paper_name,paper_url,Title,Author,Journal,Loading,PMID,Doi,download_status
attention task_00001,https://pubmed.ncbi.nlm.nih.gov/18577390/,Cortical recruitment during selective attention in multiple sclerosis: an fMRI investigation of individual differences.,"Prakash RS, Erickson KI, Snook EM, Colcombe SJ, Motl RW, Kramer AF",Neuropsychologia,0.238,18577390,10.1016/j.neuropsychologia.2008.05.027,-1
attention task_00002,https://pubmed.ncbi.nlm.nih.gov/23062751/,The effect of distracting noise on the neuronal mechanisms of attention in schizophrenia.,"Tregellas JR, Smucny J, Eichman L, Rojas DC",Schizophrenia research,0.232,23062751,10.1016/j.schres.2012.09.008,-1
attention task_00003,https://pubmed.ncbi.nlm.nih.gov/20728549/,Variations of response time in a selective attention task are linked to variations of functional connectivity in the attentional network.,"Prado J, Carp J, Weissman DH",NeuroImage,0.223,20728549,10.1016/j.neuroimage.2010.08.022,-1
attention task_00004,https://pubmed.ncbi.nlm.nih.gov/22905090/,Distinct neural activity associated with focused-attention meditation and loving-kindness meditation.,"Lee TM, Leung MK, Hou WK, Tang JC, Yin J, So KF, Lee CF, Chan CC",PloS one,0.217,22905090,10.1371/journal.pone.0040054,-1
attention task_00005,https://pubmed.ncbi.nlm.nih.gov/26514295/,Neural substrates of shared attention as social memory: A hyperscanning functional magnetic resonance imaging study.,"Koike T, Tanabe HC, Okazaki S, Nakagawa E, Sasaki AT, Shimada K, Sugawara SK, Takahashi HK, Yoshihara K, Bosch-Bayard J, Sadato N",NeuroImage,0.215,26514295,10.1016/j.neuroimage.2015.09.076,-1
attention task_00006,https://pubmed.ncbi.nlm.nih.gov/10356062/,A large-scale distributed network for covert spatial attention: further anatomical delineation based on stringent behavioural and cognitive controls.,"Gitelman DR, Nobre AC, Parrish TB, LaBar KS, Kim YH, Meyer JR, Mesulam M",Brain : a journal of neurology,0.198,10356062,10.1093/brain/122.6.1093,-1
attention task_00007,https://pubmed.ncbi.nlm.nih.gov/22841389/,Executive functions in mild cognitive impairment: emergence and breakdown of neural plasticity.,"Clement F, Gauthier S, Belleville S",Cortex; a journal devoted to the study of the nervous system and behavior,0.198,22841389,10.1016/j.cortex.2012.06.004,-1
attention task_00008,https://pubmed.ncbi.nlm.nih.gov/23645721/,Functional Connectivity and Brain Activation: A Synergistic Approach.,"Tomasi D, Wang R, Wang GJ, Volkow ND","Cerebral cortex (New York, N.Y. : 1991)",0.194,23645721,10.1093/cercor/bht119,-1
attention task_00009,https://pubmed.ncbi.nlm.nih.gov/22203319/,Methylphenidate modulates sustained attention and cortical activation in survivors of traumatic brain injury: a perfusion fMRI study.,"Kim J, Whyte J, Patel S, Europa E, Wang J, Coslett HB, Detre JA",Psychopharmacology,0.19,22203319,10.1007/s00213-011-2622-8,-1
attention task_00010,https://pubmed.ncbi.nlm.nih.gov/24108799/,Neural Conflict-Control Mechanisms Improve Memory for Target Stimuli.,"Krebs RM, Boehler CN, De Belder M, Egner T","Cerebral cortex (New York, N.Y. : 1991)",0.187,24108799,10.1093/cercor/bht283,-1
attention task_00011,https://pubmed.ncbi.nlm.nih.gov/22763170/,The interface between language and attention: prosodic focus marking recruits a general attention network in spoken language comprehension.,"Kristensen LB, Wang L, Petersson KM, Hagoort P","Cerebral cortex (New York, N.Y. : 1991)",0.185,22763170,10.1093/cercor/bhs164,-1
attention task_00012,https://pubmed.ncbi.nlm.nih.gov/21271311/,The effect of sleep deprivation on BOLD activity elicited by a divided attention  task.,"Jackson ML, Hughes ME, Croft RJ, Howard ME, Crewther D, Kennedy GA, Owens K, Pierce RJ, O'Donoghue FJ, Johnston P",Brain imaging and behavior,0.167,21271311,10.1007/s11682-011-9115-6,-1
attention task_00013,https://pubmed.ncbi.nlm.nih.gov/24642273/,Neural effects of mental fatigue caused by continuous attention load: a magnetoencephalography study.,"Tanaka M, Ishii A, Watanabe Y",Brain research,0.167,24642273,10.1016/j.brainres.2014.03.009,-1
attention task_00014,https://pubmed.ncbi.nlm.nih.gov/20851189/,Challenges to attention: a continuous arterial spin labeling (ASL) study of the effects of distraction on sustained attention.,"Demeter E, Hernandez-Garcia L, Sarter M, Lustig C",NeuroImage,0.16,20851189,10.1016/j.neuroimage.2010.09.026,-1
attention task_00015,https://pubmed.ncbi.nlm.nih.gov/22574285/,"Abnormal cortical sensorimotor activity during ""Target"" sound detection in subjects with acute acoustic trauma sequelae: an fMRI study.","Job A, Pons Y, Lamalle L, Jaillard A, Buck K, Segebarth C, Delon-Martin C",Brain and behavior,0.159,22574285,10.1002/brb3.21,-1
attention task_00016,https://pubmed.ncbi.nlm.nih.gov/17582746/,Thalamo-cortical dysfunction in cocaine abusers: implications in attention and perception.,"Tomasi D, Goldstein RZ, Telang F, Maloney T, Alia-Klein N, Caparelli EC, Volkow ND",Psychiatry research,0.156,17582746,10.1016/j.pscychresns.2007.03.002,-1
attention task_00017,https://pubmed.ncbi.nlm.nih.gov/19349237/,Hyperstimulation of striatal D2 receptors with sleep deprivation: Implications for cognitive impairment.,"Volkow ND, Tomasi D, Wang GJ, Telang F, Fowler JS, Wang RL, Logan J, Wong C, Jayne M, Swanson JM",NeuroImage,0.151,19349237,10.1016/j.neuroimage.2009.01.003,-1
attention task_00018,https://pubmed.ncbi.nlm.nih.gov/26858432/,Seasonality in human cognitive brain responses.,"Meyer C, Muto V, Jaspar M, Kusse C, Lambot E, Chellappa SL, Degueldre C, Balteau E, Luxen A, Middleton B, Archer SN, Collette F, Dijk DJ, Phillips C, Maquet P, Vandewalle G",Proceedings of the National Academy of Sciences of the United States of America,0.146,26858432,10.1073/pnas.1518129113,-1
attention task_00019,https://pubmed.ncbi.nlm.nih.gov/18752405/,Anterior intraparietal sulcus is sensitive to bottom-up attention driven by stimulus salience.,"Geng JJ, Mangun GR",Journal of cognitive neuroscience,0.137,18752405,10.1162/jocn.2009.21103,-1
attention task_00020,https://pubmed.ncbi.nlm.nih.gov/15340932/,Brain-behavior correlation in children depends on the neurocognitive network.,"Booth JR, Burman DD, Meyer JR, Trommer BL, Davenport ND, Parrish TB, Gitelman DR, Mesulam MM",Human brain mapping,0.136,15340932,10.1002/hbm.20051,-1
attention task_00021,https://pubmed.ncbi.nlm.nih.gov/16084069/,Low-dose estradiol alters brain activity.,"Stevens MC, Clark VP, Prestwood KM",Psychiatry research,0.136,16084069,10.1016/j.pscychresns.2005.04.004,-1
attention task_00022,https://pubmed.ncbi.nlm.nih.gov/12433382/,Effects of practice on executive control investigated with fMRI.,"Weissman DH, Woldorff MG, Hazlett CJ, Mangun GR",Brain research. Cognitive brain research,0.132,12433382,10.1016/s0926-6410(02)00215-x,-1
attention task_00023,https://pubmed.ncbi.nlm.nih.gov/16815338/,Separate modulations of human V1 associated with spatial attention and task structure.,"Jack AI, Shulman GL, Snyder AZ, McAvoy M, Corbetta M",Neuron,0.125,16815338,10.1016/j.neuron.2006.06.003,-1
attention task_00024,https://pubmed.ncbi.nlm.nih.gov/20599810/,A neural system for evaluating the behavioural relevance of salient events outside the current focus of attention.,"Gruber O, Diekhof EK, Kirchenbauer L, Goschke T",Brain research,0.125,20599810,10.1016/j.brainres.2010.06.056,-1
attention task_00025,https://pubmed.ncbi.nlm.nih.gov/22015111/,Fronto-striato-cerebellar dysregulation in adolescents with depression during motivated attention.,"Chantiluke K, Halari R, Simic M, Pariante CM, Papadopoulos A, Giampietro V, Rubia K",Biological psychiatry,0.125,22015111,10.1016/j.biopsych.2011.09.005,-1
attention task_00026,https://pubmed.ncbi.nlm.nih.gov/29311878/,Default Network Activity Is Associated with Better Performance in a Vigilance Task.,"Bogler C, Vowinkel A, Zhutovsky P, Haynes JD",Frontiers in human neuroscience,0.118,29311878,10.3389/fnhum.2017.00623,-1
attention task_00027,https://pubmed.ncbi.nlm.nih.gov/20171288/,Lapsing when sleep deprived: neural activation characteristics of resistant and vulnerable individuals.,"Chee MW, Tan JC",NeuroImage,0.117,20171288,10.1016/j.neuroimage.2010.02.031,-1
attention task_00028,https://pubmed.ncbi.nlm.nih.gov/18234519/,The interference of operant task performance by emotional distracters: an antagonistic relationship between the amygdala and frontoparietal cortices.,"Mitchell DG, Luo Q, Mondillo K, Vythilingam M, Finger EC, Blair RJ",NeuroImage,0.113,18234519,10.1016/j.neuroimage.2007.08.002,-1
attention task_00029,https://pubmed.ncbi.nlm.nih.gov/20445032/,"Reward, addiction, and emotion regulation systems associated with rejection in love.","Fisher HE, Brown LL, Aron A, Strong G, Mashek D",Journal of neurophysiology,0.112,20445032,10.1152/jn.00784.2009,-1
attention task_00030,https://pubmed.ncbi.nlm.nih.gov/15705612/,The functional anatomy of divided attention in amnestic mild cognitive impairment.,"Dannhauser TM, Walker Z, Stevens T, Lee L, Seal M, Shergill SS",Brain : a journal of neurology,0.111,15705612,10.1093/brain/awh413,-1
attention task_00031,https://pubmed.ncbi.nlm.nih.gov/23375117/,Effects of chewing on cognitive processing speed.,"Hirano Y, Obata T, Takahashi H, Tachibana A, Kuroiwa D, Takahashi T, Ikehira H, Onozuka M",Brain and cognition,0.11,23375117,-1,-1
attention task_00032,https://pubmed.ncbi.nlm.nih.gov/14561452/,Functional anatomy of impaired selective attention and compensatory processing in autism.,"Belmonte MK, Yurgelun-Todd DA",Brain research. Cognitive brain research,0.108,14561452,-1,-1
attention task_00033,https://pubmed.ncbi.nlm.nih.gov/26786152/,Altered balance of functional brain networks in Schizophrenia.,"Woodward TS, Leong K, Sanford N, Tipper CM, Lavigne KM",Psychiatry research. Neuroimaging,0.108,26786152,-1,-1
attention task_00034,https://pubmed.ncbi.nlm.nih.gov/14568448/,Neural development of selective attention and response inhibition.,"Booth JR, Burman DD, Meyer JR, Lei Z, Trommer BL, Davenport ND, Li W, Parrish TB, Gitelman DR, Mesulam MM",NeuroImage,0.107,14568448,-1,-1
attention task_00035,https://pubmed.ncbi.nlm.nih.gov/12873752/,A paced visual serial addition test for fMRI.,"Lazeron RH, Rombouts SA, de Sonneville L, Barkhof F, Scheltens P",Journal of the neurological sciences,0.105,12873752,-1,-1
attention task_00036,https://pubmed.ncbi.nlm.nih.gov/11322985/,Putting spatial attention on the map: timing and localization of stimulus selection processes in striate and extrastriate visual areas.,"Martinez A, Di Russo F, Anllo-Vento L, Sereno MI, Buxton RB, Hillyard SA",Vision research,0.104,11322985,-1,-1
attention task_00037,https://pubmed.ncbi.nlm.nih.gov/15381748/,Changing brain networks for visuomotor control with increased movement automaticity.,"Floyer-Lea A, Matthews PM",Journal of neurophysiology,0.104,15381748,-1,-1
attention task_00038,https://pubmed.ncbi.nlm.nih.gov/19095230/,Recovery from hemineglect: differential neurobiological effects of optokinetic stimulation and alertness training.,"Thimm M, Fink GR, Kust J, Karbe H, Willmes K, Sturm W",Cortex; a journal devoted to the study of the nervous system and behavior,0.103,19095230,-1,-1
attention task_00039,https://pubmed.ncbi.nlm.nih.gov/24473095/,Brain mechanisms underlying the effects of aging on different aspects of selective attention.,"Geerligs L, Saliasi E, Maurits NM, Renken RJ, Lorist MM",NeuroImage,0.103,24473095,-1,-1
attention task_00040,https://pubmed.ncbi.nlm.nih.gov/21738657/,Impairment of auditory-motor timing and compensatory reorganization after ventral premotor cortex stimulation.,"Kornysheva K, Schubotz RI",PloS one,0.101,21738657,-1,-1
attention task_00041,https://pubmed.ncbi.nlm.nih.gov/24146082/,Warmer outdoor temperature is associated with task-related increased BOLD activation in patients with multiple sclerosis.,"Leavitt VM, Wylie G, Chiaravalloti N, DeLuca J, Sumowski JF",Brain imaging and behavior,0.101,24146082,10.1007/s11682-013-9267-7,-1
attention task_00042,https://pubmed.ncbi.nlm.nih.gov/24315034/,Divergent task-dependent functional connectivity of executive control and salience networks.,"Elton A, Gao W",Cortex; a journal devoted to the study of the nervous system and behavior,0.099,24315034,10.1016/j.cortex.2013.10.012,-1
attention task_00043,https://pubmed.ncbi.nlm.nih.gov/24802381/,"Shared vs. specific brain activation changes in dyslexia after training of phonology, attention, or reading.","Heim S, Pape-Neumann J, van Ermingen-Marbach M, Brinkhaus M, Grande M",Brain structure & function,0.097,24802381,10.1007/s00429-014-0784-y,-1
attention task_00044,https://pubmed.ncbi.nlm.nih.gov/16043368/,Transient BOLD responses at block transitions.,"Fox MD, Snyder AZ, Barch DM, Gusnard DA, Raichle ME",NeuroImage,0.096,16043368,10.1016/j.neuroimage.2005.06.025,-1
attention task_00045,https://pubmed.ncbi.nlm.nih.gov/21295019/,Neural processing of reward magnitude under varying attentional demands.,"Stoppel CM, Boehler CN, Strumpf H, Heinze HJ, Hopf JM, Schoenfeld MA",Brain research,0.096,21295019,10.1016/j.brainres.2011.01.095,-1
attention task_00046,https://pubmed.ncbi.nlm.nih.gov/21430149/,Feature-specific attentional priority signals in human cortex.,"Liu T, Hospadaruk L, Zhu DC, Gardner JL",The Journal of neuroscience : the official journal of the Society for Neuroscience,0.096,21430149,10.1523/JNEUROSCI.5745-10.2011,-1
attention task_00047,https://pubmed.ncbi.nlm.nih.gov/17071112/,Neural mechanisms for response selection: comparing selection of responses and items from working memory.,"Hester R, D'Esposito M, Cole MW, Garavan H",NeuroImage,0.095,17071112,10.1016/j.neuroimage.2006.08.001,-1
attention task_00048,https://pubmed.ncbi.nlm.nih.gov/18562599/,Individual differences in psychotic effects of ketamine are predicted by brain function measured under placebo.,"Honey GD, Corlett PR, Absalom AR, Lee M, Pomarol-Clotet E, Murray GK, McKenna PJ, Bullmore ET, Menon DK, Fletcher PC",The Journal of neuroscience : the official journal of the Society for Neuroscience,0.095,18562599,10.1523/JNEUROSCI.0910-08.2008,-1
attention task_00049,https://pubmed.ncbi.nlm.nih.gov/25271132/,Spatial and temporal functional connectivity changes between resting and attentive states.,"Bray S, Arnold AE, Levy RM, Iaria G",Human brain mapping,0.095,25271132,10.1002/hbm.22646,-1
attention task_00050,https://pubmed.ncbi.nlm.nih.gov/23624171/,Semantic versus perceptual interactions in neural processing of speech-in-noise.,"Golestani N, Hervais-Adelman A, Obleser J, Scott SK",NeuroImage,0.093,23624171,10.1016/j.neuroimage.2013.04.049,-1
attention task_00051,https://pubmed.ncbi.nlm.nih.gov/18495886/,Lapsing during sleep deprivation is associated with distributed changes in brain  activation.,"Chee MW, Tan JC, Zheng H, Parimal S, Weissman DH, Zagorodnov V, Dinges DF",The Journal of neuroscience : the official journal of the Society for Neuroscience,0.092,18495886,10.1523/JNEUROSCI.0733-08.2008,-1
attention task_00052,https://pubmed.ncbi.nlm.nih.gov/22279213/,Causal interactions in attention networks predict behavioral performance.,"Wen X, Yao L, Liu Y, Ding M",The Journal of neuroscience : the official journal of the Society for Neuroscience,0.091,22279213,10.1523/JNEUROSCI.2817-11.2012,-1
attention task_00053,https://pubmed.ncbi.nlm.nih.gov/22941718/,Spatial stimulus configuration and attentional selection: extrastriate and superior parietal interactions.,"Gillebert CR, Caspari N, Wagemans J, Peeters R, Dupont P, Vandenberghe R","Cerebral cortex (New York, N.Y. : 1991)",0.091,22941718,10.1093/cercor/bhs263,-1
attention task_00054,https://pubmed.ncbi.nlm.nih.gov/16860474/,Thalamocortical circuits: fMRI assessment of the pulvinar and medial dorsal nucleus in normal volunteers.,"Buchsbaum MS, Buchsbaum BR, Chokron S, Tang C, Wei TC, Byne W",Neuroscience letters,0.09,16860474,10.1016/j.neulet.2006.05.063,-1
attention task_00055,https://pubmed.ncbi.nlm.nih.gov/17204249/,The neural circuitry underlying the executive control of auditory spatial attention.,"Wu CT, Weissman DH, Roberts KC, Woldorff MG",Brain research,0.09,17204249,10.1016/j.brainres.2006.11.088,-1
attention task_00056,https://pubmed.ncbi.nlm.nih.gov/17392464/,Nicotine enhances visuospatial attention by deactivating areas of the resting brain default network.,"Hahn B, Ross TJ, Yang Y, Kim I, Huestis MA, Stein EA",The Journal of neuroscience : the official journal of the Society for Neuroscience,0.09,17392464,10.1523/JNEUROSCI.5129-06.2007,-1
attention task_00057,https://pubmed.ncbi.nlm.nih.gov/18571627/,Genetic liability for bipolar disorder is characterized by excess frontal activation in response to a working memory task.,"Drapier D, Surguladze S, Marshall N, Schulze K, Fern A, Hall MH, Walshe M, Murray RM, McDonald C",Biological psychiatry,0.09,18571627,10.1016/j.biopsych.2008.04.038,-1
attention task_00058,https://pubmed.ncbi.nlm.nih.gov/17551089/,Activity in right temporo-parietal junction is not selective for theory-of-mind.,Mitchell JP,"Cerebral cortex (New York, N.Y. : 1991)",0.089,17551089,10.1093/cercor/bhm051,-1
attention task_00059,https://pubmed.ncbi.nlm.nih.gov/18479670/,Divided versus selective attention: evidence for common processing mechanisms.,"Hahn B, Wolkenberg FA, Ross TJ, Myers CS, Heishman SJ, Stein DJ, Kurup PK, Stein EA",Brain research,0.089,18479670,10.1016/j.brainres.2008.03.058,-1
attention task_00060,https://pubmed.ncbi.nlm.nih.gov/23087635/,Parallel ICA identifies sub-components of resting state networks that covary with behavioral indices.,"Meier TB, Wildenberg JC, Liu J, Chen J, Calhoun VD, Biswal BB, Meyerand ME, Birn RM, Prabhakaran V",Frontiers in human neuroscience,0.089,23087635,10.3389/fnhum.2012.00281,-1
attention task_00061,https://pubmed.ncbi.nlm.nih.gov/15190108/,Rapid prefrontal-hippocampal habituation to novel events.,"Yamaguchi S, Hale LA, D'Esposito M, Knight RT",The Journal of neuroscience : the official journal of the Society for Neuroscience,0.088,15190108,10.1523/JNEUROSCI.4587-03.2004,-1
attention task_00062,https://pubmed.ncbi.nlm.nih.gov/20736069/,Spatial attention influences trial-by-trial relationships between response time and functional connectivity in the visual cortex.,"Prado J, Weissman DH",NeuroImage,0.087,20736069,-1,-1
attention task_00063,https://pubmed.ncbi.nlm.nih.gov/16427324/,Continuous ASL perfusion fMRI investigation of higher cognition: quantification of tonic CBF changes during sustained attention and working memory tasks.,"Kim J, Whyte J, Wang J, Rao H, Tang KZ, Detre JA",NeuroImage,0.086,16427324,-1,-1
attention task_00064,https://pubmed.ncbi.nlm.nih.gov/23747456/,Time-on-task and sleep deprivation effects are evidenced in overlapping brain areas.,"Asplund CL, Chee MW",NeuroImage,0.086,23747456,-1,-1
attention task_00065,https://pubmed.ncbi.nlm.nih.gov/18483003/,Impairment of attentional networks after 1 night of sleep deprivation.,"Tomasi D, Wang RL, Telang F, Boronikolas V, Jayne MC, Wang GJ, Fowler JS, Volkow ND","Cerebral cortex (New York, N.Y. : 1991)",0.083,18483003,-1,-1
attention task_00066,https://pubmed.ncbi.nlm.nih.gov/24682003/,The impact of stimulus valence and emotion regulation on sustained brain activation: task-rest switching in emotion.,"Lamke JP, Daniels JK, Dorfel D, Gaebler M, Abdel Rahman R, Hummel F, Erk S, Walter H",PloS one,0.083,24682003,-1,-1
attention task_00067,https://pubmed.ncbi.nlm.nih.gov/27837919/,Behavioral and Neural Sustained Attention Deficits in Bipolar Disorder and Familial Risk of Bipolar Disorder.,"Pagliaccio D, Wiggins JL, Adleman NE, Harkins E, Curhan A, Towbin KE, Brotman MA, Pine DS, Leibenluft E",Biological psychiatry,0.083,27837919,-1,-1
attention task_00068,https://pubmed.ncbi.nlm.nih.gov/23307487/,Predicting effective connectivity from resting-state networks in healthy elderly  and patients with prodromal Alzheimer's disease.,"Neufang S, Akhrif A, Riedl V, Forstl H, Kurz A, Zimmer C, Sorg C, Wohlschlager AM",Human brain mapping,0.081,23307487,-1,-1
attention task_00069,https://pubmed.ncbi.nlm.nih.gov/15494184/,Cognitive modulation of pain-related brain responses depends on behavioral strategy.,"Seminowicz DA, Mikulis DJ, Davis KD",Pain,0.08,15494184,-1,-1
attention task_00070,https://pubmed.ncbi.nlm.nih.gov/28775685/,Effect of Continuous Touch on Brain Functional Connectivity Is Modified by the Operator's Tactile Attention.,"Cerritelli F, Chiacchiaretta P, Gambi F, Ferretti A",Frontiers in human neuroscience,0.079,28775685,10.3389/fnhum.2017.00368,-1
attention task_00071,https://pubmed.ncbi.nlm.nih.gov/17315224/,Management of attentional resources in within-modal and cross-modal divided attention tasks: an fMRI study.,"Vohn R, Fimm B, Weber J, Schnitker R, Thron A, Spijkers W, Willmes K, Sturm W",Human brain mapping,0.078,17315224,10.1002/hbm.20350,-1
attention task_00072,https://pubmed.ncbi.nlm.nih.gov/20140099/,Sleep deprivation impairs object-selective attention: a view from the ventral visual cortex.,"Lim J, Tan JC, Parimal S, Dinges DF, Chee MW",PloS one,0.077,20140099,10.1371/journal.pone.0009087,-1
attention task_00073,https://pubmed.ncbi.nlm.nih.gov/16521034/,Long-term effects of frequent cannabis use on working memory and attention: an fMRI study.,"Jager G, Kahn RS, Van Den Brink W, Van Ree JM, Ramsey NF",Psychopharmacology,0.076,16521034,10.1007/s00213-005-0298-7,-1
attention task_00074,https://pubmed.ncbi.nlm.nih.gov/23575842/,Top-down regulation of default mode activity in spatial visual attention.,"Wen X, Liu Y, Yao L, Ding M",The Journal of neuroscience : the official journal of the Society for Neuroscience,0.075,23575842,10.1523/JNEUROSCI.4939-12.2013,-1
attention task_00075,https://pubmed.ncbi.nlm.nih.gov/17897405/,"Gaze pursuit, 'attention pursuit' and their effects on cortical activations.","Ohlendorf S, Kimmig H, Glauche V, Haller S",The European journal of neuroscience,0.074,17897405,10.1111/j.1460-9568.2007.05824.x,-1
attention task_00076,https://pubmed.ncbi.nlm.nih.gov/20699229/,Working memory load modulates distractor competition in primary visual cortex.,"Kelley TA, Lavie N","Cerebral cortex (New York, N.Y. : 1991)",0.074,20699229,10.1093/cercor/bhq139,-1
attention task_00077,https://pubmed.ncbi.nlm.nih.gov/21300162/,Developmental effects of reward on sustained attention networks.,"Smith AB, Halari R, Giampetro V, Brammer M, Rubia K",NeuroImage,0.074,21300162,10.1016/j.neuroimage.2011.01.072,-1
attention task_00078,https://pubmed.ncbi.nlm.nih.gov/22445785/,Heightened activity in a key region of the ventral attention network is linked to reduced activity in a key region of the dorsal attention network during unexpected shifts of covert visual spatial att,"Weissman DH, Prado J",NeuroImage,0.074,22445785,10.1016/j.neuroimage.2012.03.032,-1
attention task_00079,https://pubmed.ncbi.nlm.nih.gov/22570705/,Resting-state functional connectivity between fronto-parietal and default mode networks in obsessive-compulsive disorder.,"Stern ER, Fitzgerald KD, Welsh RC, Abelson JL, Taylor SF",PloS one,0.073,22570705,10.1371/journal.pone.0036356,-1
attention task_00080,https://pubmed.ncbi.nlm.nih.gov/23986678/,Atypical modulation of distant functional connectivity by cognitive state in children with Autism Spectrum Disorders.,"You X, Norr M, Murphy E, Kuschner ES, Bal E, Gaillard WD, Kenworthy L, Vaidya CJ",Frontiers in human neuroscience,0.073,23986678,10.3389/fnhum.2013.00482,-1
attention task_00081,https://pubmed.ncbi.nlm.nih.gov/24335219/,Reorganization of hippocampal functional connectivity with transition to chronic  back pain.,"Mutso AA, Petre B, Huang L, Baliki MN, Torbey S, Herrmann KM, Schnitzer TJ, Apkarian AV",Journal of neurophysiology,0.073,24335219,10.1152/jn.00611.2013,-1
attention task_00082,https://pubmed.ncbi.nlm.nih.gov/15817513/,Functional MRI study of diencephalic amnesia in Wernicke-Korsakoff syndrome.,"Caulo M, Van Hecke J, Toma L, Ferretti A, Tartaro A, Colosimo C, Romani GL, Uncini A",Brain : a journal of neurology,0.072,15817513,10.1093/brain/awh496,-1
attention task_00083,https://pubmed.ncbi.nlm.nih.gov/18471837/,Top-down and bottom-up attention to memory: a hypothesis (AtoM) on the role of the posterior parietal cortex in memory retrieval.,"Ciaramelli E, Grady CL, Moscovitch M",Neuropsychologia,0.071,18471837,10.1016/j.neuropsychologia.2008.03.022,-1
attention task_00084,https://pubmed.ncbi.nlm.nih.gov/26741799/,Intensive Working Memory Training Produces Functional Changes in Large-scale Frontoparietal Networks.,"Thompson TW, Waskom ML, Gabrieli JD",Journal of cognitive neuroscience,0.069,26741799,10.1162/jocn_a_00916,-1
attention task_00085,https://pubmed.ncbi.nlm.nih.gov/26318935/,"Reaction time-related activity reflecting periodic, task-specific cognitive control.","Barber AD, Pekar JJ, Mostofsky SH",Behavioural brain research,0.067,26318935,10.1016/j.bbr.2015.08.020,-1
attention task_00086,https://pubmed.ncbi.nlm.nih.gov/27832090/,Neurofunctional Abnormalities during Sustained Attention in Severe Childhood Abuse.,"Lim L, Hart H, Mehta MA, Simmons A, Mirza K, Rubia K",PloS one,0.067,27832090,10.1371/journal.pone.0165547,-1
attention task_00087,https://pubmed.ncbi.nlm.nih.gov/28698387/,Cortical and Subcortical Coordination of Visual Spatial Attention Revealed by Simultaneous EEG-fMRI Recording.,"Green JJ, Boehler CN, Roberts KC, Chen LC, Krebs RM, Song AW, Woldorff MG",The Journal of neuroscience : the official journal of the Society for Neuroscience,0.067,28698387,10.1523/JNEUROSCI.0326-17.2017,-1
attention task_00088,https://pubmed.ncbi.nlm.nih.gov/20932921/,Neurobiological substrate of smoking-related attentional bias.,"Luijten M, Veltman DJ, van den Brink W, Hester R, Field M, Smits M, Franken IH",NeuroImage,0.065,20932921,10.1016/j.neuroimage.2010.09.064,-1
