paper_name,paper_url,Title,Author,Journal,Loading,PMID,Doi,download_status
attention task_00089,https://pubmed.ncbi.nlm.nih.gov/17996463/,Attentional and linguistic interactions in speech perception.,"Sabri M, Binder JR, Desai R, Medler DA, Leitl MD, Liebenthal E",NeuroImage,0.062,17996463,10.1016/j.neuroimage.2007.09.052,-1
attention task_00090,https://pubmed.ncbi.nlm.nih.gov/28529874/,Shared and disorder-specific task-positive and default mode network dysfunctions  during sustained attention in paediatric Attention-Deficit/Hyperactivity Disorder and obsessive/compulsive disorder.,"Norman LJ, Carlisi CO, Christakou A, Cubillo A, Murphy CM, Chantiluke K, Simmons A, Giampietro V, Brammer M, Mataix-Cols D, Rubia K",NeuroImage. Clinical,0.059,28529874,10.1016/j.nicl.2017.04.013,-1
attention task_00091,https://pubmed.ncbi.nlm.nih.gov/23060772/,"Hard to ""tune in"": neural mechanisms of live face-to-face interaction with high-functioning autistic spectrum disorder.","Tanabe HC, Kosaka H, Saito DN, Koike T, Hayashi MJ, Izuma K, Komeda H, Ishitobi M, Omori M, Munesue T, Okazawa H, Wada Y, Sadato N",Frontiers in human neuroscience,0.058,23060772,-1,-1
attention task_00092,https://pubmed.ncbi.nlm.nih.gov/29263238/,Attention Shifts Recruit the Monkey Default Mode Network.,"Arsenault JT, Caspari N, Vandenberghe R, Vanduffel W",The Journal of neuroscience : the official journal of the Society for Neuroscience,0.052,29263238,-1,-1
attention task_00093,https://pubmed.ncbi.nlm.nih.gov/24163364/,A positron emission tomography study of nigro-striatal dopaminergic mechanisms underlying attention: implications for ADHD and its treatment.,"del Campo N, Fryer TD, Hong YT, Smith R, Brichard L, Acosta-Cabronero J, Chamberlain SR, Tait R, Izquierdo D, Regenthal R, Dowson J, Suckling J, Baron JC, Aigbirhio FI, Robbins TW, Sahakian BJ, Muller U",Brain : a journal of neurology,0.046,24163364,-1,-1
