paper_name,paper_url,Title,Author,Journal,Loading,PMID,Doi,download_status
autism spectrum_00164,https://pubmed.ncbi.nlm.nih.gov/20008375/,Atypical neural self-representation in autism.,"Lombardo MV, Chakrabarti B, Bullmore ET, Sadek SA, Pasco G, Wheelwright SJ, Suckling J, Baron-Cohen S",Brain : a journal of neurology,0.053,20008375,10.1093/brain/awp306,-1
autism spectrum_00165,https://pubmed.ncbi.nlm.nih.gov/23060772/,"Hard to ""tune in"": neural mechanisms of live face-to-face interaction with high-functioning autistic spectrum disorder.","Tanabe HC, Kosaka H, Saito DN, Koike T, Hayashi MJ, Izuma K, Komeda H, Ishitobi M, Omori M, Munesue T, Okazawa H, Wada Y, Sadato N",Frontiers in human neuroscience,0.053,23060772,10.3389/fnhum.2012.00268,-1
autism spectrum_00166,https://pubmed.ncbi.nlm.nih.gov/27375419/,Resting State Functional Connectivity MRI among Spectral MEG Current Sources in Children on the Autism Spectrum.,"Datko M, Gougelet R, Huang MX, Pineda JA",Frontiers in neuroscience,0.053,27375419,10.3389/fnins.2016.00258,-1
autism spectrum_00167,https://pubmed.ncbi.nlm.nih.gov/27601973/,Noise Reduction in Arterial Spin Labeling Based Functional Connectivity Using Nuisance Variables.,"Jann K, Smith RX, Rios Piedra EA, Dapretto M, Wang DJ",Frontiers in neuroscience,0.051,27601973,10.3389/fnins.2016.00371,-1
autism spectrum_00168,https://pubmed.ncbi.nlm.nih.gov/23223206/,Common and distinct neural features of social and non-social reward processing in autism and social anxiety disorder.,"Richey JA, Rittenberg A, Hughes L, Damiano CR, Sabatino A, Miller S, Hanna E, Bodfish JW, Dichter GS",Social cognitive and affective neuroscience,0.05,23223206,10.1093/scan/nss146,-1
autism spectrum_00169,https://pubmed.ncbi.nlm.nih.gov/28867997/,"Autism Spectrum Disorder Related Functional Connectivity Changes in the Language  Network in Children, Adolescents and Adults.","Lee Y, Park BY, James O, Kim SG, Park H",Frontiers in human neuroscience,0.047,28867997,10.3389/fnhum.2017.00418,-1
autism spectrum_00170,https://pubmed.ncbi.nlm.nih.gov/18550622/,"Response monitoring, repetitive behaviour and anterior cingulate abnormalities in autism spectrum disorders (ASD).","Thakkar KN, Polli FE, Joseph RM, Tuch DS, Hadjikhani N, Barton JJ, Manoach DS",Brain : a journal of neurology,0.046,18550622,10.1093/brain/awn099,-1
