paper_name,paper_url,Title,Author,Journal,Loading,PMID,Doi,download_status
behavioral_01131,https://pubmed.ncbi.nlm.nih.gov/23097235/,Affective scenes influence fear perception of individual body expressions.,"Van den Stock J, Vandenbulcke M, Sinke CB, de Gelder B",Human brain mapping,0.05,23097235,-1,-1
behavioral_01132,https://pubmed.ncbi.nlm.nih.gov/23155450/,Effect of intentional bias on agency attribution of animated motion: an event-related fMRI study.,"Osaka N, Ikeda T, Osaka M",PloS one,0.05,23155450,-1,-1
behavioral_01133,https://pubmed.ncbi.nlm.nih.gov/23285070/,Effects of L-dopa during auditory instrumental learning in humans.,"Weis T, Puschmann S, Brechmann A, Thiel CM",PloS one,0.05,23285070,-1,-1
behavioral_01134,https://pubmed.ncbi.nlm.nih.gov/23314012/,Neural reactivation links unconscious thought to decision-making performance.,"Creswell JD, Bursley JK, Satpute AB",Social cognitive and affective neuroscience,0.05,23314012,-1,-1
behavioral_01135,https://pubmed.ncbi.nlm.nih.gov/23716712/,Ongoing neural development of affective theory of mind in adolescence.,"Vetter NC, Weigelt S, Dohnel K, Smolka MN, Kliegel M",Social cognitive and affective neuroscience,0.05,23716712,-1,-1
behavioral_01136,https://pubmed.ncbi.nlm.nih.gov/23717274/,The neural bases of the multiplication problem-size effect across countries.,"Prado J, Lu J, Liu L, Dong Q, Zhou X, Booth JR",Frontiers in human neuroscience,0.05,23717274,-1,-1
behavioral_01137,https://pubmed.ncbi.nlm.nih.gov/23978652/,Selective Attention to Temporal Features on Nested Time Scales.,"Henry MJ, Herrmann B, Obleser J","Cerebral cortex (New York, N.Y. : 1991)",0.05,23978652,-1,-1
behavioral_01138,https://pubmed.ncbi.nlm.nih.gov/24060844/,"Humor processing in children: influence of temperament, age and IQ.","Vrticka P, Black JM, Neely M, Walter Shelly E, Reiss AL",Neuropsychologia,0.05,24060844,-1,-1
behavioral_01139,https://pubmed.ncbi.nlm.nih.gov/24486655/,Development of temperamental effortful control mediates the relationship between  maturation of the prefrontal cortex and psychopathology during adolescence: a 4-year longitudinal study.,"Vijayakumar N, Whittle S, Dennison M, Yucel M, Simmons J, Allen NB",Developmental cognitive neuroscience,0.05,24486655,-1,-1
behavioral_01140,https://pubmed.ncbi.nlm.nih.gov/24632466/,Delineating the cortico-striatal-cerebellar network in implicit motor sequence learning.,"Tzvi E, Munte TF, Kramer UM",NeuroImage,0.05,24632466,-1,-1
behavioral_01141,https://pubmed.ncbi.nlm.nih.gov/24760279/,Brain activation of the defensive and appetitive survival systems in obsessive compulsive disorder.,"Goncalves OF, Soares JM, Carvalho S, Leite J, Ganho A, Fernandes-Goncalves A, Frank B, Pocinho F, Relvas J, Carracedo A, Sampaio A",Brain imaging and behavior,0.05,24760279,10.1007/s11682-014-9303-2,-1
behavioral_01142,https://pubmed.ncbi.nlm.nih.gov/24828546/,Memory's aging echo: Age-related decline in neural reactivation of perceptual details during recollection.,"McDonough IM, Cervantes SN, Gray SJ, Gallo DA",NeuroImage,0.05,24828546,10.1016/j.neuroimage.2014.05.012,-1
behavioral_01143,https://pubmed.ncbi.nlm.nih.gov/25062837/,A longitudinal analysis of neural regions involved in reading the mind in the eyes.,"Overgaauw S, van Duijvenvoorde AC, Gunther Moor B, Crone EA",Social cognitive and affective neuroscience,0.05,25062837,10.1093/scan/nsu095,-1
behavioral_01144,https://pubmed.ncbi.nlm.nih.gov/25171782/,Cognitive-behavioral therapy for generalized anxiety disorder is associated with  attenuation of limbic activation to threat-related facial emotions.,"Fonzo GA, Ramsawh HJ, Flagan TM, Sullivan SG, Simmons AN, Paulus MP, Stein MB",Journal of affective disorders,0.05,25171782,-1,-1
behavioral_01145,https://pubmed.ncbi.nlm.nih.gov/25411490/,Learning to minimize efforts versus maximizing rewards: computational principles  and neural correlates.,"Skvortsova V, Palminteri S, Pessiglione M",The Journal of neuroscience : the official journal of the Society for Neuroscience,0.05,25411490,-1,-1
behavioral_01146,https://pubmed.ncbi.nlm.nih.gov/25573670/,Arbitration between controlled and impulsive choices.,"Economides M, Guitart-Masip M, Kurth-Nelson Z, Dolan RJ",NeuroImage,0.05,25573670,-1,-1
behavioral_01147,https://pubmed.ncbi.nlm.nih.gov/25957484/,Neurobiology of insight deficits in schizophrenia: An fMRI study.,"Shad MU, Keshavan MS",Schizophrenia research,0.05,25957484,-1,-1
behavioral_01148,https://pubmed.ncbi.nlm.nih.gov/26083379/,Neural Networks for Mindfulness and Emotion Suppression.,"Murakami H, Katsunuma R, Oba K, Terasawa Y, Motomura Y, Mishima K, Moriguchi Y",PloS one,0.05,26083379,-1,-1
behavioral_01149,https://pubmed.ncbi.nlm.nih.gov/26210693/,Facilitation of emotion regulation with a single dose of escitalopram: A randomized fMRI study.,"Outhred T, Das P, Felmingham KL, Bryant RA, Nathan PJ, Malhi GS, Kemp AH",Psychiatry research,0.05,26210693,-1,-1
behavioral_01150,https://pubmed.ncbi.nlm.nih.gov/26441576/,Effects of social sustainability signaling on neural valuation signals and taste-experience of food products.,"Enax L, Krapp V, Piehl A, Weber B",Frontiers in behavioral neuroscience,0.05,26441576,-1,-1
behavioral_01151,https://pubmed.ncbi.nlm.nih.gov/26441600/,An engineered glove for investigating the neural correlates of finger movements using functional magnetic resonance imaging.,"Bonzano L, Tacchino A, Roccatagliata L, Inglese M, Mancardi GL, Novellino A, Bove M",Frontiers in human neuroscience,0.05,26441600,-1,-1
behavioral_01152,https://pubmed.ncbi.nlm.nih.gov/26500526/,Neural bases of accented speech perception.,"Adank P, Nuttall HE, Banks B, Kennedy-Higgins D",Frontiers in human neuroscience,0.05,26500526,-1,-1
behavioral_01153,https://pubmed.ncbi.nlm.nih.gov/26740404/,Bimodal bilingualism as multisensory training?: Evidence for improved audiovisual speech perception after sign language exposure.,"Williams JT, Darcy I, Newman SD",Brain research,0.05,26740404,-1,-1
behavioral_01154,https://pubmed.ncbi.nlm.nih.gov/27026657/,Working memory filtering continues to develop into late adolescence.,"Peverill M, McLaughlin KA, Finn AS, Sheridan MA",Developmental cognitive neuroscience,0.05,27026657,-1,-1
behavioral_01155,https://pubmed.ncbi.nlm.nih.gov/27157883/,The role of prosody and context in sarcasm comprehension: Behavioral and fMRI evidence.,"Matsui T, Nakamura T, Utsumi A, Sasaki AT, Koike T, Yoshida Y, Harada T, Tanabe HC, Sadato N",Neuropsychologia,0.05,27157883,-1,-1
behavioral_01156,https://pubmed.ncbi.nlm.nih.gov/27315265/,Sampling over Nonuniform Distributions: A Neural Efficiency Account of the Primacy Effect in Statistical Learning.,"Karuza EA, Li P, Weiss DJ, Bulgarelli F, Zinszer BD, Aslin RN",Journal of cognitive neuroscience,0.05,27315265,-1,-1
behavioral_01157,https://pubmed.ncbi.nlm.nih.gov/27618765/,Reconfiguration of parietal circuits with cognitive tutoring in elementary school children.,"Jolles D, Supekar K, Richardson J, Tenison C, Ashkenazi S, Rosenberg-Lee M, Fuchs L, Menon V",Cortex; a journal devoted to the study of the nervous system and behavior,0.05,27618765,-1,-1
behavioral_01158,https://pubmed.ncbi.nlm.nih.gov/28219776/,Deactivation in the posterior mid-cingulate cortex reflects perceptual transitions during binocular rivalry: Evidence from simultaneous EEG-fMRI.,"Roy AV, Jamison KW, He S, Engel SA, He B",NeuroImage,0.05,28219776,-1,-1
behavioral_01159,https://pubmed.ncbi.nlm.nih.gov/28716966/,Hierarchically Organized Medial Frontal Cortex-Basal Ganglia Loops Selectively Control Task- and Response-Selection.,"Korb FM, Jiang J, King JA, Egner T",The Journal of neuroscience : the official journal of the Society for Neuroscience,0.05,28716966,-1,-1
behavioral_01160,https://pubmed.ncbi.nlm.nih.gov/29440534/,Individual Differences in Reading Skill Are Related to Trial-by-Trial Neural Activation Variability in the Reading Network.,"Malins JG, Pugh KR, Buis B, Frost SJ, Hoeft F, Landi N, Mencl WE, Kurian A, Staples R, Molfese PJ, Sevcik R, Morris R",The Journal of neuroscience : the official journal of the Society for Neuroscience,0.05,29440534,-1,-1
behavioral_01161,https://pubmed.ncbi.nlm.nih.gov/14561459/,Functional neuroanatomy of interference in overlapping dual tasks: an fMRI study.,"Schubert T, Szameitat AJ",Brain research. Cognitive brain research,0.049,14561459,10.1016/s0926-6410(03)00198-8,-1
behavioral_01162,https://pubmed.ncbi.nlm.nih.gov/15381748/,Changing brain networks for visuomotor control with increased movement automaticity.,"Floyer-Lea A, Matthews PM",Journal of neurophysiology,0.049,15381748,-1,-1
behavioral_01163,https://pubmed.ncbi.nlm.nih.gov/15476691/,Experience-dependent plasticity for attention to threat: Behavioral and neurophysiological evidence in humans.,"Monk CS, Nelson EE, Woldehawariat G, Montgomery LA, Zarahn E, McClure EB, Guyer AE, Leibenluft E, Charney DS, Ernst M, Pine DS",Biological psychiatry,0.049,15476691,-1,-1
behavioral_01164,https://pubmed.ncbi.nlm.nih.gov/15850750/,Sex differences in the neural correlates of child facial resemblance: an event-related fMRI study.,"Platek SM, Keenan JP, Mohamed FB",NeuroImage,0.049,15850750,-1,-1
behavioral_01165,https://pubmed.ncbi.nlm.nih.gov/15982787/,Age differences in the neural systems supporting human allocentric spatial navigation.,"Moffat SD, Elkins W, Resnick SM",Neurobiology of aging,0.049,15982787,-1,-1
behavioral_01166,https://pubmed.ncbi.nlm.nih.gov/16256375/,Tracking the subprocesses of decision-based action in the human frontal lobes.,"Rahm B, Opwis K, Kaller CP, Spreer J, Schwarzwald R, Seifritz E, Halsband U, Unterrainer JM",NeuroImage,0.049,16256375,-1,-1
behavioral_01167,https://pubmed.ncbi.nlm.nih.gov/16718653/,Analysis of intersubject variability in activation: an application to the incidental episodic retrieval during recognition test.,"Sugiura M, Friston KJ, Willmes K, Shah NJ, Zilles K, Fink GR",Human brain mapping,0.049,16718653,-1,-1
behavioral_01168,https://pubmed.ncbi.nlm.nih.gov/16738254/,The role of multiple contralesional motor areas for complex hand movements after  internal capsular lesion.,"Lotze M, Markert J, Sauseng P, Hoppe J, Plewnia C, Gerloff C",The Journal of neuroscience : the official journal of the Society for Neuroscience,0.049,16738254,-1,-1
behavioral_01169,https://pubmed.ncbi.nlm.nih.gov/16798017/,Functional significance of age-related differences in motor activation patterns.,"Riecker A, Groschel K, Ackermann H, Steinbrink C, Witte O, Kastrup A",NeuroImage,0.049,16798017,-1,-1
behavioral_01170,https://pubmed.ncbi.nlm.nih.gov/16839780/,Influence of the stress hormone cortisol on fear conditioning in humans: evidence for sex differences in the response of the prefrontal cortex.,"Stark R, Wolf OT, Tabbert K, Kagerer S, Zimmermann M, Kirsch P, Schienle A, Vaitl D",NeuroImage,0.049,16839780,-1,-1
behavioral_01171,https://pubmed.ncbi.nlm.nih.gov/17123070/,Cortical activation to indoor versus outdoor scenes: an fMRI study.,"Henderson JM, Larson CL, Zhu DC",Experimental brain research,0.049,17123070,-1,-1
behavioral_01172,https://pubmed.ncbi.nlm.nih.gov/17543896/,Influence of emotional expression on memory recognition bias: a functional magnetic resonance imaging study.,"Sergerie K, Lepage M, Armony JL",Biological psychiatry,0.049,17543896,-1,-1
behavioral_01173,https://pubmed.ncbi.nlm.nih.gov/17894934/,Cueing method biases in visual detection studies.,"Jaffard M, Benraiss A, Longcamp M, Velay JL, Boulinguez P",Brain research,0.049,17894934,-1,-1
behavioral_01174,https://pubmed.ncbi.nlm.nih.gov/18056085/,Familiarity and conceptual priming engage distinct cortical networks.,"Voss JL, Reber PJ, Mesulam MM, Parrish TB, Paller KA","Cerebral cortex (New York, N.Y. : 1991)",0.049,18056085,-1,-1
behavioral_01175,https://pubmed.ncbi.nlm.nih.gov/18353285/,A decrease in brain activation associated with driving when listening to someone  speak.,"Just MA, Keller TA, Cynkar J",Brain research,0.049,18353285,-1,-1
behavioral_01176,https://pubmed.ncbi.nlm.nih.gov/19162206/,Exploratory structural equation modeling of resting-state fMRI: applicability of  group models to individual subjects.,"James GA, Kelley ME, Craddock RC, Holtzheimer PE, Dunlop BW, Nemeroff CB, Mayberg HS, Hu XP",NeuroImage,0.049,19162206,-1,-1
behavioral_01177,https://pubmed.ncbi.nlm.nih.gov/19546156/,Altered water diffusivity in cortical association tracts in children with early deprivation identified with Tract-Based Spatial Statistics (TBSS).,"Govindan RM, Behen ME, Helder E, Makki MI, Chugani HT","Cerebral cortex (New York, N.Y. : 1991)",0.049,19546156,-1,-1
behavioral_01178,https://pubmed.ncbi.nlm.nih.gov/19554558/,Auditory orienting and inhibition of return in mild traumatic brain injury: a FMRI study.,"Mayer AR, Mannell MV, Ling J, Elgie R, Gasparovic C, Phillips JP, Doezema D, Yeo RA",Human brain mapping,0.049,19554558,-1,-1
behavioral_01179,https://pubmed.ncbi.nlm.nih.gov/20016103/,Preparation to inhibit a response complements response inhibition during performance of a stop-signal task.,"Chikazoe J, Jimura K, Hirose S, Yamashita K, Miyashita Y, Konishi S",The Journal of neuroscience : the official journal of the Society for Neuroscience,0.049,20016103,-1,-1
behavioral_01180,https://pubmed.ncbi.nlm.nih.gov/20146606/,Combining functional neuroimaging with off-line brain stimulation: modulation of  task-related activity in language areas.,"Andoh J, Paus T",Journal of cognitive neuroscience,0.049,20146606,-1,-1
behavioral_01181,https://pubmed.ncbi.nlm.nih.gov/20226767/,Brain activation evidence for response conflict in the exclude recognition task.,"Schumacher EH, Seymour TL, Schwarb H",Brain research,0.049,20226767,10.1016/j.brainres.2010.03.015,-1
behavioral_01182,https://pubmed.ncbi.nlm.nih.gov/20584747/,Forgetting of emotional information is hard: an fMRI study of directed forgetting.,"Nowicka A, Marchewka A, Jednorog K, Tacikowski P, Brechmann A","Cerebral cortex (New York, N.Y. : 1991)",0.049,20584747,-1,-1
behavioral_01183,https://pubmed.ncbi.nlm.nih.gov/21397701/,Probing the cortical network underlying the psychological refractory period: a combined EEG-fMRI study.,"Hesselmann G, Flandin G, Dehaene S",NeuroImage,0.049,21397701,-1,-1
behavioral_01184,https://pubmed.ncbi.nlm.nih.gov/21520351/,Resting state basal ganglia network in idiopathic generalized epilepsy.,"Luo C, Li Q, Xia Y, Lei X, Xue K, Yao Z, Lai Y, Martinez-Montes E, Liao W, Zhou D, Valdes-Sosa PA, Gong Q, Yao D",Human brain mapping,0.049,21520351,-1,-1
behavioral_01185,https://pubmed.ncbi.nlm.nih.gov/21680848/,The involvement of the dopaminergic midbrain and cortico-striatal-thalamic circuits in the integration of reward prospect and attentional task demands.,"Krebs RM, Boehler CN, Roberts KC, Song AW, Woldorff MG","Cerebral cortex (New York, N.Y. : 1991)",0.049,21680848,-1,-1
behavioral_01186,https://pubmed.ncbi.nlm.nih.gov/21697388/,A stable sparse fear memory trace in human amygdala.,"Bach DR, Weiskopf N, Dolan RJ",The Journal of neuroscience : the official journal of the Society for Neuroscience,0.049,21697388,-1,-1
behavioral_01187,https://pubmed.ncbi.nlm.nih.gov/21817091/,Striatum-medial prefrontal cortex connectivity predicts developmental changes in  reinforcement learning.,"van den Bos W, Cohen MX, Kahnt T, Crone EA","Cerebral cortex (New York, N.Y. : 1991)",0.049,21817091,-1,-1
behavioral_01188,https://pubmed.ncbi.nlm.nih.gov/22573195/,Picture-naming in patients with left frontal lobe tumor - a functional neuroimaging study.,"Chakraborty A, Sumathi TA, Mehta VS, Singh NC",Brain imaging and behavior,0.049,22573195,-1,-1
behavioral_01189,https://pubmed.ncbi.nlm.nih.gov/22704853/,An fMRI study on the acute effects of exercise on pain processing in trained athletes.,"Scheef L, Jankowski J, Daamen M, Weyer G, Klingenberg M, Renner J, Mueckter S, Schurmann B, Musshoff F, Wagner M, Schild HH, Zimmer A, Boecker H",Pain,0.049,22704853,-1,-1
behavioral_01190,https://pubmed.ncbi.nlm.nih.gov/22921454/,Effect of cognitive-behavioral therapy on neural correlates of fear conditioning  in panic disorder.,"Kircher T, Arolt V, Jansen A, Pyka M, Reinhardt I, Kellermann T, Konrad C, Lueken U, Gloster AT, Gerlach AL, Strohle A, Wittmann A, Pfleiderer B, Wittchen HU, Straube B",Biological psychiatry,0.049,22921454,-1,-1
behavioral_01191,https://pubmed.ncbi.nlm.nih.gov/22952631/,"Sex, lies and fMRI--gender differences in neural basis of deception.","Marchewka A, Jednorog K, Falkiewicz M, Szeszkowski W, Grabowska A, Szatkowska I",PloS one,0.049,22952631,-1,-1
behavioral_01192,https://pubmed.ncbi.nlm.nih.gov/23008180/,Losing the struggle to stay awake: divergent thalamic and cortical activity during microsleeps.,"Poudel GR, Innes CR, Bones PJ, Watts R, Jones RD",Human brain mapping,0.049,23008180,-1,-1
behavioral_01193,https://pubmed.ncbi.nlm.nih.gov/23082194/,The human factor: behavioral and neural correlates of humanized perception in moral decision making.,"Majdandzic J, Bauer H, Windischberger C, Moser E, Engl E, Lamm C",PloS one,0.049,23082194,-1,-1
behavioral_01194,https://pubmed.ncbi.nlm.nih.gov/23664947/,Genetic and environmental contributions to brain activation during calculation.,"Pinel P, Dehaene S",NeuroImage,0.049,23664947,-1,-1
behavioral_01195,https://pubmed.ncbi.nlm.nih.gov/23681167/,Abnormal processing of deontological guilt in obsessive-compulsive disorder.,"Basile B, Mancini F, Macaluso E, Caltagirone C, Bozzali M",Brain structure & function,0.049,23681167,-1,-1
behavioral_01196,https://pubmed.ncbi.nlm.nih.gov/23805096/,Plasticity in the Visual System is Associated with Prosthesis Use in Phantom Limb Pain.,"Preissler S, Dietrich C, Blume KR, Hofmann GO, Miltner WH, Weiss T",Frontiers in human neuroscience,0.049,23805096,-1,-1
behavioral_01197,https://pubmed.ncbi.nlm.nih.gov/24097059/,Individual differences in the anterior insula are associated with the likelihood  of financially helping versus harming others.,"Greening S, Norton L, Virani K, Ty A, Mitchell D, Finger E","Cognitive, affective & behavioral neuroscience",0.049,24097059,-1,-1
behavioral_01198,https://pubmed.ncbi.nlm.nih.gov/24184440/,Selective transfer of visual working memory training on Chinese character learning.,"Opitz B, Schneiders JA, Krick CM, Mecklinger A",Neuropsychologia,0.049,24184440,-1,-1
behavioral_01199,https://pubmed.ncbi.nlm.nih.gov/24465794/,Windowed correlation: a suitable tool for providing dynamic fMRI-based functional connectivity neurofeedback on task difficulty.,"Zilverstand A, Sorger B, Zimmermann J, Kaas A, Goebel R",PloS one,0.049,24465794,-1,-1
behavioral_01200,https://pubmed.ncbi.nlm.nih.gov/24904065/,Negative Urgency Mediates the Relationship between Amygdala and Orbitofrontal Cortex Activation to Negative Emotional Stimuli and General Risk-Taking.,"Cyders MA, Dzemidzic M, Eiler WJ, Coskunpinar A, Karyadi KA, Kareken DA","Cerebral cortex (New York, N.Y. : 1991)",0.049,24904065,-1,-1
behavioral_01201,https://pubmed.ncbi.nlm.nih.gov/25115186/,Motivationally significant self-control: enhanced action withholding involves the right inferior frontal junction.,"O'Connor DA, Upton DJ, Moore J, Hester R",Journal of cognitive neuroscience,0.049,25115186,10.1162/jocn_a_00695,-1
behavioral_01202,https://pubmed.ncbi.nlm.nih.gov/25447072/,Prefrontal and parietal activity is modulated by the rule complexity of inductive reasoning and can be predicted by a cognitive model.,"Jia X, Liang P, Shi L, Wang D, Li K",Neuropsychologia,0.049,25447072,10.1016/j.neuropsychologia.2014.10.015,-1
behavioral_01203,https://pubmed.ncbi.nlm.nih.gov/25553620/,A selective involvement of putamen functional connectivity in youth with internet gaming disorder.,"Hong SB, Harrison BJ, Dandash O, Choi EJ, Kim SC, Kim HH, Shim DH, Kim CD, Kim JW, Yi SH",Brain research,0.049,25553620,-1,-1
behavioral_01204,https://pubmed.ncbi.nlm.nih.gov/25740507/,Characterizing the associative content of brain structures involved in habitual and goal-directed actions in humans: a multivariate FMRI study.,"McNamee D, Liljeholm M, Zika O, O'Doherty JP",The Journal of neuroscience : the official journal of the Society for Neuroscience,0.049,25740507,-1,-1
behavioral_01205,https://pubmed.ncbi.nlm.nih.gov/26417075/,Topology-defined units in numerosity perception.,"He L, Zhou K, Zhou T, He S, Chen L",Proceedings of the National Academy of Sciences of the United States of America,0.049,26417075,-1,-1
behavioral_01206,https://pubmed.ncbi.nlm.nih.gov/26431906/,Testing the antidepressant properties of the peptide ARA290 in a human neuropsychological model of drug action.,"Cerit H, Veer IM, Dahan A, Niesters M, Harmer CJ, Miskowiak KW, Rombouts SA, Van der Does W",European neuropsychopharmacology : the journal of the European College of Neuropsychopharmacology,0.049,26431906,-1,-1
behavioral_01207,https://pubmed.ncbi.nlm.nih.gov/26807842/,Bilateral Transcranial Direct Current Stimulation Language Treatment Enhances Functional Connectivity in the Left Hemisphere: Preliminary Data from Aphasia.,"Marangolo P, Fiori V, Sabatini U, De Pasquale G, Razzano C, Caltagirone C, Gili T",Journal of cognitive neuroscience,0.049,26807842,-1,-1
behavioral_01208,https://pubmed.ncbi.nlm.nih.gov/26912270/,The push of social pain: Does rejection's sting motivate subsequent social reconnection?,"Chester DS, DeWall CN, Pond RS Jr","Cognitive, affective & behavioral neuroscience",0.049,26912270,-1,-1
behavioral_01209,https://pubmed.ncbi.nlm.nih.gov/27622399/,Parametric modulation of reward sequences during a reversal task in ACC and VMPFC but not amygdala and striatum.,"Becker MP, Nitsch AM, Hewig J, Miltner WH, Straube T",NeuroImage,0.049,27622399,-1,-1
behavioral_01210,https://pubmed.ncbi.nlm.nih.gov/27784627/,The neural bases of proactive and reactive control processes in normal aging.,"Manard M, Francois S, Phillips C, Salmon E, Collette F",Behavioural brain research,0.049,27784627,-1,-1
behavioral_01211,https://pubmed.ncbi.nlm.nih.gov/28202336/,Functional connectivity in resting state as a phonemic fluency ability measure.,"Miro-Padilla A, Bueicheku E, Ventura-Campos N, Palomar-Garcia MA, Avila C",Neuropsychologia,0.049,28202336,-1,-1
behavioral_01212,https://pubmed.ncbi.nlm.nih.gov/28294712/,Frequency and Chunking in Derived Words: A Parametric fMRI Study.,"Blumenthal-Drame A, Glauche V, Bormann T, Weiller C, Musso M, Kortmann B",Journal of cognitive neuroscience,0.049,28294712,-1,-1
behavioral_01213,https://pubmed.ncbi.nlm.nih.gov/28491026/,Neural Efficiency of Athletes' Brain during Visuo-Spatial Task: An fMRI Study on Table Tennis Players.,"Guo Z, Li A, Yu L",Frontiers in behavioral neuroscience,0.049,28491026,-1,-1
behavioral_01214,https://pubmed.ncbi.nlm.nih.gov/28654359/,Differential Tuning of Ventral and Dorsal Streams during the Generation of Common and Uncommon Tool Uses.,"Matheson HE, Buxbaum LJ, Thompson-Schill SL",Journal of cognitive neuroscience,0.049,28654359,-1,-1
behavioral_01215,https://pubmed.ncbi.nlm.nih.gov/28923313/,Functional brain networks for learning predictive statistics.,"Giorgio J, Karlaftis VM, Wang R, Shen Y, Tino P, Welchman A, Kourtzi Z",Cortex; a journal devoted to the study of the nervous system and behavior,0.049,28923313,-1,-1
behavioral_01216,https://pubmed.ncbi.nlm.nih.gov/29163017/,Electrical Neuroimaging of Music Processing Reveals Mid-Latency Changes with Level of Musical Expertise.,"James CE, Oechslin MS, Michel CM, De Pretto M",Frontiers in neuroscience,0.049,29163017,-1,-1
behavioral_01217,https://pubmed.ncbi.nlm.nih.gov/29163079/,Neural Correlates of Rewarded Response Inhibition in Youth at Risk for Problematic Alcohol Use.,"Tervo-Clemmens B, Quach A, Luna B, Foran W, Chung T, De Bellis MD, Clark DB",Frontiers in behavioral neuroscience,0.049,29163079,-1,-1
behavioral_01218,https://pubmed.ncbi.nlm.nih.gov/10554992/,When that tune runs through your head: a PET investigation of auditory imagery for familiar melodies.,"Halpern AR, Zatorre RJ","Cerebral cortex (New York, N.Y. : 1991)",0.048,10554992,-1,-1
behavioral_01219,https://pubmed.ncbi.nlm.nih.gov/11590110/,Dissociation of verbal working memory system components using a delayed serial recall task.,"Chein JM, Fiez JA","Cerebral cortex (New York, N.Y. : 1991)",0.048,11590110,-1,-1
behavioral_01220,https://pubmed.ncbi.nlm.nih.gov/15275904/,The functional anatomy of inspection time: an event-related fMRI study.,"Deary IJ, Simonotto E, Meyer M, Marshall A, Marshall I, Goddard N, Wardlaw JM",NeuroImage,0.048,15275904,-1,-1
behavioral_01221,https://pubmed.ncbi.nlm.nih.gov/15955496/,Cognitive control and brain resources in major depression: an fMRI study using the n-back task.,"Harvey PO, Fossati P, Pochon JB, Levy R, Lebastard G, Lehericy S, Allilaire JF, Dubois B",NeuroImage,0.048,15955496,10.1016/j.neuroimage.2005.02.048,-1
behavioral_01222,https://pubmed.ncbi.nlm.nih.gov/16046148/,"Attributions on the brain: neuro-imaging dispositional inferences, beyond theory  of mind.","Harris LT, Todorov A, Fiske ST",NeuroImage,0.048,16046148,10.1016/j.neuroimage.2005.05.021,-1
behavioral_01223,https://pubmed.ncbi.nlm.nih.gov/16055351/,Emotion and attention interactions in social cognition: brain regions involved in processing anger prosody.,"Sander D, Grandjean D, Pourtois G, Schwartz S, Seghier ML, Scherer KR, Vuilleumier P",NeuroImage,0.048,16055351,-1,-1
behavioral_01224,https://pubmed.ncbi.nlm.nih.gov/16202396/,Monoamine oxidase-a genetic variations influence brain activity associated with inhibitory control: new insight into the neural correlates of impulsivity.,"Passamonti L, Fera F, Magariello A, Cerasa A, Gioia MC, Muglia M, Nicoletti G, Gallo O, Provinciali L, Quattrone A",Biological psychiatry,0.048,16202396,-1,-1
