paper_name,paper_url,Title,Author,Journal,Loading,PMID,Doi,download_status
behavioral_01689,https://pubmed.ncbi.nlm.nih.gov/19733670/,Integration of iconic gestures and speech in left superior temporal areas boosts  speech comprehension under adverse listening conditions.,"Holle H, Obleser J, Rueschemeyer SA, Gunter TC",NeuroImage,0.041,19733670,-1,-1
behavioral_01690,https://pubmed.ncbi.nlm.nih.gov/20153608/,Differential fractional anisotropy abnormalities in adolescents with ADHD or schizophrenia.,"Davenport ND, Karatekin C, White T, Lim KO",Psychiatry research,0.041,20153608,-1,-1
behavioral_01691,https://pubmed.ncbi.nlm.nih.gov/20465354/,The role of the cerebellum in sub- and supraliminal error correction during sensorimotor synchronization: evidence from fMRI and TMS.,"Bijsterbosch JD, Lee KH, Hunter MD, Tsoi DT, Lankappa S, Wilkinson ID, Barker AT, Woodruff PW",Journal of cognitive neuroscience,0.041,20465354,-1,-1
behavioral_01692,https://pubmed.ncbi.nlm.nih.gov/20603217/,Mesocorticolimbic circuits are impaired in chronic cocaine users as demonstrated  by resting-state functional connectivity.,"Gu H, Salmeron BJ, Ross TJ, Geng X, Zhan W, Stein EA, Yang Y",NeuroImage,0.041,20603217,-1,-1
behavioral_01693,https://pubmed.ncbi.nlm.nih.gov/21077147/,Altered functional adaptation to attention and working memory tasks with increasing complexity in relapsing-remitting multiple sclerosis patients.,"Amann M, Dossegger LS, Penner IK, Hirsch JG, Raselli C, Calabrese P, Weier K, Radu EW, Kappos L, Gass A",Human brain mapping,0.041,21077147,-1,-1
behavioral_01694,https://pubmed.ncbi.nlm.nih.gov/21145212/,Brain dysfunctions during facial discrimination in schizophrenia: selective association to affect decoding.,"Quintana J, Lee J, Marcus M, Kee K, Wong T, Yerevanian A",Psychiatry research,0.041,21145212,-1,-1
behavioral_01695,https://pubmed.ncbi.nlm.nih.gov/21258644/,Word wins over face: emotional Stroop effect activates the frontal cortical network.,"Ovaysikia S, Tahir KA, Chan JL, DeSouza JF",Frontiers in human neuroscience,0.041,21258644,-1,-1
behavioral_01696,https://pubmed.ncbi.nlm.nih.gov/21421062/,Functional MRI indicates consistent intra-digit topographic maps in the little but not the index finger within the human primary somatosensory cortex.,"Schweisfurth MA, Schweizer R, Frahm J",NeuroImage,0.041,21421062,-1,-1
behavioral_01697,https://pubmed.ncbi.nlm.nih.gov/21715612/,Reciprocal anatomical relationship between primary sensory and prefrontal cortices in the human brain.,"Song C, Schwarzkopf DS, Kanai R, Rees G",The Journal of neuroscience : the official journal of the Society for Neuroscience,0.041,21715612,-1,-1
behavioral_01698,https://pubmed.ncbi.nlm.nih.gov/21782157/,The effect of problem structure on problem-solving: an fMRI study of word versus  number problems.,"Newman SD, Willoughby G, Pruce B",Brain research,0.041,21782157,-1,-1
behavioral_01699,https://pubmed.ncbi.nlm.nih.gov/21823207/,"Look at me, I'll remember you: the perception of self-relevant social cues enhances memory and right hippocampal activity.","Conty L, Grezes J",Human brain mapping,0.041,21823207,-1,-1
behavioral_01700,https://pubmed.ncbi.nlm.nih.gov/21945794/,Turning on the alarm: the neural mechanisms of the transition from innocuous to painful sensation.,"Johnstone T, Salomons TV, Backonja MM, Davidson RJ",NeuroImage,0.041,21945794,-1,-1
behavioral_01701,https://pubmed.ncbi.nlm.nih.gov/22088776/,"A key role for experimental task performance: effects of math talent, gender and  performance on the neural correlates of mental rotation.","Hoppe C, Fliessbach K, Stausberg S, Stojanovic J, Trautner P, Elger CE, Weber B",Brain and cognition,0.041,22088776,-1,-1
behavioral_01702,https://pubmed.ncbi.nlm.nih.gov/22131970/,"The human likeness dimension of the ""uncanny valley hypothesis"": behavioral and functional MRI findings.","Cheetham M, Suter P, Jancke L",Frontiers in human neuroscience,0.041,22131970,-1,-1
behavioral_01703,https://pubmed.ncbi.nlm.nih.gov/22238084/,Predicting conceptual processing capacity from spontaneous neuronal activity of the left middle temporal gyrus.,"Wei T, Liang X, He Y, Zang Y, Han Z, Caramazza A, Bi Y",The Journal of neuroscience : the official journal of the Society for Neuroscience,0.041,22238084,-1,-1
behavioral_01704,https://pubmed.ncbi.nlm.nih.gov/22238630/,Abnormal activity in the precuneus during time perception in Parkinson's disease: an fMRI study.,"Dusek P, Jech R, Sieger T, Vymazal J, Ruzicka E, Wackermann J, Mueller K",PloS one,0.041,22238630,-1,-1
behavioral_01705,https://pubmed.ncbi.nlm.nih.gov/22419478/,Phonological processing in first-degree relatives of individuals with autism: an  fMRI study.,"Wilson LB, Tregellas JR, Slason E, Pasko BE, Hepburn S, Rojas DC",Human brain mapping,0.041,22419478,-1,-1
behavioral_01706,https://pubmed.ncbi.nlm.nih.gov/22452559/,Nicotine effects on brain function during a visual oddball task: a comparison between conventional and EEG-informed fMRI analysis.,"Warbrick T, Mobascher A, Brinkmeyer J, Musso F, Stoecker T, Shah NJ, Fink GR, Winterer G",Journal of cognitive neuroscience,0.041,22452559,-1,-1
behavioral_01707,https://pubmed.ncbi.nlm.nih.gov/22617632/,Cognitive Behavioral Therapy increases pain-evoked activation of the prefrontal cortex in patients with fibromyalgia.,"Jensen KB, Kosek E, Wicksell R, Kemani M, Olsson G, Merle JV, Kadetoff D, Ingvar M",Pain,0.041,22617632,-1,-1
behavioral_01708,https://pubmed.ncbi.nlm.nih.gov/22784605/,Parietal functional connectivity in numerical cognition.,"Park J, Park DC, Polk TA","Cerebral cortex (New York, N.Y. : 1991)",0.041,22784605,-1,-1
behavioral_01709,https://pubmed.ncbi.nlm.nih.gov/23108370/,A target sample of adolescents and reward processing: same neural and behavioral  correlates engaged in common paradigms?,"Nees F, Vollstadt-Klein S, Fauth-Buhler M, Steiner S, Mann K, Poustka L, Banaschewski T, Buchel C, Conrod PJ, Garavan H, Heinz A, Ittermann B, Artiges E, Paus T, Pausova Z, Rietschel M, Smolka MN, Struve M, Loth E, Schumann G, Flor H",Experimental brain research,0.041,23108370,-1,-1
behavioral_01710,https://pubmed.ncbi.nlm.nih.gov/23125826/,Structural correlates of skilled performance on a motor sequence task.,"Steele CJ, Scholz J, Douaud G, Johansen-Berg H, Penhune VB",Frontiers in human neuroscience,0.041,23125826,-1,-1
behavioral_01711,https://pubmed.ncbi.nlm.nih.gov/23450516/,Slow biasing of processing resources in early visual cortex is preceded by emotional cue extraction in emotion-attention competition.,"Schonwald LI, Muller MM",Human brain mapping,0.041,23450516,-1,-1
behavioral_01712,https://pubmed.ncbi.nlm.nih.gov/23615031/,Segregation of neural circuits involved in spatial learning in reaching and navigational space.,"Nemmi F, Boccia M, Piccardi L, Galati G, Guariglia C",Neuropsychologia,0.041,23615031,-1,-1
behavioral_01713,https://pubmed.ncbi.nlm.nih.gov/23768841/,Cortical activation deficits during facial emotion processing in youth at high risk for the development of substance use disorders.,"Hulvershorn LA, Finn P, Hummer TA, Leibenluft E, Ball B, Gichina V, Anand A",Drug and alcohol dependence,0.041,23768841,-1,-1
behavioral_01714,https://pubmed.ncbi.nlm.nih.gov/23791040/,The influence of monetary punishment on cognitive control in abstinent cocaine-users.,"Hester R, Bell RP, Foxe JJ, Garavan H",Drug and alcohol dependence,0.041,23791040,-1,-1
behavioral_01715,https://pubmed.ncbi.nlm.nih.gov/23825407/,Enhanced visual cortical activation for emotional stimuli is preserved in patients with unilateral amygdala resection.,"Edmiston EK, McHugo M, Dukic MS, Smith SD, Abou-Khalil B, Eggers E, Zald DH",The Journal of neuroscience : the official journal of the Society for Neuroscience,0.041,23825407,-1,-1
behavioral_01716,https://pubmed.ncbi.nlm.nih.gov/23962957/,Richness of information about novel words influences how episodic and semantic memory networks interact during lexicalization.,"Takashima A, Bakker I, van Hell JG, Janzen G, McQueen JM",NeuroImage,0.041,23962957,-1,-1
behavioral_01717,https://pubmed.ncbi.nlm.nih.gov/24214921/,Temporal and spatial neural dynamics in the perception of basic emotions from complex scenes.,"Costa T, Cauda F, Crini M, Tatu MK, Celeghin A, de Gelder B, Tamietto M",Social cognitive and affective neuroscience,0.041,24214921,-1,-1
behavioral_01718,https://pubmed.ncbi.nlm.nih.gov/24416229/,Effects of combining 2 weeks of passive sensory stimulation with active hand motor training in healthy adults.,"Ladda AM, Pfannmoeller JP, Kalisch T, Roschka S, Platz T, Dinse HR, Lotze M",PloS one,0.041,24416229,-1,-1
behavioral_01719,https://pubmed.ncbi.nlm.nih.gov/24493842/,Increased involvement of the parahippocampal gyri in a sad mood predicts future depressive symptoms.,"Zamoscik V, Huffziger S, Ebner-Priemer U, Kuehner C, Kirsch P",Social cognitive and affective neuroscience,0.041,24493842,-1,-1
behavioral_01720,https://pubmed.ncbi.nlm.nih.gov/24525170/,How are things adding up? Neural differences between arithmetic operations are due to general problem solving strategies.,"Tschentscher N, Hauk O",NeuroImage,0.041,24525170,-1,-1
behavioral_01721,https://pubmed.ncbi.nlm.nih.gov/24841995/,Different strategies in solving series completion inductive reasoning problems: An fMRI and computational study.,"Liang P, Jia X, Taatgen NA, Zhong N, Li K",International journal of psychophysiology : official journal of the International Organization of Psychophysiology,0.041,24841995,10.1016/j.ijpsycho.2014.05.006,-1
behavioral_01722,https://pubmed.ncbi.nlm.nih.gov/25148704/,In-context language control with production tasks in bilinguals: an fMRI study.,"Zhang Y, Huang P, Song Z, Fang L, Shen T, Li Y, Gong Q, Xie P",Brain research,0.041,25148704,-1,-1
behavioral_01723,https://pubmed.ncbi.nlm.nih.gov/25271846/,Selective vulnerability related to aging in large-scale resting brain networks.,"Zhang HY, Chen WX, Jiao Y, Xu Y, Zhang XR, Wu JT",PloS one,0.041,25271846,-1,-1
behavioral_01724,https://pubmed.ncbi.nlm.nih.gov/25366500/,fMRI identifies the right inferior frontal cortex as the brain region where time  interval processing is altered by negative emotional arousal.,"Pfeuty M, Dilharreguy B, Gerlier L, Allard M",Human brain mapping,0.041,25366500,-1,-1
behavioral_01725,https://pubmed.ncbi.nlm.nih.gov/25776211/,Distinct neural representations of placebo and nocebo effects.,"Freeman S, Yu R, Egorova N, Chen X, Kirsch I, Claggett B, Kaptchuk TJ, Gollub RL, Kong J",NeuroImage,0.041,25776211,-1,-1
behavioral_01726,https://pubmed.ncbi.nlm.nih.gov/26244883/,Cerebral Correlates of Abnormal Emotion Conflict Processing in Euthymic Bipolar Patients: A Functional MRI Study.,"Favre P, Polosan M, Pichat C, Bougerol T, Baciu M",PloS one,0.041,26244883,-1,-1
behavioral_01727,https://pubmed.ncbi.nlm.nih.gov/26478962/,Broca's region and Visual Word Form Area activation differ during a predictive Stroop task.,"Wallentin M, Gravholt CH, Skakkebaek A",Cortex; a journal devoted to the study of the nervous system and behavior,0.041,26478962,-1,-1
behavioral_01728,https://pubmed.ncbi.nlm.nih.gov/26628642/,When minds matter for moral judgment: intent information is neurally encoded for  harmful but not impure acts.,"Chakroff A, Dungan J, Koster-Hale J, Brown A, Saxe R, Young L",Social cognitive and affective neuroscience,0.041,26628642,-1,-1
behavioral_01729,https://pubmed.ncbi.nlm.nih.gov/26759791/,Neurostructural abnormalities associated with axes of emotion dysregulation in generalized anxiety.,"Makovac E, Meeten F, Watson DR, Garfinkel SN, Critchley HD, Ottaviani C",NeuroImage. Clinical,0.041,26759791,-1,-1
behavioral_01730,https://pubmed.ncbi.nlm.nih.gov/27233784/,Neurofeedback of visual food cue reactivity: a potential avenue to alter incentive sensitization and craving.,"Ihssen N, Sokunbi MO, Lawrence AD, Lawrence NS, Linden DEJ",Brain imaging and behavior,0.041,27233784,-1,-1
behavioral_01731,https://pubmed.ncbi.nlm.nih.gov/27626228/,Frontostriatal Contribution to the Interplay of Flexibility and Stability in Serial Prediction.,"Trempler I, Schiffer AM, El-Sourani N, Ahlheim C, Fink GR, Schubotz RI",Journal of cognitive neuroscience,0.041,27626228,-1,-1
behavioral_01732,https://pubmed.ncbi.nlm.nih.gov/27743373/,Depression and anxiety symptoms are associated to disruption of default mode network in subacute ischemic stroke.,"Vicentini JE, Weiler M, Almeida SRM, de Campos BM, Valler L, Li LM",Brain imaging and behavior,0.041,27743373,-1,-1
behavioral_01733,https://pubmed.ncbi.nlm.nih.gov/28402571/,Neural correlates of emotion acceptance vs worry or suppression in generalized anxiety disorder.,"Ellard KK, Barlow DH, Whitfield-Gabrieli S, Gabrieli JDE, Deckersbach T",Social cognitive and affective neuroscience,0.041,28402571,-1,-1
behavioral_01734,https://pubmed.ncbi.nlm.nih.gov/28408872/,Social Interaction Affects Neural Outcomes of Sign Language Learning As a Foreign Language in Adults.,"Yusa N, Kim J, Koizumi M, Sugiura M, Kawashima R",Frontiers in human neuroscience,0.041,28408872,-1,-1
behavioral_01735,https://pubmed.ncbi.nlm.nih.gov/28578155/,Prefrontal-parietal effective connectivity during working memory in older adults.,"Heinzel S, Lorenz RC, Duong QL, Rapp MA, Deserno L",Neurobiology of aging,0.041,28578155,-1,-1
behavioral_01736,https://pubmed.ncbi.nlm.nih.gov/28800613/,Ongoing slow oscillatory phase modulates speech intelligibility in cooperation with motor cortical activity.,"Onojima T, Kitajo K, Mizuhara H",PloS one,0.041,28800613,-1,-1
behavioral_01737,https://pubmed.ncbi.nlm.nih.gov/29079512/,Positive reinforcement modulates fronto-limbic systems subserving emotional interference in adolescents.,"Ladouceur CD, Schlund MW, Segreti AM",Behavioural brain research,0.041,29079512,-1,-1
behavioral_01738,https://pubmed.ncbi.nlm.nih.gov/29432427/,Brain entropy and human intelligence: A resting-state fMRI study.,"Saxe GN, Calderone D, Morales LJ",PloS one,0.041,29432427,-1,-1
behavioral_01739,https://pubmed.ncbi.nlm.nih.gov/29738921/,Age-related increase of image-invariance in the fusiform face area.,"Nordt M, Semmelmann K, Genc E, Weigelt S",Developmental cognitive neuroscience,0.041,29738921,-1,-1
behavioral_01740,https://pubmed.ncbi.nlm.nih.gov/10366639/,Differential neural responses during performance of matching and nonmatching to sample tasks at two delay intervals.,"Elliott R, Dolan RJ",The Journal of neuroscience : the official journal of the Society for Neuroscience,0.04,10366639,-1,-1
behavioral_01741,https://pubmed.ncbi.nlm.nih.gov/11339984/,The role of coherence and cohesion in text comprehension: an event-related fMRI study.,"Ferstl EC, von Cramon DY",Brain research. Cognitive brain research,0.04,11339984,10.1016/s0926-6410(01)00007-6,-1
behavioral_01742,https://pubmed.ncbi.nlm.nih.gov/11739597/,Exacerbation of pain by anxiety is associated with activity in a hippocampal network.,"Ploghaus A, Narain C, Beckmann CF, Clare S, Bantick S, Wise R, Matthews PM, Rawlins JN, Tracey I",The Journal of neuroscience : the official journal of the Society for Neuroscience,0.04,11739597,10.1523/JNEUROSCI.21-24-09896.2001,-1
behavioral_01743,https://pubmed.ncbi.nlm.nih.gov/15588605/,Cortical mechanisms of visual self-recognition.,"Sugiura M, Watanabe J, Maeda Y, Matsue Y, Fukuda H, Kawashima R",NeuroImage,0.04,15588605,-1,-1
behavioral_01744,https://pubmed.ncbi.nlm.nih.gov/15927489/,Different neuronal pathways support the generation of general and specific mental images.,"Gardini S, De Beni R, Cornoldi C, Bromiley A, Venneri A",NeuroImage,0.04,15927489,-1,-1
behavioral_01745,https://pubmed.ncbi.nlm.nih.gov/16300966/,Brain correlates of negative and positive visuospatial priming in adults.,"Wright CI, Keuthen NJ, Savage CR, Martis B, Williams D, Wedig M, McMullin K, Rauch SL",NeuroImage,0.04,16300966,-1,-1
behavioral_01746,https://pubmed.ncbi.nlm.nih.gov/16421886/,A developmental fMRI study of self-regulatory control.,"Marsh R, Zhu H, Schultz RT, Quackenbush G, Royal J, Skudlarski P, Peterson BS",Human brain mapping,0.04,16421886,-1,-1
behavioral_01747,https://pubmed.ncbi.nlm.nih.gov/16490307/,Activation of insular cortex and subcortical regions related to feedback stimuli  in a time estimation task: an fMRI study.,"Tsukamoto T, Kotani Y, Ohgami Y, Omura K, Inoue Y, Aihara Y",Neuroscience letters,0.04,16490307,-1,-1
behavioral_01748,https://pubmed.ncbi.nlm.nih.gov/16628608/,Effect of word and syllable frequency on activation during lexical decision and reading aloud.,"Carreiras M, Mechelli A, Price CJ",Human brain mapping,0.04,16628608,-1,-1
behavioral_01749,https://pubmed.ncbi.nlm.nih.gov/17476480/,Incidental use of ecstasy: no evidence for harmful effects on cognitive brain function in a prospective fMRI study.,"Jager G, de Win MM, Vervaeke HK, Schilt T, Kahn RS, van den Brink W, van Ree JM, Ramsey NF",Psychopharmacology,0.04,17476480,-1,-1
behavioral_01750,https://pubmed.ncbi.nlm.nih.gov/17585888/,Frontal and limbic activation during inhibitory control predicts treatment response in major depressive disorder.,"Langenecker SA, Kennedy SE, Guidotti LM, Briceno EM, Own LS, Hooven T, Young EA, Akil H, Noll DC, Zubieta JK",Biological psychiatry,0.04,17585888,-1,-1
behavioral_01751,https://pubmed.ncbi.nlm.nih.gov/17636560/,Posterior cingulate activation during moral dilemma in adolescents.,"Pujol J, Reixach J, Harrison BJ, Timoneda-Gallart C, Vilanova JC, Perez-Alvarez F",Human brain mapping,0.04,17636560,-1,-1
behavioral_01752,https://pubmed.ncbi.nlm.nih.gov/17962220/,"A dynamic object-processing network: metric shape discrimination of dynamic objects by activation of occipitotemporal, parietal, and frontal cortices.","Schultz J, Chuang L, Vuong QC","Cerebral cortex (New York, N.Y. : 1991)",0.04,17962220,-1,-1
behavioral_01753,https://pubmed.ncbi.nlm.nih.gov/18509068/,Resting states affect spontaneous BOLD oscillations in sensory and paralimbic cortex.,"McAvoy M, Larson-Prior L, Nolan TS, Vaishnavi SN, Raichle ME, d'Avossa G",Journal of neurophysiology,0.04,18509068,-1,-1
behavioral_01754,https://pubmed.ncbi.nlm.nih.gov/18823254/,Semantic context and visual feature effects in object naming: an fMRI study using arterial spin labeling.,"Hocking J, McMahon KL, de Zubicaray GI",Journal of cognitive neuroscience,0.04,18823254,-1,-1
behavioral_01755,https://pubmed.ncbi.nlm.nih.gov/19107748/,Regional brain activation changes and abnormal functional connectivity of the ventrolateral prefrontal cortex during working memory processing in adults with attention-deficit/hyperactivity disorder.,"Wolf RC, Plichta MM, Sambataro F, Fallgatter AJ, Jacob C, Lesch KP, Herrmann MJ, Schonfeldt-Lecuona C, Connemann BJ, Gron G, Vasic N",Human brain mapping,0.04,19107748,-1,-1
behavioral_01756,https://pubmed.ncbi.nlm.nih.gov/19403218/,Cognitive conflict and inhibition in primed dichotic listening.,"Saetrevik B, Specht K",Brain and cognition,0.04,19403218,-1,-1
behavioral_01757,https://pubmed.ncbi.nlm.nih.gov/19804836/,Tease or threat? Judging social interactions from bodily expressions.,"Sinke CB, Sorger B, Goebel R, de Gelder B",NeuroImage,0.04,19804836,-1,-1
behavioral_01758,https://pubmed.ncbi.nlm.nih.gov/19948225/,Anomalous neural circuit function in schizophrenia during a virtual Morris water  task.,"Folley BS, Astur R, Jagannathan K, Calhoun VD, Pearlson GD",NeuroImage,0.04,19948225,-1,-1
behavioral_01759,https://pubmed.ncbi.nlm.nih.gov/20045478/,When I think about me and simulate you: medial rostral prefrontal cortex and self-referential processes.,"Benoit RG, Gilbert SJ, Volle E, Burgess PW",NeuroImage,0.04,20045478,-1,-1
behavioral_01760,https://pubmed.ncbi.nlm.nih.gov/20097295/,"Dissociating the roles of the default-mode, dorsal, and ventral networks in episodic memory retrieval.",Kim H,NeuroImage,0.04,20097295,-1,-1
behavioral_01761,https://pubmed.ncbi.nlm.nih.gov/20460301/,"Stop looking angry and smile, please: start and stop of the very same facial expression differentially activate threat- and reward-related brain networks.","Muhlberger A, Wieser MJ, Gerdes AB, Frey MC, Weyers P, Pauli P",Social cognitive and affective neuroscience,0.04,20460301,10.1093/scan/nsq039,-1
behavioral_01762,https://pubmed.ncbi.nlm.nih.gov/20553738/,Neural correlates of body dissatisfaction in anorexia nervosa.,"Friederich HC, Brooks S, Uher R, Campbell IC, Giampietro V, Brammer M, Williams SC, Herzog W, Treasure J",Neuropsychologia,0.04,20553738,10.1016/j.neuropsychologia.2010.04.036,-1
behavioral_01763,https://pubmed.ncbi.nlm.nih.gov/20943318/,Neural bases of conditioned placebo analgesia.,"Lui F, Colloca L, Duzzi D, Anchisi D, Benedetti F, Porro CA",Pain,0.04,20943318,10.1016/j.pain.2010.09.021,-1
behavioral_01764,https://pubmed.ncbi.nlm.nih.gov/21126735/,Individuals family history positive for alcoholism show functional magnetic resonance imaging differences in reward sensitivity that are related to impulsivity factors.,"Andrews MM, Meda SA, Thomas AD, Potenza MN, Krystal JH, Worhunsky P, Stevens MC, O'Malley S, Book GA, Reynolds B, Pearlson GD",Biological psychiatry,0.04,21126735,-1,-1
behavioral_01765,https://pubmed.ncbi.nlm.nih.gov/21425391/,Common and distinct neural regions for the guidance of selection by visuoverbal information held in memory: converging evidence from fMRI and rTMS.,"Soto D, Rotshtein P, Hodsoll J, Mevorach C, Humphreys GW",Human brain mapping,0.04,21425391,-1,-1
behavioral_01766,https://pubmed.ncbi.nlm.nih.gov/21513918/,The functional correlates of face perception and recognition of emotional facial  expressions as evidenced by fMRI.,"Jehna M, Neuper C, Ischebeck A, Loitfelder M, Ropele S, Langkammer C, Ebner F, Fuchs S, Schmidt R, Fazekas F, Enzinger C",Brain research,0.04,21513918,-1,-1
behavioral_01767,https://pubmed.ncbi.nlm.nih.gov/21676378/,Can you hear a difference? Neuronal correlates of melodic deviance processing in  children.,"Wehrum S, Dege F, Ott U, Walter B, Stippekohl B, Kagerer S, Schwarzer G, Vaitl D, Stark R",Brain research,0.04,21676378,-1,-1
behavioral_01768,https://pubmed.ncbi.nlm.nih.gov/21695536/,Inter-individual discount factor differences in reward prediction are topographically associated with caudate activation.,"Onoda K, Okamoto Y, Kunisato Y, Aoyama S, Shishida K, Okada G, Tanaka SC, Schweighofer N, Yamaguchi S, Doya K, Yamawaki S",Experimental brain research,0.04,21695536,-1,-1
behavioral_01769,https://pubmed.ncbi.nlm.nih.gov/21775675/,Competition in working memory reduces frontal guidance of visual selection.,"Soto D, Greene CM, Chaudhary A, Rotshtein P","Cerebral cortex (New York, N.Y. : 1991)",0.04,21775675,-1,-1
behavioral_01770,https://pubmed.ncbi.nlm.nih.gov/21807006/,Perceptual and anatomic patterns of selective deficits in facial identity and expression processing.,"Fox CJ, Hanif HM, Iaria G, Duchaine BC, Barton JJ",Neuropsychologia,0.04,21807006,-1,-1
behavioral_01771,https://pubmed.ncbi.nlm.nih.gov/21861676/,Amygdalar function reflects common individual differences in emotion and pain regulation success.,"Lapate RC, Lee H, Salomons TV, van Reekum CM, Greischar LL, Davidson RJ",Journal of cognitive neuroscience,0.04,21861676,-1,-1
behavioral_01772,https://pubmed.ncbi.nlm.nih.gov/21862438/,Brain volume changes in Parkinson's disease and their relationship with cognitive and behavioural abnormalities.,"Biundo R, Formento-Dojot P, Facchini S, Vallelunga A, Ghezzo L, Foscolo L, Meneghello F, Antonini A",Journal of the neurological sciences,0.04,21862438,-1,-1
behavioral_01773,https://pubmed.ncbi.nlm.nih.gov/22206905/,False belief and verb non-factivity: a common neural basis?,"Cheung H, Chen L, Szeto CY, Feng G, Lu G, Zhang Z, Zhu Z, Wang S",International journal of psychophysiology : official journal of the International Organization of Psychophysiology,0.04,22206905,-1,-1
behavioral_01774,https://pubmed.ncbi.nlm.nih.gov/22245641/,Changes in regional cerebral blood flow and functional connectivity in the cholinergic pathway associated with cognitive performance in subjects with mild Alzheimer's disease after 12-week donepezil t,"Li W, Antuono PG, Xie C, Chen G, Jones JL, Ward BD, Franczak MB, Goveas JS, Li SJ",NeuroImage,0.04,22245641,-1,-1
behavioral_01775,https://pubmed.ncbi.nlm.nih.gov/22245646/,Neural basis of phonological processing in second language reading: an fMRI study of Chinese regularity effect.,"Zhao J, Li QL, Wang JJ, Yang Y, Deng Y, Bi HY",NeuroImage,0.04,22245646,-1,-1
behavioral_01776,https://pubmed.ncbi.nlm.nih.gov/22325099/,Spatial working memory dysfunction in minimal hepatic encephalopathy: an ethology and BOLD-fMRI study.,"Liao LM, Zhou LX, Le HB, Yin JJ, Ma SH",Brain research,0.04,22325099,-1,-1
behavioral_01777,https://pubmed.ncbi.nlm.nih.gov/22355285/,Striatal intrinsic reinforcement signals during recognition memory: relationship  to response bias and dysregulation in schizophrenia.,"Wolf DH, Gerraty R, Satterthwaite TD, Loughead J, Campellone T, Elliott MA, Turetsky BI, Gur RC, Gur RE",Frontiers in behavioral neuroscience,0.04,22355285,-1,-1
behavioral_01778,https://pubmed.ncbi.nlm.nih.gov/22362841/,Neuronal correlates of social cognition in borderline personality disorder.,"Mier D, Lis S, Esslinger C, Sauer C, Hagenhoff M, Ulferts J, Gallhofer B, Kirsch P",Social cognitive and affective neuroscience,0.04,22362841,-1,-1
behavioral_01779,https://pubmed.ncbi.nlm.nih.gov/22890475/,Sensory modality of smoking cues modulates neural cue reactivity.,"Yalachkov Y, Kaiser J, Gorres A, Seehaus A, Naumer MJ",Psychopharmacology,0.04,22890475,-1,-1
behavioral_01780,https://pubmed.ncbi.nlm.nih.gov/23033120/,The influence of positive and negative emotional associations on semantic processing in depression: an fMRI study.,"Sass K, Habel U, Kellermann T, Mathiak K, Gauggel S, Kircher T",Human brain mapping,0.04,23033120,-1,-1
