paper_name,paper_url,Title,Author,Journal,Loading,PMID,Doi,download_status
behavioral_00566,https://pubmed.ncbi.nlm.nih.gov/25913061/,Recognition of personally familiar faces and functional connectivity in Alzheimer's disease.,"Kurth S, Moyse E, Bahri MA, Salmon E, Bastin C",Cortex; a journal devoted to the study of the nervous system and behavior,0.073,25913061,-1,-1
behavioral_00567,https://pubmed.ncbi.nlm.nih.gov/27865969/,Age-related alterations in functional connectivity patterns during working memory encoding of emotional items.,"Ziaei M, Salami A, Persson J",Neuropsychologia,0.073,27865969,-1,-1
behavioral_00568,https://pubmed.ncbi.nlm.nih.gov/28701942/,Neural Mechanisms Underlying Conscious and Unconscious Gaze-Triggered Attentional Orienting in Autism Spectrum Disorder.,"Sato W, Kochiyama T, Uono S, Yoshimura S, Toichi M",Frontiers in human neuroscience,0.073,28701942,-1,-1
behavioral_00569,https://pubmed.ncbi.nlm.nih.gov/14527592/,Effect of head orientation on gaze processing in fusiform gyrus and superior temporal sulcus.,"Pageler NM, Menon V, Merin NM, Eliez S, Brown WE, Reiss AL",NeuroImage,0.072,14527592,-1,-1
behavioral_00570,https://pubmed.ncbi.nlm.nih.gov/14642466/,Neural correlates of the prolonged salience of painful stimulation.,"Downar J, Mikulis DJ, Davis KD",NeuroImage,0.072,14642466,-1,-1
behavioral_00571,https://pubmed.ncbi.nlm.nih.gov/16476414/,An event-related fMRI study of the neural networks underlying repetition suppression and reaction time priming in implicit visual memory.,"Habeck C, Hilton HJ, Zarahn E, Brown T, Stern Y",Brain research,0.072,16476414,10.1016/j.brainres.2005.11.102,-1
behavioral_00572,https://pubmed.ncbi.nlm.nih.gov/16672649/,The anterior cingulate and error avoidance.,"Magno E, Foxe JJ, Molholm S, Robertson IH, Garavan H",The Journal of neuroscience : the official journal of the Society for Neuroscience,0.072,16672649,10.1523/JNEUROSCI.0369-06.2006,-1
behavioral_00573,https://pubmed.ncbi.nlm.nih.gov/16988033/,Acute changes in frontoparietal activity after repetitive transcranial magnetic stimulation over the dorsolateral prefrontal cortex in a cued reaction time task.,"Rounis E, Stephan KE, Lee L, Siebner HR, Pesenti A, Friston KJ, Rothwell JC, Frackowiak RS",The Journal of neuroscience : the official journal of the Society for Neuroscience,0.072,16988033,10.1523/JNEUROSCI.2657-06.2006,-1
behavioral_00574,https://pubmed.ncbi.nlm.nih.gov/18155926/,A hippocampal-parietal network for learning an ordered sequence.,"Van Opstal F, Verguts T, Orban GA, Fias W",NeuroImage,0.072,18155926,10.1016/j.neuroimage.2007.11.027,-1
behavioral_00575,https://pubmed.ncbi.nlm.nih.gov/18564038/,Neural correlates of stereotype application.,"Mitchell JP, Ames DL, Jenkins AC, Banaji MR",Journal of cognitive neuroscience,0.072,18564038,-1,-1
behavioral_00576,https://pubmed.ncbi.nlm.nih.gov/19571268/,IQ-related fMRI differences during cognitive set shifting.,"Graham S, Jiang J, Manning V, Nejad AB, Zhisheng K, Salleh SR, Golay X, Berne YI, McKenna PJ","Cerebral cortex (New York, N.Y. : 1991)",0.072,19571268,-1,-1
behavioral_00577,https://pubmed.ncbi.nlm.nih.gov/19603407/,Metaanalytic connectivity modeling: delineating the functional connectivity of the human amygdala.,"Robinson JL, Laird AR, Glahn DC, Lovallo WR, Fox PT",Human brain mapping,0.072,19603407,-1,-1
behavioral_00578,https://pubmed.ncbi.nlm.nih.gov/19875216/,Alertness in young healthy subjects: an fMRI study of brain region interactivity  enhanced by a warning signal.,"Perin B, Godefroy O, Fall S, de Marco G",Brain and cognition,0.072,19875216,-1,-1
behavioral_00579,https://pubmed.ncbi.nlm.nih.gov/21320516/,Gender differences in the neural correlates of humor processing: implications for different processing modes.,"Kohn N, Kellermann T, Gur RC, Schneider F, Habel U",Neuropsychologia,0.072,21320516,-1,-1
behavioral_00580,https://pubmed.ncbi.nlm.nih.gov/21669407/,Distinct resting-state brain activities in heroin-dependent individuals.,"Zhang Y, Tian J, Yuan K, Liu P, Zhuo L, Qin W, Zhao L, Liu J, von Deneen KM, Klahr NJ, Gold MS, Liu Y",Brain research,0.072,21669407,-1,-1
behavioral_00581,https://pubmed.ncbi.nlm.nih.gov/22110714/,An fMRI study on the role of serotonin in reactive aggression.,"Kramer UM, Riba J, Richter S, Munte TF",PloS one,0.072,22110714,-1,-1
behavioral_00582,https://pubmed.ncbi.nlm.nih.gov/23851324/,The stimuli drive the response: an fMRI study of youth processing adult or child  emotional face stimuli.,"Marusak HA, Carre JM, Thomason ME",NeuroImage,0.072,23851324,-1,-1
behavioral_00583,https://pubmed.ncbi.nlm.nih.gov/24325851/,The effect of feedback on performance and brain activation during perceptual learning.,"Goldhacker M, Rosengarth K, Plank T, Greenlee MW",Vision research,0.072,24325851,-1,-1
behavioral_00584,https://pubmed.ncbi.nlm.nih.gov/25929599/,Distinct neural processes are engaged in the modulation of mimicry by social group-membership and emotional expressions.,"Rauchbauer B, Majdandzic J, Hummer A, Windischberger C, Lamm C",Cortex; a journal devoted to the study of the nervous system and behavior,0.072,25929599,-1,-1
behavioral_00585,https://pubmed.ncbi.nlm.nih.gov/26855062/,Brain structure links everyday creativity to creative achievement.,"Zhu W, Chen Q, Tang C, Cao G, Hou Y, Qiu J",Brain and cognition,0.072,26855062,-1,-1
behavioral_00586,https://pubmed.ncbi.nlm.nih.gov/27039701/,Sex differences in the functional connectivity of the amygdalae in association with cortisol.,"Kogler L, Muller VI, Seidel EM, Boubela R, Kalcher K, Moser E, Habel U, Gur RC, Eickhoff SB, Derntl B",NeuroImage,0.072,27039701,-1,-1
behavioral_00587,https://pubmed.ncbi.nlm.nih.gov/18079289/,Neural representations of kinematic laws of motion: evidence for action-perception coupling.,"Dayan E, Casile A, Levit-Binnun N, Giese MA, Hendler T, Flash T",Proceedings of the National Academy of Sciences of the United States of America,0.071,18079289,-1,-1
behavioral_00588,https://pubmed.ncbi.nlm.nih.gov/18234690/,Brain activation for consonants and vowels.,"Carreiras M, Price CJ","Cerebral cortex (New York, N.Y. : 1991)",0.071,18234690,-1,-1
behavioral_00589,https://pubmed.ncbi.nlm.nih.gov/18977304/,The sensory-motor specificity of taxonomic and thematic conceptual relations: a behavioral and fMRI study.,"Kalenine S, Peyrin C, Pichat C, Segebarth C, Bonthoux F, Baciu M",NeuroImage,0.071,18977304,-1,-1
behavioral_00590,https://pubmed.ncbi.nlm.nih.gov/19433790/,Experience sampling during fMRI reveals default network and executive system contributions to mind wandering.,"Christoff K, Gordon AM, Smallwood J, Smith R, Schooler JW",Proceedings of the National Academy of Sciences of the United States of America,0.071,19433790,-1,-1
behavioral_00591,https://pubmed.ncbi.nlm.nih.gov/19595679/,Detecting directional influence in fMRI connectivity analysis using PCA based Granger causality.,"Zhou Z, Ding M, Chen Y, Wright P, Lu Z, Liu Y",Brain research,0.071,19595679,10.1016/j.brainres.2009.06.096,-1
behavioral_00592,https://pubmed.ncbi.nlm.nih.gov/19925175/,The neural correlates of persuasion: a common network across cultures and media.,"Falk EB, Rameson L, Berkman ET, Liao B, Kang Y, Inagaki TK, Lieberman MD",Journal of cognitive neuroscience,0.071,19925175,10.1162/jocn.2009.21363,-1
behavioral_00593,https://pubmed.ncbi.nlm.nih.gov/22494771/,A forced-attention dichotic listening fMRI study on 113 subjects.,"Kompus K, Specht K, Ersland L, Juvodden HT, van Wageningen H, Hugdahl K, Westerhausen R",Brain and language,0.071,22494771,10.1016/j.bandl.2012.03.004,-1
behavioral_00594,https://pubmed.ncbi.nlm.nih.gov/22508768/,Exploration of the neural correlates of ticklish laughter by functional magnetic  resonance imaging.,"Wattendorf E, Westermann B, Fiedler K, Kaza E, Lotze M, Celio MR","Cerebral cortex (New York, N.Y. : 1991)",0.071,22508768,-1,-1
behavioral_00595,https://pubmed.ncbi.nlm.nih.gov/22652538/,The neural correlates of maternal sensitivity: an fMRI study.,"Musser ED, Kaiser-Laurent H, Ablow JC",Developmental cognitive neuroscience,0.071,22652538,-1,-1
behavioral_00596,https://pubmed.ncbi.nlm.nih.gov/23077059/,Prefrontally driven downregulation of neural synchrony mediates goal-directed forgetting.,"Hanslmayr S, Volberg G, Wimber M, Oehler N, Staudigl T, Hartmann T, Raabe M, Greenlee MW, Bauml KH",The Journal of neuroscience : the official journal of the Society for Neuroscience,0.071,23077059,-1,-1
behavioral_00597,https://pubmed.ncbi.nlm.nih.gov/23207574/,Synchronizing with auditory and visual rhythms: an fMRI assessment of modality differences and modality appropriateness.,"Hove MJ, Fairhurst MT, Kotz SA, Keller PE",NeuroImage,0.071,23207574,-1,-1
behavioral_00598,https://pubmed.ncbi.nlm.nih.gov/23994213/,The gender you are and the gender you like: sexual preference and empathic neural responses.,"Perry D, Walder K, Hendler T, Shamay-Tsoory SG",Brain research,0.071,23994213,-1,-1
behavioral_00599,https://pubmed.ncbi.nlm.nih.gov/24155323/,Neural underpinnings of the identifiable victim effect: affect shifts preferences for giving.,"Genevsky A, Vastfjall D, Slovic P, Knutson B",The Journal of neuroscience : the official journal of the Society for Neuroscience,0.071,24155323,-1,-1
behavioral_00600,https://pubmed.ncbi.nlm.nih.gov/24844746/,Validating the Why/How contrast for functional MRI studies of Theory of Mind.,"Spunt RP, Adolphs R",NeuroImage,0.071,24844746,-1,-1
behavioral_00601,https://pubmed.ncbi.nlm.nih.gov/25433424/,Decreased amygdala-insula resting state connectivity in behaviorally and emotionally dysregulated youth.,"Bebko G, Bertocci M, Chase H, Dwojak A, Bonar L, Almeida J, Perlman SB, Versace A, Schirda C, Travis M, Gill MK, Demeter C, Diwadkar V, Sunshine J, Holland S, Kowatch R, Birmaher B, Axelson D, Horwitz S, Frazier T, Arnold LE, Fristad M, Youngstrom E, Findling R, Phillips ML",Psychiatry research,0.071,25433424,-1,-1
behavioral_00602,https://pubmed.ncbi.nlm.nih.gov/25868676/,Goal- and retrieval-dependent activity in the striatum during memory recognition.,"Clos M, Schwarze U, Gluth S, Bunzeck N, Sommer T",Neuropsychologia,0.071,25868676,-1,-1
behavioral_00603,https://pubmed.ncbi.nlm.nih.gov/27378028/,Demonstration and validation of a new pressure-based MRI-safe pain tolerance device.,"Davis MT, Daniel TA, Witte TK, Beyers RJ, Willis JZ, Wang Y, Denney TS Jr, Katz JS, Salibi N, Deshpande G",Journal of neuroscience methods,0.071,27378028,-1,-1
behavioral_00604,https://pubmed.ncbi.nlm.nih.gov/28129051/,Mere Exposure: Preference Change for Novel Drinks Reflected in Human Ventral Tegmental Area.,"Ballard IC, Hennigan K, McClure SM",Journal of cognitive neuroscience,0.071,28129051,-1,-1
behavioral_00605,https://pubmed.ncbi.nlm.nih.gov/28373956/,A neural network underlying intentional emotional facial expression in neurodegenerative disease.,"Gola KA, Shany-Ur T, Pressman P, Sulman I, Galeana E, Paulsen H, Nguyen L, Wu T, Adhimoolam B, Poorzand P, Miller BL, Rankin KP",NeuroImage. Clinical,0.071,28373956,-1,-1
behavioral_00606,https://pubmed.ncbi.nlm.nih.gov/12160754/,Medial prefrontal and subcortical mechanisms underlying the acquisition of motor  and cognitive action sequences in humans.,"Koechlin E, Danek A, Burnod Y, Grafman J",Neuron,0.07,12160754,-1,-1
behavioral_00607,https://pubmed.ncbi.nlm.nih.gov/14980212/,Brain responses to the acquired moral status of faces.,"Singer T, Kiebel SJ, Winston JS, Dolan RJ, Frith CD",Neuron,0.07,14980212,-1,-1
behavioral_00608,https://pubmed.ncbi.nlm.nih.gov/21568631/,Right ventrolateral prefrontal cortex mediates individual differences in conflict-driven cognitive control.,Egner T,Journal of cognitive neuroscience,0.07,21568631,-1,-1
behavioral_00609,https://pubmed.ncbi.nlm.nih.gov/21642352/,The importance of actions and the worth of an object: dissociable neural systems  representing core value and economic value.,"Brosch T, Coppin G, Schwartz S, Sander D",Social cognitive and affective neuroscience,0.07,21642352,-1,-1
behavioral_00610,https://pubmed.ncbi.nlm.nih.gov/23759649/,"Network dysfunction during associative learning in schizophrenia: Increased activation, but decreased connectivity: an fMRI study.","Wadehra S, Pruitt P, Murphy ER, Diwadkar VA",Schizophrenia research,0.07,23759649,-1,-1
behavioral_00611,https://pubmed.ncbi.nlm.nih.gov/23874445/,Psychosis-proneness and neural correlates of self-inhibition in theory of mind.,"van der Meer L, Groenewold NA, Pijnenborg M, Aleman A",PloS one,0.07,23874445,10.1371/journal.pone.0067774,-1
behavioral_00612,https://pubmed.ncbi.nlm.nih.gov/24448735/,Reward prospect rapidly speeds up response inhibition via reactive control.,"Boehler CN, Schevernels H, Hopf JM, Stoppel CM, Krebs RM","Cognitive, affective & behavioral neuroscience",0.07,24448735,10.3758/s13415-014-0251-5,-1
behavioral_00613,https://pubmed.ncbi.nlm.nih.gov/24834038/,Brain functional connectivity changes in children that differ in impulsivity temperamental trait.,"Inuggi A, Sanz-Arigita E, Gonzalez-Salinas C, Valero-Garcia AV, Garcia-Santos JM, Fuentes LJ",Frontiers in behavioral neuroscience,0.07,24834038,10.3389/fnbeh.2014.00156,-1
behavioral_00614,https://pubmed.ncbi.nlm.nih.gov/25100970/,Cognitive control and unusual decisions about beauty: an fMRI study.,"Flexas A, Rossello J, de Miguel P, Nadal M, Munar E",Frontiers in human neuroscience,0.07,25100970,-1,-1
behavioral_00615,https://pubmed.ncbi.nlm.nih.gov/12595185/,Separating distractor rejection and target detection in posterior parietal cortex--an event-related fMRI study of visual marking.,"Pollmann S, Weidner R, Humphreys GW, Olivers CN, Muller K, Lohmann G, Wiggins CJ, Watson DG",NeuroImage,0.069,12595185,-1,-1
behavioral_00616,https://pubmed.ncbi.nlm.nih.gov/19184993/,Off-line sentence processing: what is involved in answering a comprehension probe?,"Newman SD, Lee D, Ratliff KL",Human brain mapping,0.069,19184993,-1,-1
behavioral_00617,https://pubmed.ncbi.nlm.nih.gov/21620979/,The effects of aging on material-independent and material-dependent neural correlates of contextual binding.,"Dulas MR, Duarte A",NeuroImage,0.069,21620979,-1,-1
behavioral_00618,https://pubmed.ncbi.nlm.nih.gov/21917804/,The decision value computations in the vmPFC and striatum use a relative value code that is guided by visual attention.,"Lim SL, O'Doherty JP, Rangel A",The Journal of neuroscience : the official journal of the Society for Neuroscience,0.069,21917804,-1,-1
behavioral_00619,https://pubmed.ncbi.nlm.nih.gov/22579718/,Characterizing the anomalous cognition-emotion interactions in externalizing.,"Baskin-Sommers AR, Curtin JJ, Larson CL, Stout D, Kiehl KA, Newman JP",Biological psychology,0.069,22579718,-1,-1
behavioral_00620,https://pubmed.ncbi.nlm.nih.gov/23392685/,Pain-specific modulation of hippocampal activity and functional connectivity during visual encoding.,"Forkmann K, Wiech K, Ritter C, Sommer T, Rose M, Bingel U",The Journal of neuroscience : the official journal of the Society for Neuroscience,0.069,23392685,-1,-1
behavioral_00621,https://pubmed.ncbi.nlm.nih.gov/24005298/,A broader view of perirhinal function: from recognition memory to fluency-based decisions.,"Dew IT, Cabeza R",The Journal of neuroscience : the official journal of the Society for Neuroscience,0.069,24005298,-1,-1
behavioral_00622,https://pubmed.ncbi.nlm.nih.gov/26707083/,Orbitofrontal and limbic signatures of empathic concern and intentional harm in the behavioral variant frontotemporal dementia.,"Baez S, Morales JP, Slachevsky A, Torralva T, Matus C, Manes F, Ibanez A",Cortex; a journal devoted to the study of the nervous system and behavior,0.069,26707083,-1,-1
behavioral_00623,https://pubmed.ncbi.nlm.nih.gov/29159055/,Neural correlates of working memory deficits and associations to response inhibition in obsessive compulsive disorder.,"Heinzel S, Kaufmann C, Grutzmann R, Hummel R, Klawohn J, Riesel A, Bey K, Lennertz L, Wagner M, Kathmann N",NeuroImage. Clinical,0.069,29159055,-1,-1
behavioral_00624,https://pubmed.ncbi.nlm.nih.gov/12595201/,Practice-related effects demonstrate complementary roles of anterior cingulate and prefrontal cortices in attentional control.,"Milham MP, Banich MT, Claus ED, Cohen NJ",NeuroImage,0.068,12595201,-1,-1
behavioral_00625,https://pubmed.ncbi.nlm.nih.gov/15964208/,Separating semantic conflict and response conflict in the Stroop task: a functional MRI study.,"van Veen V, Carter CS",NeuroImage,0.068,15964208,-1,-1
behavioral_00626,https://pubmed.ncbi.nlm.nih.gov/16725189/,Neural correlates of morphological decomposition in a morphologically rich language: an fMRI study.,"Lehtonen M, Vorobyev VA, Hugdahl K, Tuokkola T, Laine M",Brain and language,0.068,16725189,-1,-1
behavioral_00627,https://pubmed.ncbi.nlm.nih.gov/19632335/,Neural systems supporting lexical search guided by letter and semantic category cues: a self-paced overt response fMRI study of verbal fluency.,"Birn RM, Kenworthy L, Case L, Caravella R, Jones TB, Bandettini PA, Martin A",NeuroImage,0.068,19632335,-1,-1
behavioral_00628,https://pubmed.ncbi.nlm.nih.gov/21549767/,Secure attachment partners attenuate neural responses to social exclusion: an fMRI investigation.,"Karremans JC, Heslenfeld DJ, van Dillen LF, Van Lange PA",International journal of psychophysiology : official journal of the International Organization of Psychophysiology,0.068,21549767,-1,-1
behavioral_00629,https://pubmed.ncbi.nlm.nih.gov/21689765/,Changes occur in resting state network of motor system during 4 weeks of motor skill learning.,"Ma L, Narayana S, Robin DA, Fox PT, Xiong J",NeuroImage,0.068,21689765,-1,-1
behavioral_00630,https://pubmed.ncbi.nlm.nih.gov/23020899/,Reduced neural activation during an inhibition task is associated with impaired fear inhibition in a traumatized civilian sample.,"Jovanovic T, Ely T, Fani N, Glover EM, Gutman D, Tone EB, Norrholm SD, Bradley B, Ressler KJ",Cortex; a journal devoted to the study of the nervous system and behavior,0.068,23020899,-1,-1
behavioral_00631,https://pubmed.ncbi.nlm.nih.gov/24391713/,A word by any other intonation: FMRI evidence for implicit memory traces for pitch contours of spoken words in adult brains.,"Inspector M, Manor D, Amir N, Kushnir T, Karni A",PloS one,0.068,24391713,10.1371/journal.pone.0082042,-1
behavioral_00632,https://pubmed.ncbi.nlm.nih.gov/26076493/,Attenuated Neural Processing of Risk in Young Adults at Risk for Stimulant Dependence.,"Reske M, Stewart JL, Flagan TM, Paulus MP",PloS one,0.068,26076493,10.1371/journal.pone.0127010,-1
behavioral_00633,https://pubmed.ncbi.nlm.nih.gov/26248582/,Brain stimulation improves cognitive control by modulating medial-frontal activity and preSMA-vmPFC functional connectivity.,"Yu J, Tseng P, Hung DL, Wu SW, Juan CH",Human brain mapping,0.068,26248582,10.1002/hbm.22893,-1
behavioral_00634,https://pubmed.ncbi.nlm.nih.gov/26340683/,Neural differences between monolinguals and early bilinguals in their native language during comprehension.,"Roman P, Gonzalez J, Ventura-Campos N, Rodriguez-Pujadas A, Sanjuan A, Avila C",Brain and language,0.068,26340683,-1,-1
behavioral_00635,https://pubmed.ncbi.nlm.nih.gov/28377158/,Task difficulty modulates brain activation in the emotional oddball task.,"Siciliano RE, Madden DJ, Tallman CW, Boylan MA, Kirste I, Monge ZA, Packard LE, Potter GG, Wang L",Brain research,0.068,28377158,-1,-1
behavioral_00636,https://pubmed.ncbi.nlm.nih.gov/17360900/,Erythropoietin enhances hippocampal response during memory retrieval in humans.,"Miskowiak K, O'Sullivan U, Harmer CJ",The Journal of neuroscience : the official journal of the Society for Neuroscience,0.067,17360900,-1,-1
behavioral_00637,https://pubmed.ncbi.nlm.nih.gov/17467816/,Functional neural networks underlying response inhibition in adolescents and adults.,"Stevens MC, Kiehl KA, Pearlson GD, Calhoun VD",Behavioural brain research,0.067,17467816,-1,-1
behavioral_00638,https://pubmed.ncbi.nlm.nih.gov/20484643/,Vasopressin modulates medial prefrontal cortex-amygdala circuitry during emotion  processing in humans.,"Zink CF, Stein JL, Kempf L, Hakimi S, Meyer-Lindenberg A",The Journal of neuroscience : the official journal of the Society for Neuroscience,0.067,20484643,-1,-1
behavioral_00639,https://pubmed.ncbi.nlm.nih.gov/21385569/,Methylphenidate does not improve interference control during a working memory task in young patients with attention-deficit hyperactivity disorder.,"Prehn-Kristensen A, Krauel K, Hinrichs H, Fischer J, Malecki U, Schuetze H, Wolff S, Jansen O, Duezel E, Baving L",Brain research,0.067,21385569,-1,-1
behavioral_00640,https://pubmed.ncbi.nlm.nih.gov/21414916/,Investigation of the neural control of cough and cough suppression in humans using functional brain imaging.,"Mazzone SB, Cole LJ, Ando A, Egan GF, Farrell MJ",The Journal of neuroscience : the official journal of the Society for Neuroscience,0.067,21414916,-1,-1
behavioral_00641,https://pubmed.ncbi.nlm.nih.gov/22302842/,Goal-directed behavior under emotional distraction is preserved by enhanced task-specific activation.,"Wessa M, Heissler J, Schonfelder S, Kanske P",Social cognitive and affective neuroscience,0.067,22302842,-1,-1
behavioral_00642,https://pubmed.ncbi.nlm.nih.gov/22593069/,Approach-avoidance processes contribute to dissociable impacts of risk and loss on choice.,"Wright ND, Symmonds M, Hodgson K, Fitzgerald TH, Crawford B, Dolan RJ",The Journal of neuroscience : the official journal of the Society for Neuroscience,0.067,22593069,-1,-1
behavioral_00643,https://pubmed.ncbi.nlm.nih.gov/23142070/,Priming of visual cortex by temporal attention? The effects of temporal predictability on stimulus(-specific) processing in early visual cortical areas.,"Fischer R, Plessow F, Ruge H",NeuroImage,0.067,23142070,-1,-1
behavioral_00644,https://pubmed.ncbi.nlm.nih.gov/24505303/,Neural correlates of receiving an apology and active forgiveness: an FMRI study.,"Strang S, Utikal V, Fischbacher U, Weber B, Falk A",PloS one,0.067,24505303,-1,-1
behavioral_00645,https://pubmed.ncbi.nlm.nih.gov/26765947/,On Known Unknowns: Fluency and the Neural Mechanisms of Illusory Truth.,"Wang WC, Brashier NM, Wing EA, Marsh EJ, Cabeza R",Journal of cognitive neuroscience,0.067,26765947,-1,-1
behavioral_00646,https://pubmed.ncbi.nlm.nih.gov/29845006/,Decreased functional connectivity in the fronto-parietal network in children with mood disorders compared to children with dyslexia during rest: An fMRI study.,"Horowitz-Kraus T, Woodburn M, Rajagopal A, Versace AL, Kowatch RA, Bertocci MA, Bebko G, Almeida JRC, Perlman SB, Travis MJ, Gill MK, Bonar L, Schirda C, Diwadkar VA, Sunshine JL, Birmaher B, Axelson D, Gerry Taylor H, Horwitz SM, Frazier T, Eugene Arnold L, Fristad MA, Youngstrom EA, Findling RL, Phillips ML, Holland SK",NeuroImage. Clinical,0.067,29845006,-1,-1
behavioral_00647,https://pubmed.ncbi.nlm.nih.gov/15704151/,Gender differences in the functional neuroanatomy of emotional episodic autobiographical memory.,"Piefke M, Weiss PH, Markowitsch HJ, Fink GR",Human brain mapping,0.066,15704151,-1,-1
behavioral_00648,https://pubmed.ncbi.nlm.nih.gov/19781648/,Unconsciously deciphering handwriting: subliminal invariance for handwritten words in the visual word form area.,"Qiao E, Vinckier F, Szwed M, Naccache L, Valabregue R, Dehaene S, Cohen L",NeuroImage,0.066,19781648,-1,-1
behavioral_00649,https://pubmed.ncbi.nlm.nih.gov/20600178/,Framing effects: behavioral dynamics and neural basis.,"Zheng H, Wang XT, Zhu L",Neuropsychologia,0.066,20600178,-1,-1
behavioral_00650,https://pubmed.ncbi.nlm.nih.gov/21795556/,Focusing attention on the health aspects of foods changes value signals in vmPFC  and improves dietary choice.,"Hare TA, Malmaud J, Rangel A",The Journal of neuroscience : the official journal of the Society for Neuroscience,0.066,21795556,-1,-1
behavioral_00651,https://pubmed.ncbi.nlm.nih.gov/21799729/,Activation in a frontoparietal cortical network underlies individual differences  in the performance of an embedded figures task.,"Walter E, Dassonville P",PloS one,0.066,21799729,-1,-1
behavioral_00652,https://pubmed.ncbi.nlm.nih.gov/22557953/,Influence of cue exposure on inhibitory control and brain activation in patients  with alcohol dependence.,"Mainz V, Druke B, Boecker M, Kessel R, Gauggel S, Forkmann T",Frontiers in human neuroscience,0.066,22557953,10.3389/fnhum.2012.00092,-1
behavioral_00653,https://pubmed.ncbi.nlm.nih.gov/23859650/,Rejection sensitivity polarizes striatal-medial prefrontal activity when anticipating social feedback.,"Powers KE, Somerville LH, Kelley WM, Heatherton TF",Journal of cognitive neuroscience,0.066,23859650,10.1162/jocn_a_00446,-1
behavioral_00654,https://pubmed.ncbi.nlm.nih.gov/24038570/,Effect of baseline cannabis use and working-memory network function on changes in cannabis use in heavy cannabis users: a prospective fMRI study.,"Cousijn J, Wiers RW, Ridderinkhof KR, van den Brink W, Veltman DJ, Goudriaan AE",Human brain mapping,0.066,24038570,-1,-1
behavioral_00655,https://pubmed.ncbi.nlm.nih.gov/24137106/,Differences in neural activation as a function of risk-taking task parameters.,"Congdon E, Bato AA, Schonberg T, Mumford JA, Karlsgodt KH, Sabb FW, London ED, Cannon TD, Bilder RM, Poldrack RA",Frontiers in neuroscience,0.066,24137106,-1,-1
behavioral_00656,https://pubmed.ncbi.nlm.nih.gov/24340037/,The neural circuitry of reward processing in complex social comparison: evidence  from an event-related FMRI study.,"Du X, Zhang M, Wei D, Li W, Zhang Q, Qiu J",PloS one,0.066,24340037,-1,-1
behavioral_00657,https://pubmed.ncbi.nlm.nih.gov/25058010/,Brain bases of reading fluency in typical reading and impaired fluency in dyslexia.,"Christodoulou JA, Del Tufo SN, Lymberis J, Saxler PK, Ghosh SS, Triantafyllou C, Whitfield-Gabrieli S, Gabrieli JD",PloS one,0.066,25058010,-1,-1
