paper_name,paper_url,Title,Author,Journal,Loading,PMID,Doi,download_status
bipolar_00084,https://pubmed.ncbi.nlm.nih.gov/22438288/,Interaction between effects of genes coding for dopamine and glutamate transmission on striatal and parahippocampal function.,"Pauli A, Prata DP, Mechelli A, Picchioni M, Fu CH, Chaddock CA, Kane F, Kalidindi S, McDonald C, Kravariti E, Toulopoulou T, Bramon E, Walshe M, Ehlert N, Georgiades A, Murray R, Collier DA, McGuire P",Human brain mapping,0.116,22438288,-1,-1
bipolar_00085,https://pubmed.ncbi.nlm.nih.gov/25307723/,Functional connectivity and neuronal variability of resting state activity in bipolar disorder-reduction and decoupling in anterior cortical midline structures.,"Magioncalda P, Martino M, Conio B, Escelsior A, Piaggio N, Presta A, Marozzi V, Rocchi G, Anastasio L, Vassallo L, Ferri F, Huang Z, Roccatagliata L, Pardini M, Northoff G, Amore M",Human brain mapping,0.115,25307723,-1,-1
bipolar_00086,https://pubmed.ncbi.nlm.nih.gov/27090803/,Effects of childhood trauma on working memory in affective and non-affective psychotic disorders.,"Quide Y, O'Reilly N, Rowland JE, Carr VJ, Elzinga BM, Green MJ",Brain imaging and behavior,0.115,27090803,-1,-1
bipolar_00087,https://pubmed.ncbi.nlm.nih.gov/28169089/,Meta-analysis of functional magnetic resonance imaging studies of timing and cognitive control in schizophrenia and bipolar disorder: Evidence of a primary time deficit.,"Alustiza I, Radua J, Pla M, Martin R, Ortuno F",Schizophrenia research,0.114,28169089,-1,-1
bipolar_00088,https://pubmed.ncbi.nlm.nih.gov/27792964/,Increased cerebral blood flow among adolescents with bipolar disorder at rest is  reduced following acute aerobic exercise.,"MacIntosh BJ, Shirzadi Z, Scavone A, Metcalfe AW, Islam AH, Korczak D, Goldstein BI",Journal of affective disorders,0.111,27792964,-1,-1
bipolar_00089,https://pubmed.ncbi.nlm.nih.gov/27814962/,Neural complexity as a potential translational biomarker for psychosis.,"Hager B, Yang AC, Brady R, Meda S, Clementz B, Pearlson GD, Sweeney JA, Tamminga C, Keshavan M",Journal of affective disorders,0.109,27814962,-1,-1
bipolar_00090,https://pubmed.ncbi.nlm.nih.gov/23146251/,Structural brain features of borderline personality and bipolar disorders.,"Rossi R, Pievani M, Lorenzi M, Boccardi M, Beneduce R, Bignotti S, Borsci G, Cotelli M, Giannakopoulos P, Magni LR, Rillosi L, Rosini S, Rossi G, Frisoni GB",Psychiatry research,0.108,23146251,-1,-1
bipolar_00091,https://pubmed.ncbi.nlm.nih.gov/28668591/,Alteration of cortico-limbic-striatal neural system in major depressive disorder  and bipolar disorder.,"Jiang X, Dai X, Kale Edmiston E, Zhou Q, Xu K, Zhou Y, Wu F, Kong L, Wei S, Zhou Y, Chang M, Geng H, Wang D, Wang Y, Cui W, Wang F, Tang Y",Journal of affective disorders,0.108,28668591,-1,-1
bipolar_00092,https://pubmed.ncbi.nlm.nih.gov/23860750/,A genome-wide supported variant in CACNA1C influences hippocampal activation during episodic memory encoding and retrieval.,"Krug A, Witt SH, Backes H, Dietsche B, Nieratschker V, Shah NJ, Nothen MM, Rietschel M, Kircher T",European archives of psychiatry and clinical neuroscience,0.106,23860750,-1,-1
bipolar_00093,https://pubmed.ncbi.nlm.nih.gov/28199893/,Decreased Cingulate Cortex activation during cognitive control processing in bipolar disorder.,"Gruber SA, Dahlgren MK, Sagar KA, Gonenc A, Norris L, Cohen BM, Ongur D, Lewandowski KE",Journal of affective disorders,0.106,28199893,-1,-1
bipolar_00094,https://pubmed.ncbi.nlm.nih.gov/29748770/,A systematic review of associations between functional MRI activity and polygenic risk for schizophrenia and bipolar disorder.,"Dezhina Z, Ranlund S, Kyriakopoulos M, Williams SCR, Dima D",Brain imaging and behavior,0.106,29748770,-1,-1
bipolar_00095,https://pubmed.ncbi.nlm.nih.gov/21050725/,Trait and state dependent functional impairments in bipolar disorder.,"Van der Schot A, Kahn R, Ramsey N, Nolen W, Vink M",Psychiatry research,0.102,21050725,-1,-1
bipolar_00096,https://pubmed.ncbi.nlm.nih.gov/19419772/,Prefrontal-temporal gray matter deficits in bipolar disorder patients with persecutory delusions.,"Tost H, Ruf M, Schmal C, Schulze TG, Knorr C, Vollmert C, Bosshenz K, Ende G, Meyer-Lindenberg A, Henn FA, Rietschel M",Journal of affective disorders,0.101,19419772,-1,-1
bipolar_00097,https://pubmed.ncbi.nlm.nih.gov/22042765/,Partial support for ZNF804A genotype-dependent alterations in prefrontal connectivity.,"Paulus FM, Krach S, Bedenbender J, Pyka M, Sommer J, Krug A, Knake S, Nothen MM, Witt SH, Rietschel M, Kircher T, Jansen A",Human brain mapping,0.101,22042765,-1,-1
bipolar_00098,https://pubmed.ncbi.nlm.nih.gov/24493839/,Neural response during explicit and implicit face processing varies developmentally in bipolar disorder.,"Deveney CM, Brotman MA, Thomas LA, Hinton KE, Muhrer EM, Reynolds RC, Adleman NE, Zarate CA Jr, Pine DS, Leibenluft E",Social cognitive and affective neuroscience,0.101,24493839,-1,-1
bipolar_00099,https://pubmed.ncbi.nlm.nih.gov/23517886/,"Time course of recovery showing initial prefrontal cortex changes at 16 weeks, extending to subcortical changes by 3 years in pediatric bipolar disorder.","Yang H, Lu LH, Wu M, Stevens M, Wegbreit E, Fitzgerald J, Levitan B, Shankman S, Pavuluri MN",Journal of affective disorders,0.1,23517886,-1,-1
bipolar_00100,https://pubmed.ncbi.nlm.nih.gov/23526961/,Altered regional homogeneity in pediatric bipolar disorder during manic state: a  resting-state fMRI study.,"Xiao Q, Zhong Y, Lu D, Gao W, Jiao Q, Lu G, Su L",PloS one,0.1,23526961,-1,-1
bipolar_00101,https://pubmed.ncbi.nlm.nih.gov/25282143/,Identification of the neural correlates of cyclothymic temperament using a working memory task in fMRI.,"Kodama K, Terao T, Hatano K, Kohno K, Makino M, Mizokami Y, Kamei K, Katayama Y, Hoaki Y, Sakai A, Shirahama M, Watanabe S, Shimomura T, Fujiki M, Kochiyama T",Journal of affective disorders,0.1,25282143,10.1016/j.jad.2014.09.009,-1
bipolar_00102,https://pubmed.ncbi.nlm.nih.gov/16310510/,Blunted activation in orbitofrontal cortex during mania: a functional magnetic resonance imaging study.,"Altshuler LL, Bookheimer SY, Townsend J, Proenza MA, Eisenberger N, Sabb F, Mintz J, Cohen MS",Biological psychiatry,0.097,16310510,10.1016/j.biopsych.2005.09.012,-1
bipolar_00103,https://pubmed.ncbi.nlm.nih.gov/23437284/,"CACNA1C risk variant and amygdala activity in bipolar disorder, schizophrenia and healthy controls.","Tesli M, Skatun KC, Ousdal OT, Brown AA, Thoresen C, Agartz I, Melle I, Djurovic S, Jensen J, Andreassen OA",PloS one,0.097,23437284,10.1371/journal.pone.0056970,-1
bipolar_00104,https://pubmed.ncbi.nlm.nih.gov/26222050/,Altered Brain Activation during Emotional Face Processing in Relation to Both Diagnosis and Polygenic Risk of Bipolar Disorder.,"Tesli M, Kauppi K, Bettella F, Brandt CL, Kaufmann T, Espeseth T, Mattingsdal M, Agartz I, Melle I, Djurovic S, Westlye LT, Andreassen OA",PloS one,0.097,26222050,-1,-1
bipolar_00105,https://pubmed.ncbi.nlm.nih.gov/23510545/,Working memory in recurrent brief depression: an fMRI pilot study.,"Korsnes MS, Lovdahl H, Andersson S, Bjornerud A, Due-Tonnesen P, Endestad T, Malt UF",Journal of affective disorders,0.096,23510545,-1,-1
bipolar_00106,https://pubmed.ncbi.nlm.nih.gov/11430841/,"Are child-, adolescent-, and adult-onset depression one and the same disorder?","Kaufman J, Martin A, King RA, Charney D",Biological psychiatry,0.095,11430841,-1,-1
bipolar_00107,https://pubmed.ncbi.nlm.nih.gov/20739018/,Fronto-temporal spontaneous resting state functional connectivity in pediatric bipolar disorder.,"Dickstein DP, Gorrostieta C, Ombao H, Goldberg LD, Brazel AC, Gable CJ, Kelly C, Gee DG, Zuo XN, Castellanos FX, Milham MP",Biological psychiatry,0.095,20739018,-1,-1
bipolar_00108,https://pubmed.ncbi.nlm.nih.gov/24793833/,Bipolar and borderline patients display differential patterns of functional connectivity among resting state networks.,"Das P, Calhoun V, Malhi GS",NeuroImage,0.095,24793833,-1,-1
bipolar_00109,https://pubmed.ncbi.nlm.nih.gov/20336655/,Genetic variation in G72 correlates with brain activation in the right middle temporal gyrus in a verbal fluency task in healthy individuals.,"Krug A, Markov V, Krach S, Jansen A, Zerres K, Eggermann T, Stocker T, Shah NJ, Nothen MM, Georgi A, Strohmaier J, Rietschel M, Kircher T",Human brain mapping,0.093,20336655,-1,-1
bipolar_00110,https://pubmed.ncbi.nlm.nih.gov/23920122/,Prediction of antidepressant treatment response from gray matter volume across diagnostic categories.,"Samann PG, Hohn D, Chechko N, Kloiber S, Lucae S, Ising M, Holsboer F, Czisch M",European neuropsychopharmacology : the journal of the European College of Neuropsychopharmacology,0.093,23920122,-1,-1
bipolar_00111,https://pubmed.ncbi.nlm.nih.gov/24388670/,Anhedonia and Reward-Circuit Connectivity Distinguish Nonresponders from Responders to Dorsomedial Prefrontal Repetitive Transcranial Magnetic Stimulation in Major Depression.,"Downar J, Geraci J, Salomons TV, Dunlop K, Wheeler S, McAndrews MP, Bakker N, Blumberger DM, Daskalakis ZJ, Kennedy SH, Flint AJ, Giacobbe P",Biological psychiatry,0.093,24388670,-1,-1
bipolar_00112,https://pubmed.ncbi.nlm.nih.gov/25942576/,Altered effective connectivity model in the default mode network between bipolar  and unipolar depression based on resting-state fMRI.,"Liu Y, Wu X, Zhang J, Guo X, Long Z, Yao L",Journal of affective disorders,0.093,25942576,-1,-1
bipolar_00113,https://pubmed.ncbi.nlm.nih.gov/28031150/,Functional Dysconnection of the Inferior Frontal Gyrus in Young People With Bipolar Disorder or at Genetic High Risk.,"Roberts G, Lord A, Frankland A, Wright A, Lau P, Levy F, Lenroot RK, Mitchell PB, Breakspear M",Biological psychiatry,0.093,28031150,-1,-1
bipolar_00114,https://pubmed.ncbi.nlm.nih.gov/19449332/,Genetic variation in neuregulin1 is associated with differences in prefrontal engagement in children.,"Mechelli A, Viding E, Pettersson-Yeo W, Tognin S, McGuire PK",Human brain mapping,0.092,19449332,-1,-1
bipolar_00115,https://pubmed.ncbi.nlm.nih.gov/16823591/,Effect of acute tryptophan depletion on pre-frontal engagement.,"Allen PP, Cleare AJ, Lee F, Fusar-Poli P, Tunstall N, Fu CH, Brammer MJ, McGuire PK",Psychopharmacology,0.091,16823591,-1,-1
bipolar_00116,https://pubmed.ncbi.nlm.nih.gov/17265148/,"Human reward system activation is modulated by a single dose of olanzapine in healthy subjects in an event-related, double-blind, placebo-controlled fMRI study.","Abler B, Erk S, Walter H",Psychopharmacology,0.091,17265148,-1,-1
bipolar_00117,https://pubmed.ncbi.nlm.nih.gov/26551408/,Resting-state functional network connectivity in prefrontal regions differs between unmedicated patients with bipolar and major depressive disorders.,"He H, Yu Q, Du Y, Vergara V, Victor TA, Drevets WC, Savitz JB, Jiang T, Sui J, Calhoun VD",Journal of affective disorders,0.09,26551408,-1,-1
bipolar_00118,https://pubmed.ncbi.nlm.nih.gov/22004983/,Pharmacotherapy impacts functional connectivity among affective circuits during response inhibition in pediatric mania.,"Pavuluri MN, Ellis JA, Wegbreit E, Passarotti AM, Stevens MC",Behavioural brain research,0.089,22004983,-1,-1
bipolar_00119,https://pubmed.ncbi.nlm.nih.gov/24080517/,Neural activity to intense positive versus negative stimuli can help differentiate bipolar disorder from unipolar major depressive disorder in depressed adolescents: a pilot fMRI study.,"Diler RS, de Almeida JR, Ladouceur C, Birmaher B, Axelson D, Phillips M",Psychiatry research,0.089,24080517,-1,-1
bipolar_00120,https://pubmed.ncbi.nlm.nih.gov/25631056/,The Brain Basis of Positive and Negative Affect: Evidence from a Meta-Analysis of the Human Neuroimaging Literature.,"Lindquist KA, Satpute AB, Wager TD, Weber J, Barrett LF","Cerebral cortex (New York, N.Y. : 1991)",0.089,25631056,-1,-1
bipolar_00121,https://pubmed.ncbi.nlm.nih.gov/29156364/,Pattern recognition of magnetic resonance imaging-based gray matter volume measurements classifies bipolar disorder and major depressive disorder.,"Rubin-Falcone H, Zanderigo F, Thapa-Chhetry B, Lan M, Miller JM, Sublette ME, Oquendo MA, Hellerstein DJ, McGrath PJ, Stewart JW, Mann JJ",Journal of affective disorders,0.089,29156364,10.1016/j.jad.2017.11.043,-1
bipolar_00122,https://pubmed.ncbi.nlm.nih.gov/25744101/,ERBB4 polymorphism and family history of psychiatric disorders on age-related cortical changes in healthy children.,"Douet V, Chang L, Lee K, Ernst T",Brain imaging and behavior,0.088,25744101,10.1007/s11682-015-9363-y,-1
bipolar_00123,https://pubmed.ncbi.nlm.nih.gov/27114896/,Age associations with neural processing of reward anticipation in adolescents with bipolar disorders.,"Urosevic S, Luciana M, Jensen JB, Youngstrom EA, Thomas KM",NeuroImage. Clinical,0.088,27114896,10.1016/j.nicl.2016.03.013,-1
bipolar_00124,https://pubmed.ncbi.nlm.nih.gov/28558364/,Structural and functional correlates of serum soluble IL-6 receptor level in patients with bipolar disorder.,"Tu PC, Li CT, Lin WC, Chen MH, Su TP, Bai YM",Journal of affective disorders,0.088,28558364,-1,-1
bipolar_00125,https://pubmed.ncbi.nlm.nih.gov/21570470/,"Dissociable functional connectivity changes during the Stroop task relating to risk, resilience and disease expression in bipolar disorder.","Pompei F, Dima D, Rubia K, Kumari V, Frangou S",NeuroImage,0.087,21570470,-1,-1
bipolar_00126,https://pubmed.ncbi.nlm.nih.gov/23958598/,A developmental study on the neural circuitry mediating response flexibility in bipolar disorder.,"Weathers J, Brotman MA, Deveney CM, Kim P, Zarate C Jr, Fromm S, Pine D, Leibenluft E",Psychiatry research,0.087,23958598,-1,-1
bipolar_00127,https://pubmed.ncbi.nlm.nih.gov/23017873/,Abnormal baseline brain activity in bipolar depression: a resting state functional magnetic resonance imaging study.,"Liu CH, Li F, Li SF, Wang YJ, Tie CL, Wu HY, Zhou Z, Zhang D, Dong J, Yang Z, Wang CY",Psychiatry research,0.084,23017873,-1,-1
bipolar_00128,https://pubmed.ncbi.nlm.nih.gov/23355265/,Neural correlates of treatment response in depressed bipolar adolescents during emotion processing.,"Diler RS, Ladouceur CD, Segreti A, Almeida JR, Birmaher B, Axelson DA, Phillips ML, Pan LA",Brain imaging and behavior,0.084,23355265,-1,-1
bipolar_00129,https://pubmed.ncbi.nlm.nih.gov/29466722/,Shared and distinct regional homogeneity changes in bipolar and unipolar depression.,"Yao X, Yin Z, Liu F, Wei S, Zhou Y, Jiang X, Wei Y, Xu K, Wang F, Tang Y",Neuroscience letters,0.083,29466722,-1,-1
bipolar_00130,https://pubmed.ncbi.nlm.nih.gov/28275544/,Polygenic risk for five psychiatric disorders and cross-disorder and disorder-specific neural connectivity in two independent populations.,"Wang T, Zhang X, Li A, Zhu M, Liu S, Qin W, Li J, Yu C, Jiang T, Liu B",NeuroImage. Clinical,0.082,28275544,-1,-1
bipolar_00131,https://pubmed.ncbi.nlm.nih.gov/24324588/,Identify changes of brain regional homogeneity in bipolar disorder and unipolar depression using resting-state FMRI.,"Liang MJ, Zhou Q, Yang KR, Yang XL, Fang J, Chen WL, Huang Z",PloS one,0.081,24324588,-1,-1
bipolar_00132,https://pubmed.ncbi.nlm.nih.gov/19926457/,Neural correlates of response inhibition in pediatric bipolar disorder and attention deficit hyperactivity disorder.,"Passarotti AM, Sweeney JA, Pavuluri MN",Psychiatry research,0.08,19926457,-1,-1
bipolar_00133,https://pubmed.ncbi.nlm.nih.gov/28772145/,Lithium monotherapy associated clinical improvement effects on amygdala-ventromedial prefrontal cortex resting state connectivity in bipolar disorder.,"Altinay M, Karne H, Anand A",Journal of affective disorders,0.08,28772145,-1,-1
bipolar_00134,https://pubmed.ncbi.nlm.nih.gov/27940151/,Neural correlates of the affective properties of spontaneous and volitional laughter types.,"Lavan N, Rankin G, Lorking N, Scott S, McGettigan C",Neuropsychologia,0.078,27940151,-1,-1
bipolar_00135,https://pubmed.ncbi.nlm.nih.gov/20696256/,Manifestation of ocular-muscle EMG contamination in human intracranial recordings.,"Kovach CK, Tsuchiya N, Kawasaki H, Oya H, Howard MA 3rd, Adolphs R",NeuroImage,0.077,20696256,-1,-1
bipolar_00136,https://pubmed.ncbi.nlm.nih.gov/22818781/,Brain structural signature of familial predisposition for bipolar disorder: replicable evidence for involvement of the right inferior frontal gyrus.,"Hajek T, Cullis J, Novak T, Kopecek M, Blagdon R, Propper L, Stopkova P, Duffy A, Hoschl C, Uher R, Paus T, Young LT, Alda M",Biological psychiatry,0.077,22818781,-1,-1
bipolar_00137,https://pubmed.ncbi.nlm.nih.gov/28558365/,Reward anticipation revisited- evidence from an fMRI study in euthymic bipolar I  patients and healthy first-degree relatives.,"Kollmann B, Scholz V, Linke J, Kirsch P, Wessa M",Journal of affective disorders,0.077,28558365,-1,-1
bipolar_00138,https://pubmed.ncbi.nlm.nih.gov/27837919/,Behavioral and Neural Sustained Attention Deficits in Bipolar Disorder and Familial Risk of Bipolar Disorder.,"Pagliaccio D, Wiggins JL, Adleman NE, Harkins E, Curhan A, Towbin KE, Brotman MA, Pine DS, Leibenluft E",Biological psychiatry,0.076,27837919,-1,-1
bipolar_00139,https://pubmed.ncbi.nlm.nih.gov/21390505/,Fronto-limbic dysfunction in mania pre-treatment and persistent amygdala over-activity post-treatment in pediatric bipolar disorder.,"Passarotti AM, Sweeney JA, Pavuluri MN",Psychopharmacology,0.075,21390505,-1,-1
bipolar_00140,https://pubmed.ncbi.nlm.nih.gov/29136642/,"Common and distinct structural features of schizophrenia and bipolar disorder: The European Network on Psychosis, Affective disorders and Cognitive Trajectory (ENPACT) study.","Maggioni E, Crespo-Facorro B, Nenadic I, Benedetti F, Gaser C, Sauer H, Roiz-Santianez R, Poletti S, Marinelli V, Bellani M, Perlini C, Ruggeri M, Altamura AC, Diwadkar VA, Brambilla P",PloS one,0.075,29136642,-1,-1
bipolar_00141,https://pubmed.ncbi.nlm.nih.gov/22985694/,Impairment in semantic retrieval is associated with symptoms in schizophrenia but not bipolar disorder.,"Jamadar S, O'Neil KM, Pearlson GD, Ansari M, Gill A, Jagannathan K, Assaf M",Biological psychiatry,0.073,22985694,10.1016/j.biopsych.2012.07.027,-1
bipolar_00142,https://pubmed.ncbi.nlm.nih.gov/26363618/,Control-related frontal-striatal function is associated with past suicidal ideation and behavior in patients with recent-onset psychotic major mood disorders.,"Minzenberg MJ, Lesh TA, Niendam TA, Yoon JH, Cheng Y, Rhoades RN, Carter CS",Journal of affective disorders,0.073,26363618,10.1016/j.jad.2015.08.049,-1
bipolar_00143,https://pubmed.ncbi.nlm.nih.gov/23185566/,Corticolimbic functional connectivity in adolescents with bipolar disorder.,"Wang F, Bobrow L, Liu J, Spencer L, Blumberg HP",PloS one,0.072,23185566,-1,-1
bipolar_00144,https://pubmed.ncbi.nlm.nih.gov/23261134/,"Where, when, how high, and how long? The hemodynamics of emotional response in psychotropic-naive patients with adolescent bipolar disorder.","Wegbreit E, Passarotti AM, Ellis JA, Wu M, Witowski N, Fitzgerald JM, Stevens MC, Pavuluri MN",Journal of affective disorders,0.072,23261134,-1,-1
bipolar_00145,https://pubmed.ncbi.nlm.nih.gov/26216278/,"A group ICA based framework for evaluating resting fMRI markers when disease categories are unclear: application to schizophrenia, bipolar, and schizoaffective disorders.","Du Y, Pearlson GD, Liu J, Sui J, Yu Q, He H, Castro E, Calhoun VD",NeuroImage,0.071,26216278,-1,-1
bipolar_00146,https://pubmed.ncbi.nlm.nih.gov/27693668/,Altered functional connectivity during self- and close other-reflection in patients with bipolar disorder with past psychosis and patients with schizophrenia.,"Zhang L, Vander Meer L, Opmeer EM, Marsman JC, Ruhe HG, Aleman A",Neuropsychologia,0.07,27693668,-1,-1
bipolar_00147,https://pubmed.ncbi.nlm.nih.gov/25433424/,Decreased amygdala-insula resting state connectivity in behaviorally and emotionally dysregulated youth.,"Bebko G, Bertocci M, Chase H, Dwojak A, Bonar L, Almeida J, Perlman SB, Versace A, Schirda C, Travis M, Gill MK, Demeter C, Diwadkar V, Sunshine J, Holland S, Kowatch R, Birmaher B, Axelson D, Horwitz S, Frazier T, Arnold LE, Fristad M, Youngstrom E, Findling R, Phillips ML",Psychiatry research,0.069,25433424,-1,-1
bipolar_00148,https://pubmed.ncbi.nlm.nih.gov/27280965/,Alterations in regional homogeneity of resting-state brain activity in patients with major depressive disorder screening positive on the 32-item hypomania checklist (HCL-32).,"Yang H, Li L, Peng H, Liu T, Young AH, Angst J, Ye R, Rong H, Ji E, Qiu Y, Li L",Journal of affective disorders,0.069,27280965,-1,-1
bipolar_00149,https://pubmed.ncbi.nlm.nih.gov/27756046/,Amygdala-prefrontal cortical functional connectivity during implicit emotion processing differentiates youth with bipolar spectrum from youth with externalizing disorders.,"Hafeman D, Bebko G, Bertocci MA, Fournier JC, Chase HW, Bonar L, Perlman SB, Travis M, Gill MK, Diwadkar VA, Sunshine JL, Holland SK, Kowatch RA, Birmaher B, Axelson D, Horwitz SM, Arnold LE, Fristad MA, Frazier TW, Youngstrom EA, Findling RL, Phillips ML",Journal of affective disorders,0.069,27756046,-1,-1
bipolar_00150,https://pubmed.ncbi.nlm.nih.gov/24941232/,Whole brain expression of bipolar disorder associated genes: structural and genetic analyses.,"McCarthy MJ, Liang S, Spadoni AD, Kelsoe JR, Simmons AN",PloS one,0.067,24941232,-1,-1
bipolar_00151,https://pubmed.ncbi.nlm.nih.gov/29223329/,The impact of psychosis on brain anatomy in bipolar disorder: A structural MRI study.,"Altamura AC, Maggioni E, Dhanoa T, Ciappolino V, Paoli RA, Cremaschi L, Prunas C, Orsenigo G, Caletti E, Cinnante CM, Triulzi FM, Dell'Osso B, Yatham L, Brambilla P",Journal of affective disorders,0.067,29223329,-1,-1
bipolar_00152,https://pubmed.ncbi.nlm.nih.gov/28667891/,Anomalous prefrontal-limbic activation and connectivity in youth at high-risk for bipolar disorder.,"Chang K, Garrett A, Kelley R, Howe M, Sanders EM, Acquaye T, Bararpour L, Li S, Singh M, Jo B, Hallmayer J, Reiss A",Journal of affective disorders,0.065,28667891,-1,-1
bipolar_00153,https://pubmed.ncbi.nlm.nih.gov/23769608/,Posterior cerebellar vermal deficits in bipolar disorder.,"Kim D, Cho HB, Dager SR, Yurgelun-Todd DA, Yoon S, Lee JH, Lee SH, Lee S, Renshaw PF, Lyoo IK",Journal of affective disorders,0.064,23769608,-1,-1
bipolar_00154,https://pubmed.ncbi.nlm.nih.gov/27118088/,Classification of schizophrenia and bipolar patients using static and dynamic resting-state fMRI brain connectivity.,"Rashid B, Arbabshirani MR, Damaraju E, Cetin MS, Miller R, Pearlson GD, Calhoun VD",NeuroImage,0.062,27118088,-1,-1
bipolar_00155,https://pubmed.ncbi.nlm.nih.gov/27442458/,"Preliminary investigation of the relationships between sleep duration, reward circuitry function, and mood dysregulation in youth offspring of parents with bipolar disorder.","Soehner AM, Bertocci MA, Manelis A, Bebko G, Ladouceur CD, Graur S, Monk K, Bonar LK, Hickey MB, Axelson D, Goldstein BI, Goldstein TR, Birmaher B, Phillips ML",Journal of affective disorders,0.061,27442458,-1,-1
bipolar_00156,https://pubmed.ncbi.nlm.nih.gov/29751242/,"Local functional connectivity alterations in schizophrenia, bipolar disorder, and major depressive disorder.","Wei Y, Chang M, Womer FY, Zhou Q, Yin Z, Wei S, Zhou Y, Jiang X, Yao X, Duan J, Xu K, Zuo XN, Tang Y, Wang F",Journal of affective disorders,0.061,29751242,-1,-1
bipolar_00157,https://pubmed.ncbi.nlm.nih.gov/18586109/,Neural basis of abnormal response to negative feedback in unmedicated mood disorders.,"Taylor Tavares JV, Clark L, Furey ML, Williams GB, Sahakian BJ, Drevets WC",NeuroImage,0.06,18586109,-1,-1
