paper_name,paper_url,Title,Author,Journal,Loading,PMID,Doi,download_status
corpus_00089,https://pubmed.ncbi.nlm.nih.gov/24683509/,White matter integrity is associated with alcohol cue reactivity in heavy drinkers.,"Monnig MA, Thayer RE, Caprihan A, Claus ED, Yeo RA, Calhoun VD, Hutchison KE",Brain and behavior,0.078,24683509,-1,-1
corpus_00090,https://pubmed.ncbi.nlm.nih.gov/24788587/,Frontal White Matter Alterations in Short-Term Medicated Panic Disorder Patients  without Comorbid Conditions: A Diffusion Tensor Imaging Study.,"Kim B, Kim JH, Kim MK, Lee KS, Kim Y, Choi TK, Kim YT, Lee SH",PloS one,0.077,24788587,-1,-1
corpus_00091,https://pubmed.ncbi.nlm.nih.gov/18804539/,Long-term global and regional brain volume changes following severe traumatic brain injury: a longitudinal study with clinical correlates.,"Sidaros A, Skimminge A, Liptrot MG, Sidaros K, Engberg AW, Herning M, Paulson OB, Jernigan TL, Rostrup E",NeuroImage,0.076,18804539,-1,-1
corpus_00092,https://pubmed.ncbi.nlm.nih.gov/16843445/,Temporal changes in neural activation during practice of information retrieval from short-term memory: an fMRI study.,"Koch K, Wagner G, von Consbruch K, Nenadic I, Schultz C, Ehle C, Reichenbach J, Sauer H, Schlosser R",Brain research,0.075,16843445,-1,-1
corpus_00093,https://pubmed.ncbi.nlm.nih.gov/20595067/,White matter integrity in mild cognitive impairment: a tract-based spatial statistics study.,"Zhuang L, Wen W, Zhu W, Trollor J, Kochan N, Crawford J, Reppermund S, Brodaty H, Sachdev P",NeuroImage,0.073,20595067,-1,-1
corpus_00094,https://pubmed.ncbi.nlm.nih.gov/19349151/,Converging evidence for abnormalities of the prefrontal cortex and evaluation of  midsagittal structures in pediatric posttraumatic stress disorder: an MRI study.,"Carrion VG, Weems CF, Watson C, Eliez S, Menon V, Reiss AL",Psychiatry research,0.071,19349151,-1,-1
corpus_00095,https://pubmed.ncbi.nlm.nih.gov/20943668/,Decreased interhemispheric functional connectivity in autism.,"Anderson JS, Druzgal TJ, Froehlich A, DuBray MB, Lange N, Alexander AL, Abildskov T, Nielsen JA, Cariello AN, Cooperrider JR, Bigler ED, Lainhart JE","Cerebral cortex (New York, N.Y. : 1991)",0.07,20943668,-1,-1
corpus_00096,https://pubmed.ncbi.nlm.nih.gov/24480476/,Functional MR imaging of a simulated balance task.,"Karim HT, Sparto PJ, Aizenstein HJ, Furman JM, Huppert TJ, Erickson KI, Loughlin PJ",Brain research,0.07,24480476,-1,-1
corpus_00097,https://pubmed.ncbi.nlm.nih.gov/25560665/,White matter abnormalities of microstructure and physiological noise in schizophrenia.,"Cheng H, Newman SD, Kent JS, Bolbecker A, Klaunig MJ, O'Donnell BF, Puce A, Hetrick WP",Brain imaging and behavior,0.07,25560665,-1,-1
corpus_00098,https://pubmed.ncbi.nlm.nih.gov/14607785/,Diffusion tensor MRI of early upper motor neuron involvement in amyotrophic lateral sclerosis.,"Sach M, Winkler G, Glauche V, Liepert J, Heimbach B, Koch MA, Buchel C, Weiller C",Brain : a journal of neurology,0.069,14607785,-1,-1
corpus_00099,https://pubmed.ncbi.nlm.nih.gov/21071387/,Multispectral brain morphometry in Tourette syndrome persisting into adulthood.,"Draganski B, Martino D, Cavanna AE, Hutton C, Orth M, Robertson MM, Critchley HD, Frackowiak RS",Brain : a journal of neurology,0.069,21071387,-1,-1
corpus_00100,https://pubmed.ncbi.nlm.nih.gov/18992825/,Joint source based morphometry identifies linked gray and white matter group differences.,"Xu L, Pearlson G, Calhoun VD",NeuroImage,0.064,18992825,-1,-1
corpus_00101,https://pubmed.ncbi.nlm.nih.gov/15795138/,Neuroimaging of marijuana smokers during inhibitory processing: a pilot investigation.,"Gruber SA, Yurgelun-Todd DA",Brain research. Cognitive brain research,0.062,15795138,10.1016/j.cogbrainres.2005.02.016,-1
corpus_00102,https://pubmed.ncbi.nlm.nih.gov/26679527/,"Neuroanatomical anomalies of dyslexia: Disambiguating the effects of disorder, performance, and maturation.","Xia Z, Hoeft F, Zhang L, Shu H",Neuropsychologia,0.062,26679527,10.1016/j.neuropsychologia.2015.12.003,-1
corpus_00103,https://pubmed.ncbi.nlm.nih.gov/23097273/,Brain connectivity abnormalities extend beyond the sensorimotor network in peripheral neuropathy.,"Rocca MA, Valsasina P, Fazio R, Previtali SC, Messina R, Falini A, Comi G, Filippi M",Human brain mapping,0.061,23097273,10.1002/hbm.22198,-1
corpus_00104,https://pubmed.ncbi.nlm.nih.gov/24349280/,Disconnection mechanism and regional cortical atrophy contribute to impaired processing of facial expressions and theory of mind in multiple sclerosis: a structural MRI study.,"Mike A, Strammer E, Aradi M, Orsi G, Perlaki G, Hajnal A, Sandor J, Banati M, Illes E, Zaitsev A, Herold R, Guttmann CR, Illes Z",PloS one,0.061,24349280,-1,-1
corpus_00105,https://pubmed.ncbi.nlm.nih.gov/17698497/,Anatomically related grey and white matter abnormalities in adolescent-onset schizophrenia.,"Douaud G, Smith S, Jenkinson M, Behrens T, Johansen-Berg H, Vickers J, James S, Voets N, Watkins K, Matthews PM, James A",Brain : a journal of neurology,0.055,17698497,-1,-1
corpus_00106,https://pubmed.ncbi.nlm.nih.gov/29477442/,An fMRI study of coherent visual motion processing in children and adults.,"Taylor CM, Olulade OA, Luetje MM, Eden GF",NeuroImage,0.051,29477442,-1,-1
