paper_name,paper_url,Title,Author,Journal,Loading,PMID,Doi,download_status
cortex m1_00001,https://pubmed.ncbi.nlm.nih.gov/19072894/,Neural substrates of low-frequency repetitive transcranial magnetic stimulation during movement in healthy subjects and acute stroke patients. A PET study.,"Conchou F, Loubinoux I, Castel-Lacanal E, Le Tinnier A, Gerdelat-Mas A, Faure-Marie N, Gros H, Thalamas C, Calvas F, Berry I, Chollet F, Simonetta Moreau M",Human brain mapping,0.166,19072894,-1,-1
cortex m1_00002,https://pubmed.ncbi.nlm.nih.gov/24828639/,Dose-Dependent Effects of Theta Burst rTMS on Cortical Excitability and Resting-State Connectivity of the Human Motor System.,"Nettekoven C, Volz LJ, Kutscha M, Pool EM, Rehme AK, Eickhoff SB, Fink GR, Grefkes C",The Journal of neuroscience : the official journal of the Society for Neuroscience,0.146,24828639,10.1523/JNEUROSCI.4993-13.2014,-1
cortex m1_00003,https://pubmed.ncbi.nlm.nih.gov/24326095/,Effects of cortical activations on enhancement of handgrip force during teeth clenching: an fMRI study.,"Kawakubo N, Miyamoto JJ, Katsuyama N, Ono T, Honda E, Kurabayashi T, Taira M, Moriyama K",Neuroscience research,0.138,24326095,-1,-1
cortex m1_00004,https://pubmed.ncbi.nlm.nih.gov/24440530/,Re-thinking the role of motor cortex: context-sensitive motor outputs?,"Gandolla M, Ferrante S, Molteni F, Guanziroli E, Frattini T, Martegani A, Ferrigno G, Friston K, Pedrocchi A, Ward NS",NeuroImage,0.128,24440530,-1,-1
cortex m1_00005,https://pubmed.ncbi.nlm.nih.gov/17293127/,Activation of the supplementary motor area (SMA) during voluntary pelvic floor muscle contractions--an fMRI study.,"Kuhtz-Buschbeck JP, van der Horst C, Wolff S, Filippow N, Nabavi A, Jansen O, Braun PM",NeuroImage,0.127,17293127,-1,-1
cortex m1_00006,https://pubmed.ncbi.nlm.nih.gov/17566608/,Age-dependent changes in the neural correlates of force modulation: an fMRI study.,"Ward NS, Swayne OB, Newton JM",Neurobiology of aging,0.117,17566608,-1,-1
cortex m1_00007,https://pubmed.ncbi.nlm.nih.gov/15734349/,CASL fMRI of subcortico-cortical perfusion changes during memory-guided finger sequences.,"Garraux G, Hallett M, Talagala SL",NeuroImage,0.114,15734349,-1,-1
cortex m1_00008,https://pubmed.ncbi.nlm.nih.gov/19200077/,Reorganization of cortical hand representation in congenital hemiplegia.,"Vandermeeren Y, Davare M, Duque J, Olivier E",The European journal of neuroscience,0.113,19200077,-1,-1
cortex m1_00009,https://pubmed.ncbi.nlm.nih.gov/19435709/,Functional neuroanatomy of mirroring during a unimanual force generation task.,"Sehm B, Perez MA, Xu B, Hidler J, Cohen LG","Cerebral cortex (New York, N.Y. : 1991)",0.111,19435709,-1,-1
cortex m1_00010,https://pubmed.ncbi.nlm.nih.gov/25034472/,Evidence-based guidelines on the therapeutic use of repetitive transcranial magnetic stimulation (rTMS).,"Lefaucheur JP, Andre-Obadia N, Antal A, Ayache SS, Baeken C, Benninger DH, Cantello RM, Cincotta M, de Carvalho M, De Ridder D, Devanne H, Di Lazzaro V, Filipovic SR, Hummel FC, Jaaskelainen SK, Kimiskidis VK, Koch G, Langguth B, Nyffeler T, Oliviero A, Padberg F, Poulet E, Rossi S, Rossini PM, Rothwell JC, Schonfeldt-Lecuona C, Siebner HR, Slotema CW, Stagg CJ, Valls-Sole J, Ziemann U, Paulus W, Garcia-Larrea L",Clinical neurophysiology : official journal of the International Federation of Clinical Neurophysiology,0.111,25034472,-1,-1
cortex m1_00011,https://pubmed.ncbi.nlm.nih.gov/12077202/,Brain regions controlling nonsynergistic versus synergistic movement of the digits: a functional magnetic resonance imaging study.,"Ehrsson HH, Kuhtz-Buschbeck JP, Forssberg H",The Journal of neuroscience : the official journal of the Society for Neuroscience,0.109,12077202,-1,-1
cortex m1_00012,https://pubmed.ncbi.nlm.nih.gov/29387003/,Weak but Critical Links between Primary Somatosensory Centers and Motor Cortex during Movement.,"Wei P, Bao R, Lv Z, Jing B",Frontiers in human neuroscience,0.108,29387003,-1,-1
cortex m1_00013,https://pubmed.ncbi.nlm.nih.gov/12427681/,Frontal and parietal lobe activation during transitive inference in humans.,"Acuna BD, Eliassen JC, Donoghue JP, Sanes JN","Cerebral cortex (New York, N.Y. : 1991)",0.107,12427681,-1,-1
cortex m1_00014,https://pubmed.ncbi.nlm.nih.gov/16738254/,The role of multiple contralesional motor areas for complex hand movements after  internal capsular lesion.,"Lotze M, Markert J, Sauseng P, Hoppe J, Plewnia C, Gerloff C",The Journal of neuroscience : the official journal of the Society for Neuroscience,0.107,16738254,-1,-1
cortex m1_00015,https://pubmed.ncbi.nlm.nih.gov/12390981/,Changes of non-affected upper limb cortical representation in paraplegic patients as assessed by fMRI.,"Curt A, Alkadhi H, Crelier GR, Boendermaker SH, Hepp-Reymond MC, Kollias SS",Brain : a journal of neurology,0.106,12390981,-1,-1
cortex m1_00016,https://pubmed.ncbi.nlm.nih.gov/21181786/,Exploring the after-effects of theta burst magnetic stimulation on the human motor cortex: a functional imaging study.,"Cardenas-Morales L, Gron G, Kammer T",Human brain mapping,0.106,21181786,-1,-1
cortex m1_00017,https://pubmed.ncbi.nlm.nih.gov/19309295/,Monitoring coordination during bimanual movements: where is the mastermind?,"Duque J, Davare M, Delaunay L, Jacob B, Saur R, Hummel F, Hermoye L, Rossion B, Olivier E",Journal of cognitive neuroscience,0.104,19309295,-1,-1
cortex m1_00018,https://pubmed.ncbi.nlm.nih.gov/15858053/,Changes in brain activation during the acquisition of a multifrequency bimanual coordination task: from the cognitive stage to advanced levels of automaticity.,"Puttemans V, Wenderoth N, Swinnen SP",The Journal of neuroscience : the official journal of the Society for Neuroscience,0.103,15858053,-1,-1
cortex m1_00019,https://pubmed.ncbi.nlm.nih.gov/25976926/,fMRI and MRS measures of neuroplasticity in the pharyngeal motor cortex.,"Michou E, Williams S, Vidyasagar R, Downey D, Mistry S, Edden RA, Hamdy S",NeuroImage,0.103,25976926,-1,-1
cortex m1_00020,https://pubmed.ncbi.nlm.nih.gov/22441258/,Functional connectivity and laterality of the motor and sensory components in the volitional swallowing network.,"Lowell SY, Reynolds RC, Chen G, Horwitz B, Ludlow CL",Experimental brain research,0.101,22441258,-1,-1
cortex m1_00021,https://pubmed.ncbi.nlm.nih.gov/23770124/,The neural substrates of the warning effect: a functional magnetic resonance imaging study.,"Yoshida Y, Tanabe HC, Hayashi MJ, Kawamichi H, Kochiyama T, Sadato N",Neuroscience research,0.101,23770124,-1,-1
cortex m1_00022,https://pubmed.ncbi.nlm.nih.gov/18086536/,High frequency rTMS modulation of the sensorimotor networks: behavioral changes and fMRI correlates.,"Yoo WK, You SH, Ko MH, Tae Kim S, Park CH, Park JW, Hoon Ohn S, Hallett M, Kim YH",NeuroImage,0.1,18086536,-1,-1
cortex m1_00023,https://pubmed.ncbi.nlm.nih.gov/28180070/,Disrupted functional connectivity of striatal sub-regions in Bell's palsy patients.,"Song W, Cao Z, Lang C, Dai M, Xuan L, Lv K, Cui F, Jorgenson K, Xu M, Kong J",NeuroImage. Clinical,0.1,28180070,-1,-1
cortex m1_00024,https://pubmed.ncbi.nlm.nih.gov/23527247/,High-frequency TRNS reduces BOLD activity during visuomotor learning.,"Saiote C, Polania R, Rosenberger K, Paulus W, Antal A",PloS one,0.099,23527247,-1,-1
cortex m1_00025,https://pubmed.ncbi.nlm.nih.gov/23699528/,Differential effects of dual and unihemispheric motor cortex stimulation in older adults.,"Lindenberg R, Nachtigall L, Meinzer M, Sieg MM, Floel A",The Journal of neuroscience : the official journal of the Society for Neuroscience,0.097,23699528,-1,-1
cortex m1_00026,https://pubmed.ncbi.nlm.nih.gov/11222456/,Event-related functional magnetic resonance imaging in Parkinson's disease before and after levodopa.,"Haslinger B, Erhard P, Kampfe N, Boecker H, Rummeny E, Schwaiger M, Conrad B, Ceballos-Baumann AO",Brain : a journal of neurology,0.096,11222456,-1,-1
cortex m1_00027,https://pubmed.ncbi.nlm.nih.gov/15110032/,Regional homogeneity approach to fMRI data analysis.,"Zang Y, Jiang T, Lu Y, He Y, Tian L",NeuroImage,0.096,15110032,-1,-1
cortex m1_00028,https://pubmed.ncbi.nlm.nih.gov/17971871/,Comparing natural and constrained movements: new insights into the visuomotor control of grasping.,"Begliomini C, Caria A, Grodd W, Castiello U",PloS one,0.096,17971871,-1,-1
cortex m1_00029,https://pubmed.ncbi.nlm.nih.gov/29593518/,Task-Relevant Information Modulates Primary Motor Cortex Activity Before Movement Onset.,"Calderon CB, Van Opstal F, Peigneux P, Verguts T, Gevers W",Frontiers in human neuroscience,0.096,29593518,-1,-1
cortex m1_00030,https://pubmed.ncbi.nlm.nih.gov/19164537/,Congenitally altered motor experience alters somatotopic organization of human primary motor cortex.,"Stoeckel MC, Seitz RJ, Buetefisch CM",Proceedings of the National Academy of Sciences of the United States of America,0.095,19164537,-1,-1
cortex m1_00031,https://pubmed.ncbi.nlm.nih.gov/23285171/,Patterns in cortical connectivity for determining outcomes in hand function after subcortical stroke.,"Yin D, Song F, Xu D, Peterson BS, Sun L, Men W, Yan X, Fan M",PloS one,0.095,23285171,-1,-1
cortex m1_00032,https://pubmed.ncbi.nlm.nih.gov/23395849/,Network Connectivity and Individual Responses to Brain Stimulation in the Human Motor System.,"Cardenas-Morales L, Volz LJ, Michely J, Rehme AK, Pool EM, Nettekoven C, Eickhoff SB, Fink GR, Grefkes C","Cerebral cortex (New York, N.Y. : 1991)",0.095,23395849,-1,-1
cortex m1_00033,https://pubmed.ncbi.nlm.nih.gov/25461711/,Brain activity during observation and motor imagery of different balance tasks: An fMRI study.,"Taube W, Mouthon M, Leukel C, Hoogewoud HM, Annoni JM, Keller M",Cortex; a journal devoted to the study of the nervous system and behavior,0.095,25461711,-1,-1
cortex m1_00034,https://pubmed.ncbi.nlm.nih.gov/19788568/,Modulation of movement-associated cortical activation by transcranial direct current stimulation.,"Stagg CJ, O'Shea J, Kincses ZT, Woolrich M, Matthews PM, Johansen-Berg H",The European journal of neuroscience,0.094,19788568,-1,-1
cortex m1_00035,https://pubmed.ncbi.nlm.nih.gov/20554884/,Specific increases within global decreases: a functional magnetic resonance imaging investigation of five days of motor sequence learning.,"Steele CJ, Penhune VB",The Journal of neuroscience : the official journal of the Society for Neuroscience,0.094,20554884,-1,-1
cortex m1_00036,https://pubmed.ncbi.nlm.nih.gov/27417053/,Functional and structural cortical characteristics after restricted focal motor cortical infarction evaluated at chronic stage - Indications from a preliminary study.,"Julkunen P, Maatta S, Saisanen L, Kallioniemi E, Kononen M, Jakala P, Vanninen R, Vaalto S",Clinical neurophysiology : official journal of the International Federation of Clinical Neurophysiology,0.094,27417053,-1,-1
cortex m1_00037,https://pubmed.ncbi.nlm.nih.gov/15078569/,Functional MRI of the immediate impact of transcranial magnetic stimulation on cortical and subcortical motor circuits.,"Bestmann S, Baudewig J, Siebner HR, Rothwell JC, Frahm J",The European journal of neuroscience,0.093,15078569,-1,-1
cortex m1_00038,https://pubmed.ncbi.nlm.nih.gov/17965128/,Dorsal premotor cortex exerts state-dependent causal influences on activity in contralateral primary motor and dorsal premotor cortex.,"Bestmann S, Swayne O, Blankenburg F, Ruff CC, Haggard P, Weiskopf N, Josephs O, Driver J, Rothwell JC, Ward NS","Cerebral cortex (New York, N.Y. : 1991)",0.093,17965128,-1,-1
cortex m1_00039,https://pubmed.ncbi.nlm.nih.gov/18316207/,Brain activity is similar during precision and power gripping with light force: an fMRI study.,"Kuhtz-Buschbeck JP, Gilster R, Wolff S, Ulmer S, Siebner H, Jansen O",NeuroImage,0.093,18316207,-1,-1
cortex m1_00040,https://pubmed.ncbi.nlm.nih.gov/27378891/,The Cognitive Side of M1.,"Tomasino B, Gremese M",Frontiers in human neuroscience,0.092,27378891,-1,-1
cortex m1_00041,https://pubmed.ncbi.nlm.nih.gov/23056337/,Levodopa effects on hand and speech movements in patients with Parkinson's disease: a FMRI study.,"Maillet A, Krainik A, Debu B, Tropres I, Lagrange C, Thobois S, Pollak P, Pinto S",PloS one,0.09,23056337,-1,-1
cortex m1_00042,https://pubmed.ncbi.nlm.nih.gov/24062660/,Movement and afferent representations in human motor areas: a simultaneous neuroimaging and transcranial magnetic/peripheral nerve-stimulation study.,"Shitara H, Shinozaki T, Takagishi K, Honda M, Hanakawa T",Frontiers in human neuroscience,0.09,24062660,-1,-1
cortex m1_00043,https://pubmed.ncbi.nlm.nih.gov/21255661/,Resting state fMRI reveals increased subthalamic nucleus-motor cortex connectivity in Parkinson's disease.,"Baudrexel S, Witte T, Seifried C, von Wegner F, Beissner F, Klein JC, Steinmetz H, Deichmann R, Roeper J, Hilker R",NeuroImage,0.087,21255661,-1,-1
cortex m1_00044,https://pubmed.ncbi.nlm.nih.gov/28220070/,Neural Correlates of Mirror Visual Feedback-Induced Performance Improvements: A Resting-State fMRI Study.,"Rjosk V, Lepsien J, Kaminski E, Hoff M, Sehm B, Steele CJ, Villringer A, Ragert P",Frontiers in human neuroscience,0.087,28220070,-1,-1
cortex m1_00045,https://pubmed.ncbi.nlm.nih.gov/24610120/,What Makes the Muscle Twitch: Motor System Connectivity and TMS-Induced Activity.,"Volz LJ, Hamada M, Rothwell JC, Grefkes C","Cerebral cortex (New York, N.Y. : 1991)",0.085,24610120,-1,-1
cortex m1_00046,https://pubmed.ncbi.nlm.nih.gov/25328043/,Functional connectivity in the resting-state motor networks influences the kinematic processes during motor sequence learning.,"Bonzano L, Palmaro E, Teodorescu R, Fleysher L, Inglese M, Bove M",The European journal of neuroscience,0.085,25328043,-1,-1
cortex m1_00047,https://pubmed.ncbi.nlm.nih.gov/25279557/,Reduced topological efficiency in cortical-basal Ganglia motor network of Parkinson's disease: a resting state fMRI study.,"Wei L, Zhang J, Long Z, Wu GR, Hu X, Zhang Y, Wang J",PloS one,0.083,25279557,-1,-1
cortex m1_00048,https://pubmed.ncbi.nlm.nih.gov/25613438/,Functional resting-state connectivity of the human motor network: Differences between right- and left-handers.,"Pool EM, Rehme AK, Eickhoff SB, Fink GR, Grefkes C",NeuroImage,0.083,25613438,-1,-1
cortex m1_00049,https://pubmed.ncbi.nlm.nih.gov/22146753/,Task-specific modulation of effective connectivity during two simple unimanual motor tasks: a 122-channel EEG study.,"Herz DM, Christensen MS, Reck C, Florin E, Barbe MT, Stahlhut C, Pauls KA, Tittgemeyer M, Siebner HR, Timmermann L",NeuroImage,0.082,22146753,-1,-1
cortex m1_00050,https://pubmed.ncbi.nlm.nih.gov/24416397/,Complex regional pain syndrome type I affects brain structure in prefrontal and motor cortex.,"Pleger B, Draganski B, Schwenkreis P, Lenz M, Nicolas V, Maier C, Tegenthoff M",PloS one,0.082,24416397,-1,-1
cortex m1_00051,https://pubmed.ncbi.nlm.nih.gov/27502049/,Regional homogeneity of intrinsic brain activity correlates with auditory-motor processing of vocal pitch errors.,"Guo Z, Huang X, Wang M, Jones JA, Dai Z, Li W, Liu P, Liu H",NeuroImage,0.082,27502049,-1,-1
cortex m1_00052,https://pubmed.ncbi.nlm.nih.gov/23920009/,Functional somatotopy revealed across multiple cortical regions using a model of  complex motor task.,"Cunningham DA, Machado A, Yue GH, Carey JR, Plow EB",Brain research,0.081,23920009,-1,-1
cortex m1_00053,https://pubmed.ncbi.nlm.nih.gov/24040007/,Human fMRI reveals that delayed action re-recruits visual perception.,"Singhal A, Monaco S, Kaufman LD, Culham JC",PloS one,0.08,24040007,-1,-1
cortex m1_00054,https://pubmed.ncbi.nlm.nih.gov/21376126/,Brain-behavior correlates of optimizing learning through interleaved practice.,"Lin CH, Knowlton BJ, Chiang MC, Iacoboni M, Udompholkul P, Wu AD",NeuroImage,0.08,21376126,-1,-1
cortex m1_00055,https://pubmed.ncbi.nlm.nih.gov/25390206/,Patterns of modulation in the activity and connectivity of motor cortex during the repeated generation of movement sequences.,"Gabitov E, Manor D, Karni A",Journal of cognitive neuroscience,0.08,25390206,-1,-1
cortex m1_00056,https://pubmed.ncbi.nlm.nih.gov/28254457/,High-sensitivity TMS/fMRI of the Human Motor Cortex Using a Dedicated Multichannel MR Coil.,"Navarro de Lara LI, Tik M, Woletz M, Frass-Kriegl R, Moser E, Laistler E, Windischberger C",NeuroImage,0.079,28254457,-1,-1
cortex m1_00057,https://pubmed.ncbi.nlm.nih.gov/19540349/,Evaluation of the effective connectivity of supplementary motor areas during motor imagery using Granger causality mapping.,"Chen H, Yang Q, Liao W, Gong Q, Shen S",NeuroImage,0.077,19540349,-1,-1
cortex m1_00058,https://pubmed.ncbi.nlm.nih.gov/20851770/,Functional connectivity of the human insular cortex during noxious and innocuous  thermal stimulation.,"Peltz E, Seifert F, DeCol R, Dorfler A, Schwab S, Maihofner C",NeuroImage,0.077,20851770,-1,-1
cortex m1_00059,https://pubmed.ncbi.nlm.nih.gov/22912611/,Neural networks for action representation: a functional magnetic-resonance imaging and dynamic causal modeling study.,"Sasaki AT, Kochiyama T, Sugiura M, Tanabe HC, Sadato N",Frontiers in human neuroscience,0.077,22912611,-1,-1
cortex m1_00060,https://pubmed.ncbi.nlm.nih.gov/22992491/,Rostral-caudal gradients of abstraction revealed by multi-variate pattern analysis of working memory.,"Nee DE, Brown JW",NeuroImage,0.077,22992491,-1,-1
cortex m1_00061,https://pubmed.ncbi.nlm.nih.gov/23063450/,Basal ganglia are active during motor performance recovery after a demanding motor task.,"Bonzano L, Tacchino A, Saitta L, Roccatagliata L, Avanzino L, Mancardi GL, Bove M",NeuroImage,0.077,23063450,10.1016/j.neuroimage.2012.10.012,-1
cortex m1_00062,https://pubmed.ncbi.nlm.nih.gov/28631147/,The motor cortical representation of a muscle is not homogeneous in brain connectivity.,"Smith JA, Albishi A, Babikian S, Asavasopon S, Fisher BE, Kutch JJ",Experimental brain research,0.077,28631147,10.1007/s00221-017-5011-7,-1
cortex m1_00063,https://pubmed.ncbi.nlm.nih.gov/24619090/,Water diffusion reveals networks that modulate multiregional morphological plasticity after repetitive brain stimulation.,"Abe M, Fukuyama H, Mima T",Proceedings of the National Academy of Sciences of the United States of America,0.076,24619090,-1,-1
cortex m1_00064,https://pubmed.ncbi.nlm.nih.gov/17499160/,Stimulus properties matter more than perspective: an fMRI study of mental imagery and silent reading of action phrases.,"Tomasino B, Werner CJ, Weiss PH, Fink GR",NeuroImage,0.075,17499160,-1,-1
cortex m1_00065,https://pubmed.ncbi.nlm.nih.gov/20740649/,Functional connectivity of cortical motor areas in the resting state in Parkinson's disease.,"Wu T, Long X, Wang L, Hallett M, Zang Y, Li K, Chan P",Human brain mapping,0.075,20740649,-1,-1
cortex m1_00066,https://pubmed.ncbi.nlm.nih.gov/24893741/,Done that: short-term repetition related modulations of motor cortex activity as  a stable signature for overnight motor memory consolidation.,"Gabitov E, Manor D, Karni A",Journal of cognitive neuroscience,0.075,24893741,-1,-1
cortex m1_00067,https://pubmed.ncbi.nlm.nih.gov/15862218/,Brain activation of lower extremity movement in chronically impaired stroke survivors.,"Luft AR, Forrester L, Macko RF, McCombe-Waller S, Whitall J, Villagra F, Hanley DF",NeuroImage,0.074,15862218,-1,-1
cortex m1_00068,https://pubmed.ncbi.nlm.nih.gov/24632378/,Modelling psychiatric and cultural possession phenomena with suggestion and fMRI.,"Deeley Q, Oakley DA, Walsh E, Bell V, Mehta MA, Halligan PW",Cortex; a journal devoted to the study of the nervous system and behavior,0.074,24632378,-1,-1
cortex m1_00069,https://pubmed.ncbi.nlm.nih.gov/25632119/,Left dorsal speech stream components and their contribution to phonological processing.,"Murakami T, Kell CA, Restle J, Ugawa Y, Ziemann U",The Journal of neuroscience : the official journal of the Society for Neuroscience,0.073,25632119,-1,-1
cortex m1_00070,https://pubmed.ncbi.nlm.nih.gov/29704615/,Short- and long-term reliability of language fMRI.,"Nettekoven C, Reck N, Goldbrunner R, Grefkes C, Weiss Lucas C",NeuroImage,0.073,29704615,-1,-1
cortex m1_00071,https://pubmed.ncbi.nlm.nih.gov/18413350/,Hemispheric asymmetry of frequency-dependent suppression in the ipsilateral primary motor cortex during finger movement: a functional magnetic resonance imaging study.,"Hayashi MJ, Saito DN, Aramaki Y, Asai T, Fujibayashi Y, Sadato N","Cerebral cortex (New York, N.Y. : 1991)",0.072,18413350,-1,-1
cortex m1_00072,https://pubmed.ncbi.nlm.nih.gov/23675337/,A Comparison between Uni- and Bilateral tDCS Effects on Functional Connectivity of the Human Motor Cortex.,"Sehm B, Kipping J, Schafer A, Villringer A, Ragert P",Frontiers in human neuroscience,0.071,23675337,-1,-1
cortex m1_00073,https://pubmed.ncbi.nlm.nih.gov/27846290/,Altered Effective Connectivity of the Primary Motor Cortex in Stroke: A Resting-State fMRI Study with Granger Causality Analysis.,"Zhao Z, Wang X, Fan M, Yin D, Sun L, Jia J, Tang C, Zheng X, Jiang Y, Wu J, Gong J",PloS one,0.071,27846290,-1,-1
cortex m1_00074,https://pubmed.ncbi.nlm.nih.gov/21803163/,Self-modulation of primary motor cortex activity with motor and motor imagery tasks using real-time fMRI-based neurofeedback.,"Berman BD, Horovitz SG, Venkataraman G, Hallett M",NeuroImage,0.07,21803163,-1,-1
cortex m1_00075,https://pubmed.ncbi.nlm.nih.gov/16475178/,Coherent corticomuscular oscillations originate from primary motor cortex: evidence from patients with early brain lesions.,"Gerloff C, Braun C, Staudt M, Hegner YL, Dichgans J, Krageloh-Mann I",Human brain mapping,0.068,16475178,-1,-1
cortex m1_00076,https://pubmed.ncbi.nlm.nih.gov/26557065/,Neuroplastic changes in resting-state functional connectivity after stroke rehabilitation.,"Fan YT, Wu CY, Liu HL, Lin KC, Wai YY, Chen YL",Frontiers in human neuroscience,0.067,26557065,-1,-1
cortex m1_00077,https://pubmed.ncbi.nlm.nih.gov/25460498/,Initial and sustained brain responses to contextual conditioned anxiety in humans.,"Andreatta M, Glotzbach-Schoon E, Muhlberger A, Schulz SM, Wiemer J, Pauli P",Cortex; a journal devoted to the study of the nervous system and behavior,0.066,25460498,-1,-1
cortex m1_00078,https://pubmed.ncbi.nlm.nih.gov/21520346/,Convergence of human brain mapping tools: neuronavigated TMS parameters and fMRI  activity in the hand motor area.,"Sarfeld AS, Diekhoff S, Wang LE, Liuzzi G, Uludag K, Eickhoff SB, Fink GR, Grefkes C",Human brain mapping,0.065,21520346,-1,-1
cortex m1_00079,https://pubmed.ncbi.nlm.nih.gov/21291959/,The enhanced cortical activation induced by transcranial direct current stimulation during hand movements.,"Kwon YH, Jang SH",Neuroscience letters,0.063,21291959,-1,-1
cortex m1_00080,https://pubmed.ncbi.nlm.nih.gov/15728652/,Vicarious function within the human primary motor cortex? A longitudinal fMRI stroke study.,"Jaillard A, Martin CD, Garambois K, Lebas JF, Hommel M",Brain : a journal of neurology,0.055,15728652,-1,-1
cortex m1_00081,https://pubmed.ncbi.nlm.nih.gov/27881788/,Brain Network Mechanisms Underlying Motor Enhancement by Transcranial Entrainment of Gamma Oscillations.,"Moisa M, Polania R, Grueschow M, Ruff CC",The Journal of neuroscience : the official journal of the Society for Neuroscience,0.055,27881788,10.1523/JNEUROSCI.2044-16.2016,-1
