paper_name,paper_url,Title,Author,Journal,Loading,PMID,Doi,download_status
default_00001,https://pubmed.ncbi.nlm.nih.gov/18322013/,The maturing architecture of the brain's default network.,"Fair DA, Cohen AL, Dosenbach NU, Church JA, Miezin FM, Barch DM, Raichle ME, Petersen SE, Schlaggar BL",Proceedings of the National Academy of Sciences of the United States of America,0.487,18322013,-1,-1
default_00002,https://pubmed.ncbi.nlm.nih.gov/23077048/,Default network connectivity in medial temporal lobe amnesia.,"Hayes SM, Salat DH, Verfaellie M",The Journal of neuroscience : the official journal of the Society for Neuroscience,0.394,23077048,-1,-1
default_00003,https://pubmed.ncbi.nlm.nih.gov/18454447/,Resting in peace or noise: scanner background noise suppresses default-mode network.,"Gaab N, Gabrieli JD, Glover GH",Human brain mapping,0.386,18454447,-1,-1
default_00004,https://pubmed.ncbi.nlm.nih.gov/21840627/,Functional connectivity tracks clinical deterioration in Alzheimer's disease.,"Damoiseaux JS, Prater KE, Miller BL, Greicius MD",Neurobiology of aging,0.369,21840627,-1,-1
default_00005,https://pubmed.ncbi.nlm.nih.gov/20648663/,Default network connectivity during a working memory task.,"Bluhm RL, Clark CR, McFarlane AC, Moores KA, Shaw ME, Lanius RA",Human brain mapping,0.359,20648663,10.1002/hbm.21090,-1
default_00006,https://pubmed.ncbi.nlm.nih.gov/27913157/,Further evidence of alerted default network connectivity and association with theory of mind ability in schizophrenia.,"Mothersill O, Tangney N, Morris DW, McCarthy H, Frodl T, Gill M, Corvin A, Donohoe G",Schizophrenia research,0.356,27913157,-1,-1
default_00007,https://pubmed.ncbi.nlm.nih.gov/23479058/,Dysfunctional neural networks associated with impaired social interactions in early psychosis: an ICA analysis.,"Mazza M, Catalucci A, Pino MC, Giusti L, Nigri A, Pollice R, Roncone R, Casacchia M, Gallucci M",Brain imaging and behavior,0.35,23479058,-1,-1
default_00008,https://pubmed.ncbi.nlm.nih.gov/20728875/,Effects of an alpha 7-nicotinic agonist on default network activity in schizophrenia.,"Tregellas JR, Tanabe J, Rojas DC, Shatti S, Olincy A, Johnson L, Martin LF, Soti F, Kem WR, Leonard S, Freedman R",Biological psychiatry,0.346,20728875,-1,-1
default_00009,https://pubmed.ncbi.nlm.nih.gov/20004180/,Alterations of resting state functional connectivity in the default network in adolescents with autism spectrum disorders.,"Weng SJ, Wiggins JL, Peltier SJ, Carrasco M, Risi S, Lord C, Monk CS",Brain research,0.331,20004180,-1,-1
default_00010,https://pubmed.ncbi.nlm.nih.gov/26351864/,Prefrontal Engagement and Reduced Default Network Suppression Co-occur and Are Dynamically Coupled in Older Adults: The Default-Executive Coupling Hypothesis of Aging.,"Turner GR, Spreng RN",Journal of cognitive neuroscience,0.331,26351864,-1,-1
default_00011,https://pubmed.ncbi.nlm.nih.gov/26220743/,Default mode network connectivity during task execution.,"Vatansever D, Menon DK, Manktelow AE, Sahakian BJ, Stamatakis EA",NeuroImage,0.33,26220743,-1,-1
default_00012,https://pubmed.ncbi.nlm.nih.gov/19552900/,Sustained activity within the default mode network during an implicit memory task.,"Yang J, Weng X, Zang Y, Xu M, Xu X",Cortex; a journal devoted to the study of the nervous system and behavior,0.327,19552900,-1,-1
default_00013,https://pubmed.ncbi.nlm.nih.gov/22438291/,Dissociating anticipation from perception: Acute pain activates default mode network.,"Ter Minassian A, Ricalens E, Humbert S, Duc F, Aube C, Beydon L",Human brain mapping,0.327,22438291,-1,-1
default_00014,https://pubmed.ncbi.nlm.nih.gov/25266592/,Regional amyloid burden and intrinsic connectivity networks in cognitively normal elderly subjects.,"Lim HK, Nebes R, Snitz B, Cohen A, Mathis C, Price J, Weissfeld L, Klunk W, Aizenstein HJ",Brain : a journal of neurology,0.327,25266592,-1,-1
default_00015,https://pubmed.ncbi.nlm.nih.gov/20053888/,Prefrontal-related functional connectivities within the default network are modulated by COMT val158met in healthy young adults.,"Liu B, Song M, Li J, Liu Y, Li K, Yu C, Jiang T",The Journal of neuroscience : the official journal of the Society for Neuroscience,0.322,20053888,-1,-1
default_00016,https://pubmed.ncbi.nlm.nih.gov/25319706/,Goal-congruent default network activity facilitates cognitive control.,"Spreng RN, DuPre E, Selarka D, Garcia J, Gojkovic S, Mildner J, Luh WM, Turner GR",The Journal of neuroscience : the official journal of the Society for Neuroscience,0.316,25319706,-1,-1
default_00017,https://pubmed.ncbi.nlm.nih.gov/26484047/,Default mode network segregation and social deficits in autism spectrum disorder: Evidence from non-medicated children.,"Yerys BE, Gordon EM, Abrams DN, Satterthwaite TD, Weinblatt R, Jankowski KF, Strang J, Kenworthy L, Gaillard WD, Vaidya CJ",NeuroImage. Clinical,0.3,26484047,-1,-1
default_00018,https://pubmed.ncbi.nlm.nih.gov/21391760/,The default network distinguishes construals of proximal versus distal events.,"Tamir DI, Mitchell JP",Journal of cognitive neuroscience,0.299,21391760,-1,-1
default_00019,https://pubmed.ncbi.nlm.nih.gov/23824302/,Default Mode Network Connectivity in Stroke Patients.,"Tuladhar AM, Snaphaan L, Shumskaya E, Rijpkema M, Fernandez G, Norris DG, de Leeuw FE",PloS one,0.294,23824302,-1,-1
default_00020,https://pubmed.ncbi.nlm.nih.gov/21391263/,Frontal parietal control network regulates the anti-correlated default and dorsal attention networks.,"Gao W, Lin W",Human brain mapping,0.292,21391263,-1,-1
default_00021,https://pubmed.ncbi.nlm.nih.gov/25833189/,Interactions between default mode and control networks as a function of increasing cognitive reasoning complexity.,"Hearne L, Cocchi L, Zalesky A, Mattingley JB",Human brain mapping,0.291,25833189,10.1002/hbm.22802,-1
default_00022,https://pubmed.ncbi.nlm.nih.gov/25603027/,The default mode of human brain function primes the intentional stance.,"Spunt RP, Meyer ML, Lieberman MD",Journal of cognitive neuroscience,0.289,25603027,10.1162/jocn_a_00785,-1
default_00023,https://pubmed.ncbi.nlm.nih.gov/19433790/,Experience sampling during fMRI reveals default network and executive system contributions to mind wandering.,"Christoff K, Gordon AM, Smallwood J, Smith R, Schooler JW",Proceedings of the National Academy of Sciences of the United States of America,0.283,19433790,10.1073/pnas.0900234106,-1
default_00024,https://pubmed.ncbi.nlm.nih.gov/16879844/,How default is the default mode of brain function? Further evidence from intrinsic BOLD signal fluctuations.,Fransson P,Neuropsychologia,0.282,16879844,-1,-1
default_00025,https://pubmed.ncbi.nlm.nih.gov/19015108/,Functional abnormalities of the default network during self- and other-reflection in autism.,"Kennedy DP, Courchesne E",Social cognitive and affective neuroscience,0.278,19015108,-1,-1
default_00026,https://pubmed.ncbi.nlm.nih.gov/15852468/,Spontaneous low-frequency BOLD signal fluctuations: an fMRI investigation of the  resting-state default mode of brain function hypothesis.,Fransson P,Human brain mapping,0.277,15852468,-1,-1
default_00027,https://pubmed.ncbi.nlm.nih.gov/24493844/,Future planning: default network activity couples with frontoparietal control network and reward-processing regions during process and outcome simulations.,"Gerlach KD, Spreng RN, Madore KP, Schacter DL",Social cognitive and affective neuroscience,0.276,24493844,-1,-1
default_00028,https://pubmed.ncbi.nlm.nih.gov/12506194/,Functional connectivity in the resting brain: a network analysis of the default mode hypothesis.,"Greicius MD, Krasnow B, Reiss AL, Menon V",Proceedings of the National Academy of Sciences of the United States of America,0.275,12506194,-1,-1
default_00029,https://pubmed.ncbi.nlm.nih.gov/23274798/,Default-mode network functional connectivity in aphasia: therapy-induced neuroplasticity.,"Marcotte K, Perlbarg V, Marrelec G, Benali H, Ansaldo AI",Brain and language,0.273,23274798,-1,-1
default_00030,https://pubmed.ncbi.nlm.nih.gov/21077136/,Modulation of steady state functional connectivity in the default mode and working memory networks by cognitive load.,"Newton AT, Morgan VL, Rogers BP, Gore JC",Human brain mapping,0.27,21077136,-1,-1
default_00031,https://pubmed.ncbi.nlm.nih.gov/23483523/,Neural networks supporting autobiographical memory retrieval in posttraumatic stress disorder.,"St Jacques PL, Kragel PA, Rubin DC","Cognitive, affective & behavioral neuroscience",0.266,23483523,-1,-1
default_00032,https://pubmed.ncbi.nlm.nih.gov/28038366/,Brain networks underlying novel metaphor production.,"Beaty RE, Silvia PJ, Benedek M",Brain and cognition,0.266,28038366,-1,-1
default_00033,https://pubmed.ncbi.nlm.nih.gov/21256228/,Solving future problems: default network and executive activity associated with goal-directed mental simulations.,"Gerlach KD, Spreng RN, Gilmore AW, Schacter DL",NeuroImage,0.265,21256228,-1,-1
default_00034,https://pubmed.ncbi.nlm.nih.gov/19301994/,Going their separate ways: dissociation of hippocampal and dorsolateral prefrontal activation during episodic retrieval and post-retrieval processing.,"Israel SL, Seibert TM, Black ML, Brewer JB",Journal of cognitive neuroscience,0.261,19301994,-1,-1
default_00035,https://pubmed.ncbi.nlm.nih.gov/15006683/,Watching social interactions produces dorsomedial prefrontal and medial parietal  BOLD fMRI signal increases compared to a resting baseline.,"Iacoboni M, Lieberman MD, Knowlton BJ, Molnar-Szakacs I, Moritz M, Throop CJ, Fiske AP",NeuroImage,0.259,15006683,-1,-1
default_00036,https://pubmed.ncbi.nlm.nih.gov/20600998/,"Default network activity, coupled with the frontoparietal control network, supports goal-directed cognition.","Spreng RN, Stevens WD, Chamberlain JP, Gilmore AW, Schacter DL",NeuroImage,0.257,20600998,-1,-1
default_00037,https://pubmed.ncbi.nlm.nih.gov/27908591/,An fMRI investigation of the relationship between future imagination and cognitive flexibility.,"Roberts RP, Wiebels K, Sumner RL, van Mulukom V, Grady CL, Schacter DL, Addis DR",Neuropsychologia,0.255,27908591,-1,-1
default_00038,https://pubmed.ncbi.nlm.nih.gov/21618667/,Racial identification modulates default network activity for same and other races.,"Mathur VA, Harada T, Chiao JY",Human brain mapping,0.245,21618667,-1,-1
default_00039,https://pubmed.ncbi.nlm.nih.gov/20502992/,Default network response to a working memory challenge after withdrawal of continuous positive airway pressure treatment for obstructive sleep apnea.,"Sweet LH, Jerskey BA, Aloia MS",Brain imaging and behavior,0.242,20502992,-1,-1
default_00040,https://pubmed.ncbi.nlm.nih.gov/21095105/,Correlated structural and functional brain abnormalities in the default mode network in schizophrenia patients.,"Salgado-Pineda P, Fakra E, Delaveau P, McKenna PJ, Pomarol-Clotet E, Blin O",Schizophrenia research,0.242,21095105,10.1016/j.schres.2010.10.027,-1
default_00041,https://pubmed.ncbi.nlm.nih.gov/28082106/,Creative constraints: Brain activity and network dynamics underlying semantic interference during idea production.,"Beaty RE, Christensen AP, Benedek M, Silvia PJ, Schacter DL",NeuroImage,0.242,28082106,10.1016/j.neuroimage.2017.01.012,-1
default_00042,https://pubmed.ncbi.nlm.nih.gov/17210143/,Resting-state functional connectivity in major depression: abnormally increased contributions from subgenual cingulate cortex and thalamus.,"Greicius MD, Flores BH, Menon V, Glover GH, Solvason HB, Kenna H, Reiss AL, Schatzberg AF",Biological psychiatry,0.241,17210143,10.1016/j.biopsych.2006.09.020,-1
default_00043,https://pubmed.ncbi.nlm.nih.gov/20728873/,Atypical default network connectivity in youth with attention-deficit/hyperactivity disorder.,"Fair DA, Posner J, Nagel BJ, Bathula D, Dias TG, Mills KL, Blythe MS, Giwa A, Schmitt CF, Nigg JT",Biological psychiatry,0.239,20728873,-1,-1
default_00044,https://pubmed.ncbi.nlm.nih.gov/24098513/,"Default mode, dorsal attention and auditory resting state networks exhibit differential functional connectivity in tinnitus and hearing loss.","Schmidt SA, Akrofi K, Carpenter-Thompson JR, Husain FT",PloS one,0.239,24098513,-1,-1
default_00045,https://pubmed.ncbi.nlm.nih.gov/18346764/,Altered deactivation in individuals with genetic risk for Alzheimer's disease.,"Persson J, Lind J, Larsson A, Ingvar M, Sleegers K, Van Broeckhoven C, Adolfsson R, Nilsson LG, Nyberg L",Neuropsychologia,0.234,18346764,-1,-1
default_00046,https://pubmed.ncbi.nlm.nih.gov/17888686/,Motor deactivation in the human cortex and basal ganglia.,"Marchand WR, Lee JN, Thatcher JW, Thatcher GW, Jensen C, Starr J",NeuroImage,0.233,17888686,-1,-1
default_00047,https://pubmed.ncbi.nlm.nih.gov/21854855/,Evaluative and generative modes of thought during the creative process.,"Ellamil M, Dobson C, Beeman M, Christoff K",NeuroImage,0.233,21854855,-1,-1
default_00048,https://pubmed.ncbi.nlm.nih.gov/18674589/,Emotional experience modulates brain activity during fixation periods between tasks.,"Pitroda S, Angstadt M, McCloskey MS, Coccaro EF, Phan KL",Neuroscience letters,0.228,18674589,-1,-1
default_00049,https://pubmed.ncbi.nlm.nih.gov/19783410/,Retrosplenial cortex connectivity in schizophrenia.,"Bluhm RL, Miller J, Lanius RA, Osuch EA, Boksman K, Neufeld RW, Theberge J, Schaefer B, Williamson PC",Psychiatry research,0.227,19783410,-1,-1
default_00050,https://pubmed.ncbi.nlm.nih.gov/15954139/,Altered resting state networks in mild cognitive impairment and mild Alzheimer's  disease: an fMRI study.,"Rombouts SA, Barkhof F, Goekoop R, Stam CJ, Scheltens P",Human brain mapping,0.22,15954139,-1,-1
default_00051,https://pubmed.ncbi.nlm.nih.gov/23623456/,Disruption of anterior insula modulation of large-scale brain networks in schizophrenia.,"Moran LV, Tagamets MA, Sampath H, O'Donnell A, Stein EA, Kochunov P, Hong LE",Biological psychiatry,0.218,23623456,-1,-1
default_00052,https://pubmed.ncbi.nlm.nih.gov/21458238/,Functional resting-state networks are differentially affected in schizophrenia.,"Woodward ND, Rogers B, Heckers S",Schizophrenia research,0.217,21458238,-1,-1
default_00053,https://pubmed.ncbi.nlm.nih.gov/22032950/,The impact of serotonin transporter (5-HTTLPR) genotype on the development of resting-state functional connectivity in children and adolescents: a preliminary  report.,"Wiggins JL, Bedoyan JK, Peltier SJ, Ashinoff S, Carrasco M, Weng SJ, Welsh RC, Martin DM, Monk CS",NeuroImage,0.213,22032950,-1,-1
default_00054,https://pubmed.ncbi.nlm.nih.gov/20097295/,"Dissociating the roles of the default-mode, dorsal, and ventral networks in episodic memory retrieval.",Kim H,NeuroImage,0.212,20097295,-1,-1
default_00055,https://pubmed.ncbi.nlm.nih.gov/28176262/,"Modifications in resting state functional anticorrelation between default mode network and dorsal attention network: comparison among young adults, healthy elders and mild cognitive impairment patient","Esposito R, Cieri F, Chiacchiaretta P, Cera N, Lauriola M, Di Giannantonio M, Tartaro A, Ferretti A",Brain imaging and behavior,0.211,28176262,-1,-1
default_00056,https://pubmed.ncbi.nlm.nih.gov/22699906/,Gender modulates the APOE epsilon4 effect in healthy older adults: convergent evidence from functional brain connectivity and spinal fluid tau levels.,"Damoiseaux JS, Seeley WW, Zhou J, Shirer WR, Coppola G, Karydas A, Rosen HJ, Miller BL, Kramer JH, Greicius MD",The Journal of neuroscience : the official journal of the Society for Neuroscience,0.208,22699906,-1,-1
default_00057,https://pubmed.ncbi.nlm.nih.gov/22854099/,Bipolar depressed patients show both failure to activate and failure to de-activate during performance of a working memory task.,"Fernandez-Corcuera P, Salvador R, Monte GC, Salvador Sarro S, Goikolea JM, Amann B, Moro N, Sans-Sansa B, Ortiz-Gil J, Vieta E, Maristany T, McKenna PJ, Pomarol-Clotet E",Journal of affective disorders,0.206,22854099,10.1016/j.jad.2012.04.009,-1
default_00058,https://pubmed.ncbi.nlm.nih.gov/22905821/,"Intrinsic architecture underlying the relations among the default, dorsal attention, and frontoparietal control networks of the human brain.","Spreng RN, Sepulcre J, Turner GR, Stevens WD, Schacter DL",Journal of cognitive neuroscience,0.204,22905821,10.1162/jocn_a_00281,-1
default_00059,https://pubmed.ncbi.nlm.nih.gov/27459935/,Attenuated anticorrelation between the default and dorsal attention networks with aging: evidence from task and rest.,"Spreng RN, Stevens WD, Viviano JD, Schacter DL",Neurobiology of aging,0.204,27459935,10.1016/j.neurobiolaging.2016.05.020,-1
default_00060,https://pubmed.ncbi.nlm.nih.gov/22787044/,Dopamine supports coupling of attention-related networks.,"Dang LC, O'Neil JP, Jagust WJ",The Journal of neuroscience : the official journal of the Society for Neuroscience,0.202,22787044,10.1523/JNEUROSCI.0909-12.2012,-1
default_00061,https://pubmed.ncbi.nlm.nih.gov/23384193/,The encoding/retrieval flip: interactions between memory performance and memory stage and relationship to intrinsic cortical networks.,"Huijbers W, Schultz AP, Vannini P, McLaren DG, Wigman SE, Ward AM, Hedden T, Sperling RA",Journal of cognitive neuroscience,0.202,23384193,-1,-1
default_00062,https://pubmed.ncbi.nlm.nih.gov/19639552/,Specialization in the default mode: Task-induced brain deactivations dissociate between visual working memory and attention.,"Mayer JS, Roebroeck A, Maurer K, Linden DE",Human brain mapping,0.198,19639552,-1,-1
default_00063,https://pubmed.ncbi.nlm.nih.gov/26160274/,Abnormal degree centrality in neurologically asymptomatic patients with end-stage renal disease: A resting-state fMRI study.,"Li S, Ma X, Huang R, Li M, Tian J, Wen H, Lin C, Wang T, Zhan W, Fang J, Jiang G",Clinical neurophysiology : official journal of the International Federation of Clinical Neurophysiology,0.198,26160274,-1,-1
default_00064,https://pubmed.ncbi.nlm.nih.gov/25057466/,Aberrant error processing in relation to symptom severity in obsessive-compulsive disorder: A multimodal neuroimaging study.,"Agam Y, Greenberg JL, Isom M, Falkenstein MJ, Jenike E, Wilhelm S, Manoach DS",NeuroImage. Clinical,0.197,25057466,-1,-1
default_00065,https://pubmed.ncbi.nlm.nih.gov/18486491/,Social cognitive neural networks during in-group and out-group interactions.,"Rilling JK, Dagenais JE, Goldsmith DR, Glenn AL, Pagnoni G",NeuroImage,0.196,18486491,-1,-1
default_00066,https://pubmed.ncbi.nlm.nih.gov/20805236/,A neuronal basis for task-negative responses in the human brain.,"Lin P, Hasson U, Jovicich J, Robinson S","Cerebral cortex (New York, N.Y. : 1991)",0.189,20805236,-1,-1
default_00067,https://pubmed.ncbi.nlm.nih.gov/11259662/,Medial prefrontal cortex and self-referential mental activity: relation to a default mode of brain function.,"Gusnard DA, Akbudak E, Shulman GL, Raichle ME",Proceedings of the National Academy of Sciences of the United States of America,0.188,11259662,-1,-1
default_00068,https://pubmed.ncbi.nlm.nih.gov/28528774/,Local-to-remote cortical connectivity in amnestic mild cognitive impairment.,"Zhang YW, Zhao ZL, Qi Z, Hu Y, Wang YS, Sheng C, Sun Y, Wang X, Jiang LL, Yan CG, Li K, Li HJ, Zuo XN",Neurobiology of aging,0.187,28528774,-1,-1
default_00069,https://pubmed.ncbi.nlm.nih.gov/19446646/,Effects of model-based physiological noise correction on default mode network anti-correlations and correlations.,"Chang C, Glover GH",NeuroImage,0.185,19446646,-1,-1
default_00070,https://pubmed.ncbi.nlm.nih.gov/19559684/,Acupuncture mobilizes the brain's default mode and its anti-correlated network in healthy subjects.,"Hui KK, Marina O, Claunch JD, Nixon EE, Fang J, Liu J, Li M, Napadow V, Vangel M, Makris N, Chan ST, Kwong KK, Rosen BR",Brain research,0.185,19559684,-1,-1
default_00071,https://pubmed.ncbi.nlm.nih.gov/22723888/,Abnormal brain activation in neurofibromatosis type 1: a link between visual processing and the default mode network.,"Violante IR, Ribeiro MJ, Cunha G, Bernardino I, Duarte JV, Ramos F, Saraiva J, Silva E, Castelo-Branco M",PloS one,0.185,22723888,10.1371/journal.pone.0038785,-1
default_00072,https://pubmed.ncbi.nlm.nih.gov/20974213/,Default mode network gates the retrieval of task-irrelevant incidental memories.,Kompus K,Neuroscience letters,0.183,20974213,10.1016/j.neulet.2010.10.047,-1
default_00073,https://pubmed.ncbi.nlm.nih.gov/21047495/,Using a self-organizing map algorithm to detect age-related changes in functional connectivity during rest in autism spectrum disorders.,"Wiggins JL, Peltier SJ, Ashinoff S, Weng SJ, Carrasco M, Welsh RC, Lord C, Monk CS",Brain research,0.183,21047495,10.1016/j.brainres.2010.10.102,-1
default_00074,https://pubmed.ncbi.nlm.nih.gov/21159952/,Functional subdivisions in the left angular gyrus where the semantic system meets and diverges from the default network.,"Seghier ML, Fagan E, Price CJ",The Journal of neuroscience : the official journal of the Society for Neuroscience,0.183,21159952,10.1523/JNEUROSCI.3377-10.2010,-1
default_00075,https://pubmed.ncbi.nlm.nih.gov/22446489/,"A dual-subsystem model of the brain's default network: self-referential processing, memory retrieval processes, and autobiographical memory retrieval.",Kim H,NeuroImage,0.183,22446489,10.1016/j.neuroimage.2012.03.025,-1
default_00076,https://pubmed.ncbi.nlm.nih.gov/19702469/,The unrested resting brain: sleep deprivation alters activity within the default-mode network.,"Gujar N, Yoo SS, Hu P, Walker MP",Journal of cognitive neuroscience,0.175,19702469,-1,-1
default_00077,https://pubmed.ncbi.nlm.nih.gov/20083395/,Reduced task-related suppression during semantic repetition priming in schizophrenia.,"Jeong B, Kubicki M",Psychiatry research,0.175,20083395,-1,-1
default_00078,https://pubmed.ncbi.nlm.nih.gov/21713118/,Towards a neuroscience of mind-wandering.,"Gruberger M, Ben-Simon E, Levkovitz Y, Zangen A, Hendler T",Frontiers in human neuroscience,0.175,21713118,-1,-1
default_00079,https://pubmed.ncbi.nlm.nih.gov/18769538/,Thinking about not-thinking: neural correlates of conceptual processing during  Zen meditation.,"Pagnoni G, Cekic M, Guo Y",PloS one,0.174,18769538,-1,-1
default_00080,https://pubmed.ncbi.nlm.nih.gov/21111832/,Associations and dissociations between default and self-reference networks in the human brain.,"Whitfield-Gabrieli S, Moran JM, Nieto-Castanon A, Triantafyllou C, Saxe R, Gabrieli JD",NeuroImage,0.174,21111832,-1,-1
default_00081,https://pubmed.ncbi.nlm.nih.gov/25759285/,The development of the intrinsic functional connectivity of default network subsystems from age 3 to 5.,"Xiao Y, Zhai H, Friederici AD, Jia F",Brain imaging and behavior,0.174,25759285,-1,-1
default_00082,https://pubmed.ncbi.nlm.nih.gov/22514317/,Social-cognitive deficits in normal aging.,"Moran JM, Jolly E, Mitchell JP",The Journal of neuroscience : the official journal of the Society for Neuroscience,0.173,22514317,-1,-1
default_00083,https://pubmed.ncbi.nlm.nih.gov/28866021/,Low-frequency oscillations in default mode subnetworks are associated with episodic memory impairments in Alzheimer's disease.,"Veldsman M, Egorova N, Singh B, Mungas D, DeCarli C, Brodtmann A",Neurobiology of aging,0.172,28866021,-1,-1
default_00084,https://pubmed.ncbi.nlm.nih.gov/22784277/,Decreased functional connectivity by aging is associated with cognitive decline.,"Onoda K, Ishihara M, Yamaguchi S",Journal of cognitive neuroscience,0.171,22784277,-1,-1
default_00085,https://pubmed.ncbi.nlm.nih.gov/17919929/,Competition between functional brain networks mediates behavioral variability.,"Kelly AM, Uddin LQ, Biswal BB, Castellanos FX, Milham MP",NeuroImage,0.168,17919929,-1,-1
default_00086,https://pubmed.ncbi.nlm.nih.gov/18534991/,Regional differences in the coupling between resting cerebral blood flow and metabolism may indicate action preparedness as a default state.,"Gur RC, Ragland JD, Reivich M, Greenberg JH, Alavi A, Gur RE","Cerebral cortex (New York, N.Y. : 1991)",0.168,18534991,-1,-1
default_00087,https://pubmed.ncbi.nlm.nih.gov/22114080/,Culture-related differences in default network activity during visuo-spatial judgments.,"Goh JO, Hebrank AC, Sutton BP, Chee MW, Sim SK, Park DC",Social cognitive and affective neuroscience,0.168,22114080,-1,-1
default_00088,https://pubmed.ncbi.nlm.nih.gov/21167825/,Altered resting state networks in epileptic patients with generalized tonic-clonic seizures.,"Wang Z, Lu G, Zhang Z, Zhong Y, Jiao Q, Zhang Z, Tan Q, Tian L, Chen G, Liao W, Li K, Liu Y",Brain research,0.164,21167825,-1,-1
default_00089,https://pubmed.ncbi.nlm.nih.gov/17888409/,Cingulate-precuneus interactions: a new locus of dysfunction in adult attention-deficit/hyperactivity disorder.,"Castellanos FX, Margulies DS, Kelly C, Uddin LQ, Ghaffari M, Kirsch A, Shaw D, Shehzad Z, Di Martino A, Biswal B, Sonuga-Barke EJ, Rotrosen J, Adler LA, Milham MP",Biological psychiatry,0.16,17888409,-1,-1
default_00090,https://pubmed.ncbi.nlm.nih.gov/20570495/,Effects of nicotine withdrawal on verbal working memory and associated brain response.,"Sweet LH, Mulligan RC, Finnerty CE, Jerskey BA, David SP, Cohen RA, Niaura RS",Psychiatry research,0.16,20570495,-1,-1
default_00091,https://pubmed.ncbi.nlm.nih.gov/17707538/,Frontal theta EEG activity correlates negatively with the default mode network in resting state.,"Scheeringa R, Bastiaansen MC, Petersson KM, Oostenveld R, Norris DG, Hagoort P",International journal of psychophysiology : official journal of the International Organization of Psychophysiology,0.159,17707538,10.1016/j.ijpsycho.2007.05.017,-1
default_00092,https://pubmed.ncbi.nlm.nih.gov/19409498/,Abnormalities of intrinsic functional connectivity in autism spectrum disorders.,"Monk CS, Peltier SJ, Wiggins JL, Weng SJ, Carrasco M, Risi S, Lord C",NeuroImage,0.159,19409498,10.1016/j.neuroimage.2009.04.069,-1
