paper_name,paper_url,Title,Author,Journal,Loading,PMID,Doi,download_status
default_00713,https://pubmed.ncbi.nlm.nih.gov/26781483/,Mental fatigue after mild traumatic brain injury: a 3D-ASL perfusion study.,"Liu K, Li B, Qian S, Jiang Q, Li L, Wang W, Zhang G, Sun Y, Sun G",Brain imaging and behavior,0.052,26781483,10.1007/s11682-015-9492-3,-1
default_00714,https://pubmed.ncbi.nlm.nih.gov/26975555/,Causal relationship between effective connectivity within the default mode network and mind-wandering regulation and facilitation.,"Kajimura S, Kochiyama T, Nakai R, Abe N, Nomura M",NeuroImage,0.052,26975555,10.1016/j.neuroimage.2016.03.009,-1
default_00715,https://pubmed.ncbi.nlm.nih.gov/27314671/,Frequency Specificity of fMRI in Mesial Temporal Lobe Epilepsy.,"Song S, Ding M, Li H, Song X, Fan W, Zhang X, Xu H",PloS one,0.052,27314671,-1,-1
default_00716,https://pubmed.ncbi.nlm.nih.gov/19494158/,L-dopa modulates functional connectivity in striatal cognitive and motor networks: a double-blind placebo-controlled study.,"Kelly C, de Zubicaray G, Di Martino A, Copland DA, Reiss PT, Klein DF, Castellanos FX, Milham MP, McMahon K",The Journal of neuroscience : the official journal of the Society for Neuroscience,0.051,19494158,-1,-1
default_00717,https://pubmed.ncbi.nlm.nih.gov/19539034/,Resting-state BOLD networks versus task-associated functional MRI for distinguishing Alzheimer's disease risk groups.,"Fleisher AS, Sherzai A, Taylor C, Langbaum JB, Chen K, Buxton RB",NeuroImage,0.051,19539034,-1,-1
default_00718,https://pubmed.ncbi.nlm.nih.gov/21151779/,The influence of rest period instructions on the default mode network.,"Benjamin C, Lieberman DA, Chang M, Ofen N, Whitfield-Gabrieli S, Gabrieli JD, Gaab N",Frontiers in human neuroscience,0.051,21151779,-1,-1
default_00719,https://pubmed.ncbi.nlm.nih.gov/21347270/,Neural correlates of ongoing conscious experience: both task-unrelatedness and stimulus-independence are related to default network activity.,"Stawarczyk D, Majerus S, Maquet P, D'Argembeau A",PloS one,0.051,21347270,-1,-1
default_00720,https://pubmed.ncbi.nlm.nih.gov/21420500/,Characterizing dynamic functional connectivity in the resting brain using variable parameter regression and Kalman filtering approaches.,"Kang J, Wang L, Yan C, Wang J, Liang X, He Y",NeuroImage,0.051,21420500,-1,-1
default_00721,https://pubmed.ncbi.nlm.nih.gov/22427852/,Large-scale brain networks in board game experts: insights from a domain-related  task and task-free resting state.,"Duan X, Liao W, Liang D, Qiu L, Gao Q, Liu C, Gong Q, Chen H",PloS one,0.051,22427852,-1,-1
default_00722,https://pubmed.ncbi.nlm.nih.gov/22593242/,Distinct representations of attentional control during voluntary and stimulus-driven shifts across objects and locations.,"Stoppel CM, Boehler CN, Strumpf H, Krebs RM, Heinze HJ, Hopf JM, Schoenfeld MA","Cerebral cortex (New York, N.Y. : 1991)",0.051,22593242,-1,-1
default_00723,https://pubmed.ncbi.nlm.nih.gov/23578577/,White matter structures associated with empathizing and systemizing in young adults.,"Takeuchi H, Taki Y, Thyreau B, Sassa Y, Hashizume H, Sekiguchi A, Nagase T, Nouchi R, Fukushima A, Kawashima R",NeuroImage,0.051,23578577,-1,-1
default_00724,https://pubmed.ncbi.nlm.nih.gov/23746539/,Is aberrant functional connectivity a psychosis endophenotype? A resting state functional magnetic resonance imaging study.,"Khadka S, Meda SA, Stevens MC, Glahn DC, Calhoun VD, Sweeney JA, Tamminga CA, Keshavan MS, O'Neil K, Schretlen D, Pearlson GD",Biological psychiatry,0.051,23746539,-1,-1
default_00725,https://pubmed.ncbi.nlm.nih.gov/23904464/,Effects of Age on Negative Subsequent Memory Effects Associated with the Encoding of Item and Item-Context Information.,"Mattson JT, Wang TH, de Chastelaine M, Rugg MD","Cerebral cortex (New York, N.Y. : 1991)",0.051,23904464,-1,-1
default_00726,https://pubmed.ncbi.nlm.nih.gov/24096208/,The nature of mind wandering during reading varies with the cognitive control demands of the reading strategy.,"Moss J, Schunn CD, Schneider W, McNamara DS",Brain research,0.051,24096208,-1,-1
default_00727,https://pubmed.ncbi.nlm.nih.gov/25463475/,Beyond the word and image: characteristics of a common meaning system for language and vision revealed by functional and structural imaging.,"Jouen AL, Ellmore TM, Madden CJ, Pallier C, Dominey PF, Ventre-Dominey J",NeuroImage,0.051,25463475,-1,-1
default_00728,https://pubmed.ncbi.nlm.nih.gov/25505309/,"Modality-spanning deficits in attention-deficit/hyperactivity disorder in functional networks, gray matter, and white matter.","Kessler D, Angstadt M, Welsh RC, Sripada C",The Journal of neuroscience : the official journal of the Society for Neuroscience,0.051,25505309,-1,-1
default_00729,https://pubmed.ncbi.nlm.nih.gov/25679386/,Changes in thalamic connectivity in the early and late stages of amnestic mild cognitive impairment: a resting-state functional magnetic resonance study from ADNI.,"Cai S, Huang L, Zou J, Jing L, Zhai B, Ji G, von Deneen KM, Ren J, Ren A",PloS one,0.051,25679386,-1,-1
default_00730,https://pubmed.ncbi.nlm.nih.gov/25879781/,Pathological uncoupling between amplitude and connectivity of brain fluctuations  in epilepsy.,"Zhang Z, Xu Q, Liao W, Wang Z, Li Q, Yang F, Zhang Z, Liu Y, Lu G",Human brain mapping,0.051,25879781,-1,-1
default_00731,https://pubmed.ncbi.nlm.nih.gov/26147571/,Altered Resting-State Brain Activity and Connectivity in Depressed Parkinson's Disease.,"Hu X, Song X, Li E, Liu J, Yuan Y, Liu W, Liu Y",PloS one,0.051,26147571,10.1371/journal.pone.0131133,-1
default_00732,https://pubmed.ncbi.nlm.nih.gov/26654933/,Interaction among subsystems within default mode network diminished in schizophrenia patients: A dynamic connectivity approach.,"Du Y, Pearlson GD, Yu Q, He H, Lin D, Sui J, Wu L, Calhoun VD",Schizophrenia research,0.051,26654933,10.1016/j.schres.2015.11.021,-1
default_00733,https://pubmed.ncbi.nlm.nih.gov/27037791/,Altered cerebellar-cerebral functional connectivity in benign adult familial myoclonic epilepsy.,"Long L, Zeng LL, Song Y, Shen H, Fang P, Zhang L, Xu L, Gong J, Zhang YC, Zhang Y, Zhou P, Huang S, Chen S, Xie Y, Hu D, Xiao B",Epilepsia,0.051,27037791,10.1111/epi.13372,-1
default_00734,https://pubmed.ncbi.nlm.nih.gov/27445736/,"Brain Gray Matter Abnormalities in First-Episode, Treatment-Naive Children with Obsessive-Compulsive Disorder.","Cheng B, Cai W, Wang X, Lei D, Guo Y, Yang X, Wu Q, Gong J, Gong Q, Ning G",Frontiers in behavioral neuroscience,0.051,27445736,10.3389/fnbeh.2016.00141,-1
default_00735,https://pubmed.ncbi.nlm.nih.gov/28756237/,Distinct resting-state functional connections associated with episodic and visuospatial memory in older adults.,"Suri S, Topiwala A, Filippini N, Zsoldos E, Mahmood A, Sexton CE, Singh-Manoux A, Kivimaki M, Mackay CE, Smith S, Ebmeier KP",NeuroImage,0.051,28756237,10.1016/j.neuroimage.2017.07.049,-1
default_00736,https://pubmed.ncbi.nlm.nih.gov/29656259/,"Increased coherence-based regional homogeneity in resting-state patients with first-episode, drug-naive somatization disorder.","Ou Y, Liu F, Chen J, Pan P, Wu R, Su Q, Zhang Z, Zhao J, Guo W",Journal of affective disorders,0.051,29656259,-1,-1
default_00737,https://pubmed.ncbi.nlm.nih.gov/19376239/,Gender differences in the functional and structural neuroanatomy of mathematical  cognition.,"Keller K, Menon V",NeuroImage,0.05,19376239,-1,-1
default_00738,https://pubmed.ncbi.nlm.nih.gov/20541837/,Diagnostic power of default mode network resting state fMRI in the detection of Alzheimer's disease.,"Koch W, Teipel S, Mueller S, Benninghoff J, Wagner M, Bokde AL, Hampel H, Coates U, Reiser M, Meindl T",Neurobiology of aging,0.05,20541837,-1,-1
default_00739,https://pubmed.ncbi.nlm.nih.gov/21277171/,Reduced prefrontal functional connectivity in the default mode network is related to greater psychopathology in subjects with high genetic loading for schizophrenia.,"Jang JH, Jung WH, Choi JS, Choi CH, Kang DH, Shin NY, Hong KS, Kwon JS",Schizophrenia research,0.05,21277171,-1,-1
default_00740,https://pubmed.ncbi.nlm.nih.gov/22569542/,Changes in the brain intrinsic organization in both on-task state and post-task resting state.,"Wang Z, Liu J, Zhong N, Qin Y, Zhou H, Li K",NeuroImage,0.05,22569542,-1,-1
default_00741,https://pubmed.ncbi.nlm.nih.gov/23727217/,"Links among resting-state default-mode network, salience network, and symptomatology in schizophrenia.","Orliac F, Naveau M, Joliot M, Delcroix N, Razafimandimby A, Brazo P, Dollfus S, Delamillieure P",Schizophrenia research,0.05,23727217,-1,-1
default_00742,https://pubmed.ncbi.nlm.nih.gov/23773060/,"Functional alteration patterns of default mode networks: comparisons of normal aging, amnestic mild cognitive impairment and Alzheimer's disease.","Cha J, Jo HJ, Kim HJ, Seo SW, Kim HS, Yoon U, Park H, Na DL, Lee JM",The European journal of neuroscience,0.05,23773060,-1,-1
default_00743,https://pubmed.ncbi.nlm.nih.gov/23826388/,Escitalopram Decreases Cross-Regional Functional Connectivity within the Default-Mode Network.,"van de Ven V, Wingen M, Kuypers KP, Ramaekers JG, Formisano E",PloS one,0.05,23826388,10.1371/journal.pone.0068355,-1
default_00744,https://pubmed.ncbi.nlm.nih.gov/23899724/,The amplitude of the resting-state fMRI global signal is related to EEG vigilance measures.,"Wong CW, Olafsson V, Tal O, Liu TT",NeuroImage,0.05,23899724,10.1016/j.neuroimage.2013.07.057,-1
default_00745,https://pubmed.ncbi.nlm.nih.gov/24578178/,Impacts of PICALM and CLU variants associated with Alzheimer's disease on the functional connectivity of the hippocampus in healthy young adults.,"Zhang P, Qin W, Wang D, Liu B, Zhang Y, Jiang T, Yu C",Brain structure & function,0.05,24578178,10.1007/s00429-014-0738-4,-1
default_00746,https://pubmed.ncbi.nlm.nih.gov/25164875/,Cognitive impairment and resting-state network connectivity in Parkinson's disease.,"Baggio HC, Segura B, Sala-Llonch R, Marti MJ, Valldeoriola F, Compta Y, Tolosa E, Junque C",Human brain mapping,0.05,25164875,10.1002/hbm.22622,-1
default_00747,https://pubmed.ncbi.nlm.nih.gov/25287513/,Multimodal MRI of the hippocampus in Parkinson's disease with visual hallucinations.,"Yao N, Cheung C, Pang S, Shek-Kwan Chang R, Lau KK, Suckling J, Yu K, Ka-Fung Mak H, Chua SE, Ho SL, McAlonan GM",Brain structure & function,0.05,25287513,-1,-1
default_00748,https://pubmed.ncbi.nlm.nih.gov/25339739/,Sex and disease-related alterations of anterior insula functional connectivity in chronic abdominal pain.,"Hong JY, Kilpatrick LA, Labus JS, Gupta A, Katibian D, Ashe-McNalley C, Stains J, Heendeniya N, Smith SR, Tillisch K, Naliboff B, Mayer EA",The Journal of neuroscience : the official journal of the Society for Neuroscience,0.05,25339739,-1,-1
default_00749,https://pubmed.ncbi.nlm.nih.gov/25765256/,Influence of epoch length on measurement of dynamic functional connectivity in wakefulness and behavioural validation in sleep.,"Wilson RS, Mayhew SD, Rollings DT, Goldstone A, Przezdzik I, Arvanitis TN, Bagshaw AP",NeuroImage,0.05,25765256,-1,-1
default_00750,https://pubmed.ncbi.nlm.nih.gov/25844310/,Age related-changes in the neural basis of self-generation in verbal paired associate learning.,"Vannest J, Maloney T, Kay B, Siegel M, Allendorfer JB, Banks C, Altaye M, Szaflarski JP",NeuroImage. Clinical,0.05,25844310,-1,-1
default_00751,https://pubmed.ncbi.nlm.nih.gov/25959682/,The trajectory of disturbed resting-state cerebral function in Parkinson's disease at different Hoehn and Yahr stages.,"Luo C, Guo X, Song W, Chen Q, Yang J, Gong Q, Shang HF",Human brain mapping,0.05,25959682,-1,-1
default_00752,https://pubmed.ncbi.nlm.nih.gov/26106555/,Altered resting brain connectivity in persistent cancer related fatigue.,"Hampson JP, Zick SM, Khabir T, Wright BD, Harris RE",NeuroImage. Clinical,0.05,26106555,-1,-1
default_00753,https://pubmed.ncbi.nlm.nih.gov/26221571/,"Repetitive speech elicits widespread deactivation in the human cortex: the ""Mantra"" effect?","Berkovich-Ohana A, Wilf M, Kahana R, Arieli A, Malach R",Brain and behavior,0.05,26221571,-1,-1
default_00754,https://pubmed.ncbi.nlm.nih.gov/26241476/,Disruptions in Resting State Functional Connectivity and Cerebral Blood Flow in Mild Traumatic Brain Injury Patients.,"Sours C, Zhuo J, Roys S, Shanmuganathan K, Gullapalli RP",PloS one,0.05,26241476,-1,-1
default_00755,https://pubmed.ncbi.nlm.nih.gov/26388754/,Impact of real-time fMRI working memory feedback training on the interactions between three core brain networks.,"Zhang Q, Zhang G, Yao L, Zhao X",Frontiers in behavioral neuroscience,0.05,26388754,-1,-1
default_00756,https://pubmed.ncbi.nlm.nih.gov/27199653/,Abnormalities of Inter- and Intra-Hemispheric Functional Connectivity in Autism Spectrum Disorders: A Study Using the Autism Brain Imaging Data Exchange Database.,"Lee JM, Kyeong S, Kim E, Cheon KA",Frontiers in neuroscience,0.05,27199653,-1,-1
default_00757,https://pubmed.ncbi.nlm.nih.gov/27391013/,Coupling between Theta Oscillations and Cognitive Control Network during Cross-Modal Visual and Auditory Attention: Supramodal vs Modality-Specific Mechanisms.,"Wang W, Viswanathan S, Lee T, Grafton ST",PloS one,0.05,27391013,-1,-1
default_00758,https://pubmed.ncbi.nlm.nih.gov/27818628/,How Attention Modulates Encoding of Dynamic Stimuli.,"Oren N, Shapira-Lichter I, Lerner Y, Tarrasch R, Hendler T, Giladi N, Ash EL",Frontiers in human neuroscience,0.05,27818628,-1,-1
default_00759,https://pubmed.ncbi.nlm.nih.gov/28192723/,Influence of age and cognitive performance on resting-state brain networks of older adults in a population-based cohort.,"Jockwitz C, Caspers S, Lux S, Eickhoff SB, Jutten K, Lenzen S, Moebus S, Pundt N, Reid A, Hoffstaedter F, Jockel KH, Erbel R, Cichon S, Nothen MM, Shah NJ, Zilles K, Amunts K",Cortex; a journal devoted to the study of the nervous system and behavior,0.05,28192723,-1,-1
default_00760,https://pubmed.ncbi.nlm.nih.gov/16473024/,Changes in hippocampal connectivity in the early stages of Alzheimer's disease: evidence from resting state fMRI.,"Wang L, Zang Y, He Y, Liang M, Zhang X, Tian L, Wu T, Jiang T, Li K",NeuroImage,0.049,16473024,-1,-1
default_00761,https://pubmed.ncbi.nlm.nih.gov/19434601/,"Dysregulation of working memory and default-mode networks in schizophrenia using  independent component analysis, an fBIRN and MCIC study.","Kim DI, Manoach DS, Mathalon DH, Turner JA, Mannell M, Brown GG, Ford JM, Gollub RL, White T, Wible C, Belger A, Bockholt HJ, Clark VP, Lauriello J, O'Leary D, Mueller BA, Lim KO, Andreasen N, Potkin SG, Calhoun VD",Human brain mapping,0.049,19434601,-1,-1
default_00762,https://pubmed.ncbi.nlm.nih.gov/20884359/,Representation of somatosensory inputs within the cortical autonomic network.,"Goswami R, Frances MF, Shoemaker JK",NeuroImage,0.049,20884359,10.1016/j.neuroimage.2010.09.050,-1
default_00763,https://pubmed.ncbi.nlm.nih.gov/20980597/,Expectation-driven changes in cortical functional connectivity influence working  memory and long-term memory performance.,"Bollinger J, Rubens MT, Zanto TP, Gazzaley A",The Journal of neuroscience : the official journal of the Society for Neuroscience,0.049,20980597,10.1523/JNEUROSCI.1547-10.2010,-1
default_00764,https://pubmed.ncbi.nlm.nih.gov/21368033/,Fractionating the default mode network: distinct contributions of the ventral and dorsal posterior cingulate cortex to cognitive control.,"Leech R, Kamourieh S, Beckmann CF, Sharp DJ",The Journal of neuroscience : the official journal of the Society for Neuroscience,0.049,21368033,10.1523/JNEUROSCI.5626-10.2011,-1
default_00765,https://pubmed.ncbi.nlm.nih.gov/23335976/,Sex differences in the processing of global vs. local stimulus aspects in a two-digit number comparison task--an fMRI study.,"Pletzer B, Kronbichler M, Nuerk HC, Kerschbaum H",PloS one,0.049,23335976,-1,-1
default_00766,https://pubmed.ncbi.nlm.nih.gov/23750275/,Resting state brain function analysis using concurrent BOLD in ASL perfusion fMRI.,"Zhu S, Fang Z, Hu S, Wang Z, Rao H",PloS one,0.049,23750275,-1,-1
default_00767,https://pubmed.ncbi.nlm.nih.gov/25716308/,Altered spontaneous brain activity in heavy smokers revealed by regional homogeneity.,"Wu G, Yang S, Zhu L, Lin F",Psychopharmacology,0.049,25716308,-1,-1
default_00768,https://pubmed.ncbi.nlm.nih.gov/26977802/,Altered Spontaneous Activity in Patients with Persistent Somatoform Pain Disorder Revealed by Regional Homogeneity.,"Huang T, Zhao Z, Yan C, Lu J, Li X, Tang C, Fan M, Luo Y",PloS one,0.049,26977802,-1,-1
default_00769,https://pubmed.ncbi.nlm.nih.gov/27071087/,Contrasting variability patterns in the default mode and sensorimotor networks balance in bipolar depression and mania.,"Martino M, Magioncalda P, Huang Z, Conio B, Piaggio N, Duncan NW, Rocchi G, Escelsior A, Marozzi V, Wolff A, Inglese M, Amore M, Northoff G",Proceedings of the National Academy of Sciences of the United States of America,0.049,27071087,-1,-1
default_00770,https://pubmed.ncbi.nlm.nih.gov/27318139/,Aberrant functional connectivity differentiates retrosplenial cortex from posterior cingulate cortex in prodromal Alzheimer's disease.,"Dillen KNH, Jacobs HIL, Kukolja J, von Reutern B, Richter N, Onur OA, Dronse J, Langen KJ, Fink GR",Neurobiology of aging,0.049,27318139,-1,-1
default_00771,https://pubmed.ncbi.nlm.nih.gov/28594841/,Probabilistic Entity-Relationship Diagram: A correlation between functional connectivity and spontaneous brain activity during resting state in major depressive disorder.,"Zhang L, Shi L, Zhang B, Zhao L, Dong Y, Liu J, Lian Z, Liang L, Chen W, Luo X, Pei S, Mo X, Huang W, Ouyang F, Guo B, Liang C, Zhang S",PloS one,0.049,28594841,-1,-1
default_00772,https://pubmed.ncbi.nlm.nih.gov/29410609/,Abnormal Resting-State Functional Connectivity of the Anterior Cingulate Cortex in Unilateral Chronic Tinnitus Patients.,"Chen YC, Liu S, Lv H, Bo F, Feng Y, Chen H, Xu JJ, Yin X, Wang S, Gu JP",Frontiers in neuroscience,0.049,29410609,-1,-1
default_00773,https://pubmed.ncbi.nlm.nih.gov/29477415/,Strength of resting-state functional connectivity associated with performance-adjustment ability.,"Kim J, Kang E",Behavioural brain research,0.049,29477415,-1,-1
default_00774,https://pubmed.ncbi.nlm.nih.gov/19478067/,Anterior cingulate cortex hypoactivations to an emotionally salient task in cocaine addiction.,"Goldstein RZ, Alia-Klein N, Tomasi D, Carrillo JH, Maloney T, Woicik PA, Wang R, Telang F, Volkow ND",Proceedings of the National Academy of Sciences of the United States of America,0.048,19478067,-1,-1
default_00775,https://pubmed.ncbi.nlm.nih.gov/21829668/,Anterior medial prefrontal cortex exhibits activation during task preparation but deactivation during task execution.,"Koshino H, Minamoto T, Ikeda T, Osaka M, Otsuka Y, Osaka N",PloS one,0.048,21829668,-1,-1
default_00776,https://pubmed.ncbi.nlm.nih.gov/22101380/,"Neural signatures of economic parameters during decision-making: a functional MRI (FMRI), electroencephalography (EEG) and autonomic monitoring study.","Minati L, Grisoli M, Franceschetti S, Epifani F, Granvillano A, Medford N, Harrison NA, Piacentini S, Critchley HD",Brain topography,0.048,22101380,-1,-1
default_00777,https://pubmed.ncbi.nlm.nih.gov/22424873/,Abnormal functional connectivity between the anterior cingulate and the default mode network in drug-naive boys with attention deficit hyperactivity disorder.,"Sun L, Cao Q, Long X, Sui M, Cao X, Zhu C, Zuo X, An L, Song Y, Zang Y, Wang Y",Psychiatry research,0.048,22424873,-1,-1
default_00778,https://pubmed.ncbi.nlm.nih.gov/23720623/,BOLD Frequency Power Indexes Working Memory Performance.,"Balsters JH, Robertson IH, Calhoun VD",Frontiers in human neuroscience,0.048,23720623,-1,-1
default_00779,https://pubmed.ncbi.nlm.nih.gov/24453120/,Establishing the resting state default mode network derived from functional magnetic resonance imaging tasks as an endophenotype: A twins study.,"Korgaonkar MS, Ram K, Williams LM, Gatt JM, Grieve SM",Human brain mapping,0.048,24453120,-1,-1
default_00780,https://pubmed.ncbi.nlm.nih.gov/24796655/,Adolescent risk-taking and resting state functional connectivity.,"DeWitt SJ, Aslan S, Filbey FM",Psychiatry research,0.048,24796655,-1,-1
default_00781,https://pubmed.ncbi.nlm.nih.gov/24824880/,A Correspondence between Individual Differences in the Brain's Intrinsic Functional Architecture and the Content and Form of Self-Generated Thoughts.,"Gorgolewski KJ, Lurie D, Urchs S, Kipping JA, Craddock RC, Milham MP, Margulies DS, Smallwood J",PloS one,0.048,24824880,10.1371/journal.pone.0097176,-1
default_00782,https://pubmed.ncbi.nlm.nih.gov/25324040/,Impairment of functional integration of the default mode network correlates with  cognitive outcome at three months after stroke.,"Dacosta-Aguayo R, Grana M, Iturria-Medina Y, Fernandez-Andujar M, Lopez-Cancio E, Caceres C, Bargallo N, Barrios M, Clemente I, Toran P, Fores R, Davalos A, Auer T, Mataro M",Human brain mapping,0.048,25324040,10.1002/hbm.22648,-1
default_00783,https://pubmed.ncbi.nlm.nih.gov/25779924/,Obesity is marked by distinct functional connectivity in brain networks involved  in food reward and salience.,"Wijngaarden MA, Veer IM, Rombouts SA, van Buchem MA, Willems van Dijk K, Pijl H, van der Grond J",Behavioural brain research,0.048,25779924,10.1016/j.bbr.2015.03.016,-1
default_00784,https://pubmed.ncbi.nlm.nih.gov/26281967/,Dysfunctional resting-state connectivities of brain regions with structural deficits in drug-naive first-episode schizophrenia adolescents.,"Zhang Y, Zheng J, Fan X, Guo X, Guo W, Yang G, Chen H, Zhao J, Lv L",Schizophrenia research,0.048,26281967,-1,-1
default_00785,https://pubmed.ncbi.nlm.nih.gov/27242492/,"Modulation of the Default Mode Network in First-Episode, Drug-Naive Major Depressive Disorder via Acupuncture at Baihui (GV20) Acupoint.","Deng D, Liao H, Duan G, Liu Y, He Q, Liu H, Tang L, Pang Y, Tao J",Frontiers in human neuroscience,0.048,27242492,-1,-1
default_00786,https://pubmed.ncbi.nlm.nih.gov/27444730/,Intrinsic network connectivity and own body perception in gender dysphoria.,"Feusner JD, Lidstrom A, Moody TD, Dhejne C, Bookheimer SY, Savic I",Brain imaging and behavior,0.048,27444730,-1,-1
default_00787,https://pubmed.ncbi.nlm.nih.gov/27459940/,Resting-state fMRI evidence for early episodic memory consolidation: effects of age.,"Kukolja J, Goreci DY, Onur OA, Riedl V, Fink GR",Neurobiology of aging,0.048,27459940,-1,-1
default_00788,https://pubmed.ncbi.nlm.nih.gov/28938513/,"Increased anterior default-mode network homogeneity in first-episode, drug-naive  major depressive disorder: A replication study.","Guo W, Cui X, Liu F, Chen J, Xie G, Wu R, Zhang Z, Chen H, Zhao J",Journal of affective disorders,0.048,28938513,-1,-1
default_00789,https://pubmed.ncbi.nlm.nih.gov/29249930/,Effects of Field-Map Distortion Correction on Resting State Functional Connectivity MRI.,"Togo H, Rokicki J, Yoshinaga K, Hisatsune T, Matsuda H, Haga N, Hanakawa T",Frontiers in neuroscience,0.048,29249930,-1,-1
default_00790,https://pubmed.ncbi.nlm.nih.gov/19403118/,Acute psychological stress reduces working memory-related activity in the dorsolateral prefrontal cortex.,"Qin S, Hermans EJ, van Marle HJ, Luo J, Fernandez G",Biological psychiatry,0.047,19403118,-1,-1
default_00791,https://pubmed.ncbi.nlm.nih.gov/19936244/,Evidence for anomalous network connectivity during working memory encoding in schizophrenia: an ICA based analysis.,"Meda SA, Stevens MC, Folley BS, Calhoun VD, Pearlson GD",PloS one,0.047,19936244,-1,-1
default_00792,https://pubmed.ncbi.nlm.nih.gov/20004726/,Effects of aging on default mode network activity in resting state fMRI: does the method of analysis matter?,"Koch W, Teipel S, Mueller S, Buerger K, Bokde AL, Hampel H, Coates U, Reiser M, Meindl T",NeuroImage,0.047,20004726,-1,-1
default_00793,https://pubmed.ncbi.nlm.nih.gov/21364890/,Impaired resting-state functional integrations within default mode network of generalized tonic-clonic seizures epilepsy.,"Song M, Du H, Wu N, Hou B, Wu G, Wang J, Feng H, Jiang T",PloS one,0.047,21364890,-1,-1
default_00794,https://pubmed.ncbi.nlm.nih.gov/22912754/,Abnormalities of resting state functional connectivity are related to sustained attention deficits in MS.,"Loitfelder M, Filippi M, Rocca M, Valsasina P, Ropele S, Jehna M, Fuchs S, Schmidt R, Neuper C, Fazekas F, Enzinger C",PloS one,0.047,22912754,-1,-1
default_00795,https://pubmed.ncbi.nlm.nih.gov/23575842/,Top-down regulation of default mode activity in spatial visual attention.,"Wen X, Liu Y, Yao L, Ding M",The Journal of neuroscience : the official journal of the Society for Neuroscience,0.047,23575842,-1,-1
default_00796,https://pubmed.ncbi.nlm.nih.gov/23799005/,Evidence of impaired brain activity balance after passive sensorimotor stimulation in multiple sclerosis.,"Petsas N, Tinelli E, Lenzi D, Tomassini V, Sbardella E, Tona F, Raz E, Nucciarelli V, Pozzilli C, Pantano P",PloS one,0.047,23799005,-1,-1
default_00797,https://pubmed.ncbi.nlm.nih.gov/24324420/,Situating emotional experience.,"Wilson-Mendenhall CD, Barrett LF, Barsalou LW",Frontiers in human neuroscience,0.047,24324420,-1,-1
default_00798,https://pubmed.ncbi.nlm.nih.gov/24944870/,The development and expression of physical nicotine dependence corresponds to structural and functional alterations in the anterior cingulate-precuneus pathway.,"Huang W, King JA, Ursprung WW, Zheng S, Zhang N, Kennedy DN, Ziedonis D, DiFranza JR",Brain and behavior,0.047,24944870,-1,-1
default_00799,https://pubmed.ncbi.nlm.nih.gov/25051341/,The neural mechanisms underlying the acute effect of cigarette smoking on chronic smokers.,"Wang K, Yang J, Zhang S, Wei D, Hao X, Tu S, Qiu J",PloS one,0.047,25051341,-1,-1
