paper_name,paper_url,Title,Author,Journal,Loading,PMID,Doi,download_status
default_00445,https://pubmed.ncbi.nlm.nih.gov/24904391/,Imaging the where and when of tic generation and resting state networks in adult  Tourette patients.,"Neuner I, Werner CJ, Arrubla J, Stocker T, Ehlen C, Wegener HP, Schneider F, Shah NJ",Frontiers in human neuroscience,0.063,24904391,-1,-1
default_00446,https://pubmed.ncbi.nlm.nih.gov/25017826/,Altered structural connectivity and trait anhedonia in patients with schizophrenia.,"Lee JS, Han K, Lee SK, Seok JH, Kim JJ",Neuroscience letters,0.063,25017826,-1,-1
default_00447,https://pubmed.ncbi.nlm.nih.gov/25115821/,Brain Circuitry Supporting Multi-Organ Autonomic Outflow in Response to Nausea.,"Sclocco R, Kim J, Garcia RG, Sheehan JD, Beissner F, Bianchi AM, Cerutti S, Kuo B, Barbieri R, Napadow V","Cerebral cortex (New York, N.Y. : 1991)",0.063,25115821,-1,-1
default_00448,https://pubmed.ncbi.nlm.nih.gov/25527112/,Neural correlates of self-deception and impression-management.,"Farrow TF, Burgess J, Wilkinson ID, Hunter MD",Neuropsychologia,0.063,25527112,-1,-1
default_00449,https://pubmed.ncbi.nlm.nih.gov/25942576/,Altered effective connectivity model in the default mode network between bipolar  and unipolar depression based on resting-state fMRI.,"Liu Y, Wu X, Zhang J, Guo X, Long Z, Yao L",Journal of affective disorders,0.063,25942576,-1,-1
default_00450,https://pubmed.ncbi.nlm.nih.gov/26184459/,"Aberrant functioning of the putamen links delusions, antipsychotic drug dose, and compromised connectivity in first episode psychosis--Preliminary fMRI findings.","Raij TT, Mantyla T, Kieseppa T, Suvisaari J",Psychiatry research,0.063,26184459,-1,-1
default_00451,https://pubmed.ncbi.nlm.nih.gov/26216276/,Brains striving for coherence: Long-term cumulative plot formation in the default mode network.,"Tylen K, Christensen P, Roepstorff A, Lund T, Ostergaard S, Donald M",NeuroImage,0.063,26216276,-1,-1
default_00452,https://pubmed.ncbi.nlm.nih.gov/26562059/,Load-related brain activation predicts spatial working memory performance in youth aged 9-12 and is associated with executive function at earlier ages.,"Huang AS, Klein DN, Leung HC",Developmental cognitive neuroscience,0.063,26562059,-1,-1
default_00453,https://pubmed.ncbi.nlm.nih.gov/27780529/,Self-similarity and recursion as default modes in human cognition.,"Fischmeister FP, Martins MJD, Beisteiner R, Fitch WT",Cortex; a journal devoted to the study of the nervous system and behavior,0.063,27780529,-1,-1
default_00454,https://pubmed.ncbi.nlm.nih.gov/29413534/,Income change alters default mode network connectivity for adolescents in poverty.,"Weissman DG, Conger RD, Robins RW, Hastings PD, Guyer AE",Developmental cognitive neuroscience,0.063,29413534,-1,-1
default_00455,https://pubmed.ncbi.nlm.nih.gov/29588124/,Connectivity of the precuneus-posterior cingulate cortex with the anterior cingulate cortex-medial prefrontal cortex differs consistently between control subjects and first-episode psychosis patients,"Rikandi E, Mantyla T, Lindgren M, Kieseppa T, Suvisaari J, Raij TT",Schizophrenia research,0.063,29588124,-1,-1
default_00456,https://pubmed.ncbi.nlm.nih.gov/16596654/,Analysis of functional image analysis contest (FIAC) data with brainvoyager QX: From single-subject to cortically aligned group general linear model analysis and self-organizing group independent comp,"Goebel R, Esposito F, Formisano E",Human brain mapping,0.062,16596654,-1,-1
default_00457,https://pubmed.ncbi.nlm.nih.gov/19427842/,Acupuncture modulates spontaneous activities in the anticorrelated resting brain  networks.,"Bai L, Qin W, Tian J, Dong M, Pan X, Chen P, Dai J, Yang W, Liu Y",Brain research,0.062,19427842,-1,-1
default_00458,https://pubmed.ncbi.nlm.nih.gov/19909818/,Identifying the brain's most globally connected regions.,"Cole MW, Pathak S, Schneider W",NeuroImage,0.062,19909818,-1,-1
default_00459,https://pubmed.ncbi.nlm.nih.gov/20363808/,What goes down must come up: role of the posteromedial cortices in encoding and retrieval.,"Vannini P, O'Brien J, O'Keefe K, Pihlajamaki M, Laviolette P, Sperling RA","Cerebral cortex (New York, N.Y. : 1991)",0.062,20363808,10.1093/cercor/bhq051,-1
default_00460,https://pubmed.ncbi.nlm.nih.gov/20627130/,Processing of disgusted faces is facilitated by odor primes: a functional MRI study.,"Seubert J, Kellermann T, Loughead J, Boers F, Brensinger C, Schneider F, Habel U",NeuroImage,0.062,20627130,10.1016/j.neuroimage.2010.07.012,-1
default_00461,https://pubmed.ncbi.nlm.nih.gov/21282317/,"The effects of age, memory performance, and callosal integrity on the neural correlates of successful associative encoding.","de Chastelaine M, Wang TH, Minton B, Muftuler LT, Rugg MD","Cerebral cortex (New York, N.Y. : 1991)",0.062,21282317,10.1093/cercor/bhq294,-1
default_00462,https://pubmed.ncbi.nlm.nih.gov/22108504/,Emotional faces and the default mode network.,"Sreenivas S, Boehm SG, Linden DE",Neuroscience letters,0.062,22108504,10.1016/j.neulet.2011.11.012,-1
default_00463,https://pubmed.ncbi.nlm.nih.gov/22178814/,Regional homogeneity of resting state fMRI signals predicts Stop signal task performance.,"Tian L, Ren J, Zang Y",NeuroImage,0.062,22178814,-1,-1
default_00464,https://pubmed.ncbi.nlm.nih.gov/22569063/,Effects of beta-amyloid accumulation on neural function during encoding across the adult lifespan.,"Kennedy KM, Rodrigue KM, Devous MD Sr, Hebrank AC, Bischof GN, Park DC",NeuroImage,0.062,22569063,-1,-1
default_00465,https://pubmed.ncbi.nlm.nih.gov/22585315/,Modulation of limbic-cerebellar functional connectivity enables alcoholics to recognize who is who.,"Pitel AL, Chanraud S, Muller-Oehring EM, Pfefferbaum A, Sullivan EV",Brain structure & function,0.062,22585315,-1,-1
default_00466,https://pubmed.ncbi.nlm.nih.gov/24315034/,Divergent task-dependent functional connectivity of executive control and salience networks.,"Elton A, Gao W",Cortex; a journal devoted to the study of the nervous system and behavior,0.062,24315034,-1,-1
default_00467,https://pubmed.ncbi.nlm.nih.gov/24409308/,Regional gray matter volume is associated with empathizing and systemizing in young adults.,"Takeuchi H, Taki Y, Sassa Y, Hashizume H, Sekiguchi A, Fukushima A, Kawashima R",PloS one,0.062,24409308,-1,-1
default_00468,https://pubmed.ncbi.nlm.nih.gov/24454814/,Regional homogeneity of intrinsic brain activity in happy and unhappy individuals.,"Luo Y, Huang X, Yang Z, Li B, Liu J, Wei D",PloS one,0.062,24454814,-1,-1
default_00469,https://pubmed.ncbi.nlm.nih.gov/24550791/,The effect of mild-to-moderate hearing loss on auditory and emotion processing networks.,"Husain FT, Carpenter-Thompson JR, Schmidt SA",Frontiers in systems neuroscience,0.062,24550791,-1,-1
default_00470,https://pubmed.ncbi.nlm.nih.gov/24675026/,Altered default mode and fronto-parietal network subsystems in patients with schizophrenia and their unaffected siblings.,"Chang X, Shen H, Wang L, Liu Z, Xin W, Hu D, Miao D",Brain research,0.062,24675026,-1,-1
default_00471,https://pubmed.ncbi.nlm.nih.gov/25319752/,Oppositional COMT Val158Met effects on resting state functional connectivity in adolescents and adults.,"Meyer BM, Huemer J, Rabl U, Boubela RN, Kalcher K, Berger A, Banaschewski T, Barker G, Bokde A, Buchel C, Conrod P, Desrivieres S, Flor H, Frouin V, Gallinat J, Garavan H, Heinz A, Ittermann B, Jia T, Lathrop M, Martinot JL, Nees F, Rietschel M, Smolka MN, Bartova L, Popovic A, Scharinger C, Sitte HH, Steiner H, Friedrich MH, Kasper S, Perkmann T, Praschak-Rieder N, Haslacher H, Esterbauer H, Moser E, Schumann G, Pezawas L",Brain structure & function,0.062,25319752,-1,-1
default_00472,https://pubmed.ncbi.nlm.nih.gov/25679198/,The patterns of fractional amplitude of low-frequency fluctuations in depression  patients: the dissociation between temporal regions and fronto-parietal regions.,"Lai CH, Wu YT",Journal of affective disorders,0.062,25679198,-1,-1
default_00473,https://pubmed.ncbi.nlm.nih.gov/25957017/,Dissociated large-scale functional connectivity networks of the precuneus in medication-naive first-episode depression.,"Peng D, Liddle EB, Iwabuchi SJ, Zhang C, Wu Z, Liu J, Jiang K, Xu L, Liddle PF, Palaniyappan L, Fang Y",Psychiatry research,0.062,25957017,-1,-1
default_00474,https://pubmed.ncbi.nlm.nih.gov/26973170/,Intrinsic functional network architecture of human semantic processing: Modules and hubs.,"Xu Y, Lin Q, Han Z, He Y, Bi Y",NeuroImage,0.062,26973170,-1,-1
default_00475,https://pubmed.ncbi.nlm.nih.gov/28625660/,Task-related and resting-state fMRI identify distinct networks that preferentially support remembering the past and imagining the future.,"Gilmore AW, Nelson SM, Chen HY, McDermott KB",Neuropsychologia,0.062,28625660,10.1016/j.neuropsychologia.2017.06.016,-1
default_00476,https://pubmed.ncbi.nlm.nih.gov/28648285/,Simultaneous learning of two languages from birth positively impacts intrinsic functional connectivity and cognitive control.,"Kousaie S, Chai XJ, Sander KM, Klein D",Brain and cognition,0.062,28648285,10.1016/j.bandc.2017.06.003,-1
default_00477,https://pubmed.ncbi.nlm.nih.gov/28827337/,Dynamic connectivity modulates local activity in the core regions of the default-mode network.,"Tang W, Liu H, Douw L, Kramer MA, Eden UT, Hamalainen MS, Stufflebeam SM",Proceedings of the National Academy of Sciences of the United States of America,0.062,28827337,10.1073/pnas.1702027114,-1
default_00478,https://pubmed.ncbi.nlm.nih.gov/19765560/,Abnormal resting-state functional connectivity of posterior cingulate cortex in amnestic type mild cognitive impairment.,"Bai F, Watson DR, Yu H, Shi Y, Yuan Y, Zhang Z",Brain research,0.061,19765560,10.1016/j.brainres.2009.09.028,-1
default_00479,https://pubmed.ncbi.nlm.nih.gov/20154013/,Dissociable connectivity within human angular gyrus and intraparietal sulcus: evidence from functional and structural connectivity.,"Uddin LQ, Supekar K, Amin H, Rykhlevskaia E, Nguyen DA, Greicius MD, Menon V","Cerebral cortex (New York, N.Y. : 1991)",0.061,20154013,10.1093/cercor/bhq011,-1
default_00480,https://pubmed.ncbi.nlm.nih.gov/21368086/,Disruption of functional connectivity of the default-mode network in alcoholism.,"Chanraud S, Pitel AL, Pfefferbaum A, Sullivan EV","Cerebral cortex (New York, N.Y. : 1991)",0.061,21368086,10.1093/cercor/bhq297,-1
default_00481,https://pubmed.ncbi.nlm.nih.gov/21451034/,Task-load-dependent activation of dopaminergic midbrain areas in the absence of reward.,"Boehler CN, Hopf JM, Krebs RM, Stoppel CM, Schoenfeld MA, Heinze HJ, Noesselt T",The Journal of neuroscience : the official journal of the Society for Neuroscience,0.061,21451034,-1,-1
default_00482,https://pubmed.ncbi.nlm.nih.gov/21813210/,Resting state fMRI in Alzheimer's disease: beyond the default mode network.,"Agosta F, Pievani M, Geroldi C, Copetti M, Frisoni GB, Filippi M",Neurobiology of aging,0.061,21813210,-1,-1
default_00483,https://pubmed.ncbi.nlm.nih.gov/22125269/,The function of the left angular gyrus in mental arithmetic: evidence from the associative confusion effect.,"Grabner RH, Ansari D, Koschutnig K, Reishofer G, Ebner F",Human brain mapping,0.061,22125269,-1,-1
default_00484,https://pubmed.ncbi.nlm.nih.gov/22344782/,Dynamic changes of ICA-derived EEG functional connectivity in the resting state.,"Chen JL, Ros T, Gruzelier JH",Human brain mapping,0.061,22344782,-1,-1
default_00485,https://pubmed.ncbi.nlm.nih.gov/22403155/,Counterfactual thinking: an fMRI study on changing the past for a better future.,"Van Hoeck N, Ma N, Ampe L, Baetens K, Vandekerckhove M, Van Overwalle F",Social cognitive and affective neuroscience,0.061,22403155,-1,-1
default_00486,https://pubmed.ncbi.nlm.nih.gov/22563003/,Reduced functional connectivity within and between 'social' resting state networks in autism spectrum conditions.,"von dem Hagen EA, Stoyanova RS, Baron-Cohen S, Calder AJ",Social cognitive and affective neuroscience,0.061,22563003,-1,-1
default_00487,https://pubmed.ncbi.nlm.nih.gov/22644759/,Trait anxiety and the neural efficiency of manipulation in working memory.,"Basten U, Stelzel C, Fiebach CJ","Cognitive, affective & behavioral neuroscience",0.061,22644759,-1,-1
default_00488,https://pubmed.ncbi.nlm.nih.gov/23245776/,Default mode network in young people with familial risk for psychosis--the Oulu Brain and Mind study.,"Jukuri T, Kiviniemi V, Nikkinen J, Miettunen J, Maki P, Jaaskelainen E, Mukkala S, Koivukangas J, Nordstrom T, Taanila A, Moilanen I, Heinimaa M, Barnett JH, Jones PB, Murray GK, Veijola J",Schizophrenia research,0.061,23245776,-1,-1
default_00489,https://pubmed.ncbi.nlm.nih.gov/25045065/,Functional correlates of cognitive dysfunction in multiple sclerosis: A multicenter fMRI Study.,"Rocca MA, Valsasina P, Hulst HE, Abdel-Aziz K, Enzinger C, Gallo A, Pareto D, Riccitelli G, Muhlert N, Ciccarelli O, Barkhof F, Fazekas F, Tedeschi G, Arevalo MJ, Filippi M",Human brain mapping,0.061,25045065,-1,-1
default_00490,https://pubmed.ncbi.nlm.nih.gov/25637267/,Long-term use of psychedelic drugs is associated with differences in brain structure and personality in humans.,"Bouso JC, Palhano-Fontes F, Rodriguez-Fornells A, Ribeiro S, Sanches R, Crippa JA, Hallak JE, de Araujo DB, Riba J",European neuropsychopharmacology : the journal of the European College of Neuropsychopharmacology,0.061,25637267,-1,-1
default_00491,https://pubmed.ncbi.nlm.nih.gov/25644693/,Default-mode network functional connectivity is closely related to metabolic activity.,"Passow S, Specht K, Adamsen TC, Biermann M, Brekke N, Craven AR, Ersland L, Gruner R, Kleven-Madsen N, Kvernenes OH, Schwarzlmuller T, Olesen RA, Hugdahl K",Human brain mapping,0.061,25644693,10.1002/hbm.22753,-1
default_00492,https://pubmed.ncbi.nlm.nih.gov/26003860/,Generating original ideas: The neural underpinning of originality.,"Mayseless N, Eran A, Shamay-Tsoory SG",NeuroImage,0.061,26003860,10.1016/j.neuroimage.2015.05.030,-1
default_00493,https://pubmed.ncbi.nlm.nih.gov/26299314/,Intrinsic brain indices of verbal working memory capacity in children and adolescents.,"Yang Z, Jutagir DR, Koyama MS, Craddock RC, Yan CG, Shehzad Z, Castellanos FX, Di Martino A, Milham MP",Developmental cognitive neuroscience,0.061,26299314,10.1016/j.dcn.2015.07.007,-1
default_00494,https://pubmed.ncbi.nlm.nih.gov/26904405/,Transdiagnostic commonalities and differences in resting state functional connectivity of the default mode network in schizophrenia and major depression.,"Schilbach L, Hoffstaedter F, Muller V, Cieslik EC, Goya-Maldonado R, Trost S, Sorg C, Riedl V, Jardri R, Sommer I, Kogler L, Derntl B, Gruber O, Eickhoff SB",NeuroImage. Clinical,0.061,26904405,-1,-1
default_00495,https://pubmed.ncbi.nlm.nih.gov/27012899/,Association of familial risk for schizophrenia with thalamic and medial prefrontal functional connectivity during attentional control.,"Antonucci LA, Taurisano P, Fazio L, Gelao B, Romano R, Quarto T, Porcelli A, Mancini M, Di Giorgio A, Caforio G, Pergola G, Popolizio T, Bertolino A, Blasi G",Schizophrenia research,0.061,27012899,-1,-1
default_00496,https://pubmed.ncbi.nlm.nih.gov/27607439/,Attention Network Dysfunction in Bulimia Nervosa - An fMRI Study.,"Seitz J, Hueck M, Dahmen B, Schulte-Ruther M, Legenbauer T, Herpertz-Dahlmann B, Konrad K",PloS one,0.061,27607439,-1,-1
default_00497,https://pubmed.ncbi.nlm.nih.gov/18033768/,Where vision meets memory: prefrontal-posterior networks for visual object constancy during categorization and recognition.,"Schendan HE, Stern CE","Cerebral cortex (New York, N.Y. : 1991)",0.06,18033768,-1,-1
default_00498,https://pubmed.ncbi.nlm.nih.gov/18281300/,Maturational changes in anterior cingulate and frontoparietal recruitment support the development of error processing and inhibitory control.,"Velanova K, Wheeler ME, Luna B","Cerebral cortex (New York, N.Y. : 1991)",0.06,18281300,-1,-1
default_00499,https://pubmed.ncbi.nlm.nih.gov/18771736/,Measuring brain connectivity: diffusion tensor imaging validates resting state temporal correlations.,"Skudlarski P, Jagannathan K, Calhoun VD, Hampson M, Skudlarska BA, Pearlson G",NeuroImage,0.06,18771736,-1,-1
default_00500,https://pubmed.ncbi.nlm.nih.gov/18840533/,Trial-by-trial coupling between EEG and BOLD identifies networks related to alpha and theta EEG power increases during working memory maintenance.,"Scheeringa R, Petersson KM, Oostenveld R, Norris DG, Hagoort P, Bastiaansen MC",NeuroImage,0.06,18840533,-1,-1
default_00501,https://pubmed.ncbi.nlm.nih.gov/21153806/,Modafinil modulation of the default mode network.,"Minzenberg MJ, Yoon JH, Carter CS",Psychopharmacology,0.06,21153806,-1,-1
default_00502,https://pubmed.ncbi.nlm.nih.gov/21238490/,Neural correlates of the interactive relationship between memory deficits and depressive symptoms in nondemented elderly: resting fMRI study.,"Goveas J, Xie C, Wu Z, Douglas Ward B, Li W, Franczak MB, Jones JL, Antuono PG, Yang Z, Li SJ",Behavioural brain research,0.06,21238490,-1,-1
default_00503,https://pubmed.ncbi.nlm.nih.gov/22743194/,"Anti-correlated networks, global signal regression, and the effects of caffeine in resting-state functional MRI.","Wong CW, Olafsson V, Tal O, Liu TT",NeuroImage,0.06,22743194,-1,-1
default_00504,https://pubmed.ncbi.nlm.nih.gov/23042731/,Meta-analytic connectivity modeling reveals differential functional connectivity  of the medial and lateral orbitofrontal cortex.,"Zald DH, McHugo M, Ray KL, Glahn DC, Eickhoff SB, Laird AR","Cerebral cortex (New York, N.Y. : 1991)",0.06,23042731,-1,-1
default_00505,https://pubmed.ncbi.nlm.nih.gov/24491950/,Decreased regional activity of default-mode network in unaffected siblings of schizophrenia patients at rest.,"Guo W, Su Q, Yao D, Jiang J, Zhang J, Zhang Z, Yu L, Zhai J, Xiao C",European neuropsychopharmacology : the journal of the European College of Neuropsychopharmacology,0.06,24491950,-1,-1
default_00506,https://pubmed.ncbi.nlm.nih.gov/24568865/,Unraveling Brain Functional Connectivity of encoding and retrieval in the context of education.,"Panda R, Bharath RD, George L, Kanungo S, Reddy RP, Upadhyay N, Thamodharan A, Rajeshwaran J, Rao SL, Gupta AK",Brain and cognition,0.06,24568865,-1,-1
default_00507,https://pubmed.ncbi.nlm.nih.gov/24767950/,Longitudinal assessment of default-mode brain function in aging.,"Persson J, Pudas S, Nilsson LG, Nyberg L",Neurobiology of aging,0.06,24767950,-1,-1
default_00508,https://pubmed.ncbi.nlm.nih.gov/24901995/,Ongoing activity in temporally coherent networks predicts intra-subject fluctuation of response time to sporadic executive control demands.,"Nozawa T, Sugiura M, Yokoyama R, Ihara M, Kotozaki Y, Miyauchi CM, Kanno A, Kawashima R",PloS one,0.06,24901995,-1,-1
default_00509,https://pubmed.ncbi.nlm.nih.gov/25271132/,Spatial and temporal functional connectivity changes between resting and attentive states.,"Bray S, Arnold AE, Levy RM, Iaria G",Human brain mapping,0.06,25271132,-1,-1
default_00510,https://pubmed.ncbi.nlm.nih.gov/25413496/,Working memory in preterm-born adults: Load-dependent compensatory activity of the posterior default mode network.,"Daamen M, Bauml JG, Scheef L, Sorg C, Busch B, Baumann N, Bartmann P, Wolke D, Wohlschlager A, Boecker H",Human brain mapping,0.06,25413496,-1,-1
default_00511,https://pubmed.ncbi.nlm.nih.gov/25746945/,"Dissociation of anatomical and functional alterations of the default-mode network in first-episode, drug-naive schizophrenia.","Guo W, Liu F, Xiao C, Zhang Z, Yu M, Liu J, Liu G, Zhao J",Clinical neurophysiology : official journal of the International Federation of Clinical Neurophysiology,0.06,25746945,10.1016/j.clinph.2015.01.025,-1
default_00512,https://pubmed.ncbi.nlm.nih.gov/26096080/,Wavelet-based regularity analysis reveals recurrent spatiotemporal behavior in resting-state fMRI.,"Smith RX, Jann K, Ances B, Wang DJ",Human brain mapping,0.06,26096080,10.1002/hbm.22865,-1
default_00513,https://pubmed.ncbi.nlm.nih.gov/26154563/,An EEG-fMRI Study on the Termination of Generalized Spike-And-Wave Discharges in  Absence Epilepsy.,"Benuzzi F, Ballotta D, Mirandola L, Ruggieri A, Vaudano AE, Zucchelli M, Ferrari E, Nichelli PF, Meletti S",PloS one,0.06,26154563,10.1371/journal.pone.0130943,-1
default_00514,https://pubmed.ncbi.nlm.nih.gov/26720411/,Increases in the right dorsolateral prefrontal cortex and decreases the rostral prefrontal cortex activation after-8 weeks of focused attention based mindfulness meditation.,"Tomasino B, Fabbro F",Brain and cognition,0.06,26720411,-1,-1
default_00515,https://pubmed.ncbi.nlm.nih.gov/27363008/,Facing competition: Neural mechanisms underlying parallel programming of antisaccades and prosaccades.,"Talanow T, Kasparbauer AM, Steffens M, Meyhofer I, Weber B, Smyrnis N, Ettinger U",Brain and cognition,0.06,27363008,-1,-1
default_00516,https://pubmed.ncbi.nlm.nih.gov/27414048/,Aberrant Resting-State Functional Connectivity in the Salience Network of Adolescent Chronic Fatigue Syndrome.,"Wortinger LA, Endestad T, Melinder AM, Oie MG, Sevenius A, Bruun Wyller V",PloS one,0.06,27414048,-1,-1
default_00517,https://pubmed.ncbi.nlm.nih.gov/28802184/,Functional neural bases of numerosity judgments in healthy adults born preterm.,"Clark CAC, Liu Y, Wright NLA, Bedrick A, Edgin JO",Brain and cognition,0.06,28802184,-1,-1
default_00518,https://pubmed.ncbi.nlm.nih.gov/29616472/,Risk seeking for losses modulates the functional connectivity of the default mode and left frontoparietal networks in young males.,"Deza Araujo YI, Nebe S, Neukam PT, Pooseh S, Sebold M, Garbusow M, Heinz A, Smolka MN","Cognitive, affective & behavioral neuroscience",0.06,29616472,-1,-1
default_00519,https://pubmed.ncbi.nlm.nih.gov/12595181/,A region of mesial prefrontal cortex tracks monetarily rewarding outcomes: characterization with rapid event-related fMRI.,"Knutson B, Fong GW, Bennett SM, Adams CM, Hommer D",NeuroImage,0.059,12595181,-1,-1
default_00520,https://pubmed.ncbi.nlm.nih.gov/17627848/,Distinct mechanisms of altered brain activation in patients with multiple sclerosis.,"Morgen K, Sammer G, Courtney SM, Wolters T, Melchior H, Blecker CR, Oschmann P, Kaps M, Vaitl D",NeuroImage,0.059,17627848,-1,-1
default_00521,https://pubmed.ncbi.nlm.nih.gov/18632288/,Frequency specificity of functional connectivity in brain networks.,"Wu CW, Gu H, Lu H, Stein EA, Chen JH, Yang Y",NeuroImage,0.059,18632288,-1,-1
default_00522,https://pubmed.ncbi.nlm.nih.gov/20420931/,Modality-specific and modality-independent components of the human imagery system.,"Daselaar SM, Porat Y, Huijbers W, Pennartz CM",NeuroImage,0.059,20420931,-1,-1
default_00523,https://pubmed.ncbi.nlm.nih.gov/20965253/,Semantic memory involvement in the default mode network: a functional neuroimaging study using independent component analysis.,"Wirth M, Jann K, Dierks T, Federspiel A, Wiest R, Horn H",NeuroImage,0.059,20965253,-1,-1
default_00524,https://pubmed.ncbi.nlm.nih.gov/21167644/,Abnormal cortical activity in patients with temporomandibular disorder evoked by  cognitive and emotional tasks.,"Weissman-Fogel I, Moayedi M, Tenenbaum HC, Goldberg MB, Freeman BV, Davis KD",Pain,0.059,21167644,-1,-1
default_00525,https://pubmed.ncbi.nlm.nih.gov/21296864/,Emotional and cognitive stimuli differentially engage the default network during  inductive reasoning.,"Eldaief MC, Deckersbach T, Carlson LE, Beucke JC, Dougherty DD",Social cognitive and affective neuroscience,0.059,21296864,-1,-1
default_00526,https://pubmed.ncbi.nlm.nih.gov/21298074/,Abnormal brain default-mode network functional connectivity in drug addicts.,"Ma N, Liu Y, Fu XM, Li N, Wang CX, Zhang H, Qian RB, Xu HS, Hu X, Zhang DR",PloS one,0.059,21298074,-1,-1
default_00527,https://pubmed.ncbi.nlm.nih.gov/21330468/,Development of the brain's default mode network from wakefulness to slow wave sleep.,"Samann PG, Wehrle R, Hoehn D, Spoormaker VI, Peters H, Tully C, Holsboer F, Czisch M","Cerebral cortex (New York, N.Y. : 1991)",0.059,21330468,-1,-1
default_00528,https://pubmed.ncbi.nlm.nih.gov/22227051/,The NOS1 variant rs6490121 is associated with variation in prefrontal function and grey matter density in healthy individuals.,"Rose EJ, Greene C, Kelly S, Morris DW, Robertson IH, Fahey C, Jacobson S, O'Doherty J, Newell FN, McGrath J, Bokde A, Garavan H, Frodl T, Gill M, Corvin AP, Donohoe G",NeuroImage,0.059,22227051,-1,-1
default_00529,https://pubmed.ncbi.nlm.nih.gov/22348896/,Age-related differences in cortical recruitment and suppression: implications for cognitive performance.,"Prakash RS, Heo S, Voss MW, Patterson B, Kramer AF",Behavioural brain research,0.059,22348896,-1,-1
default_00530,https://pubmed.ncbi.nlm.nih.gov/22662152/,Selective impairments of resting-state networks in minimal hepatic encephalopathy.,"Qi R, Zhang LJ, Xu Q, Zhong J, Wu S, Zhang Z, Liao W, Ni L, Zhang Z, Chen H, Zhong Y, Jiao Q, Wu X, Fan X, Liu Y, Lu G",PloS one,0.059,22662152,-1,-1
default_00531,https://pubmed.ncbi.nlm.nih.gov/22711646/,Theta power during encoding predicts subsequent-memory performance and default mode network deactivation.,"White TP, Jansen M, Doege K, Mullinger KJ, Park SB, Liddle EB, Gowland PA, Francis ST, Bowtell R, Liddle PF",Human brain mapping,0.059,22711646,10.1002/hbm.22114,-1
default_00532,https://pubmed.ncbi.nlm.nih.gov/23408984/,Cortical signatures of dyslexia and remediation: an intrinsic functional connectivity approach.,"Koyama MS, Di Martino A, Kelly C, Jutagir DR, Sunshine J, Schwartz SJ, Castellanos FX, Milham MP",PloS one,0.059,23408984,10.1371/journal.pone.0055454,-1
default_00533,https://pubmed.ncbi.nlm.nih.gov/23755002/,"Combination of Resting State fMRI, DTI, and sMRI Data to Discriminate Schizophrenia by N-way MCCA + jICA.","Sui J, He H, Yu Q, Chen J, Rogers J, Pearlson GD, Mayer A, Bustillo J, Canive J, Calhoun VD",Frontiers in human neuroscience,0.059,23755002,10.3389/fnhum.2013.00235,-1
