paper_name,paper_url,Title,Author,Journal,Loading,PMID,Doi,download_status
depressed_00176,https://pubmed.ncbi.nlm.nih.gov/27912160/,Successful group psychotherapy of depression in adolescents alters fronto-limbic  resting-state connectivity.,"Straub J, Metzger CD, Plener PL, Koelch MG, Groen G, Abler B",Journal of affective disorders,0.077,27912160,-1,-1
depressed_00177,https://pubmed.ncbi.nlm.nih.gov/18805589/,Blood pressure and white matter integrity in geriatric depression.,"Hoptman MJ, Gunning-Dixon FM, Murphy CF, Ardekani BA, Hrabe J, Lim KO, Etwaroo GR, Kanellopoulos D, Alexopoulos GS",Journal of affective disorders,0.076,18805589,-1,-1
depressed_00178,https://pubmed.ncbi.nlm.nih.gov/19307251/,In search of the depressive self: extended medial prefrontal network during self-referential processing in major depression.,"Lemogne C, le Bastard G, Mayberg H, Volle E, Bergouignan L, Lehericy S, Allilaire JF, Fossati P",Social cognitive and affective neuroscience,0.076,19307251,-1,-1
depressed_00179,https://pubmed.ncbi.nlm.nih.gov/20674286/,Dopaminergic modulation of the default mode network in Parkinson's disease.,"Delaveau P, Salgado-Pineda P, Fossati P, Witjas T, Azulay JP, Blin O",European neuropsychopharmacology : the journal of the European College of Neuropsychopharmacology,0.076,20674286,-1,-1
depressed_00180,https://pubmed.ncbi.nlm.nih.gov/26411798/,Effects of acute tryptophan depletion on raphe functional connectivity in depression.,"Weinstein JJ, Rogers BP, Taylor WD, Boyd BD, Cowan RL, Shelton KM, Salomon RM",Psychiatry research,0.076,26411798,-1,-1
depressed_00181,https://pubmed.ncbi.nlm.nih.gov/28772145/,Lithium monotherapy associated clinical improvement effects on amygdala-ventromedial prefrontal cortex resting state connectivity in bipolar disorder.,"Altinay M, Karne H, Anand A",Journal of affective disorders,0.075,28772145,-1,-1
depressed_00182,https://pubmed.ncbi.nlm.nih.gov/21283580/,Individualized and clinically derived stimuli activate limbic structures in depression: an fMRI study.,"Kessler H, Taubner S, Buchheim A, Munte TF, Stasch M, Kachele H, Roth G, Heinecke A, Erhard P, Cierpka M, Wiswede D",PloS one,0.074,21283580,-1,-1
depressed_00183,https://pubmed.ncbi.nlm.nih.gov/20630713/,Habitual emotion regulation strategies and depressive symptoms in healthy subjects predict fMRI brain activation patterns related to major depression.,"Abler B, Hofer C, Walter H, Erk S, Hoffmann H, Traue HC, Kessler H",Psychiatry research,0.073,20630713,-1,-1
depressed_00184,https://pubmed.ncbi.nlm.nih.gov/16632333/,Altered brain activation in dorsolateral prefrontal cortex in adolescents and young adults at genetic risk for schizophrenia: an fMRI study of working memory.,"Seidman LJ, Thermenos HW, Poldrack RA, Peace NK, Koch JK, Faraone SV, Tsuang MT",Schizophrenia research,0.072,16632333,-1,-1
depressed_00185,https://pubmed.ncbi.nlm.nih.gov/18601940/,Risk for depression is associated with neural biases in emotional categorisation.,"Chan SW, Harmer CJ, Goodwin GM, Norbury R",Neuropsychologia,0.072,18601940,-1,-1
depressed_00186,https://pubmed.ncbi.nlm.nih.gov/24363644/,Neural activity in relation to empirically derived personality syndromes in depression using a psychodynamic fMRI paradigm.,"Taubner S, Wiswede D, Kessler H",Frontiers in human neuroscience,0.072,24363644,-1,-1
depressed_00187,https://pubmed.ncbi.nlm.nih.gov/25462395/,Cortico-limbic network abnormalities in individuals with current and past major depressive disorder.,"Klauser P, Fornito A, Lorenzetti V, Davey CG, Dwyer DB, Allen NB, Yucel M",Journal of affective disorders,0.072,25462395,-1,-1
depressed_00188,https://pubmed.ncbi.nlm.nih.gov/19931400/,BDNF gene polymorphism (Val66Met) predicts amygdala and anterior hippocampus responses to emotional faces in anxious and depressed adolescents.,"Lau JY, Goldman D, Buzas B, Hodgkinson C, Leibenluft E, Nelson E, Sankin L, Pine DS, Ernst M",NeuroImage,0.071,19931400,-1,-1
depressed_00189,https://pubmed.ncbi.nlm.nih.gov/20800687/,Amygdala responsivity related to memory of emotionally neutral stimuli constitutes a trait factor for depression.,"van Eijndhoven P, van Wingen G, Fernandez G, Rijpkema M, Verkes RJ, Buitelaar J, Tendolkar I",NeuroImage,0.071,20800687,-1,-1
depressed_00190,https://pubmed.ncbi.nlm.nih.gov/22871393/,Emotional response inhibition in bipolar disorder: a functional magnetic resonance imaging study of trait- and state-related abnormalities.,"Hummer TA, Hulvershorn LA, Karne HS, Gunn AD, Wang Y, Anand A",Biological psychiatry,0.071,22871393,-1,-1
depressed_00191,https://pubmed.ncbi.nlm.nih.gov/22037687/,Distinct but overlapping neural networks subserve depression and insecure attachment.,"Galynker II, Yaseen ZS, Katz C, Zhang X, Jennings-Donovan G, Dashnaw S, Hirsch J, Mayberg H, Cohen LJ, Winston A",Social cognitive and affective neuroscience,0.069,22037687,10.1093/scan/nsr074,-1
depressed_00192,https://pubmed.ncbi.nlm.nih.gov/23910949/,Resting-state functional connectivity of subgenual anterior cingulate cortex in depressed adolescents.,"Connolly CG, Wu J, Ho TC, Hoeft F, Wolkowitz O, Eisendrath S, Frank G, Hendren R, Max JE, Paulus MP, Tapert SF, Banerjee D, Simmons AN, Yang TT",Biological psychiatry,0.069,23910949,10.1016/j.biopsych.2013.05.036,-1
depressed_00193,https://pubmed.ncbi.nlm.nih.gov/24270043/,Cognitive control network connectivity in adolescent women with and without a parental history of depression.,"Clasen PC, Beevers CG, Mumford JA, Schnyer DM",Developmental cognitive neuroscience,0.069,24270043,10.1016/j.dcn.2013.10.008,-1
depressed_00194,https://pubmed.ncbi.nlm.nih.gov/27284693/,Neural Processing of Emotional Musical and Nonmusical Stimuli in Depression.,"Lepping RJ, Atchley RA, Chrysikou E, Martin LE, Clair AA, Ingram RE, Simmons WK, Savage CR",PloS one,0.069,27284693,-1,-1
depressed_00195,https://pubmed.ncbi.nlm.nih.gov/19101126/,Reduced gray matter volume in ventral prefrontal cortex but not amygdala in bipolar disorder: significant effects of gender and trait anxiety.,"Almeida JR, Akkal D, Hassel S, Travis MJ, Banihashemi L, Kerr N, Kupfer DJ, Phillips ML",Psychiatry research,0.067,19101126,-1,-1
depressed_00196,https://pubmed.ncbi.nlm.nih.gov/23616377/,Unsupervised classification of major depression using functional connectivity MRI.,"Zeng LL, Shen H, Liu L, Hu D",Human brain mapping,0.067,23616377,-1,-1
depressed_00197,https://pubmed.ncbi.nlm.nih.gov/26106565/,Functional and structural brain correlates of risk for major depression in children with familial depression.,"Chai XJ, Hirshfeld-Becker D, Biederman J, Uchida M, Doehrmann O, Leonard JA, Salvatore J, Kenworthy T, Brown A, Kagan E, de Los Angeles C, Whitfield-Gabrieli S, Gabrieli JD",NeuroImage. Clinical,0.067,26106565,-1,-1
depressed_00198,https://pubmed.ncbi.nlm.nih.gov/28384269/,"Amplitude of low-frequency fluctuations in first-episode, drug-naive depressive patients: A 5-year retrospective study.","Zhang K, Liu Z, Cao X, Yang C, Xu Y, Xu T, Xu C, Yang Z",PloS one,0.067,28384269,-1,-1
depressed_00199,https://pubmed.ncbi.nlm.nih.gov/23063450/,Basal ganglia are active during motor performance recovery after a demanding motor task.,"Bonzano L, Tacchino A, Saitta L, Roccatagliata L, Avanzino L, Mancardi GL, Bove M",NeuroImage,0.065,23063450,-1,-1
depressed_00200,https://pubmed.ncbi.nlm.nih.gov/27668175/,Changes of grey matter volume in first-episode drug-naive adult major depressive  disorder patients with different age-onset.,"Shen Z, Cheng Y, Yang S, Dai N, Ye J, Liu X, Lu J, Li N, Liu F, Lu Y, Sun X, Xu X",NeuroImage. Clinical,0.065,27668175,-1,-1
depressed_00201,https://pubmed.ncbi.nlm.nih.gov/28126471/,Decreased functional connectivity between the dorsal anterior cingulate cortex and lingual gyrus in Alzheimer's disease patients with depression.,"Liu X, Chen W, Hou H, Chen X, Zhang J, Liu J, Guo Z, Bai G",Behavioural brain research,0.065,28126471,-1,-1
depressed_00202,https://pubmed.ncbi.nlm.nih.gov/29765312/,"Associations Between Daily Mood States and Brain Gray Matter Volume, Resting-State Functional Connectivity and Task-Based Activity in Healthy Adults.","Ismaylova E, Di Sante J, Gouin JP, Pomares FB, Vitaro F, Tremblay RE, Booij L",Frontiers in human neuroscience,0.065,29765312,-1,-1
depressed_00203,https://pubmed.ncbi.nlm.nih.gov/27721206/,The cortical thickness correlates of clinical manifestations in the mid-stage sporadic Parkinson's disease.,"Deng X, Tang CY, Zhang J, Zhu L, Xie ZC, Gong HH, Xiao XZ, Xu RS",Neuroscience letters,0.063,27721206,-1,-1
depressed_00204,https://pubmed.ncbi.nlm.nih.gov/29020651/,Is negative self-referent bias an endophenotype for depression? An fMRI study of  emotional self-referent words in twins at high vs. low risk of depression.,"Miskowiak KW, Larsen JE, Harmer CJ, Siebner HR, Kessing LV, Macoveanu J, Vinberg M",Journal of affective disorders,0.063,29020651,-1,-1
depressed_00205,https://pubmed.ncbi.nlm.nih.gov/18950748/,Amygdala function and 5-HTT gene variants in adolescent anxiety and major depressive disorder.,"Lau JY, Goldman D, Buzas B, Fromm SJ, Guyer AE, Hodgkinson C, Monk CS, Nelson EE, Shen PH, Pine DS, Ernst M",Biological psychiatry,0.061,18950748,-1,-1
depressed_00206,https://pubmed.ncbi.nlm.nih.gov/22177602/,"Evidence of a dissociation pattern in resting-state default mode network connectivity in first-episode, treatment-naive major depression patients.","Zhu X, Wang X, Xiao J, Liao J, Zhong M, Wang W, Yao S",Biological psychiatry,0.06,22177602,-1,-1
depressed_00207,https://pubmed.ncbi.nlm.nih.gov/24369885/,Reduced reward anticipation in youth at high-risk for unipolar depression: a preliminary study.,"Olino TM, McMakin DL, Morgan JK, Silk JS, Birmaher B, Axelson DA, Williamson DE, Dahl RE, Ryan ND, Forbes EE",Developmental cognitive neuroscience,0.06,24369885,-1,-1
depressed_00208,https://pubmed.ncbi.nlm.nih.gov/22206877/,Functional magnetic resonance imaging correlates of emotional word encoding and recognition in depression and anxiety disorders.,"van Tol MJ, Demenescu LR, van der Wee NJ, Kortekaas R, Marjan M A N, Boer JA, Renken RJ, van Buchem MA, Zitman FG, Aleman A, Veltman DJ",Biological psychiatry,0.059,22206877,-1,-1
depressed_00209,https://pubmed.ncbi.nlm.nih.gov/21246665/,Cognitive appraisal and life stress moderate the effects of the 5-HTTLPR polymorphism on amygdala reactivity.,"Lemogne C, Gorwood P, Boni C, Pessiglione M, Lehericy S, Fossati P",Human brain mapping,0.058,21246665,-1,-1
depressed_00210,https://pubmed.ncbi.nlm.nih.gov/23620758/,Modulatory effects of the piccolo genotype on emotional memory in health and depression.,"Woudstra S, van Tol MJ, Bochdanovits Z, van der Wee NJ, Zitman FG, van Buchem MA, Opmeer EM, Aleman A, Penninx BW, Veltman DJ, Hoogendijk WJ",PloS one,0.058,23620758,-1,-1
depressed_00211,https://pubmed.ncbi.nlm.nih.gov/26971253/,The association between stress and mood across the adult lifespan on default mode network.,"Soares JM, Marques P, Magalhaes R, Santos NC, Sousa N",Brain structure & function,0.058,26971253,10.1007/s00429-016-1203-3,-1
depressed_00212,https://pubmed.ncbi.nlm.nih.gov/28910390/,Identify changes of brain regional homogeneity in early and later adult onset patients with first-episode depression using resting-state fMRI.,"Shen Z, Jiang L, Yang S, Ye J, Dai N, Liu X, Li N, Lu J, Liu F, Lu Y, Sun X, Cheng Y, Xu X",PloS one,0.055,28910390,10.1371/journal.pone.0184712,-1
depressed_00213,https://pubmed.ncbi.nlm.nih.gov/28392302/,"Don't worry, be happy - Neural correlates of the influence of musically induced mood on self-evaluation.","Oetken S, Pauly KD, Gur RC, Schneider F, Habel U, Pohl A",Neuropsychologia,0.05,28392302,-1,-1
depressed_00214,https://pubmed.ncbi.nlm.nih.gov/29736883/,Abnormalities of regional homogeneity and its correlation with clinical symptoms  in Naive patients with first-episode schizophrenia.,"Zhao X, Yao J, Lv Y, Zhang X, Han C, Chen L, Ren F, Jin Z, Li Y, Sui Y",Brain imaging and behavior,0.041,29736883,-1,-1
