paper_name,paper_url,Title,Author,Journal,Loading,PMID,Doi,download_status
depressed_00001,https://pubmed.ncbi.nlm.nih.gov/17217926/,Diurnal variation in regional brain glucose metabolism in depression.,"Germain A, Nofzinger EA, Meltzer CC, Wood A, Kupfer DJ, Moore RY, Buysse DJ",Biological psychiatry,0.537,17217926,-1,-1
depressed_00002,https://pubmed.ncbi.nlm.nih.gov/15955496/,Cognitive control and brain resources in major depression: an fMRI study using the n-back task.,"Harvey PO, Fossati P, Pochon JB, Levy R, Lebastard G, Lehericy S, Allilaire JF, Dubois B",NeuroImage,0.527,15955496,-1,-1
depressed_00003,https://pubmed.ncbi.nlm.nih.gov/21257158/,Increased amygdala response to positive social feedback in young people with major depressive disorder.,"Davey CG, Allen NB, Harrison BJ, Yucel M",Biological psychiatry,0.494,21257158,-1,-1
depressed_00004,https://pubmed.ncbi.nlm.nih.gov/22820298/,Spatial patterns of intrinsic neural activity in depressed patients with vascular risk factors as revealed by the amplitude of low-frequency fluctuation.,"Zhu Z, Lu Q, Meng X, Jiang Q, Peng L, Wang Q",Brain research,0.493,22820298,-1,-1
depressed_00005,https://pubmed.ncbi.nlm.nih.gov/26943454/,Neural correlates of self-perceptions in adolescents with major depressive disorder.,"Bradley KA, Colcombe S, Henderson SE, Alonso CM, Milham MP, Gabbay V",Developmental cognitive neuroscience,0.487,26943454,-1,-1
depressed_00006,https://pubmed.ncbi.nlm.nih.gov/16780808/,Event-related functional magnetic resonance imaging measures of neural activity to positive social stimuli in pre- and post-treatment depression.,"Schaefer HS, Putnam KM, Benca RM, Davidson RJ",Biological psychiatry,0.474,16780808,-1,-1
depressed_00007,https://pubmed.ncbi.nlm.nih.gov/26639452/,Abnormal brain activation during directed forgetting of negative memory in depressed patients.,"Yang W, Chen Q, Liu P, Cheng H, Cui Q, Wei D, Zhang Q, Qiu J",Journal of affective disorders,0.468,26639452,-1,-1
depressed_00008,https://pubmed.ncbi.nlm.nih.gov/25795386/,Altered functional connectivity between medial prefrontal cortex and the inferior brainstem in major depression during appraisal of subjective emotional responses: A preliminary study.,"Smith R, Allen JJ, Thayer JF, Lane RD",Biological psychology,0.449,25795386,-1,-1
depressed_00009,https://pubmed.ncbi.nlm.nih.gov/11983183/,Can't shake that feeling: event-related fMRI assessment of sustained amygdala activity in response to emotional information in depressed individuals.,"Siegle GJ, Steinhauer SR, Thase ME, Stenger VA, Carter CS",Biological psychiatry,0.439,11983183,-1,-1
depressed_00010,https://pubmed.ncbi.nlm.nih.gov/19376240/,An fMRI study of cytokine-induced depressed mood and social pain: the role of sex differences.,"Eisenberger NI, Inagaki TK, Rameson LT, Mashal NM, Irwin MR",NeuroImage,0.419,19376240,-1,-1
depressed_00011,https://pubmed.ncbi.nlm.nih.gov/16227541/,Possible structural abnormality of the brainstem in unipolar depressive illness:  a transcranial ultrasound and diffusion tensor magnetic resonance imaging study.,"Steele JD, Bastin ME, Wardlaw JM, Ebmeier KP","Journal of neurology, neurosurgery, and psychiatry",0.395,16227541,-1,-1
depressed_00012,https://pubmed.ncbi.nlm.nih.gov/28477499/,Neural correlates of autobiographical problem-solving deficits associated with rumination in depression.,"Jones NP, Fournier JC, Stone LB",Journal of affective disorders,0.391,28477499,-1,-1
depressed_00013,https://pubmed.ncbi.nlm.nih.gov/21050725/,Trait and state dependent functional impairments in bipolar disorder.,"Van der Schot A, Kahn R, Ramsey N, Nolen W, Vink M",Psychiatry research,0.387,21050725,-1,-1
depressed_00014,https://pubmed.ncbi.nlm.nih.gov/19962859/,Neural correlates of inhibitory deficits in depression.,"Eugene F, Joormann J, Cooney RE, Atlas LY, Gotlib IH",Psychiatry research,0.384,19962859,-1,-1
depressed_00015,https://pubmed.ncbi.nlm.nih.gov/23532800/,Neurophysiological correlates of anhedonia in feedback processing.,"Mies GW, Van den Berg I, Franken IH, Smits M, Van der Molen MW, Van der Veen FM",Frontiers in human neuroscience,0.38,23532800,-1,-1
depressed_00016,https://pubmed.ncbi.nlm.nih.gov/28802727/,Brain activation during processing of genuine facial emotion in depression: Preliminary findings.,"Groves SJ, Pitcher TL, Melzer TR, Jordan J, Carter JD, Malhi GS, Johnston LC, Porter RJ",Journal of affective disorders,0.38,28802727,-1,-1
depressed_00017,https://pubmed.ncbi.nlm.nih.gov/19007997/,Regional homogeneity in depression and its relationship with separate depressive  symptom clusters: a resting-state fMRI study.,"Yao Z, Wang L, Lu Q, Liu H, Teng G",Journal of affective disorders,0.376,19007997,-1,-1
depressed_00018,https://pubmed.ncbi.nlm.nih.gov/20719303/,Inflammation-induced anhedonia: endotoxin reduces ventral striatum responses to reward.,"Eisenberger NI, Berkman ET, Inagaki TK, Rameson LT, Mashal NM, Irwin MR",Biological psychiatry,0.375,20719303,10.1016/j.biopsych.2010.06.010,-1
depressed_00019,https://pubmed.ncbi.nlm.nih.gov/20599362/,The effect of acute citalopram on face emotion processing in remitted depression: a pharmacoMRI study.,"Anderson IM, Juhasz G, Thomas E, Downey D, McKie S, Deakin JF, Elliott R",European neuropsychopharmacology : the journal of the European College of Neuropsychopharmacology,0.359,20599362,10.1016/j.euroneuro.2010.06.008,-1
depressed_00020,https://pubmed.ncbi.nlm.nih.gov/26805672/,Disentangling introspective and exteroceptive attentional control from emotional  appraisal in depression using fMRI: A preliminary study.,"Smith R, Baxter LC, Thayer JF, Lane RD",Psychiatry research. Neuroimaging,0.356,26805672,10.1016/j.pscychresns.2016.01.009,-1
depressed_00021,https://pubmed.ncbi.nlm.nih.gov/27649971/,Cognitive and neural consequences of memory suppression in major depressive disorder.,"Sacchet MD, Levy BJ, Hamilton JP, Maksimovskiy A, Hertel PT, Joormann J, Anderson MC, Wagner AD, Gotlib IH","Cognitive, affective & behavioral neuroscience",0.354,27649971,-1,-1
depressed_00022,https://pubmed.ncbi.nlm.nih.gov/17699669/,Failure to regulate: counterproductive recruitment of top-down prefrontal-subcortical circuitry in major depression.,"Johnstone T, van Reekum CM, Urry HL, Kalin NH, Davidson RJ",The Journal of neuroscience : the official journal of the Society for Neuroscience,0.351,17699669,-1,-1
depressed_00023,https://pubmed.ncbi.nlm.nih.gov/26073417/,Neural substrates of negativity bias in women with and without major depression.,"Gollan JK, Connolly M, Buchanan A, Hoxha D, Rosebrock L, Cacioppo J, Csernansky J, Wang X",Biological psychology,0.35,26073417,-1,-1
depressed_00024,https://pubmed.ncbi.nlm.nih.gov/27876651/,Ventral Striatum Functional Connectivity during Rewards and Losses and Symptomatology in Depressed Patients.,"Quevedo K, Ng R, Scott H, Kodavaganti S, Smyda G, Diwadkar V, Phillips M",Biological psychology,0.345,27876651,-1,-1
depressed_00025,https://pubmed.ncbi.nlm.nih.gov/23017544/,Antidepressant effects of sertraline associated with volume increases in dorsolateral prefrontal cortex.,"Smith R, Chen K, Baxter L, Fort C, Lane RD",Journal of affective disorders,0.344,23017544,-1,-1
depressed_00026,https://pubmed.ncbi.nlm.nih.gov/25610773/,Fusion analysis of first episode depression: Where brain shape deformations meet  local composition of tissue.,"Ramezani M, Abolmaesumi P, Tahmasebi A, Bosma R, Tong R, Hollenstein T, Harkness K, Johnsrude I",NeuroImage. Clinical,0.341,25610773,-1,-1
depressed_00027,https://pubmed.ncbi.nlm.nih.gov/20401747/,Erythropoietin modulates neural and cognitive processing of emotional information in biomarker models of antidepressant drug action in depressed patients.,"Miskowiak KW, Favaron E, Hafizi S, Inkster B, Goodwin GM, Cowen PJ, Harmer CJ",Psychopharmacology,0.336,20401747,-1,-1
depressed_00028,https://pubmed.ncbi.nlm.nih.gov/17678634/,Elevated serotonin transporter binding in major depressive disorder assessed using positron emission tomography and [11C]DASB; comparison with bipolar disorder.,"Cannon DM, Ichise M, Rollis D, Klaver JM, Gandhi SK, Charney DS, Manji HK, Drevets WC",Biological psychiatry,0.335,17678634,-1,-1
depressed_00029,https://pubmed.ncbi.nlm.nih.gov/24121137/,Difference in amplitude of low-frequency fluctuation between currently depressed  and remitted females with major depressive disorder.,"Jing B, Liu CH, Ma X, Yan HG, Zhuo ZZ, Zhang Y, Wang SH, Li HY, Wang CY",Brain research,0.334,24121137,-1,-1
depressed_00030,https://pubmed.ncbi.nlm.nih.gov/26655583/,Antidepressant short-term and long-term brain effects during self-referential processing in major depression.,"Delaveau P, Jabourian M, Lemogne C, Allaili N, Choucha W, Girault N, Lehericy S, Laredo J, Fossati P",Psychiatry research. Neuroimaging,0.332,26655583,-1,-1
depressed_00031,https://pubmed.ncbi.nlm.nih.gov/27107157/,Cortical abnormalities in Parkinson's disease patients and relationship to depression: A surface-based morphometry study.,"Huang P, Lou Y, Xuan M, Gu Q, Guan X, Xu X, Song Z, Luo W, Zhang M",Psychiatry research. Neuroimaging,0.329,27107157,-1,-1
depressed_00032,https://pubmed.ncbi.nlm.nih.gov/19945172/,Self-referential processing and the prefrontal cortex over the course of depression: a pilot study.,"Lemogne C, Mayberg H, Bergouignan L, Volle E, Delaveau P, Lehericy S, Allilaire JF, Fossati P",Journal of affective disorders,0.316,19945172,-1,-1
depressed_00033,https://pubmed.ncbi.nlm.nih.gov/15866546/,Activity and connectivity of brain mood regulating circuit in depression: a functional magnetic resonance study.,"Anand A, Li Y, Wang Y, Wu J, Gao S, Bukhari L, Mathews VP, Kalnin A, Lowe MJ",Biological psychiatry,0.315,15866546,-1,-1
depressed_00034,https://pubmed.ncbi.nlm.nih.gov/24055881/,"Neural systems underlying thought suppression in young women with, and at-risk, for depression.","Carew CL, Milne AM, Tatham EL, MacQueen GM, Hall GB",Behavioural brain research,0.31,24055881,-1,-1
depressed_00035,https://pubmed.ncbi.nlm.nih.gov/17027931/,Increased amygdala and decreased dorsolateral prefrontal BOLD responses in unipolar depression: related and independent features.,"Siegle GJ, Thompson W, Carter CS, Steinhauer SR, Thase ME",Biological psychiatry,0.302,17027931,-1,-1
depressed_00036,https://pubmed.ncbi.nlm.nih.gov/19351579/,Dorsolateral and dorsomedial prefrontal gray matter density changes associated with bipolar depression.,"Brooks JO 3rd, Bonner JC, Rosen AC, Wang PW, Hoblyn JC, Hill SJ, Ketter TA",Psychiatry research,0.299,19351579,-1,-1
depressed_00037,https://pubmed.ncbi.nlm.nih.gov/16581168/,Effect of unpleasant loud noise on hippocampal activities during picture encoding: an fMRI study.,"Hirano Y, Fujita M, Watanabe K, Niwa M, Takahashi T, Kanematsu M, Ido Y, Tomida M, Onozuka M",Brain and cognition,0.288,16581168,-1,-1
depressed_00038,https://pubmed.ncbi.nlm.nih.gov/19176279/,Cortico-limbic response to personally challenging emotional stimuli after complete recovery from depression.,"Hooley JM, Gruber SA, Parker HA, Guillaumot J, Rogowska J, Yurgelun-Todd DA",Psychiatry research,0.288,19176279,-1,-1
depressed_00039,https://pubmed.ncbi.nlm.nih.gov/24205330/,The Queen and I: neural correlates of altered self-related cognitions in major depressive episode.,"Sarsam M, Parkes LM, Roberts N, Reid GS, Kinderman P",PloS one,0.288,24205330,10.1371/journal.pone.0078844,-1
depressed_00040,https://pubmed.ncbi.nlm.nih.gov/28539875/,Trait Rumination Influences Neural Correlates of the Anticipation but Not the Consumption Phase of Reward Processing.,"Kocsel N, Szabo E, Galambos A, Edes A, Pap D, Elliott R, Kozak LR, Bagdy G, Juhasz G, Kokonyei G",Frontiers in behavioral neuroscience,0.279,28539875,10.3389/fnbeh.2017.00085,-1
depressed_00041,https://pubmed.ncbi.nlm.nih.gov/26714574/,Amygdala and dorsomedial hyperactivity to emotional faces in youth with remitted  Major Depression.,"Jenkins LM, Kassel MT, Gabriel LB, Gowins JR, Hymen EA, Verges A, Calamia M, Crane NA, Jacobs RH, Ajilore O, Welsh RC, Drevets WC, Phillips ML, Zubieta JK, Langenecker SA",Social cognitive and affective neuroscience,0.277,26714574,-1,-1
depressed_00042,https://pubmed.ncbi.nlm.nih.gov/25274576/,Imbalance of default mode and regulatory networks during externally focused processing in depression.,"Belleau EL, Taubitz LE, Larson CL",Social cognitive and affective neuroscience,0.272,25274576,-1,-1
depressed_00043,https://pubmed.ncbi.nlm.nih.gov/20832482/,Structural brain alterations in patients with major depressive disorder and high  risk for suicide: evidence for a distinct neurobiological entity?,"Wagner G, Koch K, Schachtzabel C, Schultz CC, Sauer H, Schlosser RG",NeuroImage,0.261,20832482,-1,-1
depressed_00044,https://pubmed.ncbi.nlm.nih.gov/22386970/,Autobiographical memory in depression: an fMRI study.,"Whalley MG, Rugg MD, Brewin CR",Psychiatry research,0.259,22386970,-1,-1
depressed_00045,https://pubmed.ncbi.nlm.nih.gov/19433416/,Neural correlates of idiographic goal priming in depression: goal-specific dysfunctions in the orbitofrontal cortex.,"Eddington KM, Dolcos F, McLean AN, Krishnan KR, Cabeza R, Strauman TJ",Social cognitive and affective neuroscience,0.257,19433416,-1,-1
depressed_00046,https://pubmed.ncbi.nlm.nih.gov/26406969/,Aberrant brain responses to emotionally valent words is normalised after cognitive behavioural therapy in female depressed adolescents.,"Chuang JY, J Whitaker K, Murray GK, Elliott R, Hagan CC, Graham JM, Ooi C, Tait R, Holt RJ, van Nieuwenhuizen AO, Reynolds S, Wilkinson PO, Bullmore ET, Lennox BR, Sahakian BJ, Goodyer I, Suckling J",Journal of affective disorders,0.257,26406969,-1,-1
depressed_00047,https://pubmed.ncbi.nlm.nih.gov/26042728/,Abnormal amygdala function in Parkinson's disease patients and its relationship to depression.,"Huang P, Xuan M, Gu Q, Yu X, Xu X, Luo W, Zhang M",Journal of affective disorders,0.256,26042728,-1,-1
depressed_00048,https://pubmed.ncbi.nlm.nih.gov/25864196/,A pilot fMRI study of the effect of stressful factors on the onset of depression  in female patients.,"Li G, Ma X, Bian H, Sun X, Zhai N, Yao M, Qu H, Ji S, Tian H, Zhuo C",Brain imaging and behavior,0.255,25864196,-1,-1
depressed_00049,https://pubmed.ncbi.nlm.nih.gov/14980569/,Amygdalar interhemispheric functional connectivity differs between the non-depressed and depressed human brain.,"Irwin W, Anderle MJ, Abercrombie HC, Schaefer SM, Kalin NH, Davidson RJ",NeuroImage,0.253,14980569,-1,-1
depressed_00050,https://pubmed.ncbi.nlm.nih.gov/25487911/,Neural correlates of causal attribution in negative events of depressed patients: Evidence from an fMRI study.,"Hao L, Yang J, Wang Y, Zhang S, Xie P, Luo Q, Ren G, Qiu J",Clinical neurophysiology : official journal of the International Federation of Clinical Neurophysiology,0.253,25487911,-1,-1
depressed_00051,https://pubmed.ncbi.nlm.nih.gov/29163097/,The Role of Motivation in Cognitive Reappraisal for Depressed Patients.,"Wang X, Zhou X, Dai Q, Ji B, Feng Z",Frontiers in human neuroscience,0.251,29163097,-1,-1
depressed_00052,https://pubmed.ncbi.nlm.nih.gov/23769293/,Emotion-related brain activity to conflicting socio-emotional cues in unmedicated depression.,"Greening SG, Osuch EA, Williamson PC, Mitchell DG",Journal of affective disorders,0.249,23769293,-1,-1
depressed_00053,https://pubmed.ncbi.nlm.nih.gov/25555505/,Frontal lobe hypoactivation in medication-free adults with bipolar II depression  during response inhibition.,"Penfold C, Vizueta N, Townsend JD, Bookheimer SY, Altshuler LL",Psychiatry research,0.249,25555505,-1,-1
depressed_00054,https://pubmed.ncbi.nlm.nih.gov/27467529/,Resting-state functional MRI of abnormal baseline brain activity in young depressed patients with and without suicidal behavior.,"Cao J, Chen X, Chen J, Ai M, Gan Y, Wang W, Lv Z, Zhang S, Zhang S, Wang S, Kuang L, Fang W",Journal of affective disorders,0.246,27467529,-1,-1
depressed_00055,https://pubmed.ncbi.nlm.nih.gov/27716542/,Resting-state functional connectivity of the amygdala and longitudinal changes in depression severity in adolescent depression.,"Connolly CG, Ho TC, Blom EH, LeWinn KZ, Sacchet MD, Tymofiyeva O, Simmons AN, Yang TT",Journal of affective disorders,0.246,27716542,-1,-1
depressed_00056,https://pubmed.ncbi.nlm.nih.gov/14984424/,Cognitive generation of affect in bipolar depression: an fMRI study.,"Malhi GS, Lagopoulos J, Ward PB, Kumari V, Mitchell PB, Parker GB, Ivanovski B, Sachdev P",The European journal of neuroscience,0.238,14984424,-1,-1
depressed_00057,https://pubmed.ncbi.nlm.nih.gov/29272791/,Disrupted functional connectivity of the amygdala is associated with depressive mood in type 2 diabetes patients.,"Xia W, Luo Y, Chen YC, Zhang D, Bo F, Zhou P, Chen H, Wang F, Yin X, Ma J",Journal of affective disorders,0.237,29272791,-1,-1
depressed_00058,https://pubmed.ncbi.nlm.nih.gov/28263829/,Depression alters maternal extended amygdala response and functional connectivity during distress signals in attachment relationship.,"Ho SS, Swain JE",Behavioural brain research,0.236,28263829,-1,-1
depressed_00059,https://pubmed.ncbi.nlm.nih.gov/23261142/,Functional connectivity in apathy of late-life depression: a preliminary study.,"Alexopoulos GS, Hoptman MJ, Yuen G, Kanellopoulos D, Seirup JK, Lim KO, Gunning FM",Journal of affective disorders,0.232,23261142,-1,-1
depressed_00060,https://pubmed.ncbi.nlm.nih.gov/23056309/,The extended functional neuroanatomy of emotional processing biases for masked faces in major depressive disorder.,"Victor TA, Furey ML, Fromm SJ, Bellgowan PS, Ohman A, Drevets WC",PloS one,0.229,23056309,-1,-1
depressed_00061,https://pubmed.ncbi.nlm.nih.gov/18586109/,Neural basis of abnormal response to negative feedback in unmedicated mood disorders.,"Taylor Tavares JV, Clark L, Furey ML, Williams GB, Sahakian BJ, Drevets WC",NeuroImage,0.227,18586109,-1,-1
depressed_00062,https://pubmed.ncbi.nlm.nih.gov/24639328/,Altered neural function during episodic memory encoding and retrieval in major depression.,"Dietsche B, Backes H, Stratmann M, Konrad C, Kircher T, Krug A",Human brain mapping,0.227,24639328,-1,-1
depressed_00063,https://pubmed.ncbi.nlm.nih.gov/17525987/,An fMRI study of prefrontal brain activation during multiple tasks in patients with major depressive disorder.,"Fitzgerald PB, Srithiran A, Benitez J, Daskalakis ZZ, Oxley TJ, Kulkarni J, Egan GF",Human brain mapping,0.224,17525987,-1,-1
depressed_00064,https://pubmed.ncbi.nlm.nih.gov/28039797/,Impulsivity and aggression mediate regional brain responses in Borderline Personality Disorder: An fMRI study.,"Soloff PH, Abraham K, Burgess A, Ramaseshan K, Chowdury A, Diwadkar VA",Psychiatry research. Neuroimaging,0.22,28039797,-1,-1
depressed_00065,https://pubmed.ncbi.nlm.nih.gov/24381554/,"Trauma, dream, and psychic change in psychoanalyses: a dialog between psychoanalysis and the neurosciences.","Fischmann T, Russ MO, Leuzinger-Bohleber M",Frontiers in human neuroscience,0.214,24381554,-1,-1
depressed_00066,https://pubmed.ncbi.nlm.nih.gov/12928105/,An fMRI study of affective state and medication on cortical and subcortical brain regions during motor performance in bipolar disorder.,"Caligiuri MP, Brown GG, Meloy MJ, Eberson SC, Kindermann SS, Frank LR, Zorrilla LE, Lohr JB",Psychiatry research,0.201,12928105,-1,-1
depressed_00067,https://pubmed.ncbi.nlm.nih.gov/28180068/,Early cortical biomarkers of longitudinal transcutaneous vagus nerve stimulation  treatment success in depression.,"Fang J, Egorova N, Rong P, Liu J, Hong Y, Fan Y, Wang X, Wang H, Yu Y, Ma Y, Xu C, Li S, Zhao J, Luo M, Zhu B, Kong J",NeuroImage. Clinical,0.191,28180068,-1,-1
depressed_00068,https://pubmed.ncbi.nlm.nih.gov/22854099/,Bipolar depressed patients show both failure to activate and failure to de-activate during performance of a working memory task.,"Fernandez-Corcuera P, Salvador R, Monte GC, Salvador Sarro S, Goikolea JM, Amann B, Moro N, Sans-Sansa B, Ortiz-Gil J, Vieta E, Maristany T, McKenna PJ, Pomarol-Clotet E",Journal of affective disorders,0.19,22854099,-1,-1
depressed_00069,https://pubmed.ncbi.nlm.nih.gov/21106812/,Acute and sustained effects of cognitive emotion regulation in major depression.,"Erk S, Mikschl A, Stier S, Ciaramidaro A, Gapp V, Weber B, Walter H",The Journal of neuroscience : the official journal of the Society for Neuroscience,0.189,21106812,-1,-1
depressed_00070,https://pubmed.ncbi.nlm.nih.gov/21359508/,Differential modulation of emotion processing brain regions by noradrenergic and  serotonergic antidepressants.,"Bruhl AB, Jancke L, Herwig U",Psychopharmacology,0.187,21359508,-1,-1
depressed_00071,https://pubmed.ncbi.nlm.nih.gov/29747140/,Short-term escitalopram treatment normalizes aberrant self-referential processing in major depressive disorder.,"Komulainen E, Heikkila R, Nummenmaa L, Raij TT, Harmer CJ, Isometsa E, Ekelund J",Journal of affective disorders,0.183,29747140,10.1016/j.jad.2018.04.096,-1
depressed_00072,https://pubmed.ncbi.nlm.nih.gov/19162206/,Exploratory structural equation modeling of resting-state fMRI: applicability of  group models to individual subjects.,"James GA, Kelley ME, Craddock RC, Holtzheimer PE, Dunlop BW, Nemeroff CB, Mayberg HS, Hu XP",NeuroImage,0.181,19162206,-1,-1
depressed_00073,https://pubmed.ncbi.nlm.nih.gov/21878364/,Amygdala hyperactivation and prefrontal hypoactivation in subjects with cognitive vulnerability to depression.,"Zhong M, Wang X, Xiao J, Yi J, Zhu X, Liao J, Wang W, Yao S",Biological psychology,0.18,21878364,-1,-1
depressed_00074,https://pubmed.ncbi.nlm.nih.gov/11430841/,"Are child-, adolescent-, and adult-onset depression one and the same disorder?","Kaufman J, Martin A, King RA, Charney D",Biological psychiatry,0.179,11430841,-1,-1
depressed_00075,https://pubmed.ncbi.nlm.nih.gov/18164074/,Hypofrontality in subjects at high genetic risk of schizophrenia with depressive  symptoms.,"Whalley HC, Mowatt L, Stanfield AC, Hall J, Johnstone EC, Lawrie SM, McIntosh AM",Journal of affective disorders,0.178,18164074,-1,-1
depressed_00076,https://pubmed.ncbi.nlm.nih.gov/19632301/,Attentional modulation of emotional stimulus processing in patients with major depression--alterations in prefrontal cortical regions.,"Bermpohl F, Walter M, Sajonz B, Lucke C, Hagele C, Sterzer P, Adli M, Heinz A, Northoff G",Neuroscience letters,0.173,19632301,-1,-1
depressed_00077,https://pubmed.ncbi.nlm.nih.gov/26331684/,Maternal response to child affect: Role of maternal depression and relationship quality.,"Morgan JK, Ambrosia M, Forbes EE, Cyranowski JM, Amole MC, Silk JS, Elliott RD, Swartz HA",Journal of affective disorders,0.173,26331684,-1,-1
depressed_00078,https://pubmed.ncbi.nlm.nih.gov/23333840/,The impact of passive hyperthermia on human attention networks: an fMRI study.,"Liu K, Sun G, Li B, Jiang Q, Yang X, Li M, Li L, Qian S, Zhao L, Zhou Z, von Deneen KM, Liu Y",Behavioural brain research,0.171,23333840,-1,-1
depressed_00079,https://pubmed.ncbi.nlm.nih.gov/20665717/,Abnormal regional spontaneous neural activity in treatment-refractory depression  revealed by resting-state fMRI.,"Wu QZ, Li DM, Kuang WH, Zhang TJ, Lui S, Huang XQ, Chan RC, Kemp GJ, Gong QY",Human brain mapping,0.167,20665717,-1,-1
depressed_00080,https://pubmed.ncbi.nlm.nih.gov/17210143/,Resting-state functional connectivity in major depression: abnormally increased contributions from subgenual cingulate cortex and thalamus.,"Greicius MD, Flores BH, Menon V, Glover GH, Solvason HB, Kenna H, Reiss AL, Schatzberg AF",Biological psychiatry,0.166,17210143,-1,-1
depressed_00081,https://pubmed.ncbi.nlm.nih.gov/18674871/,Low prefrontal perfusion linked to depression symptoms in methadone-maintained opiate-dependent patients.,"Suh JJ, Langleben DD, Ehrman RN, Hakun JG, Wang Z, Li Y, Busch SI, O'Brien CP, Childress AR",Drug and alcohol dependence,0.166,18674871,-1,-1
depressed_00082,https://pubmed.ncbi.nlm.nih.gov/15325374/,Neural predictive error signal correlates with depressive illness severity in a game paradigm.,"Steele JD, Meyer M, Ebmeier KP",NeuroImage,0.165,15325374,-1,-1
depressed_00083,https://pubmed.ncbi.nlm.nih.gov/28039796/,Vertex-wise examination of depressive symptom dimensions and brain volumes in older adults.,"McLaren ME, Szymkowicz SM, O'Shea A, Woods AJ, Anton SD, Dotson VM",Psychiatry research. Neuroimaging,0.165,28039796,-1,-1
depressed_00084,https://pubmed.ncbi.nlm.nih.gov/23717467/,Abnormal baseline brain activity in non-depressed Parkinson's disease and depressed Parkinson's disease: a resting-state functional magnetic resonance imaging study.,"Wen X, Wu X, Liu J, Li K, Yao L",PloS one,0.164,23717467,-1,-1
depressed_00085,https://pubmed.ncbi.nlm.nih.gov/24404185/,"Altered spontaneous brain activity in patients with Parkinson's disease accompanied by depressive symptoms, as revealed by regional homogeneity and functional connectivity in the prefrontal-limbic sys","Sheng K, Fang W, Su M, Li R, Zou D, Han Y, Wang X, Cheng O",PloS one,0.164,24404185,-1,-1
depressed_00086,https://pubmed.ncbi.nlm.nih.gov/25448398/,The neural correlates of emotional face-processing in adolescent depression: a dimensional approach focusing on anhedonia and illness severity.,"Henderson SE, Vallejo AI, Ely BA, Kang G, Krain Roy A, Pine DS, Stern ER, Gabbay V",Psychiatry research,0.162,25448398,-1,-1
depressed_00087,https://pubmed.ncbi.nlm.nih.gov/27368345/,Anticipation-related brain connectivity in bipolar and unipolar depression: a graph theory approach.,"Manelis A, Almeida JR, Stiffler R, Lockovich JC, Aslam HA, Phillips ML",Brain : a journal of neurology,0.162,27368345,-1,-1
depressed_00088,https://pubmed.ncbi.nlm.nih.gov/23570916/,Evidence of successful modulation of brain activation and subjective experience during reappraisal of negative emotion in unmedicated depression.,"Dillon DG, Pizzagalli DA",Psychiatry research,0.159,23570916,-1,-1
