paper_name,paper_url,Title,Author,Journal,Loading,PMID,Doi,download_status
detection task_00001,https://pubmed.ncbi.nlm.nih.gov/20869449/,The BOLD correlates of the visual P1 and N1 in single-trial analysis of simultaneous EEG-fMRI recordings during a spatial detection task.,"Novitskiy N, Ramautar JR, Vanderperren K, De Vos M, Mennes M, Mijovic B, Vanrumste B, Stiers P, Van den Bergh B, Lagae L, Sunaert S, Van Huffel S, Wagemans J",NeuroImage,0.246,20869449,-1,-1
detection task_00002,https://pubmed.ncbi.nlm.nih.gov/22878845/,An FMRI investigation of the cortical network underlying detection and categorization abilities in hemianopic patients.,"Perez C, Peyrin C, Cavezian C, Coubard O, Caetta F, Raz N, Levin N, Doucet G, Andersson F, Obadia M, Gout O, Heran F, Savatovsky J, Chokron S",Brain topography,0.232,22878845,-1,-1
detection task_00003,https://pubmed.ncbi.nlm.nih.gov/22488985/,Neural correlates of the perception of contrastive prosodic focus in French: a functional magnetic resonance imaging study.,"Perrone-Bertolotti M, Dohen M, Loevenbruck H, Sato M, Pichat C, Baciu M",Human brain mapping,0.197,22488985,-1,-1
detection task_00004,https://pubmed.ncbi.nlm.nih.gov/16168674/,Modulation of language areas with functional MR image-guided magnetic stimulation.,"Andoh J, Artiges E, Pallier C, Riviere D, Mangin JF, Cachia A, Plaze M, Paillere-Martinot ML, Martinot JL",NeuroImage,0.19,16168674,-1,-1
detection task_00005,https://pubmed.ncbi.nlm.nih.gov/17490990/,Priming frequencies of transcranial magnetic stimulation over Wernicke's area modulate word detection.,"Andoh J, Artiges E, Pallier C, Riviere D, Mangin JF, Paillere-Martinot ML, Martinot JL","Cerebral cortex (New York, N.Y. : 1991)",0.177,17490990,-1,-1
detection task_00006,https://pubmed.ncbi.nlm.nih.gov/21157878/,Implicit memory for object locations depends on reactivation of encoding-related  brain regions.,"Manelis A, Hanson C, Hanson SJ",Human brain mapping,0.177,21157878,-1,-1
detection task_00007,https://pubmed.ncbi.nlm.nih.gov/25164675/,Prismatic adaptation changes visuospatial representation in the inferior parietal lobule.,"Crottaz-Herbette S, Fornari E, Clarke S",The Journal of neuroscience : the official journal of the Society for Neuroscience,0.168,25164675,-1,-1
detection task_00008,https://pubmed.ncbi.nlm.nih.gov/22711328/,Right and left perisylvian cortex and left inferior frontal cortex mediate sentence-level rhyme detection in spoken language as revealed by sparse fMRI.,"Hurschler MA, Liem F, Jancke L, Meyer M",Human brain mapping,0.167,22711328,-1,-1
detection task_00009,https://pubmed.ncbi.nlm.nih.gov/26025759/,fMRI reveals lateralized pattern of brain activity modulated by the metrics of stimuli during auditory rhyme processing.,"Hurschler MA, Liem F, Oechslin M, Stampfli P, Meyer M",Brain and language,0.167,26025759,-1,-1
detection task_00010,https://pubmed.ncbi.nlm.nih.gov/22807895/,Repetition enhancement and perceptual processing of visual word form.,"Lebreton K, Villain N, Chetelat G, Landeau B, Seghier ML, Lazeyras F, Eustache F, Ibanez V",Frontiers in human neuroscience,0.166,22807895,-1,-1
detection task_00011,https://pubmed.ncbi.nlm.nih.gov/24001005/,Ventral and dorsal visual stream contributions to the perception of object shape  and object location.,"Zachariou V, Klatzky R, Behrmann M",Journal of cognitive neuroscience,0.165,24001005,-1,-1
detection task_00012,https://pubmed.ncbi.nlm.nih.gov/25813780/,Magnocellular-dorsal pathway function is associated with orthographic but not phonological skill: fMRI evidence from skilled Chinese readers.,"Qian Y, Deng Y, Zhao J, Bi HY",Neuropsychologia,0.162,25813780,-1,-1
detection task_00013,https://pubmed.ncbi.nlm.nih.gov/20869846/,Altered engagement of attention and default networks during target detection in schizophrenia.,"Hasenkamp W, James GA, Boshoven W, Duncan E",Schizophrenia research,0.161,20869846,-1,-1
detection task_00014,https://pubmed.ncbi.nlm.nih.gov/22305924/,Dual-tasking alleviated sleep deprivation disruption in visuomotor tracking: an fMRI study.,"Gazes Y, Rakitin BC, Steffener J, Habeck C, Butterfield B, Basner RC, Ghez C, Stern Y",Brain and cognition,0.159,22305924,-1,-1
detection task_00015,https://pubmed.ncbi.nlm.nih.gov/23000552/,Lying in the scanner: localized inhibition predicts lying skill.,"Vartanian O, Kwantes P, Mandel DR",Neuroscience letters,0.158,23000552,-1,-1
detection task_00016,https://pubmed.ncbi.nlm.nih.gov/20203139/,The trait of sensory processing sensitivity and neural responses to changes in visual scenes.,"Jagiellowicz J, Xu X, Aron A, Aron E, Cao G, Feng T, Weng X",Social cognitive and affective neuroscience,0.155,20203139,10.1093/scan/nsq001,-1
detection task_00017,https://pubmed.ncbi.nlm.nih.gov/22302842/,Goal-directed behavior under emotional distraction is preserved by enhanced task-specific activation.,"Wessa M, Heissler J, Schonfelder S, Kanske P",Social cognitive and affective neuroscience,0.144,22302842,10.1093/scan/nsr098,-1
detection task_00018,https://pubmed.ncbi.nlm.nih.gov/12873392/,The nose smells what the eye sees: crossmodal visual facilitation of human olfactory perception.,"Gottfried JA, Dolan RJ",Neuron,0.138,12873392,10.1016/s0896-6273(03)00392-1,-1
detection task_00019,https://pubmed.ncbi.nlm.nih.gov/26079805/,Nicotinergic Modulation of Attention-Related Neural Activity Differentiates Polymorphisms of DRD2 and CHRNA4 Receptor Genes.,"Breckel TP, Giessing C, Gieseler A, Querbach S, Reuter M, Thiel CM",PloS one,0.134,26079805,10.1371/journal.pone.0126460,-1
detection task_00020,https://pubmed.ncbi.nlm.nih.gov/15784428/,The many faces of the gamma band response to complex visual stimuli.,"Lachaux JP, George N, Tallon-Baudry C, Martinerie J, Hugueville L, Minotti L, Kahane P, Renault B",NeuroImage,0.127,15784428,-1,-1
detection task_00021,https://pubmed.ncbi.nlm.nih.gov/15110021/,Attentional effects of noradrenaline vary with arousal level: selective activation of thalamic pulvinar in humans.,"Coull JT, Jones ME, Egan TD, Frith CD, Maze M",NeuroImage,0.126,15110021,-1,-1
detection task_00022,https://pubmed.ncbi.nlm.nih.gov/21504992/,Neural substrates of interpreting actions and emotions from body postures.,"Kana RK, Travers BG",Social cognitive and affective neuroscience,0.122,21504992,-1,-1
detection task_00023,https://pubmed.ncbi.nlm.nih.gov/23967320/,Enhanced sympathetic arousal in response to FMRI scanning correlates with task induced activations and deactivations.,"Muehlhan M, Lueken U, Siegert J, Wittchen HU, Smolka MN, Kirschbaum C",PloS one,0.118,23967320,-1,-1
detection task_00024,https://pubmed.ncbi.nlm.nih.gov/23966916/,Explorations of object and location memory using fMRI.,"Passaro AD, Elmore LC, Ellmore TM, Leising KJ, Papanicolaou AC, Wright AA",Frontiers in behavioral neuroscience,0.116,23966916,-1,-1
detection task_00025,https://pubmed.ncbi.nlm.nih.gov/19883666/,Neural correlates of top-down letter processing.,"Liu J, Li J, Zhang H, Rieth CA, Huber DE, Li W, Lee K, Tian J",Neuropsychologia,0.115,19883666,-1,-1
detection task_00026,https://pubmed.ncbi.nlm.nih.gov/22672735/,Attention and semantic processing during speech: an fMRI study.,"Rama P, Relander-Syrjanen K, Carlson S, Salonen O, Kujala T",Brain and language,0.115,22672735,-1,-1
detection task_00027,https://pubmed.ncbi.nlm.nih.gov/20678981/,"Perceptual organization and visual search processes during target detection task  performance in schizophrenia, as revealed by fMRI.","Silverstein SM, Berten S, Essex B, All SD, Kasi R, Little DM",Neuropsychologia,0.113,20678981,-1,-1
detection task_00028,https://pubmed.ncbi.nlm.nih.gov/21821135/,Genetic variation in nicotinic receptors affects brain networks involved in reorienting attention.,"Giessing C, Neber T, Thiel CM",NeuroImage,0.113,21821135,-1,-1
detection task_00029,https://pubmed.ncbi.nlm.nih.gov/15800041/,Quantitative prediction of perceptual decisions during near-threshold fear detection.,"Pessoa L, Padmala S",Proceedings of the National Academy of Sciences of the United States of America,0.112,15800041,-1,-1
detection task_00030,https://pubmed.ncbi.nlm.nih.gov/17963799/,Neural correlates of primary and reflective consciousness of spatial orienting.,"Bartolomeo P, Zieren N, Vohn R, Dubois B, Sturm W",Neuropsychologia,0.112,17963799,-1,-1
detection task_00031,https://pubmed.ncbi.nlm.nih.gov/21942763/,Absence of face-specific cortical activity in the complete absence of awareness:  converging evidence from functional magnetic resonance imaging and event-related  potentials.,"Rodriguez V, Thompson R, Stokes M, Brett M, Alvarez I, Valdes-Sosa M, Duncan J",Journal of cognitive neuroscience,0.11,21942763,-1,-1
detection task_00032,https://pubmed.ncbi.nlm.nih.gov/21471360/,Double dissociation between hippocampal and parahippocampal responses to object-background context and scene novelty.,"Howard LR, Kumaran D, Olafsdottir HF, Spiers HJ",The Journal of neuroscience : the official journal of the Society for Neuroscience,0.108,21471360,10.1523/JNEUROSCI.6055-10.2011,-1
detection task_00033,https://pubmed.ncbi.nlm.nih.gov/17894934/,Cueing method biases in visual detection studies.,"Jaffard M, Benraiss A, Longcamp M, Velay JL, Boulinguez P",Brain research,0.106,17894934,10.1016/j.brainres.2007.08.032,-1
detection task_00034,https://pubmed.ncbi.nlm.nih.gov/24518755/,Relationship Between Cortical Thickness and Functional Activation in the Early Blind.,"Anurova I, Renier LA, De Volder AG, Carlson S, Rauschecker JP","Cerebral cortex (New York, N.Y. : 1991)",0.106,24518755,-1,-1
detection task_00035,https://pubmed.ncbi.nlm.nih.gov/12457763/,Attention-related activity during episodic memory retrieval: a cross-function fMRI study.,"Cabeza R, Dolcos F, Prince SE, Rice HJ, Weissman DH, Nyberg L",Neuropsychologia,0.105,12457763,-1,-1
detection task_00036,https://pubmed.ncbi.nlm.nih.gov/19015088/,Mapping social target detection with functional magnetic resonance imaging.,"Dichter GS, Felder JN, Bodfish JW, Sikich L, Belger A",Social cognitive and affective neuroscience,0.104,19015088,-1,-1
detection task_00037,https://pubmed.ncbi.nlm.nih.gov/22102362/,Neural events leading to and associated with detection of sounds under high processing load.,"Sabri M, Humphries C, Binder JR, Liebenthal E",Human brain mapping,0.104,22102362,-1,-1
detection task_00038,https://pubmed.ncbi.nlm.nih.gov/20188768/,Performance degradation and altered cerebral activation during dual performance:  evidence for a bottom-up attentional system.,"Gazes Y, Rakitin BC, Steffener J, Habeck C, Butterfield B, Ghez C, Stern Y",Behavioural brain research,0.103,20188768,-1,-1
detection task_00039,https://pubmed.ncbi.nlm.nih.gov/22574269/,Specialization and integration of brain responses to object recognition and location detection.,"Pennick MR, Kana RK",Brain and behavior,0.103,22574269,-1,-1
detection task_00040,https://pubmed.ncbi.nlm.nih.gov/27261159/,Perceptual demand and distraction interactions mediated by task-control networks.,"Pillay S, Durgerian S, Sabri M",NeuroImage,0.103,27261159,-1,-1
detection task_00041,https://pubmed.ncbi.nlm.nih.gov/29078084/,Strategic adaptation to non-reward prediction error qualities and irreducible uncertainty in fMRI.,"Kluger DS, Schubotz RI",Cortex; a journal devoted to the study of the nervous system and behavior,0.103,29078084,-1,-1
detection task_00042,https://pubmed.ncbi.nlm.nih.gov/18820290/,A dual role for prediction error in associative learning.,"den Ouden HE, Friston KJ, Daw ND, McIntosh AR, Stephan KE","Cerebral cortex (New York, N.Y. : 1991)",0.101,18820290,-1,-1
detection task_00043,https://pubmed.ncbi.nlm.nih.gov/22270355/,"The ""why"" and ""how"" of JointICA: results from a visual detection task.","Mijovic B, Vanderperren K, Novitskiy N, Vanrumste B, Stiers P, Bergh BV, Lagae L, Sunaert S, Wagemans J, Huffel SV, Vos MD",NeuroImage,0.101,22270355,-1,-1
detection task_00044,https://pubmed.ncbi.nlm.nih.gov/22465842/,An fMRI study of reduced perceptual load-dependent modulation of task-irrelevant  activity in adults with autism spectrum conditions.,"Ohta H, Yamada T, Watanabe H, Kanai C, Tanaka E, Ohno T, Takayama Y, Iwanami A, Kato N, Hashimoto R",NeuroImage,0.1,22465842,-1,-1
detection task_00045,https://pubmed.ncbi.nlm.nih.gov/18534567/,Alerting deficits in children with attention deficit/hyperactivity disorder: event-related fMRI evidence.,"Cao Q, Zang Y, Zhu C, Cao X, Sun L, Zhou X, Wang Y",Brain research,0.098,18534567,-1,-1
detection task_00046,https://pubmed.ncbi.nlm.nih.gov/25243993/,Neural correlates associated with superior tactile symmetry perception in the early blind.,"Bauer C, Yazzolino L, Hirsch G, Cattaneo Z, Vecchi T, Merabet LB",Cortex; a journal devoted to the study of the nervous system and behavior,0.098,25243993,10.1016/j.cortex.2014.08.003,-1
detection task_00047,https://pubmed.ncbi.nlm.nih.gov/18206186/,Affective learning modulates spatial competition during low-load attentional conditions.,"Lim SL, Padmala S, Pessoa L",Neuropsychologia,0.097,18206186,10.1016/j.neuropsychologia.2007.12.003,-1
detection task_00048,https://pubmed.ncbi.nlm.nih.gov/24120612/,Neural correlates of shape-color binding in visual working memory.,"Parra MA, Della Sala S, Logie RH, Morcom AM",Neuropsychologia,0.097,24120612,10.1016/j.neuropsychologia.2013.09.036,-1
detection task_00049,https://pubmed.ncbi.nlm.nih.gov/24466193/,Neural mechanisms by which attention modulates the comparison of remembered and perceptual representations.,"Kuo BC, Astle DE",PloS one,0.097,24466193,-1,-1
detection task_00050,https://pubmed.ncbi.nlm.nih.gov/22248577/,Task by stimulus interactions in brain responses during Chinese character processing.,"Yang J, Wang X, Shu H, Zevin JD",NeuroImage,0.096,22248577,-1,-1
detection task_00051,https://pubmed.ncbi.nlm.nih.gov/17916328/,The neural circuitry mediating shifts in behavioral response and cognitive set in autism.,"Shafritz KM, Dichter GS, Baranek GT, Belger A",Biological psychiatry,0.095,17916328,-1,-1
detection task_00052,https://pubmed.ncbi.nlm.nih.gov/18596189/,Choosing where to attend and the medial frontal cortex: an FMRI study.,"Taylor PC, Rushworth MF, Nobre AC",Journal of neurophysiology,0.095,18596189,-1,-1
detection task_00053,https://pubmed.ncbi.nlm.nih.gov/21173881/,Complementary roles of systems representing sensory evidence and systems detecting task difficulty during perceptual decision making.,"Ruff DA, Marrett S, Heekeren HR, Bandettini PA, Ungerleider LG",Frontiers in neuroscience,0.095,21173881,-1,-1
detection task_00054,https://pubmed.ncbi.nlm.nih.gov/14741670/,"Cerebral correlates of alerting, orienting and reorienting of visuospatial attention: an event-related fMRI study.","Thiel CM, Zilles K, Fink GR",NeuroImage,0.094,14741670,-1,-1
detection task_00055,https://pubmed.ncbi.nlm.nih.gov/25224999/,Getting the beat: Entrainment of brain activity by musical rhythm and pleasantness.,"Trost W, Fruhholz S, Schon D, Labbe C, Pichon S, Grandjean D, Vuilleumier P",NeuroImage,0.094,25224999,-1,-1
detection task_00056,https://pubmed.ncbi.nlm.nih.gov/29505944/,The mental simulation of state/psychological verbs in the adolescent brain: An fMRI study.,"Tomasino B, Nobile M, Re M, Bellina M, Garzitto M, Arrigoni F, Molteni M, Fabbro F, Brambilla P",Brain and cognition,0.093,29505944,-1,-1
detection task_00057,https://pubmed.ncbi.nlm.nih.gov/24591602/,Categorical encoding of color in the brain.,"Bird CM, Berens SC, Horner AJ, Franklin A",Proceedings of the National Academy of Sciences of the United States of America,0.092,24591602,-1,-1
detection task_00058,https://pubmed.ncbi.nlm.nih.gov/14755837/,Different areas of human non-primary auditory cortex are activated by sounds with spatial and nonspatial properties.,"Hart HC, Palmer AR, Hall DA",Human brain mapping,0.091,14755837,-1,-1
detection task_00059,https://pubmed.ncbi.nlm.nih.gov/22941718/,Spatial stimulus configuration and attentional selection: extrastriate and superior parietal interactions.,"Gillebert CR, Caspari N, Wagemans J, Peeters R, Dupont P, Vandenberghe R","Cerebral cortex (New York, N.Y. : 1991)",0.091,22941718,-1,-1
detection task_00060,https://pubmed.ncbi.nlm.nih.gov/17551089/,Activity in right temporo-parietal junction is not selective for theory-of-mind.,Mitchell JP,"Cerebral cortex (New York, N.Y. : 1991)",0.09,17551089,-1,-1
detection task_00061,https://pubmed.ncbi.nlm.nih.gov/18387556/,Task-dependent and task-independent neurovascular responses to syntactic processing.,"Caplan D, Chen E, Waters G",Cortex; a journal devoted to the study of the nervous system and behavior,0.09,18387556,-1,-1
detection task_00062,https://pubmed.ncbi.nlm.nih.gov/28253080/,Distinct Frontoparietal Networks Underlying Attentional Effort and Cognitive Control.,"Berry AS, Sarter M, Lustig C",Journal of cognitive neuroscience,0.09,28253080,-1,-1
detection task_00063,https://pubmed.ncbi.nlm.nih.gov/28782545/,Reshaping the brain after stroke: The effect of prismatic adaptation in patients  with right brain damage.,"Crottaz-Herbette S, Fornari E, Notter MP, Bindschaedler C, Manzoni L, Clarke S",Neuropsychologia,0.09,28782545,10.1016/j.neuropsychologia.2017.08.005,-1
detection task_00064,https://pubmed.ncbi.nlm.nih.gov/11240107/,Neuroanatomical discrimination between manipulating and maintaining processes involved in verbal working memory; a functional MRI study.,"Tsukiura T, Fujii T, Takahashi T, Xiao R, Inase M, Iijima T, Yamadori A, Okuda J",Brain research. Cognitive brain research,0.089,11240107,10.1016/s0926-6410(00)00059-8,-1
detection task_00065,https://pubmed.ncbi.nlm.nih.gov/22916169/,Neural correlates of individual performance differences in resolving perceptual conflict.,"Labrenz F, Themann M, Wascher E, Beste C, Pfleiderer B",PloS one,0.089,22916169,-1,-1
detection task_00066,https://pubmed.ncbi.nlm.nih.gov/24616488/,Photic memory for executive brain responses.,"Chellappa SL, Ly JQ, Meyer C, Balteau E, Degueldre C, Luxen A, Phillips C, Cooper HM, Vandewalle G",Proceedings of the National Academy of Sciences of the United States of America,0.089,24616488,-1,-1
detection task_00067,https://pubmed.ncbi.nlm.nih.gov/22452559/,Nicotine effects on brain function during a visual oddball task: a comparison between conventional and EEG-informed fMRI analysis.,"Warbrick T, Mobascher A, Brinkmeyer J, Musso F, Stoecker T, Shah NJ, Fink GR, Winterer G",Journal of cognitive neuroscience,0.088,22452559,-1,-1
detection task_00068,https://pubmed.ncbi.nlm.nih.gov/22634216/,Attentional priorities and access to short-term memory: parietal interactions.,"Gillebert CR, Dyrholm M, Vangkilde S, Kyllingsbaek S, Peeters R, Vandenberghe R",NeuroImage,0.088,22634216,-1,-1
detection task_00069,https://pubmed.ncbi.nlm.nih.gov/15054055/,Color discrimination involves ventral and dorsal stream visual areas.,"Claeys KG, Dupont P, Cornette L, Sunaert S, Van Hecke P, De Schutter E, Orban GA","Cerebral cortex (New York, N.Y. : 1991)",0.086,15054055,-1,-1
detection task_00070,https://pubmed.ncbi.nlm.nih.gov/21458471/,Neural correlates of olfactory processing in congenital blindness.,"Kupers R, Beaulieu-Lefebvre M, Schneider FC, Kassuba T, Paulson OB, Siebner HR, Ptito M",Neuropsychologia,0.086,21458471,-1,-1
detection task_00071,https://pubmed.ncbi.nlm.nih.gov/23874482/,Dissociation between dorsal and ventral posterior parietal cortical responses to  incidental changes in natural scenes.,"Howard LR, Kumaran D, Olafsdottir HF, Spiers HJ",PloS one,0.085,23874482,-1,-1
detection task_00072,https://pubmed.ncbi.nlm.nih.gov/17173876/,The neural correlates of attention orienting in visuospatial working memory for detecting feature and conjunction changes.,"Yeh YY, Kuo BC, Liu HL",Brain research,0.084,17173876,-1,-1
detection task_00073,https://pubmed.ncbi.nlm.nih.gov/14568459/,Abnormal processing of speech during oddball target detection in schizophrenia.,"Ngan ET, Vouloumanos A, Cairo TA, Laurens KR, Bates AT, Anderson CM, Werker JF, Liddle PF",NeuroImage,0.083,14568459,-1,-1
detection task_00074,https://pubmed.ncbi.nlm.nih.gov/25613405/,Overlapping neural circuits for visual attention and eye movements in the human cerebellum.,"Striemer CL, Chouinard PA, Goodale MA, de Ribaupierre S",Neuropsychologia,0.083,25613405,-1,-1
detection task_00075,https://pubmed.ncbi.nlm.nih.gov/23033853/,Task-dependent uncertainty modulation of perceptual decisions in the human brain.,"Li S, Yang F",The European journal of neuroscience,0.082,23033853,-1,-1
detection task_00076,https://pubmed.ncbi.nlm.nih.gov/27313520/,Holding Biological Motion in Working Memory: An fMRI Study.,"Lu X, Huang J, Yi Y, Shen M, Weng X, Gao Z",Frontiers in human neuroscience,0.082,27313520,-1,-1
detection task_00077,https://pubmed.ncbi.nlm.nih.gov/23131612/,Differential brain response to alcohol cue distractors across stages of alcohol dependence.,"Fryer SL, Jorgensen KW, Yetter EJ, Daurignac EC, Watson TD, Shanbhag H, Krystal JH, Mathalon DH",Biological psychology,0.081,23131612,-1,-1
detection task_00078,https://pubmed.ncbi.nlm.nih.gov/22659025/,Gains of item-specific training in visual working memory and their neural correlates.,"Zimmer HD, Popp C, Reith W, Krick C",Brain research,0.08,22659025,-1,-1
detection task_00079,https://pubmed.ncbi.nlm.nih.gov/19505583/,Single-trial P3 amplitude and latency informed event-related fMRI models yield different BOLD response patterns to a target detection task.,"Warbrick T, Mobascher A, Brinkmeyer J, Musso F, Richter N, Stoecker T, Fink GR, Shah NJ, Winterer G",NeuroImage,0.079,19505583,-1,-1
detection task_00080,https://pubmed.ncbi.nlm.nih.gov/21452937/,Face processing changes in normal aging revealed by fMRI adaptation.,"Lee Y, Grady CL, Habak C, Wilson HR, Moscovitch M",Journal of cognitive neuroscience,0.078,21452937,-1,-1
detection task_00081,https://pubmed.ncbi.nlm.nih.gov/24325851/,The effect of feedback on performance and brain activation during perceptual learning.,"Goldhacker M, Rosengarth K, Plank T, Greenlee MW",Vision research,0.077,24325851,10.1016/j.visres.2013.11.010,-1
detection task_00082,https://pubmed.ncbi.nlm.nih.gov/16529951/,Personality factors correlate with regional cerebral perfusion.,"O'Gorman RL, Kumari V, Williams SC, Zelaya FO, Connor SE, Alsop DC, Gray JA",NeuroImage,0.076,16529951,10.1016/j.neuroimage.2005.12.048,-1
detection task_00083,https://pubmed.ncbi.nlm.nih.gov/22912611/,Neural networks for action representation: a functional magnetic-resonance imaging and dynamic causal modeling study.,"Sasaki AT, Kochiyama T, Sugiura M, Tanabe HC, Sadato N",Frontiers in human neuroscience,0.075,22912611,-1,-1
detection task_00084,https://pubmed.ncbi.nlm.nih.gov/22055622/,Attentional modulation of perceptual comparison for feature binding.,"Kuo BC, Rotshtein P, Yeh YY",Brain and cognition,0.074,22055622,-1,-1
detection task_00085,https://pubmed.ncbi.nlm.nih.gov/24675649/,Interplay between functional connectivity and scale-free dynamics in intrinsic fMRI networks.,"Ciuciu P, Abry P, He BJ",NeuroImage,0.074,24675649,-1,-1
detection task_00086,https://pubmed.ncbi.nlm.nih.gov/28439236/,"Auditory, Visual and Audiovisual Speech Processing Streams in Superior Temporal Sulcus.","Venezia JH, Vaden KI Jr, Rong F, Maddox D, Saberi K, Hickok G",Frontiers in human neuroscience,0.073,28439236,-1,-1
detection task_00087,https://pubmed.ncbi.nlm.nih.gov/21192958/,Atypical processing of auditory temporal complexity in autistics.,"Samson F, Hyde KL, Bertone A, Soulieres I, Mendrek A, Ahad P, Mottron L, Zeffiro TA",Neuropsychologia,0.068,21192958,-1,-1
detection task_00088,https://pubmed.ncbi.nlm.nih.gov/25119464/,The pattern and loci of training-induced brain changes in healthy older adults are predicted by the nature of the intervention.,"Belleville S, Mellah S, de Boysson C, Demonet JF, Bier B",PloS one,0.064,25119464,-1,-1
detection task_00089,https://pubmed.ncbi.nlm.nih.gov/27683905/,Multivariate Pattern Analysis Reveals Category-Related Organization of Semantic Representations in Anterior Temporal Cortex.,"Malone PS, Glezer LS, Kim J, Jiang X, Riesenhuber M",The Journal of neuroscience : the official journal of the Society for Neuroscience,0.06,27683905,-1,-1
detection task_00090,https://pubmed.ncbi.nlm.nih.gov/29477442/,An fMRI study of coherent visual motion processing in children and adults.,"Taylor CM, Olulade OA, Luetje MM, Eden GF",NeuroImage,0.052,29477442,-1,-1
detection task_00091,https://pubmed.ncbi.nlm.nih.gov/25084224/,The level of audiovisual print-speech integration deficits in dyslexia.,"Kronschnabel J, Brem S, Maurer U, Brandeis D",Neuropsychologia,0.051,25084224,-1,-1
detection task_00092,https://pubmed.ncbi.nlm.nih.gov/29655940/,Audio-visual speech processing in age-related hearing loss: Stronger integration  and increased frontal lobe recruitment.,"Rosemann S, Thiel CM",NeuroImage,0.051,29655940,-1,-1
