paper_name,paper_url,Title,Author,Journal,Loading,PMID,Doi,download_status
disease_00353,https://pubmed.ncbi.nlm.nih.gov/20724032/,White matter hyperintensities alter functional organization of the motor system.,"Linortner P, Fazekas F, Schmidt R, Ropele S, Pendl B, Petrovic K, Loitfelder M, Neuper C, Enzinger C",Neurobiology of aging,0.073,20724032,-1,-1
disease_00354,https://pubmed.ncbi.nlm.nih.gov/22044532/,Dissociating behavioral disorders in early dementia-An FDG-PET study.,"Schroeter ML, Vogt B, Frisch S, Becker G, Seese A, Barthel H, Mueller K, Villringer A, Sabri O",Psychiatry research,0.073,22044532,-1,-1
disease_00355,https://pubmed.ncbi.nlm.nih.gov/23228724/,Altered cerebellar-cerebral resting-state functional connectivity reliably identifies major depressive disorder.,"Ma Q, Zeng LL, Shen H, Liu L, Hu D",Brain research,0.073,23228724,-1,-1
disease_00356,https://pubmed.ncbi.nlm.nih.gov/23693090/,Switch the itch: a naturalistic follow-up study on the neural correlates of cognitive flexibility in obsessive-compulsive disorder.,"Vriend C, de Wit SJ, Remijnse PL, van Balkom AJ, Veltman DJ, van den Heuvel OA",Psychiatry research,0.073,23693090,-1,-1
disease_00357,https://pubmed.ncbi.nlm.nih.gov/26359798/,Brain structural and functional connectivity in Parkinson's disease with freezing of gait.,"Canu E, Agosta F, Sarasso E, Volonte MA, Basaia S, Stojkovic T, Stefanova E, Comi G, Falini A, Kostic VS, Gatti R, Filippi M",Human brain mapping,0.073,26359798,-1,-1
disease_00358,https://pubmed.ncbi.nlm.nih.gov/26627482/,Modulation effect of the SORL1 gene on functional connectivity density in healthy young adults.,"Shen J, Zhang P, Liu H, Xu L, Xu J, Qin W, Liu B, Jiang T, Yu C",Brain structure & function,0.073,26627482,-1,-1
disease_00359,https://pubmed.ncbi.nlm.nih.gov/28812218/,Neural correlates of emotional valence processing in Parkinson's disease: dysfunction in the subcortex.,"Bell PT, Gilat M, Shine JM, McMahon KL, Lewis SJG, Copland DA",Brain imaging and behavior,0.073,28812218,-1,-1
disease_00360,https://pubmed.ncbi.nlm.nih.gov/29249364/,Resting state fMRI studies in SPG4-linked hereditary spastic paraplegia.,"Liao X, Huang M, Xing W, Wu X, Liao W, Wang X, Tang B, Shen L",Journal of the neurological sciences,0.073,29249364,-1,-1
disease_00361,https://pubmed.ncbi.nlm.nih.gov/18028117/,A cardiac signature of emotionality.,"Koelsch S, Remppis A, Sammler D, Jentschke S, Mietchen D, Fritz T, Bonnemeier H, Siebel WA",The European journal of neuroscience,0.072,18028117,-1,-1
disease_00362,https://pubmed.ncbi.nlm.nih.gov/18215449/,Clock drawing performance and brain morphology in mild cognitive impairment and Alzheimer's disease.,"Thomann PA, Toro P, Dos Santos V, Essig M, Schroder J",Brain and cognition,0.072,18215449,-1,-1
disease_00363,https://pubmed.ncbi.nlm.nih.gov/21985908/,Influence of estradiol on functional brain organization for working memory.,"Joseph JE, Swearingen JE, Corbly CR, Curry TE Jr, Kelly TH",NeuroImage,0.072,21985908,-1,-1
disease_00364,https://pubmed.ncbi.nlm.nih.gov/22887827/,Brain activation and functional connectivity in premanifest Huntington's disease  during states of intrinsic and phasic alertness.,"Wolf RC, Gron G, Sambataro F, Vasic N, Wolf ND, Thomann PA, Saft C, Landwehrmeyer GB, Orth M",Human brain mapping,0.072,22887827,-1,-1
disease_00365,https://pubmed.ncbi.nlm.nih.gov/23133615/,Regional homogeneity within the default mode network in bipolar depression: a resting-state functional magnetic resonance imaging study.,"Liu CH, Ma X, Li F, Wang YJ, Tie CL, Li SF, Chen TL, Fan TT, Zhang Y, Dong J, Yao L, Wu X, Wang CY",PloS one,0.072,23133615,-1,-1
disease_00366,https://pubmed.ncbi.nlm.nih.gov/23532800/,Neurophysiological correlates of anhedonia in feedback processing.,"Mies GW, Van den Berg I, Franken IH, Smits M, Van der Molen MW, Van der Veen FM",Frontiers in human neuroscience,0.072,23532800,-1,-1
disease_00367,https://pubmed.ncbi.nlm.nih.gov/25526971/,Quantitative Magnetization Transfer Imaging as a Biomarker for Effects of Systemic Inflammation on the Brain.,"Harrison NA, Cooper E, Dowell NG, Keramida G, Voon V, Critchley HD, Cercignani M",Biological psychiatry,0.072,25526971,-1,-1
disease_00368,https://pubmed.ncbi.nlm.nih.gov/25596589/,Dopaminergic Modulation of Cognitive Preparation for Overt Reading: Evidence from the Study of Genetic Polymorphisms.,"Arnold C, Gispert S, Bonig H, von Wegner F, Somasundaram S, Kell CA","Cerebral cortex (New York, N.Y. : 1991)",0.072,25596589,-1,-1
disease_00369,https://pubmed.ncbi.nlm.nih.gov/26497912/,Experience of negative emotions in Parkinson's disease: An fMRI investigation.,"Schienle A, Ille R, Wabnegger A",Neuroscience letters,0.072,26497912,-1,-1
disease_00370,https://pubmed.ncbi.nlm.nih.gov/29578031/,The UNC/UMN Baby Connectome Project (BCP): An overview of the study design and protocol development.,"Howell BR, Styner MA, Gao W, Yap PT, Wang L, Baluyot K, Yacoub E, Chen G, Potts T, Salzwedel A, Li G, Gilmore JH, Piven J, Smith JK, Shen D, Ugurbil K, Zhu H, Lin W, Elison JT",NeuroImage,0.072,29578031,-1,-1
disease_00371,https://pubmed.ncbi.nlm.nih.gov/16997428/,Increased fMRI responses during encoding in mild cognitive impairment.,"Hamalainen A, Pihlajamaki M, Tanila H, Hanninen T, Niskanen E, Tervo S, Karjalainen PA, Vanninen RL, Soininen H",Neurobiology of aging,0.071,16997428,10.1016/j.neurobiolaging.2006.08.008,-1
disease_00372,https://pubmed.ncbi.nlm.nih.gov/18006337/,Neuroimaging of individuals with Down's syndrome at-risk for dementia: evidence for possible compensatory events.,"Haier RJ, Head K, Head E, Lott IT",NeuroImage,0.071,18006337,10.1016/j.neuroimage.2007.09.064,-1
disease_00373,https://pubmed.ncbi.nlm.nih.gov/19188005/,Functional brain changes in early Parkinson's disease during motor response and motor inhibition.,"Baglio F, Blasi V, Falini A, Farina E, Mantovani F, Olivotto F, Scotti G, Nemni R, Bozzali M",Neurobiology of aging,0.071,19188005,-1,-1
disease_00374,https://pubmed.ncbi.nlm.nih.gov/20071459/,Hierarchical organization of scripts: converging evidence from FMRI and frontotemporal degeneration.,"Farag C, Troiani V, Bonner M, Powers C, Avants B, Gee J, Grossman M","Cerebral cortex (New York, N.Y. : 1991)",0.071,20071459,-1,-1
disease_00375,https://pubmed.ncbi.nlm.nih.gov/21625502/,Visual personal familiarity in amnestic mild cognitive impairment.,"Jurjanz L, Donix M, Amanatidis EC, Meyer S, Poettrich K, Huebner T, Baeumler D, Smolka MN, Holthoff VA",PloS one,0.071,21625502,-1,-1
disease_00376,https://pubmed.ncbi.nlm.nih.gov/28754515/,Maternal Systemic Interleukin-6 During Pregnancy Is Associated With Newborn Amygdala Phenotypes and Subsequent Behavior at 2 Years of Age.,"Graham AM, Rasmussen JM, Rudolph MD, Heim CM, Gilmore JH, Styner M, Potkin SG, Entringer S, Wadhwa PD, Fair DA, Buss C",Biological psychiatry,0.071,28754515,-1,-1
disease_00377,https://pubmed.ncbi.nlm.nih.gov/28974380/,Neural evidence for defective top-down control of visual processing in Parkinson's and Alzheimer's disease.,"Nemcova Elfmarkova N, Gajdos M, Rektorova I, Marecek R, Rapcsak SZ",Neuropsychologia,0.071,28974380,-1,-1
disease_00378,https://pubmed.ncbi.nlm.nih.gov/12725761/,Evidence for axonal pathology and adaptive cortical reorganization in patients at presentation with clinically isolated syndromes suggestive of multiple sclerosis.,"Rocca MA, Mezzapesa DM, Falini A, Ghezzi A, Martinelli V, Scotti G, Comi G, Filippi M",NeuroImage,0.07,12725761,-1,-1
disease_00379,https://pubmed.ncbi.nlm.nih.gov/16226349/,Activation of brain regions vulnerable to Alzheimer's disease: the effect of mild cognitive impairment.,"Johnson SC, Schmitz TW, Moritz CH, Meyerand ME, Rowley HA, Alexander AL, Hansen KW, Gleason CE, Carlsson CM, Ries ML, Asthana S, Chen K, Reiman EM, Alexander GE",Neurobiology of aging,0.07,16226349,-1,-1
disease_00380,https://pubmed.ncbi.nlm.nih.gov/16979268/,Anatomical and functional alterations in semantic dementia: a voxel-based MRI and PET study.,"Desgranges B, Matuszewski V, Piolino P, Chetelat G, Mezenge F, Landeau B, de la Sayette V, Belliard S, Eustache F",Neurobiology of aging,0.07,16979268,-1,-1
disease_00381,https://pubmed.ncbi.nlm.nih.gov/18053618/,"Brain structure and function related to cognitive reserve variables in normal aging, mild cognitive impairment and Alzheimer's disease.","Sole-Padulles C, Bartres-Faz D, Junque C, Vendrell P, Rami L, Clemente IC, Bosch B, Villar A, Bargallo N, Jurado MA, Barrios M, Molinuevo JL",Neurobiology of aging,0.07,18053618,-1,-1
disease_00382,https://pubmed.ncbi.nlm.nih.gov/18456379/,Neural substrates of cognitive skill learning in Parkinson's disease.,"Beauchamp MH, Dagher A, Panisset M, Doyon J",Brain and cognition,0.07,18456379,-1,-1
disease_00383,https://pubmed.ncbi.nlm.nih.gov/20298792/,Increased functional brain response during word retrieval in cognitively intact older adults at genetic risk for Alzheimer's disease.,"Wierenga CE, Stricker NH, McCauley A, Simmons A, Jak AJ, Chang YL, Delano-Wood L, Bangen KJ, Salmon DP, Bondi MW",NeuroImage,0.07,20298792,-1,-1
disease_00384,https://pubmed.ncbi.nlm.nih.gov/21530556/,Where did I put that? Patients with amnestic mild cognitive impairment demonstrate widespread reductions in activity during the encoding of ecologically relevant object-location associations.,"Hampstead BM, Stringer AY, Stilla RF, Amaraneni A, Sathian K",Neuropsychologia,0.07,21530556,-1,-1
disease_00385,https://pubmed.ncbi.nlm.nih.gov/21538702/,Attention-related networks in Alzheimer's disease: a resting functional MRI study.,"Li R, Wu X, Fleisher AS, Reiman EM, Chen K, Yao L",Human brain mapping,0.07,21538702,-1,-1
disease_00386,https://pubmed.ncbi.nlm.nih.gov/21967727/,Grey matter abnormalities within cortico-limbic-striatal circuits in acute and weight-restored anorexia nervosa patients.,"Friederich HC, Walther S, Bendszus M, Biller A, Thomann P, Zeigermann S, Katus T, Brunner R, Zastrow A, Herzog W",NeuroImage,0.07,21967727,-1,-1
disease_00387,https://pubmed.ncbi.nlm.nih.gov/22209236/,Reduced striatal activation during reward anticipation due to appetite-provoking  cues in chronic schizophrenia: a fMRI study.,"Grimm O, Vollstadt-Klein S, Krebs L, Zink M, Smolka MN",Schizophrenia research,0.07,22209236,-1,-1
disease_00388,https://pubmed.ncbi.nlm.nih.gov/22363273/,Brain structural and functional correlates of resilience to Bipolar Disorder.,Frangou S,Frontiers in human neuroscience,0.07,22363273,-1,-1
disease_00389,https://pubmed.ncbi.nlm.nih.gov/23818133/,Networks involved in olfaction and their dynamics using independent component analysis and unified structural equation modeling.,"Karunanayaka P, Eslinger PJ, Wang JL, Weitekamp CW, Molitoris S, Gates KM, Molenaar PC, Yang QX",Human brain mapping,0.07,23818133,-1,-1
disease_00390,https://pubmed.ncbi.nlm.nih.gov/25447060/,Neural correlates of spelling difficulties in Alzheimer's disease.,"Rodriguez-Ferreiro J, Martinez C, Perez-Carbajal AJ, Cuetos F",Neuropsychologia,0.07,25447060,-1,-1
disease_00391,https://pubmed.ncbi.nlm.nih.gov/25459293/,Altered baseline brain activities before food intake in obese men: A resting state fMRI study.,"Zhang B, Tian D, Yu C, Zhang J, Tian X, von Deneen KM, Zang Y, Walter M, Liu Y",Neuroscience letters,0.07,25459293,10.1016/j.neulet.2014.10.020,-1
disease_00392,https://pubmed.ncbi.nlm.nih.gov/28377075/,Extrastriatal dopamine D2-receptor availability in social anxiety disorder.,"Plaven-Sigray P, Hedman E, Victorsson P, Matheson GJ, Forsberg A, Djurfeldt DR, Ruck C, Halldin C, Lindefors N, Cervenka S",European neuropsychopharmacology : the journal of the European College of Neuropsychopharmacology,0.07,28377075,-1,-1
disease_00393,https://pubmed.ncbi.nlm.nih.gov/16463149/,Subcortical reorganization in amyotrophic lateral sclerosis.,"Konrad C, Jansen A, Henningsen H, Sommer J, Turski PA, Brooks BR, Knecht S",Experimental brain research,0.069,16463149,-1,-1
disease_00394,https://pubmed.ncbi.nlm.nih.gov/17566054/,Morphological substrate of face matching in healthy ageing and mild cognitive impairment: a combined MRI-fMRI study.,"Teipel SJ, Bokde AL, Born C, Meindl T, Reiser M, Moller HJ, Hampel H",Brain : a journal of neurology,0.069,17566054,-1,-1
disease_00395,https://pubmed.ncbi.nlm.nih.gov/18241895/,fMRI activation during episodic encoding and metacognitive appraisal across the lifespan: risk factors for Alzheimer's disease.,"Trivedi MA, Schmitz TW, Ries ML, Hess TM, Fitzgerald ME, Atwood CS, Rowley HA, Asthana S, Sager MA, Johnson SC",Neuropsychologia,0.069,18241895,-1,-1
disease_00396,https://pubmed.ncbi.nlm.nih.gov/19420090/,Neurobiological mechanisms underlying emotional processing in relapsing-remitting multiple sclerosis.,"Passamonti L, Cerasa A, Liguori M, Gioia MC, Valentino P, Nistico R, Quattrone A, Fera F",Brain : a journal of neurology,0.069,19420090,-1,-1
disease_00397,https://pubmed.ncbi.nlm.nih.gov/20006713/,Impairment and compensation coexist in amnestic MCI default mode network.,"Qi Z, Wu X, Wang Z, Zhang N, Dong H, Yao L, Li K",NeuroImage,0.069,20006713,-1,-1
disease_00398,https://pubmed.ncbi.nlm.nih.gov/21442040/,A baseline for the multivariate comparison of resting-state networks.,"Allen EA, Erhardt EB, Damaraju E, Gruner W, Segall JM, Silva RF, Havlicek M, Rachakonda S, Fries J, Kalyanam R, Michael AM, Caprihan A, Turner JA, Eichele T, Adelsheim S, Bryan AD, Bustillo J, Clark VP, Feldstein Ewing SW, Filbey F, Ford CC, Hutchison K, Jung RE, Kiehl KA, Kodituwakku P, Komesu YM, Mayer AR, Pearlson GD, Phillips JP, Sadek JR, Stevens M, Teuscher U, Thoma RJ, Calhoun VD",Frontiers in systems neuroscience,0.069,21442040,-1,-1
disease_00399,https://pubmed.ncbi.nlm.nih.gov/23300524/,Therapeutic subthalamic nucleus deep brain stimulation reverses cortico-thalamic  coupling during voluntary movements in Parkinson's disease.,"Kahan J, Mancini L, Urner M, Friston K, Hariz M, Holl E, White M, Ruge D, Jahanshahi M, Boertien T, Yousry T, Thornton JS, Limousin P, Zrinzo L, Foltynie T",PloS one,0.069,23300524,-1,-1
disease_00400,https://pubmed.ncbi.nlm.nih.gov/23382821/,Differential neural activation patterns in patients with Parkinson's disease and  freezing of gait in response to concurrent cognitive and motor load.,"Shine JM, Matar E, Ward PB, Bolitho SJ, Pearson M, Naismith SL, Lewis SJ",PloS one,0.069,23382821,-1,-1
disease_00401,https://pubmed.ncbi.nlm.nih.gov/25986304/,"Reduced cortical thickness, surface area in patients with chronic obstructive pulmonary disease: a surface-based morphometry and neuropsychological study.","Chen J, Lin IT, Zhang H, Lin J, Zheng S, Fan M, Zhang J",Brain imaging and behavior,0.069,25986304,-1,-1
disease_00402,https://pubmed.ncbi.nlm.nih.gov/28116239/,Characterization of functional brain activity and connectivity using EEG and fMRI in patients with sickle cell disease.,"Case M, Zhang H, Mundahl J, Datta Y, Nelson S, Gupta K, He B",NeuroImage. Clinical,0.069,28116239,-1,-1
disease_00403,https://pubmed.ncbi.nlm.nih.gov/28957750/,Comparing abnormalities of amplitude of low-frequency fluctuations in multiple system atrophy and idiopathic Parkinson's disease measured with resting-state fMRI.,"Wang N, Edmiston EK, Luo X, Yang H, Chang M, Wang F, Fan G",Psychiatry research. Neuroimaging,0.069,28957750,-1,-1
disease_00404,https://pubmed.ncbi.nlm.nih.gov/14505331/,Compensatory cortical activation observed by fMRI during a cognitive task at the  earliest stage of MS.,"Audoin B, Ibarrola D, Ranjeva JP, Confort-Gouny S, Malikova I, Ali-Cherif A, Pelletier J, Cozzone P",Human brain mapping,0.068,14505331,-1,-1
disease_00405,https://pubmed.ncbi.nlm.nih.gov/19428532/,A novel technique for examining human brain activity associated with pedaling using fMRI.,"Mehta JP, Verber MD, Wieser JA, Schmit BD, Schindler-Ivens SM",Journal of neuroscience methods,0.068,19428532,-1,-1
disease_00406,https://pubmed.ncbi.nlm.nih.gov/19490045/,"Evaluation of cognition, structural, and functional MRI in juvenile myoclonic epilepsy.","Roebling R, Scheerer N, Uttner I, Gruber O, Kraft E, Lerche H",Epilepsia,0.068,19490045,-1,-1
disease_00407,https://pubmed.ncbi.nlm.nih.gov/23274773/,Morphometric correlation of impulsivity in medial prefrontal cortex.,"Cho SS, Pellecchia G, Aminian K, Ray N, Segura B, Obeso I, Strafella AP",Brain topography,0.068,23274773,-1,-1
disease_00408,https://pubmed.ncbi.nlm.nih.gov/23932879/,Effect of mild cognitive impairment on the patterns of neural activity in early Parkinson's disease.,"Nagano-Saito A, Habak C, Mejia-Constain B, Degroot C, Monetta L, Jubault T, Bedetti C, Lafontaine AL, Chouinard S, Soland V, Ptito A, Strafella AP, Monchi O",Neurobiology of aging,0.068,23932879,-1,-1
disease_00409,https://pubmed.ncbi.nlm.nih.gov/25433457/,Relevance of parahippocampal-locus coeruleus connectivity to memory in early dementia.,"Jacobs HI, Wiese S, van de Ven V, Gronenschild EH, Verhey FR, Matthews PM",Neurobiology of aging,0.068,25433457,-1,-1
disease_00410,https://pubmed.ncbi.nlm.nih.gov/25456522/,Obsessive-compulsivity and working memory are associated with differential prefrontal cortex and insula activation in adolescents with a recent diagnosis of an eating disorder.,"Brooks SJ, Solstrand Dahlberg L, Swenne I, Aronsson M, Zarei S, Lundberg L, Jacobsson JA, Rask-Andersen M, Salonen-Ros H, Rosling A, Larsson EM, Schioth HB",Psychiatry research,0.068,25456522,-1,-1
disease_00411,https://pubmed.ncbi.nlm.nih.gov/27401793/,A cognitive fMRI study in non-manifesting LRRK2 and GBA carriers.,"Bregman N, Thaler A, Mirelman A, Helmich RC, Gurevich T, Orr-Urtreger A, Marder K, Bressman S, Bloem BR, Giladi N",Brain structure & function,0.068,27401793,10.1007/s00429-016-1271-4,-1
disease_00412,https://pubmed.ncbi.nlm.nih.gov/29297154/,Altered topological patterns of brain functional networks in Crohn's disease.,"Liu P, Li R, Bao C, Wei Y, Fan Y, Liu Y, Wang G, Wu H, Qin W",Brain imaging and behavior,0.068,29297154,10.1007/s11682-017-9814-8,-1
disease_00413,https://pubmed.ncbi.nlm.nih.gov/18191587/,In vivo SPECT imaging of vesicular acetylcholine transporter using [(123)I]-IBVM  in early Alzheimer's disease.,"Mazere J, Prunier C, Barret O, Guyot M, Hommet C, Guilloteau D, Dartigues JF, Auriacombe S, Fabrigoule C, Allard M",NeuroImage,0.067,18191587,10.1016/j.neuroimage.2007.11.028,-1
disease_00414,https://pubmed.ncbi.nlm.nih.gov/18440493/,Ventromedial prefrontal cortex processing during emotional evaluation in late-life depression: a longitudinal functional magnetic resonance imaging study.,"Brassen S, Kalisch R, Weber-Fahr W, Braus DF, Buchel C",Biological psychiatry,0.067,18440493,-1,-1
disease_00415,https://pubmed.ncbi.nlm.nih.gov/21935394/,Specifically progressive deficits of brain functional marker in amnestic type mild cognitive impairment.,"Bai F, Watson DR, Shi Y, Wang Y, Yue C, YuhuanTeng, Wu D, Yuan Y, Zhang Z",PloS one,0.067,21935394,-1,-1
disease_00416,https://pubmed.ncbi.nlm.nih.gov/22216234/,Aberrant hippocampal subregion networks associated with the classifications of aMCI subjects: a longitudinal resting-state study.,"Bai F, Xie C, Watson DR, Shi Y, Yuan Y, Wang Y, Yue C, Teng Y, Wu D, Zhang Z",PloS one,0.067,22216234,-1,-1
disease_00417,https://pubmed.ncbi.nlm.nih.gov/23675408/,Neural basis of impaired cognitive flexibility in patients with anorexia nervosa.,"Sato Y, Saito N, Utsumi A, Aizawa E, Shoji T, Izumiyama M, Mushiake H, Hongo M, Fukudo S",PloS one,0.067,23675408,-1,-1
disease_00418,https://pubmed.ncbi.nlm.nih.gov/23951069/,Aberrant functional connectivity of resting state networks in transient ischemic  attack.,"Li R, Wang S, Zhu L, Guo J, Zeng L, Gong Q, He L, Chen H",PloS one,0.067,23951069,-1,-1
disease_00419,https://pubmed.ncbi.nlm.nih.gov/24465794/,Windowed correlation: a suitable tool for providing dynamic fMRI-based functional connectivity neurofeedback on task difficulty.,"Zilverstand A, Sorger B, Zimmermann J, Kaas A, Goebel R",PloS one,0.067,24465794,-1,-1
disease_00420,https://pubmed.ncbi.nlm.nih.gov/24985056/,The default mode network is disrupted in Parkinson's disease with visual hallucinations.,"Yao N, Shek-Kwan Chang R, Cheung C, Pang S, Lau KK, Suckling J, Rowe JB, Yu K, Ka-Fung Mak H, Chua SE, Ho SL, McAlonan GM",Human brain mapping,0.067,24985056,-1,-1
disease_00421,https://pubmed.ncbi.nlm.nih.gov/26937384/,Prefrontal contributions to relational encoding in amnestic mild cognitive impairment.,"Foster CM, Addis DR, Ford JH, Kaufer DI, Burke JR, Browndyke JN, Welsh-Bohmer KA, Giovanello KS",NeuroImage. Clinical,0.067,26937384,-1,-1
disease_00422,https://pubmed.ncbi.nlm.nih.gov/27560515/,T2-Imaging to Assess Cerebral Oxygen Extraction Fraction in Carotid Occlusive Disease: Influence of Cerebral Autoregulation and Cerebral Blood Volume.,"Seiler A, Deichmann R, Pfeilschifter W, Hattingen E, Singer OC, Wagner M",PloS one,0.067,27560515,-1,-1
disease_00423,https://pubmed.ncbi.nlm.nih.gov/29305750/,Visual symptom provocation in skin picking disorder: an fMRI study.,"Schienle A, Ubel S, Wabnegger A",Brain imaging and behavior,0.067,29305750,-1,-1
disease_00424,https://pubmed.ncbi.nlm.nih.gov/18922517/,Amygdalar enlargement associated with unique perception.,"Asari T, Konishi S, Jimura K, Chikazoe J, Nakamura N, Miyashita Y",Cortex; a journal devoted to the study of the nervous system and behavior,0.066,18922517,-1,-1
disease_00425,https://pubmed.ncbi.nlm.nih.gov/20961661/,Interaction of caudate dopamine depletion and brain metabolic changes with cognitive dysfunction in early Parkinson's disease.,"Polito C, Berti V, Ramat S, Vanzi E, De Cristofaro MT, Pellicano G, Mungai F, Marini P, Formiconi AR, Sorbi S, Pupi A",Neurobiology of aging,0.066,20961661,-1,-1
disease_00426,https://pubmed.ncbi.nlm.nih.gov/21786091/,Perfusion abnormalities in mild cognitive impairment and mild dementia in Alzheimer's disease measured by pulsed arterial spin labeling MRI.,"Alexopoulos P, Sorg C, Forschler A, Grimmer T, Skokou M, Wohlschlager A, Perneczky R, Zimmer C, Kurz A, Preibisch C",European archives of psychiatry and clinical neuroscience,0.066,21786091,-1,-1
disease_00427,https://pubmed.ncbi.nlm.nih.gov/21813680/,Effects of brain amyloid deposition and reduced glucose metabolism on the default mode of brain function in normal aging.,"Kikuchi M, Hirosawa T, Yokokura M, Yagi S, Mori N, Yoshikawa E, Yoshihara Y, Sugihara G, Takebayashi K, Iwata Y, Suzuki K, Nakamura K, Ueki T, Minabe Y, Ouchi Y",The Journal of neuroscience : the official journal of the Society for Neuroscience,0.066,21813680,-1,-1
disease_00428,https://pubmed.ncbi.nlm.nih.gov/22009019/,The neural basis for establishing a focal point in pure coordination games.,"McMillan CT, Rascovsky K, Khella MC, Clark R, Grossman M",Social cognitive and affective neuroscience,0.066,22009019,-1,-1
disease_00429,https://pubmed.ncbi.nlm.nih.gov/22841350/,Effect of levodopa on both verbal and motor representations of action in Parkinson's disease: a fMRI study.,"Peran P, Nemmi F, Meligne D, Cardebat D, Peppe A, Rascol O, Caltagirone C, Demonet JF, Sabatini U",Brain and language,0.066,22841350,-1,-1
disease_00430,https://pubmed.ncbi.nlm.nih.gov/23474094/,Resting-state brain activity in major depressive disorder patients and their siblings.,"Liu CH, Ma X, Wu X, Fan TT, Zhang Y, Zhou FC, Li LJ, Li F, Tie CL, Li SF, Zhang D, Zhou Z, Dong J, Wang YJ, Yao L, Wang CY",Journal of affective disorders,0.066,23474094,-1,-1
disease_00431,https://pubmed.ncbi.nlm.nih.gov/23946385/,Proactive selective response suppression is implemented via the basal ganglia.,"Majid DS, Cai W, Corey-Bloom J, Aron AR",The Journal of neuroscience : the official journal of the Society for Neuroscience,0.066,23946385,10.1523/JNEUROSCI.5651-12.2013,-1
disease_00432,https://pubmed.ncbi.nlm.nih.gov/24120430/,Meditation's impact on default mode network and hippocampus in mild cognitive impairment: a pilot study.,"Wells RE, Yeh GY, Kerr CE, Wolkin J, Davis RB, Tan Y, Spaeth R, Wall RB, Walsh J, Kaptchuk TJ, Press D, Phillips RS, Kong J",Neuroscience letters,0.066,24120430,10.1016/j.neulet.2013.10.001,-1
disease_00433,https://pubmed.ncbi.nlm.nih.gov/26493637/,Disrupted sensorimotor and social-cognitive networks underlie symptoms in childhood-onset schizophrenia.,"Berman RA, Gotts SJ, McAdams HM, Greenstein D, Lalonde F, Clasen L, Watsky RE, Shora L, Ordonez AE, Raznahan A, Martin A, Gogtay N, Rapoport J",Brain : a journal of neurology,0.066,26493637,-1,-1
disease_00434,https://pubmed.ncbi.nlm.nih.gov/28970788/,Altered Functional Connectivity Density in Subtypes of Parkinson's Disease.,"Hu X, Jiang Y, Jiang X, Zhang J, Liang M, Li J, Zhang Y, Yao D, Luo C, Wang J",Frontiers in human neuroscience,0.066,28970788,-1,-1
disease_00435,https://pubmed.ncbi.nlm.nih.gov/17942721/,Bihemispheric leftward bias in a visuospatial attention-related network.,"Siman-Tov T, Mendelsohn A, Schonberg T, Avidan G, Podlipsky I, Pessoa L, Gadoth N, Ungerleider LG, Hendler T",The Journal of neuroscience : the official journal of the Society for Neuroscience,0.065,17942721,-1,-1
disease_00436,https://pubmed.ncbi.nlm.nih.gov/18550759/,"Relationships between hippocampal atrophy, white matter disruption, and gray matter hypometabolism in Alzheimer's disease.","Villain N, Desgranges B, Viader F, de la Sayette V, Mezenge F, Landeau B, Baron JC, Eustache F, Chetelat G",The Journal of neuroscience : the official journal of the Society for Neuroscience,0.065,18550759,-1,-1
disease_00437,https://pubmed.ncbi.nlm.nih.gov/19720385/,Functional imaging studies of hyposmia in Parkinson's disease.,"Takeda A, Saito N, Baba T, Kikuchi A, Sugeno N, Kobayashi M, Hasegawa T, Itoyama Y",Journal of the neurological sciences,0.065,19720385,-1,-1
