paper_name,paper_url,Title,Author,Journal,Loading,PMID,Doi,download_status
disease pd_00001,https://pubmed.ncbi.nlm.nih.gov/21689852/,The organization of narrative discourse in Lewy body spectrum disorder.,"Ash S, McMillan C, Gross RG, Cook P, Morgan B, Boller A, Dreyfuss M, Siderowf A, Grossman M",Brain and language,0.142,21689852,10.1016/j.bandl.2011.05.006,-1
disease pd_00002,https://pubmed.ncbi.nlm.nih.gov/21782030/,"Apathy, depression, and motor symptoms have distinct and separable resting activity patterns in idiopathic Parkinson disease.","Skidmore FM, Yang M, Baxter L, von Deneen K, Collingwood J, He G, Tandon R, Korenkevych D, Savenkov A, Heilman KM, Gold M, Liu Y",NeuroImage,0.141,21782030,10.1016/j.neuroimage.2011.07.012,-1
disease pd_00003,https://pubmed.ncbi.nlm.nih.gov/12867520/,Cognitive impairments in early Parkinson's disease are accompanied by reductions  in activity in frontostriatal neural circuitry.,"Lewis SJ, Dove A, Robbins TW, Barker RA, Owen AM",The Journal of neuroscience : the official journal of the Society for Neuroscience,0.127,12867520,10.1523/JNEUROSCI.23-15-06351.2003,-1
disease pd_00004,https://pubmed.ncbi.nlm.nih.gov/26285212/,Facial Emotion Recognition in Parkinson's Disease: An fMRI Investigation.,"Wabnegger A, Ille R, Schwingenschuh P, Katschnig-Winter P, Kogl-Wallner M, Wenzel K, Schienle A",PloS one,0.126,26285212,-1,-1
disease pd_00005,https://pubmed.ncbi.nlm.nih.gov/29501577/,Correlations between CSF proteins and spontaneous neuronal activity in Parkinson's disease.,"Guo T, Guan X, Zeng Q, Xuan M, Gu Q, Xu X, Zhang M",Neuroscience letters,0.124,29501577,-1,-1
disease pd_00006,https://pubmed.ncbi.nlm.nih.gov/21962945/,Difficulty processing temporary syntactic ambiguities in Lewy body spectrum disorder.,"Grossman M, Gross RG, Moore P, Dreyfuss M, McMillan CT, Cook PA, Ash S, Siderowf A",Brain and language,0.118,21962945,-1,-1
disease pd_00007,https://pubmed.ncbi.nlm.nih.gov/22270353/,Impaired executive function signals in motor brain regions in Parkinson's disease.,"Cameron IG, Pari G, Alahyane N, Brien DC, Coe BC, Stroman PW, Munoz DP",NeuroImage,0.114,22270353,-1,-1
disease pd_00008,https://pubmed.ncbi.nlm.nih.gov/18752414/,Reduced ventrolateral fMRI response during observation of emotional gestures related to the degree of dopaminergic impairment in Parkinson disease.,"Lotze M, Reimold M, Heymans U, Laihinen A, Patt M, Halsband U",Journal of cognitive neuroscience,0.111,18752414,-1,-1
disease pd_00009,https://pubmed.ncbi.nlm.nih.gov/26935551/,Early dysfunctions of fronto-parietal praxis networks in Parkinson's disease.,"Matt E, Foki T, Fischmeister F, Pirker W, Haubenberger D, Rath J, Lehrner J, Auff E, Beisteiner R",Brain imaging and behavior,0.111,26935551,-1,-1
disease pd_00010,https://pubmed.ncbi.nlm.nih.gov/18675995/,Functional mapping in PD and PSP for sustained phonation and phoneme tasks.,"Sachin S, Senthil Kumaran S, Singh S, Goyal V, Shukla G, Mahajan H, Behari M",Journal of the neurological sciences,0.108,18675995,-1,-1
disease pd_00011,https://pubmed.ncbi.nlm.nih.gov/28812218/,Neural correlates of emotional valence processing in Parkinson's disease: dysfunction in the subcortex.,"Bell PT, Gilat M, Shine JM, McMahon KL, Lewis SJG, Copland DA",Brain imaging and behavior,0.108,28812218,-1,-1
disease pd_00012,https://pubmed.ncbi.nlm.nih.gov/17064939/,Correlates of movement initiation and velocity in Parkinson's disease: A longitudinal PET study.,"Carbon M, Felice Ghilardi M, Dhawan V, Eidelberg D",NeuroImage,0.107,17064939,-1,-1
disease pd_00013,https://pubmed.ncbi.nlm.nih.gov/26497912/,Experience of negative emotions in Parkinson's disease: An fMRI investigation.,"Schienle A, Ille R, Wabnegger A",Neuroscience letters,0.107,26497912,-1,-1
disease pd_00014,https://pubmed.ncbi.nlm.nih.gov/28856094/,Alterations in striato-thalamo-pallidal intrinsic functional connectivity as a prodrome of Parkinson's disease.,"Dayan E, Browner N",NeuroImage. Clinical,0.106,28856094,-1,-1
disease pd_00015,https://pubmed.ncbi.nlm.nih.gov/19188005/,Functional brain changes in early Parkinson's disease during motor response and motor inhibition.,"Baglio F, Blasi V, Falini A, Farina E, Mantovani F, Olivotto F, Scotti G, Nemni R, Bozzali M",Neurobiology of aging,0.105,19188005,-1,-1
disease pd_00016,https://pubmed.ncbi.nlm.nih.gov/18456379/,Neural substrates of cognitive skill learning in Parkinson's disease.,"Beauchamp MH, Dagher A, Panisset M, Doyon J",Brain and cognition,0.103,18456379,-1,-1
disease pd_00017,https://pubmed.ncbi.nlm.nih.gov/22661404/,Perseveration and choice in Parkinson's disease: the impact of progressive frontostriatal dysfunction on action decisions.,"Hughes LE, Altena E, Barker RA, Rowe JB","Cerebral cortex (New York, N.Y. : 1991)",0.102,22661404,-1,-1
disease pd_00018,https://pubmed.ncbi.nlm.nih.gov/23300524/,Therapeutic subthalamic nucleus deep brain stimulation reverses cortico-thalamic  coupling during voluntary movements in Parkinson's disease.,"Kahan J, Mancini L, Urner M, Friston K, Hariz M, Holl E, White M, Ruge D, Jahanshahi M, Boertien T, Yousry T, Thornton JS, Limousin P, Zrinzo L, Foltynie T",PloS one,0.102,23300524,-1,-1
disease pd_00019,https://pubmed.ncbi.nlm.nih.gov/23382821/,Differential neural activation patterns in patients with Parkinson's disease and  freezing of gait in response to concurrent cognitive and motor load.,"Shine JM, Matar E, Ward PB, Bolitho SJ, Pearson M, Naismith SL, Lewis SJ",PloS one,0.101,23382821,-1,-1
disease pd_00020,https://pubmed.ncbi.nlm.nih.gov/23932879/,Effect of mild cognitive impairment on the patterns of neural activity in early Parkinson's disease.,"Nagano-Saito A, Habak C, Mejia-Constain B, Degroot C, Monetta L, Jubault T, Bedetti C, Lafontaine AL, Chouinard S, Soland V, Ptito A, Strafella AP, Monchi O",Neurobiology of aging,0.1,23932879,-1,-1
disease pd_00021,https://pubmed.ncbi.nlm.nih.gov/27401793/,A cognitive fMRI study in non-manifesting LRRK2 and GBA carriers.,"Bregman N, Thaler A, Mirelman A, Helmich RC, Gurevich T, Orr-Urtreger A, Marder K, Bressman S, Bloem BR, Giladi N",Brain structure & function,0.1,27401793,10.1007/s00429-016-1271-4,-1
disease pd_00022,https://pubmed.ncbi.nlm.nih.gov/25577413/,Association between MAPT haplotype and memory function in patients with Parkinson's disease and healthy aging individuals.,"Winder-Rhodes SE, Hampshire A, Rowe JB, Peelle JE, Robbins TW, Owen AM, Barker RA",Neurobiology of aging,0.099,25577413,10.1016/j.neurobiolaging.2014.12.006,-1
disease pd_00023,https://pubmed.ncbi.nlm.nih.gov/18649351/,Regional homogeneity changes in patients with Parkinson's disease.,"Wu T, Long X, Zang Y, Wang L, Hallett M, Li K, Chan P",Human brain mapping,0.098,18649351,10.1002/hbm.20622,-1
disease pd_00024,https://pubmed.ncbi.nlm.nih.gov/20961661/,Interaction of caudate dopamine depletion and brain metabolic changes with cognitive dysfunction in early Parkinson's disease.,"Polito C, Berti V, Ramat S, Vanzi E, De Cristofaro MT, Pellicano G, Mungai F, Marini P, Formiconi AR, Sorbi S, Pupi A",Neurobiology of aging,0.098,20961661,-1,-1
disease pd_00025,https://pubmed.ncbi.nlm.nih.gov/24985056/,The default mode network is disrupted in Parkinson's disease with visual hallucinations.,"Yao N, Shek-Kwan Chang R, Cheung C, Pang S, Lau KK, Suckling J, Rowe JB, Yu K, Ka-Fung Mak H, Chua SE, Ho SL, McAlonan GM",Human brain mapping,0.098,24985056,-1,-1
disease pd_00026,https://pubmed.ncbi.nlm.nih.gov/20162604/,Parkinson's disease and healthy aging: independent and interacting effects on action selection.,"Hughes LE, Barker RA, Owen AM, Rowe JB",Human brain mapping,0.097,20162604,-1,-1
disease pd_00027,https://pubmed.ncbi.nlm.nih.gov/22841350/,Effect of levodopa on both verbal and motor representations of action in Parkinson's disease: a fMRI study.,"Peran P, Nemmi F, Meligne D, Cardebat D, Peppe A, Rascol O, Caltagirone C, Demonet JF, Sabatini U",Brain and language,0.097,22841350,-1,-1
disease pd_00028,https://pubmed.ncbi.nlm.nih.gov/26509113/,Resting-state functional magnetic resonance imaging of the subthalamic microlesion and stimulation effects in Parkinson's disease: Indications of a principal role of the brainstem.,"Holiga S, Mueller K, Moller HE, Urgosik D, Ruzicka E, Schroeter ML, Jech R",NeuroImage. Clinical,0.097,26509113,-1,-1
disease pd_00029,https://pubmed.ncbi.nlm.nih.gov/28970788/,Altered Functional Connectivity Density in Subtypes of Parkinson's Disease.,"Hu X, Jiang Y, Jiang X, Zhang J, Liang M, Li J, Zhang Y, Yao D, Luo C, Wang J",Frontiers in human neuroscience,0.097,28970788,-1,-1
disease pd_00030,https://pubmed.ncbi.nlm.nih.gov/19720385/,Functional imaging studies of hyposmia in Parkinson's disease.,"Takeda A, Saito N, Baba T, Kikuchi A, Sugeno N, Kobayashi M, Hasegawa T, Itoyama Y",Journal of the neurological sciences,0.096,19720385,-1,-1
disease pd_00031,https://pubmed.ncbi.nlm.nih.gov/24992291/,The processing of lexical ambiguity in healthy ageing and Parkinsons disease: role of cortico-subcortical networks.,"Ketteler S, Ketteler D, Vohn R, Kastrau F, Schulz JB, Reetz K, Huber W",Brain research,0.094,24992291,-1,-1
disease pd_00032,https://pubmed.ncbi.nlm.nih.gov/21123574/,Quantification of indirect pathway inhibition by the adenosine A2a antagonist SYN115 in Parkinson disease.,"Black KJ, Koller JM, Campbell MC, Gusnard DA, Bandak SI",The Journal of neuroscience : the official journal of the Society for Neuroscience,0.093,21123574,-1,-1
disease pd_00033,https://pubmed.ncbi.nlm.nih.gov/23717467/,Abnormal baseline brain activity in non-depressed Parkinson's disease and depressed Parkinson's disease: a resting-state functional magnetic resonance imaging study.,"Wen X, Wu X, Liu J, Li K, Yao L",PloS one,0.092,23717467,-1,-1
disease pd_00034,https://pubmed.ncbi.nlm.nih.gov/25150576/,Failure of stop and go in de novo Parkinson's disease-a functional magnetic resonance imaging study.,"Vriend C, Gerrits NJ, Berendse HW, Veltman DJ, van den Heuvel OA, van der Werf YD",Neurobiology of aging,0.092,25150576,-1,-1
disease pd_00035,https://pubmed.ncbi.nlm.nih.gov/25641065/,Resting state functional connectivity of the subthalamic nucleus in Parkinson's disease assessed using arterial spin-labeled perfusion fMRI.,"Fernandez-Seara MA, Mengual E, Vidorreta M, Castellanos G, Irigoyen J, Erro E, Pastor MA",Human brain mapping,0.092,25641065,-1,-1
disease pd_00036,https://pubmed.ncbi.nlm.nih.gov/24404185/,"Altered spontaneous brain activity in patients with Parkinson's disease accompanied by depressive symptoms, as revealed by regional homogeneity and functional connectivity in the prefrontal-limbic sys","Sheng K, Fang W, Su M, Li R, Zou D, Han Y, Wang X, Cheng O",PloS one,0.091,24404185,-1,-1
disease pd_00037,https://pubmed.ncbi.nlm.nih.gov/25369523/,Asymmetrical Effect of Levodopa on the Neural Activity of Motor Regions in PD.,"Martinu K, Nagano-Saito A, Fogel S, Monchi O",PloS one,0.091,25369523,-1,-1
disease pd_00038,https://pubmed.ncbi.nlm.nih.gov/27730477/,Non-demented Parkinson's disease patients with apathy show decreased grey matter  volume in key executive and reward-related nodes.,"Martinez-Horta S, Sampedro F, Pagonabarraga J, Fernandez-Bobadilla R, Marin-Lahoz J, Riba J, Kulisevsky J",Brain imaging and behavior,0.091,27730477,-1,-1
disease pd_00039,https://pubmed.ncbi.nlm.nih.gov/12668237/,Rule learning in a serial reaction time task: an fMRI study on patients with early Parkinson's disease.,"Werheid K, Zysset S, Muller A, Reuter M, von Cramon DY",Brain research. Cognitive brain research,0.089,12668237,-1,-1
disease pd_00040,https://pubmed.ncbi.nlm.nih.gov/22351648/,Prefrontal dopamine levels determine the balance between cognitive stability and  flexibility.,"Fallon SJ, Williams-Gray CH, Barker RA, Owen AM, Hampshire A","Cerebral cortex (New York, N.Y. : 1991)",0.089,22351648,-1,-1
disease pd_00041,https://pubmed.ncbi.nlm.nih.gov/23825570/,Complexity of motor sequences and cortical reorganization in Parkinson's disease: a functional MRI study.,"Caproni S, Muti M, Principi M, Ottaviano P, Frondizi D, Capocchi G, Floridi P, Rossi A, Calabresi P, Tambasco N",PloS one,0.089,23825570,-1,-1
disease pd_00042,https://pubmed.ncbi.nlm.nih.gov/26300761/,Muscle co-activity tuning in Parkinsonian hand movement: disease-specific changes at behavioral and cerebral level.,"van der Stouwe AM, Toxopeus CM, de Jong BM, Yavuz P, Valsan G, Conway BA, Leenders KL, Maurits NM",Frontiers in human neuroscience,0.089,26300761,-1,-1
disease pd_00043,https://pubmed.ncbi.nlm.nih.gov/14736856/,Neural bases of set-shifting deficits in Parkinson's disease.,"Monchi O, Petrides M, Doyon J, Postuma RB, Worsley K, Dagher A",The Journal of neuroscience : the official journal of the Society for Neuroscience,0.087,14736856,-1,-1
disease pd_00044,https://pubmed.ncbi.nlm.nih.gov/19341805/,On a basal ganglia role in learning and rehearsing visual-motor associations.,"Bedard P, Sanes JN",NeuroImage,0.087,19341805,-1,-1
disease pd_00045,https://pubmed.ncbi.nlm.nih.gov/19368905/,Object naming and action-verb generation in Parkinson's disease: a fMRI study.,"Peran P, Cardebat D, Cherubini A, Piras F, Luccichenti G, Peppe A, Caltagirone C, Rascol O, Demonet JF, Sabatini U",Cortex; a journal devoted to the study of the nervous system and behavior,0.087,19368905,-1,-1
disease pd_00046,https://pubmed.ncbi.nlm.nih.gov/19439588/,Increased dependence of action selection on recent motor history in Parkinson's disease.,"Helmich RC, Aarts E, de Lange FP, Bloem BR, Toni I",The Journal of neuroscience : the official journal of the Society for Neuroscience,0.087,19439588,-1,-1
disease pd_00047,https://pubmed.ncbi.nlm.nih.gov/28579482/,Precuneus degeneration and isolated apathy in patients with Parkinson's disease.,"Shin JH, Shin SA, Lee JY, Nam H, Lim JS, Kim YK",Neuroscience letters,0.087,28579482,-1,-1
disease pd_00048,https://pubmed.ncbi.nlm.nih.gov/23145068/,The subthalamic microlesion story in Parkinson's disease: electrode insertion-related motor improvement with relative cortico-subcortical hypoactivation in fMRI.,"Jech R, Mueller K, Urgosik D, Sieger T, Holiga S, Ruzicka F, Dusek P, Havrankova P, Vymazal J, Ruzicka E",PloS one,0.086,23145068,-1,-1
disease pd_00049,https://pubmed.ncbi.nlm.nih.gov/29403348/,Training for Micrographia Alters Neural Connectivity in Parkinson's Disease.,"Nackaerts E, Michely J, Heremans E, Swinnen SP, Smits-Engelsman BCM, Vandenberghe W, Grefkes C, Nieuwboer A",Frontiers in neuroscience,0.086,29403348,-1,-1
disease pd_00050,https://pubmed.ncbi.nlm.nih.gov/20674286/,Dopaminergic modulation of the default mode network in Parkinson's disease.,"Delaveau P, Salgado-Pineda P, Fossati P, Witjas T, Azulay JP, Blin O",European neuropsychopharmacology : the journal of the European College of Neuropsychopharmacology,0.085,20674286,-1,-1
disease pd_00051,https://pubmed.ncbi.nlm.nih.gov/21206528/,Altered resting state cortico-striatal connectivity in mild to moderate stage Parkinson's disease.,"Kwak Y, Peltier S, Bohnen NI, Muller ML, Dayalu P, Seidler RD",Frontiers in systems neuroscience,0.085,21206528,-1,-1
disease pd_00052,https://pubmed.ncbi.nlm.nih.gov/22238630/,Abnormal activity in the precuneus during time perception in Parkinson's disease: an fMRI study.,"Dusek P, Jech R, Sieger T, Vymazal J, Ruzicka E, Wackermann J, Mueller K",PloS one,0.085,22238630,10.1371/journal.pone.0029635,-1
disease pd_00053,https://pubmed.ncbi.nlm.nih.gov/29501966/,Levodopa improves response inhibition and enhances striatal activation in early-stage Parkinson's disease.,"Manza P, Schwartz G, Masson M, Kann S, Volkow ND, Li CR, Leung HC",Neurobiology of aging,0.085,29501966,10.1016/j.neurobiolaging.2018.02.003,-1
disease pd_00054,https://pubmed.ncbi.nlm.nih.gov/23056337/,Levodopa effects on hand and speech movements in patients with Parkinson's disease: a FMRI study.,"Maillet A, Krainik A, Debu B, Tropres I, Lagrange C, Thobois S, Pollak P, Pinto S",PloS one,0.084,23056337,10.1371/journal.pone.0046541,-1
disease pd_00055,https://pubmed.ncbi.nlm.nih.gov/23620791/,Diminished activation of motor working-memory networks in Parkinson's disease.,"Rottschy C, Kleiman A, Dogan I, Langner R, Mirzazade S, Kronenbuerger M, Werner C, Shah NJ, Schulz JB, Eickhoff SB, Reetz K",PloS one,0.084,23620791,10.1371/journal.pone.0061786,-1
disease pd_00056,https://pubmed.ncbi.nlm.nih.gov/23861319/,The Neural Correlates of Upper Limb Motor Blocks in Parkinson's Disease and Their Relation to Freezing of Gait.,"Vercruysse S, Spildooren J, Heremans E, Wenderoth N, Swinnen SP, Vandenberghe W, Nieuwboer A","Cerebral cortex (New York, N.Y. : 1991)",0.084,23861319,10.1093/cercor/bht170,-1
disease pd_00057,https://pubmed.ncbi.nlm.nih.gov/25071432/,Function of basal ganglia in bridging cognitive and motor modules to perform an action.,"Nagano-Saito A, Martinu K, Monchi O",Frontiers in neuroscience,0.084,25071432,10.3389/fnins.2014.00187,-1
disease pd_00058,https://pubmed.ncbi.nlm.nih.gov/23727173/,Specific frequency band of amplitude low-frequency fl uctuation predicts Parkinson's disease.,"Zhang J, Wei L, Hu X, Zhang Y, Zhou D, Li C, Wang X, Feng H, Yin X, Xie B, Wang J",Behavioural brain research,0.083,23727173,10.1016/j.bbr.2013.05.039,-1
disease pd_00059,https://pubmed.ncbi.nlm.nih.gov/28486506/,An fMRI study into emotional processing in Parkinson's disease: Does increased medial prefrontal activation compensate for striatal dysfunction?,"Moonen AJH, Weiss PH, Wiesing M, Weidner R, Fink GR, Reijnders JSAM, Weber WM, Leentjens AFG",PloS one,0.083,28486506,-1,-1
disease pd_00060,https://pubmed.ncbi.nlm.nih.gov/21255661/,Resting state fMRI reveals increased subthalamic nucleus-motor cortex connectivity in Parkinson's disease.,"Baudrexel S, Witte T, Seifried C, von Wegner F, Beissner F, Klein JC, Steinmetz H, Deichmann R, Roeper J, Hilker R",NeuroImage,0.082,21255661,-1,-1
disease pd_00061,https://pubmed.ncbi.nlm.nih.gov/21862438/,Brain volume changes in Parkinson's disease and their relationship with cognitive and behavioural abnormalities.,"Biundo R, Formento-Dojot P, Facchini S, Vallelunga A, Ghezzo L, Foscolo L, Meneghello F, Antonini A",Journal of the neurological sciences,0.082,21862438,-1,-1
disease pd_00062,https://pubmed.ncbi.nlm.nih.gov/24647755/,Neural correlates of rate-dependent finger-tapping in Parkinson's disease.,"Wurster CD, Graf H, Ackermann H, Groth K, Kassubek J, Riecker A",Brain structure & function,0.082,24647755,-1,-1
disease pd_00063,https://pubmed.ncbi.nlm.nih.gov/25463618/,"Cortical thickness, surface area and volume measures in Parkinson's disease, multiple system atrophy and progressive supranuclear palsy.","Worker A, Blain C, Jarosz J, Chaudhuri KR, Barker GJ, Williams SC, Brown R, Leigh PN, Simmons A",PloS one,0.082,25463618,-1,-1
disease pd_00064,https://pubmed.ncbi.nlm.nih.gov/26382750/,Motor loop dysfunction causes impaired cognitive sequencing in patients suffering from Parkinson's disease.,"Schonberger AR, Hagelweide K, Pelzer EA, Fink GR, Schubotz RI",Neuropsychologia,0.082,26382750,-1,-1
disease pd_00065,https://pubmed.ncbi.nlm.nih.gov/28131236/,Regional volumetric change in Parkinson's disease with cognitive decline.,"Gee M, Dukart J, Draganski B, Wayne Martin WR, Emery D, Camicioli R",Journal of the neurological sciences,0.082,28131236,-1,-1
disease pd_00066,https://pubmed.ncbi.nlm.nih.gov/19710357/,Spatial remapping of cortico-striatal connectivity in Parkinson's disease.,"Helmich RC, Derikx LC, Bakker M, Scheeringa R, Bloem BR, Toni I","Cerebral cortex (New York, N.Y. : 1991)",0.081,19710357,-1,-1
disease pd_00067,https://pubmed.ncbi.nlm.nih.gov/22783172/,L-DOPA changes spontaneous low-frequency BOLD signal oscillations in Parkinson's  disease: a resting state fMRI study.,"Kwak Y, Peltier SJ, Bohnen NI, Muller ML, Dayalu P, Seidler RD",Frontiers in systems neuroscience,0.081,22783172,-1,-1
disease pd_00068,https://pubmed.ncbi.nlm.nih.gov/19584921/,L-dopa medication in Parkinson's disease restores activity in the motor cortico-striatal loop but does not modify the cognitive network.,"Jubault T, Monetta L, Strafella AP, Lafontaine AL, Monchi O",PloS one,0.08,19584921,-1,-1
disease pd_00069,https://pubmed.ncbi.nlm.nih.gov/23645717/,Neuromagnetic Evidence of Abnormal Movement-Related Beta Desynchronization in Parkinson's Disease.,"Heinrichs-Graham E, Wilson TW, Santamaria PM, Heithoff SK, Torres-Russotto D, Hutter-Saunders JA, Estes KA, Meza JL, Mosley RL, Gendelman HE","Cerebral cortex (New York, N.Y. : 1991)",0.08,23645717,-1,-1
disease pd_00070,https://pubmed.ncbi.nlm.nih.gov/24074808/,Reduced functional connectivity in early-stage drug-naive Parkinson's disease: a  resting-state fMRI study.,"Luo C, Song W, Chen Q, Zheng Z, Chen K, Cao B, Yang J, Li J, Huang X, Gong Q, Shang HF",Neurobiology of aging,0.08,24074808,-1,-1
disease pd_00071,https://pubmed.ncbi.nlm.nih.gov/25598397/,Reduced neural connectivity but increased task-related activity during working memory in de novo Parkinson patients.,"Trujillo JP, Gerrits NJ, Veltman DJ, Berendse HW, van der Werf YD, van den Heuvel OA",Human brain mapping,0.08,25598397,10.1002/hbm.22723,-1
disease pd_00072,https://pubmed.ncbi.nlm.nih.gov/23277109/,Movement related dynamics of subthalmo-cortical alpha connectivity in Parkinson's disease.,"Oswal A, Brown P, Litvak V",NeuroImage,0.079,23277109,10.1016/j.neuroimage.2012.12.041,-1
disease pd_00073,https://pubmed.ncbi.nlm.nih.gov/19853664/,Effective connectivity of neural networks in automatic movements in Parkinson's disease.,"Wu T, Chan P, Hallett M",NeuroImage,0.078,19853664,-1,-1
disease pd_00074,https://pubmed.ncbi.nlm.nih.gov/25279557/,Reduced topological efficiency in cortical-basal Ganglia motor network of Parkinson's disease: a resting state fMRI study.,"Wei L, Zhang J, Long Z, Wu GR, Hu X, Zhang Y, Wang J",PloS one,0.078,25279557,-1,-1
disease pd_00075,https://pubmed.ncbi.nlm.nih.gov/25496782/,Abnormal functional connectivity density in Parkinson's disease.,"Zhang J, Bi W, Zhang Y, Zhu M, Zhang Y, Feng H, Wang J, Zhang Y, Jiang T",Behavioural brain research,0.078,25496782,-1,-1
disease pd_00076,https://pubmed.ncbi.nlm.nih.gov/25959682/,The trajectory of disturbed resting-state cerebral function in Parkinson's disease at different Hoehn and Yahr stages.,"Luo C, Guo X, Song W, Chen Q, Yang J, Gong Q, Shang HF",Human brain mapping,0.078,25959682,-1,-1
disease pd_00077,https://pubmed.ncbi.nlm.nih.gov/26147571/,Altered Resting-State Brain Activity and Connectivity in Depressed Parkinson's Disease.,"Hu X, Song X, Li E, Liu J, Yuan Y, Liu W, Liu Y",PloS one,0.078,26147571,-1,-1
disease pd_00078,https://pubmed.ncbi.nlm.nih.gov/27453508/,Alterations in conflict monitoring are related to functional connectivity in Parkinson's disease.,"Rosenberg-Katz K, Maidan I, Jacob Y, Giladi N, Mirelman A, Hausdorff JM",Cortex; a journal devoted to the study of the nervous system and behavior,0.078,27453508,-1,-1
disease pd_00079,https://pubmed.ncbi.nlm.nih.gov/28249785/,Identifying the presence of Parkinson's disease using low-frequency fluctuations  in BOLD signals.,"Tang Y, Meng L, Wan CM, Liu ZH, Liao WH, Yan XX, Wang XY, Tang BS, Guo JF",Neuroscience letters,0.078,28249785,-1,-1
disease pd_00080,https://pubmed.ncbi.nlm.nih.gov/19463891/,Changes of functional connectivity of the motor network in the resting state in Parkinson's disease.,"Wu T, Wang L, Chen Y, Zhao C, Li K, Chan P",Neuroscience letters,0.077,19463891,-1,-1
disease pd_00081,https://pubmed.ncbi.nlm.nih.gov/25164875/,Cognitive impairment and resting-state network connectivity in Parkinson's disease.,"Baggio HC, Segura B, Sala-Llonch R, Marti MJ, Valldeoriola F, Compta Y, Tolosa E, Junque C",Human brain mapping,0.077,25164875,-1,-1
disease pd_00082,https://pubmed.ncbi.nlm.nih.gov/26096737/,Impaired planning in Parkinson's disease is reflected by reduced brain activation and connectivity.,"Trujillo JP, Gerrits NJ, Vriend C, Berendse HW, van den Heuvel OA, van der Werf YD",Human brain mapping,0.077,26096737,-1,-1
disease pd_00083,https://pubmed.ncbi.nlm.nih.gov/21924367/,Reliability analysis of the resting state can sensitively and specifically identify the presence of Parkinson disease.,"Skidmore FM, Yang M, Baxter L, von Deneen KM, Collingwood J, He G, White K, Korenkevych D, Savenkov A, Heilman KM, Gold M, Liu Y",NeuroImage,0.076,21924367,-1,-1
disease pd_00084,https://pubmed.ncbi.nlm.nih.gov/24204812/,Altered resting state brain networks in Parkinson's disease.,"Gottlich M, Munte TF, Heldmann M, Kasten M, Hagenah J, Kramer UM",PloS one,0.076,24204812,-1,-1
disease pd_00085,https://pubmed.ncbi.nlm.nih.gov/25576907/,Compensatory fronto-parietal hyperactivation during set-shifting in unmedicated patients with Parkinson's disease.,"Gerrits NJ, van der Werf YD, Verhoef KM, Veltman DJ, Groenewegen HJ, Berendse HW, van den Heuvel OA",Neuropsychologia,0.076,25576907,-1,-1
disease pd_00086,https://pubmed.ncbi.nlm.nih.gov/21364772/,Neurobehavioral mechanisms of temporal processing deficits in Parkinson's disease.,"Harrington DL, Castillo GN, Greenberg PA, Song DD, Lessig S, Lee RR, Rao SM",PloS one,0.075,21364772,-1,-1
disease pd_00087,https://pubmed.ncbi.nlm.nih.gov/26919667/,"Cortical Thickness, Surface Area and Subcortical Volume Differentially Contribute to Cognitive Heterogeneity in Parkinson's Disease.","Gerrits NJ, van Loenhoud AC, van den Berg SF, Berendse HW, Foncke EM, Klein M, Stoffers D, van der Werf YD, van den Heuvel OA",PloS one,0.075,26919667,-1,-1
disease pd_00088,https://pubmed.ncbi.nlm.nih.gov/28611616/,Differential Functional Connectivity Alterations of Two Subdivisions within the Right dlPFC in Parkinson's Disease.,"Caspers J, Mathys C, Hoffstaedter F, Sudmeyer M, Cieslik EC, Rubbert C, Hartmann CJ, Eickhoff CR, Reetz K, Grefkes C, Michely J, Turowski B, Schnitzler A, Eickhoff SB",Frontiers in human neuroscience,0.074,28611616,-1,-1
