paper_name,paper_url,Title,Author,Journal,Loading,PMID,Doi,download_status
disease_00525,https://pubmed.ncbi.nlm.nih.gov/22916152/,Effect of acupuncture in mild cognitive impairment and Alzheimer disease: a functional MRI study.,"Wang Z, Nie B, Li D, Zhao Z, Han Y, Song H, Xu J, Shan B, Lu J, Li K",PloS one,0.059,22916152,-1,-1
disease_00526,https://pubmed.ncbi.nlm.nih.gov/25515312/,Rapid treatment-induced brain changes in pediatric CRPS.,"Erpelding N, Simons L, Lebel A, Serrano P, Pielech M, Prabhu S, Becerra L, Borsook D",Brain structure & function,0.059,25515312,-1,-1
disease_00527,https://pubmed.ncbi.nlm.nih.gov/25698762/,Converging evidence for the neuroanatomic basis of combinatorial semantics in the angular gyrus.,"Price AR, Bonner MF, Peelle JE, Grossman M",The Journal of neuroscience : the official journal of the Society for Neuroscience,0.059,25698762,-1,-1
disease_00528,https://pubmed.ncbi.nlm.nih.gov/27079534/,Task-specific feature extraction and classification of fMRI volumes using a deep  neural network initialized with a deep belief network: Evaluation using sensorimotor tasks.,"Jang H, Plis SM, Calhoun VD, Lee JH",NeuroImage,0.059,27079534,-1,-1
disease_00529,https://pubmed.ncbi.nlm.nih.gov/27788143/,Brain Connectivity Changes in Autosomal Recessive Parkinson Disease: A Model for  the Sporadic Form.,"Makovac E, Cercignani M, Serra L, Torso M, Spano B, Petrucci S, Ricciardi L, Ginevrino M, Caltagirone C, Bentivoglio AR, Valente EM, Bozzali M",PloS one,0.059,27788143,-1,-1
disease_00530,https://pubmed.ncbi.nlm.nih.gov/28579482/,Precuneus degeneration and isolated apathy in patients with Parkinson's disease.,"Shin JH, Shin SA, Lee JY, Nam H, Lim JS, Kim YK",Neuroscience letters,0.059,28579482,-1,-1
disease_00531,https://pubmed.ncbi.nlm.nih.gov/29403348/,Training for Micrographia Alters Neural Connectivity in Parkinson's Disease.,"Nackaerts E, Michely J, Heremans E, Swinnen SP, Smits-Engelsman BCM, Vandenberghe W, Grefkes C, Nieuwboer A",Frontiers in neuroscience,0.059,29403348,10.3389/fnins.2018.00003,-1
disease_00532,https://pubmed.ncbi.nlm.nih.gov/29644521/,Functional connectivity change between posterior cingulate cortex and ventral attention network relates to the impairment of orientation for time in Alzheimer's disease patients.,"Yamashita KI, Uehara T, Prawiroharjo P, Yamashita K, Togao O, Hiwatashi A, Taniwaki Y, Utsunomiya H, Matsushita T, Yamasaki R, Kira JI",Brain imaging and behavior,0.059,29644521,10.1007/s11682-018-9860-x,-1
disease_00533,https://pubmed.ncbi.nlm.nih.gov/17008334/,Structural anatomy of empathy in neurodegenerative disease.,"Rankin KP, Gorno-Tempini ML, Allison SC, Stanley CM, Glenn S, Weiner MW, Miller BL",Brain : a journal of neurology,0.058,17008334,-1,-1
disease_00534,https://pubmed.ncbi.nlm.nih.gov/18172852/,Cortical dysfunction in patients with Huntington's disease during working memory  performance.,"Wolf RC, Vasic N, Schonfeldt-Lecuona C, Ecker D, Landwehrmeyer GB",Human brain mapping,0.058,18172852,-1,-1
disease_00535,https://pubmed.ncbi.nlm.nih.gov/18818908/,Decreasing task-related brain activity over repeated functional MRI scans and sessions with no change in performance: implications for serial investigations.,"Goodyear BG, Douglas EA",Experimental brain research,0.058,18818908,-1,-1
disease_00536,https://pubmed.ncbi.nlm.nih.gov/20674286/,Dopaminergic modulation of the default mode network in Parkinson's disease.,"Delaveau P, Salgado-Pineda P, Fossati P, Witjas T, Azulay JP, Blin O",European neuropsychopharmacology : the journal of the European College of Neuropsychopharmacology,0.058,20674286,-1,-1
disease_00537,https://pubmed.ncbi.nlm.nih.gov/21146507/,Alterations in regional homogeneity of baseline brain activity in pediatric temporal lobe epilepsy.,"Mankinen K, Long XY, Paakki JJ, Harila M, Rytky S, Tervonen O, Nikkinen J, Starck T, Remes J, Rantala H, Zang YF, Kiviniemi V",Brain research,0.058,21146507,-1,-1
disease_00538,https://pubmed.ncbi.nlm.nih.gov/21206528/,Altered resting state cortico-striatal connectivity in mild to moderate stage Parkinson's disease.,"Kwak Y, Peltier S, Bohnen NI, Muller ML, Dayalu P, Seidler RD",Frontiers in systems neuroscience,0.058,21206528,-1,-1
disease_00539,https://pubmed.ncbi.nlm.nih.gov/21640840/,Associative memory deficits in mild cognitive impairment: the role of hippocampal formation.,"Atienza M, Atalaia-Silva KC, Gonzalez-Escamilla G, Gil-Neciga E, Suarez-Gonzalez A, Cantero JL",NeuroImage,0.058,21640840,-1,-1
disease_00540,https://pubmed.ncbi.nlm.nih.gov/22238630/,Abnormal activity in the precuneus during time perception in Parkinson's disease: an fMRI study.,"Dusek P, Jech R, Sieger T, Vymazal J, Ruzicka E, Wackermann J, Mueller K",PloS one,0.058,22238630,-1,-1
disease_00541,https://pubmed.ncbi.nlm.nih.gov/22342463/,Visuospatial processing in early Alzheimer's disease: A multimodal neuroimaging study.,"Jacobs HI, Gronenschild EH, Evers EA, Ramakers IH, Hofman PA, Backes WH, Jolles J, Verhey FR, Van Boxtel MP",Cortex; a journal devoted to the study of the nervous system and behavior,0.058,22342463,-1,-1
disease_00542,https://pubmed.ncbi.nlm.nih.gov/24582637/,Ex vivo T2 relaxation: associations with age-related neuropathology and cognition.,"Dawe RJ, Bennett DA, Schneider JA, Leurgans SE, Kotrotsou A, Boyle PA, Arfanakis K",Neurobiology of aging,0.058,24582637,-1,-1
disease_00543,https://pubmed.ncbi.nlm.nih.gov/25331602/,Identifying and Mapping Connectivity Patterns of Brain Network Hubs in Alzheimer's Disease.,"Dai Z, Yan C, Li K, Wang Z, Wang J, Cao M, Lin Q, Shu N, Xia M, Bi Y, He Y","Cerebral cortex (New York, N.Y. : 1991)",0.058,25331602,-1,-1
disease_00544,https://pubmed.ncbi.nlm.nih.gov/26225427/,Local Activity and Causal Connectivity in Children with Benign Epilepsy with Centrotemporal Spikes.,"Wu Y, Ji GJ, Zang YF, Liao W, Jin Z, Liu YL, Li K, Zeng YW, Fang F",PloS one,0.058,26225427,-1,-1
disease_00545,https://pubmed.ncbi.nlm.nih.gov/26244883/,Cerebral Correlates of Abnormal Emotion Conflict Processing in Euthymic Bipolar Patients: A Functional MRI Study.,"Favre P, Polosan M, Pichat C, Bougerol T, Baciu M",PloS one,0.058,26244883,-1,-1
disease_00546,https://pubmed.ncbi.nlm.nih.gov/27394669/,Cerebral functional deficits in patients with ankylosing spondylitis- an fMRI study.,"Li C, Wei X, Zou Q, Zhang Y, Yin X, Zhao J, Wang J",Brain imaging and behavior,0.058,27394669,-1,-1
disease_00547,https://pubmed.ncbi.nlm.nih.gov/28130184/,Amygdala-prefrontal cortex resting-state functional connectivity varies with first depressive or manic episode in bipolar disorder.,"Wei S, Geng H, Jiang X, Zhou Q, Chang M, Zhou Y, Xu K, Tang Y, Wang F",Neuroscience letters,0.058,28130184,-1,-1
disease_00548,https://pubmed.ncbi.nlm.nih.gov/28649490/,Frequency-dependent changes in local intrinsic oscillations in chronic primary insomnia: A study of the amplitude of low-frequency fluctuations in the resting state.,"Zhou F, Huang S, Zhuang Y, Gao L, Gong H",NeuroImage. Clinical,0.058,28649490,-1,-1
disease_00549,https://pubmed.ncbi.nlm.nih.gov/28826089/,Considering sex differences clarifies the effects of depression on facial emotion processing during fMRI.,"Jenkins LM, Kendall AD, Kassel MT, Patron VG, Gowins JR, Dion C, Shankman SA, Weisenbach SL, Maki P, Langenecker SA",Journal of affective disorders,0.058,28826089,-1,-1
disease_00550,https://pubmed.ncbi.nlm.nih.gov/29501966/,Levodopa improves response inhibition and enhances striatal activation in early-stage Parkinson's disease.,"Manza P, Schwartz G, Masson M, Kann S, Volkow ND, Li CR, Leung HC",Neurobiology of aging,0.058,29501966,-1,-1
disease_00551,https://pubmed.ncbi.nlm.nih.gov/15488301/,Neural correlates of internally-generated disgust via autobiographical recall: a  functional magnetic resonance imaging investigation.,"Fitzgerald DA, Posse S, Moore GJ, Tancer ME, Nathan PJ, Phan KL",Neuroscience letters,0.057,15488301,10.1016/j.neulet.2004.08.007,-1
disease_00552,https://pubmed.ncbi.nlm.nih.gov/16794848/,Bilateral basal ganglia activation associated with sensorimotor adaptation.,"Seidler RD, Noll DC, Chintalapati P",Experimental brain research,0.057,16794848,10.1007/s00221-006-0571-y,-1
disease_00553,https://pubmed.ncbi.nlm.nih.gov/17133390/,Altered functional connectivity in early Alzheimer's disease: a resting-state fMRI study.,"Wang K, Liang M, Wang L, Tian L, Zhang X, Li K, Jiang T",Human brain mapping,0.057,17133390,10.1002/hbm.20324,-1
disease_00554,https://pubmed.ncbi.nlm.nih.gov/17399959/,Fronto-temporal-lobe atrophy in early-stage Alzheimer's disease identified using  an improved detection methodology.,"Farrow TF, Thiyagesh SN, Wilkinson ID, Parks RW, Ingram L, Woodruff PW",Psychiatry research,0.057,17399959,-1,-1
disease_00555,https://pubmed.ncbi.nlm.nih.gov/17719211/,Reduced neuronal efficacy in progressive mild cognitive impairment: a prospective fMRI study on visuospatial processing.,"Vannini P, Almkvist O, Dierks T, Lehmann C, Wahlund LO",Psychiatry research,0.057,17719211,-1,-1
disease_00556,https://pubmed.ncbi.nlm.nih.gov/21077147/,Altered functional adaptation to attention and working memory tasks with increasing complexity in relapsing-remitting multiple sclerosis patients.,"Amann M, Dossegger LS, Penner IK, Hirsch JG, Raselli C, Calabrese P, Weier K, Radu EW, Kappos L, Gass A",Human brain mapping,0.057,21077147,-1,-1
disease_00557,https://pubmed.ncbi.nlm.nih.gov/21862179/,Resting-state fMRI changes in Alzheimer's disease and mild cognitive impairment.,"Binnewijzend MA, Schoonheim MM, Sanz-Arigita E, Wink AM, van der Flier WM, Tolboom N, Adriaanse SM, Damoiseaux JS, Scheltens P, van Berckel BN, Barkhof F",Neurobiology of aging,0.057,21862179,-1,-1
disease_00558,https://pubmed.ncbi.nlm.nih.gov/22395084/,"Brain hypoactivation, autonomic nervous system dysregulation, and gonadal hormones in depression: a preliminary study.","Holsen LM, Lee JH, Spaeth SB, Ogden LA, Klibanski A, Whitfield-Gabrieli S, Sloan RP, Goldstein JM",Neuroscience letters,0.057,22395084,-1,-1
disease_00559,https://pubmed.ncbi.nlm.nih.gov/23056337/,Levodopa effects on hand and speech movements in patients with Parkinson's disease: a FMRI study.,"Maillet A, Krainik A, Debu B, Tropres I, Lagrange C, Thobois S, Pollak P, Pinto S",PloS one,0.057,23056337,-1,-1
disease_00560,https://pubmed.ncbi.nlm.nih.gov/23620791/,Diminished activation of motor working-memory networks in Parkinson's disease.,"Rottschy C, Kleiman A, Dogan I, Langner R, Mirzazade S, Kronenbuerger M, Werner C, Shah NJ, Schulz JB, Eickhoff SB, Reetz K",PloS one,0.057,23620791,-1,-1
disease_00561,https://pubmed.ncbi.nlm.nih.gov/23727173/,Specific frequency band of amplitude low-frequency fl uctuation predicts Parkinson's disease.,"Zhang J, Wei L, Hu X, Zhang Y, Zhou D, Li C, Wang X, Feng H, Yin X, Xie B, Wang J",Behavioural brain research,0.057,23727173,-1,-1
disease_00562,https://pubmed.ncbi.nlm.nih.gov/23861319/,The Neural Correlates of Upper Limb Motor Blocks in Parkinson's Disease and Their Relation to Freezing of Gait.,"Vercruysse S, Spildooren J, Heremans E, Wenderoth N, Swinnen SP, Vandenberghe W, Nieuwboer A","Cerebral cortex (New York, N.Y. : 1991)",0.057,23861319,-1,-1
disease_00563,https://pubmed.ncbi.nlm.nih.gov/24447031/,Differences in paracingulate connectivity associated with epileptiform discharges and uncontrolled seizures in genetic generalized epilepsy.,"Kay BP, Holland SK, Privitera MD, Szaflarski JP",Epilepsia,0.057,24447031,-1,-1
disease_00564,https://pubmed.ncbi.nlm.nih.gov/25071432/,Function of basal ganglia in bridging cognitive and motor modules to perform an action.,"Nagano-Saito A, Martinu K, Monchi O",Frontiers in neuroscience,0.057,25071432,-1,-1
disease_00565,https://pubmed.ncbi.nlm.nih.gov/25832770/,The effect of beta-amyloid on face processing in young and old adults: A multivariate analysis of the BOLD signal.,"Rieck JR, Rodrigue KM, Kennedy KM, Devous MD Sr, Park DC",Human brain mapping,0.057,25832770,-1,-1
disease_00566,https://pubmed.ncbi.nlm.nih.gov/26923412/,Functional neuroanatomy of spatial sound processing in Alzheimer's disease.,"Golden HL, Agustus JL, Nicholas JM, Schott JM, Crutch SJ, Mancini L, Warren JD",Neurobiology of aging,0.057,26923412,-1,-1
disease_00567,https://pubmed.ncbi.nlm.nih.gov/27942447/,Altered structural and functional thalamocortical networks in secondarily generalized extratemporal lobe seizures.,"Peng SJ, Hsin YL",NeuroImage. Clinical,0.057,27942447,-1,-1
disease_00568,https://pubmed.ncbi.nlm.nih.gov/15607988/,A voxel based morphometry study on mild cognitive impairment.,"Pennanen C, Testa C, Laakso MP, Hallikainen M, Helkala EL, Hanninen T, Kivipelto M, Kononen M, Nissinen A, Tervo S, Vanhanen M, Vanninen R, Frisoni GB, Soininen H","Journal of neurology, neurosurgery, and psychiatry",0.056,15607988,-1,-1
disease_00569,https://pubmed.ncbi.nlm.nih.gov/17915264/,Neural correlates of emotional working memory in patients with mild cognitive impairment.,"Dohnel K, Sommer M, Ibach B, Rothmayr C, Meinhardt J, Hajak G",Neuropsychologia,0.056,17915264,-1,-1
disease_00570,https://pubmed.ncbi.nlm.nih.gov/18786570/,Detection of PCC functional connectivity characteristics in resting-state fMRI in mild Alzheimer's disease.,"Zhang HY, Wang SJ, Xing J, Liu B, Ma ZL, Yang M, Zhang ZJ, Teng GJ",Behavioural brain research,0.056,18786570,-1,-1
disease_00571,https://pubmed.ncbi.nlm.nih.gov/21255661/,Resting state fMRI reveals increased subthalamic nucleus-motor cortex connectivity in Parkinson's disease.,"Baudrexel S, Witte T, Seifried C, von Wegner F, Beissner F, Klein JC, Steinmetz H, Deichmann R, Roeper J, Hilker R",NeuroImage,0.056,21255661,10.1016/j.neuroimage.2011.01.017,-1
disease_00572,https://pubmed.ncbi.nlm.nih.gov/22674273/,Gray matter density of auditory association cortex relates to knowledge of sound  concepts in primary progressive aphasia.,"Bonner MF, Grossman M",The Journal of neuroscience : the official journal of the Society for Neuroscience,0.056,22674273,10.1523/JNEUROSCI.6241-11.2012,-1
disease_00573,https://pubmed.ncbi.nlm.nih.gov/24647755/,Neural correlates of rate-dependent finger-tapping in Parkinson's disease.,"Wurster CD, Graf H, Ackermann H, Groth K, Kassubek J, Riecker A",Brain structure & function,0.056,24647755,-1,-1
disease_00574,https://pubmed.ncbi.nlm.nih.gov/24651705/,Altered BOLD response during inhibitory and error processing in adolescents with  anorexia nervosa.,"Wierenga C, Bischoff-Grethe A, Melrose AJ, Grenesko-Stevens E, Irvine Z, Wagner A, Simmons A, Matthews S, Yau WY, Fennema-Notestine C, Kaye WH",PloS one,0.056,24651705,-1,-1
disease_00575,https://pubmed.ncbi.nlm.nih.gov/25176348/,Evidence for progressive brain abnormalities in early schizophrenia: a cross-sectional structural and functional connectivity study.,"Zhang F, Qiu L, Yuan L, Ma H, Ye R, Yu F, Hu P, Dong Y, Wang K",Schizophrenia research,0.056,25176348,-1,-1
disease_00576,https://pubmed.ncbi.nlm.nih.gov/25575881/,Functional connectivity pattern during rest within the episodic memory network in association with episodic memory performance in bipolar disorder.,"Oertel-Knochel V, Reinke B, Matura S, Prvulovic D, Linden DE, Ven VV",Psychiatry research,0.056,25575881,-1,-1
disease_00577,https://pubmed.ncbi.nlm.nih.gov/26382750/,Motor loop dysfunction causes impaired cognitive sequencing in patients suffering from Parkinson's disease.,"Schonberger AR, Hagelweide K, Pelzer EA, Fink GR, Schubotz RI",Neuropsychologia,0.056,26382750,-1,-1
disease_00578,https://pubmed.ncbi.nlm.nih.gov/26589804/,Don't watch where you're going: The neural correlates of decoupling eye and arm movements.,"Gorbet DJ, Sergio LE",Behavioural brain research,0.056,26589804,-1,-1
disease_00579,https://pubmed.ncbi.nlm.nih.gov/27830113/,Early grey matter changes in structural covariance networks in Huntington's disease.,"Coppen EM, van der Grond J, Hafkemeijer A, Rombouts SA, Roos RA",NeuroImage. Clinical,0.056,27830113,-1,-1
disease_00580,https://pubmed.ncbi.nlm.nih.gov/28486506/,An fMRI study into emotional processing in Parkinson's disease: Does increased medial prefrontal activation compensate for striatal dysfunction?,"Moonen AJH, Weiss PH, Wiesing M, Weidner R, Fink GR, Reijnders JSAM, Weber WM, Leentjens AFG",PloS one,0.056,28486506,-1,-1
disease_00581,https://pubmed.ncbi.nlm.nih.gov/28824362/,"Test-Retest Reliability of ""High-Order"" Functional Connectivity in Young Healthy  Adults.","Zhang H, Chen X, Zhang Y, Shen D",Frontiers in neuroscience,0.056,28824362,-1,-1
disease_00582,https://pubmed.ncbi.nlm.nih.gov/29763448/,Modulation of functional activity and connectivity by acupuncture in patients with Alzheimer disease as measured by resting-state fMRI.,"Zheng W, Su Z, Liu X, Zhang H, Han Y, Song H, Lu J, Li K, Wang Z",PloS one,0.056,29763448,-1,-1
disease_00583,https://pubmed.ncbi.nlm.nih.gov/15970381/,Visual attention deficits in Alzheimer's disease: an fMRI study.,"Hao J, Li K, Li K, Zhang D, Wang W, Yang Y, Yan B, Shan B, Zhou X",Neuroscience letters,0.055,15970381,-1,-1
disease_00584,https://pubmed.ncbi.nlm.nih.gov/18489966/,An fMRI study of verbal episodic memory encoding in amnestic mild cognitive impairment.,"Dannhauser TM, Shergill SS, Stevens T, Lee L, Seal M, Walker RW, Walker Z",Cortex; a journal devoted to the study of the nervous system and behavior,0.055,18489966,-1,-1
disease_00585,https://pubmed.ncbi.nlm.nih.gov/19596405/,Abnormal white matter independent of hippocampal atrophy in amnestic type mild cognitive impairment.,"Bai F, Zhang Z, Watson DR, Yu H, Shi Y, Yuan Y",Neuroscience letters,0.055,19596405,-1,-1
disease_00586,https://pubmed.ncbi.nlm.nih.gov/19710357/,Spatial remapping of cortico-striatal connectivity in Parkinson's disease.,"Helmich RC, Derikx LC, Bakker M, Scheeringa R, Bloem BR, Toni I","Cerebral cortex (New York, N.Y. : 1991)",0.055,19710357,-1,-1
disease_00587,https://pubmed.ncbi.nlm.nih.gov/21656213/,Cognitively preserved MS patients demonstrate functional differences in processing neutral and emotional faces.,"Jehna M, Langkammer C, Wallner-Blazek M, Neuper C, Loitfelder M, Ropele S, Fuchs S, Khalil M, Pluta-Fuerst A, Fazekas F, Enzinger C",Brain imaging and behavior,0.055,21656213,-1,-1
disease_00588,https://pubmed.ncbi.nlm.nih.gov/21862438/,Brain volume changes in Parkinson's disease and their relationship with cognitive and behavioural abnormalities.,"Biundo R, Formento-Dojot P, Facchini S, Vallelunga A, Ghezzo L, Foscolo L, Meneghello F, Antonini A",Journal of the neurological sciences,0.055,21862438,-1,-1
disease_00589,https://pubmed.ncbi.nlm.nih.gov/23236200/,Cerebral blood flow is diminished in asymptomatic middle-aged adults with maternal history of Alzheimer's disease.,"Okonkwo OC, Xu G, Oh JM, Dowling NM, Carlsson CM, Gallagher CL, Birdsill AC, Palotti M, Wharton W, Hermann BP, LaRue A, Bendlin BB, Rowley HA, Asthana S, Sager MA, Johnson SC","Cerebral cortex (New York, N.Y. : 1991)",0.055,23236200,-1,-1
disease_00590,https://pubmed.ncbi.nlm.nih.gov/25008351/,Altered intrinsic hippocmapus declarative memory network and its association with impulsivity in abstinent heroin dependent subjects.,"Zhai TY, Shao YC, Xie CM, Ye EM, Zou F, Fu LP, Li WJ, Chen G, Chen GY, Zhang ZG, Li SJ, Yang Z",Behavioural brain research,0.055,25008351,-1,-1
disease_00591,https://pubmed.ncbi.nlm.nih.gov/25462395/,Cortico-limbic network abnormalities in individuals with current and past major depressive disorder.,"Klauser P, Fornito A, Lorenzetti V, Davey CG, Dwyer DB, Allen NB, Yucel M",Journal of affective disorders,0.055,25462395,10.1016/j.jad.2014.10.041,-1
disease_00592,https://pubmed.ncbi.nlm.nih.gov/26093288/,Learning temporal statistics for sensory predictions in mild cognitive impairment.,"Bernardi Luft CD, Baker R, Bentham P, Kourtzi Z",Neuropsychologia,0.055,26093288,10.1016/j.neuropsychologia.2015.06.002,-1
disease_00593,https://pubmed.ncbi.nlm.nih.gov/28131236/,Regional volumetric change in Parkinson's disease with cognitive decline.,"Gee M, Dukart J, Draganski B, Wayne Martin WR, Emery D, Camicioli R",Journal of the neurological sciences,0.055,28131236,-1,-1
disease_00594,https://pubmed.ncbi.nlm.nih.gov/28650994/,Abnormal global functional network connectivity and its relationship to medial temporal atrophy in patients with amnestic mild cognitive impairment.,"Sheng C, Xia M, Yu H, Huang Y, Lu Y, Liu F, He Y, Han Y",PloS one,0.055,28650994,-1,-1
disease_00595,https://pubmed.ncbi.nlm.nih.gov/17397807/,Activity of attention related structures in multiple sclerosis patients.,"Nebel K, Wiese H, Seyfarth J, Gizewski ER, Stude P, Diener HC, Limmroth V",Brain research,0.054,17397807,-1,-1
disease_00596,https://pubmed.ncbi.nlm.nih.gov/17689504/,Impact of individual cognitive profile on visuo-motor reorganization in relapsing-remitting multiple sclerosis.,"Gioia MC, Cerasa A, Liguori M, Passamonti L, Condino F, Vercillo L, Valentino P, Clodomiro A, Quattrone A, Fera F",Brain research,0.054,17689504,-1,-1
disease_00597,https://pubmed.ncbi.nlm.nih.gov/17855375/,Dorsolateral prefrontal cortex dysfunction in presymptomatic Huntington's disease: evidence from event-related fMRI.,"Wolf RC, Vasic N, Schonfeldt-Lecuona C, Landwehrmeyer GB, Ecker D",Brain : a journal of neurology,0.054,17855375,-1,-1
disease_00598,https://pubmed.ncbi.nlm.nih.gov/18077465/,Cholinesterase inhibition modulates visual and attentional brain responses in Alzheimer's disease and health.,"Bentley P, Driver J, Dolan RJ",Brain : a journal of neurology,0.054,18077465,-1,-1
disease_00599,https://pubmed.ncbi.nlm.nih.gov/18585932/,The effects of neuregulin1 on brain function in controls and patients with schizophrenia and bipolar disorder.,"Mechelli A, Prata DP, Fu CH, Picchioni M, Kane F, Kalidindi S, McDonald C, Demjaha A, Kravariti E, Toulopoulou T, Murray R, Collier DA, McGuire PK",NeuroImage,0.054,18585932,-1,-1
disease_00600,https://pubmed.ncbi.nlm.nih.gov/19097164/,White-matter lesions along the cholinergic tracts are related to cortical sources of EEG rhythms in amnesic mild cognitive impairment.,"Babiloni C, Pievani M, Vecchio F, Geroldi C, Eusebi F, Fracassi C, Fletcher E, De Carli C, Boccardi M, Rossini PM, Frisoni GB",Human brain mapping,0.054,19097164,-1,-1
disease_00601,https://pubmed.ncbi.nlm.nih.gov/19560134/,"Cognitive reserve modulates task-induced activations and deactivations in healthy elders, amnestic mild cognitive impairment and mild Alzheimer's disease.","Bosch B, Bartres-Faz D, Rami L, Arenaza-Urquijo EM, Fernandez-Espejo D, Junque C, Sole-Padulles C, Sanchez-Valle R, Bargallo N, Falcon C, Molinuevo JL",Cortex; a journal devoted to the study of the nervous system and behavior,0.054,19560134,-1,-1
disease_00602,https://pubmed.ncbi.nlm.nih.gov/20053346/,Alterations in regional homogeneity of resting-state brain activity in autism spectrum disorders.,"Paakki JJ, Rahko J, Long X, Moilanen I, Tervonen O, Nikkinen J, Starck T, Remes J, Hurtig T, Haapsamo H, Jussila K, Kuusikko-Gauffin S, Mattila ML, Zang Y, Kiviniemi V",Brain research,0.054,20053346,-1,-1
disease_00603,https://pubmed.ncbi.nlm.nih.gov/20227250/,Bilateral functional asymmetry disparity in positive and negative schizophrenia revealed by resting-state fMRI.,"Ke M, Zou R, Shen H, Huang X, Zhou Z, Liu Z, Xue Z, Hu D",Psychiatry research,0.054,20227250,-1,-1
disease_00604,https://pubmed.ncbi.nlm.nih.gov/21077137/,Spatial patterns of intrinsic brain activity in mild cognitive impairment and Alzheimer's disease: a resting-state functional MRI study.,"Wang Z, Yan C, Zhao C, Qi Z, Zhou W, Lu J, He Y, Li K",Human brain mapping,0.054,21077137,-1,-1
disease_00605,https://pubmed.ncbi.nlm.nih.gov/21375601/,A multicentre study of motor functional connectivity changes in patients with multiple sclerosis.,"Valsasina P, Rocca MA, Absinta M, Sormani MP, Mancini L, De Stefano N, Rovira A, Gass A, Enzinger C, Barkhof F, Wegner C, Matthews PM, Filippi M",The European journal of neuroscience,0.054,21375601,-1,-1
disease_00606,https://pubmed.ncbi.nlm.nih.gov/22405043/,Gray matter network associated with risk for Alzheimer's disease in young to middle-aged adults.,"Alexander GE, Bergfield KL, Chen K, Reiman EM, Hanson KD, Lin L, Bandy D, Caselli RJ, Moeller JR",Neurobiology of aging,0.054,22405043,-1,-1
disease_00607,https://pubmed.ncbi.nlm.nih.gov/22579645/,Brain correlates of musical and facial emotion recognition: evidence from the dementias.,"Hsieh S, Hornberger M, Piguet O, Hodges JR",Neuropsychologia,0.054,22579645,-1,-1
disease_00608,https://pubmed.ncbi.nlm.nih.gov/23071546/,MRI-based volumetry correlates of autobiographical memory in Alzheimer's disease.,"Philippi N, Noblet V, Botzung A, Despres O, Renard F, Sfikas G, Cretin B, Kremer S, Manning L, Blanc F",PloS one,0.054,23071546,-1,-1
disease_00609,https://pubmed.ncbi.nlm.nih.gov/23247063/,Hippocampus-precuneus functional connectivity as an early sign of Alzheimer's disease: a preliminary study using structural and functional magnetic resonance imaging data.,"Kim J, Kim YH, Lee JH",Brain research,0.054,23247063,-1,-1
disease_00610,https://pubmed.ncbi.nlm.nih.gov/23277109/,Movement related dynamics of subthalmo-cortical alpha connectivity in Parkinson's disease.,"Oswal A, Brown P, Litvak V",NeuroImage,0.054,23277109,-1,-1
disease_00611,https://pubmed.ncbi.nlm.nih.gov/23645717/,Neuromagnetic Evidence of Abnormal Movement-Related Beta Desynchronization in Parkinson's Disease.,"Heinrichs-Graham E, Wilson TW, Santamaria PM, Heithoff SK, Torres-Russotto D, Hutter-Saunders JA, Estes KA, Meza JL, Mosley RL, Gendelman HE","Cerebral cortex (New York, N.Y. : 1991)",0.054,23645717,10.1093/cercor/bht121,-1
