paper_name,paper_url,Title,Author,Journal,Loading,PMID,Doi,download_status
disease pd_00089,https://pubmed.ncbi.nlm.nih.gov/22304628/,Levodopa influences striatal activity but does not affect cortical hyper-activity in Parkinson's disease.,"Martinu K, Degroot C, Madjar C, Strafella AP, Monchi O",The European journal of neuroscience,0.073,22304628,-1,-1
disease pd_00090,https://pubmed.ncbi.nlm.nih.gov/27107157/,Cortical abnormalities in Parkinson's disease patients and relationship to depression: A surface-based morphometry study.,"Huang P, Lou Y, Xuan M, Gu Q, Guan X, Xu X, Song Z, Luo W, Zhang M",Psychiatry research. Neuroimaging,0.073,27107157,-1,-1
disease pd_00091,https://pubmed.ncbi.nlm.nih.gov/29309855/,Alterations of the amplitude of low-frequency fluctuations in anxiety in Parkinson's disease.,"Wang X, Li J, Wang M, Yuan Y, Zhu L, Shen Y, Zhang H, Zhang K",Neuroscience letters,0.072,29309855,10.1016/j.neulet.2018.01.010,-1
disease pd_00092,https://pubmed.ncbi.nlm.nih.gov/26042728/,Abnormal amygdala function in Parkinson's disease patients and its relationship to depression.,"Huang P, Xuan M, Gu Q, Yu X, Xu X, Luo W, Zhang M",Journal of affective disorders,0.071,26042728,10.1016/j.jad.2015.05.029,-1
disease pd_00093,https://pubmed.ncbi.nlm.nih.gov/20740649/,Functional connectivity of cortical motor areas in the resting state in Parkinson's disease.,"Wu T, Long X, Wang L, Hallett M, Zang Y, Li K, Chan P",Human brain mapping,0.07,20740649,-1,-1
disease pd_00094,https://pubmed.ncbi.nlm.nih.gov/26483652/,Dysfunctional putamen modulation during bimanual finger-to-thumb movement in patients with Parkinson's disease.,"Yan LR, Wu YB, Zeng XH, Gao LC",Frontiers in human neuroscience,0.07,26483652,-1,-1
disease pd_00095,https://pubmed.ncbi.nlm.nih.gov/29567424/,Altered intrinsic brain functional connectivity in drug-naive Parkinson's disease patients with LRRK2 mutations.,"Hou Y, Luo C, Yang J, Ou R, Song W, Chen Y, Gong Q, Shang H",Neuroscience letters,0.07,29567424,-1,-1
disease pd_00096,https://pubmed.ncbi.nlm.nih.gov/17223579/,Role of hyperactive cerebellum and motor cortex in Parkinson's disease.,"Yu H, Sternad D, Corcos DM, Vaillancourt DE",NeuroImage,0.069,17223579,-1,-1
disease pd_00097,https://pubmed.ncbi.nlm.nih.gov/20225221/,Basal ganglia hypoactivity during grip force in drug naive Parkinson's disease.,"Spraker MB, Prodoehl J, Corcos DM, Comella CL, Vaillancourt DE",Human brain mapping,0.069,20225221,-1,-1
disease pd_00098,https://pubmed.ncbi.nlm.nih.gov/21438075/,Levodopa and the feedback process on set-shifting in Parkinson's disease.,"Au WL, Zhou J, Palmes P, Sitoh YY, Tan LC, Rajapakse JC",Human brain mapping,0.069,21438075,-1,-1
disease pd_00099,https://pubmed.ncbi.nlm.nih.gov/23816374/,Decreased and increased cerebral regional homogeneity in early Parkinson's disease.,"Choe IH, Yeo S, Chung KC, Kim SH, Lim S",Brain research,0.069,23816374,-1,-1
disease pd_00100,https://pubmed.ncbi.nlm.nih.gov/25095723/,Subthalamic nucleus-sensorimotor cortex functional connectivity in de novo and moderate Parkinson's disease.,"Kurani AS, Seidler RD, Burciu RG, Comella CL, Corcos DM, Okun MS, MacKinnon CD, Vaillancourt DE",Neurobiology of aging,0.069,25095723,-1,-1
disease pd_00101,https://pubmed.ncbi.nlm.nih.gov/27757820/,Increased brain connectivity and activation after cognitive rehabilitation in Parkinson's disease: a randomized controlled trial.,"Diez-Cirarda M, Ojeda N, Pena J, Cabrera-Zubizarreta A, Lucas-Jimenez O, Gomez-Esteban JC, Gomez-Beldarrain MA, Ibarretxe-Bilbao N",Brain imaging and behavior,0.069,27757820,-1,-1
disease pd_00102,https://pubmed.ncbi.nlm.nih.gov/27717835/,A resting-state fMRI study on early-stage drug-naive Parkinson's disease patients with drooling.,"Hou Y, Luo C, Yang J, Song W, Ou R, Liu W, Gong Q, Shang H",Neuroscience letters,0.068,27717835,-1,-1
disease pd_00103,https://pubmed.ncbi.nlm.nih.gov/29636671/,Brain Atrophy and Reorganization of Structural Network in Parkinson's Disease With Hemiparkinsonism.,"Xu X, Guan X, Guo T, Zeng Q, Ye R, Wang J, Zhong J, Xuan M, Gu Q, Huang P, Pu J, Zhang B, Zhang M",Frontiers in human neuroscience,0.068,29636671,-1,-1
disease pd_00104,https://pubmed.ncbi.nlm.nih.gov/25594281/,Structural covariance networks of striatum subdivision in patients with Parkinson's disease.,"Chou KH, Lin WC, Lee PL, Tsai NW, Huang YC, Chen HL, Cheng KY, Chen PC, Wang HC, Lin TK, Li SH, Lin WM, Lu CH, Lin CP",Human brain mapping,0.067,25594281,-1,-1
disease pd_00105,https://pubmed.ncbi.nlm.nih.gov/19735293/,Neuroanatomical correlates of impaired decision-making and facial emotion recognition in early Parkinson's disease.,"Ibarretxe-Bilbao N, Junque C, Tolosa E, Marti MJ, Valldeoriola F, Bargallo N, Zarei M",The European journal of neuroscience,0.066,19735293,-1,-1
disease pd_00106,https://pubmed.ncbi.nlm.nih.gov/23357204/,Neural correlates of executive functions in healthy G2019S LRRK2 mutation carriers.,"Thaler A, Mirelman A, Helmich RC, van Nuenen BF, Rosenberg-Katz K, Gurevich T, Orr-Urtreger A, Marder K, Bressman S, Bloem BR, Giladi N, Hendler T",Cortex; a journal devoted to the study of the nervous system and behavior,0.066,23357204,-1,-1
disease pd_00107,https://pubmed.ncbi.nlm.nih.gov/24938993/,Dopaminergic modulation of resting-state functional connectivity in de novo patients with Parkinson's disease.,"Baik K, Cha J, Ham JH, Baek GM, Sunwoo MK, Hong JY, Shin NY, Kim JS, Lee JM, Lee SK, Sohn YH, Lee PH",Human brain mapping,0.066,24938993,-1,-1
disease pd_00108,https://pubmed.ncbi.nlm.nih.gov/29530489/,Abnormal ventral tegmental area-anterior cingulate cortex connectivity in Parkinson's disease with depression.,"Wei L, Hu X, Yuan Y, Liu W, Chen H",Behavioural brain research,0.065,29530489,-1,-1
disease pd_00109,https://pubmed.ncbi.nlm.nih.gov/29182621/,Exploring the reproducibility of functional connectivity alterations in Parkinson's disease.,"Badea L, Onu M, Wu T, Roceanu A, Bajenaru O",PloS one,0.064,29182621,-1,-1
disease pd_00110,https://pubmed.ncbi.nlm.nih.gov/20851193/,"Parkinson's disease tremor-related metabolic network: characterization, progression, and treatment effects.","Mure H, Hirano S, Tang CC, Isaias IU, Antonini A, Ma Y, Dhawan V, Eidelberg D",NeuroImage,0.063,20851193,-1,-1
disease pd_00111,https://pubmed.ncbi.nlm.nih.gov/22911738/,"Cerebral activations related to ballistic, stepwise interrupted and gradually modulated movements in Parkinson patients.","Toxopeus CM, Maurits NM, Valsan G, Conway BA, Leenders KL, de Jong BM",PloS one,0.063,22911738,10.1371/journal.pone.0041042,-1
disease pd_00112,https://pubmed.ncbi.nlm.nih.gov/29355770/,Incorporating spatial constraint in co-activation pattern analysis to explore the dynamics of resting-state networks: An application to Parkinson's disease.,"Zhuang X, Walsh RR, Sreenivasan K, Yang Z, Mishra V, Cordes D",NeuroImage,0.061,29355770,10.1016/j.neuroimage.2018.01.019,-1
disease pd_00113,https://pubmed.ncbi.nlm.nih.gov/25280970/,Task-rest modulation of basal ganglia connectivity in mild to moderate Parkinson's disease.,"Muller-Oehring EM, Sullivan EV, Pfefferbaum A, Huang NC, Poston KL, Bronte-Stewart HM, Schulte T",Brain imaging and behavior,0.059,25280970,10.1007/s11682-014-9317-9,-1
disease pd_00114,https://pubmed.ncbi.nlm.nih.gov/23097317/,Dissociable dorsal and ventral frontostriatal working memory circuits: evidence from subthalamic stimulation in Parkinson's disease.,"Ventre-Dominey J, Bourret S, Mollion H, Broussolle E, Dominey PF",Human brain mapping,0.057,23097317,-1,-1
disease pd_00115,https://pubmed.ncbi.nlm.nih.gov/27133526/,Associative reinstatement memory measures hippocampal function in Parkinson's Disease.,"Cohn M, Giannoylis I, De Belder M, Saint-Cyr JA, McAndrews MP",Neuropsychologia,0.053,27133526,-1,-1
disease pd_00116,https://pubmed.ncbi.nlm.nih.gov/28974380/,Neural evidence for defective top-down control of visual processing in Parkinson's and Alzheimer's disease.,"Nemcova Elfmarkova N, Gajdos M, Rektorova I, Marecek R, Rapcsak SZ",Neuropsychologia,0.052,28974380,-1,-1
disease pd_00117,https://pubmed.ncbi.nlm.nih.gov/26379530/,Alteration of Basal Ganglia and Right Frontoparietal Network in Early Drug-Naive  Parkinson's Disease during Heat Pain Stimuli and Resting State.,"Tan Y, Tan J, Deng J, Cui W, He H, Yang F, Deng H, Xiao R, Huang Z, Zhang X, Tan R, Shen X, Liu T, Wang X, Yao D, Luo C",Frontiers in human neuroscience,0.048,26379530,-1,-1
disease pd_00118,https://pubmed.ncbi.nlm.nih.gov/26559669/,Neuroanatomical Correlates of Theory of Mind Deficit in Parkinson's Disease: A Multimodal Imaging Study.,"Diez-Cirarda M, Ojeda N, Pena J, Cabrera-Zubizarreta A, Gomez-Beldarrain MA, Gomez-Esteban JC, Ibarretxe-Bilbao N",PloS one,0.044,26559669,-1,-1
