paper_name,paper_url,Title,Author,Journal,Loading,PMID,Doi,download_status
dmpfc_00001,https://pubmed.ncbi.nlm.nih.gov/21451040/,A parallel functional topography between medial and lateral prefrontal cortex: evidence and implications for cognitive control.,"Taren AA, Venkatraman V, Huettel SA",The Journal of neuroscience : the official journal of the Society for Neuroscience,0.565,21451040,-1,-1
dmpfc_00002,https://pubmed.ncbi.nlm.nih.gov/26302673/,The impact of motivation on race-based impression formation.,"Li T, Cardenas-Iniguez C, Correll J, Cloutier J",NeuroImage,0.523,26302673,-1,-1
dmpfc_00003,https://pubmed.ncbi.nlm.nih.gov/28352220/,The Dorsal Medial Prefrontal Cortex Is Recruited by High Construal of Non-social  Stimuli.,"Baetens KL, Ma N, Van Overwalle F",Frontiers in behavioral neuroscience,0.518,28352220,-1,-1
dmpfc_00004,https://pubmed.ncbi.nlm.nih.gov/22139633/,Remembering first impressions: effects of intentionality and diagnosticity on subsequent memory.,"Gilron R, Gutchess AH","Cognitive, affective & behavioral neuroscience",0.489,22139633,-1,-1
dmpfc_00005,https://pubmed.ncbi.nlm.nih.gov/23552078/,Network structure underlying resolution of conflicting non-verbal and verbal social information.,"Watanabe T, Yahata N, Kawakubo Y, Inoue H, Takano Y, Iwashiro N, Natsubori T, Takao H, Sasaki H, Gonoi W, Murakami M, Katsura M, Kunimatsu A, Abe O, Kasai K, Yamasue H",Social cognitive and affective neuroscience,0.471,23552078,-1,-1
dmpfc_00006,https://pubmed.ncbi.nlm.nih.gov/26199873/,Increases in frontostriatal connectivity are associated with response to dorsomedial repetitive transcranial magnetic stimulation in refractory binge/purge behaviors.,"Dunlop K, Woodside B, Lam E, Olmsted M, Colton P, Giacobbe P, Downar J",NeuroImage. Clinical,0.459,26199873,-1,-1
dmpfc_00007,https://pubmed.ncbi.nlm.nih.gov/21030482/,Amygdala and dorsomedial prefrontal cortex responses to appearance-based and behavior-based person impressions.,"Baron SG, Gobbini MI, Engell AD, Todorov A",Social cognitive and affective neuroscience,0.434,21030482,-1,-1
dmpfc_00008,https://pubmed.ncbi.nlm.nih.gov/27358450/,The Dorsal Medial Prefrontal Cortex Responds Preferentially to Social Interactions during Natural Viewing.,"Wagner DD, Kelley WM, Haxby JV, Heatherton TF",The Journal of neuroscience : the official journal of the Society for Neuroscience,0.421,27358450,10.1523/JNEUROSCI.4220-15.2016,-1
dmpfc_00009,https://pubmed.ncbi.nlm.nih.gov/19726640/,"Adapting to dynamic stimulus-response values: differential contributions of inferior frontal, dorsomedial, and dorsolateral regions of prefrontal cortex to decision making.","Mitchell DG, Luo Q, Avny SB, Kasprzycki T, Gupta K, Chen G, Finger EC, Blair RJ",The Journal of neuroscience : the official journal of the Society for Neuroscience,0.412,19726640,10.1523/JNEUROSCI.0963-09.2009,-1
dmpfc_00010,https://pubmed.ncbi.nlm.nih.gov/27840604/,Neural Correlates of Hostile Jokes: Cognitive and Motivational Processes in Humor Appreciation.,"Chan YC, Liao YJ, Tu CH, Chen HC",Frontiers in human neuroscience,0.407,27840604,10.3389/fnhum.2016.00527,-1
dmpfc_00011,https://pubmed.ncbi.nlm.nih.gov/27672175/,Grit and the brain: spontaneous activity of the dorsomedial prefrontal cortex mediates the relationship between the trait grit and academic performance.,"Wang S, Zhou M, Chen T, Yang X, Chen G, Wang M, Gong Q",Social cognitive and affective neuroscience,0.388,27672175,-1,-1
dmpfc_00012,https://pubmed.ncbi.nlm.nih.gov/24324419/,Dorsomedial prefrontal cortex activity predicts the accuracy in estimating others' preferences.,"Kang P, Lee J, Sul S, Kim H",Frontiers in human neuroscience,0.379,24324419,-1,-1
dmpfc_00013,https://pubmed.ncbi.nlm.nih.gov/24384149/,Creating metaphors: the neural basis of figurative language production.,"Benedek M, Beaty R, Jauk E, Koschutnig K, Fink A, Silvia PJ, Dunst B, Neubauer AC",NeuroImage,0.367,24384149,-1,-1
dmpfc_00014,https://pubmed.ncbi.nlm.nih.gov/23664619/,Social manipulation of preference in the human brain.,"Izuma K, Adolphs R",Neuron,0.365,23664619,-1,-1
dmpfc_00015,https://pubmed.ncbi.nlm.nih.gov/23136406/,Dorsomedial prefrontal cortex mediates rapid evaluations predicting the outcome of romantic interactions.,"Cooper JC, Dunne S, Furey T, O'Doherty JP",The Journal of neuroscience : the official journal of the Society for Neuroscience,0.364,23136406,-1,-1
dmpfc_00016,https://pubmed.ncbi.nlm.nih.gov/23327932/,Reminders of mortality decrease midcingulate activity in response to others' suffering.,"Luo S, Shi Z, Yang X, Wang X, Han S",Social cognitive and affective neuroscience,0.346,23327932,-1,-1
dmpfc_00017,https://pubmed.ncbi.nlm.nih.gov/23552077/,Involvement of the mentalizing network in social and non-social high construal.,"Baetens K, Ma N, Steen J, Van Overwalle F",Social cognitive and affective neuroscience,0.339,23552077,-1,-1
dmpfc_00018,https://pubmed.ncbi.nlm.nih.gov/24710652/,Neuronal correlates of three attentional strategies during affective picture processing: an fMRI study.,"Schienle A, Wabnegger A, Schoengassner F, Scharmuller W","Cognitive, affective & behavioral neuroscience",0.338,24710652,-1,-1
dmpfc_00019,https://pubmed.ncbi.nlm.nih.gov/20688176/,Anatomical differences and network characteristics underlying smoking cue reactivity.,"Zhang X, Salmeron BJ, Ross TJ, Gu H, Geng X, Yang Y, Stein EA",NeuroImage,0.328,20688176,-1,-1
dmpfc_00020,https://pubmed.ncbi.nlm.nih.gov/21557652/,Mine and me: exploring the neural basis of object ownership.,"Turk DJ, van Bussel K, Waiter GD, Macrae CN",Journal of cognitive neuroscience,0.312,21557652,-1,-1
dmpfc_00021,https://pubmed.ncbi.nlm.nih.gov/20850555/,"Parsing decision making processes in prefrontal cortex: response inhibition, overcoming learned avoidance, and reversal learning.","Greening SG, Finger EC, Mitchell DG",NeuroImage,0.311,20850555,-1,-1
dmpfc_00022,https://pubmed.ncbi.nlm.nih.gov/19620181/,Neural substrates of self-referential processing in Chinese Buddhists.,"Han S, Gu X, Mao L, Ge J, Wang G, Ma Y",Social cognitive and affective neuroscience,0.308,19620181,-1,-1
dmpfc_00023,https://pubmed.ncbi.nlm.nih.gov/17655831/,Making sense of nonsense: an fMRI study of task induced inference processes during discourse comprehension.,"Sieborger FT, Ferstl EC, von Cramon DY",Brain research,0.284,17655831,-1,-1
dmpfc_00024,https://pubmed.ncbi.nlm.nih.gov/22689216/,Mindfulness meditation training alters cortical representations of interoceptive  attention.,"Farb NA, Segal ZV, Anderson AK",Social cognitive and affective neuroscience,0.272,22689216,-1,-1
dmpfc_00025,https://pubmed.ncbi.nlm.nih.gov/25759285/,The development of the intrinsic functional connectivity of default network subsystems from age 3 to 5.,"Xiao Y, Zhai H, Friederici AD, Jia F",Brain imaging and behavior,0.27,25759285,-1,-1
dmpfc_00026,https://pubmed.ncbi.nlm.nih.gov/25037922/,The Neural Representation of Voluntary Task-Set Selection in Dynamic Environments.,"Wisniewski D, Reverberi C, Tusche A, Haynes JD","Cerebral cortex (New York, N.Y. : 1991)",0.269,25037922,-1,-1
dmpfc_00027,https://pubmed.ncbi.nlm.nih.gov/23998674/,Increased functional connectivity with puberty in the mentalising network involved in social emotion processing.,"Klapwijk ET, Goddings AL, Burnett Heyes S, Bird G, Viner RM, Blakemore SJ",Hormones and behavior,0.254,23998674,-1,-1
dmpfc_00028,https://pubmed.ncbi.nlm.nih.gov/29209186/,The Neural Association between Tendency to Forgive and Spontaneous Brain Activity in Healthy Young Adults.,"Li H, Lu J",Frontiers in human neuroscience,0.251,29209186,-1,-1
dmpfc_00029,https://pubmed.ncbi.nlm.nih.gov/24243619/,Neural Correlates of Explicit Social Judgments on Vocal Stimuli.,"Hensel L, Bzdok D, Muller VI, Zilles K, Eickhoff SB","Cerebral cortex (New York, N.Y. : 1991)",0.246,24243619,-1,-1
dmpfc_00030,https://pubmed.ncbi.nlm.nih.gov/16139812/,Neural mechanisms of automatic and direct processing of phobogenic stimuli in specific phobia.,"Straube T, Mentzel HJ, Miltner WH",Biological psychiatry,0.242,16139812,-1,-1
dmpfc_00031,https://pubmed.ncbi.nlm.nih.gov/24872557/,Distributed value representation in the medial prefrontal cortex during intertemporal choices.,"Wang Q, Luo S, Monterosso J, Zhang J, Fang X, Dong Q, Xue G",The Journal of neuroscience : the official journal of the Society for Neuroscience,0.242,24872557,-1,-1
dmpfc_00032,https://pubmed.ncbi.nlm.nih.gov/22745788/,Diminished medial prefrontal activity behind autistic social judgments of incongruent information.,"Watanabe T, Yahata N, Abe O, Kuwabara H, Inoue H, Takano Y, Iwashiro N, Natsubori T, Aoki Y, Takao H, Sasaki H, Gonoi W, Murakami M, Katsura M, Kunimatsu A, Kawakubo Y, Matsuzaki H, Tsuchiya KJ, Kato N, Kano Y, Miyashita Y, Kasai K, Yamasue H",PloS one,0.237,22745788,-1,-1
dmpfc_00033,https://pubmed.ncbi.nlm.nih.gov/21930137/,Neural processing associated with comprehension of an indirect reply during a scenario reading task.,"Shibata M, Abe J, Itoh H, Shimada K, Umeda S",Neuropsychologia,0.235,21930137,-1,-1
dmpfc_00034,https://pubmed.ncbi.nlm.nih.gov/20820793/,Localized gray matter volume abnormalities in generalized anxiety disorder.,"Schienle A, Ebner F, Schafer A",European archives of psychiatry and clinical neuroscience,0.232,20820793,-1,-1
dmpfc_00035,https://pubmed.ncbi.nlm.nih.gov/25820129/,How the brain predicts people's behavior in relation to rules and desires. Evidence of a medio-prefrontal dissociation.,"Corradi-Dell'Acqua C, Turri F, Kaufmann L, Clement F, Schwartz S",Cortex; a journal devoted to the study of the nervous system and behavior,0.229,25820129,-1,-1
dmpfc_00036,https://pubmed.ncbi.nlm.nih.gov/27699680/,Lateral and medial prefrontal contributions to emotion generation by semantic elaboration during episodic encoding.,"Kaneda T, Shigemune Y, Tsukiura T","Cognitive, affective & behavioral neuroscience",0.226,27699680,-1,-1
dmpfc_00037,https://pubmed.ncbi.nlm.nih.gov/19683585/,Neuroticism modulates amygdala-prefrontal connectivity in response to negative emotional facial expressions.,"Cremers HR, Demenescu LR, Aleman A, Renken R, van Tol MJ, van der Wee NJ, Veltman DJ, Roelofs K",NeuroImage,0.214,19683585,-1,-1
dmpfc_00038,https://pubmed.ncbi.nlm.nih.gov/28527316/,Effects of contextual relevance on pragmatic inference during conversation: An fMRI study.,"Feng W, Wu Y, Jan C, Yu H, Jiang X, Zhou X",Brain and language,0.203,28527316,-1,-1
dmpfc_00039,https://pubmed.ncbi.nlm.nih.gov/22505330/,Atypical brain activation patterns during a face-to-face joint attention game in  adults with autism spectrum disorder.,"Redcay E, Dodell-Feder D, Mavros PL, Kleiner M, Pearrow MJ, Triantafyllou C, Gabrieli JD, Saxe R",Human brain mapping,0.202,22505330,-1,-1
dmpfc_00040,https://pubmed.ncbi.nlm.nih.gov/27007121/,Contributions of self-report and performance-based individual differences measures of social cognitive ability to large-scale neural network functioning.,"Smith R, Alkozei A, Killgore WDS",Brain imaging and behavior,0.202,27007121,-1,-1
dmpfc_00041,https://pubmed.ncbi.nlm.nih.gov/22289808/,Social status modulates neural activity in the mentalizing network.,"Muscatell KA, Morelli SA, Falk EB, Way BM, Pfeifer JH, Galinsky AD, Lieberman MD, Dapretto M, Eisenberger NI",NeuroImage,0.195,22289808,-1,-1
dmpfc_00042,https://pubmed.ncbi.nlm.nih.gov/25416726/,Mapping the relationship between subgenual cingulate cortex functional connectivity and depressive symptoms across adolescence.,"Strikwerda-Brown C, Davey CG, Whittle S, Allen NB, Byrne ML, Schwartz OS, Simmons JG, Dwyer D, Harrison BJ",Social cognitive and affective neuroscience,0.195,25416726,-1,-1
dmpfc_00043,https://pubmed.ncbi.nlm.nih.gov/22089142/,Socially excluded individuals fail to recruit medial prefrontal cortex for negative social scenes.,"Powers KE, Wagner DD, Norris CJ, Heatherton TF",Social cognitive and affective neuroscience,0.187,22089142,-1,-1
dmpfc_00044,https://pubmed.ncbi.nlm.nih.gov/25315788/,Social gating of sensory information during ongoing communication.,"Anders S, Heussen Y, Sprenger A, Haynes JD, Ethofer T",NeuroImage,0.185,25315788,-1,-1
dmpfc_00045,https://pubmed.ncbi.nlm.nih.gov/21296864/,Emotional and cognitive stimuli differentially engage the default network during  inductive reasoning.,"Eldaief MC, Deckersbach T, Carlson LE, Beucke JC, Dougherty DD",Social cognitive and affective neuroscience,0.184,21296864,-1,-1
dmpfc_00046,https://pubmed.ncbi.nlm.nih.gov/22666409/,Gender differences of brain activity in the conflicts based on implicit self-esteem.,"Miyamoto R, Kikuchi Y",PloS one,0.184,22666409,-1,-1
dmpfc_00047,https://pubmed.ncbi.nlm.nih.gov/22956676/,Compassion meditation enhances empathic accuracy and related neural activity.,"Mascaro JS, Rilling JK, Tenzin Negi L, Raison CL",Social cognitive and affective neuroscience,0.184,22956676,-1,-1
dmpfc_00048,https://pubmed.ncbi.nlm.nih.gov/23658538/,"The role of automaticity and attention in neural processes underlying empathy for happiness, sadness, and anxiety.","Morelli SA, Lieberman MD",Frontiers in human neuroscience,0.18,23658538,-1,-1
dmpfc_00049,https://pubmed.ncbi.nlm.nih.gov/29117910/,Increased resting-state global functional connectivity density of default mode network in schizophrenia subjects treated with electroconvulsive therapy.,"Huang H, Jiang Y, Xia M, Tang Y, Zhang T, Cui H, Wang J, Li Y, Xu L, Curtin A, Sheng J, Jia Y, Yao D, Li C, Luo C, Wang J",Schizophrenia research,0.18,29117910,-1,-1
dmpfc_00050,https://pubmed.ncbi.nlm.nih.gov/28895092/,Neural response to evaluating depression predicts perceivers' mental health treatment recommendations.,"Krendl AC, Cassidy BS","Cognitive, affective & behavioral neuroscience",0.175,28895092,-1,-1
dmpfc_00051,https://pubmed.ncbi.nlm.nih.gov/21412409/,Are risky choices actually guided by a compensatory process? New insights from FMRI.,"Rao LL, Zhou Y, Xu L, Liang ZY, Jiang T, Li S",PloS one,0.174,21412409,-1,-1
dmpfc_00052,https://pubmed.ncbi.nlm.nih.gov/25950551/,Specific default mode subnetworks support mentalizing as revealed through opposing network recruitment by social and semantic FMRI tasks.,"Hyatt CJ, Calhoun VD, Pearlson GD, Assaf M",Human brain mapping,0.169,25950551,-1,-1
dmpfc_00053,https://pubmed.ncbi.nlm.nih.gov/19462002/,Unstable prefrontal response to emotional conflict and activation of lower limbic structures and brainstem in remitted panic disorder.,"Chechko N, Wehrle R, Erhardt A, Holsboer F, Czisch M, Samann PG",PloS one,0.168,19462002,-1,-1
dmpfc_00054,https://pubmed.ncbi.nlm.nih.gov/26455808/,Altered processing of self-related emotional stimuli in mindfulness meditators.,"Lutz J, Bruhl AB, Doerig N, Scheerer H, Achermann R, Weibel A, Jancke L, Herwig U",NeuroImage,0.166,26455808,-1,-1
dmpfc_00055,https://pubmed.ncbi.nlm.nih.gov/26435254/,Habitual suppression relates to difficulty in regulating emotion with cognitive reappraisal.,"Che X, Luo X, Tong D, Fitzgibbon BM, Yang J",Biological psychology,0.163,26435254,-1,-1
dmpfc_00056,https://pubmed.ncbi.nlm.nih.gov/25111474/,Threat-related learning relies on distinct dorsal prefrontal cortex network connectivity.,"Wheelock MD, Sreenivasan KR, Wood KH, Ver Hoef LW, Deshpande G, Knight DC",NeuroImage,0.159,25111474,-1,-1
dmpfc_00057,https://pubmed.ncbi.nlm.nih.gov/21151779/,The influence of rest period instructions on the default mode network.,"Benjamin C, Lieberman DA, Chang M, Ofen N, Whitfield-Gabrieli S, Gabrieli JD, Gaab N",Frontiers in human neuroscience,0.158,21151779,-1,-1
dmpfc_00058,https://pubmed.ncbi.nlm.nih.gov/27881788/,Brain Network Mechanisms Underlying Motor Enhancement by Transcranial Entrainment of Gamma Oscillations.,"Moisa M, Polania R, Grueschow M, Ruff CC",The Journal of neuroscience : the official journal of the Society for Neuroscience,0.157,27881788,-1,-1
dmpfc_00059,https://pubmed.ncbi.nlm.nih.gov/28588469/,Oxytocin Increases the Perceived Value of Both Self- and Other-Owned Items and Alters Medial Prefrontal Cortex Activity in an Endowment Task.,"Zhao W, Geng Y, Luo L, Zhao Z, Ma X, Xu L, Yao S, Kendrick KM",Frontiers in human neuroscience,0.156,28588469,-1,-1
dmpfc_00060,https://pubmed.ncbi.nlm.nih.gov/22490923/,The neural dynamics of updating person impressions.,"Mende-Siedlecki P, Cai Y, Todorov A",Social cognitive and affective neuroscience,0.148,22490923,-1,-1
dmpfc_00061,https://pubmed.ncbi.nlm.nih.gov/22737112/,Look at this: the neural correlates of initiating and responding to bids for joint attention.,"Redcay E, Kleiner M, Saxe R",Frontiers in human neuroscience,0.144,22737112,10.3389/fnhum.2012.00169,-1
dmpfc_00062,https://pubmed.ncbi.nlm.nih.gov/22440646/,Brain activation during anticipation of interoceptive threat.,"Holtz K, Pane-Farre CA, Wendt J, Lotze M, Hamm AO",NeuroImage,0.143,22440646,10.1016/j.neuroimage.2012.03.019,-1
dmpfc_00063,https://pubmed.ncbi.nlm.nih.gov/19117277/,Increased self-focus in major depressive disorder is related to neural abnormalities in subcortical-cortical midline structures.,"Grimm S, Ernst J, Boesiger P, Schuepbach D, Hell D, Boeker H, Northoff G",Human brain mapping,0.141,19117277,-1,-1
dmpfc_00064,https://pubmed.ncbi.nlm.nih.gov/25913702/,The ties that bind: Group membership shapes the neural correlates of in-group favoritism.,"Telzer EH, Ichien N, Qu Y",NeuroImage,0.137,25913702,-1,-1
dmpfc_00065,https://pubmed.ncbi.nlm.nih.gov/27498369/,Neural correlates of envy: Regional homogeneity of resting-state brain activity predicts dispositional envy.,"Xiang Y, Kong F, Wen X, Wu Q, Mo L",NeuroImage,0.134,27498369,-1,-1
dmpfc_00066,https://pubmed.ncbi.nlm.nih.gov/25460498/,Initial and sustained brain responses to contextual conditioned anxiety in humans.,"Andreatta M, Glotzbach-Schoon E, Muhlberger A, Schulz SM, Wiemer J, Pauli P",Cortex; a journal devoted to the study of the nervous system and behavior,0.126,25460498,-1,-1
dmpfc_00067,https://pubmed.ncbi.nlm.nih.gov/27685784/,Intrusive Memories of Distressing Information: An fMRI Study.,"Battaglini E, Liddell B, Das P, Malhi G, Felmingham K, Bryant RA",PloS one,0.12,27685784,-1,-1
dmpfc_00068,https://pubmed.ncbi.nlm.nih.gov/23868896/,Disgust regulation via placebo: an fMRI study.,"Schienle A, Ubel S, Schongassner F, Ille R, Scharmuller W",Social cognitive and affective neuroscience,0.117,23868896,-1,-1
dmpfc_00069,https://pubmed.ncbi.nlm.nih.gov/24647937/,"The Good, the bad, and the just: justice sensitivity predicts neural response during moral evaluation of actions performed by others.","Yoder KJ, Decety J",The Journal of neuroscience : the official journal of the Society for Neuroscience,0.117,24647937,-1,-1
dmpfc_00070,https://pubmed.ncbi.nlm.nih.gov/21674692/,Engagement of amygdala in third-person view of face-to-face interaction.,"Kujala MV, Carlson S, Hari R",Human brain mapping,0.114,21674692,-1,-1
dmpfc_00071,https://pubmed.ncbi.nlm.nih.gov/24760033/,Left and right amygdala - mediofrontal cortical functional connectivity is differentially modulated by harm avoidance.,"Baeken C, Marinazzo D, Van Schuerbeek P, Wu GR, De Mey J, Luypaert R, De Raedt R",PloS one,0.112,24760033,-1,-1
dmpfc_00072,https://pubmed.ncbi.nlm.nih.gov/26231122/,Reduced neural differentiation between self-referential cognitive and emotional processes in women with borderline personality disorder.,"Scherpiet S, Herwig U, Opialla S, Scheerer H, Habermeyer V, Jancke L, Bruhl AB",Psychiatry research,0.112,26231122,-1,-1
dmpfc_00073,https://pubmed.ncbi.nlm.nih.gov/16230029/,Segregated neural representation of distinct emotion dimensions in the prefrontal cortex-an fMRI study.,"Grimm S, Schmidt CF, Bermpohl F, Heinzel A, Dahlem Y, Wyss M, Hell D, Boesiger P, Boeker H, Northoff G",NeuroImage,0.111,16230029,-1,-1
dmpfc_00074,https://pubmed.ncbi.nlm.nih.gov/25468173/,Resting-state functional connectivity alterations in the default network of schizophrenia patients with persistent auditory verbal hallucinations.,"Alonso-Solis A, Vives-Gilabert Y, Grasa E, Portella MJ, Rabella M, Sauras RB, Roldan A, Nunez-Marin F, Gomez-Anson B, Perez V, Alvarez E, Corripio I",Schizophrenia research,0.111,25468173,-1,-1
dmpfc_00075,https://pubmed.ncbi.nlm.nih.gov/19107465/,24-h smoking abstinence potentiates fMRI-BOLD activation to smoking cues in cerebral cortex and dorsal striatum.,"McClernon FJ, Kozink RV, Lutz AM, Rose JE",Psychopharmacology,0.109,19107465,-1,-1
dmpfc_00076,https://pubmed.ncbi.nlm.nih.gov/24309159/,Working memory in middle-aged males: age-related brain activation changes and cognitive fatigue effects.,"Klaassen EB, Evers EA, de Groot RH, Backes WH, Veltman DJ, Jolles J",Biological psychology,0.106,24309159,-1,-1
dmpfc_00077,https://pubmed.ncbi.nlm.nih.gov/23720575/,Reward-related neural responses are dependent on the beneficiary.,"Braams BR, Guroglu B, de Water E, Meuwese R, Koolschijn PC, Peper JS, Crone EA",Social cognitive and affective neuroscience,0.105,23720575,-1,-1
dmpfc_00078,https://pubmed.ncbi.nlm.nih.gov/16081255/,How do we modulate our emotions? Parametric fMRI reveals cortical midline structures as regions specifically involved in the processing of emotional valences.,"Heinzel A, Bermpohl F, Niese R, Pfennig A, Pascual-Leone A, Schlaug G, Northoff G",Brain research. Cognitive brain research,0.102,16081255,-1,-1
dmpfc_00079,https://pubmed.ncbi.nlm.nih.gov/23706416/,Schizophrenia and the brain's control network: aberrant within- and between-network connectivity of the frontoparietal network in schizophrenia.,"Tu PC, Lee YC, Chen YS, Li CT, Su TP",Schizophrenia research,0.1,23706416,-1,-1
dmpfc_00080,https://pubmed.ncbi.nlm.nih.gov/20702070/,The role of hippocampus dysfunction in deficient memory encoding and positive symptoms in schizophrenia.,"Zierhut K, Bogerts B, Schott B, Fenker D, Walter M, Albrecht D, Steiner J, Schutze H, Northoff G, Duzel E, Schiltz K",Psychiatry research,0.097,20702070,-1,-1
dmpfc_00081,https://pubmed.ncbi.nlm.nih.gov/23819895/,Self-reflection and positive schizotypy in the adolescent brain.,"Debbane M, Vrticka P, Lazouret M, Badoud D, Sander D, Eliez S",Schizophrenia research,0.097,23819895,10.1016/j.schres.2013.06.027,-1
dmpfc_00082,https://pubmed.ncbi.nlm.nih.gov/29184490/,Attractiveness Modulates Neural Processing of Infant Faces Differently in Males and Females.,"Yin L, Fan M, Lin L, Sun D, Wang Z",Frontiers in human neuroscience,0.097,29184490,10.3389/fnhum.2017.00551,-1
dmpfc_00083,https://pubmed.ncbi.nlm.nih.gov/21345342/,Effects of emotion regulation strategy on brain responses to the valence and social content of visual scenes.,"Vrticka P, Sander D, Vuilleumier P",Neuropsychologia,0.096,21345342,10.1016/j.neuropsychologia.2011.02.020,-1
dmpfc_00084,https://pubmed.ncbi.nlm.nih.gov/22355182/,Empathy for the social suffering of friends and strangers recruits distinct patterns of brain activation.,"Meyer ML, Masten CL, Ma Y, Wang C, Shi Z, Eisenberger NI, Han S",Social cognitive and affective neuroscience,0.096,22355182,-1,-1
dmpfc_00085,https://pubmed.ncbi.nlm.nih.gov/27263508/,"Predictability of what or where reduces brain activity, but a bottleneck occurs when both are predictable.","Davis B, Hasson U",NeuroImage,0.096,27263508,-1,-1
dmpfc_00086,https://pubmed.ncbi.nlm.nih.gov/28032303/,"Neural circuitry of emotion regulation: Effects of appraisal, attention, and cortisol administration.","Ma ST, Abelson JL, Okada G, Taylor SF, Liberzon I","Cognitive, affective & behavioral neuroscience",0.094,28032303,-1,-1
dmpfc_00087,https://pubmed.ncbi.nlm.nih.gov/26001666/,The effect of body-mind relaxation meditation induction on major depressive disorder: A resting-state fMRI study.,"Chen F, Lv X, Fang J, Yu S, Sui J, Fan L, Li T, Hong Y, Wang X, Wang W, Jiang T",Journal of affective disorders,0.093,26001666,-1,-1
dmpfc_00088,https://pubmed.ncbi.nlm.nih.gov/27445112/,The transition from childhood to adolescence is marked by a general decrease in amygdala reactivity and an affect-specific ventral-to-dorsal shift in medial prefrontal recruitment.,"Silvers JA, Insel C, Powers A, Franz P, Helion C, Martin R, Weber J, Mischel W, Casey BJ, Ochsner KN",Developmental cognitive neuroscience,0.093,27445112,-1,-1
dmpfc_00089,https://pubmed.ncbi.nlm.nih.gov/28474292/,Brain activation upon ideal-body media exposure and peer feedback in late adolescent girls.,"van der Meulen M, Veldhuis J, Braams BR, Peters S, Konijn EA, Crone EA","Cognitive, affective & behavioral neuroscience",0.093,28474292,-1,-1
dmpfc_00090,https://pubmed.ncbi.nlm.nih.gov/23874543/,Identifying neural patterns of functional dyspepsia using multivariate pattern analysis: a resting-state FMRI study.,"Liu P, Qin W, Wang J, Zeng F, Zhou G, Wen H, von Deneen KM, Liang F, Gong Q, Tian J",PloS one,0.09,23874543,-1,-1
dmpfc_00091,https://pubmed.ncbi.nlm.nih.gov/26197051/,Abnormal Social Reward Responses in Anorexia Nervosa: An fMRI Study.,"Via E, Soriano-Mas C, Sanchez I, Forcano L, Harrison BJ, Davey CG, Pujol J, Martinez-Zalacain I, Menchon JM, Fernandez-Aranda F, Cardoner N",PloS one,0.088,26197051,-1,-1
dmpfc_00092,https://pubmed.ncbi.nlm.nih.gov/28263829/,Depression alters maternal extended amygdala response and functional connectivity during distress signals in attachment relationship.,"Ho SS, Swain JE",Behavioural brain research,0.088,28263829,-1,-1
dmpfc_00093,https://pubmed.ncbi.nlm.nih.gov/22156722/,Increased anterior cingulate cortex and hippocampus activation in Complex PTSD during encoding of negative words.,"Thomaes K, Dorrepaal E, Draijer N, de Ruiter MB, Elzinga BM, Sjoerds Z, van Balkom AJ, Smit JH, Veltman DJ",Social cognitive and affective neuroscience,0.087,22156722,-1,-1
dmpfc_00094,https://pubmed.ncbi.nlm.nih.gov/26406464/,Brain Correlates of Self-Evaluation Deficits in Schizophrenia: A Combined Functional and Structural MRI Study.,"Tan S, Zhao Y, Fan F, Zou Y, Jin Z, Zen Y, Zhu X, Yang F, Tan Y, Zhou D",PloS one,0.086,26406464,-1,-1
