paper_name,paper_url,Title,Author,Journal,Loading,PMID,Doi,download_status
dmpfc_00095,https://pubmed.ncbi.nlm.nih.gov/24646887/,Neural activation associated with the cognitive emotion regulation of sadness in  healthy children.,"Belden AC, Luby JL, Pagliaccio D, Barch DM",Developmental cognitive neuroscience,0.084,24646887,-1,-1
dmpfc_00096,https://pubmed.ncbi.nlm.nih.gov/24146643/,Avoidant symptoms in PTSD predict fear circuit activation during multimodal fear  extinction.,"Sripada RK, Garfinkel SN, Liberzon I",Frontiers in human neuroscience,0.083,24146643,-1,-1
dmpfc_00097,https://pubmed.ncbi.nlm.nih.gov/19957266/,Nonlinear relationship between emotional valence and brain activity: evidence of  separate negative and positive valence dimensions.,"Viinikainen M, Jaaskelainen IP, Alexandrov Y, Balk MH, Autti T, Sams M",Human brain mapping,0.082,19957266,-1,-1
dmpfc_00098,https://pubmed.ncbi.nlm.nih.gov/19507157/,Neurocognitive processes of the religious leader in Christians.,"Ge J, Gu X, Ji M, Han S",Human brain mapping,0.079,19507157,-1,-1
dmpfc_00099,https://pubmed.ncbi.nlm.nih.gov/26654933/,Interaction among subsystems within default mode network diminished in schizophrenia patients: A dynamic connectivity approach.,"Du Y, Pearlson GD, Yu Q, He H, Lin D, Sui J, Wu L, Calhoun VD",Schizophrenia research,0.079,26654933,-1,-1
dmpfc_00100,https://pubmed.ncbi.nlm.nih.gov/28594841/,Probabilistic Entity-Relationship Diagram: A correlation between functional connectivity and spontaneous brain activity during resting state in major depressive disorder.,"Zhang L, Shi L, Zhang B, Zhao L, Dong Y, Liu J, Lian Z, Liang L, Chen W, Luo X, Pei S, Mo X, Huang W, Ouyang F, Guo B, Liang C, Zhang S",PloS one,0.076,28594841,-1,-1
dmpfc_00101,https://pubmed.ncbi.nlm.nih.gov/24603024/,Bad and worse: neural systems underlying reappraisal of high- and low-intensity negative emotions.,"Silvers JA, Weber J, Wager TD, Ochsner KN",Social cognitive and affective neuroscience,0.075,24603024,10.1093/scan/nsu043,-1
dmpfc_00102,https://pubmed.ncbi.nlm.nih.gov/28611616/,Differential Functional Connectivity Alterations of Two Subdivisions within the Right dlPFC in Parkinson's Disease.,"Caspers J, Mathys C, Hoffstaedter F, Sudmeyer M, Cieslik EC, Rubbert C, Hartmann CJ, Eickhoff CR, Reetz K, Grefkes C, Michely J, Turowski B, Schnitzler A, Eickhoff SB",Frontiers in human neuroscience,0.075,28611616,10.3389/fnhum.2017.00288,-1
dmpfc_00103,https://pubmed.ncbi.nlm.nih.gov/27313526/,Time-Perception Network and Default Mode Network Are Associated with Temporal Prediction in a Periodic Motion Task.,"Carvalho FM, Chaim KT, Sanchez TA, de Araujo DB",Frontiers in human neuroscience,0.074,27313526,10.3389/fnhum.2016.00268,-1
dmpfc_00104,https://pubmed.ncbi.nlm.nih.gov/28759780/,"Neural correlates of evaluating self and close-other in physical, academic and prosocial domains.","van der Cruijsen R, Peters S, Crone EA",Brain and cognition,0.074,28759780,-1,-1
dmpfc_00105,https://pubmed.ncbi.nlm.nih.gov/23567883/,Dissociable roles of ventromedial prefrontal cortex (vmPFC) and rostral anterior  cingulate cortex (rACC) in value representation and optimistic bias.,"Blair KS, Otero M, Teng C, Jacobs M, Odenheimer S, Pine DS, Blair RJ",NeuroImage,0.073,23567883,-1,-1
dmpfc_00106,https://pubmed.ncbi.nlm.nih.gov/26001663/,"Aberrant connectivity within the default mode network in first-episode, treatment-naive major depressive disorder.","Chen Y, Wang C, Zhu X, Tan Y, Zhong Y",Journal of affective disorders,0.073,26001663,-1,-1
dmpfc_00107,https://pubmed.ncbi.nlm.nih.gov/29337278/,Effects of hunger state on the brain responses to food cues across the life span.,"Charbonnier L, van Meer F, Johnstone AM, Crabtree D, Buosi W, Manios Y, Androutsos O, Giannopoulou A, Viergever MA, Smeets PAM",NeuroImage,0.072,29337278,-1,-1
dmpfc_00108,https://pubmed.ncbi.nlm.nih.gov/27766076/,Brain Changes in Responders vs. Non-Responders in Chronic Migraine: Markers of Disease Reversal.,"Hubbard CS, Becerra L, Smith JH, DeLange JM, Smith RM, Black DF, Welker KM, Burstein R, Cutrer FM, Borsook D",Frontiers in human neuroscience,0.07,27766076,-1,-1
dmpfc_00109,https://pubmed.ncbi.nlm.nih.gov/27881783/,Multivariate Brain Prediction of Heart Rate and Skin Conductance Responses to Social Threat.,"Eisenbarth H, Chang LJ, Wager TD",The Journal of neuroscience : the official journal of the Society for Neuroscience,0.068,27881783,-1,-1
dmpfc_00110,https://pubmed.ncbi.nlm.nih.gov/27771857/,Brain alterations in low-frequency fluctuations across multiple bands in obsessive compulsive disorder.,"Gimenez M, Guinea-Izquierdo A, Villalta-Gil V, Martinez-Zalacain I, Segalas C, Subira M, Real E, Pujol J, Harrison BJ, Haro JM, Sato JR, Hoexter MQ, Cardoner N, Alonso P, Menchon JM, Soriano-Mas C",Brain imaging and behavior,0.065,27771857,-1,-1
dmpfc_00111,https://pubmed.ncbi.nlm.nih.gov/20678489/,Modulation of the cortical false belief network during development.,"Sommer M, Meinhardt J, Eichenmuller K, Sodian B, Dohnel K, Hajak G",Brain research,0.053,20678489,-1,-1
dmpfc_00112,https://pubmed.ncbi.nlm.nih.gov/25913061/,Recognition of personally familiar faces and functional connectivity in Alzheimer's disease.,"Kurth S, Moyse E, Bahri MA, Salmon E, Bastin C",Cortex; a journal devoted to the study of the nervous system and behavior,0.051,25913061,-1,-1
