paper_name,paper_url,Title,Author,Journal,Loading,PMID,Doi,download_status
dominance_00001,https://pubmed.ncbi.nlm.nih.gov/20300635/,Cerebral asymmetries: complementary and independent processes.,"Badzakova-Trajkov G, Haberling IS, Roberts RP, Corballis MC",PloS one,0.589,20300635,10.1371/journal.pone.0009682,-1
dominance_00002,https://pubmed.ncbi.nlm.nih.gov/12725767/,How atypical is atypical language dominance?,"Knecht S, Jansen A, Frank A, van Randenborgh J, Sommer J, Kanowski M, Heinze HJ",NeuroImage,0.54,12725767,10.1016/s1053-8119(03)00039-9,-1
dominance_00003,https://pubmed.ncbi.nlm.nih.gov/22784275/,The corpus callosum in monozygotic twins concordant and discordant for handedness and language dominance.,"Haberling IS, Badzakova-Trajkov G, Corballis MC",Journal of cognitive neuroscience,0.398,22784275,-1,-1
dominance_00004,https://pubmed.ncbi.nlm.nih.gov/20600189/,Cerebral asymmetries in monozygotic twins: an fMRI study.,"Badzakova-Trajkov G, Haberling IS, Corballis MC",Neuropsychologia,0.33,20600189,-1,-1
dominance_00005,https://pubmed.ncbi.nlm.nih.gov/12902399/,Dominance for vestibular cortical function in the non-dominant hemisphere.,"Dieterich M, Bense S, Lutz S, Drzezga A, Stephan T, Bartenstein P, Brandt T","Cerebral cortex (New York, N.Y. : 1991)",0.327,12902399,-1,-1
dominance_00006,https://pubmed.ncbi.nlm.nih.gov/25463814/,Effects of representational distance between meanings on the neural correlates of semantic ambiguity.,"Grindrod CM, Garnett EO, Malyutina S, den Ouden DB",Brain and language,0.324,25463814,-1,-1
dominance_00007,https://pubmed.ncbi.nlm.nih.gov/26302674/,Inter-individual differences in the experience of negative emotion predict variations in functional brain architecture.,"Petrican R, Saverino C, Shayna Rosenbaum R, Grady C",NeuroImage,0.316,26302674,-1,-1
dominance_00008,https://pubmed.ncbi.nlm.nih.gov/23935850/,Affect and the brain's functional organization: a resting-state connectivity approach.,"Rohr CS, Okon-Singer H, Craddock RC, Villringer A, Margulies DS",PloS one,0.305,23935850,-1,-1
dominance_00009,https://pubmed.ncbi.nlm.nih.gov/19710382/,Functional asymmetries revealed in visually guided saccades: an FMRI study.,"Petit L, Zago L, Vigneau M, Andersson F, Crivello F, Mazoyer B, Mellet E, Tzourio-Mazoyer N",Journal of neurophysiology,0.272,19710382,-1,-1
dominance_00010,https://pubmed.ncbi.nlm.nih.gov/18644454/,Neural correlates of hemispheric dominance and ipsilaterality within the vestibular system.,"Janzen J, Schlindwein P, Bense S, Bauermann T, Vucurevic G, Stoeter P, Dieterich M",NeuroImage,0.258,18644454,-1,-1
dominance_00011,https://pubmed.ncbi.nlm.nih.gov/19015083/,Exploring the motivational brain: effects of implicit power motivation on brain activation in response to facial expressions of emotion.,"Schultheiss OC, Wirth MM, Waugh CE, Stanton SJ, Meier EA, Reuter-Lorenz P",Social cognitive and affective neuroscience,0.248,19015083,-1,-1
dominance_00012,https://pubmed.ncbi.nlm.nih.gov/22210673/,Emotion disrupts neural activity during selective attention in psychopathy.,"Sadeh N, Spielberg JM, Heller W, Herrington JD, Engels AS, Warren SL, Crocker LD, Sutton BP, Miller GA",Social cognitive and affective neuroscience,0.245,22210673,-1,-1
dominance_00013,https://pubmed.ncbi.nlm.nih.gov/21709178/,Interhemispheric differences in auditory processing revealed by fMRI in awake rhesus monkeys.,"Joly O, Ramus F, Pressnitzer D, Vanduffel W, Orban GA","Cerebral cortex (New York, N.Y. : 1991)",0.244,21709178,-1,-1
dominance_00014,https://pubmed.ncbi.nlm.nih.gov/28069542/,Hemispheric asymmetries in the transition from action preparation to execution.,"Sulpizio V, Lucci G, Berchicci M, Galati G, Pitzalis S, Di Russo F",NeuroImage,0.244,28069542,-1,-1
dominance_00015,https://pubmed.ncbi.nlm.nih.gov/23297206/,Complementary hemispheric specialization for language production and visuospatial attention.,"Cai Q, Van der Haegen L, Brysbaert M",Proceedings of the National Academy of Sciences of the United States of America,0.242,23297206,-1,-1
dominance_00016,https://pubmed.ncbi.nlm.nih.gov/26205825/,The impact of eye closure on somatosensory perception in the elderly.,"Brodoehl S, Klingner C, Stieglitz K, Witte OW",Behavioural brain research,0.217,26205825,-1,-1
dominance_00017,https://pubmed.ncbi.nlm.nih.gov/15385595/,Dominance of the right hemisphere and role of area 2 in human kinesthesia.,"Naito E, Roland PE, Grefkes C, Choi HJ, Eickhoff S, Geyer S, Zilles K, Ehrsson HH",Journal of neurophysiology,0.213,15385595,-1,-1
dominance_00018,https://pubmed.ncbi.nlm.nih.gov/21112404/,The neural basis of visual dominance in the context of audio-visual object processing.,"Schmid C, Buchel C, Rose M",NeuroImage,0.212,21112404,-1,-1
dominance_00019,https://pubmed.ncbi.nlm.nih.gov/25955655/,Cerebral activations related to writing and drawing with each hand.,"Potgieser AR, van der Hoorn A, de Jong BM",PloS one,0.206,25955655,-1,-1
dominance_00020,https://pubmed.ncbi.nlm.nih.gov/21554968/,Handedness-dependent and -independent cerebral asymmetries in the anterior intraparietal sulcus and ventral premotor cortex during grasp planning.,"Martin K, Jacobs S, Frey SH",NeuroImage,0.205,21554968,-1,-1
dominance_00021,https://pubmed.ncbi.nlm.nih.gov/21896497/,The balance between feeling and knowing: affective and cognitive empathy are reflected in the brain's intrinsic functional dynamics.,"Cox CL, Uddin LQ, Di Martino A, Castellanos FX, Milham MP, Kelly C",Social cognitive and affective neuroscience,0.205,21896497,10.1093/scan/nsr051,-1
dominance_00022,https://pubmed.ncbi.nlm.nih.gov/25180581/,Neural correlates of gender differences in reputation building.,"Garbarini F, Boero R, D'Agata F, Bravo G, Mosso C, Cauda F, Duca S, Geminiani G, Sacco K",PloS one,0.203,25180581,10.1371/journal.pone.0106285,-1
dominance_00023,https://pubmed.ncbi.nlm.nih.gov/22516367/,Cerebral integration of verbal and nonverbal emotional cues: impact of individual nonverbal dominance.,"Jacob H, Kreifelts B, Bruck C, Erb M, Hosl F, Wildgruber D",NeuroImage,0.201,22516367,-1,-1
dominance_00024,https://pubmed.ncbi.nlm.nih.gov/12850560/,Robust localization and lateralization of human language function: an optimized clinical functional magnetic resonance imaging protocol.,"Stippich C, Mohammed J, Kress B, Hahnel S, Gunther J, Konrad F, Sartor K",Neuroscience letters,0.199,12850560,-1,-1
dominance_00025,https://pubmed.ncbi.nlm.nih.gov/15728651/,Sign and speech: amodal commonality in left hemisphere dominance for comprehension of sentences.,"Sakai KL, Tatsuno Y, Suzuki K, Kimura H, Ichida Y",Brain : a journal of neurology,0.197,15728651,-1,-1
dominance_00026,https://pubmed.ncbi.nlm.nih.gov/25044884/,Evoked effective connectivity of the human neocortex.,"Entz L, Toth E, Keller CJ, Bickel S, Groppe DM, Fabo D, Kozak LR, Eross L, Ulbert I, Mehta AD",Human brain mapping,0.193,25044884,-1,-1
dominance_00027,https://pubmed.ncbi.nlm.nih.gov/29656269/,Task-positive and task-negative networks in major depressive disorder: A combined fMRI and EEG study.,"Knyazev GG, Savostyanov AN, Bocharov AV, Brak IV, Osipov EA, Filimonova EA, Saprigyn AE, Aftanas LI",Journal of affective disorders,0.191,29656269,-1,-1
dominance_00028,https://pubmed.ncbi.nlm.nih.gov/21391251/,Embodied visual perception of distorted finger postures.,"Schurmann M, Hlushchuk Y, Hari R",Human brain mapping,0.185,21391251,-1,-1
dominance_00029,https://pubmed.ncbi.nlm.nih.gov/25985078/,Cerebral Asymmetry of fMRI-BOLD Responses to Visual Stimulation.,"Hougaard A, Jensen BH, Amin FM, Rostrup E, Hoffmann MB, Ashina M",PloS one,0.179,25985078,-1,-1
dominance_00030,https://pubmed.ncbi.nlm.nih.gov/16080162/,Direction-dependent visual cortex activation during horizontal optokinetic stimulation (fMRI study).,"Bense S, Janusch B, Schlindwein P, Bauermann T, Vucurevic G, Brandt T, Stoeter P, Dieterich M",Human brain mapping,0.177,16080162,-1,-1
dominance_00031,https://pubmed.ncbi.nlm.nih.gov/21147233/,Right parietal dominance in spatial egocentric discrimination.,"Loayza FR, Fernandez-Seara MA, Aznarez-Sanado M, Pastor MA",NeuroImage,0.174,21147233,-1,-1
dominance_00032,https://pubmed.ncbi.nlm.nih.gov/16343948/,"Controlling for individual differences in fMRI brain activation to tones, syllables, and words.","Rimol LM, Specht K, Hugdahl K",NeuroImage,0.172,16343948,-1,-1
dominance_00033,https://pubmed.ncbi.nlm.nih.gov/19199416/,Beyond hemispheric dominance: brain regions underlying the joint lateralization of language and arithmetic to the left hemisphere.,"Pinel P, Dehaene S",Journal of cognitive neuroscience,0.169,19199416,-1,-1
dominance_00034,https://pubmed.ncbi.nlm.nih.gov/25187327/,Resting-state functional connectivity predicts the strength of hemispheric lateralization for language processing in temporal lobe epilepsy and normals.,"Doucet GE, Pustina D, Skidmore C, Sharan A, Sperling MR, Tracy JI",Human brain mapping,0.168,25187327,-1,-1
dominance_00035,https://pubmed.ncbi.nlm.nih.gov/20833698/,Lateralization of speech production starts in sensory cortices--a possible sensory origin of cerebral left dominance for speech.,"Kell CA, Morillon B, Kouneiher F, Giraud AL","Cerebral cortex (New York, N.Y. : 1991)",0.158,20833698,-1,-1
dominance_00036,https://pubmed.ncbi.nlm.nih.gov/25120445/,Roles of frontal and temporal regions in reinterpreting semantically ambiguous sentences.,"Vitello S, Warren JE, Devlin JT, Rodd JM",Frontiers in human neuroscience,0.158,25120445,-1,-1
dominance_00037,https://pubmed.ncbi.nlm.nih.gov/14755836/,Neural mechanisms underlying reaching for remembered targets cued kinesthetically or visually in left or right hemispace.,"Butler AJ, Fink GR, Dohle C, Wunderlich G, Tellmann L, Seitz RJ, Zilles K, Freund HJ",Human brain mapping,0.157,14755836,-1,-1
dominance_00038,https://pubmed.ncbi.nlm.nih.gov/12507726/,Parieto-frontal networks for clock drawing revealed with fMRI.,"Ino T, Asada T, Ito J, Kimura T, Fukuyama H",Neuroscience research,0.154,12507726,-1,-1
dominance_00039,https://pubmed.ncbi.nlm.nih.gov/19631717/,Can Cantonese rhymes be used in the assessment of hemispheric dominance for language?,"Chan ST, Tang SW, Lee WK, Tang KW, Lo SS, Kwong KK",Neuroscience letters,0.154,19631717,-1,-1
dominance_00040,https://pubmed.ncbi.nlm.nih.gov/26262561/,The attracting power of the gaze of politicians is modulated by the personality and ideological attitude of their voters: a functional magnetic resonance imaging study.,"Cazzato V, Liuzza MT, Caprara GV, Macaluso E, Aglioti SM",The European journal of neuroscience,0.154,26262561,-1,-1
dominance_00041,https://pubmed.ncbi.nlm.nih.gov/16116098/,Tactile form and location processing in the human brain.,"Van Boven RW, Ingeholm JE, Beauchamp MS, Bikle PC, Ungerleider LG",Proceedings of the National Academy of Sciences of the United States of America,0.148,16116098,10.1073/pnas.0505907102,-1
dominance_00042,https://pubmed.ncbi.nlm.nih.gov/18823232/,Mind your left: spatial bias in subcortical fear processing.,"Siman-Tov T, Papo D, Gadoth N, Schonberg T, Mendelsohn A, Perry D, Hendler T",Journal of cognitive neuroscience,0.145,18823232,10.1162/jocn.2009.21120,-1
dominance_00043,https://pubmed.ncbi.nlm.nih.gov/11689304/,Cortical and subcortical vestibular response to caloric stimulation detected by functional magnetic resonance imaging.,"Suzuki M, Kitano H, Ito R, Kitanishi T, Yazawa Y, Ogawa T, Shiino A, Kitajima K",Brain research. Cognitive brain research,0.141,11689304,-1,-1
dominance_00044,https://pubmed.ncbi.nlm.nih.gov/22564480/,Creativity and the brain: uncovering the neural signature of conceptual expansion.,"Abraham A, Pieritz K, Thybusch K, Rutter B, Kroger S, Schweckendiek J, Stark R, Windmann S, Hermann C",Neuropsychologia,0.138,22564480,-1,-1
dominance_00045,https://pubmed.ncbi.nlm.nih.gov/23701459/,A surface-based analysis of language lateralization and cortical asymmetry.,"Greve DN, Van der Haegen L, Cai Q, Stufflebeam S, Sabuncu MR, Fischl B, Brysbaert M",Journal of cognitive neuroscience,0.138,23701459,-1,-1
dominance_00046,https://pubmed.ncbi.nlm.nih.gov/24501360/,Hippocampal binding of novel information with dominant memory traces can support  both memory stability and change.,"Bridge DJ, Voss JL",The Journal of neuroscience : the official journal of the Society for Neuroscience,0.137,24501360,-1,-1
dominance_00047,https://pubmed.ncbi.nlm.nih.gov/14527576/,Neuroimaging evidence for cortical involvement in the preparation and in the act  of swallowing.,"Dziewas R, Soros P, Ishii R, Chau W, Henningsen H, Ringelstein EB, Knecht S, Pantev C",NeuroImage,0.134,14527576,-1,-1
dominance_00048,https://pubmed.ncbi.nlm.nih.gov/18286463/,Mapping a multidimensional emotion in response to television commercials.,"Morris JD, Klahr NJ, Shen F, Villegas J, Wright P, He G, Liu Y",Human brain mapping,0.131,18286463,-1,-1
dominance_00049,https://pubmed.ncbi.nlm.nih.gov/19540253/,Neural basis of interpersonal traits in neurodegenerative diseases.,"Sollberger M, Stanley CM, Wilson SM, Gyurak A, Beckman V, Growdon M, Jang J, Weiner MW, Miller BL, Rankin KP",Neuropsychologia,0.131,19540253,-1,-1
dominance_00050,https://pubmed.ncbi.nlm.nih.gov/22717280/,The neuronal infrastructure of speaking.,"Menenti L, Segaert K, Hagoort P",Brain and language,0.131,22717280,-1,-1
dominance_00051,https://pubmed.ncbi.nlm.nih.gov/18534991/,Regional differences in the coupling between resting cerebral blood flow and metabolism may indicate action preparedness as a default state.,"Gur RC, Ragland JD, Reivich M, Greenberg JH, Alavi A, Gur RE","Cerebral cortex (New York, N.Y. : 1991)",0.126,18534991,-1,-1
dominance_00052,https://pubmed.ncbi.nlm.nih.gov/10863028/,Hemispheric lateralization at different levels of human auditory word processing: a functional magnetic resonance imaging study.,"Zahn R, Huber W, Drews E, Erberich S, Krings T, Willmes K, Schwarz M",Neuroscience letters,0.125,10863028,-1,-1
dominance_00053,https://pubmed.ncbi.nlm.nih.gov/16169750/,Dissociation in the neural basis underlying Chinese tone and vowel production.,"Liu L, Peng D, Ding G, Jin Z, Zhang L, Li K, Chen C",NeuroImage,0.122,16169750,-1,-1
dominance_00054,https://pubmed.ncbi.nlm.nih.gov/10864232/,Hemispheric preference in visuospatial processing: a complementary approach with  fMRI and lesion studies.,"Ng VW, Eslinger PJ, Williams SC, Brammer MJ, Bullmore ET, Andrew CM, Suckling J, Morris RG, Benton AL",Human brain mapping,0.121,10864232,-1,-1
dominance_00055,https://pubmed.ncbi.nlm.nih.gov/24216407/,How reading acquisition changes children's spoken language network.,"Monzalvo K, Dehaene-Lambertz G",Brain and language,0.121,24216407,-1,-1
dominance_00056,https://pubmed.ncbi.nlm.nih.gov/27419066/,Atypical within- and between-hemisphere motor network functional connections in children with developmental coordination disorder and attention-deficit/hyperactivity disorder.,"McLeod KR, Langevin LM, Dewey D, Goodyear BG",NeuroImage. Clinical,0.12,27419066,-1,-1
dominance_00057,https://pubmed.ncbi.nlm.nih.gov/14684855/,Functional asymmetry for auditory processing in human primary auditory cortex.,"Devlin JT, Raley J, Tunbridge E, Lanary K, Floyer-Lea A, Narain C, Cohen I, Behrens T, Jezzard P, Matthews PM, Moore DR",The Journal of neuroscience : the official journal of the Society for Neuroscience,0.117,14684855,-1,-1
dominance_00058,https://pubmed.ncbi.nlm.nih.gov/15993759/,Cerebral asymmetry in children when reading Chinese characters.,"Xue G, Dong Q, Chen K, Jin Z, Chen C, Zeng Y, Reiman EM",Brain research. Cognitive brain research,0.117,15993759,-1,-1
dominance_00059,https://pubmed.ncbi.nlm.nih.gov/23872285/,Neural correlates of audiovisual speech processing in a second language.,"Barros-Loscertales A, Ventura-Campos N, Visser M, Alsius A, Pallier C, Avila Rivera C, Soto-Faraco S",Brain and language,0.117,23872285,-1,-1
dominance_00060,https://pubmed.ncbi.nlm.nih.gov/24502903/,Functional neuro-anatomy of egocentric versus allocentric space representation.,"Saj A, Cojan Y, Musel B, Honore J, Borel L, Vuilleumier P",Neurophysiologie clinique = Clinical neurophysiology,0.116,24502903,-1,-1
dominance_00061,https://pubmed.ncbi.nlm.nih.gov/11160524/,Cerebral cortical representation of automatic and volitional swallowing in humans.,"Martin RE, Goodyear BG, Gati JS, Menon RS",Journal of neurophysiology,0.113,11160524,10.1152/jn.2001.85.2.938,-1
dominance_00062,https://pubmed.ncbi.nlm.nih.gov/19171195/,Supercalifragilisticexpialidocious: how the brain learns words never heard before.,"Paulesu E, Vallar G, Berlingeri M, Signorini M, Vitali P, Burani C, Perani D, Fazio F",NeuroImage,0.112,19171195,10.1016/j.neuroimage.2008.12.043,-1
dominance_00063,https://pubmed.ncbi.nlm.nih.gov/20219998/,Right hemisphere dominance during spatial selective attention and target detection occurs outside the dorsal frontoparietal network.,"Shulman GL, Pope DL, Astafiev SV, McAvoy MP, Snyder AZ, Corbetta M",The Journal of neuroscience : the official journal of the Society for Neuroscience,0.112,20219998,10.1523/JNEUROSCI.4085-09.2010,-1
dominance_00064,https://pubmed.ncbi.nlm.nih.gov/25512040/,Brain activity dynamics in human parietal regions during spontaneous switches in  bistable perception.,"Megumi F, Bahrami B, Kanai R, Rees G",NeuroImage,0.112,25512040,-1,-1
dominance_00065,https://pubmed.ncbi.nlm.nih.gov/19684250/,The left ventral occipito-temporal response to words depends on language lateralization but not on visual familiarity.,"Cai Q, Paulignan Y, Brysbaert M, Ibarrola D, Nazir TA","Cerebral cortex (New York, N.Y. : 1991)",0.111,19684250,-1,-1
dominance_00066,https://pubmed.ncbi.nlm.nih.gov/20832483/,Process-specific prefrontal contributions to episodic encoding and retrieval of tastes: a functional NIRS study.,"Okamoto M, Wada Y, Yamaguchi Y, Kyutoku Y, Clowney L, Singh AK, Dan I",NeuroImage,0.108,20832483,-1,-1
dominance_00067,https://pubmed.ncbi.nlm.nih.gov/27096431/,The Role of the Insular Cortex in Retaliation.,"Emmerling F, Schuhmann T, Lobbestael J, Arntz A, Brugman S, Sack AT",PloS one,0.107,27096431,-1,-1
dominance_00068,https://pubmed.ncbi.nlm.nih.gov/16525049/,Dissociating arbitrary stimulus-response mapping from movement planning during preparatory period: evidence from event-related functional magnetic resonance imaging.,"Cavina-Pratesi C, Valyear KF, Culham JC, Kohler S, Obhi SS, Marzi CA, Goodale MA",The Journal of neuroscience : the official journal of the Society for Neuroscience,0.106,16525049,-1,-1
dominance_00069,https://pubmed.ncbi.nlm.nih.gov/18718872/,Network activation during bimanual movements in humans.,"Walsh RR, Small SL, Chen EE, Solodkin A",NeuroImage,0.106,18718872,-1,-1
dominance_00070,https://pubmed.ncbi.nlm.nih.gov/19224619/,A double dissociation between striate and extrastriate visual cortex for pattern  motion perception revealed using rTMS.,"Thompson B, Aaen-Stockdale C, Koski L, Hess RF",Human brain mapping,0.104,19224619,-1,-1
dominance_00071,https://pubmed.ncbi.nlm.nih.gov/21329677/,Latencies in BOLD response during visual attention processes.,"Kellermann T, Reske M, Jansen A, Satrapi P, Shah NJ, Schneider F, Habel U",Brain research,0.104,21329677,-1,-1
dominance_00072,https://pubmed.ncbi.nlm.nih.gov/28808866/,Activations in gray and white matter are modulated by uni-manual responses during within and inter-hemispheric transfer: effects of response hand and right-handedness.,"Diwadkar VA, Bellani M, Chowdury A, Savazzi S, Perlini C, Marinelli V, Zoccatelli G, Alessandrini F, Ciceri E, Rambaldelli G, Ruggieri M, Carlo Altamura A, Marzi CA, Brambilla P",Brain imaging and behavior,0.104,28808866,-1,-1
dominance_00073,https://pubmed.ncbi.nlm.nih.gov/16718654/,Volitional control of attention and brain activation in dual task performance.,"Newman SD, Keller TA, Just MA",Human brain mapping,0.102,16718654,-1,-1
dominance_00074,https://pubmed.ncbi.nlm.nih.gov/17596454/,Activity in the posterior parietal cortex mediates visual dominance over kinesthesia.,"Hagura N, Takei T, Hirose S, Aramaki Y, Matsumura M, Sadato N, Naito E",The Journal of neuroscience : the official journal of the Society for Neuroscience,0.102,17596454,-1,-1
dominance_00075,https://pubmed.ncbi.nlm.nih.gov/25636911/,Unmasking Language Lateralization in Human Brain Intrinsic Activity.,"McAvoy M, Mitra A, Coalson RS, d'Avossa G, Keidel JL, Petersen SE, Raichle ME","Cerebral cortex (New York, N.Y. : 1991)",0.102,25636911,-1,-1
dominance_00076,https://pubmed.ncbi.nlm.nih.gov/27330971/,Functional networks of motor inhibition in conversion disorder patients and feigning subjects.,"Hassa T, de Jel E, Tuescher O, Schmidt R, Schoenfeld MA",NeuroImage. Clinical,0.102,27330971,-1,-1
dominance_00077,https://pubmed.ncbi.nlm.nih.gov/10624956/,Human cortical regions involved in extracting depth from motion.,"Orban GA, Sunaert S, Todd JT, Van Hecke P, Marchal G",Neuron,0.101,10624956,-1,-1
dominance_00078,https://pubmed.ncbi.nlm.nih.gov/20051357/,Neural control of cross-language asymmetry in the bilingual brain.,"Nakamura K, Kouider S, Makuuchi M, Kuroki C, Hanajima R, Ugawa Y, Ogawa S","Cerebral cortex (New York, N.Y. : 1991)",0.101,20051357,-1,-1
dominance_00079,https://pubmed.ncbi.nlm.nih.gov/25552315/,Structural and functional connectivity mapping of the vestibular circuitry from human brainstem to cortex.,"Kirsch V, Keeser D, Hergenroeder T, Erat O, Ertl-Wagner B, Brandt T, Dieterich M",Brain structure & function,0.1,25552315,-1,-1
dominance_00080,https://pubmed.ncbi.nlm.nih.gov/21056675/,Spatio-temporal indications of sub-cortical involvement in leftward bias of spatial attention.,"Okon-Singer H, Podlipsky I, Siman-Tov T, Ben-Simon E, Zhdanov A, Neufeld MY, Hendler T",NeuroImage,0.098,21056675,-1,-1
dominance_00081,https://pubmed.ncbi.nlm.nih.gov/16219423/,An fMRI study of Chinese character reading and picture naming by native Korean speakers.,"Yoon HW, Chung JY, Kim KH, Song MS, Park HW",Neuroscience letters,0.097,16219423,10.1016/j.neulet.2005.09.027,-1
dominance_00082,https://pubmed.ncbi.nlm.nih.gov/17400477/,Abnormalities of language networks in temporal lobe epilepsy.,"Powell HW, Parker GJ, Alexander DC, Symms MR, Boulby PA, Wheeler-Kingshott CA, Barker GJ, Koepp MJ, Duncan JS",NeuroImage,0.097,17400477,10.1016/j.neuroimage.2007.02.028,-1
dominance_00083,https://pubmed.ncbi.nlm.nih.gov/23382516/,I Can't Keep Your Face and Voice Out of My Head: Neural Correlates of an Attentional Bias Toward Nonverbal Emotional Cues.,"Jacob H, Bruck C, Domin M, Lotze M, Wildgruber D","Cerebral cortex (New York, N.Y. : 1991)",0.097,23382516,10.1093/cercor/bhs417,-1
dominance_00084,https://pubmed.ncbi.nlm.nih.gov/28983238/,Unique Neural Characteristics of Atypical Lateralization of Language in Healthy Individuals.,"Bidula SP, Przybylski L, Pawlak MA, Kroliczak G",Frontiers in neuroscience,0.097,28983238,10.3389/fnins.2017.00525,-1
dominance_00085,https://pubmed.ncbi.nlm.nih.gov/15955504/,Functional MRI BOLD response to Tower of London performance of first-episode schizophrenia patients using cortical pattern matching.,"Rasser PE, Johnston P, Lagopoulos J, Ward PB, Schall U, Thienel R, Bender S, Toga AW, Thompson PM",NeuroImage,0.096,15955504,-1,-1
dominance_00086,https://pubmed.ncbi.nlm.nih.gov/18617009/,Sensorimotor tongue representation in individuals with unilateral upper limb amelia.,"Funk M, Lutz K, Hotz-Boendermaker S, Roos M, Summers P, Brugger P, Hepp-Reymond MC, Kollias SS",NeuroImage,0.096,18617009,-1,-1
dominance_00087,https://pubmed.ncbi.nlm.nih.gov/19028549/,The role of the right anterior insular cortex in the right hemisphere preponderance of stimulus-preceding negativity (SPN): an fMRI study.,"Kotani Y, Ohgami Y, Kuramoto Y, Tsukamoto T, Inoue Y, Aihara Y",Neuroscience letters,0.096,19028549,-1,-1
dominance_00088,https://pubmed.ncbi.nlm.nih.gov/23033058/,Regional differences in the developmental trajectory of lateralization of the language network.,"Berl MM, Mayo J, Parks EN, Rosenberger LR, VanMeter J, Ratner NB, Vaidya CJ, Gaillard WD",Human brain mapping,0.096,23033058,-1,-1
dominance_00089,https://pubmed.ncbi.nlm.nih.gov/11595392/,"Language lateralization in schizophrenia, an fMRI study.","Sommer IE, Ramsey NF, Kahn RS",Schizophrenia research,0.095,11595392,-1,-1
dominance_00090,https://pubmed.ncbi.nlm.nih.gov/14980562/,Functional imaging of face and hand imitation: towards a motor theory of empathy.,"Leslie KR, Johnson-Frey SH, Grafton ST",NeuroImage,0.095,14980562,-1,-1
dominance_00091,https://pubmed.ncbi.nlm.nih.gov/22144954/,The lateralization of motor cortex activation to action-words.,"Hauk O, Pulvermuller F",Frontiers in human neuroscience,0.093,22144954,-1,-1
dominance_00092,https://pubmed.ncbi.nlm.nih.gov/18787235/,The effects of stimulus modality and frequency of stimulus presentation on cross-modal distraction.,"Mayer AR, Franco AR, Canive J, Harrington DL","Cerebral cortex (New York, N.Y. : 1991)",0.092,18787235,-1,-1
dominance_00093,https://pubmed.ncbi.nlm.nih.gov/19300986/,Deriving angular displacement from optic flow: a fMRI study.,"Diekmann V, Jurgens R, Becker W",Experimental brain research,0.091,19300986,-1,-1
dominance_00094,https://pubmed.ncbi.nlm.nih.gov/22066589/,An application of univariate and multivariate approaches in FMRI to quantifying the hemispheric lateralization of acoustic and linguistic processes.,"McGettigan C, Evans S, Rosen S, Agnew ZK, Shah P, Scott SK",Journal of cognitive neuroscience,0.091,22066589,-1,-1
dominance_00095,https://pubmed.ncbi.nlm.nih.gov/26548403/,Cerebral asymmetry for language: Comparing production with comprehension.,"Haberling IS, Steinemann A, Corballis MC",Neuropsychologia,0.091,26548403,-1,-1
