paper_name,paper_url,Title,Author,Journal,Loading,PMID,Doi,download_status
education_00175,https://pubmed.ncbi.nlm.nih.gov/16585053/,Marijuana use is associated with a reorganized visual-attention network and cerebellar hypoactivation.,"Chang L, Yakupov R, Cloak C, Ernst T",Brain : a journal of neurology,0.062,16585053,-1,-1
education_00176,https://pubmed.ncbi.nlm.nih.gov/20553750/,Neural correlates of altered pain response in women with posttraumatic stress disorder from intimate partner violence.,"Strigo IA, Simmons AN, Matthews SC, Grimes EM, Allard CB, Reinhardt LE, Paulus MP, Stein MB",Biological psychiatry,0.062,20553750,-1,-1
education_00177,https://pubmed.ncbi.nlm.nih.gov/25257747/,Regional cortical thickness and subcortical volume changes in patients with metabolic syndrome.,"Song SW, Chung JH, Rho JS, Lee YA, Lim HK, Kang SG, Kim HN, Kim JE, Kim SH",Brain imaging and behavior,0.062,25257747,-1,-1
education_00178,https://pubmed.ncbi.nlm.nih.gov/27792961/,Effectiveness of cognitive-coping therapy and alteration of resting-state brain function in obsessive-compulsive disorder.,"Zhao HZ, Wang CH, Gao ZZ, Ma JD, Huang P, Li HF, Sang DE, Shan XW, Kou SJ, Li ZR, Ma L, Zhang ZH, Zhang JH, Ouyang H, Lian HK, Zang YF, Hu XZ",Journal of affective disorders,0.062,27792961,-1,-1
education_00179,https://pubmed.ncbi.nlm.nih.gov/16738250/,The influence of Alzheimer disease family history and apolipoprotein E epsilon4 on mesial temporal lobe activation.,"Johnson SC, Schmitz TW, Trivedi MA, Ries ML, Torgerson BM, Carlsson CM, Asthana S, Hermann BP, Sager MA",The Journal of neuroscience : the official journal of the Society for Neuroscience,0.061,16738250,-1,-1
education_00180,https://pubmed.ncbi.nlm.nih.gov/23670951/,Common and unique gray matter correlates of episodic memory dysfunction in frontotemporal dementia and Alzheimer's disease.,"Irish M, Piguet O, Hodges JR, Hornberger M",Human brain mapping,0.061,23670951,-1,-1
education_00181,https://pubmed.ncbi.nlm.nih.gov/24505314/,Contrasting prefrontal cortex contributions to episodic memory dysfunction in behavioural variant frontotemporal dementia and Alzheimer's disease.,"Wong S, Flanagan E, Savage G, Hodges JR, Hornberger M",PloS one,0.06,24505314,-1,-1
education_00182,https://pubmed.ncbi.nlm.nih.gov/26869907/,Amplitude of Low-Frequency Fluctuations in Multiple-Frequency Bands in Acute Mild Traumatic Brain Injury.,"Zhan J, Gao L, Zhou F, Bai L, Kuang H, He L, Zeng X, Gong H",Frontiers in human neuroscience,0.059,26869907,-1,-1
education_00183,https://pubmed.ncbi.nlm.nih.gov/20008455/,Intellectual enrichment is linked to cerebral efficiency in multiple sclerosis: functional magnetic resonance imaging evidence for cognitive reserve.,"Sumowski JF, Wylie GR, Deluca J, Chiaravalloti N",Brain : a journal of neurology,0.057,20008455,-1,-1
education_00184,https://pubmed.ncbi.nlm.nih.gov/24121137/,Difference in amplitude of low-frequency fluctuation between currently depressed  and remitted females with major depressive disorder.,"Jing B, Liu CH, Ma X, Yan HG, Zhuo ZZ, Zhang Y, Wang SH, Li HY, Wang CY",Brain research,0.057,24121137,-1,-1
education_00185,https://pubmed.ncbi.nlm.nih.gov/24498389/,Abnormal intrinsic brain activity patterns in patients with subcortical ischemic  vascular dementia.,"Liu C, Li C, Yin X, Yang J, Zhou D, Gui L, Wang J",PloS one,0.057,24498389,-1,-1
education_00186,https://pubmed.ncbi.nlm.nih.gov/18423780/,Prion protein M129V polymorphism affects retrieval-related brain activity.,"Buchmann A, Mondadori CR, Hanggi J, Aerni A, Vrticka P, Luechinger R, Boesiger P, Hock C, Nitsch RM, de Quervain DJ, Papassotiropoulos A, Henke K",Neuropsychologia,0.054,18423780,-1,-1
education_00187,https://pubmed.ncbi.nlm.nih.gov/28652414/,Differential Aging Trajectories of Modulation of Activation to Cognitive Challenge in APOE epsilon4 Groups: Reduced Modulation Predicts Poorer Cognitive Performance.,"Foster CM, Kennedy KM, Rodrigue KM",The Journal of neuroscience : the official journal of the Society for Neuroscience,0.054,28652414,-1,-1
education_00188,https://pubmed.ncbi.nlm.nih.gov/28789992/,A whole brain volumetric approach in overweight/obese children: Examining the association with different physical fitness components and academic performance.  The ActiveBrains project.,"Esteban-Cornejo I, Cadenas-Sanchez C, Contreras-Rodriguez O, Verdejo-Roman J, Mora-Gonzalez J, Migueles JH, Henriksson P, Davis CL, Verdejo-Garcia A, Catena A, Ortega FB",NeuroImage,0.054,28789992,-1,-1
education_00189,https://pubmed.ncbi.nlm.nih.gov/24332795/,Preservation and compensation: the functional neuroanatomy of insight and working memory in schizophrenia.,"Sapara A, Ffytche DH, Birchwood M, Cooke MA, Fannon D, Williams SC, Kuipers E, Kumari V",Schizophrenia research,0.053,24332795,-1,-1
education_00190,https://pubmed.ncbi.nlm.nih.gov/20647266/,Impulsivity-related brain volume deficits in schizophrenia-addiction comorbidity.,"Schiffer B, Muller BW, Scherbaum N, Forsting M, Wiltfang J, Leygraf N, Gizewski ER",Brain : a journal of neurology,0.052,20647266,-1,-1
education_00191,https://pubmed.ncbi.nlm.nih.gov/23593393/,The BDNF Val66Met polymorphism has opposite effects on memory circuits of multiple sclerosis patients and controls.,"Fera F, Passamonti L, Cerasa A, Gioia MC, Liguori M, Manna I, Valentino P, Quattrone A",PloS one,0.052,23593393,10.1371/journal.pone.0061063,-1
education_00192,https://pubmed.ncbi.nlm.nih.gov/25982002/,"Increased short-range and long-range functional connectivity in first-episode, medication-naive schizophrenia at rest.","Guo W, Liu F, Xiao C, Liu J, Yu M, Zhang Z, Zhang J, Zhao J",Schizophrenia research,0.051,25982002,10.1016/j.schres.2015.04.034,-1
education_00193,https://pubmed.ncbi.nlm.nih.gov/27474916/,The neural correlates of auditory and visuospatial span in logopenic progressive  aphasia and Alzheimer's disease.,"Foxe D, Leyton CE, Hodges JR, Burrell JR, Irish M, Piguet O",Cortex; a journal devoted to the study of the nervous system and behavior,0.05,27474916,-1,-1
