paper_name,paper_url,Title,Author,Journal,Loading,PMID,Doi,download_status
education_00001,https://pubmed.ncbi.nlm.nih.gov/27734304/,"Relationships between years of education, regional grey matter volumes, and working memory-related brain activity in healthy older adults.","Boller B, Mellah S, Ducharme-Laliberte G, Belleville S",Brain imaging and behavior,0.616,27734304,-1,-1
education_00002,https://pubmed.ncbi.nlm.nih.gov/29584781/,"Working memory, age and education: A lifespan fMRI study.","Archer JA, Lee A, Qiu A, Chen SA",PloS one,0.509,29584781,-1,-1
education_00003,https://pubmed.ncbi.nlm.nih.gov/27636672/,White matter hyperintensities and cognitive reserve during a working memory task: a functional magnetic resonance imaging study in cognitively normal older adults.,"Fernandez-Cabello S, Valls-Pedret C, Schurz M, Vidal-Pineiro D, Sala-Llonch R, Bargallo N, Ros E, Bartres-Faz D",Neurobiology of aging,0.449,27636672,-1,-1
education_00004,https://pubmed.ncbi.nlm.nih.gov/23796547/,"Relationships between years of education and gray matter volume, metabolism and functional connectivity in healthy elders.","Arenaza-Urquijo EM, Landeau B, La Joie R, Mevel K, Mezenge F, Perrotin A, Desgranges B, Bartres-Faz D, Eustache F, Chetelat G",NeuroImage,0.401,23796547,-1,-1
education_00005,https://pubmed.ncbi.nlm.nih.gov/18465748/,Differential cerebellar and cortical involvement according to various attentional load: role of educational level.,"Bonnet MC, Dilharreguy B, Allard M, Deloire MS, Petry KG, Brochet B",Human brain mapping,0.394,18465748,-1,-1
education_00006,https://pubmed.ncbi.nlm.nih.gov/16080160/,Cognitive processing in Chinese literate and illiterate subjects: an fMRI study.,"Li G, Cheung RT, Gao JH, Lee TM, Tan LH, Fox PT, Jack CR Jr, Yang ES",Human brain mapping,0.307,16080160,-1,-1
education_00007,https://pubmed.ncbi.nlm.nih.gov/28764930/,Association between educational attainment and amyloid deposition across the spectrum from normal cognition to dementia: neuroimaging evidence for protection  and compensation.,"Arenaza-Urquijo EM, Bejanin A, Gonneaud J, Wirth M, La Joie R, Mutlu J, Gaubert M, Landeau B, de la Sayette V, Eustache F, Chetelat G",Neurobiology of aging,0.264,28764930,-1,-1
education_00008,https://pubmed.ncbi.nlm.nih.gov/22543811/,Prominent activation of the bilateral inferior parietal lobule of literate compared with illiterate subjects during Chinese logographic processing.,"Wu J, Li X, Yang J, Cai C, Sun H, Guo Q",Experimental brain research,0.209,22543811,-1,-1
education_00009,https://pubmed.ncbi.nlm.nih.gov/25355487/,Distributed neural representations of logical arguments in school-age children.,"Mathieu R, Booth JR, Prado J",Human brain mapping,0.207,25355487,-1,-1
education_00010,https://pubmed.ncbi.nlm.nih.gov/22796505/,Cognitive reserve impacts on inter-individual variability in resting-state cerebral metabolism in normal aging.,"Bastin C, Yakushev I, Bahri MA, Fellgiebel A, Eustache F, Landeau B, Scheurich A, Feyers D, Collette F, Chetelat G, Salmon E",NeuroImage,0.201,22796505,-1,-1
education_00011,https://pubmed.ncbi.nlm.nih.gov/12880846/,Cognitive reserve modulates functional brain responses during memory tasks: a PET study in healthy young and elderly subjects.,"Scarmeas N, Zarahn E, Anderson KE, Hilton J, Flynn J, Van Heertum RL, Sackeim HA, Stern Y",NeuroImage,0.197,12880846,-1,-1
education_00012,https://pubmed.ncbi.nlm.nih.gov/23133615/,Regional homogeneity within the default mode network in bipolar depression: a resting-state functional magnetic resonance imaging study.,"Liu CH, Ma X, Li F, Wang YJ, Tie CL, Li SF, Chen TL, Fan TT, Zhang Y, Dong J, Yao L, Wu X, Wang CY",PloS one,0.193,23133615,-1,-1
education_00013,https://pubmed.ncbi.nlm.nih.gov/24568865/,Unraveling Brain Functional Connectivity of encoding and retrieval in the context of education.,"Panda R, Bharath RD, George L, Kanungo S, Reddy RP, Upadhyay N, Thamodharan A, Rajeshwaran J, Rao SL, Gupta AK",Brain and cognition,0.169,24568865,-1,-1
education_00014,https://pubmed.ncbi.nlm.nih.gov/28437659/,The relationship between maternal education and the neural substrates of phoneme  perception in children: Interactions between socioeconomic status and proficiency level.,"Conant LL, Liebenthal E, Desai A, Binder JR",Brain and language,0.165,28437659,-1,-1
education_00015,https://pubmed.ncbi.nlm.nih.gov/26026373/,"Abnormal regional homogeneity and its correlations with personality in first-episode, treatment-naive somatization disorder.","Song Y, Su Q, Jiang M, Liu F, Yao D, Dai Y, Long L, Yu M, Liu J, Zhang Z, Zhang J, Xiao C, Guo W",International journal of psychophysiology : official journal of the International Organization of Psychophysiology,0.15,26026373,-1,-1
education_00016,https://pubmed.ncbi.nlm.nih.gov/17548160/,Differential engagement of anterior cingulate and adjacent medial frontal cortex  in adept meditators and non-meditators.,"Holzel BK, Ott U, Hempel H, Hackl A, Wolf K, Stark R, Vaitl D",Neuroscience letters,0.149,17548160,-1,-1
education_00017,https://pubmed.ncbi.nlm.nih.gov/22521476/,Neural processing of overt word generation in healthy individuals: the effect of  age and word knowledge.,"Nagels A, Kircher T, Dietsche B, Backes H, Marquetand J, Krug A",NeuroImage,0.146,22521476,-1,-1
education_00018,https://pubmed.ncbi.nlm.nih.gov/17582746/,Thalamo-cortical dysfunction in cocaine abusers: implications in attention and perception.,"Tomasi D, Goldstein RZ, Telang F, Maloney T, Alia-Klein N, Caparelli EC, Volkow ND",Psychiatry research,0.137,17582746,-1,-1
education_00019,https://pubmed.ncbi.nlm.nih.gov/16814986/,Deficit in schizophrenia to recruit the striatum in implicit learning: a functional magnetic resonance imaging investigation.,"Reiss JP, Campbell DW, Leslie WD, Paulus MP, Ryner LN, Polimeni JO, Foot BJ, Sareen J",Schizophrenia research,0.136,16814986,-1,-1
education_00020,https://pubmed.ncbi.nlm.nih.gov/16766210/,Individuals with schizophrenia present hypo- and hyperactivation during implicit  cueing in an inhibitory task.,"Arce E, Leland DS, Miller DA, Simmons AN, Winternheimer KC, Paulus MP",NeuroImage,0.131,16766210,-1,-1
education_00021,https://pubmed.ncbi.nlm.nih.gov/11595391/,An fMRI study of reduced left prefrontal activation in schizophrenia during normal inhibitory function.,"Rubia K, Russell T, Bullmore ET, Soni W, Brammer MJ, Simmons A, Taylor E, Andrew C, Giampietro V, Sharma T",Schizophrenia research,0.13,11595391,-1,-1
education_00022,https://pubmed.ncbi.nlm.nih.gov/19007997/,Regional homogeneity in depression and its relationship with separate depressive  symptom clusters: a resting-state fMRI study.,"Yao Z, Wang L, Lu Q, Liu H, Teng G",Journal of affective disorders,0.128,19007997,-1,-1
education_00023,https://pubmed.ncbi.nlm.nih.gov/19775795/,Gray matter density negatively correlates with duration of heroin use in young lifetime heroin-dependent individuals.,"Yuan Y, Zhu Z, Shi J, Zou Z, Yuan F, Liu Y, Lee TM, Weng X",Brain and cognition,0.126,19775795,-1,-1
education_00024,https://pubmed.ncbi.nlm.nih.gov/28130005/,Resting-state functional connectivity in medication-naive schizophrenia patients  with and without auditory verbal hallucinations: A preliminary report.,"Chang X, Collin G, Xi Y, Cui L, Scholtens LH, Sommer IE, Wang H, Yin H, Kahn RS, van den Heuvel MP",Schizophrenia research,0.126,28130005,-1,-1
education_00025,https://pubmed.ncbi.nlm.nih.gov/27086318/,Excessive users of violent video games do not show emotional desensitization: an  fMRI study.,"Szycik GR, Mohammadi B, Hake M, Kneer J, Samii A, Munte TF, Te Wildt BT",Brain imaging and behavior,0.124,27086318,-1,-1
education_00026,https://pubmed.ncbi.nlm.nih.gov/23820976/,Abnormal auditory sensory gating-out in first-episode and never-medicated paranoid schizophrenia patients: an fMRI study.,"Ji B, Mei W, Zhang JX, Jing J, Wu Q, Zhuo Y, Xiao Z",Experimental brain research,0.123,23820976,-1,-1
education_00027,https://pubmed.ncbi.nlm.nih.gov/19351572/,Toward a functional neuroanatomy of dysthymia: a functional magnetic resonance imaging study.,"Ravindran AV, Smith A, Cameron C, Bhatla R, Cameron I, Georgescu TM, Hogan MJ",Journal of affective disorders,0.12,19351572,-1,-1
education_00028,https://pubmed.ncbi.nlm.nih.gov/26031380/,Local brain gyrification as a marker of neurological soft signs in schizophrenia.,"Hirjak D, Kubera KM, Wolf RC, Thomann AK, Hell SK, Seidl U, Thomann PA",Behavioural brain research,0.119,26031380,-1,-1
education_00029,https://pubmed.ncbi.nlm.nih.gov/24478680/,Linking neuroscientific research on decision making to the educational context of novice students assigned to a multiple-choice scientific task involving common misconceptions about electrical circuit,"Potvin P, Turmel E, Masson S",Frontiers in human neuroscience,0.118,24478680,-1,-1
education_00030,https://pubmed.ncbi.nlm.nih.gov/17408585/,Learning-related human brain activations reflecting individual finances.,"Tobler PN, Fletcher PC, Bullmore ET, Schultz W",Neuron,0.117,17408585,-1,-1
education_00031,https://pubmed.ncbi.nlm.nih.gov/19342124/,Memory activation in healthy nonagenarians.,"Beeri MS, Lee H, Cheng H, Wollman D, Silverman JM, Prohovnik I",Neurobiology of aging,0.115,19342124,10.1016/j.neurobiolaging.2009.02.022,-1
education_00032,https://pubmed.ncbi.nlm.nih.gov/17329129/,Phonological processing in relation to reading: an fMRI study in deaf readers.,"Aparicio M, Gounot D, Demont E, Metz-Lutz MN",NeuroImage,0.114,17329129,-1,-1
education_00033,https://pubmed.ncbi.nlm.nih.gov/18635342/,Neural correlates of attachment trauma in borderline personality disorder: a functional magnetic resonance imaging study.,"Buchheim A, Erk S, George C, Kachele H, Kircher T, Martius P, Pokorny D, Ruchsow M, Spitzer M, Walter H",Psychiatry research,0.112,18635342,-1,-1
education_00034,https://pubmed.ncbi.nlm.nih.gov/21763432/,Meditation training increases brain efficiency in an attention task.,"Kozasa EH, Sato JR, Lacerda SS, Barreiros MA, Radvany J, Russell TA, Sanches LG, Mello LE, Amaro E Jr",NeuroImage,0.112,21763432,-1,-1
education_00035,https://pubmed.ncbi.nlm.nih.gov/25798328/,Neural basis of nonanalytical reasoning expertise during clinical evaluation.,"Durning SJ, Costanzo ME, Artino AR, Graner J, van der Vleuten C, Beckman TJ, Wittich CM, Roy MJ, Holmboe ES, Schuwirth L",Brain and behavior,0.111,25798328,-1,-1
education_00036,https://pubmed.ncbi.nlm.nih.gov/19366285/,Contrasting effects of vocabulary knowledge on temporal and parietal brain structure across lifespan.,"Richardson FM, Thomas MS, Filippi R, Harth H, Price CJ",Journal of cognitive neuroscience,0.11,19366285,-1,-1
education_00037,https://pubmed.ncbi.nlm.nih.gov/14573322/,Recovery and chronicity in anorexia nervosa: brain activity associated with differential outcomes.,"Uher R, Brammer MJ, Murphy T, Campbell IC, Ng VW, Williams SC, Treasure J",Biological psychiatry,0.107,14573322,-1,-1
education_00038,https://pubmed.ncbi.nlm.nih.gov/16458263/,Cortical inefficiency in patients with unipolar depression: an event-related FMRI study with the Stroop task.,"Wagner G, Sinsel E, Sobanski T, Kohler S, Marinou V, Mentzel HJ, Sauer H, Schlosser RG",Biological psychiatry,0.106,16458263,-1,-1
education_00039,https://pubmed.ncbi.nlm.nih.gov/19699020/,Neurofunctional correlates of personality traits in relapsing-remitting multiple  sclerosis: an fMRI study.,"Gioia MC, Cerasa A, Valentino P, Fera F, Nistico R, Liguori M, Lanza P, Quattrone A",Brain and cognition,0.105,19699020,-1,-1
education_00040,https://pubmed.ncbi.nlm.nih.gov/21220170/,Seeing Chinese characters in action: an fMRI study of the perception of writing sequences.,"Yu H, Gong L, Qiu Y, Zhou X",Brain and language,0.105,21220170,-1,-1
education_00041,https://pubmed.ncbi.nlm.nih.gov/27531977/,Neural Response during the Activation of the Attachment System in Patients with Borderline Personality Disorder: An fMRI Study.,"Buchheim A, Erk S, George C, Kachele H, Martius P, Pokorny D, Spitzer M, Walter H",Frontiers in human neuroscience,0.105,27531977,-1,-1
education_00042,https://pubmed.ncbi.nlm.nih.gov/20884362/,Structural brain alterations associated with dyslexia predate reading onset.,"Raschle NM, Chang M, Gaab N",NeuroImage,0.103,20884362,-1,-1
education_00043,https://pubmed.ncbi.nlm.nih.gov/26052275/,Cognitive function and brain structure after recurrent mild traumatic brain injuries in young-to-middle-aged adults.,"List J, Ott S, Bukowski M, Lindenberg R, Floel A",Frontiers in human neuroscience,0.103,26052275,-1,-1
education_00044,https://pubmed.ncbi.nlm.nih.gov/24263193/,Cultural influences on the neural correlate of moral decision making processes.,"Han H, Glover GH, Jeong C",Behavioural brain research,0.102,24263193,-1,-1
education_00045,https://pubmed.ncbi.nlm.nih.gov/24266006/,Neuroanatomical correlates of Klinefelter syndrome studied in relation to the neuropsychological profile.,"Skakkebaek A, Gravholt CH, Rasmussen PM, Bojesen A, Jensen JS, Fedder J, Laurberg P, Hertz JM, Ostergaard JR, Pedersen AD, Wallentin M",NeuroImage. Clinical,0.102,24266006,-1,-1
education_00046,https://pubmed.ncbi.nlm.nih.gov/23116810/,"Abnormal amplitude low-frequency oscillations in medication-naive, first-episode  patients with major depressive disorder: a resting-state fMRI study.","Liu F, Guo W, Liu L, Long Z, Ma C, Xue Z, Wang Y, Li J, Hu M, Zhang J, Du H, Zeng L, Liu Z, Wooderson SC, Tan C, Zhao J, Chen H",Journal of affective disorders,0.101,23116810,-1,-1
education_00047,https://pubmed.ncbi.nlm.nih.gov/20385153/,The neural basis of lip-reading capabilities is altered by early visual deprivation.,"Putzar L, Goerendt I, Heed T, Richard G, Buchel C, Roder B",Neuropsychologia,0.099,20385153,-1,-1
education_00048,https://pubmed.ncbi.nlm.nih.gov/21466926/,Enhanced cue reactivity and fronto-striatal functional connectivity in cocaine use disorders.,"Wilcox CE, Teshiba TM, Merideth F, Ling J, Mayer AR",Drug and alcohol dependence,0.099,21466926,-1,-1
education_00049,https://pubmed.ncbi.nlm.nih.gov/26909331/,Hurt but still alive: Residual activity in the parahippocampal cortex conditions  the recognition of familiar places in a patient with topographic agnosia.,"van Assche M, Kebets V, Lopez U, Saj A, Goldstein R, Bernasconi F, Vuilleumier P, Assal F",NeuroImage. Clinical,0.099,26909331,-1,-1
education_00050,https://pubmed.ncbi.nlm.nih.gov/11375910/,Normal sexual dimorphism of the adult human brain assessed by in vivo magnetic resonance imaging.,"Goldstein JM, Seidman LJ, Horton NJ, Makris N, Kennedy DN, Caviness VS Jr, Faraone SV, Tsuang MT","Cerebral cortex (New York, N.Y. : 1991)",0.097,11375910,-1,-1
education_00051,https://pubmed.ncbi.nlm.nih.gov/21316814/,Structural brain changes in normal individuals with a maternal history of Alzheimer's.,"Berti V, Mosconi L, Glodzik L, Li Y, Murray J, De Santi S, Pupi A, Tsui W, De Leon MJ",Neurobiology of aging,0.097,21316814,10.1016/j.neurobiolaging.2011.01.001,-1
education_00052,https://pubmed.ncbi.nlm.nih.gov/21808615/,Specialization in the human brain: the case of numbers.,"Cohen Kadosh R, Bahrami B, Walsh V, Butterworth B, Popescu T, Price CJ",Frontiers in human neuroscience,0.097,21808615,10.3389/fnhum.2011.00062,-1
education_00053,https://pubmed.ncbi.nlm.nih.gov/25394198/,Frontopolar activity and connectivity support dynamic conscious augmentation of creative state.,"Green AE, Cohen MS, Raab HA, Yedibalian CG, Gray JR",Human brain mapping,0.097,25394198,-1,-1
education_00054,https://pubmed.ncbi.nlm.nih.gov/23585869/,Can Taichi reshape the brain? A brain morphometry study.,"Wei GX, Xu T, Fan FM, Dong HM, Jiang LL, Li HJ, Yang Z, Luo J, Zuo XN",PloS one,0.096,23585869,-1,-1
education_00055,https://pubmed.ncbi.nlm.nih.gov/26462573/,Chronological age and its impact on associative learning proficiency and brain structure in middle adulthood.,"Diwadkar VA, Bellani M, Ahmed R, Dusi N, Rambaldelli G, Perlini C, Marinelli V, Ramaseshan K, Ruggeri M, Bambilla P",Behavioural brain research,0.096,26462573,-1,-1
education_00056,https://pubmed.ncbi.nlm.nih.gov/16537568/,Reduced functional brain activity response in cognitively intact apolipoprotein E epsilon4 carriers.,"Lind J, Persson J, Ingvar M, Larsson A, Cruts M, Van Broeckhoven C, Adolfsson R, Backman L, Nilsson LG, Petersson KM, Nyberg L",Brain : a journal of neurology,0.095,16537568,-1,-1
education_00057,https://pubmed.ncbi.nlm.nih.gov/20298792/,Increased functional brain response during word retrieval in cognitively intact older adults at genetic risk for Alzheimer's disease.,"Wierenga CE, Stricker NH, McCauley A, Simmons A, Jak AJ, Chang YL, Delano-Wood L, Bangen KJ, Salmon DP, Bondi MW",NeuroImage,0.095,20298792,-1,-1
education_00058,https://pubmed.ncbi.nlm.nih.gov/22206834/,Volumetric variation in subregions of the cerebellum correlates with working memory performance.,"Ding H, Qin W, Jiang T, Zhang Y, Yu C",Neuroscience letters,0.095,22206834,-1,-1
education_00059,https://pubmed.ncbi.nlm.nih.gov/22569187/,Neural correlates of moral reasoning in autism spectrum disorder.,"Schneider K, Pauly KD, Gossen A, Mevissen L, Michel TM, Gur RC, Schneider F, Habel U",Social cognitive and affective neuroscience,0.095,22569187,-1,-1
education_00060,https://pubmed.ncbi.nlm.nih.gov/18053618/,"Brain structure and function related to cognitive reserve variables in normal aging, mild cognitive impairment and Alzheimer's disease.","Sole-Padulles C, Bartres-Faz D, Junque C, Vendrell P, Rami L, Clemente IC, Bosch B, Villar A, Bargallo N, Jurado MA, Barrios M, Molinuevo JL",Neurobiology of aging,0.094,18053618,-1,-1
education_00061,https://pubmed.ncbi.nlm.nih.gov/23149023/,Behavioral regulation in methamphetamine abusers: an fMRI study.,"Salo R, Fassbender C, Buonocore MH, Ursu S",Psychiatry research,0.094,23149023,-1,-1
education_00062,https://pubmed.ncbi.nlm.nih.gov/17321724/,Brain activation during implicit sequence learning in individuals with trichotillomania.,"Rauch SL, Wright CI, Savage CR, Martis B, McMullin KG, Wedig MM, Gold AL, Keuthen NJ",Psychiatry research,0.093,17321724,-1,-1
education_00063,https://pubmed.ncbi.nlm.nih.gov/23510545/,Working memory in recurrent brief depression: an fMRI pilot study.,"Korsnes MS, Lovdahl H, Andersson S, Bjornerud A, Due-Tonnesen P, Endestad T, Malt UF",Journal of affective disorders,0.093,23510545,-1,-1
education_00064,https://pubmed.ncbi.nlm.nih.gov/25858311/,Three-dimensional grammar in the brain: Dissociating the neural correlates of natural sign language and manually coded spoken language.,"Jednorog K, Bola L, Mostowski P, Szwed M, Boguszewski PM, Marchewka A, Rutkowski P",Neuropsychologia,0.093,25858311,-1,-1
education_00065,https://pubmed.ncbi.nlm.nih.gov/15885517/,A 4.0-T fMRI study of brain connectivity during word fluency in first-episode schizophrenia.,"Boksman K, Theberge J, Williamson P, Drost DJ, Malla A, Densmore M, Takhar J, Pavlosky W, Menon RS, Neufeld RW",Schizophrenia research,0.092,15885517,-1,-1
education_00066,https://pubmed.ncbi.nlm.nih.gov/17949691/,Reduced behavioral and neural activation in stimulant users to different error rates during decision making.,"Paulus MP, Lovero KL, Wittmann M, Leland DS",Biological psychiatry,0.092,17949691,-1,-1
education_00067,https://pubmed.ncbi.nlm.nih.gov/19490045/,"Evaluation of cognition, structural, and functional MRI in juvenile myoclonic epilepsy.","Roebling R, Scheerer N, Uttner I, Gruber O, Kraft E, Lerche H",Epilepsia,0.092,19490045,-1,-1
education_00068,https://pubmed.ncbi.nlm.nih.gov/23664947/,Genetic and environmental contributions to brain activation during calculation.,"Pinel P, Dehaene S",NeuroImage,0.092,23664947,-1,-1
education_00069,https://pubmed.ncbi.nlm.nih.gov/28648549/,Hippocampal spatial mechanisms relate to the development of arithmetic symbol processing in children.,"Mathieu R, Epinat-Duclos J, Leone J, Fayol M, Thevenot C, Prado J",Developmental cognitive neuroscience,0.092,28648549,-1,-1
education_00070,https://pubmed.ncbi.nlm.nih.gov/14505331/,Compensatory cortical activation observed by fMRI during a cognitive task at the  earliest stage of MS.,"Audoin B, Ibarrola D, Ranjeva JP, Confort-Gouny S, Malikova I, Ali-Cherif A, Pelletier J, Cozzone P",Human brain mapping,0.091,14505331,-1,-1
education_00071,https://pubmed.ncbi.nlm.nih.gov/27766586/,Brain structure and function in patients with ovarian cancer treated with first-line chemotherapy: a pilot study.,"Correa DD, Root JC, Kryza-Lacombe M, Mehta M, Karimi S, Hensley ML, Relkin N",Brain imaging and behavior,0.091,27766586,-1,-1
education_00072,https://pubmed.ncbi.nlm.nih.gov/21300113/,Alexithymia and regional gray matter alterations in schizophrenia.,"Kubota M, Miyata J, Hirao K, Fujiwara H, Kawada R, Fujimoto S, Tanaka Y, Sasamoto A, Sawamoto N, Fukuyama H, Takahashi H, Murai T",Neuroscience research,0.09,21300113,10.1016/j.neures.2011.01.019,-1
education_00073,https://pubmed.ncbi.nlm.nih.gov/29407469/,Age-related differences in the neural correlates of empathy for pleasant and unpleasant touch in a female sample.,"Riva F, Tschernegg M, Chiesa PA, Wagner IC, Kronbichler M, Lamm C, Silani G",Neurobiology of aging,0.09,29407469,10.1016/j.neurobiolaging.2017.12.028,-1
education_00074,https://pubmed.ncbi.nlm.nih.gov/19619664/,White matter defects in first episode psychosis patients: a voxelwise analysis of diffusion tensor imaging.,"Perez-Iglesias R, Tordesillas-Gutierrez D, Barker GJ, McGuire PK, Roiz-Santianez R, Mata I, de Lucas EM, Quintana F, Vazquez-Barquero JL, Crespo-Facorro B",NeuroImage,0.089,19619664,10.1016/j.neuroimage.2009.07.016,-1
education_00075,https://pubmed.ncbi.nlm.nih.gov/21531384/,Exaggerated brain activation during emotion processing in unaffected siblings of  patients with schizophrenia.,"van Buuren M, Vink M, Rapcencu AE, Kahn RS",Biological psychiatry,0.089,21531384,-1,-1
education_00076,https://pubmed.ncbi.nlm.nih.gov/23474094/,Resting-state brain activity in major depressive disorder patients and their siblings.,"Liu CH, Ma X, Wu X, Fan TT, Zhang Y, Zhou FC, Li LJ, Li F, Tie CL, Li SF, Zhang D, Zhou Z, Dong J, Wang YJ, Yao L, Wang CY",Journal of affective disorders,0.089,23474094,-1,-1
education_00077,https://pubmed.ncbi.nlm.nih.gov/24074717/,"Dissociation of regional activity in the default mode network in first-episode, drug-naive major depressive disorder at rest.","Guo W, Liu F, Zhang J, Zhang Z, Yu L, Liu J, Chen H, Xiao C",Journal of affective disorders,0.089,24074717,-1,-1
education_00078,https://pubmed.ncbi.nlm.nih.gov/18242723/,Compromised fronto-striatal functioning in HIV: an fMRI investigation of semantic event sequencing.,"Melrose RJ, Tinaz S, Castelo JM, Courtney MG, Stern CE",Behavioural brain research,0.088,18242723,-1,-1
education_00079,https://pubmed.ncbi.nlm.nih.gov/24557637/,Altered Cognitive Control Activations after Moderate-to-Severe Traumatic Brain Injury and Their Relationship to Injury Severity and Everyday-Life Function.,"Olsen A, Brunner JF, Indredavik Evensen KA, Finnanger TG, Vik A, Skandsen T, Landro NI, Haberg AK","Cerebral cortex (New York, N.Y. : 1991)",0.088,24557637,-1,-1
education_00080,https://pubmed.ncbi.nlm.nih.gov/28600740/,Functional reorganization during cognitive function tasks in patients with amyotrophic lateral sclerosis.,"Keller J, Bohm S, Aho-Ozhan HEA, Loose M, Gorges M, Kassubek J, Uttner I, Abrahams S, Ludolph AC, Lule D",Brain imaging and behavior,0.088,28600740,-1,-1
education_00081,https://pubmed.ncbi.nlm.nih.gov/16487943/,A reversal of the normal pattern of parahippocampal response to neutral and fearful faces is associated with reality distortion in schizophrenia.,"Surguladze S, Russell T, Kucharska-Pietura K, Travis MJ, Giampietro V, David AS, Phillips ML",Biological psychiatry,0.087,16487943,-1,-1
education_00082,https://pubmed.ncbi.nlm.nih.gov/19019637/,Neuroanatomical correlates of neurological soft signs in antipsychotic-naive schizophrenia.,"Venkatasubramanian G, Jayakumar PN, Gangadhar BN, Keshavan MS",Psychiatry research,0.087,19019637,-1,-1
education_00083,https://pubmed.ncbi.nlm.nih.gov/19199407/,Sexual dimorphism in the parietal substrate associated with visuospatial cognition independent of general intelligence.,"Hanggi J, Buchmann A, Mondadori CR, Henke K, Jancke L, Hock C",Journal of cognitive neuroscience,0.087,19199407,-1,-1
education_00084,https://pubmed.ncbi.nlm.nih.gov/19346000/,Functional MRI study of memory-related brain regions in patients with depressive  disorder.,"Werner NS, Meindl T, Materne J, Engel RR, Huber D, Riedel M, Reiser M, Hennig-Fast K",Journal of affective disorders,0.087,19346000,-1,-1
education_00085,https://pubmed.ncbi.nlm.nih.gov/22806961/,Memory performance and fMRI signal in presymptomatic familial Alzheimer's disease.,"Braskie MN, Medina LD, Rodriguez-Agudelo Y, Geschwind DH, Macias-Islas MA, Thompson PM, Cummings JL, Bookheimer SY, Ringman JM",Human brain mapping,0.087,22806961,-1,-1
education_00086,https://pubmed.ncbi.nlm.nih.gov/22841389/,Executive functions in mild cognitive impairment: emergence and breakdown of neural plasticity.,"Clement F, Gauthier S, Belleville S",Cortex; a journal devoted to the study of the nervous system and behavior,0.087,22841389,-1,-1
education_00087,https://pubmed.ncbi.nlm.nih.gov/17016713/,Lorazepam dose-dependently decreases risk-taking related activation in limbic areas.,"Arce E, Miller DA, Feinstein JS, Stein MB, Paulus MP",Psychopharmacology,0.086,17016713,-1,-1
education_00088,https://pubmed.ncbi.nlm.nih.gov/20053536/,The interaction of working memory and emotion in persons clinically at risk for psychosis: an fMRI pilot study.,"Pauly K, Seiferth NY, Kellermann T, Ruhrmann S, Daumann B, Backes V, Klosterkotter J, Shah NJ, Schneider F, Kircher TT, Habel U",Schizophrenia research,0.086,20053536,-1,-1
