paper_name,paper_url,Title,Author,Journal,Loading,PMID,Doi,download_status
encoding retrieval_00001,https://pubmed.ncbi.nlm.nih.gov/19524092/,Encoding and retrieving faces and places: distinguishing process- and stimulus-specific differences in brain activity.,"Prince SE, Dennis NA, Cabeza R",Neuropsychologia,0.477,19524092,-1,-1
encoding retrieval_00002,https://pubmed.ncbi.nlm.nih.gov/28202612/,Transformed Neural Pattern Reinstatement during Episodic Memory Retrieval.,"Xiao X, Dong Q, Gao J, Men W, Poldrack RA, Xue G",The Journal of neuroscience : the official journal of the Society for Neuroscience,0.383,28202612,-1,-1
encoding retrieval_00003,https://pubmed.ncbi.nlm.nih.gov/24568865/,Unraveling Brain Functional Connectivity of encoding and retrieval in the context of education.,"Panda R, Bharath RD, George L, Kanungo S, Reddy RP, Upadhyay N, Thamodharan A, Rajeshwaran J, Rao SL, Gupta AK",Brain and cognition,0.366,24568865,10.1016/j.bandc.2014.01.018,-1
encoding retrieval_00004,https://pubmed.ncbi.nlm.nih.gov/22855822/,Opposing effects of aging on large-scale brain systems for memory encoding and cognitive control.,"Salami A, Eriksson J, Nyberg L",The Journal of neuroscience : the official journal of the Society for Neuroscience,0.35,22855822,10.1523/JNEUROSCI.0278-12.2012,-1
encoding retrieval_00005,https://pubmed.ncbi.nlm.nih.gov/16525800/,Precuneus is involved in allocentric spatial location encoding and recognition.,"Frings L, Wagner K, Quiske A, Schwarzwald R, Spreer J, Halsband U, Schulze-Bonhage A",Experimental brain research,0.341,16525800,10.1007/s00221-006-0408-8,-1
encoding retrieval_00006,https://pubmed.ncbi.nlm.nih.gov/19428683/,Neural correlates of associative memory: the effects of negative emotion.,"Onoda K, Okamoto Y, Yamawaki S",Neuroscience research,0.34,19428683,-1,-1
encoding retrieval_00007,https://pubmed.ncbi.nlm.nih.gov/20637787/,Hippocampal-neocortical networks differ during encoding and retrieval of relational memory: functional and effective connectivity analyses.,"McCormick C, Moscovitch M, Protzner AB, Huber CG, McAndrews MP",Neuropsychologia,0.338,20637787,-1,-1
encoding retrieval_00008,https://pubmed.ncbi.nlm.nih.gov/20832483/,Process-specific prefrontal contributions to episodic encoding and retrieval of tastes: a functional NIRS study.,"Okamoto M, Wada Y, Yamaguchi Y, Kyutoku Y, Clowney L, Singh AK, Dan I",NeuroImage,0.332,20832483,-1,-1
encoding retrieval_00009,https://pubmed.ncbi.nlm.nih.gov/23860750/,A genome-wide supported variant in CACNA1C influences hippocampal activation during episodic memory encoding and retrieval.,"Krug A, Witt SH, Backes H, Dietsche B, Nieratschker V, Shah NJ, Nothen MM, Rietschel M, Kircher T",European archives of psychiatry and clinical neuroscience,0.331,23860750,-1,-1
encoding retrieval_00010,https://pubmed.ncbi.nlm.nih.gov/12821520/,Dissociating atrophy and hypometabolism impact on episodic memory in mild cognitive impairment.,"Chetelat G, Desgranges B, de la Sayette V, Viader F, Berkouk K, Landeau B, Lalevee C, Le Doze F, Dupuy B, Hannequin D, Baron JC, Eustache F",Brain : a journal of neurology,0.312,12821520,-1,-1
encoding retrieval_00011,https://pubmed.ncbi.nlm.nih.gov/29217684/,Retrieval Demands Adaptively Change Striatal Old/New Signals and Boost Subsequent Long-Term Memory.,"Herweg NA, Sommer T, Bunzeck N",The Journal of neuroscience : the official journal of the Society for Neuroscience,0.307,29217684,-1,-1
encoding retrieval_00012,https://pubmed.ncbi.nlm.nih.gov/27923474/,Recapitulation of emotional source context during memory retrieval.,"Bowen HJ, Kensinger EA",Cortex; a journal devoted to the study of the nervous system and behavior,0.306,27923474,-1,-1
encoding retrieval_00013,https://pubmed.ncbi.nlm.nih.gov/27311641/,Changes in the modulation of brain activity during context encoding vs. context retrieval across the adult lifespan.,"Ankudowich E, Pasvanis S, Rajah MN",NeuroImage,0.299,27311641,-1,-1
encoding retrieval_00014,https://pubmed.ncbi.nlm.nih.gov/20399796/,Increased neural activation during picture encoding and retrieval in 60-year-olds compared to 20-year-olds.,"Burgmans S, van Boxtel MP, Vuurman EF, Evers EA, Jolles J",Neuropsychologia,0.289,20399796,-1,-1
encoding retrieval_00015,https://pubmed.ncbi.nlm.nih.gov/22238671/,The neural substrates of memory suppression: a FMRI exploration of directed forgetting.,"Bastin C, Feyers D, Majerus S, Balteau E, Degueldre C, Luxen A, Maquet P, Salmon E, Collette F",PloS one,0.285,22238671,-1,-1
encoding retrieval_00016,https://pubmed.ncbi.nlm.nih.gov/21935483/,The effect of negative and positive emotionality on associative memory: an FMRI study.,"Okada G, Okamoto Y, Kunisato Y, Aoyama S, Nishiyama Y, Yoshimura S, Onoda K, Toki S, Yamashita H, Yamawaki S",PloS one,0.269,21935483,-1,-1
encoding retrieval_00017,https://pubmed.ncbi.nlm.nih.gov/18455740/,Orbitofrontal and hippocampal contributions to memory for face-name associations: the rewarding power of a smile.,"Tsukiura T, Cabeza R",Neuropsychologia,0.264,18455740,-1,-1
encoding retrieval_00018,https://pubmed.ncbi.nlm.nih.gov/20036336/,The effect of Neuregulin 1 on neural correlates of episodic memory encoding and retrieval.,"Krug A, Markov V, Krach S, Jansen A, Zerres K, Eggermann T, Stocker T, Shah NJ, Nothen MM, Treutlein J, Rietschel M, Kircher T",NeuroImage,0.26,20036336,-1,-1
encoding retrieval_00019,https://pubmed.ncbi.nlm.nih.gov/15689557/,Neural correlates of relational memory: successful encoding and retrieval of semantic and perceptual associations.,"Prince SE, Daselaar SM, Cabeza R",The Journal of neuroscience : the official journal of the Society for Neuroscience,0.255,15689557,-1,-1
encoding retrieval_00020,https://pubmed.ncbi.nlm.nih.gov/10666559/,Functional asymmetry of human prefrontal cortex in verbal and non-verbal episodic memory as revealed by fMRI.,"Iidaka T, Sadato N, Yamada H, Yonekura Y",Brain research. Cognitive brain research,0.253,10666559,-1,-1
encoding retrieval_00021,https://pubmed.ncbi.nlm.nih.gov/19925208/,Neural mechanisms of context effects on face recognition: automatic binding and context shift decrements.,"Hayes SM, Baena E, Truong TK, Cabeza R",Journal of cognitive neuroscience,0.233,19925208,10.1162/jocn.2009.21379,-1
encoding retrieval_00022,https://pubmed.ncbi.nlm.nih.gov/23384193/,The encoding/retrieval flip: interactions between memory performance and memory stage and relationship to intrinsic cortical networks.,"Huijbers W, Schultz AP, Vannini P, McLaren DG, Wigman SE, Ward AM, Hedden T, Sperling RA",Journal of cognitive neuroscience,0.231,23384193,10.1162/jocn_a_00366,-1
encoding retrieval_00023,https://pubmed.ncbi.nlm.nih.gov/17150375/,Reactivation of medial temporal lobe and occipital lobe during the retrieval of color information: A positron emission tomography study.,"Ueno A, Abe N, Suzuki M, Hirayama K, Mori E, Tashiro M, Itoh M, Fujii T",NeuroImage,0.23,17150375,-1,-1
encoding retrieval_00024,https://pubmed.ncbi.nlm.nih.gov/25313659/,Reinstatement of individual past events revealed by the similarity of distributed activation patterns during encoding and retrieval.,"Wing EA, Ritchey M, Cabeza R",Journal of cognitive neuroscience,0.228,25313659,-1,-1
encoding retrieval_00025,https://pubmed.ncbi.nlm.nih.gov/19647800/,Overlapping brain activity between episodic memory encoding and retrieval: roles  of the task-positive and task-negative networks.,"Kim H, Daselaar SM, Cabeza R",NeuroImage,0.227,19647800,-1,-1
encoding retrieval_00026,https://pubmed.ncbi.nlm.nih.gov/18437279/,Anterior hippocampus orchestrates successful encoding and retrieval of non-relational memory: an event-related fMRI study.,"Kircher T, Weis S, Leube D, Freymann K, Erb M, Jessen F, Grodd W, Heun R, Krach S",European archives of psychiatry and clinical neuroscience,0.226,18437279,-1,-1
encoding retrieval_00027,https://pubmed.ncbi.nlm.nih.gov/21736451/,Similarity between brain activity at encoding and retrieval predicts successful realization of delayed intentions.,"Gilbert SJ, Armbruster DJ, Panagiotidi M",Journal of cognitive neuroscience,0.222,21736451,-1,-1
encoding retrieval_00028,https://pubmed.ncbi.nlm.nih.gov/14689505/,fMRI differences in encoding and retrieval of pictures due to encoding strategy in the elderly.,"Mandzia JL, Black SE, McAndrews MP, Grady C, Graham S",Human brain mapping,0.22,14689505,-1,-1
encoding retrieval_00029,https://pubmed.ncbi.nlm.nih.gov/18823239/,Age-related alterations in simple declarative memory and the effect of negative stimulus valence.,"Murty VP, Sambataro F, Das S, Tan HY, Callicott JH, Goldberg TE, Meyer-Lindenberg A, Weinberger DR, Mattay VS",Journal of cognitive neuroscience,0.22,18823239,-1,-1
encoding retrieval_00030,https://pubmed.ncbi.nlm.nih.gov/16503328/,A functional magnetic resonance imaging study of working memory abnormalities in  schizophrenia.,"Johnson MR, Morris NA, Astur RS, Calhoun VD, Mathalon DH, Kiehl KA, Pearlson GD",Biological psychiatry,0.214,16503328,-1,-1
encoding retrieval_00031,https://pubmed.ncbi.nlm.nih.gov/15537676/,Ketamine disrupts frontal and hippocampal contribution to encoding and retrieval  of episodic memory: an fMRI study.,"Honey GD, Honey RA, O'Loughlin C, Sharar SR, Kumaran D, Suckling J, Menon DK, Sleator C, Bullmore ET, Fletcher PC","Cerebral cortex (New York, N.Y. : 1991)",0.213,15537676,-1,-1
encoding retrieval_00032,https://pubmed.ncbi.nlm.nih.gov/15177789/,Genes and memory: the neuroanatomical correlates of emotional memory in monozygotic twin discordant for schizophrenia.,"Fahim C, Stip E, Mancini-Marie A, Beauregard M",Brain and cognition,0.21,15177789,-1,-1
encoding retrieval_00033,https://pubmed.ncbi.nlm.nih.gov/24608131/,Brain activity and functional coupling changes associated with self-reference effect during both encoding and retrieval.,"Morel N, Villain N, Rauchs G, Gaubert M, Piolino P, Landeau B, Mezenge F, Desgranges B, Eustache F, Chetelat G",PloS one,0.202,24608131,-1,-1
encoding retrieval_00034,https://pubmed.ncbi.nlm.nih.gov/24427267/,The route to an integrative associative memory is influenced by emotion.,"Murray BD, Kensinger EA",PloS one,0.195,24427267,-1,-1
encoding retrieval_00035,https://pubmed.ncbi.nlm.nih.gov/23149036/,Altered brain function underlying verbal memory encoding and retrieval in psychotic major depression.,"Kelley R, Garrett A, Cohen J, Gomez R, Lembke A, Keller J, Reiss AL, Schatzberg A",Psychiatry research,0.191,23149036,-1,-1
encoding retrieval_00036,https://pubmed.ncbi.nlm.nih.gov/20363808/,What goes down must come up: role of the posteromedial cortices in encoding and retrieval.,"Vannini P, O'Brien J, O'Keefe K, Pihlajamaki M, Laviolette P, Sperling RA","Cerebral cortex (New York, N.Y. : 1991)",0.188,20363808,10.1093/cercor/bhq051,-1
encoding retrieval_00037,https://pubmed.ncbi.nlm.nih.gov/19837178/,Dissociable neural circuits for encoding and retrieval of object locations during active navigation in humans.,"Baumann O, Chan E, Mattingley JB",NeuroImage,0.186,19837178,10.1016/j.neuroimage.2009.10.021,-1
encoding retrieval_00038,https://pubmed.ncbi.nlm.nih.gov/20005295/,The effect of G72 genotype on neural correlates of memory encoding and retrieval.,"Jansen A, Krach S, Krug A, Markov V, Thimm M, Paulus FM, Zerres K, Stocker T, Shah NJ, Nothen MM, Treutlein J, Rietschel M, Kircher T",NeuroImage,0.186,20005295,-1,-1
encoding retrieval_00039,https://pubmed.ncbi.nlm.nih.gov/19621369/,The impact of dystrobrevin-binding protein 1 (DTNBP1) on neural correlates of episodic memory encoding and retrieval.,"Thimm M, Krug A, Markov V, Krach S, Jansen A, Zerres K, Eggermann T, Stocker T, Shah NJ, Nothen MM, Rietschel M, Kircher T",Human brain mapping,0.182,19621369,-1,-1
encoding retrieval_00040,https://pubmed.ncbi.nlm.nih.gov/20097294/,The brain-derived neurotrophic factor Val66Met polymorphism affects memory formation and retrieval of biologically salient stimuli.,"van Wingen G, Rijpkema M, Franke B, van Eijndhoven P, Tendolkar I, Verkes RJ, Buitelaar J, Fernandez G",NeuroImage,0.176,20097294,-1,-1
encoding retrieval_00041,https://pubmed.ncbi.nlm.nih.gov/20079444/,Functional neural networks underlying semantic encoding of associative memories.,"Crespo-Garcia M, Cantero JL, Pomyalov A, Boccaletti S, Atienza M",NeuroImage,0.171,20079444,-1,-1
encoding retrieval_00042,https://pubmed.ncbi.nlm.nih.gov/29040763/,Oxytocin effects on self-referential processing: behavioral and neuroimaging evidence.,"Liu Y, Wu B, Wang X, Li W, Zhang T, Wu X, Han S",Social cognitive and affective neuroscience,0.16,29040763,-1,-1
encoding retrieval_00043,https://pubmed.ncbi.nlm.nih.gov/28733247/,Effective connectivity during successful and unsuccessful recollection in young and old adults.,"Cansino S, Trejo-Morales P, Estrada-Manilla C, Pasaye-Alcaraz EH, Aguilar-Castaneda E, Salgado-Lujambio P, Sosa-Ortiz AL",Neuropsychologia,0.158,28733247,-1,-1
encoding retrieval_00044,https://pubmed.ncbi.nlm.nih.gov/16497521/,Task-induced deactivations during successful paired associates learning: an effect of age but not Alzheimer's disease.,"Gould RL, Brown RG, Owen AM, Bullmore ET, Howard RJ",NeuroImage,0.157,16497521,-1,-1
encoding retrieval_00045,https://pubmed.ncbi.nlm.nih.gov/17916334/,Regional specificity and practice: dynamic changes in object and spatial working  memory.,"Landau SM, Garavan H, Schumacher EH, D'Esposito M",Brain research,0.153,17916334,-1,-1
encoding retrieval_00046,https://pubmed.ncbi.nlm.nih.gov/12477696/,Neuroanatomical correlates of episodic encoding and retrieval in young and elderly subjects.,"Daselaar SM, Veltman DJ, Rombouts SA, Raaijmakers JG, Jonker C",Brain : a journal of neurology,0.151,12477696,-1,-1
encoding retrieval_00047,https://pubmed.ncbi.nlm.nih.gov/20060480/,Neural correlates of episodic retrieval: an fMRI study of the part-list cueing effect.,"Crescentini C, Shallice T, Del Missier F, Macaluso E",NeuroImage,0.149,20060480,-1,-1
encoding retrieval_00048,https://pubmed.ncbi.nlm.nih.gov/18675364/,Testosterone biases automatic memory processes in women towards potential mates.,"van Wingen G, Mattern C, Verkes RJ, Buitelaar J, Fernandez G",NeuroImage,0.143,18675364,-1,-1
encoding retrieval_00049,https://pubmed.ncbi.nlm.nih.gov/26458520/,Patterns of effective connectivity during memory encoding and retrieval differ between patients with mild cognitive impairment and healthy older adults.,"Hampstead BM, Khoshnoodi M, Yan W, Deshpande G, Sathian K",NeuroImage,0.141,26458520,-1,-1
encoding retrieval_00050,https://pubmed.ncbi.nlm.nih.gov/15275903/,Recognition memory for studied words is determined by cortical activation differences at encoding but not during retrieval.,"Chee MW, Goh JO, Lim Y, Graham S, Lee K",NeuroImage,0.138,15275903,-1,-1
encoding retrieval_00051,https://pubmed.ncbi.nlm.nih.gov/17360900/,Erythropoietin enhances hippocampal response during memory retrieval in humans.,"Miskowiak K, O'Sullivan U, Harmer CJ",The Journal of neuroscience : the official journal of the Society for Neuroscience,0.135,17360900,-1,-1
encoding retrieval_00052,https://pubmed.ncbi.nlm.nih.gov/23435209/,The role of the thalamic nuclei in recognition memory accompanied by recall during encoding and retrieval: an fMRI study.,"Pergola G, Ranft A, Mathias K, Suchan B",NeuroImage,0.134,23435209,10.1016/j.neuroimage.2013.02.017,-1
encoding retrieval_00053,https://pubmed.ncbi.nlm.nih.gov/24394347/,Imaging early consolidation of perceptual learning with face stimuli during rest.,"Vilsten JS, Mundy ME",Brain and cognition,0.132,24394347,10.1016/j.bandc.2013.12.005,-1
encoding retrieval_00054,https://pubmed.ncbi.nlm.nih.gov/17123836/,Diffusion tensor studies dissociated two fronto-temporal pathways in the human memory system.,"Takahashi E, Ohki K, Kim DS",NeuroImage,0.13,17123836,10.1016/j.neuroimage.2006.10.009,-1
encoding retrieval_00055,https://pubmed.ncbi.nlm.nih.gov/25960314/,The dorsal prefrontal and dorsal anterior cingulate cortices exert complementary  network signatures during encoding and retrieval in associative memory.,"Woodcock EA, White R, Diwadkar VA",Behavioural brain research,0.129,25960314,10.1016/j.bbr.2015.04.050,-1
encoding retrieval_00056,https://pubmed.ncbi.nlm.nih.gov/25465313/,Consolidation time affects performance and neural activity during visual working  memory.,"Knochel C, Oertel-Knochel V, Bittner R, Stablein M, Heselhaus V, Prvulovic D, Fusser F, Karakaya T, Pantel J, Maurer K, Linden DE",Psychiatry research,0.128,25465313,-1,-1
encoding retrieval_00057,https://pubmed.ncbi.nlm.nih.gov/21568643/,Functional imaging reveals working memory and attention interact to produce the attentional blink.,"Johnston SJ, Linden DE, Shapiro KL",Journal of cognitive neuroscience,0.125,21568643,-1,-1
encoding retrieval_00058,https://pubmed.ncbi.nlm.nih.gov/15275916/,Distributed self in episodic memory: neural correlates of successful retrieval of self-encoded positive and negative personality traits.,"Fossati P, Hevenor SJ, Lepage M, Graham SJ, Grady C, Keightley ML, Craik F, Mayberg H",NeuroImage,0.123,15275916,-1,-1
encoding retrieval_00059,https://pubmed.ncbi.nlm.nih.gov/23274842/,Selective role of lingual/parahippocampal gyrus and retrosplenial complex in spatial memory across viewpoint changes relative to the environmental reference frame.,"Sulpizio V, Committeri G, Lambrey S, Berthoz A, Galati G",Behavioural brain research,0.119,23274842,-1,-1
encoding retrieval_00060,https://pubmed.ncbi.nlm.nih.gov/24296331/,Differential effects of the ApoE4 genotype on brain structure and function.,"Matura S, Prvulovic D, Jurcoane A, Hartmann D, Miller J, Scheibe M, O'Dwyer L, Oertel-Knochel V, Knochel C, Reinke B, Karakaya T, Fusser F, Pantel J",NeuroImage,0.117,24296331,-1,-1
encoding retrieval_00061,https://pubmed.ncbi.nlm.nih.gov/15854792/,Emotional memory: separating content and context.,"Medford N, Phillips ML, Brierley B, Brammer M, Bullmore ET, David AS",Psychiatry research,0.114,15854792,-1,-1
encoding retrieval_00062,https://pubmed.ncbi.nlm.nih.gov/19429863/,Neural signatures of stimulus features in visual working memory--a spatiotemporal approach.,"Morgan HM, Jackson MC, Klein C, Mohr H, Shapiro KL, Linden DE","Cerebral cortex (New York, N.Y. : 1991)",0.114,19429863,-1,-1
encoding retrieval_00063,https://pubmed.ncbi.nlm.nih.gov/16476669/,The dynamics of hippocampal activation during encoding of overlapping sequences.,"Kumaran D, Maguire EA",Neuron,0.112,16476669,-1,-1
encoding retrieval_00064,https://pubmed.ncbi.nlm.nih.gov/28871031/,Angular Gyrus Involvement at Encoding and Retrieval Is Associated with Durable But Less Specific Memories.,"van der Linden M, Berkers RMWJ, Morris RGM, Fernandez G",The Journal of neuroscience : the official journal of the Society for Neuroscience,0.111,28871031,-1,-1
encoding retrieval_00065,https://pubmed.ncbi.nlm.nih.gov/15982902/,The role of precuneus and left inferior frontal cortex during source memory episodic retrieval.,"Lundstrom BN, Ingvar M, Petersson KM",NeuroImage,0.109,15982902,-1,-1
encoding retrieval_00066,https://pubmed.ncbi.nlm.nih.gov/25064431/,Neural reinstatement and the amount of information recollected.,"Leiker EK, Johnson JD",Brain research,0.108,25064431,-1,-1
encoding retrieval_00067,https://pubmed.ncbi.nlm.nih.gov/27745847/,The parietal memory network activates similarly for true and associative false recognition elicited via the DRM procedure.,"McDermott KB, Gilmore AW, Nelson SM, Watson JM, Ojemann JG",Cortex; a journal devoted to the study of the nervous system and behavior,0.107,27745847,-1,-1
encoding retrieval_00068,https://pubmed.ncbi.nlm.nih.gov/19641018/,COMT val108/158 met genotype affects neural but not cognitive processing in healthy individuals.,"Dennis NA, Need AC, LaBar KS, Waters-Metenier S, Cirulli ET, Kragel J, Goldstein DB, Cabeza R","Cerebral cortex (New York, N.Y. : 1991)",0.105,19641018,-1,-1
encoding retrieval_00069,https://pubmed.ncbi.nlm.nih.gov/21898674/,Functional adaptive changes within the hippocampal memory system of patients with multiple sclerosis.,"Hulst HE, Schoonheim MM, Roosendaal SD, Popescu V, Schweren LJ, van der Werf YD, Visser LH, Polman CH, Barkhof F, Geurts JJ",Human brain mapping,0.105,21898674,-1,-1
encoding retrieval_00070,https://pubmed.ncbi.nlm.nih.gov/22197786/,Neuronal correlates of reduced memory performance in overweight subjects.,"Stingl KT, Kullmann S, Ketterer C, Heni M, Haring HU, Fritsche A, Preissl H",NeuroImage,0.105,22197786,-1,-1
encoding retrieval_00071,https://pubmed.ncbi.nlm.nih.gov/17905481/,Ageing-related changes of neural activity associated with spatial contextual memory.,"Kukolja J, Thiel CM, Wilms M, Mirzazade S, Fink GR",Neurobiology of aging,0.104,17905481,10.1016/j.neurobiolaging.2007.08.015,-1
encoding retrieval_00072,https://pubmed.ncbi.nlm.nih.gov/20039023/,Functional abnormalities in normally appearing athletes following mild traumatic  brain injury: a functional MRI study.,"Slobounov SM, Zhang K, Pennell D, Ray W, Johnson B, Sebastianelli W",Experimental brain research,0.099,20039023,10.1007/s00221-009-2141-6,-1
encoding retrieval_00073,https://pubmed.ncbi.nlm.nih.gov/20164353/,Hippocampal gamma oscillations increase with memory load.,"van Vugt MK, Schulze-Bonhage A, Litt B, Brandt A, Kahana MJ",The Journal of neuroscience : the official journal of the Society for Neuroscience,0.098,20164353,-1,-1
encoding retrieval_00074,https://pubmed.ncbi.nlm.nih.gov/22159123/,First-pass selectivity for semantic categories in human anteroventral temporal lobe.,"Chan AM, Baker JM, Eskandar E, Schomer D, Ulbert I, Marinkovic K, Cash SS, Halgren E",The Journal of neuroscience : the official journal of the Society for Neuroscience,0.098,22159123,-1,-1
encoding retrieval_00075,https://pubmed.ncbi.nlm.nih.gov/17572110/,Negative words enhance recognition in nonclinical high dissociators: An fMRI study.,"de Ruiter MB, Veltman DJ, Phaf RH, van Dyck R",NeuroImage,0.096,17572110,-1,-1
encoding retrieval_00076,https://pubmed.ncbi.nlm.nih.gov/14568470/,fMRI BOLD response to increasing task difficulty during successful paired associates learning.,"Gould RL, Brown RG, Owen AM, ffytche DH, Howard RJ",NeuroImage,0.094,14568470,-1,-1
encoding retrieval_00077,https://pubmed.ncbi.nlm.nih.gov/16480749/,fMRI correlates of retrieval orientation.,"Hornberger M, Rugg MD, Henson RN",Neuropsychologia,0.094,16480749,-1,-1
encoding retrieval_00078,https://pubmed.ncbi.nlm.nih.gov/19346000/,Functional MRI study of memory-related brain regions in patients with depressive  disorder.,"Werner NS, Meindl T, Materne J, Engel RR, Huber D, Riedel M, Reiser M, Hennig-Fast K",Journal of affective disorders,0.094,19346000,-1,-1
encoding retrieval_00079,https://pubmed.ncbi.nlm.nih.gov/19553452/,Cholinergic stimulation enhances neural activity associated with encoding but reduces neural activity associated with retrieval in humans.,"Kukolja J, Thiel CM, Fink GR",The Journal of neuroscience : the official journal of the Society for Neuroscience,0.092,19553452,-1,-1
encoding retrieval_00080,https://pubmed.ncbi.nlm.nih.gov/20060911/,COMT genotype and its role on hippocampal-prefrontal regions in declarative memory.,"Krach S, Jansen A, Krug A, Markov V, Thimm M, Sheldrick AJ, Eggermann T, Zerres K, Stocker T, Shah NJ, Kircher T",NeuroImage,0.092,20060911,-1,-1
encoding retrieval_00081,https://pubmed.ncbi.nlm.nih.gov/22609273/,fMRI-activation during drawing a naturalistic or sketchy portrait.,"Schaer K, Jahn G, Lotze M",Behavioural brain research,0.092,22609273,-1,-1
encoding retrieval_00082,https://pubmed.ncbi.nlm.nih.gov/19925207/,The commonality of neural networks for verbal and visual short-term memory.,"Majerus S, D'Argembeau A, Martinez Perez T, Belayachi S, Van der Linden M, Collette F, Salmon E, Seurinck R, Fias W, Maquet P",Journal of cognitive neuroscience,0.091,19925207,-1,-1
encoding retrieval_00083,https://pubmed.ncbi.nlm.nih.gov/27713000/,Overlapping effects of age on associative memory and the anterior hippocampus from middle to older age.,"Nordin K, Herlitz A, Larsson EM, Soderlund H",Behavioural brain research,0.091,27713000,-1,-1
encoding retrieval_00084,https://pubmed.ncbi.nlm.nih.gov/16624583/,Dissociable contributions of the mid-ventrolateral frontal cortex and the medial  temporal lobe system to human memory.,"Dove A, Brett M, Cusack R, Owen AM",NeuroImage,0.09,16624583,-1,-1
encoding retrieval_00085,https://pubmed.ncbi.nlm.nih.gov/19350561/,Dissociating networks of imitation.,"Menz MM, McNamara A, Klemen J, Binkofski F",Human brain mapping,0.09,19350561,-1,-1
encoding retrieval_00086,https://pubmed.ncbi.nlm.nih.gov/19395526/,An fMRI study of functional abnormalities in the verbal working memory system and the relationship to clinical symptoms in chronic schizophrenia.,"Hashimoto R, Lee K, Preus A, McCarley RW, Wible CG","Cerebral cortex (New York, N.Y. : 1991)",0.089,19395526,-1,-1
encoding retrieval_00087,https://pubmed.ncbi.nlm.nih.gov/16513369/,Acute tryptophan depletion reduces activation in the right hippocampus during encoding in an episodic memory task.,"van der Veen FM, Evers EA, van Deursen JA, Deutz NE, Backes WH, Schmitt JA",NeuroImage,0.088,16513369,-1,-1
encoding retrieval_00088,https://pubmed.ncbi.nlm.nih.gov/24564467/,Brain mechanisms of successful recognition through retrieval of semantic context.,"Flegal KE, Marin-Gutierrez A, Ragland JD, Ranganath C",Journal of cognitive neuroscience,0.088,24564467,-1,-1
encoding retrieval_00089,https://pubmed.ncbi.nlm.nih.gov/17936858/,The anatomical bases of semantic retrieval deficits in early Alzheimer's disease.,"Venneri A, McGeown WJ, Hietanen HM, Guerrini C, Ellis AW, Shanks MF",Neuropsychologia,0.087,17936858,-1,-1
