paper_name,paper_url,Title,Author,Journal,Loading,PMID,Doi,download_status
encoding retrieval_00090,https://pubmed.ncbi.nlm.nih.gov/19492301/,Test-retest reliability of fMRI verbal episodic memory paradigms in healthy older adults and in persons with mild cognitive impairment.,"Clement F, Belleville S",Human brain mapping,0.087,19492301,-1,-1
encoding retrieval_00091,https://pubmed.ncbi.nlm.nih.gov/28704424/,Examining distinct working memory processes in children and adolescents using fMRI: Results and validation of a modified Brown-Peterson paradigm.,"Siffredi V, Barrouillet P, Spencer-Smith M, Vaessen M, Anderson V, Vuilleumier P",PloS one,0.087,28704424,10.1371/journal.pone.0179959,-1
encoding retrieval_00092,https://pubmed.ncbi.nlm.nih.gov/18704371/,Increased cortisol levels in cognitively challenging situations are beneficial in young but not older subjects.,"Kukolja J, Thiel CM, Wolf OT, Fink GR",Psychopharmacology,0.086,18704371,10.1007/s00213-008-1275-8,-1
encoding retrieval_00093,https://pubmed.ncbi.nlm.nih.gov/19028382/,Abnormal functional connectivity of hippocampus during episodic memory retrieval  processing network in amnestic mild cognitive impairment.,"Bai F, Zhang Z, Watson DR, Yu H, Shi Y, Yuan Y, Zang Y, Zhu C, Qian Y",Biological psychiatry,0.086,19028382,10.1016/j.biopsych.2008.10.017,-1
encoding retrieval_00094,https://pubmed.ncbi.nlm.nih.gov/22992490/,Brain activation patterns during visual episodic memory processing among first-degree relatives of schizophrenia subjects.,"Stolz E, Pancholi KM, Goradia DD, Paul S, Keshavan MS, Nimgaonkar VL, Prasad KM",NeuroImage,0.086,22992490,-1,-1
encoding retrieval_00095,https://pubmed.ncbi.nlm.nih.gov/20012682/,The neural bases of word encoding and retrieval: A fMRI-guided transcranial magnetic stimulation study.,"Manenti R, Tettamanti M, Cotelli M, Miniussi C, Cappa SF",Brain topography,0.085,20012682,-1,-1
encoding retrieval_00096,https://pubmed.ncbi.nlm.nih.gov/20797401/,Equivalent activation of the hippocampus by face-face and face-laugh paired associate learning and recognition.,"Holdstock JS, Crane J, Bachorowski JA, Milner B",Neuropsychologia,0.085,20797401,-1,-1
encoding retrieval_00097,https://pubmed.ncbi.nlm.nih.gov/22940117/,The different faces of one's self: an fMRI study into the recognition of current  and past self-facial appearances.,"Apps MA, Tajadura-Jimenez A, Turley G, Tsakiris M",NeuroImage,0.085,22940117,-1,-1
encoding retrieval_00098,https://pubmed.ncbi.nlm.nih.gov/23542499/,Altered brain structure in Chinese dyslexic children.,"Liu L, You W, Wang W, Guo X, Peng D, Booth J",Neuropsychologia,0.085,23542499,-1,-1
encoding retrieval_00099,https://pubmed.ncbi.nlm.nih.gov/15850740/,Hippocampal activations during encoding and retrieval in a verbal working memory  paradigm.,"Karlsgodt KH, Shirinyan D, van Erp TG, Cohen MS, Cannon TD",NeuroImage,0.084,15850740,-1,-1
encoding retrieval_00100,https://pubmed.ncbi.nlm.nih.gov/19683225/,Functional neuroanatomy of the encoding and retrieval processes of verbal episodic memory in MCI.,"Clement F, Belleville S, Mellah S",Cortex; a journal devoted to the study of the nervous system and behavior,0.084,19683225,-1,-1
encoding retrieval_00101,https://pubmed.ncbi.nlm.nih.gov/24639328/,Altered neural function during episodic memory encoding and retrieval in major depression.,"Dietsche B, Backes H, Stratmann M, Konrad C, Kircher T, Krug A",Human brain mapping,0.084,24639328,-1,-1
encoding retrieval_00102,https://pubmed.ncbi.nlm.nih.gov/24936431/,Prefrontal responses to digit span memory phases in patients with post-traumatic  stress disorder (PTSD): a functional near infrared spectroscopy study.,"Tian F, Yennu A, Smith-Osborne A, Gonzalez-Lima F, North CS, Liu H",NeuroImage. Clinical,0.084,24936431,-1,-1
encoding retrieval_00103,https://pubmed.ncbi.nlm.nih.gov/15992522/,The influence of encoding strategy on episodic memory and cortical activity in schizophrenia.,"Bonner-Jackson A, Haut K, Csernansky JG, Barch DM",Biological psychiatry,0.083,15992522,-1,-1
encoding retrieval_00104,https://pubmed.ncbi.nlm.nih.gov/23962957/,Richness of information about novel words influences how episodic and semantic memory networks interact during lexicalization.,"Takashima A, Bakker I, van Hell JG, Janzen G, McQueen JM",NeuroImage,0.083,23962957,-1,-1
encoding retrieval_00105,https://pubmed.ncbi.nlm.nih.gov/24800631/,Aging Affects the Interaction between Attentional Control and Source Memory: An fMRI Study.,"Dulas MR, Duarte A",Journal of cognitive neuroscience,0.083,24800631,-1,-1
encoding retrieval_00106,https://pubmed.ncbi.nlm.nih.gov/19129391/,Distinct memory signatures in the hippocampus: intentional States distinguish match and mismatch enhancement signals.,"Duncan K, Curtis C, Davachi L",The Journal of neuroscience : the official journal of the Society for Neuroscience,0.082,19129391,-1,-1
encoding retrieval_00107,https://pubmed.ncbi.nlm.nih.gov/21494597/,The hippocampus is coupled with the default network during memory retrieval but not during memory encoding.,"Huijbers W, Pennartz CM, Cabeza R, Daselaar SM",PloS one,0.082,21494597,-1,-1
encoding retrieval_00108,https://pubmed.ncbi.nlm.nih.gov/26845110/,Assessing the Neural Correlates of Task-unrelated Thoughts during Episodic Encoding and Their Association with Subsequent Memory in Young and Older Adults.,"Maillet D, Rajah MN",Journal of cognitive neuroscience,0.082,26845110,-1,-1
encoding retrieval_00109,https://pubmed.ncbi.nlm.nih.gov/15820629/,"An event-related fMRI study of the neural networks underlying the encoding, maintenance, and retrieval phase in a delayed-match-to-sample task.","Habeck C, Rakitin BC, Moeller J, Scarmeas N, Zarahn E, Brown T, Stern Y",Brain research. Cognitive brain research,0.081,15820629,-1,-1
encoding retrieval_00110,https://pubmed.ncbi.nlm.nih.gov/26076024/,Temporal and Motor Representation of Rhythm in Fronto-Parietal Cortical Areas: An fMRI Study.,"Konoike N, Kotozaki Y, Jeong H, Miyazaki A, Sakaki K, Shinada T, Sugiura M, Kawashima R, Nakamura K",PloS one,0.081,26076024,-1,-1
encoding retrieval_00111,https://pubmed.ncbi.nlm.nih.gov/15537894/,"Cortical areas involved in object, background, and object-background processing revealed with functional magnetic resonance adaptation.","Goh JO, Siong SC, Park D, Gutchess A, Hebrank A, Chee MW",The Journal of neuroscience : the official journal of the Society for Neuroscience,0.079,15537894,10.1523/JNEUROSCI.3373-04.2004,-1
encoding retrieval_00112,https://pubmed.ncbi.nlm.nih.gov/12725759/,Feeling-of-knowing in episodic memory: an event-related fMRI study.,"Maril A, Simons JS, Mitchell JP, Schwartz BL, Schacter DL",NeuroImage,0.077,12725759,10.1016/s1053-8119(03)00014-4,-1
encoding retrieval_00113,https://pubmed.ncbi.nlm.nih.gov/22854261/,Bilateral basal ganglia activity in verbal working memory.,"Moore AB, Li Z, Tyner CE, Hu X, Crosson B",Brain and language,0.077,22854261,10.1016/j.bandl.2012.05.003,-1
encoding retrieval_00114,https://pubmed.ncbi.nlm.nih.gov/22119654/,Role of hippocampal CA1 atrophy in memory encoding deficits in amnestic Mild Cognitive Impairment.,"Fouquet M, Desgranges B, La Joie R, Riviere D, Mangin JF, Landeau B, Mezenge F, Pelerin A, de La Sayette V, Viader F, Baron JC, Eustache F, Chetelat G",NeuroImage,0.076,22119654,10.1016/j.neuroimage.2011.11.036,-1
encoding retrieval_00115,https://pubmed.ncbi.nlm.nih.gov/24009565/,The Effect of Retrieval Focus and Emotional Valence on the Medial Temporal Lobe Activity during Autobiographical Recollection.,"Denkova E, Dolcos S, Dolcos F",Frontiers in behavioral neuroscience,0.074,24009565,-1,-1
encoding retrieval_00116,https://pubmed.ncbi.nlm.nih.gov/27335409/,Neural Global Pattern Similarity Underlies True and False Memories.,"Ye Z, Zhu B, Zhuang L, Lu Z, Chen C, Xue G",The Journal of neuroscience : the official journal of the Society for Neuroscience,0.072,27335409,-1,-1
encoding retrieval_00117,https://pubmed.ncbi.nlm.nih.gov/21145314/,Stimulus content and the neural correlates of source memory.,"Duarte A, Henson RN, Graham KS",Brain research,0.071,21145314,-1,-1
encoding retrieval_00118,https://pubmed.ncbi.nlm.nih.gov/27018483/,Cortical pattern separation and item-specific memory encoding.,"Pidgeon LM, Morcom AM",Neuropsychologia,0.068,27018483,-1,-1
encoding retrieval_00119,https://pubmed.ncbi.nlm.nih.gov/21048124/,Flexible memories: differential roles for medial temporal lobe and prefrontal cortex in cross-episode binding.,"Zeithamova D, Preston AR",The Journal of neuroscience : the official journal of the Society for Neuroscience,0.063,21048124,-1,-1
encoding retrieval_00120,https://pubmed.ncbi.nlm.nih.gov/25826338/,Hippocampus is place of interaction between unconscious and conscious memories.,"Zust MA, Colella P, Reber TP, Vuilleumier P, Hauf M, Ruch S, Henke K",PloS one,0.062,25826338,-1,-1
encoding retrieval_00121,https://pubmed.ncbi.nlm.nih.gov/21427462/,Training-related brain plasticity in subjects at risk of developing Alzheimer's disease.,"Belleville S, Clement F, Mellah S, Gilbert B, Fontaine F, Gauthier S",Brain : a journal of neurology,0.057,21427462,-1,-1
encoding retrieval_00122,https://pubmed.ncbi.nlm.nih.gov/23593393/,The BDNF Val66Met polymorphism has opposite effects on memory circuits of multiple sclerosis patients and controls.,"Fera F, Passamonti L, Cerasa A, Gioia MC, Liguori M, Manna I, Valentino P, Quattrone A",PloS one,0.056,23593393,-1,-1
encoding retrieval_00123,https://pubmed.ncbi.nlm.nih.gov/19433442/,The neural correlates of verbal short-term memory in Alzheimer's disease: an fMRI study.,"Peters F, Collette F, Degueldre C, Sterpenich V, Majerus S, Salmon E",Brain : a journal of neurology,0.055,19433442,-1,-1
encoding retrieval_00124,https://pubmed.ncbi.nlm.nih.gov/16861011/,The effect of word concreteness on recognition memory.,"Fliessbach K, Weis S, Klaver P, Elger CE, Weber B",NeuroImage,0.05,16861011,-1,-1
