paper_name,paper_url,Title,Author,Journal,Loading,PMID,Doi,download_status
fronto parietal_00284,https://pubmed.ncbi.nlm.nih.gov/26311607/,Complex sensorimotor transformation processes required for response selection are facilitated by the striatum.,"Stock AK, Ness V, Beste C",NeuroImage,0.069,26311607,-1,-1
fronto parietal_00285,https://pubmed.ncbi.nlm.nih.gov/26685089/,Let the man choose what to do: Neural correlates of spontaneous lying and truth-telling.,"Yin L, Reuter M, Weber B",Brain and cognition,0.069,26685089,-1,-1
fronto parietal_00286,https://pubmed.ncbi.nlm.nih.gov/19530217/,Priming words with pictures: neural correlates of semantic associations in a cross-modal priming task using fMRI.,"Kircher T, Sass K, Sachs O, Krach S",Human brain mapping,0.068,19530217,-1,-1
fronto parietal_00287,https://pubmed.ncbi.nlm.nih.gov/22741094/,Effects of cranial electrotherapy stimulation on resting state brain activity.,"Feusner JD, Madsen S, Moody TD, Bohon C, Hembacher E, Bookheimer SY, Bystritsky A",Brain and behavior,0.068,22741094,-1,-1
fronto parietal_00288,https://pubmed.ncbi.nlm.nih.gov/25315785/,Language Networks Associated with Computerized Semantic Indices.,"Pakhomov SV, Jones DT, Knopman DS",NeuroImage,0.068,25315785,-1,-1
fronto parietal_00289,https://pubmed.ncbi.nlm.nih.gov/25355218/,"Dissociable roles of right inferior frontal cortex and anterior insula in inhibitory control: evidence from intrinsic and task-related functional parcellation, connectivity, and response profile analy","Cai W, Ryali S, Chen T, Li CS, Menon V",The Journal of neuroscience : the official journal of the Society for Neuroscience,0.068,25355218,-1,-1
fronto parietal_00290,https://pubmed.ncbi.nlm.nih.gov/25980975/,Resting state signatures of domain and demand-specific working memory performance.,"van Dam WO, Decker SL, Durbin JS, Vendemia JM, Desai RH",NeuroImage,0.068,25980975,-1,-1
fronto parietal_00291,https://pubmed.ncbi.nlm.nih.gov/26049149/,What makes your brain suggestible? Hypnotizability is associated with differential brain activity during attention outside hypnosis.,"Cojan Y, Piguet C, Vuilleumier P",NeuroImage,0.068,26049149,-1,-1
fronto parietal_00292,https://pubmed.ncbi.nlm.nih.gov/27788143/,Brain Connectivity Changes in Autosomal Recessive Parkinson Disease: A Model for  the Sporadic Form.,"Makovac E, Cercignani M, Serra L, Torso M, Spano B, Petrucci S, Ricciardi L, Ginevrino M, Caltagirone C, Bentivoglio AR, Valente EM, Bozzali M",PloS one,0.068,27788143,-1,-1
fronto parietal_00293,https://pubmed.ncbi.nlm.nih.gov/27995066/,Functional resting-state fMRI connectivity correlates with serum levels of the S100B protein in the acute phase of traumatic brain injury.,"Thompson WH, Thelin EP, Lilja A, Bellander BM, Fransson P",NeuroImage. Clinical,0.068,27995066,-1,-1
fronto parietal_00294,https://pubmed.ncbi.nlm.nih.gov/28662482/,Phonological experience modulates voice discrimination: Evidence from functional  brain networks analysis.,"Hu X, Wang X, Gu Y, Luo P, Yin S, Wang L, Fu C, Qiao L, Du Y, Chen A",Brain and language,0.068,28662482,-1,-1
fronto parietal_00295,https://pubmed.ncbi.nlm.nih.gov/28704424/,Examining distinct working memory processes in children and adolescents using fMRI: Results and validation of a modified Brown-Peterson paradigm.,"Siffredi V, Barrouillet P, Spencer-Smith M, Vaessen M, Anderson V, Vuilleumier P",PloS one,0.068,28704424,-1,-1
fronto parietal_00296,https://pubmed.ncbi.nlm.nih.gov/28964911/,Bilateral dorsal fronto-parietal areas are associated with integration of visual  motion information and timed motor action.,"de Azevedo Neto RM, Amaro Junior E",Behavioural brain research,0.068,28964911,-1,-1
fronto parietal_00297,https://pubmed.ncbi.nlm.nih.gov/20350177/,Viewing one's own face being touched modulates tactile perception: an fMRI study.,"Cardini F, Costantini M, Galati G, Romani GL, Ladavas E, Serino A",Journal of cognitive neuroscience,0.067,20350177,-1,-1
fronto parietal_00298,https://pubmed.ncbi.nlm.nih.gov/20600999/,Top-down modulation of visual feature processing: the role of the inferior frontal junction.,"Zanto TP, Rubens MT, Bollinger J, Gazzaley A",NeuroImage,0.067,20600999,-1,-1
fronto parietal_00299,https://pubmed.ncbi.nlm.nih.gov/22475505/,"Neural correlates of interference inhibition, action withholding and action cancelation in adult ADHD.","Sebastian A, Gerdes B, Feige B, Kloppel S, Lange T, Philipsen A, Tebartz van Elst L, Lieb K, Tuscher O",Psychiatry research,0.067,22475505,-1,-1
fronto parietal_00300,https://pubmed.ncbi.nlm.nih.gov/22721373/,Learning to sample: eye tracking and fMRI indices of changes in object perception.,"Emberson LL, Amso D",Journal of cognitive neuroscience,0.067,22721373,-1,-1
fronto parietal_00301,https://pubmed.ncbi.nlm.nih.gov/22916169/,Neural correlates of individual performance differences in resolving perceptual conflict.,"Labrenz F, Themann M, Wascher E, Beste C, Pfleiderer B",PloS one,0.067,22916169,10.1371/journal.pone.0042849,-1
fronto parietal_00302,https://pubmed.ncbi.nlm.nih.gov/24642753/,Organizing heterogeneous samples using community detection of GIMME-derived resting state functional networks.,"Gates KM, Molenaar PC, Iyer SP, Nigg JT, Fair DA",PloS one,0.067,24642753,10.1371/journal.pone.0091322,-1
fronto parietal_00303,https://pubmed.ncbi.nlm.nih.gov/25842293/,Modulation of prefrontal functioning in attention systems by NPSR1 gene variation.,"Neufang S, Geiger MJ, Homola GA, Mahr M, Akhrif A, Nowak J, Reif A, Romanos M, Deckert J, Solymosi L, Domschke K",NeuroImage,0.067,25842293,10.1016/j.neuroimage.2015.03.064,-1
fronto parietal_00304,https://pubmed.ncbi.nlm.nih.gov/25989317/,An fMRI investigation into the effect of preceding stimuli during visual oddball  tasks.,"Fajkus J, Mikl M, Shaw DJ, Brazdil M",Journal of neuroscience methods,0.067,25989317,-1,-1
fronto parietal_00305,https://pubmed.ncbi.nlm.nih.gov/28746902/,Remembering verbally-presented items as pictures: Brain activity underlying visual mental images in schizophrenia patients with visual hallucinations.,"Stephan-Otto C, Siddi S, Senior C, Cuevas-Esteban J, Cambra-Marti MR, Ochoa S, Brebion G",Cortex; a journal devoted to the study of the nervous system and behavior,0.067,28746902,-1,-1
fronto parietal_00306,https://pubmed.ncbi.nlm.nih.gov/12062884/,Parietal dysfunction is associated with increased outcome-related decision-making in schizophrenia patients.,"Paulus MP, Hozack NE, Zauscher BE, Frank L, Brown GG, McDowell J, Braff DL",Biological psychiatry,0.066,12062884,-1,-1
fronto parietal_00307,https://pubmed.ncbi.nlm.nih.gov/23056337/,Levodopa effects on hand and speech movements in patients with Parkinson's disease: a FMRI study.,"Maillet A, Krainik A, Debu B, Tropres I, Lagrange C, Thobois S, Pollak P, Pinto S",PloS one,0.066,23056337,-1,-1
fronto parietal_00308,https://pubmed.ncbi.nlm.nih.gov/25620492/,Multiple brain networks underpinning word learning from fluent speech revealed by independent component analysis.,"Lopez-Barroso D, Ripolles P, Marco-Pallares J, Mohammadi B, Munte TF, Bachoud-Levi AC, Rodriguez-Fornells A, de Diego-Balaguer R",NeuroImage,0.066,25620492,-1,-1
fronto parietal_00309,https://pubmed.ncbi.nlm.nih.gov/25970523/,Aberrant function of learning and cognitive control networks underlie inefficient cognitive flexibility in anorexia nervosa: a cross-sectional FMRI study.,"Lao-Kaim NP, Fonville L, Giampietro VP, Williams SC, Simmons A, Tchanturia K",PloS one,0.066,25970523,-1,-1
fronto parietal_00310,https://pubmed.ncbi.nlm.nih.gov/27979789/,Age-related reduction of BOLD modulation to cognitive difficulty predicts poorer  task accuracy and poorer fluid reasoning ability.,"Rieck JR, Rodrigue KM, Boylan MA, Kennedy KM",NeuroImage,0.066,27979789,-1,-1
fronto parietal_00311,https://pubmed.ncbi.nlm.nih.gov/28119346/,Dissociating the Neural Basis of Conceptual Self-Awareness from Perceptual Awareness and Unaware Self-Processing.,"Tacikowski P, Berger CC, Ehrsson HH","Cerebral cortex (New York, N.Y. : 1991)",0.066,28119346,-1,-1
fronto parietal_00312,https://pubmed.ncbi.nlm.nih.gov/14736575/,"Dissociating the cortical basis of memory for voices, words and tones.",Stevens AA,Brain research. Cognitive brain research,0.065,14736575,-1,-1
fronto parietal_00313,https://pubmed.ncbi.nlm.nih.gov/16005247/,Asymmetric modulation of human visual cortex activity during 10 degrees lateral gaze (fMRI study).,"Deutschlander A, Marx E, Stephan T, Riedel E, Wiesmann M, Dieterich M, Brandt T",NeuroImage,0.065,16005247,-1,-1
fronto parietal_00314,https://pubmed.ncbi.nlm.nih.gov/22087089/,Functional development of fronto-striato-parietal networks associated with time perception.,"Smith AB, Giampietro V, Brammer M, Halari R, Simmons A, Rubia K",Frontiers in human neuroscience,0.065,22087089,-1,-1
fronto parietal_00315,https://pubmed.ncbi.nlm.nih.gov/23297206/,Complementary hemispheric specialization for language production and visuospatial attention.,"Cai Q, Van der Haegen L, Brysbaert M",Proceedings of the National Academy of Sciences of the United States of America,0.065,23297206,-1,-1
fronto parietal_00316,https://pubmed.ncbi.nlm.nih.gov/24525170/,How are things adding up? Neural differences between arithmetic operations are due to general problem solving strategies.,"Tschentscher N, Hauk O",NeuroImage,0.065,24525170,-1,-1
fronto parietal_00317,https://pubmed.ncbi.nlm.nih.gov/25126947/,Brain networks during free viewing of complex erotic movie: new insights on psychogenic erectile dysfunction.,"Cera N, Di Pierro ED, Ferretti A, Tartaro A, Romani GL, Perrucci MG",PloS one,0.065,25126947,-1,-1
fronto parietal_00318,https://pubmed.ncbi.nlm.nih.gov/25557401/,Top-down controlled and bottom-up triggered orienting of auditory attention to pitch activate overlapping brain networks.,"Alho K, Salmi J, Koistinen S, Salonen O, Rinne T",Brain research,0.065,25557401,10.1016/j.brainres.2014.12.050,-1
fronto parietal_00319,https://pubmed.ncbi.nlm.nih.gov/27590722/,Working memory load influences perceptual ambiguity by competing for fronto-parietal attentional resources.,"Intaite M, Duarte JV, Castelo-Branco M",Brain research,0.065,27590722,10.1016/j.brainres.2016.08.044,-1
fronto parietal_00320,https://pubmed.ncbi.nlm.nih.gov/11549616/,Human cortical networks for new and familiar sequences of saccades.,"Grosbras MH, Leonards U, Lobel E, Poline JB, LeBihan D, Berthoz A","Cerebral cortex (New York, N.Y. : 1991)",0.064,11549616,10.1093/cercor/11.10.936,-1
fronto parietal_00321,https://pubmed.ncbi.nlm.nih.gov/11556898/,Spatial coding of visual and somatic sensory information in body-centred coordinates.,"Galati G, Committeri G, Sanes JN, Pizzamiglio L",The European journal of neuroscience,0.064,11556898,10.1046/j.0953-816x.2001.01674.x,-1
fronto parietal_00322,https://pubmed.ncbi.nlm.nih.gov/19199412/,Sources of top-down control in visual search.,"Weidner R, Krummenacher J, Reimann B, Muller HJ, Fink GR",Journal of cognitive neuroscience,0.064,19199412,-1,-1
fronto parietal_00323,https://pubmed.ncbi.nlm.nih.gov/21937201/,Neural correlates of inhibitory control in adult attention deficit/hyperactivity  disorder: evidence from the Milwaukee longitudinal sample.,"Mulligan RC, Knopik VS, Sweet LH, Fischer M, Seidenberg M, Rao SM",Psychiatry research,0.064,21937201,-1,-1
fronto parietal_00324,https://pubmed.ncbi.nlm.nih.gov/25218167/,Fronto-parietal network supports context-dependent speech comprehension.,"Smirnov D, Glerean E, Lahnakoski JM, Salmi J, Jaaskelainen IP, Sams M, Nummenmaa L",Neuropsychologia,0.064,25218167,-1,-1
fronto parietal_00325,https://pubmed.ncbi.nlm.nih.gov/25562175/,"Resting-state anticorrelations between medial and lateral prefrontal cortex: Association with working memory, aging, and individual differences.","Keller JB, Hedden T, Thompson TW, Anteraper SA, Gabrieli JD, Whitfield-Gabrieli S",Cortex; a journal devoted to the study of the nervous system and behavior,0.064,25562175,-1,-1
fronto parietal_00326,https://pubmed.ncbi.nlm.nih.gov/26019123/,Co-activated yet disconnected-Neural correlates of eye closures when trying to stay awake.,"Ong JL, Kong D, Chia TT, Tandi J, Thomas Yeo BT, Chee MW",NeuroImage,0.064,26019123,-1,-1
fronto parietal_00327,https://pubmed.ncbi.nlm.nih.gov/26076024/,Temporal and Motor Representation of Rhythm in Fronto-Parietal Cortical Areas: An fMRI Study.,"Konoike N, Kotozaki Y, Jeong H, Miyazaki A, Sakaki K, Shinada T, Sugiura M, Kawashima R, Nakamura K",PloS one,0.064,26076024,-1,-1
fronto parietal_00328,https://pubmed.ncbi.nlm.nih.gov/27764124/,Influence of Temporal Expectations on Response Priming by Subliminal Faces.,"Pichon S, Guex R, Vuilleumier P",PloS one,0.064,27764124,-1,-1
fronto parietal_00329,https://pubmed.ncbi.nlm.nih.gov/18299790/,Cerebral connectivity and psychotic personality traits. A diffusion tensor imaging study.,"Volpe U, Federspiel A, Mucci A, Dierks T, Frank A, Wahlund LO, Galderisi S, Maj M",European archives of psychiatry and clinical neuroscience,0.063,18299790,-1,-1
fronto parietal_00330,https://pubmed.ncbi.nlm.nih.gov/18761138/,An fMRI study of the numerical Stroop task in individuals with and without minimal cognitive impairment.,"Kaufmann L, Ischebeck A, Weiss E, Koppelstaetter F, Siedentopf C, Vogel SE, Gotwald T, Marksteiner J, Wood G",Cortex; a journal devoted to the study of the nervous system and behavior,0.063,18761138,-1,-1
fronto parietal_00331,https://pubmed.ncbi.nlm.nih.gov/21674697/,Temporally remote destabilization of prediction after rare breaches of expectancy.,"Kuhn AB, Schubotz RI",Human brain mapping,0.063,21674697,10.1002/hbm.21325,-1
fronto parietal_00332,https://pubmed.ncbi.nlm.nih.gov/21983182/,Imitation and observational learning of hand actions: prefrontal involvement and  connectivity.,"Higuchi S, Holle H, Roberts N, Eickhoff SB, Vogt S",NeuroImage,0.063,21983182,10.1016/j.neuroimage.2011.09.021,-1
fronto parietal_00333,https://pubmed.ncbi.nlm.nih.gov/22905819/,The neural selection and integration of actions and objects: an fMRI study.,"Yoon EY, Humphreys GW, Kumar S, Rotshtein P",Journal of cognitive neuroscience,0.063,22905819,10.1162/jocn_a_00256,-1
fronto parietal_00334,https://pubmed.ncbi.nlm.nih.gov/22911806/,Modulation of brain activity during a Stroop inhibitory task by the kind of cognitive control required.,"Grandjean J, D'Ostilio K, Phillips C, Balteau E, Degueldre C, Luxen A, Maquet P, Salmon E, Collette F",PloS one,0.063,22911806,10.1371/journal.pone.0041513,-1
fronto parietal_00335,https://pubmed.ncbi.nlm.nih.gov/23558103/,The importance of integration and top-down salience when listening to complex multi-part musical stimuli.,"Uhlig M, Fairhurst MT, Keller PE",NeuroImage,0.063,23558103,-1,-1
fronto parietal_00336,https://pubmed.ncbi.nlm.nih.gov/23874935/,The importance of encoding-related neural dynamics in the prediction of inter-individual differences in verbal working memory performance.,"Majerus S, Salmon E, Attout L",PloS one,0.063,23874935,-1,-1
fronto parietal_00337,https://pubmed.ncbi.nlm.nih.gov/24291502/,Where agreement merges with disagreement: fMRI evidence of subject-verb integration.,"Quinones I, Molinaro N, Mancini S, Hernandez-Cabrera JA, Carreiras M",NeuroImage,0.063,24291502,-1,-1
fronto parietal_00338,https://pubmed.ncbi.nlm.nih.gov/25644499/,The neural basis of impulsive discounting in pathological gamblers.,"Miedl SF, Wiswede D, Marco-Pallares J, Ye Z, Fehr T, Herrmann M, Munte TF",Brain imaging and behavior,0.063,25644499,-1,-1
fronto parietal_00339,https://pubmed.ncbi.nlm.nih.gov/25671315/,The magical activation of left amygdala when reading Harry Potter: an fMRI study  on how descriptions of supra-natural events entertain and enchant.,"Hsu CT, Jacobs AM, Altmann U, Conrad M",PloS one,0.063,25671315,-1,-1
fronto parietal_00340,https://pubmed.ncbi.nlm.nih.gov/25790026/,Neural control of enhanced filtering demands in a combined Flanker and Garner conflict task.,"Berron D, Fruhholz S, Herrmann M",PloS one,0.063,25790026,-1,-1
fronto parietal_00341,https://pubmed.ncbi.nlm.nih.gov/28803942/,"An adaptive, individualized fMRI delay discounting procedure to increase flexibility and optimize scanner time.","Koffarnus MN, Deshpande HU, Lisinski JM, Eklund A, Bickel WK, LaConte SM",NeuroImage,0.063,28803942,-1,-1
fronto parietal_00342,https://pubmed.ncbi.nlm.nih.gov/29672547/,Trait anger modulates neural activity in the fronto-parietal attention network.,"Alia-Klein N, Preston-Campbell RN, Moeller SJ, Parvaz MA, Bachi K, Gan G, Zilverstand A, Konova AB, Goldstein RZ",PloS one,0.063,29672547,-1,-1
fronto parietal_00343,https://pubmed.ncbi.nlm.nih.gov/16243051/,A functional MRI study of preparatory signals for spatial location and objects.,"Corbetta M, Tansy AP, Stanley CM, Astafiev SV, Snyder AZ, Shulman GL",Neuropsychologia,0.062,16243051,-1,-1
fronto parietal_00344,https://pubmed.ncbi.nlm.nih.gov/17258693/,The neural basis of the egocentric and allocentric spatial frame of reference.,"Zaehle T, Jordan K, Wustenberg T, Baudewig J, Dechent P, Mast FW",Brain research,0.062,17258693,-1,-1
fronto parietal_00345,https://pubmed.ncbi.nlm.nih.gov/18573266/,Who caused the pain? An fMRI investigation of empathy and intentionality in children.,"Decety J, Michalska KJ, Akitsuki Y",Neuropsychologia,0.062,18573266,-1,-1
fronto parietal_00346,https://pubmed.ncbi.nlm.nih.gov/18601940/,Risk for depression is associated with neural biases in emotional categorisation.,"Chan SW, Harmer CJ, Goodwin GM, Norbury R",Neuropsychologia,0.062,18601940,-1,-1
fronto parietal_00347,https://pubmed.ncbi.nlm.nih.gov/21047627/,Receptive prosody in nonfluent primary progressive aphasias.,"Rohrer JD, Sauter D, Scott S, Rossor MN, Warren JD",Cortex; a journal devoted to the study of the nervous system and behavior,0.062,21047627,-1,-1
fronto parietal_00348,https://pubmed.ncbi.nlm.nih.gov/25613405/,Overlapping neural circuits for visual attention and eye movements in the human cerebellum.,"Striemer CL, Chouinard PA, Goodale MA, de Ribaupierre S",Neuropsychologia,0.062,25613405,-1,-1
fronto parietal_00349,https://pubmed.ncbi.nlm.nih.gov/25814470/,Classical conditioning in borderline personality disorder: an fMRI study.,"Krause-Utz A, Keibel-Mauchnik J, Ebner-Priemer U, Bohus M, Schmahl C",European archives of psychiatry and clinical neuroscience,0.062,25814470,-1,-1
fronto parietal_00350,https://pubmed.ncbi.nlm.nih.gov/17587600/,The role of immediate and final goals in action planning: an fMRI study.,"Majdandzic J, Grol MJ, van Schie HT, Verhagen L, Toni I, Bekkering H",NeuroImage,0.061,17587600,-1,-1
fronto parietal_00351,https://pubmed.ncbi.nlm.nih.gov/17707869/,Inefficient executive cognitive control in schizophrenia is preceded by altered functional activation during information encoding: an fMRI study.,"Schlosser RG, Koch K, Wagner G, Nenadic I, Roebel M, Schachtzabel C, Axer M, Schultz C, Reichenbach JR, Sauer H",Neuropsychologia,0.061,17707869,10.1016/j.neuropsychologia.2007.07.006,-1
fronto parietal_00352,https://pubmed.ncbi.nlm.nih.gov/20146607/,"Identifying the what, why, and how of an observed action: an fMRI study of mentalizing and mechanizing during action observation.","Spunt RP, Satpute AB, Lieberman MD",Journal of cognitive neuroscience,0.061,20146607,10.1162/jocn.2010.21446,-1
fronto parietal_00353,https://pubmed.ncbi.nlm.nih.gov/27453508/,Alterations in conflict monitoring are related to functional connectivity in Parkinson's disease.,"Rosenberg-Katz K, Maidan I, Jacob Y, Giladi N, Mirelman A, Hausdorff JM",Cortex; a journal devoted to the study of the nervous system and behavior,0.061,27453508,-1,-1
fronto parietal_00354,https://pubmed.ncbi.nlm.nih.gov/12067701/,Functional MRI of motor sequence acquisition: effects of learning stage and performance.,"Muller RA, Kleinhans N, Pierce K, Kemmotsu N, Courchesne E",Brain research. Cognitive brain research,0.06,12067701,-1,-1
fronto parietal_00355,https://pubmed.ncbi.nlm.nih.gov/16863694/,Separating brain regions involved in internally guided and visual feedback control of moving effectors: an event-related fMRI study.,"Ogawa K, Inui T, Sugio T",NeuroImage,0.06,16863694,-1,-1
fronto parietal_00356,https://pubmed.ncbi.nlm.nih.gov/19465134/,Different categories of living and non-living sound-sources activate distinct cortical networks.,"Engel LR, Frum C, Puce A, Walker NA, Lewis JW",NeuroImage,0.06,19465134,-1,-1
fronto parietal_00357,https://pubmed.ncbi.nlm.nih.gov/21168427/,Self-face enhances processing of immediately preceding invisible faces.,"Pannese A, Hirsch J",Neuropsychologia,0.06,21168427,-1,-1
fronto parietal_00358,https://pubmed.ncbi.nlm.nih.gov/21976411/,Modeling conflict and error in the medial frontal cortex.,"Mayer AR, Teshiba TM, Franco AR, Ling J, Shane MS, Stephen JM, Jung RE",Human brain mapping,0.06,21976411,-1,-1
fronto parietal_00359,https://pubmed.ncbi.nlm.nih.gov/23227139/,The effects of CPAP treatment on task positive and default mode networks in obstructive sleep apnea patients: an fMRI study.,"Prilipko O, Huynh N, Schwartz S, Tantrakul V, Kushida C, Paiva T, Guilleminault C",PloS one,0.06,23227139,-1,-1
fronto parietal_00360,https://pubmed.ncbi.nlm.nih.gov/24578178/,Impacts of PICALM and CLU variants associated with Alzheimer's disease on the functional connectivity of the hippocampus in healthy young adults.,"Zhang P, Qin W, Wang D, Liu B, Zhang Y, Jiang T, Yu C",Brain structure & function,0.06,24578178,-1,-1
fronto parietal_00361,https://pubmed.ncbi.nlm.nih.gov/26471057/,"Distinct contributions of lateral orbito-frontal cortex, striatum, and fronto-parietal network regions for rule encoding and control of memory-based implementation during instructed reversal learning.","Ruge H, Wolfensteller U",NeuroImage,0.06,26471057,-1,-1
fronto parietal_00362,https://pubmed.ncbi.nlm.nih.gov/17315224/,Management of attentional resources in within-modal and cross-modal divided attention tasks: an fMRI study.,"Vohn R, Fimm B, Weber J, Schnitker R, Thron A, Spijkers W, Willmes K, Sturm W",Human brain mapping,0.059,17315224,-1,-1
fronto parietal_00363,https://pubmed.ncbi.nlm.nih.gov/19199406/,Interactions between voluntary and stimulus-driven spatial attention mechanisms across sensory modalities.,"Santangelo V, Olivetti Belardinelli M, Spence C, Macaluso E",Journal of cognitive neuroscience,0.059,19199406,-1,-1
fronto parietal_00364,https://pubmed.ncbi.nlm.nih.gov/23251704/,Auditory processing under cross-modal visual load investigated with simultaneous  EEG-fMRI.,"Regenbogen C, De Vos M, Debener S, Turetsky BI, Mossnang C, Finkelmeyer A, Habel U, Neuner I, Kellermann T",PloS one,0.059,23251704,-1,-1
fronto parietal_00365,https://pubmed.ncbi.nlm.nih.gov/26143208/,Temporal unpredictability of a stimulus sequence and the processing of neutral and emotional stimuli.,"Koppe G, Heidel A, Sammer G, Bohus M, Gallhofer B, Kirsch P, Lis S",NeuroImage,0.059,26143208,-1,-1
fronto parietal_00366,https://pubmed.ncbi.nlm.nih.gov/27311641/,Changes in the modulation of brain activity during context encoding vs. context retrieval across the adult lifespan.,"Ankudowich E, Pasvanis S, Rajah MN",NeuroImage,0.059,27311641,-1,-1
fronto parietal_00367,https://pubmed.ncbi.nlm.nih.gov/16846742/,Cue validity modulates the neural correlates of covert endogenous orienting of attention in parietal and frontal cortex.,"Vossel S, Thiel CM, Fink GR",NeuroImage,0.058,16846742,-1,-1
fronto parietal_00368,https://pubmed.ncbi.nlm.nih.gov/18602840/,Cognitive processing speed and the structure of white matter pathways: convergent evidence from normal variation and lesion studies.,"Turken A, Whitfield-Gabrieli S, Bammer R, Baldo JV, Dronkers NF, Gabrieli JD",NeuroImage,0.058,18602840,-1,-1
fronto parietal_00369,https://pubmed.ncbi.nlm.nih.gov/19683584/,Investigating the predictive value of whole-brain structural MR scans in autism:  a pattern classification approach.,"Ecker C, Rocha-Rego V, Johnston P, Mourao-Miranda J, Marquand A, Daly EM, Brammer MJ, Murphy C, Murphy DG",NeuroImage,0.058,19683584,-1,-1
fronto parietal_00370,https://pubmed.ncbi.nlm.nih.gov/21520342/,The influence of emotional associations on the neural correlates of semantic priming.,"Sass K, Habel U, Sachs O, Huber W, Gauggel S, Kircher T",Human brain mapping,0.058,21520342,-1,-1
fronto parietal_00371,https://pubmed.ncbi.nlm.nih.gov/21839174/,Altered resting-state effective connectivity of fronto-parietal motor control systems on the primary motor network following stroke.,"Inman CS, James GA, Hamann S, Rajendra JK, Pagnoni G, Butler AJ",NeuroImage,0.058,21839174,10.1016/j.neuroimage.2011.07.083,-1
fronto parietal_00372,https://pubmed.ncbi.nlm.nih.gov/22669497/,Genetic influences of resting state fMRI activity in language-related brain regions in healthy controls and schizophrenia patients: a pilot study.,"Jamadar S, Powers NR, Meda SA, Calhoun VD, Gelernter J, Gruen JR, Pearlson GD",Brain imaging and behavior,0.058,22669497,10.1007/s11682-012-9168-1,-1
fronto parietal_00373,https://pubmed.ncbi.nlm.nih.gov/23263840/,Human trace fear conditioning: right-lateralized cortical activity supports trace-interval processes.,"Haritha AT, Wood KH, Ver Hoef LW, Knight DC","Cognitive, affective & behavioral neuroscience",0.058,23263840,10.3758/s13415-012-0142-6,-1
fronto parietal_00374,https://pubmed.ncbi.nlm.nih.gov/25628546/,Episodic memory and self-reference via semantic autobiographical memory: insights from an fMRI study in younger and older adults.,"Kalenzaga S, Sperduti M, Anssens A, Martinelli P, Devauchelle AD, Gallarda T, Delhommeau M, Lion S, Amado I, Krebs MO, Oppenheim C, Piolino P",Frontiers in behavioral neuroscience,0.058,25628546,-1,-1
