paper_name,paper_url,Title,Author,Journal,Loading,PMID,Doi,download_status
fronto parietal_00095,https://pubmed.ncbi.nlm.nih.gov/29190830/,Reduced functional connectivity of fronto-parietal sustained attention networks in severe childhood abuse.,"Hart H, Lim L, Mehta MA, Chatzieffraimidou A, Curtis C, Xu X, Breen G, Simmons A, Mirza K, Rubia K",PloS one,0.115,29190830,-1,-1
fronto parietal_00096,https://pubmed.ncbi.nlm.nih.gov/21874602/,Cue-switch effects do not rely on the same neural systems as task-switch effects.,"De Baene W, Brass M","Cognitive, affective & behavioral neuroscience",0.114,21874602,-1,-1
fronto parietal_00097,https://pubmed.ncbi.nlm.nih.gov/19135767/,Brain mechanisms associated with background monitoring of the environment for potentially significant sensory events.,"Gruber O, Melcher T, Diekhof EK, Karch S, Falkai P, Goschke T",Brain and cognition,0.113,19135767,-1,-1
fronto parietal_00098,https://pubmed.ncbi.nlm.nih.gov/20350184/,Overrecruitment in the aging brain as a function of task demands: evidence for a  compensatory view.,"Vallesi A, McIntosh AR, Stuss DT",Journal of cognitive neuroscience,0.113,20350184,-1,-1
fronto parietal_00099,https://pubmed.ncbi.nlm.nih.gov/22131379/,Closely overlapping responses to tools and hands in left lateral occipitotemporal cortex.,"Bracci S, Cavina-Pratesi C, Ietswaart M, Caramazza A, Peelen MV",Journal of neurophysiology,0.113,22131379,-1,-1
fronto parietal_00100,https://pubmed.ncbi.nlm.nih.gov/28893526/,Neural correlates of working memory in children and adolescents with agenesis of  the corpus callosum: An fMRI study.,"Siffredi V, Spencer-Smith MM, Barrouillet P, Vaessen MJ, Leventer RJ, Anderson V, Vuilleumier P",Neuropsychologia,0.113,28893526,-1,-1
fronto parietal_00101,https://pubmed.ncbi.nlm.nih.gov/16828717/,Exact and approximate judgements of visual and auditory numerosity: an fMRI study.,"Piazza M, Mechelli A, Price CJ, Butterworth B",Brain research,0.112,16828717,10.1016/j.brainres.2006.05.104,-1
fronto parietal_00102,https://pubmed.ncbi.nlm.nih.gov/22570705/,Resting-state functional connectivity between fronto-parietal and default mode networks in obsessive-compulsive disorder.,"Stern ER, Fitzgerald KD, Welsh RC, Abelson JL, Taylor SF",PloS one,0.109,22570705,10.1371/journal.pone.0036356,-1
fronto parietal_00103,https://pubmed.ncbi.nlm.nih.gov/23482624/,From mind to matter: neural correlates of abstract and concrete mindsets.,"Gilead M, Liberman N, Maril A",Social cognitive and affective neuroscience,0.108,23482624,10.1093/scan/nst031,-1
fronto parietal_00104,https://pubmed.ncbi.nlm.nih.gov/25368563/,Different neural systems contribute to semantic bias and conflict detection in the inclusion fallacy task.,"Liang P, Goel V, Jia X, Li K",Frontiers in human neuroscience,0.107,25368563,-1,-1
fronto parietal_00105,https://pubmed.ncbi.nlm.nih.gov/27444935/,Emotion regulation and amygdala-precuneus connectivity: Focusing on attentional deployment.,"Ferri J, Schmidt J, Hajcak G, Canli T","Cognitive, affective & behavioral neuroscience",0.106,27444935,-1,-1
fronto parietal_00106,https://pubmed.ncbi.nlm.nih.gov/19539767/,Cerebral correlates of analogical processing and their modulation by training.,"Wartenburger I, Heekeren HR, Preusse F, Kramer J, van der Meer E",NeuroImage,0.105,19539767,-1,-1
fronto parietal_00107,https://pubmed.ncbi.nlm.nih.gov/20807054/,Active ignoring in early visual cortex.,"Payne HE, Allen HA",Journal of cognitive neuroscience,0.105,20807054,-1,-1
fronto parietal_00108,https://pubmed.ncbi.nlm.nih.gov/20300627/,The neural correlates of visuospatial perceptual and oculomotor extrapolation.,"Tibber M, Saygin AP, Grant S, Melmoth D, Rees G, Morgan M",PloS one,0.104,20300627,-1,-1
fronto parietal_00109,https://pubmed.ncbi.nlm.nih.gov/20621961/,The neural basis of rationalization: cognitive dissonance reduction during decision-making.,"Jarcho JM, Berkman ET, Lieberman MD",Social cognitive and affective neuroscience,0.104,20621961,-1,-1
fronto parietal_00110,https://pubmed.ncbi.nlm.nih.gov/22285718/,Sex differences in anterior cingulate cortex activation during impulse inhibition and behavioral correlates.,"Liu J, Zubieta JK, Heitzeg M",Psychiatry research,0.104,22285718,-1,-1
fronto parietal_00111,https://pubmed.ncbi.nlm.nih.gov/21406238/,Common and dissociable neural correlates associated with component processes of inductive reasoning.,"Jia X, Liang P, Lu J, Yang Y, Zhong N, Li K",NeuroImage,0.103,21406238,-1,-1
fronto parietal_00112,https://pubmed.ncbi.nlm.nih.gov/25713528/,Analyzing the association between functional connectivity of the brain and intellectual performance.,"Pamplona GS, Santos Neto GS, Rosset SR, Rogers BP, Salmon CE",Frontiers in human neuroscience,0.102,25713528,-1,-1
fronto parietal_00113,https://pubmed.ncbi.nlm.nih.gov/25101865/,Preliminary findings on the heritability of the neural correlates of response inhibition.,"Macare C, Meindl T, Nenadic I, Rujescu D, Ettinger U",Biological psychology,0.101,25101865,-1,-1
fronto parietal_00114,https://pubmed.ncbi.nlm.nih.gov/11698132/,Retrieval of long and short lists from long term memory: a functional magnetic resonance imaging study with human subjects.,"Zysset S, Muller K, Lehmann C, Thone-Otto AI, von Cramon DY",Neuroscience letters,0.1,11698132,-1,-1
fronto parietal_00115,https://pubmed.ncbi.nlm.nih.gov/19107752/,White-matter abnormalities in attention deficit hyperactivity disorder: a diffusion tensor imaging study.,"Silk TJ, Vance A, Rinehart N, Bradshaw JL, Cunnington R",Human brain mapping,0.1,19107752,-1,-1
fronto parietal_00116,https://pubmed.ncbi.nlm.nih.gov/28539879/,Multiple Neural Networks Malfunction in Primary Blepharospasm: An Independent Components Analysis.,"Huang XF, Zhu MR, Shan P, Pei CH, Liang ZH, Zhou HL, Ni MF, Miao YW, Xu GQ, Zhang BW, Luo YY",Frontiers in human neuroscience,0.1,28539879,-1,-1
fronto parietal_00117,https://pubmed.ncbi.nlm.nih.gov/12408855/,Cognitive mechanisms of nicotine on visual attention.,"Lawrence NS, Ross TJ, Stein EA",Neuron,0.099,12408855,-1,-1
fronto parietal_00118,https://pubmed.ncbi.nlm.nih.gov/21568643/,Functional imaging reveals working memory and attention interact to produce the attentional blink.,"Johnston SJ, Linden DE, Shapiro KL",Journal of cognitive neuroscience,0.099,21568643,-1,-1
fronto parietal_00119,https://pubmed.ncbi.nlm.nih.gov/23567890/,Switch probability context (in)sensitivity within the cognitive control network.,"De Baene W, Brass M",NeuroImage,0.099,23567890,-1,-1
fronto parietal_00120,https://pubmed.ncbi.nlm.nih.gov/24064069/,Numerical ordering and symbolic arithmetic share frontal and parietal circuits in the right hemisphere.,"Knops A, Willmes K",NeuroImage,0.099,24064069,-1,-1
fronto parietal_00121,https://pubmed.ncbi.nlm.nih.gov/26322974/,Correlating Gray Matter Volume with Individual Difference in the Flanker Interference Effect.,"Chen C, Yang J, Lai J, Li H, Yuan J, Abbasi Nu",PloS one,0.098,26322974,10.1371/journal.pone.0136877,-1
fronto parietal_00122,https://pubmed.ncbi.nlm.nih.gov/26186229/,"What letters can ""learn"" from Arabic digits--fMRI-controlled single case therapy  study of peripheral agraphia.","Jung S, Halm K, Huber W, Willmes K, Klein E",Brain and language,0.098,26186229,10.1016/j.bandl.2015.06.003,-1
fronto parietal_00123,https://pubmed.ncbi.nlm.nih.gov/17005420/,The effect of gender on planning: An fMRI study using the Tower of London task.,"Boghi A, Rasetti R, Avidano F, Manzone C, Orsi L, D'Agata F, Caroppo P, Bergui M, Rocca P, Pulvirenti L, Bradac GB, Bogetto F, Mutani R, Mortara P",NeuroImage,0.097,17005420,10.1016/j.neuroimage.2006.07.022,-1
fronto parietal_00124,https://pubmed.ncbi.nlm.nih.gov/17499173/,Beyond grasping: representation of action in human anterior intraparietal sulcus.,"Tunik E, Rice NJ, Hamilton A, Grafton ST",NeuroImage,0.096,17499173,-1,-1
fronto parietal_00125,https://pubmed.ncbi.nlm.nih.gov/21571078/,Right fronto-parietal involvement in monitoring spatial trajectories.,"Vallesi A, Crescentini C",NeuroImage,0.096,21571078,-1,-1
fronto parietal_00126,https://pubmed.ncbi.nlm.nih.gov/24100194/,Possible role of an error detection mechanism in brain processing of deception: PET-fMRI study.,"Kireev M, Korotkov A, Medvedeva N, Medvedev S",International journal of psychophysiology : official journal of the International Organization of Psychophysiology,0.095,24100194,-1,-1
fronto parietal_00127,https://pubmed.ncbi.nlm.nih.gov/25237810/,Modafinil alters intrinsic functional connectivity of the right posterior insula: a pharmacological resting state fMRI study.,"Cera N, Tartaro A, Sensi SL",PloS one,0.095,25237810,-1,-1
fronto parietal_00128,https://pubmed.ncbi.nlm.nih.gov/23274842/,Selective role of lingual/parahippocampal gyrus and retrosplenial complex in spatial memory across viewpoint changes relative to the environmental reference frame.,"Sulpizio V, Committeri G, Lambrey S, Berthoz A, Galati G",Behavioural brain research,0.094,23274842,-1,-1
fronto parietal_00129,https://pubmed.ncbi.nlm.nih.gov/29414492/,"Age-related differences in BOLD modulation to cognitive control costs in a multitasking paradigm: Global switch, local switch, and compatibility-switch costs.","Nashiro K, Qin S, O'Connell MA, Basak C",NeuroImage,0.094,29414492,-1,-1
fronto parietal_00130,https://pubmed.ncbi.nlm.nih.gov/20138482/,Neurobiological correlates of problem gambling in a quasi-realistic blackjack scenario as revealed by fMRI.,"Miedl SF, Fehr T, Meyer G, Herrmann M",Psychiatry research,0.093,20138482,-1,-1
fronto parietal_00131,https://pubmed.ncbi.nlm.nih.gov/24642280/,Developmental improvements in voluntary control of behavior: Effect of preparation in the fronto-parietal network?,"Alahyane N, Brien DC, Coe BC, Stroman PW, Munoz DP",NeuroImage,0.093,24642280,-1,-1
fronto parietal_00132,https://pubmed.ncbi.nlm.nih.gov/25071505/,Short time sports exercise boosts motor imagery patterns: implications of mental  practice in rehabilitation programs.,"Wriessnegger SC, Steyrl D, Koschutnig K, Muller-Putz GR",Frontiers in human neuroscience,0.093,25071505,-1,-1
fronto parietal_00133,https://pubmed.ncbi.nlm.nih.gov/15488909/,The inhibition of imitative and overlearned responses: a functional double dissociation.,"Brass M, Derrfuss J, von Cramon DY",Neuropsychologia,0.092,15488909,-1,-1
fronto parietal_00134,https://pubmed.ncbi.nlm.nih.gov/18771738/,A longitudinal fMRI study of working memory in severe TBI patients with diffuse axonal injury.,"Sanchez-Carrion R, Fernandez-Espejo D, Junque C, Falcon C, Bargallo N, Roig T, Bernabeu M, Tormos JM, Vendrell P",NeuroImage,0.092,18771738,-1,-1
fronto parietal_00135,https://pubmed.ncbi.nlm.nih.gov/19631255/,Cortical areas related to performance of WAIS Digit Symbol Test: a functional imaging study.,"Usui N, Haji T, Maruyama M, Katsuyama N, Uchida S, Hozawa A, Omori K, Tsuji I, Kawashima R, Taira M",Neuroscience letters,0.092,19631255,-1,-1
fronto parietal_00136,https://pubmed.ncbi.nlm.nih.gov/26213335/,Are the carrot and the stick the two sides of same coin? A neural examination of  approach/avoidance motivation during cognitive performance.,"Belayachi S, Majerus S, Gendolla G, Salmon E, Peters F, Van der Linden M",Behavioural brain research,0.092,26213335,-1,-1
fronto parietal_00137,https://pubmed.ncbi.nlm.nih.gov/19580392/,fMRI activation during observation of others' reach errors.,"Malfait N, Valyear KF, Culham JC, Anton JL, Brown LE, Gribble PL",Journal of cognitive neuroscience,0.091,19580392,-1,-1
fronto parietal_00138,https://pubmed.ncbi.nlm.nih.gov/21425400/,Hemispheric specialization during mental imagery of brisk walking.,"Cremers J, Dessoullieres A, Garraux G",Human brain mapping,0.091,21425400,-1,-1
fronto parietal_00139,https://pubmed.ncbi.nlm.nih.gov/23506969/,Functional network architecture of reading-related regions across development.,"Vogel AC, Church JA, Power JD, Miezin FM, Petersen SE, Schlaggar BL",Brain and language,0.091,23506969,-1,-1
fronto parietal_00140,https://pubmed.ncbi.nlm.nih.gov/17625917/,Single dose antidepressant administration modulates the neural processing of self-referent personality trait words.,"Miskowiak K, Papadatou-Pastou M, Cowen PJ, Goodwin GM, Norbury R, Harmer CJ",NeuroImage,0.09,17625917,-1,-1
fronto parietal_00141,https://pubmed.ncbi.nlm.nih.gov/25046361/,Monitoring mechanisms in visual search: an fMRI study.,Vallesi A,Brain research,0.09,25046361,10.1016/j.brainres.2014.07.018,-1
fronto parietal_00142,https://pubmed.ncbi.nlm.nih.gov/17990304/,Visual target modulation of functional connectivity networks revealed by self-organizing group ICA.,"van de Ven V, Bledowski C, Prvulovic D, Goebel R, Formisano E, Di Salle F, Linden DE, Esposito F",Human brain mapping,0.089,17990304,10.1002/hbm.20479,-1
fronto parietal_00143,https://pubmed.ncbi.nlm.nih.gov/19699020/,Neurofunctional correlates of personality traits in relapsing-remitting multiple  sclerosis: an fMRI study.,"Gioia MC, Cerasa A, Valentino P, Fera F, Nistico R, Liguori M, Lanza P, Quattrone A",Brain and cognition,0.089,19699020,10.1016/j.bandc.2009.07.009,-1
fronto parietal_00144,https://pubmed.ncbi.nlm.nih.gov/24183468/,Fronto-parietal dorsal and ventral pathways in the context of different linguistic manipulations.,"Kellmeyer P, Ziegler W, Peschke C, Juliane E, Schnell S, Baumgaertner A, Weiller C, Saur D",Brain and language,0.089,24183468,10.1016/j.bandl.2013.09.011,-1
fronto parietal_00145,https://pubmed.ncbi.nlm.nih.gov/29311878/,Default Network Activity Is Associated with Better Performance in a Vigilance Task.,"Bogler C, Vowinkel A, Zhutovsky P, Haynes JD",Frontiers in human neuroscience,0.089,29311878,-1,-1
fronto parietal_00146,https://pubmed.ncbi.nlm.nih.gov/21867758/,Changing the structure of complex visuo-motor sequences selectively activates the fronto-parietal network.,"Pammi VS, Miyapuram KP, Ahmed, Samejima K, Bapi RS, Doya K",NeuroImage,0.088,21867758,-1,-1
fronto parietal_00147,https://pubmed.ncbi.nlm.nih.gov/23046904/,"Cortical thickness, mental absorption and meditative practice: possible implications for disorders of attention.","Grant JA, Duerden EG, Courtemanche J, Cherkasova M, Duncan GH, Rainville P",Biological psychology,0.088,23046904,-1,-1
fronto parietal_00148,https://pubmed.ncbi.nlm.nih.gov/11728837/,De-coupling of cognitive performance and cerebral functional response during working memory in schizophrenia.,"Honey GD, Bullmore ET, Sharma T",Schizophrenia research,0.087,11728837,-1,-1
fronto parietal_00149,https://pubmed.ncbi.nlm.nih.gov/17499166/,Zones of bimanual and unimanual preference within human primary sensorimotor cortex during object manipulation.,"Theorin A, Johansson RS",NeuroImage,0.087,17499166,-1,-1
fronto parietal_00150,https://pubmed.ncbi.nlm.nih.gov/26935551/,Early dysfunctions of fronto-parietal praxis networks in Parkinson's disease.,"Matt E, Foki T, Fischmeister F, Pirker W, Haubenberger D, Rath J, Lehrner J, Auff E, Beisteiner R",Brain imaging and behavior,0.087,26935551,-1,-1
fronto parietal_00151,https://pubmed.ncbi.nlm.nih.gov/15385595/,Dominance of the right hemisphere and role of area 2 in human kinesthesia.,"Naito E, Roland PE, Grefkes C, Choi HJ, Eickhoff S, Geyer S, Zilles K, Ehrsson HH",Journal of neurophysiology,0.086,15385595,-1,-1
fronto parietal_00152,https://pubmed.ncbi.nlm.nih.gov/20336685/,Dehydration affects brain structure and function in healthy adolescents.,"Kempton MJ, Ettinger U, Foster R, Williams SC, Calvert GA, Hampshire A, Zelaya FO, O'Gorman RL, McMorris T, Owen AM, Smith MS",Human brain mapping,0.086,20336685,-1,-1
fronto parietal_00153,https://pubmed.ncbi.nlm.nih.gov/21147136/,Conflict and cognitive control during sentence comprehension: recruitment of a frontal network during the processing of Spanish object-first sentences.,"del Rio D, Maestu F, Lopez-Higes R, Moratti S, Gutierrez R, Maestu C, del-Pozo F",Neuropsychologia,0.086,21147136,-1,-1
fronto parietal_00154,https://pubmed.ncbi.nlm.nih.gov/16527492/,Alcohol-induced suppression of BOLD activity during goal-directed visuomotor performance.,"Van Horn JD, Yanos M, Schmitt PJ, Grafton ST",NeuroImage,0.085,16527492,-1,-1
fronto parietal_00155,https://pubmed.ncbi.nlm.nih.gov/22732492/,Mental arithmetic activates analogic representations of internally generated sums.,"Kallai AY, Schunn CD, Fiez JA",Neuropsychologia,0.085,22732492,-1,-1
fronto parietal_00156,https://pubmed.ncbi.nlm.nih.gov/27456537/,Moral competence and brain connectivity: A resting-state fMRI study.,"Jung WH, Prehn K, Fang Z, Korczykowski M, Kable JW, Rao H, Robertson DC",NeuroImage,0.085,27456537,-1,-1
fronto parietal_00157,https://pubmed.ncbi.nlm.nih.gov/15193611/,Endogenous and exogenous attention shifts are mediated by the same large-scale neural network.,"Peelen MV, Heslenfeld DJ, Theeuwes J",NeuroImage,0.084,15193611,-1,-1
fronto parietal_00158,https://pubmed.ncbi.nlm.nih.gov/16919481/,Differential correlation of frontal and parietal activity with the number of alternatives for cued choice saccades.,"Lee KM, Wade AR, Lee BT",NeuroImage,0.084,16919481,-1,-1
fronto parietal_00159,https://pubmed.ncbi.nlm.nih.gov/17490893/,Imaging early practice effects in arithmetic.,"Ischebeck A, Zamarian L, Egger K, Schocke M, Delazer M",NeuroImage,0.084,17490893,-1,-1
fronto parietal_00160,https://pubmed.ncbi.nlm.nih.gov/17963799/,Neural correlates of primary and reflective consciousness of spatial orienting.,"Bartolomeo P, Zieren N, Vohn R, Dubois B, Sturm W",Neuropsychologia,0.084,17963799,-1,-1
fronto parietal_00161,https://pubmed.ncbi.nlm.nih.gov/19761849/,Functional neural correlates of fluid and crystallized analogizing.,"Geake JG, Hansen PC",NeuroImage,0.084,19761849,10.1016/j.neuroimage.2009.09.008,-1
fronto parietal_00162,https://pubmed.ncbi.nlm.nih.gov/20828626/,Evaluation of effective connectivity of motor areas during motor imagery and execution using conditional Granger causality.,"Gao Q, Duan X, Chen H",NeuroImage,0.084,20828626,10.1016/j.neuroimage.2010.08.071,-1
fronto parietal_00163,https://pubmed.ncbi.nlm.nih.gov/21329677/,Latencies in BOLD response during visual attention processes.,"Kellermann T, Reske M, Jansen A, Satrapi P, Shah NJ, Schneider F, Habel U",Brain research,0.084,21329677,10.1016/j.brainres.2011.02.023,-1
fronto parietal_00164,https://pubmed.ncbi.nlm.nih.gov/21692143/,A common right fronto-parietal network for numerosity and duration processing: an fMRI study.,"Dormal V, Dormal G, Joassin F, Pesenti M",Human brain mapping,0.084,21692143,10.1002/hbm.21300,-1
fronto parietal_00165,https://pubmed.ncbi.nlm.nih.gov/26151102/,Verbal and nominal agreement: An fMRI study.,"Carreiras M, Quinones I, Mancini S, Hernandez-Cabrera JA, Barber H",NeuroImage,0.084,26151102,-1,-1
fronto parietal_00166,https://pubmed.ncbi.nlm.nih.gov/27039697/,Modulating rest-break length induces differential recruitment of automatic and controlled attentional processes upon task reengagement.,"Lim J, Teng J, Wong KF, Chee MWL",NeuroImage,0.084,27039697,-1,-1
fronto parietal_00167,https://pubmed.ncbi.nlm.nih.gov/27378890/,Comparing the Neural Correlates of Conscious and Unconscious Conflict Control in  a Masked Stroop Priming Task.,"Jiang J, Bailey K, Xiang L, Zhang L, Zhang Q",Frontiers in human neuroscience,0.084,27378890,-1,-1
fronto parietal_00168,https://pubmed.ncbi.nlm.nih.gov/16766208/,The impact of semantic reference on word class: an fMRI study of action and object naming.,"Saccuman MC, Cappa SF, Bates EA, Arevalo A, Della Rosa P, Danna M, Perani D",NeuroImage,0.083,16766208,-1,-1
fronto parietal_00169,https://pubmed.ncbi.nlm.nih.gov/18033767/,Understanding the neural computations of arbitrary visuomotor learning through fMRI and associative learning theory.,"Brovelli A, Laksiri N, Nazarian B, Meunier M, Boussaoud D","Cerebral cortex (New York, N.Y. : 1991)",0.083,18033767,-1,-1
fronto parietal_00170,https://pubmed.ncbi.nlm.nih.gov/20006717/,Altered activation in association with reward-related trial-and-error learning in patients with schizophrenia.,"Koch K, Schachtzabel C, Wagner G, Schikora J, Schultz C, Reichenbach JR, Sauer H, Schlosser RG",NeuroImage,0.083,20006717,-1,-1
fronto parietal_00171,https://pubmed.ncbi.nlm.nih.gov/21942763/,Absence of face-specific cortical activity in the complete absence of awareness:  converging evidence from functional magnetic resonance imaging and event-related  potentials.,"Rodriguez V, Thompson R, Stokes M, Brett M, Alvarez I, Valdes-Sosa M, Duncan J",Journal of cognitive neuroscience,0.083,21942763,-1,-1
fronto parietal_00172,https://pubmed.ncbi.nlm.nih.gov/23756137/,A large scale (N=102) functional neuroimaging study of response inhibition in a Go/NoGo task.,"Steele VR, Aharoni E, Munro GE, Calhoun VD, Nyalakanti P, Stevens MC, Pearlson G, Kiehl KA",Behavioural brain research,0.083,23756137,-1,-1
fronto parietal_00173,https://pubmed.ncbi.nlm.nih.gov/25592803/,Task-based functional connectivity as an indicator of genetic liability to schizophrenia.,"Poppe AB, Carter CS, Minzenberg MJ, MacDonald AW 3rd",Schizophrenia research,0.083,25592803,-1,-1
fronto parietal_00174,https://pubmed.ncbi.nlm.nih.gov/12244209/,Neural basis of protracted developmental changes in visuo-spatial working memory.,"Kwon H, Reiss AL, Menon V",Proceedings of the National Academy of Sciences of the United States of America,0.082,12244209,-1,-1
fronto parietal_00175,https://pubmed.ncbi.nlm.nih.gov/19117276/,Repetition suppression for performed hand gestures revealed by fMRI.,"Hamilton AF, Grafton ST",Human brain mapping,0.082,19117276,-1,-1
fronto parietal_00176,https://pubmed.ncbi.nlm.nih.gov/19277116/,The architecture of the golfer's brain.,"Jancke L, Koeneke S, Hoppe A, Rominger C, Hanggi J",PloS one,0.082,19277116,-1,-1
fronto parietal_00177,https://pubmed.ncbi.nlm.nih.gov/19574393/,Auditory attentional control and selection during cocktail party listening.,"Hill KT, Miller LM","Cerebral cortex (New York, N.Y. : 1991)",0.082,19574393,-1,-1
fronto parietal_00178,https://pubmed.ncbi.nlm.nih.gov/19702470/,Neural correlates of species-typical illogical cognitive bias in human inference.,"Ogawa A, Yamazaki Y, Ueno K, Cheng K, Iriki A",Journal of cognitive neuroscience,0.082,19702470,-1,-1
fronto parietal_00179,https://pubmed.ncbi.nlm.nih.gov/19750227/,Spatio-temporal dynamics of human intention understanding in temporo-parietal cortex: a combined EEG/fMRI repetition suppression paradigm.,"Ortigue S, Thompson JC, Parasuraman R, Grafton ST",PloS one,0.082,19750227,-1,-1
fronto parietal_00180,https://pubmed.ncbi.nlm.nih.gov/21382559/,Stimulus-driven orienting of visuo-spatial attention in complex dynamic environments.,"Nardo D, Santangelo V, Macaluso E",Neuron,0.082,21382559,-1,-1
fronto parietal_00181,https://pubmed.ncbi.nlm.nih.gov/22154751/,Prism adaptation enhances activity of intact fronto-parietal areas in both hemispheres in neglect patients.,"Saj A, Cojan Y, Vocat R, Luaute J, Vuilleumier P",Cortex; a journal devoted to the study of the nervous system and behavior,0.082,22154751,10.1016/j.cortex.2011.10.009,-1
fronto parietal_00182,https://pubmed.ncbi.nlm.nih.gov/24416003/,The effect of theta-burst TMS on cognitive control networks measured with resting state fMRI.,"Gratton C, Lee TG, Nomura EM, D'Esposito M",Frontiers in systems neuroscience,0.082,24416003,10.3389/fnsys.2013.00124,-1
fronto parietal_00183,https://pubmed.ncbi.nlm.nih.gov/24699668/,Disruptions in brain networks of older fallers are associated with subsequent cognitive decline: a 12-month prospective exploratory study.,"Hsu CL, Voss MW, Handy TC, Davis JC, Nagamatsu LS, Chan A, Bolandzadeh N, Liu-Ambrose T",PloS one,0.082,24699668,10.1371/journal.pone.0093673,-1
fronto parietal_00184,https://pubmed.ncbi.nlm.nih.gov/25284304/,Age trajectories of functional activation under conditions of low and high processing demands: An adult lifespan fMRI study of the aging brain.,"Kennedy KM, Rodrigue KM, Bischof GN, Hebrank AC, Reuter-Lorenz PA, Park DC",NeuroImage,0.082,25284304,10.1016/j.neuroimage.2014.09.056,-1
fronto parietal_00185,https://pubmed.ncbi.nlm.nih.gov/28291572/,Noradrenaline transporter blockade increases fronto-parietal functional connectivity relevant for working memory.,"Hernaus D, Casales Santa MM, Offermann JS, Van Amelsvoort T",European neuropsychopharmacology : the journal of the European College of Neuropsychopharmacology,0.082,28291572,10.1016/j.euroneuro.2017.02.004,-1
fronto parietal_00186,https://pubmed.ncbi.nlm.nih.gov/27033686/,Mindful attention to breath regulates emotions via increased amygdala-prefrontal  cortex connectivity.,"Doll A, Holzel BK, Mulej Bratec S, Boucard CC, Xie X, Wohlschlager AM, Sorg C",NeuroImage,0.081,27033686,-1,-1
fronto parietal_00187,https://pubmed.ncbi.nlm.nih.gov/19915989/,Disrupted white matter integrity of corticopontine-cerebellar circuitry in schizophrenia.,"Koch K, Wagner G, Dahnke R, Schachtzabel C, Schultz C, Roebel M, Gullmar D, Reichenbach JR, Sauer H, Schlosser RG",European archives of psychiatry and clinical neuroscience,0.08,19915989,-1,-1
fronto parietal_00188,https://pubmed.ncbi.nlm.nih.gov/26630882/,Brain functional network abnormality extends beyond the sensorimotor network in brachial plexus injury patients.,"Feng JT, Liu HQ, Hua XY, Gu YD, Xu JG, Xu WD",Brain imaging and behavior,0.08,26630882,-1,-1
fronto parietal_00189,https://pubmed.ncbi.nlm.nih.gov/27103137/,Structural and functional correlates of motor imagery BCI performance: Insights from the patterns of fronto-parietal attention network.,"Zhang T, Liu T, Li F, Li M, Liu D, Zhang R, He H, Li P, Gong J, Luo C, Yao D, Xu P",NeuroImage,0.08,27103137,-1,-1
