paper_name,paper_url,Title,Author,Journal,Loading,PMID,Doi,download_status
fronto parietal_00190,https://pubmed.ncbi.nlm.nih.gov/28219776/,Deactivation in the posterior mid-cingulate cortex reflects perceptual transitions during binocular rivalry: Evidence from simultaneous EEG-fMRI.,"Roy AV, Jamison KW, He S, Engel SA, He B",NeuroImage,0.08,28219776,-1,-1
fronto parietal_00191,https://pubmed.ncbi.nlm.nih.gov/15728741/,Neural systems underlying observation of humanly impossible movements: an FMRI study.,"Costantini M, Galati G, Ferretti A, Caulo M, Tartaro A, Romani GL, Aglioti SM","Cerebral cortex (New York, N.Y. : 1991)",0.079,15728741,-1,-1
fronto parietal_00192,https://pubmed.ncbi.nlm.nih.gov/18095280/,Differential patterns of cortical activation as a function of fluid reasoning complexity.,"Perfetti B, Saggino A, Ferretti A, Caulo M, Romani GL, Onofrj M",Human brain mapping,0.079,18095280,-1,-1
fronto parietal_00193,https://pubmed.ncbi.nlm.nih.gov/19577650/,Attentional modulation of stimulus representation in human fronto-parietal cortex.,"Thompson R, Duncan J",NeuroImage,0.079,19577650,-1,-1
fronto parietal_00194,https://pubmed.ncbi.nlm.nih.gov/20189356/,Switching schizophrenia patients from typical neuroleptics to aripiprazole: effects on working memory dependent functional activation.,"Schlagenhauf F, Dinges M, Beck A, Wustenberg T, Friedel E, Dembler T, Sarkar R, Wrase J, Gallinat J, Juckel G, Heinz A",Schizophrenia research,0.079,20189356,-1,-1
fronto parietal_00195,https://pubmed.ncbi.nlm.nih.gov/20674554/,The neural mechanisms of reciprocal communication.,"Nagy E, Liotti M, Brown S, Waiter G, Bromiley A, Trevarthen C, Bardos G",Brain research,0.079,20674554,-1,-1
fronto parietal_00196,https://pubmed.ncbi.nlm.nih.gov/21398015/,Attention and cognitive control networks assessed in a dichotic listening fMRI study.,"Falkenberg LE, Specht K, Westerhausen R",Brain and cognition,0.079,21398015,-1,-1
fronto parietal_00197,https://pubmed.ncbi.nlm.nih.gov/23000255/,Co-localizing linguistic and musical syntax with intracranial EEG.,"Sammler D, Koelsch S, Ball T, Brandt A, Grigutsch M, Huppertz HJ, Knosche TR, Wellmer J, Widman G, Elger CE, Friederici AD, Schulze-Bonhage A",NeuroImage,0.079,23000255,-1,-1
fronto parietal_00198,https://pubmed.ncbi.nlm.nih.gov/23008180/,Losing the struggle to stay awake: divergent thalamic and cortical activity during microsleeps.,"Poudel GR, Innes CR, Bones PJ, Watts R, Jones RD",Human brain mapping,0.079,23008180,-1,-1
fronto parietal_00199,https://pubmed.ncbi.nlm.nih.gov/25180974/,Bilingual cognitive control in language switching: an fMRI study of English-Chinese late bilinguals.,"Ma H, Hu J, Xi J, Shen W, Ge J, Geng F, Wu Y, Guo J, Yao D",PloS one,0.079,25180974,-1,-1
fronto parietal_00200,https://pubmed.ncbi.nlm.nih.gov/25528225/,Multiparametric mapping of neurological soft signs in healthy adults.,"Hirjak D, Wolf RC, Kubera KM, Stieltjes B, Thomann PA",Brain structure & function,0.079,25528225,-1,-1
fronto parietal_00201,https://pubmed.ncbi.nlm.nih.gov/12457763/,Attention-related activity during episodic memory retrieval: a cross-function fMRI study.,"Cabeza R, Dolcos F, Prince SE, Rice HJ, Weissman DH, Nyberg L",Neuropsychologia,0.078,12457763,10.1016/s0028-3932(02)00170-7,-1
fronto parietal_00202,https://pubmed.ncbi.nlm.nih.gov/20363236/,Identification of attention and cognitive control networks in a parametric auditory fMRI study.,"Westerhausen R, Moosmann M, Alho K, Belsby SO, Hamalainen H, Medvedev S, Specht K, Hugdahl K",Neuropsychologia,0.078,20363236,10.1016/j.neuropsychologia.2010.03.028,-1
fronto parietal_00203,https://pubmed.ncbi.nlm.nih.gov/21397701/,Probing the cortical network underlying the psychological refractory period: a combined EEG-fMRI study.,"Hesselmann G, Flandin G, Dehaene S",NeuroImage,0.078,21397701,10.1016/j.neuroimage.2011.03.017,-1
fronto parietal_00204,https://pubmed.ncbi.nlm.nih.gov/21680848/,The involvement of the dopaminergic midbrain and cortico-striatal-thalamic circuits in the integration of reward prospect and attentional task demands.,"Krebs RM, Boehler CN, Roberts KC, Song AW, Woldorff MG","Cerebral cortex (New York, N.Y. : 1991)",0.078,21680848,-1,-1
fronto parietal_00205,https://pubmed.ncbi.nlm.nih.gov/24613934/,Altered causal connectivity of resting state brain networks in amnesic MCI.,"Liang P, Li Z, Deshpande G, Wang Z, Hu X, Li K",PloS one,0.078,24613934,-1,-1
fronto parietal_00206,https://pubmed.ncbi.nlm.nih.gov/26341950/,Brain structure and function correlates of cognitive subtypes in schizophrenia.,"Geisler D, Walton E, Naylor M, Roessner V, Lim KO, Charles Schulz S, Gollub RL, Calhoun VD, Sponheim SR, Ehrlich S",Psychiatry research,0.078,26341950,-1,-1
fronto parietal_00207,https://pubmed.ncbi.nlm.nih.gov/26826511/,Binge drinking impacts dorsal striatal response during decision making in adolescents.,"Jones SA, Cservenka A, Nagel BJ",NeuroImage,0.078,26826511,-1,-1
fronto parietal_00208,https://pubmed.ncbi.nlm.nih.gov/19103296/,Connectivity and signal intensity in the parieto-occipital cortex predicts top-down attentional effect in visual masking: an fMRI study based on individual  differences.,"Tsubomi H, Ikeda T, Hanakawa T, Hirose N, Fukuyama H, Osaka N",NeuroImage,0.077,19103296,-1,-1
fronto parietal_00209,https://pubmed.ncbi.nlm.nih.gov/21145902/,Biasing visual selection: functional neuroimaging of the interplay between spatial cueing and feature memory guidance.,"Soto D, Mok AY, McRobbie D, Quest R, Waldman A, Rotshtein P",Neuropsychologia,0.077,21145902,-1,-1
fronto parietal_00210,https://pubmed.ncbi.nlm.nih.gov/24348991/,Individual differences in brain structure and resting brain function underlie cognitive styles: evidence from the Embedded Figures Test.,"Hao X, Wang K, Li W, Yang W, Wei D, Qiu J, Zhang Q",PloS one,0.077,24348991,-1,-1
fronto parietal_00211,https://pubmed.ncbi.nlm.nih.gov/24473095/,Brain mechanisms underlying the effects of aging on different aspects of selective attention.,"Geerligs L, Saliasi E, Maurits NM, Renken RJ, Lorist MM",NeuroImage,0.077,24473095,-1,-1
fronto parietal_00212,https://pubmed.ncbi.nlm.nih.gov/28423021/,Trait impulsivity components correlate differently with proactive and reactive control.,"Huang S, Zhu Z, Zhang W, Chen Y, Zhen S",PloS one,0.077,28423021,-1,-1
fronto parietal_00213,https://pubmed.ncbi.nlm.nih.gov/29556183/,Fronto-Parietal Brain Responses to Visuotactile Congruence in an Anatomical Reference Frame.,"Limanowski J, Blankenburg F",Frontiers in human neuroscience,0.077,29556183,-1,-1
fronto parietal_00214,https://pubmed.ncbi.nlm.nih.gov/15128413/,Dissociating brain regions controlling the temporal and ordinal structure of learned movement sequences.,"Bengtsson SL, Ehrsson HH, Forssberg H, Ullen F",The European journal of neuroscience,0.076,15128413,-1,-1
fronto parietal_00215,https://pubmed.ncbi.nlm.nih.gov/19007800/,To retrieve or to calculate? Left angular gyrus mediates the retrieval of arithmetic facts during problem solving.,"Grabner RH, Ansari D, Koschutnig K, Reishofer G, Ebner F, Neuper C",Neuropsychologia,0.076,19007800,-1,-1
fronto parietal_00216,https://pubmed.ncbi.nlm.nih.gov/19457372/,"Made you look! Consciously perceived, irrelevant instructional cues can hijack the attentional network.","Moore KS, Porter CB, Weissman DH",NeuroImage,0.076,19457372,-1,-1
fronto parietal_00217,https://pubmed.ncbi.nlm.nih.gov/19572308/,Crossmodal influences in somatosensory cortex: Interaction of vision and touch.,"Dionne JK, Meehan SK, Legon W, Staines WR",Human brain mapping,0.076,19572308,-1,-1
fronto parietal_00218,https://pubmed.ncbi.nlm.nih.gov/20162604/,Parkinson's disease and healthy aging: independent and interacting effects on action selection.,"Hughes LE, Barker RA, Owen AM, Rowe JB",Human brain mapping,0.076,20162604,-1,-1
fronto parietal_00219,https://pubmed.ncbi.nlm.nih.gov/25191704/,Quantifying the reconfiguration of intrinsic networks during working memory.,"Cohen JR, Gallen CL, Jacobs EG, Lee TG, D'Esposito M",PloS one,0.076,25191704,-1,-1
fronto parietal_00220,https://pubmed.ncbi.nlm.nih.gov/26779002/,"Haptically Guided Grasping. fMRI Shows Right-Hemisphere Parietal Stimulus Encoding, and Bilateral Dorso-Ventral Parietal Gradients of Object- and Action-Related Processing during Grasp Execution.","Marangon M, Kubiak A, Kroliczak G",Frontiers in human neuroscience,0.076,26779002,-1,-1
fronto parietal_00221,https://pubmed.ncbi.nlm.nih.gov/26827815/,Individual attentional selection capacities are reflected in interhemispheric connectivity of the parietal cortex.,"Vossel S, Weidner R, Moos K, Fink GR",NeuroImage,0.076,26827815,10.1016/j.neuroimage.2016.01.054,-1
fronto parietal_00222,https://pubmed.ncbi.nlm.nih.gov/27780529/,Self-similarity and recursion as default modes in human cognition.,"Fischmeister FP, Martins MJD, Beisteiner R, Fitch WT",Cortex; a journal devoted to the study of the nervous system and behavior,0.076,27780529,10.1016/j.cortex.2016.08.016,-1
fronto parietal_00223,https://pubmed.ncbi.nlm.nih.gov/18729079/,Disentangling the prefrontal network for rule selection by means of a non-verbal  variant of the Wisconsin Card Sorting Test.,"Specht K, Lie CH, Shah NJ, Fink GR",Human brain mapping,0.075,18729079,10.1002/hbm.20637,-1
fronto parietal_00224,https://pubmed.ncbi.nlm.nih.gov/22465842/,An fMRI study of reduced perceptual load-dependent modulation of task-irrelevant  activity in adults with autism spectrum conditions.,"Ohta H, Yamada T, Watanabe H, Kanai C, Tanaka E, Ohno T, Takayama Y, Iwanami A, Kato N, Hashimoto R",NeuroImage,0.075,22465842,-1,-1
fronto parietal_00225,https://pubmed.ncbi.nlm.nih.gov/24367286/,Coding of level of ambiguity within neural systems mediating choice.,"Lopez-Paniagua D, Seger CA",Frontiers in neuroscience,0.075,24367286,-1,-1
fronto parietal_00226,https://pubmed.ncbi.nlm.nih.gov/25148078/,Striatal and hippocampal involvement in motor sequence chunking depends on the learning strategy.,"Lungu O, Monchi O, Albouy G, Jubault T, Ballarin E, Burnod Y, Doyon J",PloS one,0.075,25148078,-1,-1
fronto parietal_00227,https://pubmed.ncbi.nlm.nih.gov/26454185/,Behavioral activation can normalize neural hypoactivation in subthreshold depression during a monetary incentive delay task.,"Mori A, Okamoto Y, Okada G, Takagaki K, Jinnin R, Takamura M, Kobayakawa M, Yamawaki S",Journal of affective disorders,0.075,26454185,-1,-1
fronto parietal_00228,https://pubmed.ncbi.nlm.nih.gov/27263508/,"Predictability of what or where reduces brain activity, but a bottleneck occurs when both are predictable.","Davis B, Hasson U",NeuroImage,0.075,27263508,-1,-1
fronto parietal_00229,https://pubmed.ncbi.nlm.nih.gov/28046076/,Visual Imagery and False Memory for Pictures: A Functional Magnetic Resonance Imaging Study in Healthy Participants.,"Stephan-Otto C, Siddi S, Senior C, Munoz-Samons D, Ochoa S, Sanchez-Laforga AM, Brebion G",PloS one,0.075,28046076,-1,-1
fronto parietal_00230,https://pubmed.ncbi.nlm.nih.gov/18708149/,Developmental changes in neural activation and psychophysiological interaction patterns of brain regions associated with interference control and time perception.,"Neufang S, Fink GR, Herpertz-Dahlmann B, Willmes K, Konrad K",NeuroImage,0.074,18708149,-1,-1
fronto parietal_00231,https://pubmed.ncbi.nlm.nih.gov/19398308/,Functional connectivity reveals inefficient working memory systems in post-traumatic stress disorder.,"Shaw ME, Moores KA, Clark RC, McFarlane AC, Strother SC, Bryant RA, Brown GC, Taylor JD",Psychiatry research,0.074,19398308,-1,-1
fronto parietal_00232,https://pubmed.ncbi.nlm.nih.gov/21182966/,Effects of problem size and arithmetic operation on brain activation during calculation in children with varying levels of arithmetical fluency.,"De Smedt B, Holloway ID, Ansari D",NeuroImage,0.074,21182966,-1,-1
fronto parietal_00233,https://pubmed.ncbi.nlm.nih.gov/24675026/,Altered default mode and fronto-parietal network subsystems in patients with schizophrenia and their unaffected siblings.,"Chang X, Shen H, Wang L, Liu Z, Xin W, Hu D, Miao D",Brain research,0.074,24675026,-1,-1
fronto parietal_00234,https://pubmed.ncbi.nlm.nih.gov/25147520/,The relative contributions of frontal and parietal cortex for generalized quantifier comprehension.,"Olm CA, McMillan CT, Spotorno N, Clark R, Grossman M",Frontiers in human neuroscience,0.074,25147520,-1,-1
fronto parietal_00235,https://pubmed.ncbi.nlm.nih.gov/25344118/,A frontal but not parietal neural correlate of auditory consciousness.,"Brancucci A, Lugli V, Perrucci MG, Del Gratta C, Tommasi L",Brain structure & function,0.074,25344118,-1,-1
fronto parietal_00236,https://pubmed.ncbi.nlm.nih.gov/25679198/,The patterns of fractional amplitude of low-frequency fluctuations in depression  patients: the dissociation between temporal regions and fronto-parietal regions.,"Lai CH, Wu YT",Journal of affective disorders,0.074,25679198,-1,-1
fronto parietal_00237,https://pubmed.ncbi.nlm.nih.gov/26503692/,Transcranial alternating current stimulation affects the BOLD signal in a frequency and task-dependent manner.,"Cabral-Calderin Y, Anne Weinrich C, Schmidt-Samoa C, Poland E, Dechent P, Bahr M, Wilke M",Human brain mapping,0.074,26503692,-1,-1
fronto parietal_00238,https://pubmed.ncbi.nlm.nih.gov/17655831/,Making sense of nonsense: an fMRI study of task induced inference processes during discourse comprehension.,"Sieborger FT, Ferstl EC, von Cramon DY",Brain research,0.073,17655831,-1,-1
fronto parietal_00239,https://pubmed.ncbi.nlm.nih.gov/18282770/,Phonological processing in deaf signers and the impact of age of first language acquisition.,"MacSweeney M, Waters D, Brammer MJ, Woll B, Goswami U",NeuroImage,0.073,18282770,-1,-1
fronto parietal_00240,https://pubmed.ncbi.nlm.nih.gov/18702586/,Functional neuroanatomy of mental rotation.,"Milivojevic B, Hamm JP, Corballis MC",Journal of cognitive neuroscience,0.073,18702586,-1,-1
fronto parietal_00241,https://pubmed.ncbi.nlm.nih.gov/25784868/,Adaptation to recent conflict in the classical color-word Stroop-task mainly involves facilitation of processing of task-relevant information.,"Purmann S, Pollmann S",Frontiers in human neuroscience,0.073,25784868,10.3389/fnhum.2015.00088,-1
fronto parietal_00242,https://pubmed.ncbi.nlm.nih.gov/27294029/,Power spectrum scale invariance as a neural marker of cocaine misuse and altered  cognitive control.,"Ide JS, Hu S, Zhang S, Mujica-Parodi LR, Li CS",NeuroImage. Clinical,0.073,27294029,10.1016/j.nicl.2016.03.004,-1
fronto parietal_00243,https://pubmed.ncbi.nlm.nih.gov/28942896/,Visuo-spatial orienting during active exploratory behavior: Processing of task-related and stimulus-related signals.,"Macaluso E, Ogawa A",Cortex; a journal devoted to the study of the nervous system and behavior,0.073,28942896,10.1016/j.cortex.2017.08.032,-1
fronto parietal_00244,https://pubmed.ncbi.nlm.nih.gov/29428579/,Brain activations supporting linking of action phases in a sequential manual task.,"Safstrom D, Domellof E",NeuroImage,0.073,29428579,10.1016/j.neuroimage.2018.02.014,-1
fronto parietal_00245,https://pubmed.ncbi.nlm.nih.gov/29662447/,Neural Mechanisms Underlying Time Perception and Reward Anticipation.,"Apaydin N, Ustun S, Kale EH, Celikag I, Ozguven HD, Baskak B, Cicek M",Frontiers in human neuroscience,0.073,29662447,-1,-1
fronto parietal_00246,https://pubmed.ncbi.nlm.nih.gov/17239829/,Neural correlates of covert orienting of visual spatial attention along vertical  and horizontal dimensions.,"Mao L, Zhou B, Zhou W, Han S",Brain research,0.072,17239829,-1,-1
fronto parietal_00247,https://pubmed.ncbi.nlm.nih.gov/21334351/,Neural correlates of choice behavior related to impulsivity and venturesomeness.,"Hinvest NS, Elliott R, McKie S, Anderson IM",Neuropsychologia,0.072,21334351,-1,-1
fronto parietal_00248,https://pubmed.ncbi.nlm.nih.gov/24027166/,Predictors of coupling between structural and functional cortical networks in normal aging.,"Romero-Garcia R, Atienza M, Cantero JL",Human brain mapping,0.072,24027166,-1,-1
fronto parietal_00249,https://pubmed.ncbi.nlm.nih.gov/28077513/,Cognitive Control Structures in the Imitation Learning of Spatial Sequences and Rhythms-An fMRI Study.,"Sakreida K, Higuchi S, Di Dio C, Ziessler M, Turgeon M, Roberts N, Vogt S","Cerebral cortex (New York, N.Y. : 1991)",0.072,28077513,-1,-1
fronto parietal_00250,https://pubmed.ncbi.nlm.nih.gov/28802184/,Functional neural bases of numerosity judgments in healthy adults born preterm.,"Clark CAC, Liu Y, Wright NLA, Bedrick A, Edgin JO",Brain and cognition,0.072,28802184,-1,-1
fronto parietal_00251,https://pubmed.ncbi.nlm.nih.gov/29354044/,Effects of Acute Alcohol Intoxication on Empathic Neural Responses for Pain.,"Hu Y, Cui Z, Fan M, Pei Y, Wang Z",Frontiers in human neuroscience,0.072,29354044,-1,-1
fronto parietal_00252,https://pubmed.ncbi.nlm.nih.gov/29845006/,Decreased functional connectivity in the fronto-parietal network in children with mood disorders compared to children with dyslexia during rest: An fMRI study.,"Horowitz-Kraus T, Woodburn M, Rajagopal A, Versace AL, Kowatch RA, Bertocci MA, Bebko G, Almeida JRC, Perlman SB, Travis MJ, Gill MK, Bonar L, Schirda C, Diwadkar VA, Sunshine JL, Birmaher B, Axelson D, Gerry Taylor H, Horwitz SM, Frazier T, Eugene Arnold L, Fristad MA, Youngstrom EA, Findling RL, Phillips ML, Holland SK",NeuroImage. Clinical,0.072,29845006,-1,-1
fronto parietal_00253,https://pubmed.ncbi.nlm.nih.gov/19818906/,Executive functions in the absence of behavior: functional imaging of the minimally conscious state.,"Monti MM, Coleman MR, Owen AM",Progress in brain research,0.071,19818906,-1,-1
fronto parietal_00254,https://pubmed.ncbi.nlm.nih.gov/20974266/,Incongruence effects in crossmodal emotional integration.,"Muller VI, Habel U, Derntl B, Schneider F, Zilles K, Turetsky BI, Eickhoff SB",NeuroImage,0.071,20974266,-1,-1
fronto parietal_00255,https://pubmed.ncbi.nlm.nih.gov/21391262/,Mapping reflexive shifts of attention in eye-centered and hand-centered coordinate systems.,"Cazzato V, Macaluso E, Crostella F, Aglioti SM",Human brain mapping,0.071,21391262,-1,-1
fronto parietal_00256,https://pubmed.ncbi.nlm.nih.gov/23408984/,Cortical signatures of dyslexia and remediation: an intrinsic functional connectivity approach.,"Koyama MS, Di Martino A, Kelly C, Jutagir DR, Sunshine J, Schwartz SJ, Castellanos FX, Milham MP",PloS one,0.071,23408984,-1,-1
fronto parietal_00257,https://pubmed.ncbi.nlm.nih.gov/23939020/,A multivariate analysis of age-related differences in functional networks supporting conflict resolution.,"Salami A, Rieckmann A, Fischer H, Backman L",NeuroImage,0.071,23939020,-1,-1
fronto parietal_00258,https://pubmed.ncbi.nlm.nih.gov/28688741/,Stronger default mode network connectivity is associated with poorer clinical insight in youth at ultra high-risk for psychotic disorders.,"Clark SV, Mittal VA, Bernard JA, Ahmadi A, King TZ, Turner JA",Schizophrenia research,0.071,28688741,-1,-1
fronto parietal_00259,https://pubmed.ncbi.nlm.nih.gov/28733834/,Long-term intensive gymnastic training induced changes in intra- and inter-network functional connectivity: an independent component analysis.,"Huang H, Wang J, Seger C, Lu M, Deng F, Wu X, He Y, Niu C, Wang J, Huang R",Brain structure & function,0.071,28733834,-1,-1
fronto parietal_00260,https://pubmed.ncbi.nlm.nih.gov/28806707/,Deviant functional activation and connectivity of the right insula are associated with lack of awareness of episodic memory impairment in nonamnesic alcoholism.,"Le Berre AP, Muller-Oehring EM, Schulte T, Serventi MR, Pfefferbaum A, Sullivan EV",Cortex; a journal devoted to the study of the nervous system and behavior,0.071,28806707,-1,-1
fronto parietal_00261,https://pubmed.ncbi.nlm.nih.gov/17478107/,Overt and imagined singing of an Italian aria.,"Kleber B, Birbaumer N, Veit R, Trevorrow T, Lotze M",NeuroImage,0.07,17478107,10.1016/j.neuroimage.2007.02.053,-1
fronto parietal_00262,https://pubmed.ncbi.nlm.nih.gov/23563963/,Complexity in Relational Processing Predicts Changes in Functional Brain Network  Dynamics.,"Cocchi L, Halford GS, Zalesky A, Harding IH, Ramm BJ, Cutmore T, Shum DH, Mattingley JB","Cerebral cortex (New York, N.Y. : 1991)",0.07,23563963,10.1093/cercor/bht075,-1
fronto parietal_00263,https://pubmed.ncbi.nlm.nih.gov/24705397/,Spatially distributed effects of mental exhaustion on resting-state FMRI networks.,"Esposito F, Otto T, Zijlstra FR, Goebel R",PloS one,0.07,24705397,10.1371/journal.pone.0094222,-1
fronto parietal_00264,https://pubmed.ncbi.nlm.nih.gov/25339893/,Activity of right premotor-parietal regions dependent upon imagined force level:  an fMRI study.,"Mizuguchi N, Nakata H, Kanosue K",Frontiers in human neuroscience,0.07,25339893,10.3389/fnhum.2014.00810,-1
fronto parietal_00265,https://pubmed.ncbi.nlm.nih.gov/25819306/,Memory detection using fMRI - Does the encoding context matter?,"Peth J, Sommer T, Hebart MN, Vossel G, Buchel C, Gamer M",NeuroImage,0.07,25819306,-1,-1
fronto parietal_00266,https://pubmed.ncbi.nlm.nih.gov/26300757/,On the existence of a generalized non-specific task-dependent network.,"Hugdahl K, Raichle ME, Mitra A, Specht K",Frontiers in human neuroscience,0.07,26300757,-1,-1
fronto parietal_00267,https://pubmed.ncbi.nlm.nih.gov/28284798/,Interactions between the anterior cingulate-insula network and the fronto-parietal network during perceptual decision-making.,"Chand GB, Dhamala M",NeuroImage,0.07,28284798,-1,-1
fronto parietal_00268,https://pubmed.ncbi.nlm.nih.gov/28829994/,Language for action: Motor resonance during the processing of human and robotic voices.,"Di Cesare G, Errante A, Marchi M, Cuccio V",Brain and cognition,0.07,28829994,-1,-1
fronto parietal_00269,https://pubmed.ncbi.nlm.nih.gov/29593518/,Task-Relevant Information Modulates Primary Motor Cortex Activity Before Movement Onset.,"Calderon CB, Van Opstal F, Peigneux P, Verguts T, Gevers W",Frontiers in human neuroscience,0.07,29593518,-1,-1
fronto parietal_00270,https://pubmed.ncbi.nlm.nih.gov/18412112/,The neural basis of response inhibition and attention allocation as mediated by gestational age.,"Lawrence EJ, Rubia K, Murray RM, McGuire PK, Walshe M, Allin M, Giampietro V, Rifkin L, Williams SC, Nosarti C",Human brain mapping,0.069,18412112,-1,-1
fronto parietal_00271,https://pubmed.ncbi.nlm.nih.gov/19034897/,FMRI correlates of visuo-spatial reorienting investigated with an attention shifting double-cue paradigm.,"Natale E, Marzi CA, Macaluso E",Human brain mapping,0.069,19034897,-1,-1
fronto parietal_00272,https://pubmed.ncbi.nlm.nih.gov/19167505/,Neural correlates of semantic ambiguity processing during context verification.,"Hoenig K, Scheef L",NeuroImage,0.069,19167505,-1,-1
fronto parietal_00273,https://pubmed.ncbi.nlm.nih.gov/19679192/,CNS activation and regional connectivity during pantomime observation: no engagement of the mirror neuron system for deaf signers.,"Emmorey K, Xu J, Gannon P, Goldin-Meadow S, Braun A",NeuroImage,0.069,19679192,-1,-1
fronto parietal_00274,https://pubmed.ncbi.nlm.nih.gov/21557954/,Evolution of non-speech sound memory in postlingual deafness: implications for cochlear implant rehabilitation.,"Lazard DS, Giraud AL, Truy E, Lee HJ",Neuropsychologia,0.069,21557954,-1,-1
fronto parietal_00275,https://pubmed.ncbi.nlm.nih.gov/22096519/,Evidence for thalamic involvement in the thermal grill illusion: an FMRI study.,"Lindstedt F, Johansson B, Martinsen S, Kosek E, Fransson P, Ingvar M",PloS one,0.069,22096519,-1,-1
fronto parietal_00276,https://pubmed.ncbi.nlm.nih.gov/23796543/,The contribution of fronto-parietal regions to sentence comprehension: insights from the Moses illusion.,"Raposo A, Marques JF",NeuroImage,0.069,23796543,-1,-1
fronto parietal_00277,https://pubmed.ncbi.nlm.nih.gov/24080400/,The neural pathway underlying a numerical working memory task in abacus-trained children and associated functional connectivity in the resting brain.,"Li Y, Hu Y, Zhao M, Wang Y, Huang J, Chen F",Brain research,0.069,24080400,-1,-1
fronto parietal_00278,https://pubmed.ncbi.nlm.nih.gov/24099849/,Talking about social conflict in the MRI scanner: neural correlates of being empathized with.,"Seehausen M, Kazzer P, Bajbouj M, Heekeren HR, Jacobs AM, Klann-Delius G, Menninghaus W, Prehn K",NeuroImage,0.069,24099849,-1,-1
fronto parietal_00279,https://pubmed.ncbi.nlm.nih.gov/24324753/,Bayesian network analysis reveals alterations to default mode network connectivity in individuals at risk for Alzheimer's disease.,"Li R, Yu J, Zhang S, Bao F, Wang P, Huang X, Li J",PloS one,0.069,24324753,-1,-1
fronto parietal_00280,https://pubmed.ncbi.nlm.nih.gov/24847235/,Dissociating dynamic probability and predictability in observed actions-an fMRI study.,"Ahlheim C, Stadler W, Schubotz RI",Frontiers in human neuroscience,0.069,24847235,-1,-1
fronto parietal_00281,https://pubmed.ncbi.nlm.nih.gov/25311282/,Parsing The Intrinsic Networks Underlying Attention: A Resting State Study.,"Visintin E, De Panfilis C, Antonucci C, Capecci C, Marchesi C, Sambataro F",Behavioural brain research,0.069,25311282,10.1016/j.bbr.2014.10.002,-1
fronto parietal_00282,https://pubmed.ncbi.nlm.nih.gov/25566010/,Tactile priming modulates the activation of the fronto-parietal circuit during tactile angle match and non-match processing: an fMRI study.,"Yang J, Yu Y, Kunita A, Huang Q, Wu J, Sawamoto N, Fukuyama H",Frontiers in human neuroscience,0.069,25566010,10.3389/fnhum.2014.00926,-1
fronto parietal_00283,https://pubmed.ncbi.nlm.nih.gov/25951196/,"Variation in functional connectivity along anterior-to-posterior intraparietal sulcus, and relationship with age across late childhood and adolescence.","Vinette SA, Bray S",Developmental cognitive neuroscience,0.069,25951196,10.1016/j.dcn.2015.04.004,-1
