paper_name,paper_url,Title,Author,Journal,Loading,PMID,Doi,download_status
fronto parietal_00001,https://pubmed.ncbi.nlm.nih.gov/21729757/,Fronto-parietal hypo-activation during working memory independent of structural abnormalities: conjoint fMRI and sMRI analyses in adolescent offspring of schizophrenia patients.,"Diwadkar VA, Pruitt P, Goradia D, Murphy E, Bakshi N, Keshavan MS, Rajan U, Reid A, Zajac-Benitez C",NeuroImage,0.31,21729757,-1,-1
fronto parietal_00002,https://pubmed.ncbi.nlm.nih.gov/23670989/,Assessing the function of the fronto-parietal attention network: insights from resting-state fMRI and the attentional network test.,"Markett S, Reuter M, Montag C, Voigt G, Lachmann B, Rudorf S, Elger CE, Weber B",Human brain mapping,0.301,23670989,-1,-1
fronto parietal_00003,https://pubmed.ncbi.nlm.nih.gov/10220229/,Learning-related neuronal responses in prefrontal cortex studied with functional  neuroimaging.,"Fletcher P, Buchel C, Josephs O, Friston K, Dolan R","Cerebral cortex (New York, N.Y. : 1991)",0.295,10220229,-1,-1
fronto parietal_00004,https://pubmed.ncbi.nlm.nih.gov/23767925/,Global increase in task-related fronto-parietal activity after focal frontal lobe lesion.,"Woolgar A, Bor D, Duncan J",Journal of cognitive neuroscience,0.29,23767925,10.1162/jocn_a_00432,-1
fronto parietal_00005,https://pubmed.ncbi.nlm.nih.gov/26436710/,Ventral fronto-parietal contributions to the disruption of visual working memory  storage.,"Hakun JG, Ravizza SM",NeuroImage,0.282,26436710,10.1016/j.neuroimage.2015.09.056,-1
fronto parietal_00006,https://pubmed.ncbi.nlm.nih.gov/24361661/,fMRI characterization of visual working memory recognition.,"Rahm B, Kaiser J, Unterrainer JM, Simon J, Bledowski C",NeuroImage,0.265,24361661,10.1016/j.neuroimage.2013.12.017,-1
fronto parietal_00007,https://pubmed.ncbi.nlm.nih.gov/15734339/,EEG source analysis and fMRI reveal two electrical sources in the fronto-parietal operculum during subepidermal finger stimulation.,"Stancak A, Polacek H, Vrana J, Rachmanova R, Hoechstetter K, Tintra J, Scherg M",NeuroImage,0.26,15734339,10.1016/j.neuroimage.2004.10.025,-1
fronto parietal_00008,https://pubmed.ncbi.nlm.nih.gov/17849020/,No language-specific activation during linguistic processing of observed actions.,"Meister IG, Iacoboni M",PloS one,0.259,17849020,10.1371/journal.pone.0000891,-1
fronto parietal_00009,https://pubmed.ncbi.nlm.nih.gov/20715080/,Effective connectivity of the multiplication network: a functional MRI and multivariate Granger Causality Mapping study.,"Krueger F, Landgraf S, van der Meer E, Deshpande G, Hu X",Human brain mapping,0.257,20715080,10.1002/hbm.21119,-1
fronto parietal_00010,https://pubmed.ncbi.nlm.nih.gov/19925871/,Imaging brain fatigue from sustained mental workload: an ASL perfusion study of the time-on-task effect.,"Lim J, Wu WC, Wang J, Detre JA, Dinges DF, Rao H",NeuroImage,0.238,19925871,-1,-1
fronto parietal_00011,https://pubmed.ncbi.nlm.nih.gov/15313521/,Functional MRI mapping of brain activation during visually guided saccades and antisaccades: cortical and subcortical networks.,"Matsuda T, Matsuura M, Ohkubo T, Ohkubo H, Matsushima E, Inoue K, Taira M, Kojima T",Psychiatry research,0.236,15313521,-1,-1
fronto parietal_00012,https://pubmed.ncbi.nlm.nih.gov/27150704/,Audience effects on the neural correlates of relational reasoning in adolescence.,"Dumontheil I, Wolf LK, Blakemore SJ",Neuropsychologia,0.233,27150704,-1,-1
fronto parietal_00013,https://pubmed.ncbi.nlm.nih.gov/21649758/,Intensive language training and attention modulate the involvement of fronto-parietal regions during a non-verbal auditory discrimination task.,"Elmer S, Meyer M, Marrama L, Jancke L",The European journal of neuroscience,0.229,21649758,-1,-1
fronto parietal_00014,https://pubmed.ncbi.nlm.nih.gov/29425803/,Exogenous vs. endogenous attention: Shifting the balance of fronto-parietal activity.,"Meyer KN, Du F, Parks E, Hopfinger JB",Neuropsychologia,0.224,29425803,-1,-1
fronto parietal_00015,https://pubmed.ncbi.nlm.nih.gov/25734897/,Domain-independent neural underpinning of task-switching: an fMRI investigation.,"Vallesi A, Arbula S, Capizzi M, Causin F, D'Avella D",Cortex; a journal devoted to the study of the nervous system and behavior,0.215,25734897,-1,-1
fronto parietal_00016,https://pubmed.ncbi.nlm.nih.gov/16997576/,Observing complex action sequences: The role of the fronto-parietal mirror neuron system.,"Molnar-Szakacs I, Kaplan J, Greenfield PM, Iacoboni M",NeuroImage,0.207,16997576,-1,-1
fronto parietal_00017,https://pubmed.ncbi.nlm.nih.gov/23319628/,Using model-based functional MRI to locate working memory updates and declarative memory retrievals in the fronto-parietal network.,"Borst JP, Anderson JR",Proceedings of the National Academy of Sciences of the United States of America,0.205,23319628,-1,-1
fronto parietal_00018,https://pubmed.ncbi.nlm.nih.gov/22114080/,Culture-related differences in default network activity during visuo-spatial judgments.,"Goh JO, Hebrank AC, Sutton BP, Chee MW, Sim SK, Park DC",Social cognitive and affective neuroscience,0.202,22114080,-1,-1
fronto parietal_00019,https://pubmed.ncbi.nlm.nih.gov/25463450/,Microstructure of frontoparietal connections predicts individual resistance to sleep deprivation.,"Cui J, Tkachenko O, Gogel H, Kipman M, Preer LA, Weber M, Divatia SC, Demers LA, Olson EA, Buchholz JL, Bark JS, Rosso IM, Rauch SL, Killgore WD",NeuroImage,0.202,25463450,-1,-1
fronto parietal_00020,https://pubmed.ncbi.nlm.nih.gov/27761399/,Disruptions in neural connectivity associated with reduced susceptibility to a depth inversion illusion in youth at ultra high risk for psychosis.,"Gupta T, Silverstein SM, Bernard JA, Keane BP, Papathomas TV, Pelletier-Baldelli A, Dean DJ, Newberry RE, Ristanovic I, Mittal VA",NeuroImage. Clinical,0.196,27761399,-1,-1
fronto parietal_00021,https://pubmed.ncbi.nlm.nih.gov/28785212/,The Neural Bases of Event Monitoring across Domains: a Simultaneous ERP-fMRI Study.,"Tarantino V, Mazzonetto I, Formica S, Causin F, Vallesi A",Frontiers in human neuroscience,0.195,28785212,10.3389/fnhum.2017.00376,-1
fronto parietal_00022,https://pubmed.ncbi.nlm.nih.gov/16135780/,Neuro-functional differences associated with arithmetic processing in Turner syndrome.,"Kesler SR, Menon V, Reiss AL","Cerebral cortex (New York, N.Y. : 1991)",0.185,16135780,10.1093/cercor/bhj028,-1
fronto parietal_00023,https://pubmed.ncbi.nlm.nih.gov/21228301/,Controlling instabilities in manipulation requires specific cortical-striatal-cerebellar networks.,"Mosier K, Lau C, Wang Y, Venkadesan M, Valero-Cuevas FJ",Journal of neurophysiology,0.185,21228301,10.1152/jn.00757.2010,-1
fronto parietal_00024,https://pubmed.ncbi.nlm.nih.gov/22608404/,Neural representations of unfamiliar objects are modulated by sensorimotor experience.,"Bellebaum C, Tettamanti M, Marchetta E, Della Rosa P, Rizzo G, Daum I, Cappa SF",Cortex; a journal devoted to the study of the nervous system and behavior,0.184,22608404,10.1016/j.cortex.2012.03.023,-1
fronto parietal_00025,https://pubmed.ncbi.nlm.nih.gov/28017920/,Common and distinct brain regions processing multisensory bodily signals for peripersonal space and body ownership.,"Grivaz P, Blanke O, Serino A",NeuroImage,0.182,28017920,10.1016/j.neuroimage.2016.12.052,-1
fronto parietal_00026,https://pubmed.ncbi.nlm.nih.gov/29555427/,Temporal evolution of neural activity and connectivity during microsleeps when rested and following sleep restriction.,"Poudel GR, Innes CRH, Jones RD",NeuroImage,0.182,29555427,-1,-1
fronto parietal_00027,https://pubmed.ncbi.nlm.nih.gov/27199694/,Mapping of the Underlying Neural Mechanisms of Maintenance and Manipulation in Visuo-Spatial Working Memory Using An n-back Mental Rotation Task: A Functional Magnetic Resonance Imaging Study.,"Lamp G, Alexander B, Laycock R, Crewther DP, Crewther SG",Frontiers in behavioral neuroscience,0.18,27199694,-1,-1
fronto parietal_00028,https://pubmed.ncbi.nlm.nih.gov/28417219/,Treatment effect of methylphenidate on intrinsic functional brain network in medication-naive ADHD children: A multivariate analysis.,"Yoo JH, Kim D, Choi J, Jeong B",Brain imaging and behavior,0.177,28417219,-1,-1
fronto parietal_00029,https://pubmed.ncbi.nlm.nih.gov/20171288/,Lapsing when sleep deprived: neural activation characteristics of resistant and vulnerable individuals.,"Chee MW, Tan JC",NeuroImage,0.175,20171288,-1,-1
fronto parietal_00030,https://pubmed.ncbi.nlm.nih.gov/24135773/,Shifted neuronal balance during stimulus-response integration in schizophrenia: an fMRI study.,"Cieslik EC, Muller VI, Kellermann TS, Grefkes C, Halfter S, Eickhoff SB",Brain structure & function,0.175,24135773,-1,-1
fronto parietal_00031,https://pubmed.ncbi.nlm.nih.gov/20140099/,Sleep deprivation impairs object-selective attention: a view from the ventral visual cortex.,"Lim J, Tan JC, Parimal S, Dinges DF, Chee MW",PloS one,0.172,20140099,-1,-1
fronto parietal_00032,https://pubmed.ncbi.nlm.nih.gov/21391280/,Challenging a decade of brain research on task switching: brain activation in the task-switching paradigm reflects adaptation rather than reconfiguration of task sets.,"De Baene W, Kuhn S, Brass M",Human brain mapping,0.172,21391280,-1,-1
fronto parietal_00033,https://pubmed.ncbi.nlm.nih.gov/27103136/,Developmental trajectories of cerebral blood flow and oxidative metabolism at baseline and during working memory tasks.,"Jog MA, Yan L, Kilroy E, Krasileva K, Jann K, LeClair H, Elashoff D, Wang DJJ",NeuroImage,0.169,27103136,-1,-1
fronto parietal_00034,https://pubmed.ncbi.nlm.nih.gov/18823252/,Attending to multiple visual streams: interactions between location-based and category-based attentional selection.,"Fagioli S, Macaluso E",Journal of cognitive neuroscience,0.165,18823252,-1,-1
fronto parietal_00035,https://pubmed.ncbi.nlm.nih.gov/20138255/,Simulating neurocognitive aging: effects of a dopaminergic antagonist on brain activity during working memory.,"Fischer H, Nyberg L, Karlsson S, Karlsson P, Brehmer Y, Rieckmann A, MacDonald SW, Farde L, Backman L",Biological psychiatry,0.162,20138255,-1,-1
fronto parietal_00036,https://pubmed.ncbi.nlm.nih.gov/21864560/,Neural bases of selective attention in action video game players.,"Bavelier D, Achtman RL, Mani M, Focker J",Vision research,0.162,21864560,-1,-1
fronto parietal_00037,https://pubmed.ncbi.nlm.nih.gov/19400684/,Spatial attention evokes similar activation patterns for visual and auditory stimuli.,"Smith DV, Davis B, Niu K, Healy EW, Bonilha L, Fridriksson J, Morgan PS, Rorden C",Journal of cognitive neuroscience,0.161,19400684,-1,-1
fronto parietal_00038,https://pubmed.ncbi.nlm.nih.gov/19583471/,The function of words: distinct neural correlates for words denoting differently  manipulable objects.,"Rueschemeyer SA, van Rooij D, Lindemann O, Willems RM, Bekkering H",Journal of cognitive neuroscience,0.161,19583471,-1,-1
fronto parietal_00039,https://pubmed.ncbi.nlm.nih.gov/19643585/,Brain activation during executive processes in schizophrenia.,"Royer A, Schneider FC, Grosselin A, Pellet J, Barral FG, Laurent B, Brouillet D, Lang F",Psychiatry research,0.159,19643585,-1,-1
fronto parietal_00040,https://pubmed.ncbi.nlm.nih.gov/23044088/,Working memory of somatosensory stimuli: an fMRI study.,"Savini N, Brunetti M, Babiloni C, Ferretti A",International journal of psychophysiology : official journal of the International Organization of Psychophysiology,0.159,23044088,-1,-1
fronto parietal_00041,https://pubmed.ncbi.nlm.nih.gov/23978652/,Selective Attention to Temporal Features on Nested Time Scales.,"Henry MJ, Herrmann B, Obleser J","Cerebral cortex (New York, N.Y. : 1991)",0.159,23978652,10.1093/cercor/bht240,-1
fronto parietal_00042,https://pubmed.ncbi.nlm.nih.gov/27026657/,Working memory filtering continues to develop into late adolescence.,"Peverill M, McLaughlin KA, Finn AS, Sheridan MA",Developmental cognitive neuroscience,0.158,27026657,10.1016/j.dcn.2016.02.004,-1
fronto parietal_00043,https://pubmed.ncbi.nlm.nih.gov/25308823/,Contribution of the motor system to the perception of reachable space: an fMRI study.,"Bartolo A, Coello Y, Edwards MG, Delepoulle S, Endo S, Wing AM",The European journal of neuroscience,0.157,25308823,10.1111/ejn.12742,-1
fronto parietal_00044,https://pubmed.ncbi.nlm.nih.gov/28208069/,Neural activity during production of rorschach responses: An fMRI study.,"Giromini L, Viglione DJ Jr, Zennaro A, Cauda F",Psychiatry research. Neuroimaging,0.157,28208069,-1,-1
fronto parietal_00045,https://pubmed.ncbi.nlm.nih.gov/28572756/,Differences and Similarities for Spatial and Feature-Based Selective Attentional  Orienting.,"Galashan D, Siemann J",Frontiers in neuroscience,0.156,28572756,-1,-1
fronto parietal_00046,https://pubmed.ncbi.nlm.nih.gov/16122946/,Neural correlates of superior intelligence: stronger recruitment of posterior parietal cortex.,"Lee KH, Choi YY, Gray JR, Cho SH, Chae JH, Lee S, Kim K",NeuroImage,0.155,16122946,-1,-1
fronto parietal_00047,https://pubmed.ncbi.nlm.nih.gov/23052545/,"The ""vegetarian brain"": chatting with monkeys and pigs?","Filippi M, Riccitelli G, Meani A, Falini A, Comi G, Rocca MA",Brain structure & function,0.155,23052545,-1,-1
fronto parietal_00048,https://pubmed.ncbi.nlm.nih.gov/23660436/,Task-load manipulation in the Symbol Digit Modalities Test: an alternative measure of information processing speed.,"Forn C, Ripolles P, Cruz-Gomez AJ, Belenguer A, Gonzalez-Torre JA, Avila C",Brain and cognition,0.155,23660436,-1,-1
fronto parietal_00049,https://pubmed.ncbi.nlm.nih.gov/24600374/,Sensitivity of fNIRS to cognitive state and load.,"Fishburn FA, Norr ME, Medvedev AV, Vaidya CJ",Frontiers in human neuroscience,0.155,24600374,-1,-1
fronto parietal_00050,https://pubmed.ncbi.nlm.nih.gov/22541026/,Action anticipation beyond the action observation network: a functional magnetic  resonance imaging study in expert basketball players.,"Abreu AM, Macaluso E, Azevedo RT, Cesari P, Urgesi C, Aglioti SM",The European journal of neuroscience,0.154,22541026,-1,-1
fronto parietal_00051,https://pubmed.ncbi.nlm.nih.gov/21452938/,Reward reduces conflict by enhancing attentional control and biasing visual cortical processing.,"Padmala S, Pessoa L",Journal of cognitive neuroscience,0.151,21452938,-1,-1
fronto parietal_00052,https://pubmed.ncbi.nlm.nih.gov/21134387/,Retention of identity versus expression of emotional faces differs in the recruitment of limbic areas.,"Roder CH, Mohr H, Linden DE",Neuropsychologia,0.15,21134387,-1,-1
fronto parietal_00053,https://pubmed.ncbi.nlm.nih.gov/22108504/,Emotional faces and the default mode network.,"Sreenivas S, Boehm SG, Linden DE",Neuroscience letters,0.149,22108504,-1,-1
fronto parietal_00054,https://pubmed.ncbi.nlm.nih.gov/14615298/,Cortical mechanisms of feature-based attentional control.,"Liu T, Slotnick SD, Serences JT, Yantis S","Cerebral cortex (New York, N.Y. : 1991)",0.148,14615298,-1,-1
fronto parietal_00055,https://pubmed.ncbi.nlm.nih.gov/18621033/,Neural substrates for visual pattern recognition learning in Igo.,"Itoh K, Kitamura H, Fujii Y, Nakada T",Brain research,0.147,18621033,-1,-1
fronto parietal_00056,https://pubmed.ncbi.nlm.nih.gov/24671130/,Structural and functional cerebral correlates of hypnotic suggestibility.,"Huber A, Lui F, Duzzi D, Pagnoni G, Porro CA",PloS one,0.147,24671130,-1,-1
fronto parietal_00057,https://pubmed.ncbi.nlm.nih.gov/26733841/,Behavioral and Neural Plasticity of Ocular Motor Control: Changes in Performance  and fMRI Activity Following Antisaccade Training.,"Jamadar SD, Johnson BP, Clough M, Egan GF, Fielding J",Frontiers in human neuroscience,0.145,26733841,-1,-1
fronto parietal_00058,https://pubmed.ncbi.nlm.nih.gov/22974555/,Counterfactual thinking and reward processing: an fMRI study of responses to gamble outcomes.,"Henderson SE, Norris CJ",NeuroImage,0.144,22974555,-1,-1
fronto parietal_00059,https://pubmed.ncbi.nlm.nih.gov/23767921/,Longitudinal working memory development is related to structural maturation of frontal and parietal cortices.,"Tamnes CK, Walhovd KB, Grydeland H, Holland D, Ostby Y, Dale AM, Fjell AM",Journal of cognitive neuroscience,0.143,23767921,-1,-1
fronto parietal_00060,https://pubmed.ncbi.nlm.nih.gov/24901995/,Ongoing activity in temporally coherent networks predicts intra-subject fluctuation of response time to sporadic executive control demands.,"Nozawa T, Sugiura M, Yokoyama R, Ihara M, Kotozaki Y, Miyauchi CM, Kanno A, Kawashima R",PloS one,0.143,24901995,-1,-1
fronto parietal_00061,https://pubmed.ncbi.nlm.nih.gov/17071112/,Neural mechanisms for response selection: comparing selection of responses and items from working memory.,"Hester R, D'Esposito M, Cole MW, Garavan H",NeuroImage,0.142,17071112,10.1016/j.neuroimage.2006.08.001,-1
fronto parietal_00062,https://pubmed.ncbi.nlm.nih.gov/23645101/,Brain activation deficit in increased-load working memory tasks among adults with ADHD using fMRI.,"Ko CH, Yen JY, Yen CF, Chen CS, Lin WC, Wang PW, Liu GC",European archives of psychiatry and clinical neuroscience,0.141,23645101,10.1007/s00406-013-0407-2,-1
fronto parietal_00063,https://pubmed.ncbi.nlm.nih.gov/21147233/,Right parietal dominance in spatial egocentric discrimination.,"Loayza FR, Fernandez-Seara MA, Aznarez-Sanado M, Pastor MA",NeuroImage,0.14,21147233,10.1016/j.neuroimage.2010.12.011,-1
fronto parietal_00064,https://pubmed.ncbi.nlm.nih.gov/25309392/,Distributed cognitive maps reflecting real distances between places and views in  the human brain.,"Sulpizio V, Committeri G, Galati G",Frontiers in human neuroscience,0.14,25309392,10.3389/fnhum.2014.00716,-1
fronto parietal_00065,https://pubmed.ncbi.nlm.nih.gov/18296434/,Functional coactivation map of the human brain.,"Toro R, Fox PT, Paus T","Cerebral cortex (New York, N.Y. : 1991)",0.139,18296434,-1,-1
fronto parietal_00066,https://pubmed.ncbi.nlm.nih.gov/22877840/,Functional anatomy of temporal organisation and domain-specificity of episodic memory retrieval.,"Kwok SC, Shallice T, Macaluso E",Neuropsychologia,0.139,22877840,-1,-1
fronto parietal_00067,https://pubmed.ncbi.nlm.nih.gov/15006681/,A functional MRI study of cortical activations associated with object manipulation in patients with MS.,"Filippi M, Rocca MA, Mezzapesa DM, Falini A, Colombo B, Scotti G, Comi G",NeuroImage,0.138,15006681,-1,-1
fronto parietal_00068,https://pubmed.ncbi.nlm.nih.gov/29354041/,Longitudinal Brain Development of Numerical Skills in Typically Developing Children and Children with Developmental Dyscalculia.,"McCaskey U, von Aster M, Maurer U, Martin E, O'Gorman Tuura R, Kucian K",Frontiers in human neuroscience,0.137,29354041,-1,-1
fronto parietal_00069,https://pubmed.ncbi.nlm.nih.gov/22476131/,Ventral and dorsal fiber systems for imagined and executed movement.,"Vry MS, Saur D, Rijntjes M, Umarova R, Kellmeyer P, Schnell S, Glauche V, Hamzei F, Weiller C",Experimental brain research,0.136,22476131,-1,-1
fronto parietal_00070,https://pubmed.ncbi.nlm.nih.gov/17204249/,The neural circuitry underlying the executive control of auditory spatial attention.,"Wu CT, Weissman DH, Roberts KC, Woldorff MG",Brain research,0.135,17204249,-1,-1
fronto parietal_00071,https://pubmed.ncbi.nlm.nih.gov/21976418/,Optimized neural coding? Control mechanisms in large cortical networks implemented by connectivity changes.,"Cross KA, Iacoboni M",Human brain mapping,0.135,21976418,-1,-1
fronto parietal_00072,https://pubmed.ncbi.nlm.nih.gov/26388724/,Gambling on visual performance: neural correlates of metacognitive choice between visual lotteries.,"Wu SW, Delgado MR, Maloney LT",Frontiers in neuroscience,0.134,26388724,-1,-1
fronto parietal_00073,https://pubmed.ncbi.nlm.nih.gov/21278194/,Development of the action observation network during early adolescence: a longitudinal study.,"Shaw DJ, Grosbras MH, Leonard G, Pike GB, Paus T",Social cognitive and affective neuroscience,0.131,21278194,-1,-1
fronto parietal_00074,https://pubmed.ncbi.nlm.nih.gov/17828390/,Differential effects of erythropoietin on neural and cognitive measures of executive function 3 and 7 days post-administration.,"Miskowiak K, Inkster B, O'Sullivan U, Selvaraj S, Goodwin GM, Harmer CJ",Experimental brain research,0.13,17828390,-1,-1
fronto parietal_00075,https://pubmed.ncbi.nlm.nih.gov/22079455/,"The link between visual exploration and neuronal activity: a multi-modal study combining eye tracking, functional magnetic resonance imaging and transcranial magnetic stimulation.","Chaves S, Vannini P, Jann K, Wurtz P, Federspiel A, Nyffeler T, Luethi M, Hubl D, Wiest R, Dierks T, Muri RM",NeuroImage,0.13,22079455,-1,-1
fronto parietal_00076,https://pubmed.ncbi.nlm.nih.gov/27877120/,Fronto-Parietal Contributions to Phonological Processes in Successful Artificial  Grammar Learning.,"Goranskaya D, Kreitewolf J, Mueller JL, Friederici AD, Hartwigsen G",Frontiers in human neuroscience,0.13,27877120,-1,-1
fronto parietal_00077,https://pubmed.ncbi.nlm.nih.gov/18952678/,Control networks in paediatric Tourette syndrome show immature and anomalous patterns of functional connectivity.,"Church JA, Fair DA, Dosenbach NU, Cohen AL, Miezin FM, Petersen SE, Schlaggar BL",Brain : a journal of neurology,0.129,18952678,-1,-1
fronto parietal_00078,https://pubmed.ncbi.nlm.nih.gov/23747456/,Time-on-task and sleep deprivation effects are evidenced in overlapping brain areas.,"Asplund CL, Chee MW",NeuroImage,0.129,23747456,-1,-1
fronto parietal_00079,https://pubmed.ncbi.nlm.nih.gov/25872899/,The neural basis of the abnormal self-referential processing and its impact on cognitive control in depressed patients.,"Wagner G, Schachtzabel C, Peikert G, Bar KJ",Human brain mapping,0.129,25872899,-1,-1
fronto parietal_00080,https://pubmed.ncbi.nlm.nih.gov/21984928/,Revealing the functional neuroanatomy of intrinsic alertness using fMRI: methodological peculiarities.,"Clemens B, Zvyagintsev M, Sack AT, Heinecke A, Willmes K, Sturm W",PloS one,0.127,21984928,-1,-1
fronto parietal_00081,https://pubmed.ncbi.nlm.nih.gov/19410583/,The neural substrates of cognitive control deficits in autism spectrum disorders.,"Solomon M, Ozonoff SJ, Ursu S, Ravizza S, Cummings N, Ly S, Carter CS",Neuropsychologia,0.126,19410583,10.1016/j.neuropsychologia.2009.04.019,-1
fronto parietal_00082,https://pubmed.ncbi.nlm.nih.gov/23079572/,fMRI task parameters influence hemodynamic activity in regions implicated in mental set switching.,"Witt ST, Stevens MC",NeuroImage,0.125,23079572,10.1016/j.neuroimage.2012.09.072,-1
fronto parietal_00083,https://pubmed.ncbi.nlm.nih.gov/23435206/,Separable networks for top-down attention to auditory non-spatial and visuospatial modalities.,"Braga RM, Wilson LR, Sharp DJ, Wise RJ, Leech R",NeuroImage,0.125,23435206,10.1016/j.neuroimage.2013.02.023,-1
fronto parietal_00084,https://pubmed.ncbi.nlm.nih.gov/18992228/,Attentional control during the transient updating of cue information.,"Pessoa L, Rossi A, Japee S, Desimone R, Ungerleider LG",Brain research,0.124,18992228,-1,-1
fronto parietal_00085,https://pubmed.ncbi.nlm.nih.gov/26935553/,Neuronal correlates of personal space intrusion in violent offenders.,"Schienle A, Wabnegger A, Leitner M, Leutgeb V",Brain imaging and behavior,0.124,26935553,-1,-1
fronto parietal_00086,https://pubmed.ncbi.nlm.nih.gov/25443178/,Intergenerational transmission of fronto-parietal dysfunction during forethought  in attention deficit/hyperactivity disorder: a pilot study.,"Poissant H, Rapin L, Mendrek A",Psychiatry research,0.123,25443178,-1,-1
fronto parietal_00087,https://pubmed.ncbi.nlm.nih.gov/27107470/,Similar coding of freely chosen and externally cued intentions in a fronto-parietal network.,"Wisniewski D, Goschke T, Haynes JD",NeuroImage,0.122,27107470,-1,-1
fronto parietal_00088,https://pubmed.ncbi.nlm.nih.gov/27391013/,Coupling between Theta Oscillations and Cognitive Control Network during Cross-Modal Visual and Auditory Attention: Supramodal vs Modality-Specific Mechanisms.,"Wang W, Viswanathan S, Lee T, Grafton ST",PloS one,0.119,27391013,-1,-1
fronto parietal_00089,https://pubmed.ncbi.nlm.nih.gov/15054067/,Neural correlates of change detection and change blindness in a working memory task.,"Pessoa L, Ungerleider LG","Cerebral cortex (New York, N.Y. : 1991)",0.118,15054067,-1,-1
fronto parietal_00090,https://pubmed.ncbi.nlm.nih.gov/17553017/,Human limb-specific and non-limb-specific brain representations during kinesthetic illusory movements of the upper and lower extremities.,"Naito E, Nakashima T, Kito T, Aramaki Y, Okada T, Sadato N",The European journal of neuroscience,0.117,17553017,-1,-1
fronto parietal_00091,https://pubmed.ncbi.nlm.nih.gov/19395524/,"The brain network underlying serial visual search: comparing overt and covert spatial orienting, for activations and for effective connectivity.","Fairhall SL, Indovina I, Driver J, Macaluso E","Cerebral cortex (New York, N.Y. : 1991)",0.117,19395524,-1,-1
fronto parietal_00092,https://pubmed.ncbi.nlm.nih.gov/20739098/,Interaction between aging and neurodegeneration in amyotrophic lateral sclerosis.,"Tedeschi G, Trojsi F, Tessitore A, Corbo D, Sagnelli A, Paccone A, D'Ambrosio A, Piccirillo G, Cirillo M, Cirillo S, Monsurro MR, Esposito F",Neurobiology of aging,0.117,20739098,-1,-1
fronto parietal_00093,https://pubmed.ncbi.nlm.nih.gov/16650836/,Individual differences in the functional neuroanatomy of inhibitory control.,"Garavan H, Hester R, Murphy K, Fassbender C, Kelly C",Brain research,0.116,16650836,-1,-1
fronto parietal_00094,https://pubmed.ncbi.nlm.nih.gov/27995061/,Neural basis of distorted self-face recognition in social anxiety disorder.,"Kim MK, Yoon HJ, Shin YB, Lee SK, Kim JJ",NeuroImage. Clinical,0.115,27995061,-1,-1
