paper_name,paper_url,Title,Author,Journal,Loading,PMID,Doi,download_status
gyrus insula_00091,https://pubmed.ncbi.nlm.nih.gov/24099844/,Temporal and spatial evolution of grey matter atrophy in primary progressive multiple sclerosis.,"Eshaghi A, Bodini B, Ridgway GR, Garcia-Lorenzo D, Tozer DJ, Sahraian MA, Thompson AJ, Ciccarelli O",NeuroImage,0.067,24099844,10.1016/j.neuroimage.2013.09.059,-1
gyrus insula_00092,https://pubmed.ncbi.nlm.nih.gov/20018360/,Common and segregated neural substrates for automatic conceptual and affective priming as revealed by event-related functional magnetic resonance imaging.,"Liu H, Hu Z, Peng D, Yang Y, Li K",Brain and language,0.065,20018360,10.1016/j.bandl.2009.11.001,-1
gyrus insula_00093,https://pubmed.ncbi.nlm.nih.gov/27032959/,Prior exposure to extreme pain alters neural response to pain in others.,"Eidelman-Rothman M, Goldstein A, Weisman O, Schneiderman I, Zagoory-Sharon O, Decety J, Feldman R","Cognitive, affective & behavioral neuroscience",0.064,27032959,-1,-1
gyrus insula_00094,https://pubmed.ncbi.nlm.nih.gov/21097491/,"Decreased language lateralization is characteristic of psychosis, not auditory hallucinations.","Diederen KM, De Weijer AD, Daalman K, Blom JD, Neggers SF, Kahn RS, Sommer IE",Brain : a journal of neurology,0.06,21097491,-1,-1
gyrus insula_00095,https://pubmed.ncbi.nlm.nih.gov/25458571/,Impaired insight into illness and cognitive insight in schizophrenia spectrum disorders: resting state functional connectivity.,"Gerretsen P, Menon M, Mamo DC, Fervaha G, Remington G, Pollock BG, Graff-Guerrero A",Schizophrenia research,0.058,25458571,-1,-1
gyrus insula_00096,https://pubmed.ncbi.nlm.nih.gov/28481904/,Cortical brain volume abnormalities associated with few or multiple neuropsychiatric symptoms in Alzheimer's disease.,"Tascone LDS, Payne ME, MacFall J, Azevedo D, de Castro CC, Steffens DC, Busatto GF, Bottino CMC",PloS one,0.055,28481904,-1,-1
gyrus insula_00097,https://pubmed.ncbi.nlm.nih.gov/23674488/,A functional magnetic resonance imaging study mapping the episodic memory encoding network in temporal lobe epilepsy.,"Sidhu MK, Stretton J, Winston GP, Bonelli S, Centeno M, Vollmar C, Symms M, Thompson PJ, Koepp MJ, Duncan JS",Brain : a journal of neurology,0.042,23674488,-1,-1
