paper_name,paper_url,Title,Author,Journal,Loading,PMID,Doi,download_status
intraparietal_00192,https://pubmed.ncbi.nlm.nih.gov/25312829/,Baseline effects of transcranial direct current stimulation on glutamatergic neurotransmission and large-scale network connectivity.,"Hunter MA, Coffman BA, Gasparovic C, Calhoun VD, Trumbo MC, Clark VP",Brain research,0.079,25312829,-1,-1
intraparietal_00193,https://pubmed.ncbi.nlm.nih.gov/11208666/,The role of the inferior parietal cortex in linking the tactile perception and manual construction of object shapes.,"Jancke L, Kleinschmidt A, Mirzazade S, Shah NJ, Freund HJ","Cerebral cortex (New York, N.Y. : 1991)",0.078,11208666,-1,-1
intraparietal_00194,https://pubmed.ncbi.nlm.nih.gov/11590114/,Effects of domain-specific interference on brain activation associated with verbal working memory task performance.,Gruber O,"Cerebral cortex (New York, N.Y. : 1991)",0.078,11590114,-1,-1
intraparietal_00195,https://pubmed.ncbi.nlm.nih.gov/19022856/,The neural basis of surface dyslexia in semantic dementia.,"Wilson SM, Brambati SM, Henry RG, Handwerker DA, Agosta F, Miller BL, Wilkins DP, Ogar JM, Gorno-Tempini ML",Brain : a journal of neurology,0.078,19022856,-1,-1
intraparietal_00196,https://pubmed.ncbi.nlm.nih.gov/19366284/,Neural correlates of symbolic number comparison in developmental dyscalculia.,"Mussolin C, De Volder A, Grandin C, Schlogel X, Nassogne MC, Noel MP",Journal of cognitive neuroscience,0.078,19366284,-1,-1
intraparietal_00197,https://pubmed.ncbi.nlm.nih.gov/21246667/,Distinct representations of subtraction and multiplication in the neural systems  for numerosity and language.,"Prado J, Mutreja R, Zhang H, Mehta R, Desroches AS, Minas JE, Booth JR",Human brain mapping,0.078,21246667,-1,-1
intraparietal_00198,https://pubmed.ncbi.nlm.nih.gov/24478664/,Frontopolar cortex and decision-making efficiency: comparing brain activity of experts with different professional background during an exploration-exploitation task.,"Laureiro-Martinez D, Canessa N, Brusoni S, Zollo M, Hare T, Alemanno F, Cappa SF",Frontiers in human neuroscience,0.078,24478664,-1,-1
intraparietal_00199,https://pubmed.ncbi.nlm.nih.gov/25463140/,Responsiveness and functional connectivity of the scene-sensitive retrosplenial complex in 7-11-year-old children.,"Jiang P, Tokariev M, Aronen ET, Salonen O, Ma Y, Vuontela V, Carlson S",Brain and cognition,0.078,25463140,-1,-1
intraparietal_00200,https://pubmed.ncbi.nlm.nih.gov/28533402/,Behavioral and neural correlates to multisensory detection of sick humans.,"Regenbogen C, Axelsson J, Lasselin J, Porada DK, Sundelin T, Peter MG, Lekander M, Lundstrom JN, Olsson MJ",Proceedings of the National Academy of Sciences of the United States of America,0.078,28533402,-1,-1
intraparietal_00201,https://pubmed.ncbi.nlm.nih.gov/15385595/,Dominance of the right hemisphere and role of area 2 in human kinesthesia.,"Naito E, Roland PE, Grefkes C, Choi HJ, Eickhoff S, Geyer S, Zilles K, Ehrsson HH",Journal of neurophysiology,0.077,15385595,10.1152/jn.00637.2004,-1
intraparietal_00202,https://pubmed.ncbi.nlm.nih.gov/16260124/,Arithmetic ability and parietal alterations: a diffusion tensor imaging study in  velocardiofacial syndrome.,"Barnea-Goraly N, Eliez S, Menon V, Bammer R, Reiss AL",Brain research. Cognitive brain research,0.077,16260124,10.1016/j.cogbrainres.2005.09.013,-1
intraparietal_00203,https://pubmed.ncbi.nlm.nih.gov/19619661/,fMRI activation during spike and wave discharges evoked by photic stimulation.,"Moeller F, Siebner HR, Ahlgrimm N, Wolff S, Muhle H, Granert O, Boor R, Jansen O, Gotman J, Stephani U, Siniatchkin M",NeuroImage,0.077,19619661,10.1016/j.neuroimage.2009.07.019,-1
intraparietal_00204,https://pubmed.ncbi.nlm.nih.gov/22796505/,Cognitive reserve impacts on inter-individual variability in resting-state cerebral metabolism in normal aging.,"Bastin C, Yakushev I, Bahri MA, Fellgiebel A, Eustache F, Landeau B, Scheurich A, Feyers D, Collette F, Chetelat G, Salmon E",NeuroImage,0.077,22796505,-1,-1
intraparietal_00205,https://pubmed.ncbi.nlm.nih.gov/26199871/,Parietal dysfunction during number processing in children with fetal alcohol spectrum disorders.,"Woods KJ, Meintjes EM, Molteno CD, Jacobson SW, Jacobson JL",NeuroImage. Clinical,0.077,26199871,-1,-1
intraparietal_00206,https://pubmed.ncbi.nlm.nih.gov/16919481/,Differential correlation of frontal and parietal activity with the number of alternatives for cued choice saccades.,"Lee KM, Wade AR, Lee BT",NeuroImage,0.076,16919481,-1,-1
intraparietal_00207,https://pubmed.ncbi.nlm.nih.gov/18846222/,Cortical activations in humans grasp-related areas depend on hand used and handedness.,"Begliomini C, Nelini C, Caria A, Grodd W, Castiello U",PloS one,0.076,18846222,-1,-1
intraparietal_00208,https://pubmed.ncbi.nlm.nih.gov/22020967/,Prominent activation of the intraparietal and somatosensory areas during angle discrimination by intra-active touch.,"Yang J, Han H, Chui D, Shen Y, Wu J",Human brain mapping,0.076,22020967,-1,-1
intraparietal_00209,https://pubmed.ncbi.nlm.nih.gov/22815825/,Number conservation is related to children's prefrontal inhibitory control: an fMRI study of a piagetian task.,"Poirel N, Borst G, Simon G, Rossi S, Cassotti M, Pineau A, Houde O",PloS one,0.076,22815825,-1,-1
intraparietal_00210,https://pubmed.ncbi.nlm.nih.gov/23185300/,Somatosensory-motor adaptation of orofacial actions in posterior parietal and ventral premotor cortices.,"Grabski K, Lamalle L, Sato M",PloS one,0.076,23185300,-1,-1
intraparietal_00211,https://pubmed.ncbi.nlm.nih.gov/15014131/,The processing of visual shape in the cerebral cortex of human and nonhuman primates: a functional magnetic resonance imaging study.,"Denys K, Vanduffel W, Fize D, Nelissen K, Peuskens H, Van Essen D, Orban GA",The Journal of neuroscience : the official journal of the Society for Neuroscience,0.075,15014131,-1,-1
intraparietal_00212,https://pubmed.ncbi.nlm.nih.gov/15734349/,CASL fMRI of subcortico-cortical perfusion changes during memory-guided finger sequences.,"Garraux G, Hallett M, Talagala SL",NeuroImage,0.075,15734349,-1,-1
intraparietal_00213,https://pubmed.ncbi.nlm.nih.gov/16413797/,Distraction-spanning sustained activity during delayed recognition of locations.,Postle BR,NeuroImage,0.075,16413797,-1,-1
intraparietal_00214,https://pubmed.ncbi.nlm.nih.gov/18424775/,Where is a nose with respect to a foot? The left posterior parietal cortex processes spatial relationships among body parts.,"Corradi-Dell'Acqua C, Hesse MD, Rumiati RI, Fink GR","Cerebral cortex (New York, N.Y. : 1991)",0.075,18424775,-1,-1
intraparietal_00215,https://pubmed.ncbi.nlm.nih.gov/19874897/,Shared neural resources between left and right interlimb coordination skills: the neural substrate of abstract motor representations.,"Swinnen SP, Vangheluwe S, Wagemans J, Coxon JP, Goble DJ, Van Impe A, Sunaert S, Peeters R, Wenderoth N",NeuroImage,0.075,19874897,-1,-1
intraparietal_00216,https://pubmed.ncbi.nlm.nih.gov/19948228/,Cortical anatomy in human X monosomy.,"Raznahan A, Cutter W, Lalonde F, Robertson D, Daly E, Conway GS, Skuse DH, Ross J, Lerch JP, Giedd JN, Murphy DD",NeuroImage,0.075,19948228,-1,-1
intraparietal_00217,https://pubmed.ncbi.nlm.nih.gov/20406690/,"Multi-voxel coding of stimuli, rules, and responses in human frontoparietal cortex.","Woolgar A, Thompson R, Bor D, Duncan J",NeuroImage,0.075,20406690,-1,-1
intraparietal_00218,https://pubmed.ncbi.nlm.nih.gov/21375598/,"Technology, expertise and social cognition in human evolution.","Stout D, Passingham R, Frith C, Apel J, Chaminade T",The European journal of neuroscience,0.075,21375598,-1,-1
intraparietal_00219,https://pubmed.ncbi.nlm.nih.gov/21692143/,A common right fronto-parietal network for numerosity and duration processing: an fMRI study.,"Dormal V, Dormal G, Joassin F, Pesenti M",Human brain mapping,0.075,21692143,-1,-1
intraparietal_00220,https://pubmed.ncbi.nlm.nih.gov/25653582/,Impact of hematocrit on measurements of the intrinsic brain.,"Yang Z, Craddock RC, Milham MP",Frontiers in neuroscience,0.075,25653582,-1,-1
intraparietal_00221,https://pubmed.ncbi.nlm.nih.gov/27474523/,Neural representations of magnitude for natural and rational numbers.,"DeWolf M, Chiang JN, Bassok M, Holyoak KJ, Monti MM",NeuroImage,0.075,27474523,10.1016/j.neuroimage.2016.07.052,-1
intraparietal_00222,https://pubmed.ncbi.nlm.nih.gov/15183391/,The where and how of attention-based rehearsal in spatial working memory.,"Postle BR, Awh E, Jonides J, Smith EE, D'Esposito M",Brain research. Cognitive brain research,0.074,15183391,10.1016/j.cogbrainres.2004.02.008,-1
intraparietal_00223,https://pubmed.ncbi.nlm.nih.gov/19574393/,Auditory attentional control and selection during cocktail party listening.,"Hill KT, Miller LM","Cerebral cortex (New York, N.Y. : 1991)",0.074,19574393,10.1093/cercor/bhp124,-1
intraparietal_00224,https://pubmed.ncbi.nlm.nih.gov/19750227/,Spatio-temporal dynamics of human intention understanding in temporo-parietal cortex: a combined EEG/fMRI repetition suppression paradigm.,"Ortigue S, Thompson JC, Parasuraman R, Grafton ST",PloS one,0.074,19750227,10.1371/journal.pone.0006962,-1
intraparietal_00225,https://pubmed.ncbi.nlm.nih.gov/20231266/,On the role of object information in action observation: an fMRI study.,"Bach P, Peelen MV, Tipper SP","Cerebral cortex (New York, N.Y. : 1991)",0.074,20231266,-1,-1
intraparietal_00226,https://pubmed.ncbi.nlm.nih.gov/20610756/,Low-frequency transcranial magnetic stimulation over left dorsal premotor cortex  improves the dynamic control of visuospatially cued actions.,"Ward NS, Bestmann S, Hartwigsen G, Weiss MM, Christensen LO, Frackowiak RS, Rothwell JC, Siebner HR",The Journal of neuroscience : the official journal of the Society for Neuroscience,0.074,20610756,-1,-1
intraparietal_00227,https://pubmed.ncbi.nlm.nih.gov/21175881/,Functional MRI evidence for the importance of visual short-term memory in logographic reading.,"Koyama MS, Stein JF, Stoodley CJ, Hansen PC",The European journal of neuroscience,0.074,21175881,-1,-1
intraparietal_00228,https://pubmed.ncbi.nlm.nih.gov/21554968/,Handedness-dependent and -independent cerebral asymmetries in the anterior intraparietal sulcus and ventral premotor cortex during grasp planning.,"Martin K, Jacobs S, Frey SH",NeuroImage,0.074,21554968,-1,-1
intraparietal_00229,https://pubmed.ncbi.nlm.nih.gov/21942763/,Absence of face-specific cortical activity in the complete absence of awareness:  converging evidence from functional magnetic resonance imaging and event-related  potentials.,"Rodriguez V, Thompson R, Stokes M, Brett M, Alvarez I, Valdes-Sosa M, Duncan J",Journal of cognitive neuroscience,0.074,21942763,-1,-1
intraparietal_00230,https://pubmed.ncbi.nlm.nih.gov/23201492/,Dorsal and ventral working memory-related brain areas support distinct processes  in contextual cueing.,"Manginelli AA, Baumgartner F, Pollmann S",NeuroImage,0.074,23201492,-1,-1
intraparietal_00231,https://pubmed.ncbi.nlm.nih.gov/23404335/,Parietal substrates for dimensional effects in visual search: evidence from lesion-symptom mapping.,"Utz S, Humphreys GW, Chechlacz M",Brain : a journal of neurology,0.074,23404335,-1,-1
intraparietal_00232,https://pubmed.ncbi.nlm.nih.gov/23711484/,Frontoparietal mechanisms supporting attention to location and intensity of painful stimuli.,"Lobanov OV, Quevedo AS, Hadsel MS, Kraft RA, Coghill RC",Pain,0.074,23711484,-1,-1
intraparietal_00233,https://pubmed.ncbi.nlm.nih.gov/24269575/,Short-term antidepressant administration reduces default mode and task-positive network connectivity in healthy individuals during rest.,"van Wingen GA, Tendolkar I, Urner M, van Marle HJ, Denys D, Verkes RJ, Fernandez G",NeuroImage,0.074,24269575,-1,-1
intraparietal_00234,https://pubmed.ncbi.nlm.nih.gov/25120447/,The role of parietal cortex in the formation of color and motion based concepts.,"Cheadle SW, Zeki S",Frontiers in human neuroscience,0.074,25120447,-1,-1
intraparietal_00235,https://pubmed.ncbi.nlm.nih.gov/28142026/,Isolating response inhibition in the brain: Parietal versus frontal contribution.,"Kolodny T, Mevorach C, Shalev L",Cortex; a journal devoted to the study of the nervous system and behavior,0.074,28142026,-1,-1
intraparietal_00236,https://pubmed.ncbi.nlm.nih.gov/10624956/,Human cortical regions involved in extracting depth from motion.,"Orban GA, Sunaert S, Todd JT, Van Hecke P, Marchal G",Neuron,0.073,10624956,-1,-1
intraparietal_00237,https://pubmed.ncbi.nlm.nih.gov/12193197/,Two mechanisms of protracted reaction times mediated by dissociable cortical networks.,"Herath P, Young J, Roland P",The European journal of neuroscience,0.073,12193197,-1,-1
intraparietal_00238,https://pubmed.ncbi.nlm.nih.gov/12713654/,Cerebral regions processing first- and higher-order motion in an opposed-direction discrimination task.,"Dupont P, Sary G, Peuskens H, Orban GA",The European journal of neuroscience,0.073,12713654,-1,-1
intraparietal_00239,https://pubmed.ncbi.nlm.nih.gov/14561452/,Functional anatomy of impaired selective attention and compensatory processing in autism.,"Belmonte MK, Yurgelun-Todd DA",Brain research. Cognitive brain research,0.073,14561452,-1,-1
intraparietal_00240,https://pubmed.ncbi.nlm.nih.gov/15183397/,Phonemic manipulation in Japanese: an fMRI study.,"Seki A, Okada T, Koeda T, Sadato N",Brain research. Cognitive brain research,0.073,15183397,-1,-1
intraparietal_00241,https://pubmed.ncbi.nlm.nih.gov/15930389/,Shifts of effective connectivity within a language network during rhyming and spelling.,"Bitan T, Booth JR, Choy J, Burman DD, Gitelman DR, Mesulam MM",The Journal of neuroscience : the official journal of the Society for Neuroscience,0.073,15930389,10.1523/JNEUROSCI.0864-05.2005,-1
intraparietal_00242,https://pubmed.ncbi.nlm.nih.gov/18702576/,"Developmental increase in top-down and bottom-up processing in a phonological task: an effective connectivity, fMRI study.","Bitan T, Cheon J, Lu D, Burman DD, Booth JR",Journal of cognitive neuroscience,0.073,18702576,10.1162/jocn.2009.21065,-1
intraparietal_00243,https://pubmed.ncbi.nlm.nih.gov/19702470/,Neural correlates of species-typical illogical cognitive bias in human inference.,"Ogawa A, Yamazaki Y, Ueno K, Cheng K, Iriki A",Journal of cognitive neuroscience,0.073,19702470,-1,-1
intraparietal_00244,https://pubmed.ncbi.nlm.nih.gov/20861364/,Hemispheric asymmetry in visuotopic posterior parietal cortex emerges with visual short-term memory load.,"Sheremata SL, Bettencourt KC, Somers DC",The Journal of neuroscience : the official journal of the Society for Neuroscience,0.073,20861364,-1,-1
intraparietal_00245,https://pubmed.ncbi.nlm.nih.gov/21677185/,FMRI adaptation reveals a cortical mechanism for the coding of space near the hand.,"Brozzoli C, Gentile G, Petkova VI, Ehrsson HH",The Journal of neuroscience : the official journal of the Society for Neuroscience,0.073,21677185,-1,-1
intraparietal_00246,https://pubmed.ncbi.nlm.nih.gov/22206809/,Brain activation during spatial updating and attentive tracking of moving targets.,"Jahn G, Wendt J, Lotze M, Papenmeier F, Huff M",Brain and cognition,0.073,22206809,-1,-1
intraparietal_00247,https://pubmed.ncbi.nlm.nih.gov/12077202/,Brain regions controlling nonsynergistic versus synergistic movement of the digits: a functional magnetic resonance imaging study.,"Ehrsson HH, Kuhtz-Buschbeck JP, Forssberg H",The Journal of neuroscience : the official journal of the Society for Neuroscience,0.072,12077202,-1,-1
intraparietal_00248,https://pubmed.ncbi.nlm.nih.gov/17182259/,Dodecapus: An MR-compatible system for somatosensory stimulation.,"Huang RS, Sereno MI",NeuroImage,0.072,17182259,-1,-1
intraparietal_00249,https://pubmed.ncbi.nlm.nih.gov/17389629/,On the programming and reprogramming of actions.,"Mars RB, Piekema C, Coles MG, Hulstijn W, Toni I","Cerebral cortex (New York, N.Y. : 1991)",0.072,17389629,-1,-1
intraparietal_00250,https://pubmed.ncbi.nlm.nih.gov/19166947/,Neural basis of interaction between target presence and display homogeneity in visual search: an fMRI study.,"Wei P, Muller HJ, Pollmann S, Zhou X",NeuroImage,0.072,19166947,-1,-1
intraparietal_00251,https://pubmed.ncbi.nlm.nih.gov/20956614/,Neural correlates of developing and adapting behavioral biases in speeded choice  reactions--an fMRI study on predictive motor coding.,"Eickhoff SB, Pomjanski W, Jakobs O, Zilles K, Langner R","Cerebral cortex (New York, N.Y. : 1991)",0.072,20956614,-1,-1
intraparietal_00252,https://pubmed.ncbi.nlm.nih.gov/21148091/,Integration of visual and tactile signals from the hand in the human brain: an FMRI study.,"Gentile G, Petkova VI, Ehrsson HH",Journal of neurophysiology,0.072,21148091,-1,-1
intraparietal_00253,https://pubmed.ncbi.nlm.nih.gov/21254797/,Modulatory effects of levodopa on cognitive control in young but not in older subjects: a pharmacological fMRI study.,"Onur OA, Piefke M, Lie CH, Thiel CM, Fink GR",Journal of cognitive neuroscience,0.072,21254797,-1,-1
intraparietal_00254,https://pubmed.ncbi.nlm.nih.gov/21538702/,Attention-related networks in Alzheimer's disease: a resting functional MRI study.,"Li R, Wu X, Fleisher AS, Reiman EM, Chen K, Yao L",Human brain mapping,0.072,21538702,-1,-1
intraparietal_00255,https://pubmed.ncbi.nlm.nih.gov/24392901/,Neural substrates of social status inference: roles of medial prefrontal cortex and superior temporal sulcus.,"Mason M, Magee JC, Fiske ST",Journal of cognitive neuroscience,0.072,24392901,-1,-1
intraparietal_00256,https://pubmed.ncbi.nlm.nih.gov/24532318/,Unfamiliar Walking Movements Are Detected Early in the Visual Stream: An fMRI Study.,"Maffei V, Giusti MA, Macaluso E, Lacquaniti F, Viviani P","Cerebral cortex (New York, N.Y. : 1991)",0.072,24532318,-1,-1
intraparietal_00257,https://pubmed.ncbi.nlm.nih.gov/26019331/,Reinforcement learning in multidimensional environments relies on attention mechanisms.,"Niv Y, Daniel R, Geana A, Gershman SJ, Leong YC, Radulescu A, Wilson RC",The Journal of neuroscience : the official journal of the Society for Neuroscience,0.072,26019331,-1,-1
intraparietal_00258,https://pubmed.ncbi.nlm.nih.gov/26794640/,The activation of interactive attentional networks.,"Xuan B, Mackie MA, Spagna A, Wu T, Tian Y, Hof PR, Fan J",NeuroImage,0.072,26794640,-1,-1
intraparietal_00259,https://pubmed.ncbi.nlm.nih.gov/27103137/,Structural and functional correlates of motor imagery BCI performance: Insights from the patterns of fronto-parietal attention network.,"Zhang T, Liu T, Li F, Li M, Liu D, Zhang R, He H, Li P, Gong J, Luo C, Yao D, Xu P",NeuroImage,0.072,27103137,-1,-1
intraparietal_00260,https://pubmed.ncbi.nlm.nih.gov/27618765/,Reconfiguration of parietal circuits with cognitive tutoring in elementary school children.,"Jolles D, Supekar K, Richardson J, Tenison C, Ashkenazi S, Rosenberg-Lee M, Fuchs L, Menon V",Cortex; a journal devoted to the study of the nervous system and behavior,0.072,27618765,-1,-1
intraparietal_00261,https://pubmed.ncbi.nlm.nih.gov/28038366/,Brain networks underlying novel metaphor production.,"Beaty RE, Silvia PJ, Benedek M",Brain and cognition,0.072,28038366,10.1016/j.bandc.2016.12.004,-1
intraparietal_00262,https://pubmed.ncbi.nlm.nih.gov/9819274/,Functional MRI of galvanic vestibular stimulation.,"Lobel E, Kleine JF, Bihan DL, Leroy-Willig A, Berthoz A",Journal of neurophysiology,0.071,9819274,10.1152/jn.1998.80.5.2699,-1
intraparietal_00263,https://pubmed.ncbi.nlm.nih.gov/12023321/,"Painful stimuli evoke different stimulus-response functions in the amygdala, prefrontal, insula and somatosensory cortex: a single-trial fMRI study.","Bornhovd K, Quante M, Glauche V, Bromm B, Weiller C, Buchel C",Brain : a journal of neurology,0.071,12023321,10.1093/brain/awf137,-1
intraparietal_00264,https://pubmed.ncbi.nlm.nih.gov/15190112/,Somatotopy and attentional modulation of the human parietal and opercular regions.,"Young JP, Herath P, Eickhoff S, Choi J, Grefkes C, Zilles K, Roland PE",The Journal of neuroscience : the official journal of the Society for Neuroscience,0.071,15190112,-1,-1
intraparietal_00265,https://pubmed.ncbi.nlm.nih.gov/15885507/,Attention orienting dysfunction during salient novel stimulus processing in schizophrenia.,"Laurens KR, Kiehl KA, Ngan ET, Liddle PF",Schizophrenia research,0.071,15885507,-1,-1
intraparietal_00266,https://pubmed.ncbi.nlm.nih.gov/16337921/,Two cortical systems for reaching in central and peripheral vision.,"Prado J, Clavagnier S, Otzenberger H, Scheiber C, Kennedy H, Perenin MT",Neuron,0.071,16337921,-1,-1
intraparietal_00267,https://pubmed.ncbi.nlm.nih.gov/16718653/,Analysis of intersubject variability in activation: an application to the incidental episodic retrieval during recognition test.,"Sugiura M, Friston KJ, Willmes K, Shah NJ, Zilles K, Fink GR",Human brain mapping,0.071,16718653,-1,-1
intraparietal_00268,https://pubmed.ncbi.nlm.nih.gov/17617658/,The effect of prior visual information on recognition of speech and sounds.,"Noppeney U, Josephs O, Hocking J, Price CJ, Friston KJ","Cerebral cortex (New York, N.Y. : 1991)",0.071,17617658,-1,-1
intraparietal_00269,https://pubmed.ncbi.nlm.nih.gov/17928451/,Posteromedial parietal cortical activity and inputs predict tactile spatial acuity.,"Stilla R, Deshpande G, LaConte S, Hu X, Sathian K",The Journal of neuroscience : the official journal of the Society for Neuroscience,0.071,17928451,-1,-1
intraparietal_00270,https://pubmed.ncbi.nlm.nih.gov/19932154/,Maintenance of real objects and their verbal designations in working memory.,"Kaiser S, Kopka ML, Rentrop M, Walther S, Kronmuller K, Olbrich R, Weisbrod M, Stippich C",Neuroscience letters,0.071,19932154,-1,-1
intraparietal_00271,https://pubmed.ncbi.nlm.nih.gov/21862445/,Role of the medial part of the intraparietal sulcus in implementing movement direction.,"Davare M, Zenon A, Pourtois G, Desmurget M, Olivier E","Cerebral cortex (New York, N.Y. : 1991)",0.071,21862445,-1,-1
intraparietal_00272,https://pubmed.ncbi.nlm.nih.gov/22705376/,Neural networks related to pro-saccades and anti-saccades revealed by independent component analysis.,"Domagalik A, Beldzik E, Fafrowicz M, Oginska H, Marek T",NeuroImage,0.071,22705376,-1,-1
intraparietal_00273,https://pubmed.ncbi.nlm.nih.gov/23415950/,Functional specialization and generalization for grouping of stimuli based on colour and motion.,"Zeki S, Stutters J",NeuroImage,0.071,23415950,-1,-1
intraparietal_00274,https://pubmed.ncbi.nlm.nih.gov/24709370/,Adaptive ability to cope with atypical or novel situations involving tool use: An fMRI approach.,"Wakusawa K, Sugiura M, Sassa Y, Jeong H, Yomogida Y, Horie K, Sato S, Yokoyama H, Kure S, Takei N, Mori N, Kawashima R",Neuroscience research,0.071,24709370,-1,-1
intraparietal_00275,https://pubmed.ncbi.nlm.nih.gov/26484048/,Abnormalities in personal space and parietal-frontal function in schizophrenia.,"Holt DJ, Boeke EA, Coombs G 3rd, DeCross SN, Cassidy BS, Stufflebeam S, Rauch SL, Tootell RB",NeuroImage. Clinical,0.071,26484048,-1,-1
intraparietal_00276,https://pubmed.ncbi.nlm.nih.gov/26807841/,The Semantics of Syntax: The Grounding of Transitive and Intransitive Constructions.,"van Dam WO, Desai RH",Journal of cognitive neuroscience,0.071,26807841,-1,-1
intraparietal_00277,https://pubmed.ncbi.nlm.nih.gov/28129058/,A TMS Investigation on the Role of Lateral Occipital Complex and Caudal Intraparietal Sulcus in the Perception of Object Form and Orientation.,"Chouinard PA, Meena DK, Whitwell RL, Hilchey MD, Goodale MA",Journal of cognitive neuroscience,0.071,28129058,-1,-1
intraparietal_00278,https://pubmed.ncbi.nlm.nih.gov/16087350/,Implementation of visuospatial cues in response selection.,"van Eimeren T, Wolbers T, Munchau A, Buchel C, Weiller C, Siebner HR",NeuroImage,0.07,16087350,-1,-1
intraparietal_00279,https://pubmed.ncbi.nlm.nih.gov/16122946/,Neural correlates of superior intelligence: stronger recruitment of posterior parietal cortex.,"Lee KH, Choi YY, Gray JR, Cho SH, Chae JH, Lee S, Kim K",NeuroImage,0.07,16122946,-1,-1
intraparietal_00280,https://pubmed.ncbi.nlm.nih.gov/16889805/,Cortical correlates of TMS-induced phantom hand movements revealed with concurrent TMS-fMRI.,"Bestmann S, Oliviero A, Voss M, Dechent P, Lopez-Dolado E, Driver J, Baudewig J",Neuropsychologia,0.07,16889805,-1,-1
intraparietal_00281,https://pubmed.ncbi.nlm.nih.gov/17575278/,The motor system shows adaptive changes in complex regional pain syndrome.,"Maihofner C, Baron R, DeCol R, Binder A, Birklein F, Deuschl G, Handwerker HO, Schattschneider J",Brain : a journal of neurology,0.07,17575278,10.1093/brain/awm131,-1
intraparietal_00282,https://pubmed.ncbi.nlm.nih.gov/17662530/,Saccular stimulation of the human cortex: a functional magnetic resonance imaging study.,"Miyamoto T, Fukushima K, Takada T, de Waele C, Vidal PP",Neuroscience letters,0.07,17662530,10.1016/j.neulet.2007.06.036,-1
intraparietal_00283,https://pubmed.ncbi.nlm.nih.gov/18476756/,"What is ""odd"" in Posner's location-cueing paradigm? Neural responses to unexpected location and feature changes compared.","Vossel S, Weidner R, Thiel CM, Fink GR",Journal of cognitive neuroscience,0.07,18476756,-1,-1
intraparietal_00284,https://pubmed.ncbi.nlm.nih.gov/19929327/,Developmental specialization in the right intraparietal sulcus for the abstract representation of numerical magnitude.,"Holloway ID, Ansari D",Journal of cognitive neuroscience,0.07,19929327,-1,-1
intraparietal_00285,https://pubmed.ncbi.nlm.nih.gov/20863844/,Self-organisation in the human visual system--visuo-motor processing with congenitally abnormal V1 input.,"Wolynski B, Kanowski M, Meltendorf S, Behrens-Baumann W, Hoffmann MB",Neuropsychologia,0.07,20863844,-1,-1
