paper_name,paper_url,Title,Author,Journal,Loading,PMID,Doi,download_status
intraparietal_00382,https://pubmed.ncbi.nlm.nih.gov/24560914/,Multisensory convergence of visual and haptic object preference across development.,"Joanne Jao R, James TW, Harman James K",Neuropsychologia,0.064,24560914,10.1016/j.neuropsychologia.2014.02.009,-1
intraparietal_00383,https://pubmed.ncbi.nlm.nih.gov/25463138/,Anticipating action effects recruits audiovisual movement representations in the  ventral premotor cortex.,"Bischoff M, Zentgraf K, Pilgramm S, Stark R, Kruger B, Munzert J",Brain and cognition,0.064,25463138,-1,-1
intraparietal_00384,https://pubmed.ncbi.nlm.nih.gov/25797238/,Asymmetric development of dorsal and ventral attention networks in the human brain.,"Farrant K, Uddin LQ",Developmental cognitive neuroscience,0.064,25797238,-1,-1
intraparietal_00385,https://pubmed.ncbi.nlm.nih.gov/25798098/,Neural evidence for the use of digit-image mnemonic in a superior memorist: an fMRI study.,"Yin LJ, Lou YT, Fan MX, Wang ZX, Hu Y",Frontiers in human neuroscience,0.064,25798098,-1,-1
intraparietal_00386,https://pubmed.ncbi.nlm.nih.gov/27523448/,Functional mechanisms of probabilistic inference in feature- and space-based attentional systems.,"Dombert PL, Kuhns A, Mengotti P, Fink GR, Vossel S",NeuroImage,0.064,27523448,-1,-1
intraparietal_00387,https://pubmed.ncbi.nlm.nih.gov/28824403/,Individual Differences in the Accuracy of Judgments of Learning Are Related to the Gray Matter Volume and Functional Connectivity of the Left Mid-Insula.,"Hu X, Liu Z, Chen W, Zheng J, Su N, Wang W, Lin C, Luo L",Frontiers in human neuroscience,0.064,28824403,-1,-1
intraparietal_00388,https://pubmed.ncbi.nlm.nih.gov/29129671/,The semantic system is involved in mathematical problem solving.,"Zhou X, Li M, Li L, Zhang Y, Cui J, Liu J, Chen C",NeuroImage,0.064,29129671,-1,-1
intraparietal_00389,https://pubmed.ncbi.nlm.nih.gov/10982748/,A comparison of visual and auditory motion processing in human cerebral cortex.,"Lewis JW, Beauchamp MS, DeYoe EA","Cerebral cortex (New York, N.Y. : 1991)",0.063,10982748,-1,-1
intraparietal_00390,https://pubmed.ncbi.nlm.nih.gov/14642464/,Cortical capacity constraints for visual working memory: dissociation of fMRI load effects in a fronto-parietal network.,"Linden DE, Bittner RA, Muckli L, Waltz JA, Kriegeskorte N, Goebel R, Singer W, Munk MH",NeuroImage,0.063,14642464,-1,-1
intraparietal_00391,https://pubmed.ncbi.nlm.nih.gov/14741670/,"Cerebral correlates of alerting, orienting and reorienting of visuospatial attention: an event-related fMRI study.","Thiel CM, Zilles K, Fink GR",NeuroImage,0.063,14741670,-1,-1
intraparietal_00392,https://pubmed.ncbi.nlm.nih.gov/14749289/,fMRI correlates of state and trait effects in subjects at genetically enhanced risk of schizophrenia.,"Whalley HC, Simonotto E, Flett S, Marshall I, Ebmeier KP, Owens DG, Goddard NH, Johnstone EC, Lawrie SM",Brain : a journal of neurology,0.063,14749289,-1,-1
intraparietal_00393,https://pubmed.ncbi.nlm.nih.gov/15016102/,Cortical mechanisms of smooth pursuit eye movements with target blanking. An fMRI study.,"Lencer R, Nagel M, Sprenger A, Zapf S, Erdmann C, Heide W, Binkofski F",The European journal of neuroscience,0.063,15016102,-1,-1
intraparietal_00394,https://pubmed.ncbi.nlm.nih.gov/16087351/,Brain correlates of aesthetic judgment of beauty.,"Jacobsen T, Schubotz RI, Hofel L, Cramon DY",NeuroImage,0.063,16087351,-1,-1
intraparietal_00395,https://pubmed.ncbi.nlm.nih.gov/16095920/,A special role for numbers in working memory? An fMRI study.,"Knops A, Nuerk HC, Fimm B, Vohn R, Willmes K",NeuroImage,0.063,16095920,-1,-1
intraparietal_00396,https://pubmed.ncbi.nlm.nih.gov/16111898/,When visual perception causes feeling: enhanced cross-modal processing in grapheme-color synesthesia.,"Weiss PH, Zilles K, Fink GR",NeuroImage,0.063,16111898,-1,-1
intraparietal_00397,https://pubmed.ncbi.nlm.nih.gov/16855105/,On-line attentional selection from competing stimuli in opposite visual fields: effects on human visual cortex and control processes.,"Geng JJ, Eger E, Ruff CC, Kristjansson A, Rotshtein P, Driver J",Journal of neurophysiology,0.063,16855105,-1,-1
intraparietal_00398,https://pubmed.ncbi.nlm.nih.gov/17548801/,Kinesthetic working memory and action control within the dorsal stream.,"Fiehler K, Burke M, Engel A, Bien S, Rosler F","Cerebral cortex (New York, N.Y. : 1991)",0.063,17548801,-1,-1
intraparietal_00399,https://pubmed.ncbi.nlm.nih.gov/19925182/,Dissociable neural substrates for agentic versus conceptual representations of self.,"Powell LJ, Macrae CN, Cloutier J, Metcalfe J, Mitchell JP",Journal of cognitive neuroscience,0.063,19925182,-1,-1
intraparietal_00400,https://pubmed.ncbi.nlm.nih.gov/20004724/,The amodal system for conscious word and picture identification in the absence of a semantic task.,"Van Doren L, Dupont P, De Grauwe S, Peeters R, Vandenberghe R",NeuroImage,0.063,20004724,-1,-1
intraparietal_00401,https://pubmed.ncbi.nlm.nih.gov/20034582/,fMRI-adaptation evidence of overlapping neural representations for objects related in function or manipulation.,"Yee E, Drucker DM, Thompson-Schill SL",NeuroImage,0.063,20034582,10.1016/j.neuroimage.2009.12.036,-1
intraparietal_00402,https://pubmed.ncbi.nlm.nih.gov/21739528/,Hand shape selection in pantomimed grasping: interaction between the dorsal and the ventral visual streams and convergence on the ventral premotor area.,"Makuuchi M, Someya Y, Ogawa S, Takayama Y",Human brain mapping,0.063,21739528,10.1002/hbm.21323,-1
intraparietal_00403,https://pubmed.ncbi.nlm.nih.gov/21931738/,Self-regulation of amygdala activation using real-time FMRI neurofeedback.,"Zotev V, Krueger F, Phillips R, Alvarez RP, Simmons WK, Bellgowan P, Drevets WC, Bodurka J",PloS one,0.063,21931738,10.1371/journal.pone.0024522,-1
intraparietal_00404,https://pubmed.ncbi.nlm.nih.gov/21933287/,Involvement of area MT in bimanual finger movements in left-handers: an fMRI study.,"Muller K, Kleiser R, Mechsner F, Seitz RJ",The European journal of neuroscience,0.063,21933287,-1,-1
intraparietal_00405,https://pubmed.ncbi.nlm.nih.gov/22275475/,Human parietofrontal networks related to action observation detected at rest.,"Molinari E, Baraldi P, Campanella M, Duzzi D, Nocetti L, Pagnoni G, Porro CA","Cerebral cortex (New York, N.Y. : 1991)",0.063,22275475,-1,-1
intraparietal_00406,https://pubmed.ncbi.nlm.nih.gov/23019128/,"Dissociated neural correlates of quantity processing of quantifiers, numbers, and numerosities.","Wei W, Chen C, Yang T, Zhang H, Zhou X",Human brain mapping,0.063,23019128,-1,-1
intraparietal_00407,https://pubmed.ncbi.nlm.nih.gov/26272239/,Crossmodal enhancement in the LOC for visuohaptic object recognition over development.,"Jao RJ, James TW, James KH",Neuropsychologia,0.063,26272239,-1,-1
intraparietal_00408,https://pubmed.ncbi.nlm.nih.gov/10400972/,Functional anatomy of pursuit eye movements in humans as revealed by fMRI.,"Petit L, Haxby JV",Journal of neurophysiology,0.062,10400972,-1,-1
intraparietal_00409,https://pubmed.ncbi.nlm.nih.gov/11884351/,Directing attention to locations and to sensory modalities: multiple levels of selective processing revealed with PET.,"Macaluso E, Frith CD, Driver J","Cerebral cortex (New York, N.Y. : 1991)",0.062,11884351,-1,-1
intraparietal_00410,https://pubmed.ncbi.nlm.nih.gov/12527103/,Premotor cortex in observing erroneous action: an fMRI study.,"Manthey S, Schubotz RI, von Cramon DY",Brain research. Cognitive brain research,0.062,12527103,-1,-1
intraparietal_00411,https://pubmed.ncbi.nlm.nih.gov/12880794/,The human action recognition system and its relationship to Broca's area: an fMRI study.,"Hamzei F, Rijntjes M, Dettmers C, Glauche V, Weiller C, Buchel C",NeuroImage,0.062,12880794,-1,-1
intraparietal_00412,https://pubmed.ncbi.nlm.nih.gov/12880836/,A fronto-parietal circuit for tactile object discrimination: an event-related fMRI study.,"Stoeckel MC, Weder B, Binkofski F, Buccino G, Shah NJ, Seitz RJ",NeuroImage,0.062,12880836,-1,-1
intraparietal_00413,https://pubmed.ncbi.nlm.nih.gov/12948709/,Basal ganglia and supplementary motor area subtend duration perception: an fMRI study.,"Ferrandez AM, Hugueville L, Lehericy S, Poline JB, Marsault C, Pouthas V",NeuroImage,0.062,12948709,-1,-1
intraparietal_00414,https://pubmed.ncbi.nlm.nih.gov/15275908/,Preparatory deployment of attention to motion activates higher-order motion-processing brain regions.,"Luks TL, Simpson GV",NeuroImage,0.062,15275908,-1,-1
intraparietal_00415,https://pubmed.ncbi.nlm.nih.gov/15808989/,Neural correlates of distance and congruity effects in a numerical Stroop task: an event-related fMRI study.,"Kaufmann L, Koppelstaetter F, Delazer M, Siedentopf C, Rhomberg P, Golaszewski S, Felber S, Ischebeck A",NeuroImage,0.062,15808989,-1,-1
intraparietal_00416,https://pubmed.ncbi.nlm.nih.gov/18252743/,COMT val158met genotype affects recruitment of neural mechanisms supporting fluid intelligence.,"Bishop SJ, Fossella J, Croucher CJ, Duncan J","Cerebral cortex (New York, N.Y. : 1991)",0.062,18252743,-1,-1
intraparietal_00417,https://pubmed.ncbi.nlm.nih.gov/18281304/,The extraction of 3D shape from texture and shading in the human brain.,"Georgieva SS, Todd JT, Peeters R, Orban GA","Cerebral cortex (New York, N.Y. : 1991)",0.062,18281304,-1,-1
intraparietal_00418,https://pubmed.ncbi.nlm.nih.gov/19015373/,Cortical plasticity of audio-visual object representations.,"Naumer MJ, Doehrmann O, Muller NG, Muckli L, Kaiser J, Hein G","Cerebral cortex (New York, N.Y. : 1991)",0.062,19015373,-1,-1
intraparietal_00419,https://pubmed.ncbi.nlm.nih.gov/19428395/,Visuo-motor integration in humans: cortical patterns of response lateralisation and functional connectivity.,"Wolynski B, Schott BH, Kanowski M, Hoffmann MB",Neuropsychologia,0.062,19428395,-1,-1
intraparietal_00420,https://pubmed.ncbi.nlm.nih.gov/19603410/,Pathological amygdala activation during working memory performance: Evidence for  a pathophysiological trait marker in bipolar affective disorder.,"Gruber O, Tost H, Henseler I, Schmael C, Scherk H, Ende G, Ruf M, Falkai P, Rietschel M",Human brain mapping,0.062,19603410,-1,-1
intraparietal_00421,https://pubmed.ncbi.nlm.nih.gov/19686473/,A systematic fMRI investigation of the brain systems subserving different working memory components in schizophrenia.,"Henseler I, Falkai P, Gruber O",The European journal of neuroscience,0.062,19686473,10.1111/j.1460-9568.2009.06850.x,-1
intraparietal_00422,https://pubmed.ncbi.nlm.nih.gov/19759300/,The representation of tool use in humans and monkeys: common and uniquely human features.,"Peeters R, Simone L, Nelissen K, Fabbri-Destro M, Vanduffel W, Rizzolatti G, Orban GA",The Journal of neuroscience : the official journal of the Society for Neuroscience,0.062,19759300,10.1523/JNEUROSCI.2040-09.2009,-1
intraparietal_00423,https://pubmed.ncbi.nlm.nih.gov/21613471/,Motor planning is facilitated by adopting an action's goal posture: an fMRI study.,"Zimmermann M, Meulenbroek RG, de Lange FP","Cerebral cortex (New York, N.Y. : 1991)",0.062,21613471,-1,-1
intraparietal_00424,https://pubmed.ncbi.nlm.nih.gov/21911384/,"Cortico-subcortical visual, somatosensory, and motor activations for perceiving dynamic whole-body emotional expressions with and without striate cortex (V1).","Van den Stock J, Tamietto M, Sorger B, Pichon S, Grezes J, de Gelder B",Proceedings of the National Academy of Sciences of the United States of America,0.062,21911384,-1,-1
intraparietal_00425,https://pubmed.ncbi.nlm.nih.gov/23166800/,An FMRI study of the neural systems involved in visually cued auditory top-down spatial and temporal attention.,"Li C, Chen K, Han H, Chui D, Wu J",PloS one,0.062,23166800,-1,-1
intraparietal_00426,https://pubmed.ncbi.nlm.nih.gov/24828652/,Memory accumulation mechanisms in human cortex are independent of motor intentions.,"Sestieri C, Tosoni A, Mignogna V, McAvoy MP, Shulman GL, Corbetta M, Romani GL",The Journal of neuroscience : the official journal of the Society for Neuroscience,0.062,24828652,-1,-1
intraparietal_00427,https://pubmed.ncbi.nlm.nih.gov/25762673/,Dissociable cortical pathways for qualitative and quantitative mechanisms in the  face inversion effect.,"Matsuyoshi D, Morita T, Kochiyama T, Tanabe HC, Sadato N, Kakigi R",The Journal of neuroscience : the official journal of the Society for Neuroscience,0.062,25762673,-1,-1
intraparietal_00428,https://pubmed.ncbi.nlm.nih.gov/25951196/,"Variation in functional connectivity along anterior-to-posterior intraparietal sulcus, and relationship with age across late childhood and adolescence.","Vinette SA, Bray S",Developmental cognitive neuroscience,0.062,25951196,-1,-1
intraparietal_00429,https://pubmed.ncbi.nlm.nih.gov/28025017/,Automatic numerical-spatial association in synaesthesia: An fMRI investigation.,"Arend I, Ashkenazi S, Yuen K, Ofir S, Henik A",Neuropsychologia,0.062,28025017,-1,-1
intraparietal_00430,https://pubmed.ncbi.nlm.nih.gov/28259773/,Different activity patterns for action and language within their shared neural areas: An fMRI study on action observation and language phonology.,"Zhang Z, Sun Y, Humphreys GW, Song Y",Neuropsychologia,0.062,28259773,-1,-1
intraparietal_00431,https://pubmed.ncbi.nlm.nih.gov/29354041/,Longitudinal Brain Development of Numerical Skills in Typically Developing Children and Children with Developmental Dyscalculia.,"McCaskey U, von Aster M, Maurer U, Martin E, O'Gorman Tuura R, Kucian K",Frontiers in human neuroscience,0.062,29354041,-1,-1
intraparietal_00432,https://pubmed.ncbi.nlm.nih.gov/29505944/,The mental simulation of state/psychological verbs in the adolescent brain: An fMRI study.,"Tomasino B, Nobile M, Re M, Bellina M, Garzitto M, Arrigoni F, Molteni M, Fabbro F, Brambilla P",Brain and cognition,0.062,29505944,-1,-1
intraparietal_00433,https://pubmed.ncbi.nlm.nih.gov/17924535/,Selective visuo-haptic processing of shape and texture.,"Stilla R, Sathian K",Human brain mapping,0.061,17924535,-1,-1
intraparietal_00434,https://pubmed.ncbi.nlm.nih.gov/19199416/,Beyond hemispheric dominance: brain regions underlying the joint lateralization of language and arithmetic to the left hemisphere.,"Pinel P, Dehaene S",Journal of cognitive neuroscience,0.061,19199416,-1,-1
intraparietal_00435,https://pubmed.ncbi.nlm.nih.gov/19285142/,Left posterior parietal cortex participates in both task preparation and episodic retrieval.,"Phillips JS, Velanova K, Wolk DA, Wheeler ME",NeuroImage,0.061,19285142,-1,-1
intraparietal_00436,https://pubmed.ncbi.nlm.nih.gov/20434468/,Triangles have goals too: understanding action representation in left aIPS.,"Ramsey R, Hamilton FC",Neuropsychologia,0.061,20434468,-1,-1
intraparietal_00437,https://pubmed.ncbi.nlm.nih.gov/21787795/,The attention network of the human brain: relating structural damage associated with spatial neglect to functional imaging correlates of spatial attention.,"Ptak R, Schnider A",Neuropsychologia,0.061,21787795,-1,-1
intraparietal_00438,https://pubmed.ncbi.nlm.nih.gov/22279213/,Causal interactions in attention networks predict behavioral performance.,"Wen X, Yao L, Liu Y, Ding M",The Journal of neuroscience : the official journal of the Society for Neuroscience,0.061,22279213,-1,-1
intraparietal_00439,https://pubmed.ncbi.nlm.nih.gov/22682904/,Weak task-related modulation and stimulus representations during arithmetic problem solving in children with developmental dyscalculia.,"Ashkenazi S, Rosenberg-Lee M, Tenison C, Menon V",Developmental cognitive neuroscience,0.061,22682904,-1,-1
intraparietal_00440,https://pubmed.ncbi.nlm.nih.gov/22941718/,Spatial stimulus configuration and attentional selection: extrastriate and superior parietal interactions.,"Gillebert CR, Caspari N, Wagemans J, Peeters R, Dupont P, Vandenberghe R","Cerebral cortex (New York, N.Y. : 1991)",0.061,22941718,-1,-1
intraparietal_00441,https://pubmed.ncbi.nlm.nih.gov/25426057/,Hemodynamic Response Pattern of Spatial Cueing is Different for Social and Symbolic Cues.,"Lockhofen DE, Gruppe H, Ruprecht C, Gallhofer B, Sammer G",Frontiers in human neuroscience,0.061,25426057,10.3389/fnhum.2014.00912,-1
intraparietal_00442,https://pubmed.ncbi.nlm.nih.gov/25497398/,How number line estimation skills relate to neural activations in single digit subtraction problems.,"Berteletti I, Man G, Booth JR",NeuroImage,0.061,25497398,10.1016/j.neuroimage.2014.12.011,-1
intraparietal_00443,https://pubmed.ncbi.nlm.nih.gov/26049149/,What makes your brain suggestible? Hypnotizability is associated with differential brain activity during attention outside hypnosis.,"Cojan Y, Piguet C, Vuilleumier P",NeuroImage,0.061,26049149,10.1016/j.neuroimage.2015.05.076,-1
intraparietal_00444,https://pubmed.ncbi.nlm.nih.gov/26160287/,Development of common neural representations for distinct numerical problems.,"Chang TT, Rosenberg-Lee M, Metcalfe AW, Chen T, Menon V",Neuropsychologia,0.061,26160287,-1,-1
intraparietal_00445,https://pubmed.ncbi.nlm.nih.gov/28442224/,Functional hyperconnectivity vanishes in children with developmental dyscalculia  after numerical intervention.,"Michels L, O'Gorman R, Kucian K",Developmental cognitive neuroscience,0.061,28442224,-1,-1
intraparietal_00446,https://pubmed.ncbi.nlm.nih.gov/28939991/,When three is greater than five: EEG and fMRI signatures of errors in numerical and physical comparisons.,"Beldzik E, Domagalik A, Gawlowska M, Marek T, Mojsa-Kaja J",Brain structure & function,0.061,28939991,-1,-1
intraparietal_00447,https://pubmed.ncbi.nlm.nih.gov/28964911/,Bilateral dorsal fronto-parietal areas are associated with integration of visual  motion information and timed motor action.,"de Azevedo Neto RM, Amaro Junior E",Behavioural brain research,0.061,28964911,-1,-1
intraparietal_00448,https://pubmed.ncbi.nlm.nih.gov/29023463/,Learning to tie the knot: The acquisition of functional object representations by physical and observational experience.,"Cross ES, Hamilton AFC, Cohen NR, Grafton ST",PloS one,0.061,29023463,-1,-1
intraparietal_00449,https://pubmed.ncbi.nlm.nih.gov/15182320/,The role of V5 (hMT+) in visually guided hand movements: an fMRI study.,"Oreja-Guevara C, Kleiser R, Paulus W, Kruse W, Seitz RJ, Hoffmann KP",The European journal of neuroscience,0.06,15182320,-1,-1
intraparietal_00450,https://pubmed.ncbi.nlm.nih.gov/16806986/,Exploring the visual world: the neural substrate of spatial orienting.,"Himmelbach M, Erb M, Karnath HO",NeuroImage,0.06,16806986,-1,-1
intraparietal_00451,https://pubmed.ncbi.nlm.nih.gov/17398117/,fMRI reveals a preference for near viewing in the human parieto-occipital cortex.,"Quinlan DJ, Culham JC",NeuroImage,0.06,17398117,-1,-1
intraparietal_00452,https://pubmed.ncbi.nlm.nih.gov/19109459/,Discrete parieto-frontal functional connectivity related to grasping.,"Hattori N, Shibasaki H, Wheaton L, Wu T, Matsuhashi M, Hallett M",Journal of neurophysiology,0.06,19109459,-1,-1
intraparietal_00453,https://pubmed.ncbi.nlm.nih.gov/19301995/,Effective connectivity of the fronto-parietal network during attentional control.,"Wang L, Liu X, Guise KG, Knight RT, Ghajar J, Fan J",Journal of cognitive neuroscience,0.06,19301995,-1,-1
intraparietal_00454,https://pubmed.ncbi.nlm.nih.gov/21982696/,The neural correlates of object-centered processing in reading: a lesion study of neglect dyslexia.,"Ptak R, Di Pietro M, Schnider A",Neuropsychologia,0.06,21982696,-1,-1
intraparietal_00455,https://pubmed.ncbi.nlm.nih.gov/22634216/,Attentional priorities and access to short-term memory: parietal interactions.,"Gillebert CR, Dyrholm M, Vangkilde S, Kyllingsbaek S, Peeters R, Vandenberghe R",NeuroImage,0.06,22634216,-1,-1
intraparietal_00456,https://pubmed.ncbi.nlm.nih.gov/22634854/,Common substrate for mental arithmetic and finger representation in the parietal  cortex.,"Andres M, Michaux N, Pesenti M",NeuroImage,0.06,22634854,-1,-1
intraparietal_00457,https://pubmed.ncbi.nlm.nih.gov/22772359/,Whole-brain haemodynamic after-effects of 1-Hz magnetic stimulation of the posterior superior temporal cortex during action observation.,"Arfeller C, Schwarzbach J, Ubaldi S, Ferrari P, Barchiesi G, Cattaneo L",Brain topography,0.06,22772359,-1,-1
intraparietal_00458,https://pubmed.ncbi.nlm.nih.gov/24523939/,Real-time FMRI neurofeedback training of amygdala activity in patients with major depressive disorder.,"Young KD, Zotev V, Phillips R, Misaki M, Yuan H, Drevets WC, Bodurka J",PloS one,0.06,24523939,-1,-1
intraparietal_00459,https://pubmed.ncbi.nlm.nih.gov/26388724/,Gambling on visual performance: neural correlates of metacognitive choice between visual lotteries.,"Wu SW, Delgado MR, Maloney LT",Frontiers in neuroscience,0.06,26388724,-1,-1
intraparietal_00460,https://pubmed.ncbi.nlm.nih.gov/15110020/,The encoding of saccadic eye movements within human posterior parietal cortex.,"Konen CS, Kleiser R, Wittsack HJ, Bremmer F, Seitz RJ",NeuroImage,0.059,15110020,-1,-1
intraparietal_00461,https://pubmed.ncbi.nlm.nih.gov/16757180/,Neuroanatomical dissociation between bottom-up and top-down processes of visuospatial selective attention.,"Hahn B, Ross TJ, Stein EA",NeuroImage,0.059,16757180,-1,-1
intraparietal_00462,https://pubmed.ncbi.nlm.nih.gov/16854945/,The basal ganglia are hyperactive during the discrimination of tactile stimuli in writer's cramp.,"Peller M, Zeuner KE, Munchau A, Quartarone A, Weiss M, Knutzen A, Hallett M, Deuschl G, Siebner HR",Brain : a journal of neurology,0.059,16854945,10.1093/brain/awl181,-1
intraparietal_00463,https://pubmed.ncbi.nlm.nih.gov/17202232/,BOLD coherence reveals segregated functional neural interactions when adapting to distinct torque perturbations.,"Tunik E, Schmitt PJ, Grafton ST",Journal of neurophysiology,0.059,17202232,10.1152/jn.00405.2006,-1
intraparietal_00464,https://pubmed.ncbi.nlm.nih.gov/17621607/,The different neural correlates of action and functional knowledge in semantic memory: an FMRI study.,"Canessa N, Borgo F, Cappa SF, Perani D, Falini A, Buccino G, Tettamanti M, Shallice T","Cerebral cortex (New York, N.Y. : 1991)",0.059,17621607,10.1093/cercor/bhm110,-1
intraparietal_00465,https://pubmed.ncbi.nlm.nih.gov/19780040/,Primary and multisensory cortical activity is correlated with audiovisual percepts.,"Benoit MM, Raij T, Lin FH, Jaaskelainen IP, Stufflebeam S",Human brain mapping,0.059,19780040,10.1002/hbm.20884,-1
intraparietal_00466,https://pubmed.ncbi.nlm.nih.gov/20592124/,Repetition suppression dissociates spatial frames of reference in human saccade generation.,"Van Pelt S, Toni I, Diedrichsen J, Medendorp WP",Journal of neurophysiology,0.059,20592124,-1,-1
intraparietal_00467,https://pubmed.ncbi.nlm.nih.gov/21834102/,Rostrolateral prefrontal cortex: domain-general or domain-sensitive?,"Wendelken C, Chung D, Bunge SA",Human brain mapping,0.059,21834102,-1,-1
intraparietal_00468,https://pubmed.ncbi.nlm.nih.gov/23406055/,The dependencies of fronto-parietal BOLD responses evoked by covert visual search suggest eye-centred coding.,"Atabaki A, Dicke PW, Karnath HO, Thier P",The European journal of neuroscience,0.059,23406055,-1,-1
intraparietal_00469,https://pubmed.ncbi.nlm.nih.gov/23774397/,Neural substrates of cognitive switching and inhibition in a face processing task.,"Piguet C, Sterpenich V, Desseilles M, Cojan Y, Bertschy G, Vuilleumier P",NeuroImage,0.059,23774397,-1,-1
intraparietal_00470,https://pubmed.ncbi.nlm.nih.gov/26344476/,Representational content of occipitotemporal and parietal tool areas.,"Bracci S, Cavina-Pratesi C, Connolly JD, Ietswaart M",Neuropsychologia,0.059,26344476,-1,-1
intraparietal_00471,https://pubmed.ncbi.nlm.nih.gov/28069542/,Hemispheric asymmetries in the transition from action preparation to execution.,"Sulpizio V, Lucci G, Berchicci M, Galati G, Pitzalis S, Di Russo F",NeuroImage,0.059,28069542,-1,-1
intraparietal_00472,https://pubmed.ncbi.nlm.nih.gov/11556898/,Spatial coding of visual and somatic sensory information in body-centred coordinates.,"Galati G, Committeri G, Sanes JN, Pizzamiglio L",The European journal of neuroscience,0.058,11556898,-1,-1
intraparietal_00473,https://pubmed.ncbi.nlm.nih.gov/15006672/,A functional neuroimaging study of motivation and executive function.,"Taylor SF, Welsh RC, Wager TD, Phan KL, Fitzgerald KD, Gehring WJ",NeuroImage,0.058,15006672,-1,-1
intraparietal_00474,https://pubmed.ncbi.nlm.nih.gov/16337706/,Anterior and superior lateral occipito-temporal cortex responsible for target motion prediction during overt and covert visual pursuit.,"Kawawaki D, Shibata T, Goda N, Doya K, Kawato M",Neuroscience research,0.058,16337706,-1,-1
intraparietal_00475,https://pubmed.ncbi.nlm.nih.gov/16944492/,Frontoparietal cortical activity of methamphetamine-dependent and comparison subjects performing a delay discounting task.,"Monterosso JR, Ainslie G, Xu J, Cordova X, Domier CP, London ED",Human brain mapping,0.058,16944492,-1,-1
intraparietal_00476,https://pubmed.ncbi.nlm.nih.gov/17977592/,Neuroanatomical distribution of five semantic components of verbs: evidence from  fMRI.,"Kemmerer D, Castillo JG, Talavage T, Patterson S, Wiley C",Brain and language,0.058,17977592,-1,-1
intraparietal_00477,https://pubmed.ncbi.nlm.nih.gov/18433807/,The neural substrate of gesture recognition.,"Villarreal M, Fridman EA, Amengual A, Falasco G, Gerschcovich ER, Ulloa ER, Leiguarda RC",Neuropsychologia,0.058,18433807,-1,-1
intraparietal_00478,https://pubmed.ncbi.nlm.nih.gov/20629027/,Neural correlates of pantomiming familiar and unfamiliar tools: action semantics  versus mechanical problem solving?,"Vingerhoets G, Vandekerckhove E, Honore P, Vandemaele P, Achten E",Human brain mapping,0.058,20629027,-1,-1
intraparietal_00479,https://pubmed.ncbi.nlm.nih.gov/21671736/,Eye can see what you want: posterior intraparietal sulcus encodes the object of an actor's gaze.,"Ramsey R, Cross ES, Hamilton AF",Journal of cognitive neuroscience,0.058,21671736,-1,-1
