paper_name,paper_url,Title,Author,Journal,Loading,PMID,Doi,download_status
intraparietal_00480,https://pubmed.ncbi.nlm.nih.gov/21765184/,Attention supports verbal short-term memory via competition between dorsal and ventral attention networks.,"Majerus S, Attout L, D'Argembeau A, Degueldre C, Fias W, Maquet P, Martinez Perez T, Stawarczyk D, Salmon E, Van der Linden M, Phillips C, Balteau E","Cerebral cortex (New York, N.Y. : 1991)",0.058,21765184,-1,-1
intraparietal_00481,https://pubmed.ncbi.nlm.nih.gov/22357860/,Visuotopic cortical connectivity underlying attention revealed with white-matter  tractography.,"Greenberg AS, Verstynen T, Chiu YC, Yantis S, Schneider W, Behrmann M",The Journal of neuroscience : the official journal of the Society for Neuroscience,0.058,22357860,10.1523/JNEUROSCI.5419-11.2012,-1
intraparietal_00482,https://pubmed.ncbi.nlm.nih.gov/23470983/,Common parietal activation in musical mental transformations across pitch and time.,"Foster NE, Halpern AR, Zatorre RJ",NeuroImage,0.058,23470983,10.1016/j.neuroimage.2013.02.044,-1
intraparietal_00483,https://pubmed.ncbi.nlm.nih.gov/14511835/,Neural networks active during tactile form perception: common and differential activity during macrospatial and microspatial tasks.,"Stoesz MR, Zhang M, Weisser VD, Prather SC, Mao H, Sathian K",International journal of psychophysiology : official journal of the International Organization of Psychophysiology,0.057,14511835,-1,-1
intraparietal_00484,https://pubmed.ncbi.nlm.nih.gov/15449356/,Cortical activity to vibrotactile stimulation: an fMRI study in blind and sighted individuals.,"Burton H, Sinclair RJ, McLaren DG",Human brain mapping,0.057,15449356,-1,-1
intraparietal_00485,https://pubmed.ncbi.nlm.nih.gov/16236528/,Parallel networks operating across attentional deployment and motion processing:  a multi-seed partial least squares fMRI study.,"Caplan JB, Luks TL, Simpson GV, Glaholt M, McIntosh AR",NeuroImage,0.057,16236528,-1,-1
intraparietal_00486,https://pubmed.ncbi.nlm.nih.gov/17596416/,Frontoparietal activation with preparation for antisaccades.,"Brown MR, Vilis T, Everling S",Journal of neurophysiology,0.057,17596416,-1,-1
intraparietal_00487,https://pubmed.ncbi.nlm.nih.gov/18176625/,Controlled scanpath variation alters fusiform face activation.,"Morris JP, Pelphrey KA, McCarthy G",Social cognitive and affective neuroscience,0.057,18176625,-1,-1
intraparietal_00488,https://pubmed.ncbi.nlm.nih.gov/19199409/,Order and magnitude share a common representation in parietal cortex.,"Franklin MS, Jonides J",Journal of cognitive neuroscience,0.057,19199409,-1,-1
intraparietal_00489,https://pubmed.ncbi.nlm.nih.gov/19710309/,Search for a threatening target triggers limbic guidance of spatial attention.,"Mohanty A, Egner T, Monti JM, Mesulam MM",The Journal of neuroscience : the official journal of the Society for Neuroscience,0.057,19710309,-1,-1
intraparietal_00490,https://pubmed.ncbi.nlm.nih.gov/21103010/,The Saccadic Re-Centering Bias is Associated with Activity Changes in the Human Superior Colliculus.,"Krebs RM, Schoenfeld MA, Boehler CN, Song AW, Woldorff MG",Frontiers in human neuroscience,0.057,21103010,-1,-1
intraparietal_00491,https://pubmed.ncbi.nlm.nih.gov/22972952/,Intra- and interhemispheric connectivity between face-selective regions in the human brain.,"Davies-Thompson J, Andrews TJ",Journal of neurophysiology,0.057,22972952,-1,-1
intraparietal_00492,https://pubmed.ncbi.nlm.nih.gov/28220070/,Neural Correlates of Mirror Visual Feedback-Induced Performance Improvements: A Resting-State fMRI Study.,"Rjosk V, Lepsien J, Kaminski E, Hoff M, Sehm B, Steele CJ, Villringer A, Ragert P",Frontiers in human neuroscience,0.057,28220070,-1,-1
intraparietal_00493,https://pubmed.ncbi.nlm.nih.gov/28294713/,Attention to Distinct Goal-relevant Features Differentially Guides Semantic Knowledge Retrieval.,"Hanson GK, Chrysikou EG",Journal of cognitive neuroscience,0.057,28294713,-1,-1
intraparietal_00494,https://pubmed.ncbi.nlm.nih.gov/14568457/,Brain processing of visual sexual stimuli in healthy men: a functional magnetic resonance imaging study.,"Mouras H, Stoleru S, Bittoun J, Glutron D, Pelegrini-Issac M, Paradis AL, Burnod Y",NeuroImage,0.056,14568457,-1,-1
intraparietal_00495,https://pubmed.ncbi.nlm.nih.gov/16243051/,A functional MRI study of preparatory signals for spatial location and objects.,"Corbetta M, Tansy AP, Stanley CM, Astafiev SV, Snyder AZ, Shulman GL",Neuropsychologia,0.056,16243051,-1,-1
intraparietal_00496,https://pubmed.ncbi.nlm.nih.gov/16281285/,Neural bases of categorization of simple speech and nonspeech sounds.,"Husain FT, Fromm SJ, Pursley RH, Hosey LA, Braun AR, Horwitz B",Human brain mapping,0.056,16281285,-1,-1
intraparietal_00497,https://pubmed.ncbi.nlm.nih.gov/16421171/,Motor system activation after subcortical stroke depends on corticospinal system  integrity.,"Ward NS, Newton JM, Swayne OB, Lee L, Thompson AJ, Greenwood RJ, Rothwell JC, Frackowiak RS",Brain : a journal of neurology,0.056,16421171,-1,-1
intraparietal_00498,https://pubmed.ncbi.nlm.nih.gov/17652467/,The relationship between study processing and the effects of cue congruency at retrieval: fMRI support for transfer appropriate processing.,"Park H, Rugg MD","Cerebral cortex (New York, N.Y. : 1991)",0.056,17652467,-1,-1
intraparietal_00499,https://pubmed.ncbi.nlm.nih.gov/18308706/,The spatial attention network interacts with limbic and monoaminergic systems to  modulate motivation-induced attention shifts.,"Mohanty A, Gitelman DR, Small DM, Mesulam MM","Cerebral cortex (New York, N.Y. : 1991)",0.056,18308706,-1,-1
intraparietal_00500,https://pubmed.ncbi.nlm.nih.gov/21620984/,What difference does a year of schooling make? Maturation of brain response and connectivity between 2nd and 3rd grades during arithmetic problem solving.,"Rosenberg-Lee M, Barth M, Menon V",NeuroImage,0.056,21620984,-1,-1
intraparietal_00501,https://pubmed.ncbi.nlm.nih.gov/22015854/,FMRI-adaptation to highly-rendered color photographs of animals and manipulable artifacts during a classification task.,"Chouinard PA, Goodale MA",NeuroImage,0.056,22015854,10.1016/j.neuroimage.2011.09.073,-1
intraparietal_00502,https://pubmed.ncbi.nlm.nih.gov/22437052/,Processing noncanonical sentences in broca's region: reflections of movement distance and type.,"Makuuchi M, Grodzinsky Y, Amunts K, Santi A, Friederici AD","Cerebral cortex (New York, N.Y. : 1991)",0.056,22437052,10.1093/cercor/bhs058,-1
intraparietal_00503,https://pubmed.ncbi.nlm.nih.gov/23249348/,The biology of linguistic expression impacts neural correlates for spatial language.,"Emmorey K, McCullough S, Mehta S, Ponto LL, Grabowski TJ",Journal of cognitive neuroscience,0.056,23249348,10.1162/jocn_a_00339,-1
intraparietal_00504,https://pubmed.ncbi.nlm.nih.gov/23363408/,Contextual processing of abstract concepts reveals neural representations of nonlinguistic semantic content.,"Wilson-Mendenhall CD, Simmons WK, Martin A, Barsalou LW",Journal of cognitive neuroscience,0.056,23363408,-1,-1
intraparietal_00505,https://pubmed.ncbi.nlm.nih.gov/23408389/,Uncertainty in visual and auditory series is coded by modality-general and modality-specific neural systems.,"Nastase S, Iacovella V, Hasson U",Human brain mapping,0.056,23408389,-1,-1
intraparietal_00506,https://pubmed.ncbi.nlm.nih.gov/23874935/,The importance of encoding-related neural dynamics in the prediction of inter-individual differences in verbal working memory performance.,"Majerus S, Salmon E, Attout L",PloS one,0.056,23874935,-1,-1
intraparietal_00507,https://pubmed.ncbi.nlm.nih.gov/24069223/,Network dynamics underlying speed-accuracy trade-offs in response to errors.,"Agam Y, Carey C, Barton JJ, Dyckman KA, Lee AK, Vangel M, Manoach DS",PloS one,0.056,24069223,-1,-1
intraparietal_00508,https://pubmed.ncbi.nlm.nih.gov/24960045/,The neural basis of temporal order processing in past and future thought.,"D'Argembeau A, Jeunehomme O, Majerus S, Bastin C, Salmon E",Journal of cognitive neuroscience,0.056,24960045,-1,-1
intraparietal_00509,https://pubmed.ncbi.nlm.nih.gov/25133927/,Decoding letter position in word reading.,"Ossmy O, Ben-Shachar M, Mukamel R",Cortex; a journal devoted to the study of the nervous system and behavior,0.056,25133927,-1,-1
intraparietal_00510,https://pubmed.ncbi.nlm.nih.gov/27566261/,Functional neuroanatomy of arithmetic and word reading and its relationship to age.,"Evans TM, Flowers DL, Luetje MM, Napoliello E, Eden GF",NeuroImage,0.056,27566261,-1,-1
intraparietal_00511,https://pubmed.ncbi.nlm.nih.gov/28957344/,Functional hemispheric asymmetries during the planning and manual control of virtual avatar movements.,"Floegel M, Kell CA",PloS one,0.056,28957344,-1,-1
intraparietal_00512,https://pubmed.ncbi.nlm.nih.gov/29175612/,Making sense of objects lying around: How contextual objects shape brain activity during action observation.,"El-Sourani N, Wurm MF, Trempler I, Fink GR, Schubotz RI",NeuroImage,0.056,29175612,-1,-1
intraparietal_00513,https://pubmed.ncbi.nlm.nih.gov/10669519/,Human cerebellum plays an important role in memory-timed finger movement: an fMRI study.,"Kawashima R, Okuda J, Umetsu A, Sugiura M, Inoue K, Suzuki K, Tabuchi M, Tsukiura T, Narayan SL, Nagasaka T, Yanagawa I, Fujii T, Takahashi S, Fukuda H, Yamadori A",Journal of neurophysiology,0.055,10669519,-1,-1
intraparietal_00514,https://pubmed.ncbi.nlm.nih.gov/11099454/,Neural consequences of acting in near versus far space: a physiological basis for clinical dissociations.,"Weiss PH, Marshall JC, Wunderlich G, Tellmann L, Halligan PW, Freund HJ, Zilles K, Fink GR",Brain : a journal of neurology,0.055,11099454,-1,-1
intraparietal_00515,https://pubmed.ncbi.nlm.nih.gov/12880907/,Distinct neural substrates for visual search amongst spatial versus temporal distractors.,"Coull JT, Walsh V, Frith CD, Nobre AC",Brain research. Cognitive brain research,0.055,12880907,-1,-1
intraparietal_00516,https://pubmed.ncbi.nlm.nih.gov/17240164/,Short-term memory and the left intraparietal sulcus: focus of attention? Further  evidence from a face short-term memory paradigm.,"Majerus S, Bastin C, Poncelet M, Van der Linden M, Salmon E, Collette F, Maquet P",NeuroImage,0.055,17240164,-1,-1
intraparietal_00517,https://pubmed.ncbi.nlm.nih.gov/17321151/,Social stimuli interfere with cognitive control in autism.,"Dichter GS, Belger A",NeuroImage,0.055,17321151,-1,-1
intraparietal_00518,https://pubmed.ncbi.nlm.nih.gov/18337398/,Capture of auditory motion by vision is represented by an activation shift from auditory to visual motion cortex.,"Alink A, Singer W, Muckli L",The Journal of neuroscience : the official journal of the Society for Neuroscience,0.055,18337398,-1,-1
intraparietal_00519,https://pubmed.ncbi.nlm.nih.gov/21653723/,The organization of the human cerebral cortex estimated by intrinsic functional connectivity.,"Yeo BT, Krienen FM, Sepulcre J, Sabuncu MR, Lashkari D, Hollinshead M, Roffman JL, Smoller JW, Zollei L, Polimeni JR, Fischl B, Liu H, Buckner RL",Journal of neurophysiology,0.055,21653723,-1,-1
intraparietal_00520,https://pubmed.ncbi.nlm.nih.gov/21736455/,Neural dissociation of number from letter recognition and its relationship to parietal numerical processing.,"Park J, Hebrank A, Polk TA, Park DC",Journal of cognitive neuroscience,0.055,21736455,-1,-1
intraparietal_00521,https://pubmed.ncbi.nlm.nih.gov/22452557/,The context-object-manipulation triad: cross talk during action perception revealed by fMRI.,"Wurm MF, Cramon DY, Schubotz RI",Journal of cognitive neuroscience,0.055,22452557,10.1162/jocn_a_00232,-1
intraparietal_00522,https://pubmed.ncbi.nlm.nih.gov/22613230/,Fluid reasoning deficits in children with ADHD: evidence from fMRI.,"Tamm L, Juranek J",Brain research,0.055,22613230,10.1016/j.brainres.2012.05.021,-1
intraparietal_00523,https://pubmed.ncbi.nlm.nih.gov/23032487/,Vision holds a greater share in visuo-haptic object recognition than touch.,"Kassuba T, Klinge C, Holig C, Roder B, Siebner HR",NeuroImage,0.055,23032487,-1,-1
intraparietal_00524,https://pubmed.ncbi.nlm.nih.gov/23033853/,Task-dependent uncertainty modulation of perceptual decisions in the human brain.,"Li S, Yang F",The European journal of neuroscience,0.055,23033853,-1,-1
intraparietal_00525,https://pubmed.ncbi.nlm.nih.gov/24361478/,"Detecting math problem solving strategies: an investigation into the use of retrospective self-reports, latency and fMRI data.","Tenison C, Fincham JM, Anderson JR",Neuropsychologia,0.055,24361478,-1,-1
intraparietal_00526,https://pubmed.ncbi.nlm.nih.gov/24453190/,Prediction of human actions: Expertise and task-related effects on neural activation of the action observation network.,"Balser N, Lorey B, Pilgramm S, Stark R, Bischoff M, Zentgraf K, Williams AM, Munzert J",Human brain mapping,0.055,24453190,-1,-1
intraparietal_00527,https://pubmed.ncbi.nlm.nih.gov/25205663/,Top-down Modulation of Neural Activity in Anticipatory Visual Attention: Control  Mechanisms Revealed by Simultaneous EEG-fMRI.,"Liu Y, Bengson J, Huang H, Mangun GR, Ding M","Cerebral cortex (New York, N.Y. : 1991)",0.055,25205663,-1,-1
intraparietal_00528,https://pubmed.ncbi.nlm.nih.gov/27638209/,Absence of visual experience modifies the neural basis of numerical thinking.,"Kanjlia S, Lane C, Feigenson L, Bedny M",Proceedings of the National Academy of Sciences of the United States of America,0.055,27638209,-1,-1
intraparietal_00529,https://pubmed.ncbi.nlm.nih.gov/27845254/,Neuronal correlates of continuous manual tracking under varying visual movement feedback in a virtual reality environment.,"Limanowski J, Kirilina E, Blankenburg F",NeuroImage,0.055,27845254,-1,-1
intraparietal_00530,https://pubmed.ncbi.nlm.nih.gov/28017920/,Common and distinct brain regions processing multisensory bodily signals for peripersonal space and body ownership.,"Grivaz P, Blanke O, Serino A",NeuroImage,0.055,28017920,-1,-1
intraparietal_00531,https://pubmed.ncbi.nlm.nih.gov/28445695/,Neural correlates of evoked phantom limb sensations.,"Andoh J, Diers M, Milde C, Frobel C, Kleinbohl D, Flor H",Biological psychology,0.055,28445695,-1,-1
intraparietal_00532,https://pubmed.ncbi.nlm.nih.gov/19146963/,An investigation of the effects of relative probability of old and new test items on the neural correlates of successful and unsuccessful source memory.,"Vilberg KL, Rugg MD",NeuroImage,0.054,19146963,-1,-1
intraparietal_00533,https://pubmed.ncbi.nlm.nih.gov/21514925/,Influence of the COMT genotype on working memory and brain activity changes during development.,"Dumontheil I, Roggeman C, Ziermans T, Peyrard-Janvid M, Matsson H, Kere J, Klingberg T",Biological psychiatry,0.054,21514925,-1,-1
intraparietal_00534,https://pubmed.ncbi.nlm.nih.gov/21616086/,Functional dissociations between four basic arithmetic operations in the human posterior parietal cortex: a cytoarchitectonic mapping study.,"Rosenberg-Lee M, Chang TT, Young CB, Wu S, Menon V",Neuropsychologia,0.054,21616086,-1,-1
intraparietal_00535,https://pubmed.ncbi.nlm.nih.gov/22659025/,Gains of item-specific training in visual working memory and their neural correlates.,"Zimmer HD, Popp C, Reith W, Krick C",Brain research,0.054,22659025,-1,-1
intraparietal_00536,https://pubmed.ncbi.nlm.nih.gov/23362111/,Functional magnetic resonance imaging adaptation reveals the cortical networks for processing grasp-relevant object properties.,"Monaco S, Chen Y, Medendorp WP, Crawford JD, Fiehler K, Henriques DY","Cerebral cortex (New York, N.Y. : 1991)",0.054,23362111,-1,-1
intraparietal_00537,https://pubmed.ncbi.nlm.nih.gov/23536716/,The representation of tool and non-tool object information in the human intraparietal sulcus.,"Mruczek RE, von Loga IS, Kastner S",Journal of neurophysiology,0.054,23536716,-1,-1
intraparietal_00538,https://pubmed.ncbi.nlm.nih.gov/24012546/,The shared neural basis of empathy and facial imitation accuracy.,"Braadbaart L, de Grauw H, Perrett DI, Waiter GD, Williams JH",NeuroImage,0.054,24012546,-1,-1
intraparietal_00539,https://pubmed.ncbi.nlm.nih.gov/24092642/,He Who Is Well Prepared Has Half Won The Battle: An fMRI Study of Task Preparation.,"Manelis A, Reder LM","Cerebral cortex (New York, N.Y. : 1991)",0.054,24092642,-1,-1
intraparietal_00540,https://pubmed.ncbi.nlm.nih.gov/25562825/,Early visual deprivation changes cortical anatomical covariance in dorsal-stream  structures.,"Voss P, Zatorre RJ",NeuroImage,0.054,25562825,-1,-1
intraparietal_00541,https://pubmed.ncbi.nlm.nih.gov/25995478/,Connections between Intraparietal Sulcus and a Sensorimotor Network Underpin Sustained Tactile Attention.,"Goltz D, Gundlach C, Nierhaus T, Villringer A, Muller M, Pleger B",The Journal of neuroscience : the official journal of the Society for Neuroscience,0.054,25995478,10.1523/JNEUROSCI.3421-14.2015,-1
intraparietal_00542,https://pubmed.ncbi.nlm.nih.gov/27479051/,Relationship between Parental Feeding Practices and Neural Responses to Food Cues in Adolescents.,"Allen HA, Chambers A, Blissett J, Chechlacz M, Barrett T, Higgs S, Nouwen A",PloS one,0.054,27479051,10.1371/journal.pone.0157037,-1
intraparietal_00543,https://pubmed.ncbi.nlm.nih.gov/9465007/,Transition of brain activation from frontal to parietal areas in visuomotor sequence learning.,"Sakai K, Hikosaka O, Miyauchi S, Takino R, Sasaki Y, Putz B",The Journal of neuroscience : the official journal of the Society for Neuroscience,0.053,9465007,-1,-1
intraparietal_00544,https://pubmed.ncbi.nlm.nih.gov/15820643/,Distinctions between manipulation and function knowledge of objects: evidence from functional magnetic resonance imaging.,"Boronat CB, Buxbaum LJ, Coslett HB, Tang K, Saffran EM, Kimberg DY, Detre JA",Brain research. Cognitive brain research,0.053,15820643,-1,-1
intraparietal_00545,https://pubmed.ncbi.nlm.nih.gov/15907302/,Passive somatosensory discrimination tasks in healthy volunteers: differential networks involved in familiar versus unfamiliar shape and length discrimination.,"Van de Winckel A, Sunaert S, Wenderoth N, Peeters R, Van Hecke P, Feys H, Horemans E, Marchal G, Swinnen SP, Perfetti C, De Weerdt W",NeuroImage,0.053,15907302,-1,-1
intraparietal_00546,https://pubmed.ncbi.nlm.nih.gov/16280594/,Touching a rubber hand: feeling of body ownership is associated with activity in  multisensory brain areas.,"Ehrsson HH, Holmes NP, Passingham RE",The Journal of neuroscience : the official journal of the Society for Neuroscience,0.053,16280594,-1,-1
intraparietal_00547,https://pubmed.ncbi.nlm.nih.gov/16702002/,The left intraparietal sulcus and verbal short-term memory: focus of attention or serial order?,"Majerus S, Poncelet M, Van der Linden M, Albouy G, Salmon E, Sterpenich V, Vandewalle G, Collette F, Maquet P",NeuroImage,0.053,16702002,-1,-1
intraparietal_00548,https://pubmed.ncbi.nlm.nih.gov/24040007/,Human fMRI reveals that delayed action re-recruits visual perception.,"Singhal A, Monaco S, Kaufman LD, Culham JC",PloS one,0.053,24040007,-1,-1
intraparietal_00549,https://pubmed.ncbi.nlm.nih.gov/18258337/,Perspective taking to assess self-personality: what's modified in Alzheimer's disease?,"Ruby P, Collette F, D'Argembeau A, Peters F, Degueldre C, Balteau E, Luxen A, Maquet P, Salmon E",Neurobiology of aging,0.053,18258337,-1,-1
intraparietal_00550,https://pubmed.ncbi.nlm.nih.gov/18448649/,Perceptuo-motor interactions during prehension movements.,"Verhagen L, Dijkerman HC, Grol MJ, Toni I",The Journal of neuroscience : the official journal of the Society for Neuroscience,0.053,18448649,-1,-1
intraparietal_00551,https://pubmed.ncbi.nlm.nih.gov/19702467/,Neural basis of visual distraction.,"Kim SY, Hopfinger JB",Journal of cognitive neuroscience,0.053,19702467,-1,-1
intraparietal_00552,https://pubmed.ncbi.nlm.nih.gov/19715732/,Neural activations correlated with reading speed during reading novels.,"Fujimaki N, Munetsuna S, Sasaki T, Hayakawa T, Ihara A, Wei Q, Terazono Y, Murata T",Neuroscience research,0.053,19715732,-1,-1
intraparietal_00553,https://pubmed.ncbi.nlm.nih.gov/20980597/,Expectation-driven changes in cortical functional connectivity influence working  memory and long-term memory performance.,"Bollinger J, Rubens MT, Zanto TP, Gazzaley A",The Journal of neuroscience : the official journal of the Society for Neuroscience,0.053,20980597,-1,-1
intraparietal_00554,https://pubmed.ncbi.nlm.nih.gov/21248113/,Spontaneous action representation in smokers when watching movie characters smoke.,"Wagner DD, Dal Cin S, Sargent JD, Kelley WM, Heatherton TF",The Journal of neuroscience : the official journal of the Society for Neuroscience,0.053,21248113,-1,-1
intraparietal_00555,https://pubmed.ncbi.nlm.nih.gov/21575727/,Dual pathways for haptic and visual perception of spatial and texture information.,"Sathian K, Lacey S, Stilla R, Gibson GO, Deshpande G, Hu X, Laconte S, Glielmi C",NeuroImage,0.053,21575727,-1,-1
intraparietal_00556,https://pubmed.ncbi.nlm.nih.gov/21880922/,Dissociable effects of top-down and bottom-up attention during episodic encoding.,"Uncapher MR, Hutchinson JB, Wagner AD",The Journal of neuroscience : the official journal of the Society for Neuroscience,0.053,21880922,-1,-1
intraparietal_00557,https://pubmed.ncbi.nlm.nih.gov/24904374/,Accurate expectancies diminish perceptual distraction during visual search.,"Sy JL, Guerin SA, Stegman A, Giesbrecht B",Frontiers in human neuroscience,0.053,24904374,-1,-1
intraparietal_00558,https://pubmed.ncbi.nlm.nih.gov/26143208/,Temporal unpredictability of a stimulus sequence and the processing of neutral and emotional stimuli.,"Koppe G, Heidel A, Sammer G, Bohus M, Gallhofer B, Kirsch P, Lis S",NeuroImage,0.053,26143208,-1,-1
intraparietal_00559,https://pubmed.ncbi.nlm.nih.gov/28961524/,Auditory attention enhances processing of positive and negative words in inferior and superior prefrontal cortex.,"Wegrzyn M, Herbert C, Ethofer T, Flaisch T, Kissler J",Cortex; a journal devoted to the study of the nervous system and behavior,0.053,28961524,-1,-1
intraparietal_00560,https://pubmed.ncbi.nlm.nih.gov/15722209/,The sensorimotor transformation of cross-modal spatial information in the anterior intraparietal sulcus as revealed by functional MRI.,"Tanabe HC, Kato M, Miyauchi S, Hayashi S, Yanagida T",Brain research. Cognitive brain research,0.052,15722209,-1,-1
intraparietal_00561,https://pubmed.ncbi.nlm.nih.gov/16949303/,"Inhibition and generation of saccades: rapid event-related fMRI of prosaccades, antisaccades, and nogo trials.","Brown MR, Goltz HC, Vilis T, Ford KA, Everling S",NeuroImage,0.052,16949303,10.1016/j.neuroimage.2006.07.002,-1
intraparietal_00562,https://pubmed.ncbi.nlm.nih.gov/16988033/,Acute changes in frontoparietal activity after repetitive transcranial magnetic stimulation over the dorsolateral prefrontal cortex in a cued reaction time task.,"Rounis E, Stephan KE, Lee L, Siebner HR, Pesenti A, Friston KJ, Rothwell JC, Frackowiak RS",The Journal of neuroscience : the official journal of the Society for Neuroscience,0.052,16988033,10.1523/JNEUROSCI.2657-06.2006,-1
intraparietal_00563,https://pubmed.ncbi.nlm.nih.gov/19027079/,Developmental changes in category-specific brain responses to numbers and letters in a working memory task.,"Libertus ME, Brannon EM, Pelphrey KA",NeuroImage,0.052,19027079,10.1016/j.neuroimage.2008.10.027,-1
intraparietal_00564,https://pubmed.ncbi.nlm.nih.gov/19400672/,The role of right and left parietal lobes in the conceptual processing of numbers.,"Cappelletti M, Lee HL, Freeman ED, Price CJ",Journal of cognitive neuroscience,0.052,19400672,-1,-1
intraparietal_00565,https://pubmed.ncbi.nlm.nih.gov/19523524/,Tool responsive regions in the posterior parietal cortex: effect of differences in motor goal and target object during imagined transitive movements.,"Vingerhoets G, Acke F, Vandemaele P, Achten E",NeuroImage,0.052,19523524,-1,-1
intraparietal_00566,https://pubmed.ncbi.nlm.nih.gov/20140099/,Sleep deprivation impairs object-selective attention: a view from the ventral visual cortex.,"Lim J, Tan JC, Parimal S, Dinges DF, Chee MW",PloS one,0.052,20140099,-1,-1
intraparietal_00567,https://pubmed.ncbi.nlm.nih.gov/21787870/,Phonological manipulation between speech perception and production activates a parieto-frontal circuit.,"Peschke C, Ziegler W, Eisenberger J, Baumgaertner A",NeuroImage,0.052,21787870,-1,-1
intraparietal_00568,https://pubmed.ncbi.nlm.nih.gov/22062191/,Autism spectrum traits predict the neural response to eye gaze in typical individuals.,"Nummenmaa L, Engell AD, von dem Hagen E, Henson RN, Calder AJ",NeuroImage,0.052,22062191,-1,-1
intraparietal_00569,https://pubmed.ncbi.nlm.nih.gov/23416146/,Overlapping and distinct brain regions involved in estimating the spatial position of numerical and non-numerical magnitudes: an fMRI study.,"Vogel SE, Grabner RH, Schneider M, Siegler RS, Ansari D",Neuropsychologia,0.052,23416146,-1,-1
intraparietal_00570,https://pubmed.ncbi.nlm.nih.gov/25379713/,Neural mechanisms underlying the computation of hierarchical tree structures in mathematics.,"Nakai T, Sakai KL",PloS one,0.052,25379713,-1,-1
intraparietal_00571,https://pubmed.ncbi.nlm.nih.gov/27864082/,"Individual variation in intentionality in the mind-wandering state is reflected in the integration of the default-mode, fronto-parietal, and limbic networks.","Golchert J, Smallwood J, Jefferies E, Seli P, Huntenburg JM, Liem F, Lauckner ME, Oligschlager S, Bernhardt BC, Villringer A, Margulies DS",NeuroImage,0.052,27864082,-1,-1
intraparietal_00572,https://pubmed.ncbi.nlm.nih.gov/12595178/,Differential cortical activation during voluntary and reflexive saccades in man.,"Mort DJ, Perry RJ, Mannan SK, Hodgson TL, Anderson E, Quest R, McRobbie D, McBride A, Husain M, Kennard C",NeuroImage,0.051,12595178,-1,-1
