paper_name,paper_url,Title,Author,Journal,Loading,PMID,Doi,download_status
junction_00101,https://pubmed.ncbi.nlm.nih.gov/20869449/,The BOLD correlates of the visual P1 and N1 in single-trial analysis of simultaneous EEG-fMRI recordings during a spatial detection task.,"Novitskiy N, Ramautar JR, Vanderperren K, De Vos M, Mennes M, Mijovic B, Vanrumste B, Stiers P, Van den Bergh B, Lagae L, Sunaert S, Van Huffel S, Wagemans J",NeuroImage,0.088,20869449,-1,-1
junction_00102,https://pubmed.ncbi.nlm.nih.gov/21549201/,Cultural influences on neural basis of intergroup empathy.,"Cheon BK, Im DM, Harada T, Kim JS, Mathur VA, Scimeca JM, Parrish TB, Park HW, Chiao JY",NeuroImage,0.088,21549201,-1,-1
junction_00103,https://pubmed.ncbi.nlm.nih.gov/22016480/,Mathematics anxiety: separating the math from the anxiety.,"Lyons IM, Beilock SL","Cerebral cortex (New York, N.Y. : 1991)",0.088,22016480,-1,-1
junction_00104,https://pubmed.ncbi.nlm.nih.gov/23685774/,Evaluating ambivalence: social-cognitive and affective brain regions associated with ambivalent decision-making.,"Nohlen HU, van Harreveld F, Rotteveel M, Lelieveld GJ, Crone EA",Social cognitive and affective neuroscience,0.088,23685774,-1,-1
junction_00105,https://pubmed.ncbi.nlm.nih.gov/26347227/,Cannabis use in early adolescence: Evidence of amygdala hypersensitivity to signals of threat.,"Spechler PA, Orr CA, Chaarani B, Kan KJ, Mackey S, Morton A, Snowe MP, Hudson KE, Althoff RR, Higgins ST, Cattrell A, Flor H, Nees F, Banaschewski T, Bokde ALW, Whelan R, Buchel C, Bromberg U, Conrod P, Frouin V, Papadopoulos D, Gallinat J, Heinz A, Walter H, Ittermann B, Gowland P, Paus T, Poustka L, Martinot JL, Artiges E, Smolka MN, Schumann G, Garavan H",Developmental cognitive neuroscience,0.088,26347227,-1,-1
junction_00106,https://pubmed.ncbi.nlm.nih.gov/10920049/,Visual perception of motion and 3-D structure from motion: an fMRI study.,"Paradis AL, Cornilleau-Peres V, Droulez J, Van De Moortele PF, Lobel E, Berthoz A, Le Bihan D, Poline JB","Cerebral cortex (New York, N.Y. : 1991)",0.087,10920049,-1,-1
junction_00107,https://pubmed.ncbi.nlm.nih.gov/16952466/,Detecting fearful and neutral faces: BOLD latency differences in amygdala-hippocampal junction.,"Reinders AA, Glascher J, de Jong JR, Willemsen AT, den Boer JA, Buchel C",NeuroImage,0.087,16952466,-1,-1
junction_00108,https://pubmed.ncbi.nlm.nih.gov/19171195/,Supercalifragilisticexpialidocious: how the brain learns words never heard before.,"Paulesu E, Vallar G, Berlingeri M, Signorini M, Vitali P, Burani C, Perani D, Fazio F",NeuroImage,0.087,19171195,-1,-1
junction_00109,https://pubmed.ncbi.nlm.nih.gov/22609579/,The neuroscience of group membership.,"Morrison S, Decety J, Molenberghs P",Neuropsychologia,0.087,22609579,-1,-1
junction_00110,https://pubmed.ncbi.nlm.nih.gov/25524648/,The neural signature of information regularity in temporally extended event sequences.,"Zhang J, Rowe JB",NeuroImage,0.087,25524648,-1,-1
junction_00111,https://pubmed.ncbi.nlm.nih.gov/28559803/,Aberrant Insula-Centered Functional Connectivity in Psychogenic Erectile Dysfunction Patients: A Resting-State fMRI Study.,"Wang Y, Dong M, Guan M, Wu J, He Z, Zou Z, Chen X, Shi D, Liang J, Zhang X",Frontiers in human neuroscience,0.087,28559803,10.3389/fnhum.2017.00221,-1
junction_00112,https://pubmed.ncbi.nlm.nih.gov/28757070/,Individual differences in the processing of smoking-cessation video messages: An  imaging genetics study.,"Shi Z, Wang AL, Aronowitz CA, Romer D, Langleben DD",Biological psychology,0.087,28757070,10.1016/j.biopsycho.2017.07.019,-1
junction_00113,https://pubmed.ncbi.nlm.nih.gov/28912675/,Deceptive but Not Honest Manipulative Actions Are Associated with Increased Interaction between Middle and Inferior Frontal gyri.,"Kireev M, Korotkov A, Medvedeva N, Masharipov R, Medvedev S",Frontiers in neuroscience,0.087,28912675,-1,-1
junction_00114,https://pubmed.ncbi.nlm.nih.gov/16257547/,Ecphory of autobiographical memories: an fMRI study of recent and remote memory retrieval.,"Steinvorth S, Corkin S, Halgren E",NeuroImage,0.086,16257547,-1,-1
junction_00115,https://pubmed.ncbi.nlm.nih.gov/19878727/,A functional imaging investigation of moral deliberation and moral intuition.,"Harenski CL, Antonenko O, Shane MS, Kiehl KA",NeuroImage,0.086,19878727,-1,-1
junction_00116,https://pubmed.ncbi.nlm.nih.gov/21872451/,Impaired neural processing of social attribution in anorexia nervosa.,"McAdams CJ, Krawczyk DC",Psychiatry research,0.086,21872451,-1,-1
junction_00117,https://pubmed.ncbi.nlm.nih.gov/24224053/,The neural basis of responsibility attribution in decision-making.,"Li P, Shen Y, Sui X, Chen C, Feng T, Li H, Holroyd C",PloS one,0.086,24224053,-1,-1
junction_00118,https://pubmed.ncbi.nlm.nih.gov/24647937/,"The Good, the bad, and the just: justice sensitivity predicts neural response during moral evaluation of actions performed by others.","Yoder KJ, Decety J",The Journal of neuroscience : the official journal of the Society for Neuroscience,0.086,24647937,-1,-1
junction_00119,https://pubmed.ncbi.nlm.nih.gov/27835675/,Group Membership Modulates the Neural Circuitry Underlying Third Party Punishment.,"Morese R, Rabellino D, Sambataro F, Perussia F, Valentini MC, Bara BG, Bosco FM",PloS one,0.086,27835675,-1,-1
junction_00120,https://pubmed.ncbi.nlm.nih.gov/16513368/,The neural implementation of multi-attribute decision making: a parametric fMRI study with human subjects.,"Zysset S, Wendt CS, Volz KG, Neumann J, Huber O, von Cramon DY",NeuroImage,0.085,16513368,-1,-1
junction_00121,https://pubmed.ncbi.nlm.nih.gov/17720687/,A frontoparietal network for spatial attention reorienting in the auditory domain: a human fMRI/MEG study of functional and temporal dynamics.,"Brunetti M, Della Penna S, Ferretti A, Del Gratta C, Cianflone F, Belardinelli P, Caulo M, Pizzella V, Olivetti Belardinelli M, Romani GL","Cerebral cortex (New York, N.Y. : 1991)",0.085,17720687,-1,-1
junction_00122,https://pubmed.ncbi.nlm.nih.gov/22348885/,Differentiating maturational and training influences on fMRI activation during music processing.,"Ellis RJ, Norton AC, Overy K, Winner E, Alsop DC, Schlaug G",NeuroImage,0.085,22348885,-1,-1
junction_00123,https://pubmed.ncbi.nlm.nih.gov/23847507/,Framing the ultimatum game: the contribution of simulation.,"Tomasino B, Lotto L, Sarlo M, Civai C, Rumiati R, Rumiati RI",Frontiers in human neuroscience,0.085,23847507,-1,-1
junction_00124,https://pubmed.ncbi.nlm.nih.gov/23893849/,Cognitive empathy modulates the processing of pragmatic constraints during sentence comprehension.,"Li S, Jiang X, Yu H, Zhou X",Social cognitive and affective neuroscience,0.085,23893849,-1,-1
junction_00125,https://pubmed.ncbi.nlm.nih.gov/24004695/,Functional connectivity between ventral and dorsal frontoparietal networks underlies stimulus-driven and working memory-driven sources of visual distraction.,"Greene CM, Soto D",NeuroImage,0.085,24004695,-1,-1
junction_00126,https://pubmed.ncbi.nlm.nih.gov/26621704/,"Neural evidence that three dimensions organize mental state representation: Rationality, social impact, and valence.","Tamir DI, Thornton MA, Contreras JM, Mitchell JP",Proceedings of the National Academy of Sciences of the United States of America,0.085,26621704,-1,-1
junction_00127,https://pubmed.ncbi.nlm.nih.gov/28755632/,Heightened activity in social reward networks is associated with adolescents' risky sexual behaviors.,"Eckstrand KL, Choukas-Bradley S, Mohanty A, Cross M, Allen NB, Silk JS, Jones NP, Forbes EE",Developmental cognitive neuroscience,0.085,28755632,-1,-1
junction_00128,https://pubmed.ncbi.nlm.nih.gov/29122723/,The neuronal network involved in self-attribution of an artificial hand: A lesion network-symptom-mapping study.,"Wawrzyniak M, Klingbeil J, Zeller D, Saur D, Classen J",NeuroImage,0.085,29122723,-1,-1
junction_00129,https://pubmed.ncbi.nlm.nih.gov/16525051/,Local morphology predicts functional organization of the dorsal premotor region in the human brain.,"Amiez C, Kostopoulos P, Champod AS, Petrides M",The Journal of neuroscience : the official journal of the Society for Neuroscience,0.084,16525051,-1,-1
junction_00130,https://pubmed.ncbi.nlm.nih.gov/18476760/,In the eye of the beholder: individual differences in perceived social isolation  predict regional brain activation to social stimuli.,"Cacioppo JT, Norris CJ, Decety J, Monteleone G, Nusbaum H",Journal of cognitive neuroscience,0.084,18476760,-1,-1
junction_00131,https://pubmed.ncbi.nlm.nih.gov/20338249/,"Decomposing the neural mechanisms of visual search through model-based analysis of fMRI: top-down excitation, active ignoring and the use of saliency by the right TPJ.","Mavritsaki E, Allen HA, Humphreys GW",NeuroImage,0.084,20338249,10.1016/j.neuroimage.2010.03.044,-1
junction_00132,https://pubmed.ncbi.nlm.nih.gov/20350933/,Unfair? It depends: neural correlates of fairness in social context.,"Guroglu B, van den Bos W, Rombouts SA, Crone EA",Social cognitive and affective neuroscience,0.084,20350933,10.1093/scan/nsq013,-1
junction_00133,https://pubmed.ncbi.nlm.nih.gov/21315749/,The role of negative affectivity and social inhibition in perceiving social threat: an fMRI study.,"Kret ME, Denollet J, Grezes J, de Gelder B",Neuropsychologia,0.084,21315749,10.1016/j.neuropsychologia.2011.02.007,-1
junction_00134,https://pubmed.ncbi.nlm.nih.gov/26598684/,Neural mechanisms tracking popularity in real-world social networks.,"Zerubavel N, Bearman PS, Weber J, Ochsner KN",Proceedings of the National Academy of Sciences of the United States of America,0.084,26598684,-1,-1
junction_00135,https://pubmed.ncbi.nlm.nih.gov/27747153/,"Structural brain abnormalities in a single gene disorder associated with epilepsy, language impairment and intellectual disability.","Bathelt J, Astle D, Barnes J, Raymond FL, Baker K",NeuroImage. Clinical,0.084,27747153,-1,-1
junction_00136,https://pubmed.ncbi.nlm.nih.gov/12098493/,Common neural processing regions for dynamic and static stereopsis in human parieto-occipital cortices.,"Iwami T, Nishida Y, Hayashi O, Kimura M, Sakai M, Kani K, Ito R, Shiino A, Suzuki M",Neuroscience letters,0.083,12098493,-1,-1
junction_00137,https://pubmed.ncbi.nlm.nih.gov/18985142/,Anthropomorphism influences perception of computer-animated characters' actions.,"Chaminade T, Hodgins J, Kawato M",Social cognitive and affective neuroscience,0.083,18985142,-1,-1
junction_00138,https://pubmed.ncbi.nlm.nih.gov/22225882/,Landmark sequencing and route knowledge: an fMRI study.,"Nemmi F, Piras F, Peran P, Incoccia C, Sabatini U, Guariglia C",Cortex; a journal devoted to the study of the nervous system and behavior,0.083,22225882,-1,-1
junction_00139,https://pubmed.ncbi.nlm.nih.gov/23404563/,Explicit authenticity and stimulus features interact to modulate BOLD response induced by emotional speech.,"Drolet M, Schubotz RI, Fischer J","Cognitive, affective & behavioral neuroscience",0.083,23404563,-1,-1
junction_00140,https://pubmed.ncbi.nlm.nih.gov/23645715/,Beyond the Language Given: The Neural Correlates of Inferring Speaker Meaning.,"Basnakova J, Weber K, Petersson KM, van Berkum J, Hagoort P","Cerebral cortex (New York, N.Y. : 1991)",0.083,23645715,-1,-1
junction_00141,https://pubmed.ncbi.nlm.nih.gov/25379447/,Functional neuroimaging of conversion disorder: The role of ancillary activation.,"Burke MJ, Ghaffar O, Staines WR, Downar J, Feinstein A",NeuroImage. Clinical,0.083,25379447,-1,-1
junction_00142,https://pubmed.ncbi.nlm.nih.gov/20723605/,Similarities and differences in perceiving threat from dynamic faces and bodies.  An fMRI study.,"Kret ME, Pichon S, Grezes J, de Gelder B",NeuroImage,0.082,20723605,-1,-1
junction_00143,https://pubmed.ncbi.nlm.nih.gov/21484518/,Brain mechanisms for processing direct and averted gaze in individuals with autism.,"Pitskel NB, Bolling DZ, Hudac CM, Lantz SD, Minshew NJ, Vander Wyk BC, Pelphrey KA",Journal of autism and developmental disorders,0.082,21484518,-1,-1
junction_00144,https://pubmed.ncbi.nlm.nih.gov/23313779/,Toward a minimally invasive brain-computer interface using a single subdural channel: a visual speller study.,"Zhang D, Song H, Xu R, Zhou W, Ling Z, Hong B",NeuroImage,0.082,23313779,-1,-1
junction_00145,https://pubmed.ncbi.nlm.nih.gov/24009354/,Does self-construal predict activity in the social brain network? A genetic moderation effect.,"Ma Y, Wang C, Li B, Zhang W, Rao Y, Han S",Social cognitive and affective neuroscience,0.082,24009354,-1,-1
junction_00146,https://pubmed.ncbi.nlm.nih.gov/11133789/,Separate neural subsystems within 'Wernicke's area'.,"Wise RJ, Scott SK, Blank SC, Mummery CJ, Murphy K, Warburton EA",Brain : a journal of neurology,0.081,11133789,-1,-1
junction_00147,https://pubmed.ncbi.nlm.nih.gov/21821135/,Genetic variation in nicotinic receptors affects brain networks involved in reorienting attention.,"Giessing C, Neber T, Thiel CM",NeuroImage,0.081,21821135,-1,-1
junction_00148,https://pubmed.ncbi.nlm.nih.gov/23365249/,Neural correlates of reinforcement learning and social preferences in competitive bidding.,"van den Bos W, Talwar A, McClure SM",The Journal of neuroscience : the official journal of the Society for Neuroscience,0.081,23365249,-1,-1
junction_00149,https://pubmed.ncbi.nlm.nih.gov/24089495/,Imaging social motivation: distinct brain mechanisms drive effort production during collaboration versus competition.,"Le Bouc R, Pessiglione M",The Journal of neuroscience : the official journal of the Society for Neuroscience,0.081,24089495,-1,-1
junction_00150,https://pubmed.ncbi.nlm.nih.gov/24269573/,To create or to recall? Neural mechanisms underlying the generation of creative new ideas.,"Benedek M, Jauk E, Fink A, Koschutnig K, Reishofer G, Ebner F, Neubauer AC",NeuroImage,0.081,24269573,-1,-1
junction_00151,https://pubmed.ncbi.nlm.nih.gov/25241085/,Responses to irrational actions in action observation and mentalising networks of the human brain.,"Marsh LE, Mullett TL, Ropar D, Hamilton AFC",NeuroImage,0.081,25241085,10.1016/j.neuroimage.2014.09.020,-1
junction_00152,https://pubmed.ncbi.nlm.nih.gov/25852519/,Plasma oxytocin explains individual differences in neural substrates of social perception.,"Lancaster K, Carter CS, Pournajafi-Nazarloo H, Karaoli T, Lillard TS, Jack A, Davis JM, Morris JP, Connelly JJ",Frontiers in human neuroscience,0.081,25852519,10.3389/fnhum.2015.00132,-1
junction_00153,https://pubmed.ncbi.nlm.nih.gov/26448909/,Impaired target detection in schizophrenia and the ventral attentional network: Findings from a joint event-related potential-functional MRI analysis.,"Wynn JK, Jimenez AM, Roach BJ, Korb A, Lee J, Horan WP, Ford JM, Green MF",NeuroImage. Clinical,0.081,26448909,10.1016/j.nicl.2015.07.004,-1
junction_00154,https://pubmed.ncbi.nlm.nih.gov/17643400/,Cultural and linguistic effects on neural bases of 'Theory of Mind' in American and Japanese children.,"Kobayashi C, Glover GH, Temple E",Brain research,0.08,17643400,-1,-1
junction_00155,https://pubmed.ncbi.nlm.nih.gov/19279255/,Temporal order judgments activate temporal parietal junction.,"Davis B, Christie J, Rorden C",The Journal of neuroscience : the official journal of the Society for Neuroscience,0.08,19279255,-1,-1
junction_00156,https://pubmed.ncbi.nlm.nih.gov/24370610/,Facial emotion modulates the neural mechanisms responsible for short interval time perception.,"Tipples J, Brattan V, Johnston P",Brain topography,0.08,24370610,-1,-1
junction_00157,https://pubmed.ncbi.nlm.nih.gov/11230098/,Conjoint and extended neural networks for the computation of speech codes: the neural basis of selective impairment in reading words and pseudowords.,"Xu B, Grafman J, Gaillard WD, Ishii K, Vega-Bermudez F, Pietrini P, Reeves-Tyer P, DiCamillo P, Theodore W","Cerebral cortex (New York, N.Y. : 1991)",0.079,11230098,-1,-1
junction_00158,https://pubmed.ncbi.nlm.nih.gov/11958964/,Neural activation during an explicit categorization task: category- or feature-specific effects?,"Kraut MA, Moo LR, Segal JB, Hart J Jr",Brain research. Cognitive brain research,0.079,11958964,-1,-1
junction_00159,https://pubmed.ncbi.nlm.nih.gov/18445602/,Functional dissociation in right inferior frontal cortex during performance of go/no-go task.,"Chikazoe J, Jimura K, Asari T, Yamashita K, Morimoto H, Hirose S, Miyashita Y, Konishi S","Cerebral cortex (New York, N.Y. : 1991)",0.079,18445602,-1,-1
junction_00160,https://pubmed.ncbi.nlm.nih.gov/18702587/,"Temporo-parietal junction activity in theory-of-mind tasks: falseness, beliefs, or attention.","Aichhorn M, Perner J, Weiss B, Kronbichler M, Staffen W, Ladurner G",Journal of cognitive neuroscience,0.079,18702587,-1,-1
junction_00161,https://pubmed.ncbi.nlm.nih.gov/21071182/,Mindfulness practice leads to increases in regional brain gray matter density.,"Holzel BK, Carmody J, Vangel M, Congleton C, Yerramsetti SM, Gard T, Lazar SW",Psychiatry research,0.079,21071182,-1,-1
junction_00162,https://pubmed.ncbi.nlm.nih.gov/23201492/,Dorsal and ventral working memory-related brain areas support distinct processes  in contextual cueing.,"Manginelli AA, Baumgartner F, Pollmann S",NeuroImage,0.079,23201492,-1,-1
junction_00163,https://pubmed.ncbi.nlm.nih.gov/24165833/,Analysis of Cortical Shape in Children with Simplex Autism.,"Dierker DL, Feczko E, Pruett JR Jr, Petersen SE, Schlaggar BL, Constantino JN, Harwell JW, Coalson TS, Van Essen DC","Cerebral cortex (New York, N.Y. : 1991)",0.079,24165833,-1,-1
junction_00164,https://pubmed.ncbi.nlm.nih.gov/26348560/,Functional connectivity between the cerebrum and cerebellum in social cognition:  A multi-study analysis.,"Van Overwalle F, Marien P",NeuroImage,0.079,26348560,-1,-1
junction_00165,https://pubmed.ncbi.nlm.nih.gov/28142026/,Isolating response inhibition in the brain: Parietal versus frontal contribution.,"Kolodny T, Mevorach C, Shalev L",Cortex; a journal devoted to the study of the nervous system and behavior,0.079,28142026,-1,-1
junction_00166,https://pubmed.ncbi.nlm.nih.gov/29408576/,Neural correlates of novelty and appropriateness processing in externally induced constraint relaxation.,"Huang F, Tang S, Sun P, Luo J",NeuroImage,0.079,29408576,-1,-1
junction_00167,https://pubmed.ncbi.nlm.nih.gov/15219589/,Neural changes associated with speech learning in deaf children following cochlear implantation.,"Kang E, Lee DS, Kang H, Lee JS, Oh SH, Lee MC, Kim CS",NeuroImage,0.078,15219589,-1,-1
junction_00168,https://pubmed.ncbi.nlm.nih.gov/16122945/,Development of attentional networks: an fMRI study with children and adults.,"Konrad K, Neufang S, Thiel CM, Specht K, Hanisch C, Fan J, Herpertz-Dahlmann B, Fink GR",NeuroImage,0.078,16122945,-1,-1
junction_00169,https://pubmed.ncbi.nlm.nih.gov/17499159/,The neural basis for understanding non-intended actions.,"Buccino G, Baumgaertner A, Colle L, Buechel C, Rizzolatti G, Binkofski F",NeuroImage,0.078,17499159,-1,-1
junction_00170,https://pubmed.ncbi.nlm.nih.gov/18378467/,Anatomical substrates of cooperative joint-action in a continuous motor task: virtual lifting and balancing.,"Newman-Norlund RD, Bosga J, Meulenbroek RG, Bekkering H",NeuroImage,0.078,18378467,-1,-1
junction_00171,https://pubmed.ncbi.nlm.nih.gov/21092865/,Human posterior parietal cortex flexibly determines reference frames for reaching based on sensory context.,"Bernier PM, Grafton ST",Neuron,0.078,21092865,10.1016/j.neuron.2010.11.002,-1
junction_00172,https://pubmed.ncbi.nlm.nih.gov/22569187/,Neural correlates of moral reasoning in autism spectrum disorder.,"Schneider K, Pauly KD, Gossen A, Mevissen L, Michel TM, Gur RC, Schneider F, Habel U",Social cognitive and affective neuroscience,0.078,22569187,10.1093/scan/nss051,-1
junction_00173,https://pubmed.ncbi.nlm.nih.gov/23720575/,Reward-related neural responses are dependent on the beneficiary.,"Braams BR, Guroglu B, de Water E, Meuwese R, Koolschijn PC, Peper JS, Crone EA",Social cognitive and affective neuroscience,0.078,23720575,-1,-1
junction_00174,https://pubmed.ncbi.nlm.nih.gov/24652858/,Acting on social exclusion: neural correlates of punishment and forgiveness of excluders.,"Will GJ, Crone EA, Guroglu B",Social cognitive and affective neuroscience,0.078,24652858,-1,-1
junction_00175,https://pubmed.ncbi.nlm.nih.gov/29380291/,Neural correlates of three cognitive processes involved in theory of mind and discourse comprehension.,"Lin N, Yang X, Li J, Wang S, Hua H, Ma Y, Li X","Cognitive, affective & behavioral neuroscience",0.078,29380291,-1,-1
junction_00176,https://pubmed.ncbi.nlm.nih.gov/17553704/,The cognitive control network: Integrated cortical regions with dissociable functions.,"Cole MW, Schneider W",NeuroImage,0.077,17553704,-1,-1
junction_00177,https://pubmed.ncbi.nlm.nih.gov/18431500/,Cooperation and deception recruit different subsets of the theory-of-mind network.,"Lissek S, Peters S, Fuchs N, Witthaus H, Nicolas V, Tegenthoff M, Juckel G, Brune M",PloS one,0.077,18431500,-1,-1
junction_00178,https://pubmed.ncbi.nlm.nih.gov/19166947/,Neural basis of interaction between target presence and display homogeneity in visual search: an fMRI study.,"Wei P, Muller HJ, Pollmann S, Zhou X",NeuroImage,0.077,19166947,-1,-1
junction_00179,https://pubmed.ncbi.nlm.nih.gov/19302165/,Functional connectivity during a social emotion task in adolescents and in adults.,"Burnett S, Blakemore SJ",The European journal of neuroscience,0.077,19302165,-1,-1
junction_00180,https://pubmed.ncbi.nlm.nih.gov/20060103/,Auditory hallucinations in schizophrenia are associated with reduced functional connectivity of the temporo-parietal area.,"Vercammen A, Knegtering H, den Boer JA, Liemburg EJ, Aleman A",Biological psychiatry,0.077,20060103,-1,-1
junction_00181,https://pubmed.ncbi.nlm.nih.gov/21168512/,Left TPJ activity in verbal working memory: implications for storage- and sensory-specific models of short term memory.,"Ravizza SM, Hazeltine E, Ruiz S, Zhu DC",NeuroImage,0.077,21168512,-1,-1
junction_00182,https://pubmed.ncbi.nlm.nih.gov/22366332/,Age effects on the P300 potential and the corresponding fMRI BOLD-signal.,"Juckel G, Karch S, Kawohl W, Kirsch V, Jager L, Leicht G, Lutz J, Stammel A, Pogarell O, Ertl M, Reiser M, Hegerl U, Moller HJ, Mulert C",NeuroImage,0.077,22366332,-1,-1
junction_00183,https://pubmed.ncbi.nlm.nih.gov/23818133/,Networks involved in olfaction and their dynamics using independent component analysis and unified structural equation modeling.,"Karunanayaka P, Eslinger PJ, Wang JL, Weitekamp CW, Molitoris S, Gates KM, Molenaar PC, Yang QX",Human brain mapping,0.077,23818133,-1,-1
junction_00184,https://pubmed.ncbi.nlm.nih.gov/24027192/,Real world navigation independence in the early blind correlates with differential brain activity associated with virtual navigation.,"Halko MA, Connors EC, Sanchez J, Merabet LB",Human brain mapping,0.077,24027192,-1,-1
junction_00185,https://pubmed.ncbi.nlm.nih.gov/24532318/,Unfamiliar Walking Movements Are Detected Early in the Visual Stream: An fMRI Study.,"Maffei V, Giusti MA, Macaluso E, Lacquaniti F, Viviani P","Cerebral cortex (New York, N.Y. : 1991)",0.077,24532318,-1,-1
junction_00186,https://pubmed.ncbi.nlm.nih.gov/24633532/,"Neural correlates of attributing causes to the self, another person and the situation.","Kestemont J, Ma N, Baetens K, Clement N, Van Overwalle F, Vandekerckhove M",Social cognitive and affective neuroscience,0.077,24633532,-1,-1
junction_00187,https://pubmed.ncbi.nlm.nih.gov/26074796/,Dimensional schizotypy and social cognition: an fMRI imaging study.,"Wang Y, Liu WH, Li Z, Wei XH, Jiang XQ, Neumann DL, Shum DH, Cheung EF, Chan RC",Frontiers in behavioral neuroscience,0.077,26074796,-1,-1
junction_00188,https://pubmed.ncbi.nlm.nih.gov/15885507/,Attention orienting dysfunction during salient novel stimulus processing in schizophrenia.,"Laurens KR, Kiehl KA, Ngan ET, Liddle PF",Schizophrenia research,0.076,15885507,-1,-1
junction_00189,https://pubmed.ncbi.nlm.nih.gov/16337921/,Two cortical systems for reaching in central and peripheral vision.,"Prado J, Clavagnier S, Otzenberger H, Scheiber C, Kennedy H, Perenin MT",Neuron,0.076,16337921,-1,-1
junction_00190,https://pubmed.ncbi.nlm.nih.gov/19744566/,"A common functional brain network for autobiographical, episodic, and semantic memory retrieval.","Burianova H, McIntosh AR, Grady CL",NeuroImage,0.076,19744566,-1,-1
junction_00191,https://pubmed.ncbi.nlm.nih.gov/20956614/,Neural correlates of developing and adapting behavioral biases in speeded choice  reactions--an fMRI study on predictive motor coding.,"Eickhoff SB, Pomjanski W, Jakobs O, Zilles K, Langner R","Cerebral cortex (New York, N.Y. : 1991)",0.076,20956614,-1,-1
junction_00192,https://pubmed.ncbi.nlm.nih.gov/21398015/,Attention and cognitive control networks assessed in a dichotic listening fMRI study.,"Falkenberg LE, Specht K, Westerhausen R",Brain and cognition,0.076,21398015,10.1016/j.bandc.2011.02.006,-1
junction_00193,https://pubmed.ncbi.nlm.nih.gov/24097059/,Individual differences in the anterior insula are associated with the likelihood  of financially helping versus harming others.,"Greening S, Norton L, Virani K, Ty A, Mitchell D, Finger E","Cognitive, affective & behavioral neuroscience",0.076,24097059,10.3758/s13415-013-0213-3,-1
junction_00194,https://pubmed.ncbi.nlm.nih.gov/25140705/,The neural bases of directed and spontaneous mental state attributions to group agents.,"Jenkins AC, Dodell-Feder D, Saxe R, Knobe J",PloS one,0.076,25140705,-1,-1
junction_00195,https://pubmed.ncbi.nlm.nih.gov/28412511/,Difference in neural response to social exclusion observation and subsequent altruism between adolescents and adults.,"Tousignant B, Eugene F, Sirois K, Jackson PL",Neuropsychologia,0.076,28412511,-1,-1
