paper_name,paper_url,Title,Author,Journal,Loading,PMID,Doi,download_status
junction_00390,https://pubmed.ncbi.nlm.nih.gov/21568635/,Functional connectivity separates switching operations in the posterior lateral frontal cortex.,"Stelzel C, Basten U, Fiebach CJ",Journal of cognitive neuroscience,0.06,21568635,-1,-1
junction_00391,https://pubmed.ncbi.nlm.nih.gov/22586381/,How do we think machines think? An fMRI study of alleged competition with an artificial intelligence.,"Chaminade T, Rosset D, Da Fonseca D, Nazarian B, Lutcher E, Cheng G, Deruelle C",Frontiers in human neuroscience,0.06,22586381,-1,-1
junction_00392,https://pubmed.ncbi.nlm.nih.gov/23796527/,Longitudinal changes in brains of patients with fluent primary progressive aphasia.,"Heim S, Pieperhoff P, Grande M, Kuijsten W, Wellner B, Saez LE, Schulte S, Sudmeyer M, Caspers S, Minnerop M, Binkofski F, Huber W, Amunts K",Brain and language,0.06,23796527,-1,-1
junction_00393,https://pubmed.ncbi.nlm.nih.gov/23872155/,Overlapping and parallel cerebello-cerebral networks contributing to sensorimotor control: an intrinsic functional connectivity study.,"Kipping JA, Grodd W, Kumar V, Taubert M, Villringer A, Margulies DS",NeuroImage,0.06,23872155,-1,-1
junction_00394,https://pubmed.ncbi.nlm.nih.gov/25567420/,Deficits in task-set maintenance and execution networks in Parkinson's disease.,"Tinaz S, Lauro P, Hallett M, Horovitz SG",Brain structure & function,0.06,25567420,-1,-1
junction_00395,https://pubmed.ncbi.nlm.nih.gov/25793718/,Microstructural changes across different clinical milestones of disease in amyotrophic lateral sclerosis.,"Trojsi F, Caiazzo G, Corbo D, Piccirillo G, Cristillo V, Femiano C, Ferrantino T, Cirillo M, Monsurro MR, Esposito F, Tedeschi G",PloS one,0.06,25793718,10.1371/journal.pone.0119045,-1
junction_00396,https://pubmed.ncbi.nlm.nih.gov/26474740/,The neural basis of humour comprehension and humour appreciation: The roles of the temporoparietal junction and superior frontal gyrus.,"Campbell DW, Wallace MG, Modirrousta M, Polimeni JO, McKeen NA, Reiss JP",Neuropsychologia,0.06,26474740,10.1016/j.neuropsychologia.2015.10.013,-1
junction_00397,https://pubmed.ncbi.nlm.nih.gov/27260987/,Neural activity during self-referential working memory and the underlying role of the amygdala in social anxiety disorder.,"Yoon HJ, Kim JS, Shin YB, Choi SH, Lee SK, Kim JJ",Neuroscience letters,0.06,27260987,10.1016/j.neulet.2016.05.068,-1
junction_00398,https://pubmed.ncbi.nlm.nih.gov/28957344/,Functional hemispheric asymmetries during the planning and manual control of virtual avatar movements.,"Floegel M, Kell CA",PloS one,0.06,28957344,-1,-1
junction_00399,https://pubmed.ncbi.nlm.nih.gov/12880785/,Statistical mapping analysis of lesion location and neurological disability in multiple sclerosis: application to 452 patient data sets.,"Charil A, Zijdenbos AP, Taylor J, Boelman C, Worsley KJ, Evans AC, Dagher A",NeuroImage,0.059,12880785,-1,-1
junction_00400,https://pubmed.ncbi.nlm.nih.gov/19803685/,Common and unique neural correlates of autobiographical memory and theory of mind.,"Rabin JS, Gilboa A, Stuss DT, Mar RA, Rosenbaum RS",Journal of cognitive neuroscience,0.059,19803685,-1,-1
junction_00401,https://pubmed.ncbi.nlm.nih.gov/21195194/,Common and distinct neural networks for false-belief reasoning and inhibitory control.,"Rothmayr C, Sodian B, Hajak G, Dohnel K, Meinhardt J, Sommer M",NeuroImage,0.059,21195194,-1,-1
junction_00402,https://pubmed.ncbi.nlm.nih.gov/21943555/,Mentalizing impairment in schizophrenia: a functional MRI study.,"Das P, Lagopoulos J, Coulston CM, Henderson AF, Malhi GS",Schizophrenia research,0.059,21943555,-1,-1
junction_00403,https://pubmed.ncbi.nlm.nih.gov/22750124/,Common and distinct neural mechanisms of attentional switching and response conflict.,"Kim C, Johnson NF, Gold BT",Brain research,0.059,22750124,-1,-1
junction_00404,https://pubmed.ncbi.nlm.nih.gov/23578577/,White matter structures associated with empathizing and systemizing in young adults.,"Takeuchi H, Taki Y, Thyreau B, Sassa Y, Hashizume H, Sekiguchi A, Nagase T, Nouchi R, Fukushima A, Kawashima R",NeuroImage,0.059,23578577,-1,-1
junction_00405,https://pubmed.ncbi.nlm.nih.gov/25613438/,Functional resting-state connectivity of the human motor network: Differences between right- and left-handers.,"Pool EM, Rehme AK, Eickhoff SB, Fink GR, Grefkes C",NeuroImage,0.059,25613438,-1,-1
junction_00406,https://pubmed.ncbi.nlm.nih.gov/26048952/,Brain Mechanisms for Processing Affective (and Nonaffective) Touch Are Atypical in Autism.,"Kaiser MD, Yang DY, Voos AC, Bennett RH, Gordon I, Pretzsch C, Beam D, Keifer C, Eilbott J, McGlone F, Pelphrey KA","Cerebral cortex (New York, N.Y. : 1991)",0.059,26048952,-1,-1
junction_00407,https://pubmed.ncbi.nlm.nih.gov/26635557/,Incidental Memory Encoding Assessed with Signal Detection Theory and Functional Magnetic Resonance Imaging (fMRI).,"Clemens B, Regenbogen C, Koch K, Backes V, Romanczuk-Seiferth N, Pauly K, Shah NJ, Schneider F, Habel U, Kellermann T",Frontiers in behavioral neuroscience,0.059,26635557,-1,-1
junction_00408,https://pubmed.ncbi.nlm.nih.gov/27118087/,Contour junctions underlie neural representations of scene categories in high-level human visual cortex.,"Choo H, Walther DB",NeuroImage,0.059,27118087,-1,-1
junction_00409,https://pubmed.ncbi.nlm.nih.gov/11784775/,A cortical network sensitive to stimulus salience in a neutral behavioral context across multiple sensory modalities.,"Downar J, Crawley AP, Mikulis DJ, Davis KD",Journal of neurophysiology,0.058,11784775,-1,-1
junction_00410,https://pubmed.ncbi.nlm.nih.gov/20728548/,Right temporoparietal junction activation by a salient contextual cue facilitates target discrimination.,"Geng JJ, Mangun GR",NeuroImage,0.058,20728548,-1,-1
junction_00411,https://pubmed.ncbi.nlm.nih.gov/21130888/,How choice modifies preference: neural correlates of choice justification.,"Qin J, Kimel S, Kitayama S, Wang X, Yang X, Han S",NeuroImage,0.058,21130888,-1,-1
junction_00412,https://pubmed.ncbi.nlm.nih.gov/23160812/,Roman Catholic beliefs produce characteristic neural responses to moral dilemmas.,"Christensen JF, Flexas A, de Miguel P, Cela-Conde CJ, Munar E",Social cognitive and affective neuroscience,0.058,23160812,-1,-1
junction_00413,https://pubmed.ncbi.nlm.nih.gov/25810522/,Neural substrates of intention--consequence integration and its impact on reactive punishment in interpersonal transgression.,"Yu H, Li J, Zhou X",The Journal of neuroscience : the official journal of the Society for Neuroscience,0.058,25810522,-1,-1
junction_00414,https://pubmed.ncbi.nlm.nih.gov/27498040/,"Am I seeing myself, my friend or a stranger? The role of personal familiarity in  visual distinction of body identities in the human brain.","Kruse B, Bogler C, Haynes JD, Schutz-Bosbach S",Cortex; a journal devoted to the study of the nervous system and behavior,0.058,27498040,-1,-1
junction_00415,https://pubmed.ncbi.nlm.nih.gov/28012826/,Increase of posterior connectivity in aging within the Ventral Attention Network: A functional connectivity analysis using independent component analysis.,"Deslauriers J, Ansado J, Marrelec G, Provost JS, Joanette Y",Brain research,0.058,28012826,-1,-1
junction_00416,https://pubmed.ncbi.nlm.nih.gov/28017920/,Common and distinct brain regions processing multisensory bodily signals for peripersonal space and body ownership.,"Grivaz P, Blanke O, Serino A",NeuroImage,0.058,28017920,10.1016/j.neuroimage.2016.12.052,-1
junction_00417,https://pubmed.ncbi.nlm.nih.gov/28291690/,Social-cognitive brain function and connectivity during visual perspective-taking in autism and schizophrenia.,"Eack SM, Wojtalik JA, Keshavan MS, Minshew NJ",Schizophrenia research,0.058,28291690,10.1016/j.schres.2017.03.009,-1
junction_00418,https://pubmed.ncbi.nlm.nih.gov/16122944/,Neuronal correlates of theory of mind and empathy: a functional magnetic resonance imaging study in a nonverbal task.,"Vollm BA, Taylor AN, Richardson P, Corcoran R, Stirling J, McKie S, Deakin JF, Elliott R",NeuroImage,0.057,16122944,10.1016/j.neuroimage.2005.07.022,-1
junction_00419,https://pubmed.ncbi.nlm.nih.gov/18095277/,Task-relevance and temporal synchrony between tactile and visual stimuli modulates cortical activity and motor performance during sensory-guided movement.,"Meehan SK, Staines WR",Human brain mapping,0.057,18095277,-1,-1
junction_00420,https://pubmed.ncbi.nlm.nih.gov/18180168/,Sensitivity to orthographic familiarity in the occipito-temporal region.,"Bruno JL, Zumberge A, Manis FR, Lu ZL, Goldman JG",NeuroImage,0.057,18180168,-1,-1
junction_00421,https://pubmed.ncbi.nlm.nih.gov/19702467/,Neural basis of visual distraction.,"Kim SY, Hopfinger JB",Journal of cognitive neuroscience,0.057,19702467,-1,-1
junction_00422,https://pubmed.ncbi.nlm.nih.gov/19747928/,Atrophy in two attention networks is associated with performance on a Flanker task in neurodegenerative disease.,"Luks TL, Oliveira M, Possin KL, Bird A, Miller BL, Weiner MW, Kramer JH",Neuropsychologia,0.057,19747928,-1,-1
junction_00423,https://pubmed.ncbi.nlm.nih.gov/19966326/,Sociotopy in the temporoparietal cortex: common versus distinct processes.,"Bahnemann M, Dziobek I, Prehn K, Wolf I, Heekeren HR",Social cognitive and affective neuroscience,0.057,19966326,-1,-1
junction_00424,https://pubmed.ncbi.nlm.nih.gov/20026227/,Dopamine transporter gene variation modulates activation of striatum in youth with ADHD.,"Bedard AC, Schulz KP, Cook EH Jr, Fan J, Clerkin SM, Ivanov I, Halperin JM, Newcorn JH",NeuroImage,0.057,20026227,-1,-1
junction_00425,https://pubmed.ncbi.nlm.nih.gov/20980597/,Expectation-driven changes in cortical functional connectivity influence working  memory and long-term memory performance.,"Bollinger J, Rubens MT, Zanto TP, Gazzaley A",The Journal of neuroscience : the official journal of the Society for Neuroscience,0.057,20980597,-1,-1
junction_00426,https://pubmed.ncbi.nlm.nih.gov/21880922/,Dissociable effects of top-down and bottom-up attention during episodic encoding.,"Uncapher MR, Hutchinson JB, Wagner AD",The Journal of neuroscience : the official journal of the Society for Neuroscience,0.057,21880922,-1,-1
junction_00427,https://pubmed.ncbi.nlm.nih.gov/26892860/,Competing against a familiar friend: Interactive mechanism of the temporo-parietal junction with the reward-related regions during episodic encoding.,"Sugimoto H, Shigemune Y, Tsukiura T",NeuroImage,0.057,26892860,-1,-1
junction_00428,https://pubmed.ncbi.nlm.nih.gov/27085513/,Role of features and categories in the organization of object knowledge: Evidence from adaptation fMRI.,"Geng J, Schnur TT",Cortex; a journal devoted to the study of the nervous system and behavior,0.057,27085513,-1,-1
junction_00429,https://pubmed.ncbi.nlm.nih.gov/28981837/,Neural correlates of empathic accuracy in adolescence.,"Kral TRA, Solis E, Mumford JA, Schuyler BS, Flook L, Rifken K, Patsenko EG, Davidson RJ",Social cognitive and affective neuroscience,0.057,28981837,-1,-1
junction_00430,https://pubmed.ncbi.nlm.nih.gov/29218005/,Distributed Neural Activity Patterns during Human-to-Human Competition.,"Piva M, Zhang X, Noah JA, Chang SWC, Hirsch J",Frontiers in human neuroscience,0.057,29218005,-1,-1
junction_00431,https://pubmed.ncbi.nlm.nih.gov/29275843/,Transdiagnostic deviant facial recognition for implicit negative emotion in autism and schizophrenia.,"Ciaramidaro A, Bolte S, Schlitt S, Hainz D, Poustka F, Weber B, Freitag C, Walter H",European neuropsychopharmacology : the journal of the European College of Neuropsychopharmacology,0.057,29275843,-1,-1
junction_00432,https://pubmed.ncbi.nlm.nih.gov/29311795/,Neural and Genetic Correlates of the Social Sharing of Happiness.,"Matsunaga M, Kawamichi H, Umemura T, Hori R, Shibata E, Kobayashi F, Suzuki K, Ishii K, Ohtsubo Y, Noguchi Y, Ochi M, Yamasue H, Ohira H",Frontiers in neuroscience,0.057,29311795,-1,-1
junction_00433,https://pubmed.ncbi.nlm.nih.gov/16140346/,Neural mechanisms of imitation and 'mirror neuron' functioning in autistic spectrum disorder.,"Williams JH, Waiter GD, Gilchrist A, Perrett DI, Murray AD, Whiten A",Neuropsychologia,0.056,16140346,-1,-1
junction_00434,https://pubmed.ncbi.nlm.nih.gov/17442821/,Independent effects of emotion and working memory load on visual activation in the lateral occipital complex.,"Glascher J, Rose M, Buchel C",The Journal of neuroscience : the official journal of the Society for Neuroscience,0.056,17442821,-1,-1
junction_00435,https://pubmed.ncbi.nlm.nih.gov/18855557/,Anatomical segregation of representations of personally familiar and famous people in the temporal and parietal cortices.,"Sugiura M, Sassa Y, Watanabe J, Akitsuki Y, Maeda Y, Matsue Y, Kawashima R",Journal of cognitive neuroscience,0.056,18855557,-1,-1
junction_00436,https://pubmed.ncbi.nlm.nih.gov/21983057/,Culture modulates brain activity during empathy with anger.,"de Greck M, Shi Z, Wang G, Zuo X, Yang X, Wang X, Northoff G, Han S",NeuroImage,0.056,21983057,-1,-1
junction_00437,https://pubmed.ncbi.nlm.nih.gov/22062191/,Autism spectrum traits predict the neural response to eye gaze in typical individuals.,"Nummenmaa L, Engell AD, von dem Hagen E, Henson RN, Calder AJ",NeuroImage,0.056,22062191,10.1016/j.neuroimage.2011.10.075,-1
junction_00438,https://pubmed.ncbi.nlm.nih.gov/22422512/,Episodic autobiographical memory in amnestic mild cognitive impairment: what are  the neural correlates?,"Bastin C, Feyers D, Jedidi H, Bahri MA, Degueldre C, Lemaire C, Collette F, Salmon E",Human brain mapping,0.056,22422512,10.1002/hbm.22032,-1
junction_00439,https://pubmed.ncbi.nlm.nih.gov/23062751/,The effect of distracting noise on the neuronal mechanisms of attention in schizophrenia.,"Tregellas JR, Smucny J, Eichman L, Rojas DC",Schizophrenia research,0.056,23062751,10.1016/j.schres.2012.09.008,-1
junction_00440,https://pubmed.ncbi.nlm.nih.gov/24288150/,"Shindigs, brunches, and rodeos: the neural basis of event words.","Bedny M, Dravida S, Saxe R","Cognitive, affective & behavioral neuroscience",0.056,24288150,10.3758/s13415-013-0217-z,-1
junction_00441,https://pubmed.ncbi.nlm.nih.gov/24324419/,Dorsomedial prefrontal cortex activity predicts the accuracy in estimating others' preferences.,"Kang P, Lee J, Sul S, Kim H",Frontiers in human neuroscience,0.056,24324419,-1,-1
junction_00442,https://pubmed.ncbi.nlm.nih.gov/28567009/,Anatomical Modularity of Verbal Working Memory? Functional Anatomical Evidence from a Famous Patient with Short-Term Memory Deficits.,"Paulesu E, Shallice T, Danelli L, Sberna M, Frackowiak RSJ, Frith CD",Frontiers in human neuroscience,0.056,28567009,-1,-1
junction_00443,https://pubmed.ncbi.nlm.nih.gov/12917383/,Quantitative analysis of attention and detection signals during visual search.,"Shulman GL, McAvoy MP, Cowan MC, Astafiev SV, Tansy AP, d'Avossa G, Corbetta M",Journal of neurophysiology,0.055,12917383,-1,-1
junction_00444,https://pubmed.ncbi.nlm.nih.gov/24343872/,Effects of multitasking-training on gray matter structure and resting state neural mechanisms.,"Takeuchi H, Taki Y, Nouchi R, Hashizume H, Sekiguchi A, Kotozaki Y, Nakagawa S, Miyauchi CM, Sassa Y, Kawashima R",Human brain mapping,0.055,24343872,-1,-1
junction_00445,https://pubmed.ncbi.nlm.nih.gov/25929599/,Distinct neural processes are engaged in the modulation of mimicry by social group-membership and emotional expressions.,"Rauchbauer B, Majdandzic J, Hummer A, Windischberger C, Lamm C",Cortex; a journal devoted to the study of the nervous system and behavior,0.055,25929599,-1,-1
junction_00446,https://pubmed.ncbi.nlm.nih.gov/27664826/,Neural bases of the adaptive mechanisms associated with reciprocal partner choice.,"Yokoyama R, Sugiura M, Yamamoto Y, Nejad KK, Kawashima R",NeuroImage,0.055,27664826,-1,-1
junction_00447,https://pubmed.ncbi.nlm.nih.gov/11113036/,The noradrenergic alpha2 agonist clonidine modulates behavioural and neuroanatomical correlates of human attentional orienting and alerting.,"Coull JT, Nobre AC, Frith CD","Cerebral cortex (New York, N.Y. : 1991)",0.054,11113036,-1,-1
junction_00448,https://pubmed.ncbi.nlm.nih.gov/18456517/,Perceiving and naming actions and objects.,"Liljestrom M, Tarkiainen A, Parviainen T, Kujala J, Numminen J, Hiltunen J, Laine M, Salmelin R",NeuroImage,0.054,18456517,-1,-1
junction_00449,https://pubmed.ncbi.nlm.nih.gov/19357267/,Interaction of stimulus-driven reorienting and expectation in ventral and dorsal  frontoparietal and basal ganglia-cortical networks.,"Shulman GL, Astafiev SV, Franke D, Pope DL, Snyder AZ, McAvoy MP, Corbetta M",The Journal of neuroscience : the official journal of the Society for Neuroscience,0.054,19357267,-1,-1
junction_00450,https://pubmed.ncbi.nlm.nih.gov/21554965/,Strategy-effects in prefrontal cortex during learning of higher-order S-R rules.,"Wolfensteller U, von Cramon DY",NeuroImage,0.054,21554965,-1,-1
junction_00451,https://pubmed.ncbi.nlm.nih.gov/22992491/,Rostral-caudal gradients of abstraction revealed by multi-variate pattern analysis of working memory.,"Nee DE, Brown JW",NeuroImage,0.054,22992491,-1,-1
junction_00452,https://pubmed.ncbi.nlm.nih.gov/23994213/,The gender you are and the gender you like: sexual preference and empathic neural responses.,"Perry D, Walder K, Hendler T, Shamay-Tsoory SG",Brain research,0.054,23994213,-1,-1
junction_00453,https://pubmed.ncbi.nlm.nih.gov/10531451/,Areas involved in encoding and applying directional expectations to moving objects.,"Shulman GL, Ollinger JM, Akbudak E, Conturo TE, Snyder AZ, Petersen SE, Corbetta M",The Journal of neuroscience : the official journal of the Society for Neuroscience,0.053,10531451,-1,-1
junction_00454,https://pubmed.ncbi.nlm.nih.gov/15593271/,A supramodal limbic-paralimbic-neocortical network supports goal-directed stimulus processing.,"Laurens KR, Kiehl KA, Liddle PF",Human brain mapping,0.053,15593271,10.1002/hbm.20062,-1
junction_00455,https://pubmed.ncbi.nlm.nih.gov/15872107/,An event-related functional magnetic resonance imaging study of voluntary and stimulus-driven orienting of attention.,"Kincade JM, Abrams RA, Astafiev SV, Shulman GL, Corbetta M",The Journal of neuroscience : the official journal of the Society for Neuroscience,0.053,15872107,10.1523/JNEUROSCI.0236-05.2005,-1
junction_00456,https://pubmed.ncbi.nlm.nih.gov/17888688/,Neural system for updating object working memory from different sources: sensory  stimuli or long-term memory.,"Roth JK, Courtney SM",NeuroImage,0.053,17888688,10.1016/j.neuroimage.2007.06.037,-1
junction_00457,https://pubmed.ncbi.nlm.nih.gov/18848999/,The dorsal auditory pathway is involved in performance of both visual and auditory rhythms.,"Karabanov A, Blom O, Forsman L, Ullen F",NeuroImage,0.053,18848999,-1,-1
junction_00458,https://pubmed.ncbi.nlm.nih.gov/18940230/,Atypical empathic responses in adolescents with aggressive conduct disorder: a functional MRI investigation.,"Decety J, Michalska KJ, Akitsuki Y, Lahey BB",Biological psychology,0.053,18940230,-1,-1
junction_00459,https://pubmed.ncbi.nlm.nih.gov/19836364/,Neural activity during social signal perception correlates with self-reported empathy.,"Hooker CI, Verosky SC, Germine LT, Knight RT, D'Esposito M",Brain research,0.053,19836364,-1,-1
junction_00460,https://pubmed.ncbi.nlm.nih.gov/20728556/,Functional relations of empathy and mentalizing: an fMRI study on the neural basis of cognitive empathy.,"Schnell K, Bluschke S, Konradt B, Walter H",NeuroImage,0.053,20728556,-1,-1
junction_00461,https://pubmed.ncbi.nlm.nih.gov/23342148/,A shared neural substrate for mentalizing and the affective component of sentence comprehension.,"Herve PY, Razafimandimby A, Jobard G, Tzourio-Mazoyer N",PloS one,0.053,23342148,-1,-1
junction_00462,https://pubmed.ncbi.nlm.nih.gov/23967180/,An evaluation of the left-brain vs. right-brain hypothesis with resting state functional connectivity magnetic resonance imaging.,"Nielsen JA, Zielinski BA, Ferguson MA, Lainhart JE, Anderson JS",PloS one,0.053,23967180,-1,-1
junction_00463,https://pubmed.ncbi.nlm.nih.gov/24820264/,Sticking with the nice guy: trait warmth information impairs learning and modulates person perception brain network activity.,"Lee VK, Harris LT","Cognitive, affective & behavioral neuroscience",0.053,24820264,-1,-1
junction_00464,https://pubmed.ncbi.nlm.nih.gov/27012986/,Changes in visual perspective influence brain activity patterns during cognitive  perspective-taking of other people's pain.,"Vistoli D, Achim AM, Lavoie MA, Jackson PL",Neuropsychologia,0.053,27012986,-1,-1
junction_00465,https://pubmed.ncbi.nlm.nih.gov/27445760/,Competition between Visual Events Modulates the Influence of Salience during Free-Viewing of Naturalistic Videos.,"Nardo D, Console P, Reverberi C, Macaluso E",Frontiers in human neuroscience,0.053,27445760,-1,-1
junction_00466,https://pubmed.ncbi.nlm.nih.gov/10906316/,Segregating semantic and syntactic aspects of processing in the human brain: an fMRI investigation of different word types.,"Friederici AD, Opitz B, von Cramon DY","Cerebral cortex (New York, N.Y. : 1991)",0.052,10906316,-1,-1
junction_00467,https://pubmed.ncbi.nlm.nih.gov/19733672/,Neural correlates of social cognition in naturalistic settings: a model-free analysis approach.,"Wolf I, Dziobek I, Heekeren HR",NeuroImage,0.052,19733672,-1,-1
junction_00468,https://pubmed.ncbi.nlm.nih.gov/23128082/,Neural activation during anticipation of opposite-sex and same-sex faces in heterosexual men and women.,"Spreckelmeyer KN, Rademacher L, Paulus FM, Grunder G",NeuroImage,0.052,23128082,-1,-1
junction_00469,https://pubmed.ncbi.nlm.nih.gov/18471837/,Top-down and bottom-up attention to memory: a hypothesis (AtoM) on the role of the posterior parietal cortex in memory retrieval.,"Ciaramelli E, Grady CL, Moscovitch M",Neuropsychologia,0.051,18471837,-1,-1
junction_00470,https://pubmed.ncbi.nlm.nih.gov/19846472/,Neural correlates of the spatial and expectancy components of endogenous and stimulus-driven orienting of attention in the Posner task.,"Doricchi F, Macci E, Silvetti M, Macaluso E","Cerebral cortex (New York, N.Y. : 1991)",0.051,19846472,-1,-1
junction_00471,https://pubmed.ncbi.nlm.nih.gov/23019246/,Functional heterogeneity in posterior parietal cortex across attention and episodic memory retrieval.,"Hutchinson JB, Uncapher MR, Weiner KS, Bressler DW, Silver MA, Preston AR, Wagner AD","Cerebral cortex (New York, N.Y. : 1991)",0.051,23019246,-1,-1
junction_00472,https://pubmed.ncbi.nlm.nih.gov/23891902/,Anticipatory alpha phase influences visual working memory performance.,"Zanto TP, Chadick JZ, Gazzaley A",NeuroImage,0.051,23891902,10.1016/j.neuroimage.2013.07.048,-1
junction_00473,https://pubmed.ncbi.nlm.nih.gov/23954317/,Functional and structural amygdala - anterior cingulate connectivity correlates with attentional bias to masked fearful faces.,"Carlson JM, Cha J, Mujica-Parodi LR",Cortex; a journal devoted to the study of the nervous system and behavior,0.051,23954317,10.1016/j.cortex.2013.07.008,-1
junction_00474,https://pubmed.ncbi.nlm.nih.gov/24361661/,fMRI characterization of visual working memory recognition.,"Rahm B, Kaiser J, Unterrainer JM, Simon J, Bledowski C",NeuroImage,0.051,24361661,10.1016/j.neuroimage.2013.12.017,-1
junction_00475,https://pubmed.ncbi.nlm.nih.gov/24376401/,A novel V1a receptor antagonist blocks vasopressin-induced changes in the CNS response to emotional stimuli: an fMRI study.,"Lee RJ, Coccaro EF, Cremers H, McCarron R, Lu SF, Brownstein MJ, Simon NG",Frontiers in systems neuroscience,0.051,24376401,10.3389/fnsys.2013.00100,-1
junction_00476,https://pubmed.ncbi.nlm.nih.gov/28110087/,Internal and external attention and the default mode network.,"Scheibner HJ, Bogler C, Gleich T, Haynes JD, Bermpohl F",NeuroImage,0.051,28110087,-1,-1
junction_00477,https://pubmed.ncbi.nlm.nih.gov/15769494/,Left inferior parietal dominance in gesture imitation: an fMRI study.,"Muhlau M, Hermsdorfer J, Goldenberg G, Wohlschlager AM, Castrop F, Stahl R, Rottinger M, Erhard P, Haslinger B, Ceballos-Baumann AO, Conrad B, Boecker H",Neuropsychologia,0.05,15769494,-1,-1
junction_00478,https://pubmed.ncbi.nlm.nih.gov/24657476/,Different association between intentionality competence and prefrontal volume in  left- and right-handers.,"Powell JL, Kemp GJ, Dunbar RI, Roberts N, Sluming V, Garcia-Finana M",Cortex; a journal devoted to the study of the nervous system and behavior,0.05,24657476,-1,-1
junction_00479,https://pubmed.ncbi.nlm.nih.gov/25309400/,Neural correlates of moral and non-moral emotion in female psychopathy.,"Harenski CL, Edwards BG, Harenski KA, Kiehl KA",Frontiers in human neuroscience,0.05,25309400,-1,-1
junction_00480,https://pubmed.ncbi.nlm.nih.gov/26419389/,Meta-analysis of real-time fMRI neurofeedback studies using individual participant data: How is brain regulation mediated?,"Emmert K, Kopel R, Sulzer J, Bruhl AB, Berman BD, Linden DEJ, Horovitz SG, Breimhorst M, Caria A, Frank S, Johnston S, Long Z, Paret C, Robineau F, Veit R, Bartsch A, Beckmann CF, Van De Ville D, Haller S",NeuroImage,0.05,26419389,-1,-1
junction_00481,https://pubmed.ncbi.nlm.nih.gov/27132070/,Intrinsic functional connectivity predicts individual differences in distractibility.,"Poole VN, Robinson ME, Singleton O, DeGutis J, Milberg WP, McGlinchey RE, Salat DH, Esterman M",Neuropsychologia,0.05,27132070,-1,-1
junction_00482,https://pubmed.ncbi.nlm.nih.gov/27847305/,A functional magnetic resonance imaging investigation of theory of mind impairments in patients with temporal lobe epilepsy.,"Hennion S, Delbeuck X, Koelkebeck K, Brion M, Tyvaert L, Plomhause L, Derambure P, Lopes R, Szurhaj W",Neuropsychologia,0.05,27847305,-1,-1
junction_00483,https://pubmed.ncbi.nlm.nih.gov/12611944/,Neural basis of visually guided head movements studied with fMRI.,"Petit L, Beauchamp MS",Journal of neurophysiology,0.049,12611944,-1,-1
