paper_name,paper_url,Title,Author,Journal,Loading,PMID,Doi,download_status
junction_00001,https://pubmed.ncbi.nlm.nih.gov/18325789/,Effects of shifting perspective of the self: an fMRI study.,"Corradi-Dell'acqua C, Ueno K, Ogawa A, Cheng K, Rumiati RI, Iriki A",NeuroImage,0.229,18325789,-1,-1
junction_00002,https://pubmed.ncbi.nlm.nih.gov/18072280/,"Neural activations at the junction of the inferior frontal sulcus and the inferior precentral sulcus: interindividual variability, reliability, and association with sulcal morphology.","Derrfuss J, Brass M, von Cramon DY, Lohmann G, Amunts K",Human brain mapping,0.201,18072280,-1,-1
junction_00003,https://pubmed.ncbi.nlm.nih.gov/19135072/,Perspective-taking as part of narrative comprehension: a functional MRI study.,"Mano Y, Harada T, Sugiura M, Saito DN, Sadato N",Neuropsychologia,0.19,19135072,-1,-1
junction_00004,https://pubmed.ncbi.nlm.nih.gov/15588605/,Cortical mechanisms of visual self-recognition.,"Sugiura M, Watanabe J, Maeda Y, Matsue Y, Fukuda H, Kawashima R",NeuroImage,0.183,15588605,-1,-1
junction_00005,https://pubmed.ncbi.nlm.nih.gov/19539770/,Neural correlates of processing situational relationships between a part and the  whole: an fMRI study.,"Wakusawa K, Sugiura M, Sassa Y, Jeong H, Horie K, Sato S, Yokoyama H, Tsuchiya S, Kawashima R",NeuroImage,0.173,19539770,-1,-1
junction_00006,https://pubmed.ncbi.nlm.nih.gov/19620139/,Reading epilepsy from the dominant temporo-occipital region.,"Gavaret M, Guedj E, Koessler L, Trebuchon-Da Fonseca A, Aubert S, Mundler O, Chauvel P, Bartolomei F","Journal of neurology, neurosurgery, and psychiatry",0.169,19620139,-1,-1
junction_00007,https://pubmed.ncbi.nlm.nih.gov/19246473/,Highly religious participants recruit areas of social cognition in personal prayer.,"Schjoedt U, Stodkilde-Jorgensen H, Geertz AW, Roepstorff A",Social cognitive and affective neuroscience,0.168,19246473,-1,-1
junction_00008,https://pubmed.ncbi.nlm.nih.gov/20433242/,The literate brain: the relationship between spelling and reading.,"Rapp B, Lipka K",Journal of cognitive neuroscience,0.164,20433242,-1,-1
junction_00009,https://pubmed.ncbi.nlm.nih.gov/22708629/,The morphology and variability of the caudal rami of the superior temporal sulcus.,"Segal E, Petrides M",The European journal of neuroscience,0.162,22708629,-1,-1
junction_00010,https://pubmed.ncbi.nlm.nih.gov/15820646/,Cortical topography of human anterior intraparietal cortex active during visually guided grasping.,"Frey SH, Vinton D, Norlund R, Grafton ST",Brain research. Cognitive brain research,0.156,15820646,-1,-1
junction_00011,https://pubmed.ncbi.nlm.nih.gov/20205246/,Cortical activation by tactile stimulation to face and anterior neck areas: an fMRI study with three analytic methods.,"Lin CC, Sun YN, Huang CI, Yu CY, Ju MS",Human brain mapping,0.155,20205246,-1,-1
junction_00012,https://pubmed.ncbi.nlm.nih.gov/25115186/,Motivationally significant self-control: enhanced action withholding involves the right inferior frontal junction.,"O'Connor DA, Upton DJ, Moore J, Hester R",Journal of cognitive neuroscience,0.152,25115186,-1,-1
junction_00013,https://pubmed.ncbi.nlm.nih.gov/16478667/,Cortical mechanisms of person representation: recognition of famous and personally familiar names.,"Sugiura M, Sassa Y, Watanabe J, Akitsuki Y, Maeda Y, Matsue Y, Fukuda H, Kawashima R",NeuroImage,0.151,16478667,-1,-1
junction_00014,https://pubmed.ncbi.nlm.nih.gov/22155041/,Functional organization of the left inferior precentral sulcus: dissociating the  inferior frontal eye field and the inferior frontal junction.,"Derrfuss J, Vogt VL, Fiebach CJ, von Cramon DY, Tittgemeyer M",NeuroImage,0.15,22155041,10.1016/j.neuroimage.2011.11.051,-1
junction_00015,https://pubmed.ncbi.nlm.nih.gov/26249369/,Differential functional brain network connectivity during visceral interoception  as revealed by independent component analysis of fMRI TIME-series.,"Jarrahi B, Mantini D, Balsters JH, Michels L, Kessler TM, Mehnert U, Kollias SS",Human brain mapping,0.15,26249369,10.1002/hbm.22929,-1
junction_00016,https://pubmed.ncbi.nlm.nih.gov/21315091/,The neural correlates of visual working memory encoding: a time-resolved fMRI study.,"Todd JJ, Han SW, Harrison S, Marois R",Neuropsychologia,0.149,21315091,10.1016/j.neuropsychologia.2011.01.040,-1
junction_00017,https://pubmed.ncbi.nlm.nih.gov/21569855/,An fMRI study of violations of social expectations: when people are not who we expect them to be.,"Cloutier J, Gabrieli JD, O'Young D, Ambady N",NeuroImage,0.148,21569855,-1,-1
junction_00018,https://pubmed.ncbi.nlm.nih.gov/21576110/,Lesion evidence for the critical role of the intraparietal sulcus in spatial attention.,"Gillebert CR, Mantini D, Thijs V, Sunaert S, Dupont P, Vandenberghe R",Brain : a journal of neurology,0.147,21576110,-1,-1
junction_00019,https://pubmed.ncbi.nlm.nih.gov/25623035/,Enhanced amygdala-cortical functional connectivity in meditators.,"Leung MK, Chan CC, Yin J, Lee CF, So KF, Lee TM",Neuroscience letters,0.146,25623035,-1,-1
junction_00020,https://pubmed.ncbi.nlm.nih.gov/16337813/,Do visual perspective tasks need theory of mind?,"Aichhorn M, Perner J, Kronbichler M, Staffen W, Ladurner G",NeuroImage,0.144,16337813,-1,-1
junction_00021,https://pubmed.ncbi.nlm.nih.gov/25729358/,The neural basis of deception in strategic interactions.,"Volz KG, Vogeley K, Tittgemeyer M, von Cramon DY, Sutter M",Frontiers in behavioral neuroscience,0.141,25729358,-1,-1
junction_00022,https://pubmed.ncbi.nlm.nih.gov/21172325/,I remember you: a role for memory in social cognition and the functional neuroanatomy of their interaction.,"Spreng RN, Mar RA",Brain research,0.137,21172325,-1,-1
junction_00023,https://pubmed.ncbi.nlm.nih.gov/11897168/,Mental navigation in humans is processed in the anterior bank of the parieto-occipital sulcus.,"Ino T, Inoue Y, Kage M, Hirose S, Kimura T, Fukuyama H",Neuroscience letters,0.135,11897168,-1,-1
junction_00024,https://pubmed.ncbi.nlm.nih.gov/18649349/,Executive control of spatial attention shifts in the auditory compared to the visual modality.,"Krumbholz K, Nobis EA, Weatheritt RJ, Fink GR",Human brain mapping,0.135,18649349,-1,-1
junction_00025,https://pubmed.ncbi.nlm.nih.gov/21256186/,Brain activity associated with recognition of appropriate action selection based  on allocentric perspectives.,"Shibata H, Inui T",Neuroscience letters,0.135,21256186,-1,-1
junction_00026,https://pubmed.ncbi.nlm.nih.gov/26197267/,Brain networks of affective mentalizing revealed by the tear effect: The integrative role of the medial prefrontal cortex and precuneus.,"Takahashi HK, Kitada R, Sasaki AT, Kawamichi H, Okazaki S, Kochiyama T, Sadato N",Neuroscience research,0.135,26197267,-1,-1
junction_00027,https://pubmed.ncbi.nlm.nih.gov/26716447/,Task-switching Cost and Intrinsic Functional Connectivity in the Human Brain: Toward Understanding Individual Differences in Cognitive Flexibility.,"Yin S, Wang T, Pan W, Liu Y, Chen A",PloS one,0.131,26716447,-1,-1
junction_00028,https://pubmed.ncbi.nlm.nih.gov/17551089/,Activity in right temporo-parietal junction is not selective for theory-of-mind.,Mitchell JP,"Cerebral cortex (New York, N.Y. : 1991)",0.129,17551089,-1,-1
junction_00029,https://pubmed.ncbi.nlm.nih.gov/22209639/,Cortical thickness and folding deficits in conduct-disordered adolescents.,"Hyatt CJ, Haney-Caron E, Stevens MC",Biological psychiatry,0.128,22209639,-1,-1
junction_00030,https://pubmed.ncbi.nlm.nih.gov/17283202/,Human neural systems for conceptual knowledge of proper object use: a functional  magnetic resonance imaging study.,"Ebisch SJ, Babiloni C, Del Gratta C, Ferretti A, Perrucci MG, Caulo M, Sitskoorn MM, Romani GL","Cerebral cortex (New York, N.Y. : 1991)",0.126,17283202,-1,-1
junction_00031,https://pubmed.ncbi.nlm.nih.gov/25241083/,Distinct neural correlates of social categories and personality traits.,"Van der Cruyssen L, Heleven E, Ma N, Vandekerckhove M, Van Overwalle F",NeuroImage,0.126,25241083,10.1016/j.neuroimage.2014.09.022,-1
junction_00032,https://pubmed.ncbi.nlm.nih.gov/19804836/,Tease or threat? Judging social interactions from bodily expressions.,"Sinke CB, Sorger B, Goebel R, de Gelder B",NeuroImage,0.124,19804836,10.1016/j.neuroimage.2009.09.065,-1
junction_00033,https://pubmed.ncbi.nlm.nih.gov/23245426/,Alexithymia decreases altruism in real social decisions.,"Feldmanhall O, Dalgleish T, Mobbs D",Cortex; a journal devoted to the study of the nervous system and behavior,0.124,23245426,10.1016/j.cortex.2012.10.015,-1
junction_00034,https://pubmed.ncbi.nlm.nih.gov/12135974/,"Autism, Asperger syndrome and brain mechanisms for the attribution of mental states to animated shapes.","Castelli F, Frith C, Happe F, Frith U",Brain : a journal of neurology,0.123,12135974,-1,-1
junction_00035,https://pubmed.ncbi.nlm.nih.gov/24637793/,"Modulating intrinsic connectivity: adjacent subregions within supplementary motor cortex, dorsolateral prefrontal cortex, and parietal cortex connect to separate functional networks during task and al","Roth JK, Johnson MK, Tokoglu F, Murphy I, Constable RT",PloS one,0.123,24637793,-1,-1
junction_00036,https://pubmed.ncbi.nlm.nih.gov/19632816/,Functional and structural brain correlates of theory of mind and empathy deficits in schizophrenia.,"Benedetti F, Bernasconi A, Bosia M, Cavallaro R, Dallaspezia S, Falini A, Poletti S, Radaelli D, Riccaboni R, Scotti G, Smeraldi E",Schizophrenia research,0.121,19632816,-1,-1
junction_00037,https://pubmed.ncbi.nlm.nih.gov/14568459/,Abnormal processing of speech during oddball target detection in schizophrenia.,"Ngan ET, Vouloumanos A, Cairo TA, Laurens KR, Bates AT, Anderson CM, Werker JF, Liddle PF",NeuroImage,0.119,14568459,-1,-1
junction_00038,https://pubmed.ncbi.nlm.nih.gov/23056533/,Hemispheric asymmetry for affective stimulus processing in healthy subjects--a fMRI study.,"Beraha E, Eggers J, Hindi Attar C, Gutwinski S, Schlagenhauf F, Stoy M, Sterzer P, Kienast T, Heinz A, Bermpohl F",PloS one,0.118,23056533,-1,-1
junction_00039,https://pubmed.ncbi.nlm.nih.gov/24642509/,Altered intrinsic functional connectivity of the salience network in childhood absence epilepsy.,"Luo C, Yang T, Tu S, Deng J, Liu D, Li Q, Dong L, Goldberg I, Gong Q, Zhang D, An D, Zhou D, Yao D",Journal of the neurological sciences,0.118,24642509,-1,-1
junction_00040,https://pubmed.ncbi.nlm.nih.gov/21737435/,Empathic neural responses to others' pain depend on monetary reward.,"Guo X, Zheng L, Zhang W, Zhu L, Li J, Wang Q, Dienes Z, Yang Z",Social cognitive and affective neuroscience,0.116,21737435,-1,-1
junction_00041,https://pubmed.ncbi.nlm.nih.gov/22905818/,Prefrontal cortical mechanisms underlying individual differences in cognitive flexibility and stability.,"Armbruster DJ, Ueltzhoffer K, Basten U, Fiebach CJ",Journal of cognitive neuroscience,0.116,22905818,-1,-1
junction_00042,https://pubmed.ncbi.nlm.nih.gov/12948687/,Human precentral cortical activation patterns during saccade tasks: an fMRI comparison with activation during intentional eyeblink tasks.,"Kato M, Miyauchi S",NeuroImage,0.114,12948687,-1,-1
junction_00043,https://pubmed.ncbi.nlm.nih.gov/16116098/,Tactile form and location processing in the human brain.,"Van Boven RW, Ingeholm JE, Beauchamp MS, Bikle PC, Ungerleider LG",Proceedings of the National Academy of Sciences of the United States of America,0.114,16116098,-1,-1
junction_00044,https://pubmed.ncbi.nlm.nih.gov/15766766/,Generating animal and tool names: an fMRI study of effective connectivity.,"Vitali P, Abutalebi J, Tettamanti M, Rowe J, Scifo P, Fazio F, Cappa SF, Perani D",Brain and language,0.113,15766766,-1,-1
junction_00045,https://pubmed.ncbi.nlm.nih.gov/20096792/,Live face-to-face interaction during fMRI: a new tool for social cognitive neuroscience.,"Redcay E, Dodell-Feder D, Pearrow MJ, Mavros PL, Kleiner M, Gabrieli JD, Saxe R",NeuroImage,0.113,20096792,-1,-1
junction_00046,https://pubmed.ncbi.nlm.nih.gov/18514546/,Gender differences in brain networks supporting empathy.,"Schulte-Ruther M, Markowitsch HJ, Shah NJ, Fink GR, Piefke M",NeuroImage,0.11,18514546,-1,-1
junction_00047,https://pubmed.ncbi.nlm.nih.gov/18234521/,The neural substrates of person comparison--an fMRI study.,"Lindner M, Hundhammer T, Ciaramidaro A, Linden DE, Mussweiler T",NeuroImage,0.107,18234521,-1,-1
junction_00048,https://pubmed.ncbi.nlm.nih.gov/25140046/,Neural coding of assessing another person's knowledge based on nonverbal cues.,"Kuhlen AK, Bogler C, Swerts M, Haynes JD",Social cognitive and affective neuroscience,0.107,25140046,-1,-1
junction_00049,https://pubmed.ncbi.nlm.nih.gov/25281309/,Neuronal substrates of Corsi Block span: Lesion symptom mapping analyses in relation to attentional competition and spatial bias.,"Chechlacz M, Rotshtein P, Humphreys GW",Neuropsychologia,0.107,25281309,-1,-1
junction_00050,https://pubmed.ncbi.nlm.nih.gov/25525808/,Self-Recognition of One's Own Fall Recruits the Genuine Bodily Crisis-Related Brain Activity.,"Atomi T, Noriuchi M, Oba K, Atomi Y, Kikuchi Y",PloS one,0.107,25525808,-1,-1
junction_00051,https://pubmed.ncbi.nlm.nih.gov/26458520/,Patterns of effective connectivity during memory encoding and retrieval differ between patients with mild cognitive impairment and healthy older adults.,"Hampstead BM, Khoshnoodi M, Yan W, Deshpande G, Sathian K",NeuroImage,0.107,26458520,10.1016/j.neuroimage.2015.10.002,-1
junction_00052,https://pubmed.ncbi.nlm.nih.gov/21616156/,Ventromedial prefrontal volume predicts understanding of others and social network size.,"Lewis PA, Rezaie R, Brown R, Roberts N, Dunbar RI",NeuroImage,0.106,21616156,-1,-1
junction_00053,https://pubmed.ncbi.nlm.nih.gov/28811367/,Amplification of local changes along the timescale processing hierarchy.,"Yeshurun Y, Nguyen M, Hasson U",Proceedings of the National Academy of Sciences of the United States of America,0.106,28811367,-1,-1
junction_00054,https://pubmed.ncbi.nlm.nih.gov/12595185/,Separating distractor rejection and target detection in posterior parietal cortex--an event-related fMRI study of visual marking.,"Pollmann S, Weidner R, Humphreys GW, Olivers CN, Muller K, Lohmann G, Wiggins CJ, Watson DG",NeuroImage,0.105,12595185,-1,-1
junction_00055,https://pubmed.ncbi.nlm.nih.gov/20696386/,When giving is good: ventromedial prefrontal cortex activation for others' intentions.,"Cooper JC, Kreps TA, Wiebe T, Pirkl T, Knutson B",Neuron,0.105,20696386,-1,-1
junction_00056,https://pubmed.ncbi.nlm.nih.gov/20967538/,Two forms of touch perception in the human brain.,"Spitoni GF, Galati G, Antonucci G, Haggard P, Pizzamiglio L",Experimental brain research,0.105,20967538,-1,-1
junction_00057,https://pubmed.ncbi.nlm.nih.gov/24493845/,Neural correlates of social decision-making in severely antisocial adolescents.,"van den Bos W, Vahl P, Guro X011f Lu B, van Nunspeet F, Colins O, Markus M, Rombouts SA, van der Wee N, Vermeiren R, Crone EA",Social cognitive and affective neuroscience,0.105,24493845,-1,-1
junction_00058,https://pubmed.ncbi.nlm.nih.gov/20525743/,Neuroimaging social emotional processing in women: fMRI study of script-driven imagery.,"Frewen PA, Dozois DJ, Neufeld RW, Densmore M, Stevens TK, Lanius RA",Social cognitive and affective neuroscience,0.104,20525743,-1,-1
junction_00059,https://pubmed.ncbi.nlm.nih.gov/24575000/,Voluntary Out-of-Body Experience: An fMRI Study.,"Smith AM, Messier C",Frontiers in human neuroscience,0.104,24575000,-1,-1
junction_00060,https://pubmed.ncbi.nlm.nih.gov/15238438/,Right temporoparietal cortex activation during visuo-proprioceptive conflict.,"Balslev D, Nielsen FA, Paulson OB, Law I","Cerebral cortex (New York, N.Y. : 1991)",0.103,15238438,-1,-1
junction_00061,https://pubmed.ncbi.nlm.nih.gov/18801444/,Brain mechanisms involved in processing unreal perceptions.,"Ku J, Kim JJ, Jung YC, Park IH, Lee H, Han K, Yoon KJ, Kim IY, Kim SI",NeuroImage,0.103,18801444,-1,-1
junction_00062,https://pubmed.ncbi.nlm.nih.gov/23530923/,Effects of working memory demand on neural mechanisms of motor response selection and control.,"Barber AD, Caffo BS, Pekar JJ, Mostofsky SH",Journal of cognitive neuroscience,0.103,23530923,-1,-1
junction_00063,https://pubmed.ncbi.nlm.nih.gov/29221830/,Distinguishable memory retrieval networks for collaboratively and non-collaboratively learned information.,"Vanlangendonck F, Takashima A, Willems RM, Hagoort P",Neuropsychologia,0.102,29221830,-1,-1
junction_00064,https://pubmed.ncbi.nlm.nih.gov/23986265/,Emotional reactivity to threat modulates activity in mentalizing network during aggression.,"Beyer F, Munte TF, Erdmann C, Kramer UM",Social cognitive and affective neuroscience,0.101,23986265,-1,-1
junction_00065,https://pubmed.ncbi.nlm.nih.gov/18612463/,Can machines think? Interaction and perspective taking with robots investigated via fMRI.,"Krach S, Hegel F, Wrede B, Sagerer G, Binkofski F, Kircher T",PloS one,0.1,18612463,-1,-1
junction_00066,https://pubmed.ncbi.nlm.nih.gov/21554961/,Dissociable brain networks involved in development of fairness considerations: understanding intentionality behind unfairness.,"Guroglu B, van den Bos W, van Dijk E, Rombouts SA, Crone EA",NeuroImage,0.1,21554961,-1,-1
junction_00067,https://pubmed.ncbi.nlm.nih.gov/23326568/,Functional neural correlates of attentional deficits in amnestic mild cognitive impairment.,"Van Dam NT, Sano M, Mitsis EM, Grossman HT, Gu X, Park Y, Hof PR, Fan J",PloS one,0.1,23326568,-1,-1
junction_00068,https://pubmed.ncbi.nlm.nih.gov/24396009/,Neural disruption to theory of mind predicts daily social functioning in individuals at familial high-risk for schizophrenia.,"Dodell-Feder D, Delisi LE, Hooker CI",Social cognitive and affective neuroscience,0.1,24396009,-1,-1
junction_00069,https://pubmed.ncbi.nlm.nih.gov/12183390/,The role of the frontal cortex in task preparation.,"Brass M, von Cramon DY","Cerebral cortex (New York, N.Y. : 1991)",0.099,12183390,-1,-1
junction_00070,https://pubmed.ncbi.nlm.nih.gov/19304843/,What motivates repayment? Neural correlates of reciprocity in the Trust Game.,"van den Bos W, van Dijk E, Westenberg M, Rombouts SA, Crone EA",Social cognitive and affective neuroscience,0.099,19304843,10.1093/scan/nsp009,-1
junction_00071,https://pubmed.ncbi.nlm.nih.gov/22974974/,The cortical dynamics underlying effective switching of auditory spatial attention.,"Larson E, Lee AK",NeuroImage,0.099,22974974,-1,-1
junction_00072,https://pubmed.ncbi.nlm.nih.gov/23262080/,Neurofunctional correlates of esthetic and moral judgments.,"Avram M, Gutyrchik E, Bao Y, Poppel E, Reiser M, Blautzik J",Neuroscience letters,0.097,23262080,-1,-1
junction_00073,https://pubmed.ncbi.nlm.nih.gov/29464552/,Neural response to prosocial scenes relates to subsequent giving behavior in adolescents: A pilot study.,"Tashjian SM, Weissman DG, Guyer AE, Galvan A","Cognitive, affective & behavioral neuroscience",0.097,29464552,-1,-1
junction_00074,https://pubmed.ncbi.nlm.nih.gov/16626972/,Increased brain activation during verbal learning in obstructive sleep apnea.,"Ayalon L, Ancoli-Israel S, Klemfuss Z, Shalauta MD, Drummond SP",NeuroImage,0.096,16626972,-1,-1
junction_00075,https://pubmed.ncbi.nlm.nih.gov/18329671/,"An fMRI study of theory of mind in schizophrenic patients with ""passivity"" symptoms.","Brune M, Lissek S, Fuchs N, Witthaus H, Peters S, Nicolas V, Juckel G, Tegenthoff M",Neuropsychologia,0.096,18329671,-1,-1
junction_00076,https://pubmed.ncbi.nlm.nih.gov/22047967/,Distinct neural substrates for semantic knowledge and naming in the temporoparietal network.,"Gesierich B, Jovicich J, Riello M, Adriani M, Monti A, Brentari V, Robinson SD, Wilson SM, Fairhall SL, Gorno-Tempini ML","Cerebral cortex (New York, N.Y. : 1991)",0.096,22047967,-1,-1
junction_00077,https://pubmed.ncbi.nlm.nih.gov/24323497/,Ha ha! versus aha! a direct comparison of humor to nonhumorous insight for determining the neural correlates of mirth.,"Amir O, Biederman I, Wang Z, Xu X","Cerebral cortex (New York, N.Y. : 1991)",0.096,24323497,-1,-1
junction_00078,https://pubmed.ncbi.nlm.nih.gov/25911418/,In our own image? Emotional and neural processing differences when observing human-human vs human-robot interactions.,"Wang Y, Quadflieg S",Social cognitive and affective neuroscience,0.096,25911418,-1,-1
junction_00079,https://pubmed.ncbi.nlm.nih.gov/26045566/,Probing the Cognitive Mechanism of Mental Representational Change During Chunk Decomposition: A Parametric fMRI Study.,"Tang X, Pang J, Nie QY, Conci M, Luo J, Luo J","Cerebral cortex (New York, N.Y. : 1991)",0.095,26045566,-1,-1
junction_00080,https://pubmed.ncbi.nlm.nih.gov/27867351/,Advice Taking from Humans and Machines: An fMRI and Effective Connectivity Study.,"Goodyear K, Parasuraman R, Chernyak S, Madhavan P, Deshpande G, Krueger F",Frontiers in human neuroscience,0.095,27867351,-1,-1
junction_00081,https://pubmed.ncbi.nlm.nih.gov/16757183/,"Functional dominance of finger flexion over extension, expressed in left parietal activation.","Stenekes MW, Hoogduin JM, Mulder T, Geertzen JH, Leenders KL, Nicolai JP, de Jong BM",NeuroImage,0.094,16757183,-1,-1
junction_00082,https://pubmed.ncbi.nlm.nih.gov/16891125/,Caught in the act: the impact of audience on the neural response to morally and socially inappropriate behavior.,"Finger EC, Marsh AA, Kamel N, Mitchell DG, Blair JR",NeuroImage,0.094,16891125,-1,-1
junction_00083,https://pubmed.ncbi.nlm.nih.gov/19632299/,Individual differences in the theory of mind and superior temporal sulcus.,"Otsuka Y, Osaka N, Ikeda T, Osaka M",Neuroscience letters,0.094,19632299,-1,-1
junction_00084,https://pubmed.ncbi.nlm.nih.gov/23036282/,The neural basis of autobiographical memory deficits in transient epileptic amnesia.,"Milton F, Butler CR, Benattayallah A, Zeman AZ",Neuropsychologia,0.094,23036282,-1,-1
junction_00085,https://pubmed.ncbi.nlm.nih.gov/17897686/,'Eavesdropping' on social interactions biases threat perception in visuospatial pathways.,"Lloyd DM, Morrison CI",Neuropsychologia,0.093,17897686,-1,-1
junction_00086,https://pubmed.ncbi.nlm.nih.gov/19457388/,Age-related changes in brain activation associated with dimensional shifts of attention: an fMRI study.,"Morton JB, Bosma R, Ansari D",NeuroImage,0.093,19457388,-1,-1
junction_00087,https://pubmed.ncbi.nlm.nih.gov/28364401/,Impaired engagement of the ventral attention system in neurofibromatosis type 1.,"Pride NA, Korgaonkar MS, North KN, Payne JM",Brain imaging and behavior,0.093,28364401,-1,-1
junction_00088,https://pubmed.ncbi.nlm.nih.gov/29845005/,Psychopathic traits linked to alterations in neural activity during personality judgments of self and others.,"Deming P, Philippi CL, Wolf RC, Dargis M, Kiehl KA, Koenigs M",NeuroImage. Clinical,0.093,29845005,-1,-1
junction_00089,https://pubmed.ncbi.nlm.nih.gov/21715632/,Why clowns taste funny: the relationship between humor and semantic ambiguity.,"Bekinschtein TA, Davis MH, Rodd JM, Owen AM",The Journal of neuroscience : the official journal of the Society for Neuroscience,0.092,21715632,-1,-1
junction_00090,https://pubmed.ncbi.nlm.nih.gov/29318509/,Friend versus foe: Neural correlates of prosocial decisions for liked and disliked peers.,"Schreuders E, Klapwijk ET, Will GJ, Guroglu B","Cognitive, affective & behavioral neuroscience",0.092,29318509,-1,-1
junction_00091,https://pubmed.ncbi.nlm.nih.gov/20188182/,Love hurts: an fMRI study.,"Cheng Y, Chen C, Lin CP, Chou KH, Decety J",NeuroImage,0.091,20188182,-1,-1
junction_00092,https://pubmed.ncbi.nlm.nih.gov/20962241/,Frontostriatal involvement in task switching depends on genetic differences in d2 receptor density.,"Stelzel C, Basten U, Montag C, Reuter M, Fiebach CJ",The Journal of neuroscience : the official journal of the Society for Neuroscience,0.091,20962241,-1,-1
junction_00093,https://pubmed.ncbi.nlm.nih.gov/23887807/,Individual differences in anthropomorphic attributions and human brain structure.,"Cullen H, Kanai R, Bahrami B, Rees G",Social cognitive and affective neuroscience,0.091,23887807,-1,-1
junction_00094,https://pubmed.ncbi.nlm.nih.gov/23986239/,"Echoes of the brain within default mode, association, and heteromodal cortices.","Braga RM, Sharp DJ, Leeson C, Wise RJ, Leech R",The Journal of neuroscience : the official journal of the Society for Neuroscience,0.091,23986239,-1,-1
junction_00095,https://pubmed.ncbi.nlm.nih.gov/16275931/,Sex differences in brain activation elicited by humor.,"Azim E, Mobbs D, Jo B, Menon V, Reiss AL",Proceedings of the National Academy of Sciences of the United States of America,0.09,16275931,-1,-1
junction_00096,https://pubmed.ncbi.nlm.nih.gov/20599810/,A neural system for evaluating the behavioural relevance of salient events outside the current focus of attention.,"Gruber O, Diekhof EK, Kirchenbauer L, Goschke T",Brain research,0.09,20599810,-1,-1
junction_00097,https://pubmed.ncbi.nlm.nih.gov/22302817/,Neural correlates of humor detection and appreciation in children.,"Neely MN, Walter E, Black JM, Reiss AL",The Journal of neuroscience : the official journal of the Society for Neuroscience,0.089,22302817,-1,-1
junction_00098,https://pubmed.ncbi.nlm.nih.gov/22496570/,Dynamical properties of BOLD activity from the ventral posteromedial cortex associated with meditation and attentional skills.,Pagnoni G,The Journal of neuroscience : the official journal of the Society for Neuroscience,0.089,22496570,-1,-1
junction_00099,https://pubmed.ncbi.nlm.nih.gov/23386740/,Sex differences in the neural bases of social appraisals.,"Veroude K, Jolles J, Croiset G, Krabbendam L",Social cognitive and affective neuroscience,0.089,23386740,-1,-1
junction_00100,https://pubmed.ncbi.nlm.nih.gov/18985141/,Detecting agency from the biological motion of veridical vs animated agents.,"Mar RA, Kelley WM, Heatherton TF, Macrae CN",Social cognitive and affective neuroscience,0.088,18985141,-1,-1
