paper_name,paper_url,Title,Author,Journal,Loading,PMID,Doi,download_status
junction_00196,https://pubmed.ncbi.nlm.nih.gov/9819274/,Functional MRI of galvanic vestibular stimulation.,"Lobel E, Kleine JF, Bihan DL, Leroy-Willig A, Berthoz A",Journal of neurophysiology,0.075,9819274,-1,-1
junction_00197,https://pubmed.ncbi.nlm.nih.gov/16140345/,Empathy examined through the neural mechanisms involved in imagining how I feel versus how you feel pain.,"Jackson PL, Brunet E, Meltzoff AN, Decety J",Neuropsychologia,0.075,16140345,-1,-1
junction_00198,https://pubmed.ncbi.nlm.nih.gov/17662530/,Saccular stimulation of the human cortex: a functional magnetic resonance imaging study.,"Miyamoto T, Fukushima K, Takada T, de Waele C, Vidal PP",Neuroscience letters,0.075,17662530,-1,-1
junction_00199,https://pubmed.ncbi.nlm.nih.gov/18476756/,"What is ""odd"" in Posner's location-cueing paradigm? Neural responses to unexpected location and feature changes compared.","Vossel S, Weidner R, Thiel CM, Fink GR",Journal of cognitive neuroscience,0.075,18476756,-1,-1
junction_00200,https://pubmed.ncbi.nlm.nih.gov/19467357/,Innocent intentions: a correlation between forgiveness for accidental harm and neural activity.,"Young L, Saxe R",Neuropsychologia,0.075,19467357,-1,-1
junction_00201,https://pubmed.ncbi.nlm.nih.gov/20053431/,Individual differences in auditory sentence comprehension in children: An exploratory event-related functional magnetic resonance imaging investigation.,"Yeatman JD, Ben-Shachar M, Glover GH, Feldman HM",Brain and language,0.075,20053431,-1,-1
junction_00202,https://pubmed.ncbi.nlm.nih.gov/23202661/,Default distrust? An fMRI investigation of the neural development of trust and cooperation.,"Fett AK, Gromann PM, Giampietro V, Shergill SS, Krabbendam L",Social cognitive and affective neuroscience,0.075,23202661,-1,-1
junction_00203,https://pubmed.ncbi.nlm.nih.gov/23535179/,"Effects of Number Magnitude and Notation at 7T: Separating the Neural Response to Small and Large, Symbolic and Nonsymbolic Number.","He L, Zuo Z, Chen L, Humphreys G","Cerebral cortex (New York, N.Y. : 1991)",0.075,23535179,-1,-1
junction_00204,https://pubmed.ncbi.nlm.nih.gov/23946001/,Neural responses to unfairness and fairness depend on self-contribution to the income.,"Guo X, Zheng L, Cheng X, Chen M, Zhu L, Li J, Chen L, Yang Z",Social cognitive and affective neuroscience,0.075,23946001,-1,-1
junction_00205,https://pubmed.ncbi.nlm.nih.gov/24825504/,Imagining triadic interactions simultaneously activates mirror and mentalizing systems.,"Trapp K, Spengler S, Wustenberg T, Wiers CE, Busch NA, Bermpohl F",NeuroImage,0.075,24825504,-1,-1
junction_00206,https://pubmed.ncbi.nlm.nih.gov/24936178/,The neural correlates of regulating another person's emotions: an exploratory fMRI study.,"Hallam GP, Webb TL, Sheeran P, Miles E, Niven K, Wilkinson ID, Hunter MD, Woodruff PW, Totterdell P, Farrow TF",Frontiers in human neuroscience,0.075,24936178,-1,-1
junction_00207,https://pubmed.ncbi.nlm.nih.gov/25824980/,Processing of bilateral versus unilateral conditions: evidence for the functional contribution of the ventral attention network.,"Beume LA, Kaller CP, Hoeren M, Kloppel S, Kuemmerer D, Glauche V, Kostering L, Mader I, Rijntjes M, Weiller C, Umarova R",Cortex; a journal devoted to the study of the nervous system and behavior,0.075,25824980,-1,-1
junction_00208,https://pubmed.ncbi.nlm.nih.gov/27591782/,Hand-independent representation of tool-use pantomimes in the left anterior intraparietal cortex.,"Ogawa K, Imai F",Experimental brain research,0.075,27591782,-1,-1
junction_00209,https://pubmed.ncbi.nlm.nih.gov/12948738/,"People thinking about thinking people. The role of the temporo-parietal junction  in ""theory of mind"".","Saxe R, Kanwisher N",NeuroImage,0.074,12948738,-1,-1
junction_00210,https://pubmed.ncbi.nlm.nih.gov/16641225/,Content- and task-specific dissociations of frontal activity during maintenance and manipulation in visual working memory.,"Mohr HM, Goebel R, Linden DE",The Journal of neuroscience : the official journal of the Society for Neuroscience,0.074,16641225,-1,-1
junction_00211,https://pubmed.ncbi.nlm.nih.gov/20226769/,Temporal pole activity during understanding other persons' mental states correlates with neuroticism trait.,"Jimura K, Konishi S, Asari T, Miyashita Y",Brain research,0.074,20226769,-1,-1
junction_00212,https://pubmed.ncbi.nlm.nih.gov/21419144/,Brain mechanisms of perceiving tools and imagining tool use acts: a functional MRI study.,"Wadsworth HM, Kana RK",Neuropsychologia,0.074,21419144,-1,-1
junction_00213,https://pubmed.ncbi.nlm.nih.gov/22902649/,The implementation of verbal instructions: dissociating motor preparation from the formation of stimulus-response associations.,"Hartstra E, Waszak F, Brass M",NeuroImage,0.074,22902649,-1,-1
junction_00214,https://pubmed.ncbi.nlm.nih.gov/25277495/,"Manipulating item proportion and deception reveals crucial dissociation between behavioral, autonomic, and neural indices of concealed information.","Suchotzki K, Verschuere B, Peth J, Crombez G, Gamer M",Human brain mapping,0.074,25277495,10.1002/hbm.22637,-1
junction_00215,https://pubmed.ncbi.nlm.nih.gov/26484830/,Role of the human retrosplenial cortex/parieto-occipital sulcus in perspective priming.,"Sulpizio V, Committeri G, Lambrey S, Berthoz A, Galati G",NeuroImage,0.074,26484830,10.1016/j.neuroimage.2015.10.040,-1
junction_00216,https://pubmed.ncbi.nlm.nih.gov/29104537/,Consciously Feeling the Pain of Others Reflects Atypical Functional Connectivity  between the Pain Matrix and Frontal-Parietal Regions.,"Grice-Jackson T, Critchley HD, Banissy MJ, Ward J",Frontiers in human neuroscience,0.074,29104537,10.3389/fnhum.2017.00507,-1
junction_00217,https://pubmed.ncbi.nlm.nih.gov/10774738/,A stimulus-driven approach to object identity and location processing in the human brain.,"Marois R, Leung HC, Gore JC",Neuron,0.073,10774738,-1,-1
junction_00218,https://pubmed.ncbi.nlm.nih.gov/11566313/,Spatial attention and crossmodal interactions between vision and touch.,"Macaluso E, Driver J",Neuropsychologia,0.073,11566313,-1,-1
junction_00219,https://pubmed.ncbi.nlm.nih.gov/12599280/,Neural basis of the non-attentional processing of briefly presented words.,"Peng DL, Xu D, Jin Z, Luo Q, Ding GS, Perry C, Zhang L, Liu Y",Human brain mapping,0.073,12599280,-1,-1
junction_00220,https://pubmed.ncbi.nlm.nih.gov/15703253/,The functional anatomy of sleep-dependent visual skill learning.,"Walker MP, Stickgold R, Jolesz FA, Yoo SS","Cerebral cortex (New York, N.Y. : 1991)",0.073,15703253,-1,-1
junction_00221,https://pubmed.ncbi.nlm.nih.gov/17964741/,Differences in cortical activity between methamphetamine-dependent and healthy individuals performing a facial affect matching task.,"Payer DE, Lieberman MD, Monterosso JR, Xu J, Fong TW, London ED",Drug and alcohol dependence,0.073,17964741,-1,-1
junction_00222,https://pubmed.ncbi.nlm.nih.gov/18606175/,The influence of prior record on moral judgment.,"Kliemann D, Young L, Scholz J, Saxe R",Neuropsychologia,0.073,18606175,-1,-1
junction_00223,https://pubmed.ncbi.nlm.nih.gov/20150343/,The neural substrates of action identification.,"Marsh AA, Kozak MN, Wegner DM, Reid ME, Yu HH, Blair RJ",Social cognitive and affective neuroscience,0.073,20150343,-1,-1
junction_00224,https://pubmed.ncbi.nlm.nih.gov/21887888/,"Stroop interference, hemodynamic response and aging: an event-related fMRI study.","Zysset S, Schroeter ML, Neumann J, von Cramon DY",Neurobiology of aging,0.073,21887888,-1,-1
junction_00225,https://pubmed.ncbi.nlm.nih.gov/21908447/,Dissociable neural correlates of stereotypes and other forms of semantic knowledge.,"Contreras JM, Banaji MR, Mitchell JP",Social cognitive and affective neuroscience,0.073,21908447,-1,-1
junction_00226,https://pubmed.ncbi.nlm.nih.gov/23547245/,Experimental human endotoxemia enhances brain activity during social cognition.,"Kullmann JS, Grigoleit JS, Wolf OT, Engler H, Oberbeck R, Elsenbruch S, Forsting M, Schedlowski M, Gizewski ER",Social cognitive and affective neuroscience,0.073,23547245,-1,-1
junction_00227,https://pubmed.ncbi.nlm.nih.gov/25527112/,Neural correlates of self-deception and impression-management.,"Farrow TF, Burgess J, Wilkinson ID, Hunter MD",Neuropsychologia,0.073,25527112,-1,-1
junction_00228,https://pubmed.ncbi.nlm.nih.gov/27369095/,The imitation game: Effects of social cues on 'imitation' are domain-general in nature.,"Marsh LE, Bird G, Catmur C",NeuroImage,0.073,27369095,-1,-1
junction_00229,https://pubmed.ncbi.nlm.nih.gov/29744804/,Frontal lobe functioning during a simple response conflict task in first-episode  psychosis and its relationship to treatment response.,"Shafritz KM, Ikuta T, Greene A, Robinson DG, Gallego J, Lencz T, DeRosse P, Kingsley PB, Szeszko PR",Brain imaging and behavior,0.073,29744804,-1,-1
junction_00230,https://pubmed.ncbi.nlm.nih.gov/15193581/,Attentional systems in target and distractor processing: a combined ERP and fMRI  study.,"Bledowski C, Prvulovic D, Goebel R, Zanella FE, Linden DE",NeuroImage,0.072,15193581,-1,-1
junction_00231,https://pubmed.ncbi.nlm.nih.gov/19439183/,Social context and perceived agency affects empathy for pain: an event-related fMRI investigation.,"Akitsuki Y, Decety J",NeuroImage,0.072,19439183,-1,-1
junction_00232,https://pubmed.ncbi.nlm.nih.gov/19453626/,Dissociation of attention and intention in human posterior parietal cortex: an fMRI study.,"Hu S, Bu Y, Song Y, Zhen Z, Liu J",The European journal of neuroscience,0.072,19453626,-1,-1
junction_00233,https://pubmed.ncbi.nlm.nih.gov/20171291/,Separating distinct aspects of the voluntary selection between response alternatives: N2- and P3-related BOLD responses.,"Karch S, Feuerecker R, Leicht G, Meindl T, Hantschk I, Kirsch V, Ertl M, Lutz J, Pogarell O, Mulert C",NeuroImage,0.072,20171291,-1,-1
junction_00234,https://pubmed.ncbi.nlm.nih.gov/21438078/,"Staying responsive to the world: modality-specific and -nonspecific contributions to speeded auditory, tactile, and visual stimulus detection.","Langner R, Kellermann T, Eickhoff SB, Boers F, Chatterjee A, Willmes K, Sturm W",Human brain mapping,0.072,21438078,-1,-1
junction_00235,https://pubmed.ncbi.nlm.nih.gov/25942019/,The neural basis of testable and non-testable beliefs.,"Howlett JR, Paulus MP",PloS one,0.072,25942019,10.1371/journal.pone.0124596,-1
junction_00236,https://pubmed.ncbi.nlm.nih.gov/26011751/,Trait-level temporal lobe hypoactivation to social exclusion in unaffected siblings of children and adolescents with autism spectrum disorders.,"Bolling DZ, Pelphrey KA, Vander Wyk BC",Developmental cognitive neuroscience,0.072,26011751,10.1016/j.dcn.2015.04.007,-1
junction_00237,https://pubmed.ncbi.nlm.nih.gov/26301900/,Is the Medial Prefrontal Cortex Necessary for Theory of Mind?,"Otti A, Wohlschlaeger AM, Noll-Hussong M",PloS one,0.072,26301900,10.1371/journal.pone.0135912,-1
junction_00238,https://pubmed.ncbi.nlm.nih.gov/15275913/,Anatomy and time course of discrimination and categorization processes in vision: an fMRI study.,"Pernet C, Franceries X, Basan S, Cassol E, Demonet JF, Celsis P",NeuroImage,0.071,15275913,10.1016/j.neuroimage.2004.03.044,-1
junction_00239,https://pubmed.ncbi.nlm.nih.gov/18523591/,Fast visuomotor processing of redundant targets: the role of the right temporo-parietal junction.,"Mooshagian E, Kaplan J, Zaidel E, Iacoboni M",PloS one,0.071,18523591,-1,-1
junction_00240,https://pubmed.ncbi.nlm.nih.gov/18621033/,Neural substrates for visual pattern recognition learning in Igo.,"Itoh K, Kitamura H, Fujii Y, Nakada T",Brain research,0.071,18621033,-1,-1
junction_00241,https://pubmed.ncbi.nlm.nih.gov/21036183/,Multisensory perception of action in posterior temporal and parietal cortices.,"James TW, VanDerKlok RM, Stevenson RA, James KH",Neuropsychologia,0.071,21036183,-1,-1
junction_00242,https://pubmed.ncbi.nlm.nih.gov/21259389/,Do we mind other minds when we mind other minds' actions? A functional magnetic resonance imaging study.,"Wurm MF, von Cramon DY, Schubotz RI",Human brain mapping,0.071,21259389,-1,-1
junction_00243,https://pubmed.ncbi.nlm.nih.gov/21896334/,Female children with autism spectrum disorder: an insight from mass-univariate and pattern classification analyses.,"Calderoni S, Retico A, Biagi L, Tancredi R, Muratori F, Tosetti M",NeuroImage,0.071,21896334,-1,-1
junction_00244,https://pubmed.ncbi.nlm.nih.gov/24398265/,Altered neural activity in the 'when' pathway during temporal processing in fragile X premutation carriers.,"Kim SY, Tassone F, Simon TJ, Rivera SM",Behavioural brain research,0.071,24398265,-1,-1
junction_00245,https://pubmed.ncbi.nlm.nih.gov/24789353/,The neural basis of event simulation: an FMRI study.,"Yomogida Y, Sugiura M, Akimoto Y, Miyauchi CM, Kawashima R",PloS one,0.071,24789353,-1,-1
junction_00246,https://pubmed.ncbi.nlm.nih.gov/25957017/,Dissociated large-scale functional connectivity networks of the precuneus in medication-naive first-episode depression.,"Peng D, Liddle EB, Iwabuchi SJ, Zhang C, Wu Z, Liu J, Jiang K, Xu L, Liddle PF, Palaniyappan L, Fang Y",Psychiatry research,0.071,25957017,-1,-1
junction_00247,https://pubmed.ncbi.nlm.nih.gov/25976923/,Disentangling neural processes of egocentric and allocentric mental spatial transformations using whole-body photos of self and other.,"Ganesh S, van Schie HT, Cross ES, de Lange FP, Wigboldus DH",NeuroImage,0.071,25976923,-1,-1
junction_00248,https://pubmed.ncbi.nlm.nih.gov/26745874/,Delays in Human-Computer Interaction and Their Effects on Brain Activity.,"Kohrs C, Angenstein N, Brechmann A",PloS one,0.071,26745874,-1,-1
junction_00249,https://pubmed.ncbi.nlm.nih.gov/29275004/,Handling or being the concept: An fMRI study on metonymy representations in coverbal gestures.,"Joue G, Boven L, Willmes K, Evola V, Demenescu LR, Hassemer J, Mittelberg I, Mathiak K, Schneider F, Habel U",Neuropsychologia,0.071,29275004,-1,-1
junction_00250,https://pubmed.ncbi.nlm.nih.gov/19710382/,Functional asymmetries revealed in visually guided saccades: an FMRI study.,"Petit L, Zago L, Vigneau M, Andersson F, Crivello F, Mazoyer B, Mellet E, Tzourio-Mazoyer N",Journal of neurophysiology,0.07,19710382,-1,-1
junction_00251,https://pubmed.ncbi.nlm.nih.gov/22192727/,The central role of the temporo-parietal junction and the superior longitudinal fasciculus in supporting multi-item competition: evidence from lesion-symptom mapping of extinction.,"Chechlacz M, Rotshtein P, Hansen PC, Deb S, Riddoch MJ, Humphreys GW",Cortex; a journal devoted to the study of the nervous system and behavior,0.07,22192727,-1,-1
junction_00252,https://pubmed.ncbi.nlm.nih.gov/22345370/,Situation and person attributions under spontaneous and intentional instructions: an fMRI study.,"Kestemont J, Vandekerckhove M, Ma N, Van Hoeck N, Van Overwalle F",Social cognitive and affective neuroscience,0.07,22345370,-1,-1
junction_00253,https://pubmed.ncbi.nlm.nih.gov/22363406/,The effect of the visual context in the recognition of symbolic gestures.,"Villarreal MF, Fridman EA, Leiguarda RC",PloS one,0.07,22363406,-1,-1
junction_00254,https://pubmed.ncbi.nlm.nih.gov/22766167/,Neural evidence that utterance-processing entails mentalizing: the case of irony.,"Spotorno N, Koun E, Prado J, Van Der Henst JB, Noveck IA",NeuroImage,0.07,22766167,10.1016/j.neuroimage.2012.06.046,-1
junction_00255,https://pubmed.ncbi.nlm.nih.gov/23324559/,Direct Gaze Elicits Atypical Activation of the Theory-of-Mind Network in Autism Spectrum Conditions.,"von dem Hagen EA, Stoyanova RS, Rowe JB, Baron-Cohen S, Calder AJ","Cerebral cortex (New York, N.Y. : 1991)",0.07,23324559,10.1093/cercor/bht003,-1
junction_00256,https://pubmed.ncbi.nlm.nih.gov/25534111/,A frontotemporoparietal network common to initiating and responding to joint attention bids.,"Caruana N, Brock J, Woolgar A",NeuroImage,0.07,25534111,10.1016/j.neuroimage.2014.12.041,-1
junction_00257,https://pubmed.ncbi.nlm.nih.gov/26892856/,Look into my eyes: Investigating joint attention using interactive eye-tracking and fMRI in a developmental sample.,"Oberwelland E, Schilbach L, Barisic I, Krall SC, Vogeley K, Fink GR, Herpertz-Dahlmann B, Konrad K, Schulte-Ruther M",NeuroImage,0.07,26892856,10.1016/j.neuroimage.2016.02.026,-1
junction_00258,https://pubmed.ncbi.nlm.nih.gov/27607439/,Attention Network Dysfunction in Bulimia Nervosa - An fMRI Study.,"Seitz J, Hueck M, Dahmen B, Schulte-Ruther M, Legenbauer T, Herpertz-Dahlmann B, Konrad K",PloS one,0.07,27607439,10.1371/journal.pone.0161329,-1
junction_00259,https://pubmed.ncbi.nlm.nih.gov/29456496/,How Do Acquired Political Identities Influence Our Neural Processing toward Others within the Context of a Trust Game?,"Wu CT, Fan YT, Du YR, Yang TT, Liu HL, Yen NS, Chen SH, Hsung RM",Frontiers in human neuroscience,0.07,29456496,10.3389/fnhum.2018.00023,-1
junction_00260,https://pubmed.ncbi.nlm.nih.gov/14568445/,Evaluation of the dual route theory of reading: a metanalysis of 35 neuroimaging  studies.,"Jobard G, Crivello F, Tzourio-Mazoyer N",NeuroImage,0.069,14568445,-1,-1
junction_00261,https://pubmed.ncbi.nlm.nih.gov/19478034/,Mentalizing under uncertainty: dissociated neural responses to ambiguous and unambiguous mental state inferences.,"Jenkins AC, Mitchell JP","Cerebral cortex (New York, N.Y. : 1991)",0.069,19478034,-1,-1
junction_00262,https://pubmed.ncbi.nlm.nih.gov/21352923/,A gateway system in rostral PFC? Evidence from biasing attention to perceptual information and internal representations.,"Henseler I, Kruger S, Dechent P, Gruber O",NeuroImage,0.069,21352923,-1,-1
junction_00263,https://pubmed.ncbi.nlm.nih.gov/22203319/,Methylphenidate modulates sustained attention and cortical activation in survivors of traumatic brain injury: a perfusion fMRI study.,"Kim J, Whyte J, Patel S, Europa E, Wang J, Coslett HB, Detre JA",Psychopharmacology,0.069,22203319,-1,-1
junction_00264,https://pubmed.ncbi.nlm.nih.gov/22438199/,Brain activity during sympathetic response in anticipation and experience of pain.,"Seifert F, Schuberth N, De Col R, Peltz E, Nickel FT, Maihofner C",Human brain mapping,0.069,22438199,-1,-1
junction_00265,https://pubmed.ncbi.nlm.nih.gov/23825319/,Effective Connectivity During Feature-Based Attentional Capture: Evidence Against the Attentional Reorienting Hypothesis of TPJ.,"Diquattro NE, Sawaki R, Geng JJ","Cerebral cortex (New York, N.Y. : 1991)",0.069,23825319,-1,-1
junction_00266,https://pubmed.ncbi.nlm.nih.gov/25271132/,Spatial and temporal functional connectivity changes between resting and attentive states.,"Bray S, Arnold AE, Levy RM, Iaria G",Human brain mapping,0.069,25271132,-1,-1
junction_00267,https://pubmed.ncbi.nlm.nih.gov/27363008/,Facing competition: Neural mechanisms underlying parallel programming of antisaccades and prosaccades.,"Talanow T, Kasparbauer AM, Steffens M, Meyhofer I, Weber B, Smyrnis N, Ettinger U",Brain and cognition,0.069,27363008,-1,-1
junction_00268,https://pubmed.ncbi.nlm.nih.gov/27523448/,Functional mechanisms of probabilistic inference in feature- and space-based attentional systems.,"Dombert PL, Kuhns A, Mengotti P, Fink GR, Vossel S",NeuroImage,0.069,27523448,-1,-1
junction_00269,https://pubmed.ncbi.nlm.nih.gov/28928643/,How Situational Context Impacts Empathic Responses and Brain Activation Patterns.,"Cheng Y, Chen C, Decety J",Frontiers in behavioral neuroscience,0.069,28928643,-1,-1
junction_00270,https://pubmed.ncbi.nlm.nih.gov/28986207/,The role of the temporoparietal junction (TPJ) in action observation: Agent detection rather than visuospatial transformation.,"Wurm MF, Schubotz RI",NeuroImage,0.069,28986207,-1,-1
junction_00271,https://pubmed.ncbi.nlm.nih.gov/12507947/,"Foot, hand, face and eye representation in the human striatum.","Gerardin E, Lehericy S, Pochon JB, Tezenas du Montcel S, Mangin JF, Poupon F, Agid Y, Le Bihan D, Marsault C","Cerebral cortex (New York, N.Y. : 1991)",0.068,12507947,10.1093/cercor/13.2.162,-1
junction_00272,https://pubmed.ncbi.nlm.nih.gov/16087351/,Brain correlates of aesthetic judgment of beauty.,"Jacobsen T, Schubotz RI, Hofel L, Cramon DY",NeuroImage,0.068,16087351,10.1016/j.neuroimage.2005.07.010,-1
junction_00273,https://pubmed.ncbi.nlm.nih.gov/19365800/,Neural correlates of word production stages delineated by parametric modulation of psycholinguistic variables.,"Wilson SM, Isenberg AL, Hickok G",Human brain mapping,0.068,19365800,10.1002/hbm.20782,-1
junction_00274,https://pubmed.ncbi.nlm.nih.gov/19414052/,"Neural correlates of ""analytical-specific visual perception"" and degree of task difficulty as investigated by the Mangina-Test: a functional magnetic resonance imaging (fMRI) study in young healthy ad","Mangina CA, Beuzeron-Mangina H, Ricciardi E, Pietrini P, Chiarenza GA, Casarotto S",International journal of psychophysiology : official journal of the International Organization of Psychophysiology,0.068,19414052,10.1016/j.ijpsycho.2009.04.009,-1
junction_00275,https://pubmed.ncbi.nlm.nih.gov/19890846/,Cortical representation of verbs with optional complements: the theoretical contribution of fMRI.,"Shetreet E, Friedmann N, Hadar U",Human brain mapping,0.068,19890846,-1,-1
junction_00276,https://pubmed.ncbi.nlm.nih.gov/20810877/,Preservation and modulation of specific left hemisphere regions is vital for treated recovery from anomia in stroke.,Fridriksson J,The Journal of neuroscience : the official journal of the Society for Neuroscience,0.068,20810877,-1,-1
junction_00277,https://pubmed.ncbi.nlm.nih.gov/20974266/,Incongruence effects in crossmodal emotional integration.,"Muller VI, Habel U, Derntl B, Schneider F, Zilles K, Turetsky BI, Eickhoff SB",NeuroImage,0.068,20974266,-1,-1
junction_00278,https://pubmed.ncbi.nlm.nih.gov/21830257/,Spatiotemporal dynamics of processing nonsymbolic number: an event-related potential source localization study.,"Hyde DC, Spelke ES",Human brain mapping,0.068,21830257,-1,-1
junction_00279,https://pubmed.ncbi.nlm.nih.gov/21933718/,Imitation components in the human brain: an fMRI study.,"Mengotti P, Corradi-Dell'acqua C, Rumiati RI",NeuroImage,0.068,21933718,-1,-1
junction_00280,https://pubmed.ncbi.nlm.nih.gov/23322890/,Deconstructing the brain's moral network: dissociable functionality between the temporoparietal junction and ventro-medial prefrontal cortex.,"Feldmanhall O, Mobbs D, Dalgleish T",Social cognitive and affective neuroscience,0.068,23322890,-1,-1
junction_00281,https://pubmed.ncbi.nlm.nih.gov/23964067/,Plasticity in Unimodal and Multimodal Brain Areas Reflects Multisensory Changes in Self-Face Identification.,"Apps MA, Tajadura-Jimenez A, Sereno M, Blanke O, Tsakiris M","Cerebral cortex (New York, N.Y. : 1991)",0.068,23964067,-1,-1
junction_00282,https://pubmed.ncbi.nlm.nih.gov/25797238/,Asymmetric development of dorsal and ventral attention networks in the human brain.,"Farrant K, Uddin LQ",Developmental cognitive neuroscience,0.068,25797238,-1,-1
junction_00283,https://pubmed.ncbi.nlm.nih.gov/14741670/,"Cerebral correlates of alerting, orienting and reorienting of visuospatial attention: an event-related fMRI study.","Thiel CM, Zilles K, Fink GR",NeuroImage,0.067,14741670,-1,-1
junction_00284,https://pubmed.ncbi.nlm.nih.gov/15050563/,Target dependency of brain mechanism involved in dispositional inference: a PET study.,"Sugiura M, Gotoh R, Okada K, Yamaguchi K, Itoh M, Fukuda H, Kawashima R",NeuroImage,0.067,15050563,-1,-1
junction_00285,https://pubmed.ncbi.nlm.nih.gov/17627852/,Cortical mechanism of communicative speech production.,"Sassa Y, Sugiura M, Jeong H, Horie K, Sato S, Kawashima R",NeuroImage,0.067,17627852,-1,-1
junction_00286,https://pubmed.ncbi.nlm.nih.gov/19034897/,FMRI correlates of visuo-spatial reorienting investigated with an attention shifting double-cue paradigm.,"Natale E, Marzi CA, Macaluso E",Human brain mapping,0.067,19034897,-1,-1
junction_00287,https://pubmed.ncbi.nlm.nih.gov/20004724/,The amodal system for conscious word and picture identification in the absence of a semantic task.,"Van Doren L, Dupont P, De Grauwe S, Peeters R, Vandenberghe R",NeuroImage,0.067,20004724,-1,-1
junction_00288,https://pubmed.ncbi.nlm.nih.gov/20302951/,Recomposing a fragmented literature: how conditional and relational arguments engage different neural systems for deductive reasoning.,"Prado J, Van Der Henst JB, Noveck IA",NeuroImage,0.067,20302951,-1,-1
junction_00289,https://pubmed.ncbi.nlm.nih.gov/22440654/,Multiple roles for executive control in belief-desire reasoning: distinct neural  networks are recruited for self perspective inhibition and complexity of reasoning.,"Hartwright CE, Apperly IA, Hansen PC",NeuroImage,0.067,22440654,-1,-1
junction_00290,https://pubmed.ncbi.nlm.nih.gov/22766165/,The what and how components of cognitive control.,"De Baene W, Albers AM, Brass M",NeuroImage,0.067,22766165,-1,-1
junction_00291,https://pubmed.ncbi.nlm.nih.gov/23015426/,Neural mechanisms of attentional reorienting in three-dimensional space.,"Chen Q, Weidner R, Vossel S, Weiss PH, Fink GR",The Journal of neuroscience : the official journal of the Society for Neuroscience,0.067,23015426,10.1523/JNEUROSCI.1772-12.2012,-1
junction_00292,https://pubmed.ncbi.nlm.nih.gov/23077042/,Neural substrate of the late positive potential in emotional processing.,"Liu Y, Huang H, McGinnis-Deweese M, Keil A, Ding M",The Journal of neuroscience : the official journal of the Society for Neuroscience,0.067,23077042,-1,-1
junction_00293,https://pubmed.ncbi.nlm.nih.gov/23658538/,"The role of automaticity and attention in neural processes underlying empathy for happiness, sadness, and anxiety.","Morelli SA, Lieberman MD",Frontiers in human neuroscience,0.067,23658538,-1,-1
