paper_name,paper_url,Title,Author,Journal,Loading,PMID,Doi,download_status
parieto_00001,https://pubmed.ncbi.nlm.nih.gov/22114283/,Decoding effector-dependent and effector-independent movement intentions from human parieto-frontal brain activity.,"Gallivan JP, McLean DA, Smith FW, Culham JC",The Journal of neuroscience : the official journal of the Society for Neuroscience,0.491,22114283,-1,-1
parieto_00002,https://pubmed.ncbi.nlm.nih.gov/19300986/,Deriving angular displacement from optic flow: a fMRI study.,"Diekmann V, Jurgens R, Becker W",Experimental brain research,0.344,19300986,-1,-1
parieto_00003,https://pubmed.ncbi.nlm.nih.gov/12098493/,Common neural processing regions for dynamic and static stereopsis in human parieto-occipital cortices.,"Iwami T, Nishida Y, Hayashi O, Kimura M, Sakai M, Kani K, Ito R, Shiino A, Suzuki M",Neuroscience letters,0.306,12098493,-1,-1
parieto_00004,https://pubmed.ncbi.nlm.nih.gov/16087350/,Implementation of visuospatial cues in response selection.,"van Eimeren T, Wolbers T, Munchau A, Buchel C, Weiller C, Siebner HR",NeuroImage,0.275,16087350,-1,-1
parieto_00005,https://pubmed.ncbi.nlm.nih.gov/26484830/,Role of the human retrosplenial cortex/parieto-occipital sulcus in perspective priming.,"Sulpizio V, Committeri G, Lambrey S, Berthoz A, Galati G",NeuroImage,0.272,26484830,-1,-1
parieto_00006,https://pubmed.ncbi.nlm.nih.gov/25887261/,Developmental sex differences in resting state functional connectivity of amygdala sub-regions.,"Alarcon G, Cservenka A, Rudolph MD, Fair DA, Nagel BJ",NeuroImage,0.262,25887261,-1,-1
parieto_00007,https://pubmed.ncbi.nlm.nih.gov/28673767/,Diminished motor imagery capability in adults with motor impairment: An fMRI mental rotation study.,"Kashuk SR, Williams J, Thorpe G, Wilson PH, Egan GF",Behavioural brain research,0.253,28673767,-1,-1
parieto_00008,https://pubmed.ncbi.nlm.nih.gov/16750818/,Frontopolar cortex mediates abstract integration in analogy.,"Green AE, Fugelsang JA, Kraemer DJ, Shamosh NA, Dunbar KN",Brain research,0.232,16750818,-1,-1
parieto_00009,https://pubmed.ncbi.nlm.nih.gov/16966490/,The neural correlates of human working memory for haptically explored object orientations.,"Kaas AL, van Mier H, Goebel R","Cerebral cortex (New York, N.Y. : 1991)",0.232,16966490,-1,-1
parieto_00010,https://pubmed.ncbi.nlm.nih.gov/12427682/,Neural basis of mental scanning of a topographic representation built from a text.,"Mellet E, Bricogne S, Crivello F, Mazoyer B, Denis M, Tzourio-Mazoyer N","Cerebral cortex (New York, N.Y. : 1991)",0.215,12427682,-1,-1
parieto_00011,https://pubmed.ncbi.nlm.nih.gov/23530922/,Negative BOLD response in the hippocampus during short-term spatial memory retrieval.,"Nilsson J, Ferrier IN, Coventry K, Bester A, Finkelmeyer A",Journal of cognitive neuroscience,0.208,23530922,-1,-1
parieto_00012,https://pubmed.ncbi.nlm.nih.gov/16281284/,Identifying human parieto-insular vestibular cortex using fMRI and cytoarchitectonic mapping.,"Eickhoff SB, Weiss PH, Amunts K, Fink GR, Zilles K",Human brain mapping,0.201,16281284,-1,-1
parieto_00013,https://pubmed.ncbi.nlm.nih.gov/22066584/,The neural underpinings of simultanagnosia: disconnecting the visuospatial attention network.,"Chechlacz M, Rotshtein P, Hansen PC, Riddoch JM, Deb S, Humphreys GW",Journal of cognitive neuroscience,0.201,22066584,-1,-1
parieto_00014,https://pubmed.ncbi.nlm.nih.gov/16139817/,Influence of X chromosome and hormones on human brain development: a magnetic resonance imaging and proton magnetic resonance spectroscopy study of Turner syndrome.,"Cutter WJ, Daly EM, Robertson DM, Chitnis XA, van Amelsvoort TA, Simmons A, Ng VW, Williams BS, Shaw P, Conway GS, Skuse DH, Collier DA, Craig M, Murphy DG",Biological psychiatry,0.193,16139817,-1,-1
parieto_00015,https://pubmed.ncbi.nlm.nih.gov/15219589/,Neural changes associated with speech learning in deaf children following cochlear implantation.,"Kang E, Lee DS, Kang H, Lee JS, Oh SH, Lee MC, Kim CS",NeuroImage,0.191,15219589,-1,-1
parieto_00016,https://pubmed.ncbi.nlm.nih.gov/17060366/,Topography of cortical activation differs for fundamental and harmonic frequencies of the steady-state visual-evoked responses. An EEG and PET H215O study.,"Pastor MA, Valencia M, Artieda J, Alegre M, Masdeu JC","Cerebral cortex (New York, N.Y. : 1991)",0.187,17060366,-1,-1
parieto_00017,https://pubmed.ncbi.nlm.nih.gov/27591782/,Hand-independent representation of tool-use pantomimes in the left anterior intraparietal cortex.,"Ogawa K, Imai F",Experimental brain research,0.185,27591782,-1,-1
parieto_00018,https://pubmed.ncbi.nlm.nih.gov/11322979/,Functional organisation of the saccadic reference system processing extraretinal  signals in humans.,"Tobler PN, Felblinger J, Burki M, Nirkko AC, Ozdoba C, Muri RM",Vision research,0.179,11322979,-1,-1
parieto_00019,https://pubmed.ncbi.nlm.nih.gov/26779002/,"Haptically Guided Grasping. fMRI Shows Right-Hemisphere Parietal Stimulus Encoding, and Bilateral Dorso-Ventral Parietal Gradients of Object- and Action-Related Processing during Grasp Execution.","Marangon M, Kubiak A, Kroliczak G",Frontiers in human neuroscience,0.179,26779002,-1,-1
parieto_00020,https://pubmed.ncbi.nlm.nih.gov/27607439/,Attention Network Dysfunction in Bulimia Nervosa - An fMRI Study.,"Seitz J, Hueck M, Dahmen B, Schulte-Ruther M, Legenbauer T, Herpertz-Dahlmann B, Konrad K",PloS one,0.173,27607439,-1,-1
parieto_00021,https://pubmed.ncbi.nlm.nih.gov/15893941/,Two distinct neural effects of blinking on human visual processing.,"Bristow D, Frith C, Rees G",NeuroImage,0.169,15893941,-1,-1
parieto_00022,https://pubmed.ncbi.nlm.nih.gov/11897168/,Mental navigation in humans is processed in the anterior bank of the parieto-occipital sulcus.,"Ino T, Inoue Y, Kage M, Hirose S, Kimura T, Fukuyama H",Neuroscience letters,0.166,11897168,-1,-1
parieto_00023,https://pubmed.ncbi.nlm.nih.gov/18582581/,Functional imaging of sensory decline and gain induced by differential noxious stimulation.,"Stammler T, De Col R, Seifert F, Maihofner C",NeuroImage,0.161,18582581,-1,-1
parieto_00024,https://pubmed.ncbi.nlm.nih.gov/23523811/,Contributive sources analysis: a measure of neural networks' contribution to brain activations.,"Beldzik E, Domagalik A, Daselaar S, Fafrowicz M, Froncisz W, Oginska H, Marek T",NeuroImage,0.158,23523811,-1,-1
parieto_00025,https://pubmed.ncbi.nlm.nih.gov/21130531/,Aging-related changes of neural mechanisms underlying visual-spatial working memory.,"Piefke M, Onur OA, Fink GR",Neurobiology of aging,0.156,21130531,-1,-1
parieto_00026,https://pubmed.ncbi.nlm.nih.gov/19780042/,Sensory-motor brain network connectivity for speech comprehension.,"Londei A, D'Ausilio A, Basso D, Sestieri C, Gratta CD, Romani GL, Belardinelli MO",Human brain mapping,0.154,19780042,-1,-1
parieto_00027,https://pubmed.ncbi.nlm.nih.gov/22087089/,Functional development of fronto-striato-parietal networks associated with time perception.,"Smith AB, Giampietro V, Brammer M, Halari R, Simmons A, Rubia K",Frontiers in human neuroscience,0.153,22087089,-1,-1
parieto_00028,https://pubmed.ncbi.nlm.nih.gov/20034998/,Sensitivity of human visual and vestibular cortical regions to egomotion-compatible visual stimulation.,"Cardin V, Smith AT","Cerebral cortex (New York, N.Y. : 1991)",0.148,20034998,-1,-1
parieto_00029,https://pubmed.ncbi.nlm.nih.gov/24643507/,Green tea extract enhances parieto-frontal connectivity during working memory processing.,"Schmidt A, Hammann F, Wolnerhanssen B, Meyer-Gerspach AC, Drewe J, Beglinger C, Borgwardt S",Psychopharmacology,0.148,24643507,-1,-1
parieto_00030,https://pubmed.ncbi.nlm.nih.gov/12507726/,Parieto-frontal networks for clock drawing revealed with fMRI.,"Ino T, Asada T, Ito J, Kimura T, Fukuyama H",Neuroscience research,0.145,12507726,-1,-1
parieto_00031,https://pubmed.ncbi.nlm.nih.gov/22982356/,Dissociation between process-based and data-based limitations for conscious perception in the human brain.,"Han SW, Marois R",NeuroImage,0.14,22982356,-1,-1
parieto_00032,https://pubmed.ncbi.nlm.nih.gov/15907302/,Passive somatosensory discrimination tasks in healthy volunteers: differential networks involved in familiar versus unfamiliar shape and length discrimination.,"Van de Winckel A, Sunaert S, Wenderoth N, Peeters R, Van Hecke P, Feys H, Horemans E, Marchal G, Swinnen SP, Perfetti C, De Weerdt W",NeuroImage,0.139,15907302,-1,-1
parieto_00033,https://pubmed.ncbi.nlm.nih.gov/21795615/,Functional magnetic resonance adaptation reveals the involvement of the dorsomedial stream in hand orientation for grasping.,"Monaco S, Cavina-Pratesi C, Sedda A, Fattori P, Galletti C, Culham JC",Journal of neurophysiology,0.138,21795615,-1,-1
parieto_00034,https://pubmed.ncbi.nlm.nih.gov/28536517/,Differential Recruitment of Parietal Cortex during Spatial and Non-spatial Reach  Planning.,"Bernier PM, Whittingstall K, Grafton ST",Frontiers in human neuroscience,0.137,28536517,-1,-1
parieto_00035,https://pubmed.ncbi.nlm.nih.gov/11160520/,Multisensory cortical signal increases and decreases during vestibular galvanic stimulation (fMRI).,"Bense S, Stephan T, Yousry TA, Brandt T, Dieterich M",Journal of neurophysiology,0.136,11160520,-1,-1
parieto_00036,https://pubmed.ncbi.nlm.nih.gov/21787870/,Phonological manipulation between speech perception and production activates a parieto-frontal circuit.,"Peschke C, Ziegler W, Eisenberger J, Baumgaertner A",NeuroImage,0.135,21787870,-1,-1
parieto_00037,https://pubmed.ncbi.nlm.nih.gov/22561022/,Magneto- and electroencephalographic manifestations of reward anticipation and delivery.,"Donamayor N, Schoenfeld MA, Munte TF",NeuroImage,0.133,22561022,-1,-1
parieto_00038,https://pubmed.ncbi.nlm.nih.gov/25525808/,Self-Recognition of One's Own Fall Recruits the Genuine Bodily Crisis-Related Brain Activity.,"Atomi T, Noriuchi M, Oba K, Atomi Y, Kikuchi Y",PloS one,0.131,25525808,-1,-1
parieto_00039,https://pubmed.ncbi.nlm.nih.gov/12099909/,Posterior parietal cortex control of reach-to-grasp movements in humans.,"Chapman H, Gavrilescu M, Wang H, Kean M, Egan G, Castiello U",The European journal of neuroscience,0.128,12099909,-1,-1
parieto_00040,https://pubmed.ncbi.nlm.nih.gov/20967538/,Two forms of touch perception in the human brain.,"Spitoni GF, Galati G, Antonucci G, Haggard P, Pizzamiglio L",Experimental brain research,0.128,20967538,-1,-1
parieto_00041,https://pubmed.ncbi.nlm.nih.gov/27939793/,Validating an image-based fNIRS approach with fMRI and a working memory task.,"Wijeakumar S, Huppert TJ, Magnotta VA, Buss AT, Spencer JP",NeuroImage,0.128,27939793,10.1016/j.neuroimage.2016.12.007,-1
parieto_00042,https://pubmed.ncbi.nlm.nih.gov/18296073/,Proprioceptive head posture-related processing in human polysensory cortical areas.,"Fasold O, Heinau J, Trenner MU, Villringer A, Wenzel R",NeuroImage,0.127,18296073,10.1016/j.neuroimage.2007.12.060,-1
parieto_00043,https://pubmed.ncbi.nlm.nih.gov/11931748/,Perception of sound-source motion by the human brain.,"Warren JD, Zielinski BA, Green GG, Rauschecker JP, Griffiths TD",Neuron,0.126,11931748,-1,-1
parieto_00044,https://pubmed.ncbi.nlm.nih.gov/16959501/,Posture influences motor imagery: an fMRI study.,"de Lange FP, Helmich RC, Toni I",NeuroImage,0.123,16959501,-1,-1
parieto_00045,https://pubmed.ncbi.nlm.nih.gov/21692148/,Working memory load modulation of parieto-frontal connections: evidence from dynamic causal modeling.,"Ma L, Steinberg JL, Hasan KM, Narayana PA, Kramer LA, Moeller FG",Human brain mapping,0.12,21692148,-1,-1
parieto_00046,https://pubmed.ncbi.nlm.nih.gov/16620884/,Utilizing the ventriloquism-effect to investigate audio-visual binding.,"Bischoff M, Walter B, Blecker CR, Morgen K, Vaitl D, Sammer G",Neuropsychologia,0.119,16620884,-1,-1
parieto_00047,https://pubmed.ncbi.nlm.nih.gov/15091345/,Learning letters in adulthood: direct visualization of cortical plasticity for forming a new link between orthography and phonology.,"Hashimoto R, Sakai KL",Neuron,0.118,15091345,-1,-1
parieto_00048,https://pubmed.ncbi.nlm.nih.gov/21264550/,Neural correlates of personality dimensions and affective measures during the anticipation of emotional stimuli.,"Bruhl AB, Viebke MC, Baumgartner T, Kaffenberger T, Herwig U",Brain imaging and behavior,0.116,21264550,-1,-1
parieto_00049,https://pubmed.ncbi.nlm.nih.gov/22162145/,Neural correlates of creative writing: an fMRI study.,"Shah C, Erhard K, Ortheil HJ, Kaza E, Kessler C, Lotze M",Human brain mapping,0.115,22162145,-1,-1
parieto_00050,https://pubmed.ncbi.nlm.nih.gov/22102437/,The cerebral representation of temporomandibular joint occlusion and its alternation by occlusal splints.,"Lotze M, Lucas C, Domin M, Kordass B",Human brain mapping,0.114,22102437,-1,-1
parieto_00051,https://pubmed.ncbi.nlm.nih.gov/15924866/,Visibility reflects dynamic changes of effective connectivity between V1 and fusiform cortex.,"Haynes JD, Driver J, Rees G",Neuron,0.112,15924866,-1,-1
parieto_00052,https://pubmed.ncbi.nlm.nih.gov/18089297/,Abnormal connections in the supraspinal bladder control network in women with urge urinary incontinence.,"Tadic SD, Griffiths D, Schaefer W, Resnick NM",NeuroImage,0.112,18089297,-1,-1
parieto_00053,https://pubmed.ncbi.nlm.nih.gov/11698133/,Activation during endogenous orienting of visual attention using symbolic pointers in the human parietal and frontal cortices: a functional magnetic resonance imaging study.,"Kato C, Matsuo K, Matsuzawa M, Moriya T, Glover GH, Nakai T",Neuroscience letters,0.111,11698133,-1,-1
parieto_00054,https://pubmed.ncbi.nlm.nih.gov/24069414/,Neural correlates of musical creativity: differences between high and low creative subjects.,"Villarreal MF, Cerquetti D, Caruso S, Schwarcz Lopez Aranguren V, Gerschcovich ER, Frega AL, Leiguarda RC",PloS one,0.111,24069414,-1,-1
parieto_00055,https://pubmed.ncbi.nlm.nih.gov/16597450/,Isolated numerical skills in posterior cortical atrophy--an fMRI study.,"Delazer M, Benke T, Trieb T, Schocke M, Ischebeck A",Neuropsychologia,0.11,16597450,-1,-1
parieto_00056,https://pubmed.ncbi.nlm.nih.gov/19129395/,Dynamic changes in brain activity during prism adaptation.,"Luaute J, Schwartz S, Rossetti Y, Spiridon M, Rode G, Boisson D, Vuilleumier P",The Journal of neuroscience : the official journal of the Society for Neuroscience,0.11,19129395,-1,-1
parieto_00057,https://pubmed.ncbi.nlm.nih.gov/15142955/,Parieto-premotor areas mediate directional interference during bimanual movements.,"Wenderoth N, Debaere F, Sunaert S, van Hecke P, Swinnen SP","Cerebral cortex (New York, N.Y. : 1991)",0.109,15142955,-1,-1
parieto_00058,https://pubmed.ncbi.nlm.nih.gov/19580392/,fMRI activation during observation of others' reach errors.,"Malfait N, Valyear KF, Culham JC, Anton JL, Brown LE, Gribble PL",Journal of cognitive neuroscience,0.107,19580392,-1,-1
parieto_00059,https://pubmed.ncbi.nlm.nih.gov/27477623/,Sensitivity to biomechanical limitations during postural decision-making depends  on the integrity of posterior superior parietal cortex.,"Wood DK, Chouinard PA, Major AJ, Goodale MA",Cortex; a journal devoted to the study of the nervous system and behavior,0.107,27477623,-1,-1
parieto_00060,https://pubmed.ncbi.nlm.nih.gov/16257547/,Ecphory of autobiographical memories: an fMRI study of recent and remote memory retrieval.,"Steinvorth S, Corkin S, Halgren E",NeuroImage,0.106,16257547,-1,-1
parieto_00061,https://pubmed.ncbi.nlm.nih.gov/15809000/,"Language in context: emergent features of word, sentence, and narrative comprehension.","Xu J, Kemeny S, Park G, Frattali C, Braun A",NeuroImage,0.105,15809000,10.1016/j.neuroimage.2004.12.013,-1
parieto_00062,https://pubmed.ncbi.nlm.nih.gov/15852384/,Tactile discrimination of grating orientation: fMRI activation patterns.,"Zhang M, Mariola E, Stilla R, Stoesz M, Mao H, Hu X, Sathian K",Human brain mapping,0.105,15852384,10.1002/hbm.20107,-1
parieto_00063,https://pubmed.ncbi.nlm.nih.gov/18183378/,Differences in saccade-evoked brain activation patterns with eyes open or eyes closed in complete darkness.,"Hufner K, Stephan T, Glasauer S, Kalla R, Riedel E, Deutschlander A, Dera T, Wiesmann M, Strupp M, Brandt T",Experimental brain research,0.103,18183378,10.1007/s00221-007-1247-y,-1
parieto_00064,https://pubmed.ncbi.nlm.nih.gov/20602092/,Representing actions through their sound.,"Aglioti SM, Pazzaglia M",Experimental brain research,0.102,20602092,-1,-1
parieto_00065,https://pubmed.ncbi.nlm.nih.gov/18778780/,Piecemeal recruitment of left-lateralized brain areas during reading: a spatio-functional account.,"Levy J, Pernet C, Treserras S, Boulanouar K, Berry I, Aubry F, Demonet JF, Celsis P",NeuroImage,0.101,18778780,-1,-1
parieto_00066,https://pubmed.ncbi.nlm.nih.gov/28911803/,Sensory overload and imbalance: Resting-state vestibular connectivity in PTSD and its dissociative subtype.,"Harricharan S, Nicholson AA, Densmore M, Theberge J, McKinnon MC, Neufeld RWJ, Lanius RA",Neuropsychologia,0.101,28911803,-1,-1
parieto_00067,https://pubmed.ncbi.nlm.nih.gov/19967769/,Impact of the virtual reality on the neural representation of an environment.,"Mellet E, Laou L, Petit L, Zago L, Mazoyer B, Tzourio-Mazoyer N",Human brain mapping,0.1,19967769,-1,-1
parieto_00068,https://pubmed.ncbi.nlm.nih.gov/16530885/,Mild cognitive impairment (MCI) and actual retrieval performance affect cerebral  activation in the elderly.,"Heun R, Freymann K, Erb M, Leube DT, Jessen F, Kircher TT, Grodd W",Neurobiology of aging,0.099,16530885,-1,-1
parieto_00069,https://pubmed.ncbi.nlm.nih.gov/19324533/,The neural basis of visuospatial perception in Alzheimer's disease and healthy elderly comparison subjects: an fMRI study.,"Thiyagesh SN, Farrow TF, Parks RW, Accosta-Mesa H, Young C, Wilkinson ID, Hunter MD, Woodruff PW",Psychiatry research,0.099,19324533,-1,-1
parieto_00070,https://pubmed.ncbi.nlm.nih.gov/22708629/,The morphology and variability of the caudal rami of the superior temporal sulcus.,"Segal E, Petrides M",The European journal of neuroscience,0.099,22708629,-1,-1
parieto_00071,https://pubmed.ncbi.nlm.nih.gov/18835075/,Developmental shifts in fMRI activations during visuospatial relational reasoning.,"Eslinger PJ, Blair C, Wang J, Lipovsky B, Realmuto J, Baker D, Thorne S, Gamson D, Zimmerman E, Rohrer L, Yang QX",Brain and cognition,0.097,18835075,-1,-1
parieto_00072,https://pubmed.ncbi.nlm.nih.gov/23675819/,Repetition priming effects dissociate between miniature eye movements and induced gamma-band responses in the human electroencephalogram.,"Hassler U, Friese U, Martens U, Trujillo-Barreto N, Gruber T",The European journal of neuroscience,0.097,23675819,-1,-1
parieto_00073,https://pubmed.ncbi.nlm.nih.gov/17761331/,"Personality, gender and brain oscillations.","Jausovec N, Jausovec K",International journal of psychophysiology : official journal of the International Organization of Psychophysiology,0.096,17761331,-1,-1
parieto_00074,https://pubmed.ncbi.nlm.nih.gov/21092865/,Human posterior parietal cortex flexibly determines reference frames for reaching based on sensory context.,"Bernier PM, Grafton ST",Neuron,0.095,21092865,-1,-1
parieto_00075,https://pubmed.ncbi.nlm.nih.gov/23484034/,Activation of midbrain and ventral striatal regions implicates salience processing during a modified beads task.,"Esslinger C, Braun U, Schirmbeck F, Santos A, Meyer-Lindenberg A, Zink M, Kirsch P",PloS one,0.095,23484034,-1,-1
parieto_00076,https://pubmed.ncbi.nlm.nih.gov/25552315/,Structural and functional connectivity mapping of the vestibular circuitry from human brainstem to cortex.,"Kirsch V, Keeser D, Hergenroeder T, Erat O, Ertl-Wagner B, Brandt T, Dieterich M",Brain structure & function,0.094,25552315,-1,-1
parieto_00077,https://pubmed.ncbi.nlm.nih.gov/16337921/,Two cortical systems for reaching in central and peripheral vision.,"Prado J, Clavagnier S, Otzenberger H, Scheiber C, Kennedy H, Perenin MT",Neuron,0.093,16337921,-1,-1
parieto_00078,https://pubmed.ncbi.nlm.nih.gov/18325789/,Effects of shifting perspective of the self: an fMRI study.,"Corradi-Dell'acqua C, Ueno K, Ogawa A, Cheng K, Rumiati RI, Iriki A",NeuroImage,0.093,18325789,-1,-1
parieto_00079,https://pubmed.ncbi.nlm.nih.gov/22705376/,Neural networks related to pro-saccades and anti-saccades revealed by independent component analysis.,"Domagalik A, Beldzik E, Fafrowicz M, Oginska H, Marek T",NeuroImage,0.093,22705376,-1,-1
parieto_00080,https://pubmed.ncbi.nlm.nih.gov/25972116/,Distinct and common cerebral activation changes during mental time travel in relapsing-remitting multiple sclerosis patients.,"Ernst A, Noblet V, Denkova E, Blanc F, De Seze J, Gounot D, Manning L",Brain imaging and behavior,0.093,25972116,-1,-1
parieto_00081,https://pubmed.ncbi.nlm.nih.gov/28957750/,Comparing abnormalities of amplitude of low-frequency fluctuations in multiple system atrophy and idiopathic Parkinson's disease measured with resting-state fMRI.,"Wang N, Edmiston EK, Luo X, Yang H, Chang M, Wang F, Fan G",Psychiatry research. Neuroimaging,0.093,28957750,10.1016/j.pscychresns.2017.09.002,-1
parieto_00082,https://pubmed.ncbi.nlm.nih.gov/16192397/,Configural processing of biological motion in human superior temporal sulcus.,"Thompson JC, Clarke M, Stewart T, Puce A",The Journal of neuroscience : the official journal of the Society for Neuroscience,0.092,16192397,10.1523/JNEUROSCI.2129-05.2005,-1
parieto_00083,https://pubmed.ncbi.nlm.nih.gov/22038714/,Dissociation of brain areas associated with force production and stabilization during manipulation of unstable objects.,"Holmstrom L, de Manzano O, Vollmer B, Forsman L, Valero-Cuevas FJ, Ullen F, Forssberg H",Experimental brain research,0.092,22038714,-1,-1
parieto_00084,https://pubmed.ncbi.nlm.nih.gov/21108990/,Regional homogeneity of the resting-state brain activity correlates with individual intelligence.,"Wang L, Song M, Jiang T, Zhang Y, Yu C",Neuroscience letters,0.091,21108990,-1,-1
parieto_00085,https://pubmed.ncbi.nlm.nih.gov/15808999/,Dissociable brain activations during the retrieval of different kinds of spatial  context memory.,"Suzuki M, Tsukiura T, Matsue Y, Yamadori A, Fujii T",NeuroImage,0.09,15808999,-1,-1
parieto_00086,https://pubmed.ncbi.nlm.nih.gov/28811257/,Auditory conflict and congruence in frontotemporal dementia.,"Clark CN, Nicholas JM, Agustus JL, Hardy CJD, Russell LL, Brotherhood EV, Dick KM, Marshall CR, Mummery CJ, Rohrer JD, Warren JD",Neuropsychologia,0.09,28811257,-1,-1
parieto_00087,https://pubmed.ncbi.nlm.nih.gov/18165283/,Dissociated pathways for successful memory retrieval from the human parietal cortex: anatomical and functional connectivity analyses.,"Takahashi E, Ohki K, Kim DS","Cerebral cortex (New York, N.Y. : 1991)",0.087,18165283,-1,-1
parieto_00088,https://pubmed.ncbi.nlm.nih.gov/18708149/,Developmental changes in neural activation and psychophysiological interaction patterns of brain regions associated with interference control and time perception.,"Neufang S, Fink GR, Herpertz-Dahlmann B, Willmes K, Konrad K",NeuroImage,0.087,18708149,-1,-1
parieto_00089,https://pubmed.ncbi.nlm.nih.gov/20685975/,Functional magnetic resonance imaging reveals the neural substrates of arm transport and grip formation in reach-to-grasp actions in humans.,"Cavina-Pratesi C, Monaco S, Fattori P, Galletti C, McAdam TD, Quinlan DJ, Goodale MA, Culham JC",The Journal of neuroscience : the official journal of the Society for Neuroscience,0.087,20685975,-1,-1
parieto_00090,https://pubmed.ncbi.nlm.nih.gov/20888872/,fMRI of patients with social anxiety disorder during a social situation task.,"Nakao T, Sanematsu H, Yoshiura T, Togao O, Murayama K, Tomita M, Masuda Y, Kanba S",Neuroscience research,0.087,20888872,-1,-1
parieto_00091,https://pubmed.ncbi.nlm.nih.gov/23770124/,The neural substrates of the warning effect: a functional magnetic resonance imaging study.,"Yoshida Y, Tanabe HC, Hayashi MJ, Kawamichi H, Kochiyama T, Sadato N",Neuroscience research,0.087,23770124,10.1016/j.neures.2013.05.008,-1
parieto_00092,https://pubmed.ncbi.nlm.nih.gov/12077201/,"The spatiotemporal dynamics of illusory contour processing: combined high-density electrical mapping, source analysis, and functional magnetic resonance imaging.","Murray MM, Wylie GR, Higgins BA, Javitt DC, Schroeder CE, Foxe JJ",The Journal of neuroscience : the official journal of the Society for Neuroscience,0.086,12077201,10.1523/JNEUROSCI.22-12-05055.2002,-1
parieto_00093,https://pubmed.ncbi.nlm.nih.gov/18053746/,Model-free characterization of brain functional networks for motor sequence learning using fMRI.,"Tamas Kincses Z, Johansen-Berg H, Tomassini V, Bosnell R, Matthews PM, Beckmann CF",NeuroImage,0.086,18053746,10.1016/j.neuroimage.2007.09.070,-1
parieto_00094,https://pubmed.ncbi.nlm.nih.gov/23285136/,FMRI resting slow fluctuations correlate with the activity of fast cortico-cortical physiological connections.,"Koch G, Bozzali M, Bonni S, Giacobbe V, Caltagirone C, Cercignani M",PloS one,0.086,23285136,-1,-1
parieto_00095,https://pubmed.ncbi.nlm.nih.gov/25045065/,Functional correlates of cognitive dysfunction in multiple sclerosis: A multicenter fMRI Study.,"Rocca MA, Valsasina P, Hulst HE, Abdel-Aziz K, Enzinger C, Gallo A, Pareto D, Riccitelli G, Muhlert N, Ciccarelli O, Barkhof F, Fazekas F, Tedeschi G, Arevalo MJ, Filippi M",Human brain mapping,0.086,25045065,-1,-1
parieto_00096,https://pubmed.ncbi.nlm.nih.gov/19058914/,Differential brain activation associated with laser-evoked burning and pricking pain: An event-related fMRI study.,"Veldhuijzen DS, Nemenov MI, Keaser M, Zhuo J, Gullapalli RP, Greenspan JD",Pain,0.085,19058914,-1,-1
parieto_00097,https://pubmed.ncbi.nlm.nih.gov/24661911/,Abnormal functional connectivity density in children with anisometropic amblyopia at resting-state.,"Wang T, Li Q, Guo M, Peng Y, Li Q, Qin W, Yu C",Brain research,0.085,24661911,-1,-1
