paper_name,paper_url,Title,Author,Journal,Loading,PMID,Doi,download_status
parieto_00098,https://pubmed.ncbi.nlm.nih.gov/25078102/,Baseline frontostriatal-limbic connectivity predicts reward-based memory formation.,"Hamann JM, Dayan E, Hummel FC, Cohen LG",Human brain mapping,0.085,25078102,-1,-1
parieto_00099,https://pubmed.ncbi.nlm.nih.gov/25762672/,Neural substrates underlying the passive observation and active control of translational egomotion.,"Huang RS, Chen CF, Sereno MI",The Journal of neuroscience : the official journal of the Society for Neuroscience,0.085,25762672,-1,-1
parieto_00100,https://pubmed.ncbi.nlm.nih.gov/16806311/,The special involvement of the rostrolateral prefrontal cortex in planning abilities: an event-related fMRI study with the Tower of London paradigm.,"Wagner G, Koch K, Reichenbach JR, Sauer H, Schlosser RG",Neuropsychologia,0.084,16806311,-1,-1
parieto_00101,https://pubmed.ncbi.nlm.nih.gov/19890846/,Cortical representation of verbs with optional complements: the theoretical contribution of fMRI.,"Shetreet E, Friedmann N, Hadar U",Human brain mapping,0.084,19890846,-1,-1
parieto_00102,https://pubmed.ncbi.nlm.nih.gov/19925207/,The commonality of neural networks for verbal and visual short-term memory.,"Majerus S, D'Argembeau A, Martinez Perez T, Belayachi S, Van der Linden M, Collette F, Salmon E, Seurinck R, Fias W, Maquet P",Journal of cognitive neuroscience,0.084,19925207,-1,-1
parieto_00103,https://pubmed.ncbi.nlm.nih.gov/22203319/,Methylphenidate modulates sustained attention and cortical activation in survivors of traumatic brain injury: a perfusion fMRI study.,"Kim J, Whyte J, Patel S, Europa E, Wang J, Coslett HB, Detre JA",Psychopharmacology,0.084,22203319,-1,-1
parieto_00104,https://pubmed.ncbi.nlm.nih.gov/22555622/,The modulation of venlafaxine on cortical activation of language area in healthy  subjects with fMRI study.,"Xie Q, Liu Y, Li CY, Song XZ, Wang J, Han LX, Bai HM",Psychopharmacology,0.084,22555622,-1,-1
parieto_00105,https://pubmed.ncbi.nlm.nih.gov/25300959/,Interaction of brain areas of visual and vestibular simultaneous activity with fMRI.,"Della-Justina HM, Gamba HR, Lukasova K, Nucci-da-Silva MP, Winkler AM, Amaro E Jr",Experimental brain research,0.084,25300959,-1,-1
parieto_00106,https://pubmed.ncbi.nlm.nih.gov/17448450/,The influence of olfactory-induced negative emotion on verbal working memory: individual differences in neurobehavioral findings.,"Habel U, Koch K, Pauly K, Kellermann T, Reske M, Backes V, Seiferth NY, Stocker T, Kircher T, Amunts K, Jon Shah N, Schneider F",Brain research,0.083,17448450,-1,-1
parieto_00107,https://pubmed.ncbi.nlm.nih.gov/20832486/,The neural network sustaining the crossmodal processing of human gender from faces and voices: an fMRI study.,"Joassin F, Maurage P, Campanella S",NeuroImage,0.083,20832486,-1,-1
parieto_00108,https://pubmed.ncbi.nlm.nih.gov/21256186/,Brain activity associated with recognition of appropriate action selection based  on allocentric perspectives.,"Shibata H, Inui T",Neuroscience letters,0.083,21256186,-1,-1
parieto_00109,https://pubmed.ncbi.nlm.nih.gov/24727703/,Sustained attention to spontaneous thumb sensations activates brain somatosensory and other proprioceptive areas.,"Bauer CC, Diaz JL, Concha L, Barrios FA",Brain and cognition,0.083,24727703,-1,-1
parieto_00110,https://pubmed.ncbi.nlm.nih.gov/29666567/,The Neural Correlates of Grasping in Left-Handers: When Handedness Does Not Matter.,"Begliomini C, Sartori L, Di Bono MG, Budisavljevic S, Castiello U",Frontiers in neuroscience,0.083,29666567,-1,-1
parieto_00111,https://pubmed.ncbi.nlm.nih.gov/16466679/,Information processing in human parieto-frontal circuits during goal-directed bimanual movements.,"Wenderoth N, Toni I, Bedeleem S, Debaere F, Swinnen SP",NeuroImage,0.082,16466679,10.1016/j.neuroimage.2005.11.033,-1
parieto_00112,https://pubmed.ncbi.nlm.nih.gov/20302951/,Recomposing a fragmented literature: how conditional and relational arguments engage different neural systems for deductive reasoning.,"Prado J, Van Der Henst JB, Noveck IA",NeuroImage,0.082,20302951,10.1016/j.neuroimage.2010.03.026,-1
parieto_00113,https://pubmed.ncbi.nlm.nih.gov/23395849/,Network Connectivity and Individual Responses to Brain Stimulation in the Human Motor System.,"Cardenas-Morales L, Volz LJ, Michely J, Rehme AK, Pool EM, Nettekoven C, Eickhoff SB, Fink GR, Grefkes C","Cerebral cortex (New York, N.Y. : 1991)",0.082,23395849,10.1093/cercor/bht023,-1
parieto_00114,https://pubmed.ncbi.nlm.nih.gov/25228872/,An investigation of the neural circuits underlying reaching and reach-to-grasp movements: from planning to execution.,"Begliomini C, De Sanctis T, Marangon M, Tarantino V, Sartori L, Miotto D, Motta R, Stramare R, Castiello U",Frontiers in human neuroscience,0.082,25228872,-1,-1
parieto_00115,https://pubmed.ncbi.nlm.nih.gov/25904155/,The alterations in regional homogeneity of parieto-cingulate and temporo-cerebellum regions of first-episode medication-naive depression patients.,"Lai CH, Wu YT",Brain imaging and behavior,0.082,25904155,-1,-1
parieto_00116,https://pubmed.ncbi.nlm.nih.gov/18644454/,Neural correlates of hemispheric dominance and ipsilaterality within the vestibular system.,"Janzen J, Schlindwein P, Bense S, Bauermann T, Vucurevic G, Stoeter P, Dieterich M",NeuroImage,0.081,18644454,-1,-1
parieto_00117,https://pubmed.ncbi.nlm.nih.gov/16162854/,Evidence for separate perceptual reactivation and search processes during remembering.,"Wheeler ME, Shulman GL, Buckner RL, Miezin FM, Velanova K, Petersen SE","Cerebral cortex (New York, N.Y. : 1991)",0.08,16162854,-1,-1
parieto_00118,https://pubmed.ncbi.nlm.nih.gov/22768085/,Neural network development in late adolescents during observation of risk-taking  action.,"Tamura M, Moriguchi Y, Higuchi S, Hida A, Enomoto M, Umezawa J, Mishima K",PloS one,0.08,22768085,-1,-1
parieto_00119,https://pubmed.ncbi.nlm.nih.gov/27312746/,Understanding the internal states of others by listening to action verbs.,"Di Cesare G, Fasano F, Errante A, Marchi M, Rizzolatti G",Neuropsychologia,0.08,27312746,-1,-1
parieto_00120,https://pubmed.ncbi.nlm.nih.gov/28323166/,Neural foundations of overt and covert actions.,"Simos PG, Kavroulakis E, Maris T, Papadaki E, Boursianis T, Kalaitzakis G, Savaki HE",NeuroImage,0.08,28323166,-1,-1
parieto_00121,https://pubmed.ncbi.nlm.nih.gov/17493834/,Gaze fixations predict brain activation during the voluntary regulation of picture-induced negative affect.,"van Reekum CM, Johnstone T, Urry HL, Thurow ME, Schaefer HS, Alexander AL, Davidson RJ",NeuroImage,0.079,17493834,-1,-1
parieto_00122,https://pubmed.ncbi.nlm.nih.gov/22634854/,Common substrate for mental arithmetic and finger representation in the parietal  cortex.,"Andres M, Michaux N, Pesenti M",NeuroImage,0.079,22634854,-1,-1
parieto_00123,https://pubmed.ncbi.nlm.nih.gov/24663382/,Interplay Between Conceptual Expectations and Movement Predictions Underlies Action Understanding.,"Ondobaka S, de Lange FP, Wittmann M, Frith CD, Bekkering H","Cerebral cortex (New York, N.Y. : 1991)",0.079,24663382,-1,-1
parieto_00124,https://pubmed.ncbi.nlm.nih.gov/17398117/,fMRI reveals a preference for near viewing in the human parieto-occipital cortex.,"Quinlan DJ, Culham JC",NeuroImage,0.078,17398117,-1,-1
parieto_00125,https://pubmed.ncbi.nlm.nih.gov/21880905/,Training-induced neural plasticity in golf novices.,"Bezzola L, Merillat S, Gaser C, Jancke L",The Journal of neuroscience : the official journal of the Society for Neuroscience,0.078,21880905,-1,-1
parieto_00126,https://pubmed.ncbi.nlm.nih.gov/24688464/,"Differential hippocampal and retrosplenial involvement in egocentric-updating, rotation, and allocentric processing during online spatial encoding: an fMRI study.","Gomez A, Cerles M, Rousset S, Remy C, Baciu M",Frontiers in human neuroscience,0.078,24688464,-1,-1
parieto_00127,https://pubmed.ncbi.nlm.nih.gov/26385540/,Aberrant functional connectivity of resting state networks associated with trait  anxiety.,"Modi S, Kumar M, Kumar P, Khushu S",Psychiatry research,0.078,26385540,-1,-1
parieto_00128,https://pubmed.ncbi.nlm.nih.gov/19925200/,Human anterior intraparietal and ventral premotor cortices support representations of grasping with the hand or a novel tool.,"Jacobs S, Danielmeier C, Frey SH",Journal of cognitive neuroscience,0.077,19925200,-1,-1
parieto_00129,https://pubmed.ncbi.nlm.nih.gov/21276432/,fMRI correlates of working memory: specific posterior representation sites for motion and position information.,"Umla-Runge K, Zimmer HD, Krick CM, Reith W",Brain research,0.077,21276432,-1,-1
parieto_00130,https://pubmed.ncbi.nlm.nih.gov/23335893/,Neural correlates of the behavioral-autonomic interaction response to potentially threatening stimuli.,"Farrow TF, Johnson NK, Hunter MD, Barker AT, Wilkinson ID, Woodruff PW",Frontiers in human neuroscience,0.076,23335893,-1,-1
parieto_00131,https://pubmed.ncbi.nlm.nih.gov/23727173/,Specific frequency band of amplitude low-frequency fl uctuation predicts Parkinson's disease.,"Zhang J, Wei L, Hu X, Zhang Y, Zhou D, Li C, Wang X, Feng H, Yin X, Xie B, Wang J",Behavioural brain research,0.076,23727173,10.1016/j.bbr.2013.05.039,-1
parieto_00132,https://pubmed.ncbi.nlm.nih.gov/11549616/,Human cortical networks for new and familiar sequences of saccades.,"Grosbras MH, Leonards U, Lobel E, Poline JB, LeBihan D, Berthoz A","Cerebral cortex (New York, N.Y. : 1991)",0.075,11549616,10.1093/cercor/11.10.936,-1
parieto_00133,https://pubmed.ncbi.nlm.nih.gov/18514745/,Gender-specific strategy use and neural correlates in a spatial perspective taking task.,"Kaiser S, Walther S, Nennig E, Kronmuller K, Mundt C, Weisbrod M, Stippich C, Vogeley K",Neuropsychologia,0.075,18514745,-1,-1
parieto_00134,https://pubmed.ncbi.nlm.nih.gov/21500317/,Spatiotemporal brain mapping of spatial attention effects on pattern-reversal ERPs.,"Di Russo F, Stella A, Spitoni G, Strappini F, Sdoia S, Galati G, Hillyard SA, Spinelli D, Pitzalis S",Human brain mapping,0.075,21500317,-1,-1
parieto_00135,https://pubmed.ncbi.nlm.nih.gov/22576840/,The neural substrate for working memory of tactile surface texture.,"Kaas AL, van Mier H, Visser M, Goebel R",Human brain mapping,0.075,22576840,-1,-1
parieto_00136,https://pubmed.ncbi.nlm.nih.gov/26696853/,Role of the Insula and Vestibular System in Patients with Chronic Subjective Dizziness: An fMRI Study Using Sound-Evoked Vestibular Stimulation.,"Indovina I, Riccelli R, Chiarella G, Petrolo C, Augimeri A, Giofre L, Lacquaniti F, Staab JP, Passamonti L",Frontiers in behavioral neuroscience,0.075,26696853,-1,-1
parieto_00137,https://pubmed.ncbi.nlm.nih.gov/19393745/,Brain pathways of verbal working memory: a lesion-function correlation study.,"Sepulcre J, Masdeu JC, Pastor MA, Goni J, Barbosa C, Bejarano B, Villoslada P",NeuroImage,0.074,19393745,-1,-1
parieto_00138,https://pubmed.ncbi.nlm.nih.gov/17689504/,Impact of individual cognitive profile on visuo-motor reorganization in relapsing-remitting multiple sclerosis.,"Gioia MC, Cerasa A, Liguori M, Passamonti L, Condino F, Vercillo L, Valentino P, Clodomiro A, Quattrone A, Fera F",Brain research,0.073,17689504,-1,-1
parieto_00139,https://pubmed.ncbi.nlm.nih.gov/18603609/,Pitch processing sites in the human auditory brain.,"Hall DA, Plack CJ","Cerebral cortex (New York, N.Y. : 1991)",0.073,18603609,-1,-1
parieto_00140,https://pubmed.ncbi.nlm.nih.gov/18973817/,Cortical midline involvement in autobiographical memory.,"Summerfield JJ, Hassabis D, Maguire EA",NeuroImage,0.073,18973817,-1,-1
parieto_00141,https://pubmed.ncbi.nlm.nih.gov/26942317/,Trial-to-trial Adaptation: Parsing out the Roles of Cerebellum and BG in Predictive Motor Timing.,"Lungu OV, Bares M, Liu T, Gomez CM, Cechova I, Ashe J",Journal of cognitive neuroscience,0.073,26942317,-1,-1
parieto_00142,https://pubmed.ncbi.nlm.nih.gov/17499172/,Functional dissociation of saccade and hand reaching control with bilateral lesions of the medial wall of the intraparietal sulcus: implications for optic ataxia.,"Trillenberg P, Sprenger A, Petersen D, Kompf D, Heide W, Helmchen C",NeuroImage,0.072,17499172,-1,-1
parieto_00143,https://pubmed.ncbi.nlm.nih.gov/12763188/,Tactile-visual cross-modal shape matching: a functional MRI study.,"Saito DN, Okada T, Morita Y, Yonekura Y, Sadato N",Brain research. Cognitive brain research,0.071,12763188,-1,-1
parieto_00144,https://pubmed.ncbi.nlm.nih.gov/16806977/,Multiple brain networks for visual self-recognition with different sensitivity for motion and body part.,"Sugiura M, Sassa Y, Jeong H, Miura N, Akitsuki Y, Horie K, Sato S, Kawashima R",NeuroImage,0.071,16806977,-1,-1
parieto_00145,https://pubmed.ncbi.nlm.nih.gov/22985694/,Impairment in semantic retrieval is associated with symptoms in schizophrenia but not bipolar disorder.,"Jamadar S, O'Neil KM, Pearlson GD, Ansari M, Gill A, Jagannathan K, Assaf M",Biological psychiatry,0.071,22985694,-1,-1
parieto_00146,https://pubmed.ncbi.nlm.nih.gov/28708977/,Relative cortico-subcortical shift in brain activity but preserved training-induced neural modulation in older adults during bimanual motor learning.,"Santos Monteiro T, Beets IAM, Boisgontier MP, Gooijers J, Pauwels L, Chalavi S, King B, Albouy G, Swinnen SP",Neurobiology of aging,0.071,28708977,-1,-1
parieto_00147,https://pubmed.ncbi.nlm.nih.gov/19646536/,Imagery of a moving object: the role of occipital cortex and human MT/V5+.,"Kaas A, Weigelt S, Roebroeck A, Kohler A, Muckli L",NeuroImage,0.07,19646536,-1,-1
parieto_00148,https://pubmed.ncbi.nlm.nih.gov/21415916/,Fluid intelligence allows flexible recruitment of the parieto-frontal network in  analogical reasoning.,"Preusse F, van der Meer Elke, Deshpande G, Krueger F, Wartenburger I",Frontiers in human neuroscience,0.07,21415916,-1,-1
parieto_00149,https://pubmed.ncbi.nlm.nih.gov/22119654/,Role of hippocampal CA1 atrophy in memory encoding deficits in amnestic Mild Cognitive Impairment.,"Fouquet M, Desgranges B, La Joie R, Riviere D, Mangin JF, Landeau B, Mezenge F, Pelerin A, de La Sayette V, Viader F, Baron JC, Eustache F, Chetelat G",NeuroImage,0.07,22119654,-1,-1
parieto_00150,https://pubmed.ncbi.nlm.nih.gov/12574485/,Neural networks for the coordination of the hands in time.,"Ullen F, Forssberg H, Ehrsson HH",Journal of neurophysiology,0.069,12574485,-1,-1
parieto_00151,https://pubmed.ncbi.nlm.nih.gov/19620139/,Reading epilepsy from the dominant temporo-occipital region.,"Gavaret M, Guedj E, Koessler L, Trebuchon-Da Fonseca A, Aubert S, Mundler O, Chauvel P, Bartolomei F","Journal of neurology, neurosurgery, and psychiatry",0.069,19620139,10.1136/jnnp.2009.175935,-1
parieto_00152,https://pubmed.ncbi.nlm.nih.gov/21601434/,Fronto-striatal underactivation during interference inhibition and attention allocation in grown up children with attention deficit/hyperactivity disorder and persistent symptoms.,"Cubillo A, Halari R, Giampietro V, Taylor E, Rubia K",Psychiatry research,0.069,21601434,10.1016/j.pscychresns.2010.12.014,-1
parieto_00153,https://pubmed.ncbi.nlm.nih.gov/23457466/,Dissociating memory networks in early Alzheimer's disease and frontotemporal lobar degeneration - a combined study of hypometabolism and atrophy.,"Frisch S, Dukart J, Vogt B, Horstmann A, Becker G, Villringer A, Barthel H, Sabri O, Muller K, Schroeter ML",PloS one,0.069,23457466,-1,-1
parieto_00154,https://pubmed.ncbi.nlm.nih.gov/27553438/,Dorso-medial and ventro-lateral functional specialization of the human retrosplenial complex in spatial updating and orienting.,"Burles F, Slone E, Iaria G",Brain structure & function,0.069,27553438,-1,-1
parieto_00155,https://pubmed.ncbi.nlm.nih.gov/28701942/,Neural Mechanisms Underlying Conscious and Unconscious Gaze-Triggered Attentional Orienting in Autism Spectrum Disorder.,"Sato W, Kochiyama T, Uono S, Yoshimura S, Toichi M",Frontiers in human neuroscience,0.069,28701942,-1,-1
parieto_00156,https://pubmed.ncbi.nlm.nih.gov/16647086/,"Reduced thalamic and cerebellar rest metabolism in relapsing-remitting multiple sclerosis, a positron emission tomography study: correlations to lesion load.","Derache N, Marie RM, Constans JM, Defer GL",Journal of the neurological sciences,0.068,16647086,-1,-1
parieto_00157,https://pubmed.ncbi.nlm.nih.gov/19874854/,The effects of BDNF Val66Met polymorphism on brain function in controls and patients with multiple sclerosis: an imaging genetic study.,"Cerasa A, Tongiorgi E, Fera F, Gioia MC, Valentino P, Liguori M, Manna I, Zito G, Passamonti L, Nistico R, Quattrone A",Behavioural brain research,0.068,19874854,-1,-1
parieto_00158,https://pubmed.ncbi.nlm.nih.gov/23251130/,Imaging the neural mechanisms of TMS neglect-like bias in healthy volunteers with the interleaved TMS/fMRI technique: preliminary evidence.,"Ricci R, Salatino A, Li X, Funk AP, Logan SL, Mu Q, Johnson KA, Bohning DE, George MS",Frontiers in human neuroscience,0.067,23251130,-1,-1
parieto_00159,https://pubmed.ncbi.nlm.nih.gov/22558222/,Spatio-temporal brain mapping of motion-onset VEPs combined with fMRI and retinotopic maps.,"Pitzalis S, Strappini F, De Gasperis M, Bultrini A, Di Russo F",PloS one,0.066,22558222,-1,-1
parieto_00160,https://pubmed.ncbi.nlm.nih.gov/23791837/,General fluid-type intelligence is related to indices of white matter structure in middle-aged and old adults.,"Haasz J, Westlye ET, Fjaer S, Espeseth T, Lundervold A, Lundervold AJ",NeuroImage,0.066,23791837,-1,-1
parieto_00161,https://pubmed.ncbi.nlm.nih.gov/25281309/,Neuronal substrates of Corsi Block span: Lesion symptom mapping analyses in relation to attentional competition and spatial bias.,"Chechlacz M, Rotshtein P, Humphreys GW",Neuropsychologia,0.066,25281309,-1,-1
parieto_00162,https://pubmed.ncbi.nlm.nih.gov/17449320/,fMRI of peripheral visual field representation.,"Stenbacka L, Vanni S",Clinical neurophysiology : official journal of the International Federation of Clinical Neurophysiology,0.065,17449320,-1,-1
parieto_00163,https://pubmed.ncbi.nlm.nih.gov/22446489/,"A dual-subsystem model of the brain's default network: self-referential processing, memory retrieval processes, and autobiographical memory retrieval.",Kim H,NeuroImage,0.065,22446489,-1,-1
parieto_00164,https://pubmed.ncbi.nlm.nih.gov/16275018/,Dissociable networks for the expectancy and perception of emotional stimuli in the human brain.,"Bermpohl F, Pascual-Leone A, Amedi A, Merabet LB, Fregni F, Gaab N, Alsop D, Schlaug G, Northoff G",NeuroImage,0.063,16275018,-1,-1
parieto_00165,https://pubmed.ncbi.nlm.nih.gov/16343560/,Mapping the parietal cortex of human and non-human primates.,"Orban GA, Claeys K, Nelissen K, Smans R, Sunaert S, Todd JT, Wardak C, Durand JB, Vanduffel W",Neuropsychologia,0.063,16343560,-1,-1
parieto_00166,https://pubmed.ncbi.nlm.nih.gov/20188841/,Effects of age and sex on developmental neural networks of visual-spatial attention allocation.,"Rubia K, Hyde Z, Halari R, Giampietro V, Smith A",NeuroImage,0.063,20188841,-1,-1
parieto_00167,https://pubmed.ncbi.nlm.nih.gov/24828639/,Dose-Dependent Effects of Theta Burst rTMS on Cortical Excitability and Resting-State Connectivity of the Human Motor System.,"Nettekoven C, Volz LJ, Kutscha M, Pool EM, Rehme AK, Eickhoff SB, Fink GR, Grefkes C",The Journal of neuroscience : the official journal of the Society for Neuroscience,0.063,24828639,-1,-1
parieto_00168,https://pubmed.ncbi.nlm.nih.gov/25208743/,Common neural correlates of intertemporal choices and intelligence in adolescents.,"Ripke S, Hubner T, Mennigen E, Muller KU, Li SC, Smolka MN",Journal of cognitive neuroscience,0.063,25208743,-1,-1
parieto_00169,https://pubmed.ncbi.nlm.nih.gov/12902399/,Dominance for vestibular cortical function in the non-dominant hemisphere.,"Dieterich M, Bense S, Lutz S, Drzezga A, Stephan T, Bartenstein P, Brandt T","Cerebral cortex (New York, N.Y. : 1991)",0.062,12902399,-1,-1
parieto_00170,https://pubmed.ncbi.nlm.nih.gov/18037455/,Is there continuity between categorical and coordinate spatial relations coding?  Evidence from a grid/no-grid working memory paradigm.,"Martin R, Houssemand C, Schiltz C, Burnod Y, Alexandre F",Neuropsychologia,0.062,18037455,-1,-1
parieto_00171,https://pubmed.ncbi.nlm.nih.gov/25632119/,Left dorsal speech stream components and their contribution to phonological processing.,"Murakami T, Kell CA, Restle J, Ugawa Y, Ziemann U",The Journal of neuroscience : the official journal of the Society for Neuroscience,0.062,25632119,10.1523/JNEUROSCI.0246-14.2015,-1
parieto_00172,https://pubmed.ncbi.nlm.nih.gov/19906516/,A functional magnetic resonance imaging study of inhibitory control in obsessive-compulsive disorder.,"Page LA, Rubia K, Deeley Q, Daly E, Toal F, Mataix-Cols D, Giampietro V, Schmitz N, Murphy DG",Psychiatry research,0.061,19906516,10.1016/j.pscychresns.2009.05.002,-1
parieto_00173,https://pubmed.ncbi.nlm.nih.gov/12611944/,Neural basis of visually guided head movements studied with fMRI.,"Petit L, Beauchamp MS",Journal of neurophysiology,0.06,12611944,-1,-1
parieto_00174,https://pubmed.ncbi.nlm.nih.gov/18394660/,fMRI evidence for sensorimotor transformations in human cortex during smooth pursuit eye movements.,"Kimmig H, Ohlendorf S, Speck O, Sprenger A, Rutschmann RM, Haller S, Greenlee MW",Neuropsychologia,0.059,18394660,-1,-1
parieto_00175,https://pubmed.ncbi.nlm.nih.gov/19107752/,White-matter abnormalities in attention deficit hyperactivity disorder: a diffusion tensor imaging study.,"Silk TJ, Vance A, Rinehart N, Bradshaw JL, Cunnington R",Human brain mapping,0.059,19107752,-1,-1
parieto_00176,https://pubmed.ncbi.nlm.nih.gov/23357078/,Neuroanatomic overlap between intelligence and cognitive factors: morphometry methods provide support for the key role of the frontal lobes.,"Colom R, Burgaleta M, Roman FJ, Karama S, Alvarez-Linera J, Abad FJ, Martinez K, Quiroga MA, Haier RJ",NeuroImage,0.059,23357078,-1,-1
parieto_00177,https://pubmed.ncbi.nlm.nih.gov/11240106/,An fMRI study of the functional neuroanatomy of picture encoding in younger and older adults.,"Iidaka T, Sadato N, Yamada H, Murata T, Omori M, Yonekura Y",Brain research. Cognitive brain research,0.058,11240106,-1,-1
parieto_00178,https://pubmed.ncbi.nlm.nih.gov/19112507/,Optic flow stimuli in and near the visual field centre: a group FMRI study of motion sensitive regions.,"Ohlendorf S, Sprenger A, Speck O, Haller S, Kimmig H",PloS one,0.055,19112507,-1,-1
parieto_00179,https://pubmed.ncbi.nlm.nih.gov/23696841/,Disorder-specific predictive classification of adolescents with attention deficit hyperactivity disorder (ADHD) relative to autism using structural magnetic resonance imaging.,"Lim L, Marquand A, Cubillo AA, Smith AB, Chantiluke K, Simmons A, Mehta M, Rubia K",PloS one,0.055,23696841,-1,-1
parieto_00180,https://pubmed.ncbi.nlm.nih.gov/25175536/,Being an agent or an observer: Different spectral dynamics revealed by MEG.,"Sebastiani V, de Pasquale F, Costantini M, Mantini D, Pizzella V, Romani GL, Della Penna S",NeuroImage,0.055,25175536,-1,-1
parieto_00181,https://pubmed.ncbi.nlm.nih.gov/26679527/,"Neuroanatomical anomalies of dyslexia: Disambiguating the effects of disorder, performance, and maturation.","Xia Z, Hoeft F, Zhang L, Shu H",Neuropsychologia,0.055,26679527,-1,-1
parieto_00182,https://pubmed.ncbi.nlm.nih.gov/18985119/,Social interaction modifies neural response to gaze shifts.,"Bristow D, Rees G, Frith CD",Social cognitive and affective neuroscience,0.054,18985119,-1,-1
parieto_00183,https://pubmed.ncbi.nlm.nih.gov/21575934/,A review of fronto-striatal and fronto-cortical brain abnormalities in children and adults with Attention Deficit Hyperactivity Disorder (ADHD) and new evidence  for dysfunction in adults with ADHD du,"Cubillo A, Halari R, Smith A, Taylor E, Rubia K",Cortex; a journal devoted to the study of the nervous system and behavior,0.054,21575934,-1,-1
parieto_00184,https://pubmed.ncbi.nlm.nih.gov/10920049/,Visual perception of motion and 3-D structure from motion: an fMRI study.,"Paradis AL, Cornilleau-Peres V, Droulez J, Van De Moortele PF, Lobel E, Berthoz A, Le Bihan D, Poline JB","Cerebral cortex (New York, N.Y. : 1991)",0.053,10920049,-1,-1
parieto_00185,https://pubmed.ncbi.nlm.nih.gov/23097317/,Dissociable dorsal and ventral frontostriatal working memory circuits: evidence from subthalamic stimulation in Parkinson's disease.,"Ventre-Dominey J, Bourret S, Mollion H, Broussolle E, Dominey PF",Human brain mapping,0.053,23097317,-1,-1
parieto_00186,https://pubmed.ncbi.nlm.nih.gov/24391569/,Dissociated repetition deficits in aphasia can reflect flexible interactions between left dorsal and ventral streams and gender-dimorphic architecture of the  right dorsal stream.,"Berthier ML, Froudist Walsh S, Davila G, Nabrozidis A, Juarez Y Ruiz de Mier R, Gutierrez A, De-Torres I, Ruiz-Cruces R, Alfaro F, Garcia-Casares N",Frontiers in human neuroscience,0.053,24391569,-1,-1
parieto_00187,https://pubmed.ncbi.nlm.nih.gov/19433442/,The neural correlates of verbal short-term memory in Alzheimer's disease: an fMRI study.,"Peters F, Collette F, Degueldre C, Sterpenich V, Majerus S, Salmon E",Brain : a journal of neurology,0.051,19433442,-1,-1
parieto_00188,https://pubmed.ncbi.nlm.nih.gov/27474916/,The neural correlates of auditory and visuospatial span in logopenic progressive  aphasia and Alzheimer's disease.,"Foxe D, Leyton CE, Hodges JR, Burrell JR, Irish M, Piguet O",Cortex; a journal devoted to the study of the nervous system and behavior,0.05,27474916,-1,-1
parieto_00189,https://pubmed.ncbi.nlm.nih.gov/22820634/,Neural strategies for reading Japanese and Chinese sentences: a cross-linguistic  fMRI study of character-decoding and morphosyntax.,"Huang K, Itoh K, Kwee IL, Nakada T",Neuropsychologia,0.048,22820634,-1,-1
