paper_name,paper_url,Title,Author,Journal,Loading,PMID,Doi,download_status
parietal lobule_00377,https://pubmed.ncbi.nlm.nih.gov/25985078/,Cerebral Asymmetry of fMRI-BOLD Responses to Visual Stimulation.,"Hougaard A, Jensen BH, Amin FM, Rostrup E, Hoffmann MB, Ashina M",PloS one,0.063,25985078,-1,-1
parietal lobule_00378,https://pubmed.ncbi.nlm.nih.gov/27639213/,Improved estimates for the role of grey matter volume and GABA in bistable perception.,"Sandberg K, Blicher JU, Del Pin SH, Andersen LM, Rees G, Kanai R",Cortex; a journal devoted to the study of the nervous system and behavior,0.063,27639213,-1,-1
parietal lobule_00379,https://pubmed.ncbi.nlm.nih.gov/28253075/,The Contribution of Different Cortical Regions to the Control of Spatially Decoupled Eye-Hand Coordination.,"Sayegh PF, Gorbet DJ, Hawkins KM, Hoffman KL, Sergio LE",Journal of cognitive neuroscience,0.063,28253075,-1,-1
parietal lobule_00380,https://pubmed.ncbi.nlm.nih.gov/16574082/,"Polysyllabic pseudo-word processing in reading and lexical decision: converging evidence from behavioral data, connectionist simulations and functional MRI.","Valdois S, Carbonnel S, Juphard A, Baciu M, Ans B, Peyrin C, Segebarth C",Brain research,0.062,16574082,-1,-1
parietal lobule_00381,https://pubmed.ncbi.nlm.nih.gov/18691703/,Integration of cross-modal emotional information in the human brain: an fMRI study.,"Park JY, Gu BM, Kang DH, Shin YW, Choi CH, Lee JM, Kwon JS",Cortex; a journal devoted to the study of the nervous system and behavior,0.062,18691703,-1,-1
parietal lobule_00382,https://pubmed.ncbi.nlm.nih.gov/18819106/,Brain activity during visual versus kinesthetic imagery: an fMRI study.,"Guillot A, Collet C, Nguyen VA, Malouin F, Richards C, Doyon J",Human brain mapping,0.062,18819106,-1,-1
parietal lobule_00383,https://pubmed.ncbi.nlm.nih.gov/19414052/,"Neural correlates of ""analytical-specific visual perception"" and degree of task difficulty as investigated by the Mangina-Test: a functional magnetic resonance imaging (fMRI) study in young healthy ad","Mangina CA, Beuzeron-Mangina H, Ricciardi E, Pietrini P, Chiarenza GA, Casarotto S",International journal of psychophysiology : official journal of the International Organization of Psychophysiology,0.062,19414052,-1,-1
parietal lobule_00384,https://pubmed.ncbi.nlm.nih.gov/19968969/,The role of inferior frontal and parietal areas in differentiating meaningful and meaningless object-directed actions.,"Newman-Norlund R, van Schie HT, van Hoek ME, Cuijpers RH, Bekkering H",Brain research,0.062,19968969,-1,-1
parietal lobule_00385,https://pubmed.ncbi.nlm.nih.gov/20056150/,A group independent component analysis of covert verb generation in children: a functional magnetic resonance imaging study.,"Karunanayaka P, Schmithorst VJ, Vannest J, Szaflarski JP, Plante E, Holland SK",NeuroImage,0.062,20056150,-1,-1
parietal lobule_00386,https://pubmed.ncbi.nlm.nih.gov/21215442/,Brain activations associated with sign production using word and picture inputs in deaf signers.,"Hu Z, Wang W, Liu H, Peng D, Yang Y, Li K, Zhang JX, Ding G",Brain and language,0.062,21215442,-1,-1
parietal lobule_00387,https://pubmed.ncbi.nlm.nih.gov/21256186/,Brain activity associated with recognition of appropriate action selection based  on allocentric perspectives.,"Shibata H, Inui T",Neuroscience letters,0.062,21256186,-1,-1
parietal lobule_00388,https://pubmed.ncbi.nlm.nih.gov/22662152/,Selective impairments of resting-state networks in minimal hepatic encephalopathy.,"Qi R, Zhang LJ, Xu Q, Zhong J, Wu S, Zhang Z, Liao W, Ni L, Zhang Z, Chen H, Zhong Y, Jiao Q, Wu X, Fan X, Liu Y, Lu G",PloS one,0.062,22662152,-1,-1
parietal lobule_00389,https://pubmed.ncbi.nlm.nih.gov/23660871/,Cortical signature of neurological soft signs in recent onset schizophrenia.,"Hirjak D, Wolf RC, Stieltjes B, Hauser T, Seidl U, Schroder J, Thomann PA",Brain topography,0.062,23660871,-1,-1
parietal lobule_00390,https://pubmed.ncbi.nlm.nih.gov/23973351/,Differences and commonalities in the judgment of causality in physical and social contexts: an fMRI study.,"Wende KC, Nagels A, Blos J, Stratmann M, Chatterjee A, Kircher T, Straube B",Neuropsychologia,0.062,23973351,-1,-1
parietal lobule_00391,https://pubmed.ncbi.nlm.nih.gov/24125791/,Age-related variability in performance of a motor action selection task is related to differences in brain function and structure among older adults.,"Stewart JC, Tran X, Cramer SC",NeuroImage,0.062,24125791,10.1016/j.neuroimage.2013.10.016,-1
parietal lobule_00392,https://pubmed.ncbi.nlm.nih.gov/25289490/,Do you like Arcimboldo's? Esthetic appreciation modulates brain activity in solving perceptual ambiguity.,"Boccia M, Nemmi F, Tizzani E, Guariglia C, Ferlazzo F, Galati G, Giannini AM",Behavioural brain research,0.062,25289490,10.1016/j.bbr.2014.09.041,-1
parietal lobule_00393,https://pubmed.ncbi.nlm.nih.gov/25339893/,Activity of right premotor-parietal regions dependent upon imagined force level:  an fMRI study.,"Mizuguchi N, Nakata H, Kanosue K",Frontiers in human neuroscience,0.062,25339893,-1,-1
parietal lobule_00394,https://pubmed.ncbi.nlm.nih.gov/26232869/,Neural activity changes in unaffected children of patients with schizophrenia: A  resting-state fMRI study.,"Tang Y, Chen K, Zhou Y, Liu J, Wang Y, Driesen N, Edmiston EK, Chen X, Jiang X, Kong L, Zhou Q, Li H, Wu F, Wang Z, Xu K, Wang F",Schizophrenia research,0.062,26232869,-1,-1
parietal lobule_00395,https://pubmed.ncbi.nlm.nih.gov/26386395/,Decreased inhibitory control of negative information in directed forgetting.,"Yang T, Lei X, Anderson M",International journal of psychophysiology : official journal of the International Organization of Psychophysiology,0.062,26386395,-1,-1
parietal lobule_00396,https://pubmed.ncbi.nlm.nih.gov/26820995/,Is Brain Activity during Action Observation Modulated by the Perceived Fairness of the Actor?,"Etzel JA, Valchev N, Gazzola V, Keysers C",PloS one,0.062,26820995,-1,-1
parietal lobule_00397,https://pubmed.ncbi.nlm.nih.gov/27690125/,Bilateral parietal contributions to spatial language.,"Conder J, Fridriksson J, Baylis GC, Smith CM, Boiteau TW, Almor A",Brain and language,0.062,27690125,-1,-1
parietal lobule_00398,https://pubmed.ncbi.nlm.nih.gov/27790087/,Functional and Structural Neuroplasticity Induced by Short-Term Tactile Training  Based on Braille Reading.,"Debowska W, Wolak T, Nowicka A, Kozak A, Szwed M, Kossut M",Frontiers in neuroscience,0.062,27790087,-1,-1
parietal lobule_00399,https://pubmed.ncbi.nlm.nih.gov/29246487/,Practice effects in healthy older adults: Implications for treatment-induced neuroplasticity in Aphasia.,"Kurland J, Liu A, Stokes P",Neuropsychologia,0.062,29246487,-1,-1
parietal lobule_00400,https://pubmed.ncbi.nlm.nih.gov/14980565/,The neural basis of executive function in working memory: an fMRI study based on  individual differences.,"Osaka N, Osaka M, Kondo H, Morishita M, Fukuyama H, Shibasaki H",NeuroImage,0.061,14980565,-1,-1
parietal lobule_00401,https://pubmed.ncbi.nlm.nih.gov/18083602/,Somato-motor inhibitory processing in humans: an event-related functional MRI study.,"Nakata H, Sakamoto K, Ferretti A, Gianni Perrucci M, Del Gratta C, Kakigi R, Luca Romani G",NeuroImage,0.061,18083602,-1,-1
parietal lobule_00402,https://pubmed.ncbi.nlm.nih.gov/18424181/,Variability of BOLD response evoked by foot vibrotactile stimulation: influence of vibration amplitude and stimulus waveform.,"Siedentopf CM, Heubach K, Ischebeck A, Gallasch E, Fend M, Mottaghy FM, Koppelstaetter F, Haala IA, Krause BJ, Felber S, Gerstenbrand F, Golaszewski SM",NeuroImage,0.061,18424181,-1,-1
parietal lobule_00403,https://pubmed.ncbi.nlm.nih.gov/19050764/,Neural dynamics of learning sound-action associations.,"McNamara A, Buccino G, Menz MM, Glascher J, Wolbers T, Baumgartner A, Binkofski F",PloS one,0.061,19050764,-1,-1
parietal lobule_00404,https://pubmed.ncbi.nlm.nih.gov/19679192/,CNS activation and regional connectivity during pantomime observation: no engagement of the mirror neuron system for deaf signers.,"Emmorey K, Xu J, Gannon P, Goldin-Meadow S, Braun A",NeuroImage,0.061,19679192,-1,-1
parietal lobule_00405,https://pubmed.ncbi.nlm.nih.gov/19759300/,The representation of tool use in humans and monkeys: common and uniquely human features.,"Peeters R, Simone L, Nelissen K, Fabbri-Destro M, Vanduffel W, Rizzolatti G, Orban GA",The Journal of neuroscience : the official journal of the Society for Neuroscience,0.061,19759300,-1,-1
parietal lobule_00406,https://pubmed.ncbi.nlm.nih.gov/21195187/,"Working memory load modulates the auditory ""What"" and ""Where"" neural networks.","Leung AW, Alain C",NeuroImage,0.061,21195187,-1,-1
parietal lobule_00407,https://pubmed.ncbi.nlm.nih.gov/21656217/,The interplay of cue modality and response latency in brain areas supporting crossmodal motor preparation: an event-related fMRI study.,"Fatima Z, McIntosh AR",Experimental brain research,0.061,21656217,-1,-1
parietal lobule_00408,https://pubmed.ncbi.nlm.nih.gov/22584235/,Single-trial EEG-fMRI coupling of the emotional auditory early posterior negativity.,"Jaspers-Fayer F, Ertl M, Leicht G, Leupelt A, Mulert C",NeuroImage,0.061,22584235,-1,-1
parietal lobule_00409,https://pubmed.ncbi.nlm.nih.gov/23461704/,Modulation of proprioceptive feedback during functional electrical stimulation: an fMRI study.,"Christensen MS, Grey MJ",The European journal of neuroscience,0.061,23461704,-1,-1
parietal lobule_00410,https://pubmed.ncbi.nlm.nih.gov/23684870/,The roles of superficial amygdala and auditory cortex in music-evoked fear and joy.,"Koelsch S, Skouras S, Fritz T, Herrera P, Bonhage C, Kussner MB, Jacobs AM",NeuroImage,0.061,23684870,-1,-1
parietal lobule_00411,https://pubmed.ncbi.nlm.nih.gov/23796543/,The contribution of fronto-parietal regions to sentence comprehension: insights from the Moses illusion.,"Raposo A, Marques JF",NeuroImage,0.061,23796543,10.1016/j.neuroimage.2013.06.052,-1
parietal lobule_00412,https://pubmed.ncbi.nlm.nih.gov/24080400/,The neural pathway underlying a numerical working memory task in abacus-trained children and associated functional connectivity in the resting brain.,"Li Y, Hu Y, Zhao M, Wang Y, Huang J, Chen F",Brain research,0.061,24080400,10.1016/j.brainres.2013.09.030,-1
parietal lobule_00413,https://pubmed.ncbi.nlm.nih.gov/24324753/,Bayesian network analysis reveals alterations to default mode network connectivity in individuals at risk for Alzheimer's disease.,"Li R, Yu J, Zhang S, Bao F, Wang P, Huang X, Li J",PloS one,0.061,24324753,10.1371/journal.pone.0082104,-1
parietal lobule_00414,https://pubmed.ncbi.nlm.nih.gov/25676678/,Modulation of the motor cortex during singing-voice perception.,"Leveque Y, Schon D",Neuropsychologia,0.061,25676678,-1,-1
parietal lobule_00415,https://pubmed.ncbi.nlm.nih.gov/25904155/,The alterations in regional homogeneity of parieto-cingulate and temporo-cerebellum regions of first-episode medication-naive depression patients.,"Lai CH, Wu YT",Brain imaging and behavior,0.061,25904155,-1,-1
parietal lobule_00416,https://pubmed.ncbi.nlm.nih.gov/25939814/,CREB-BDNF pathway influences alcohol cue-elicited activation in drinkers.,"Chen J, Hutchison KE, Calhoun VD, Claus ED, Turner JA, Sui J, Liu J",Human brain mapping,0.061,25939814,-1,-1
parietal lobule_00417,https://pubmed.ncbi.nlm.nih.gov/26300757/,On the existence of a generalized non-specific task-dependent network.,"Hugdahl K, Raichle ME, Mitra A, Specht K",Frontiers in human neuroscience,0.061,26300757,-1,-1
parietal lobule_00418,https://pubmed.ncbi.nlm.nih.gov/26685089/,Let the man choose what to do: Neural correlates of spontaneous lying and truth-telling.,"Yin L, Reuter M, Weber B",Brain and cognition,0.061,26685089,-1,-1
parietal lobule_00419,https://pubmed.ncbi.nlm.nih.gov/27394152/,"Hidden sources of joy, fear, and sadness: Explicit versus implicit neural processing of musical emotions.","Bogert B, Numminen-Kontti T, Gold B, Sams M, Numminen J, Burunat I, Lampinen J, Brattico E",Neuropsychologia,0.061,27394152,-1,-1
parietal lobule_00420,https://pubmed.ncbi.nlm.nih.gov/27887859/,Olanzapine modulation of long- and short-range functional connectivity in the resting brain in a sample of patients with schizophrenia.,"Guo W, Liu F, Chen J, Wu R, Li L, Zhang Z, Zhao J",European neuropsychopharmacology : the journal of the European College of Neuropsychopharmacology,0.061,27887859,-1,-1
parietal lobule_00421,https://pubmed.ncbi.nlm.nih.gov/28344549/,Functional Brain Activation in Response to a Clinical Vestibular Test Correlates  with Balance.,"Noohi F, Kinnaird C, DeDios Y, Kofman IS, Wood S, Bloomberg J, Mulavara A, Seidler R",Frontiers in systems neuroscience,0.061,28344549,-1,-1
parietal lobule_00422,https://pubmed.ncbi.nlm.nih.gov/18096410/,Dorsal stream development in motion and structure-from-motion perception.,"Klaver P, Lichtensteiger J, Bucher K, Dietrich T, Loenneker T, Martin E",NeuroImage,0.06,18096410,-1,-1
parietal lobule_00423,https://pubmed.ncbi.nlm.nih.gov/18728197/,Inferior parietal lobule supports decision making under uncertainty in humans.,"Vickery TJ, Jiang YV","Cerebral cortex (New York, N.Y. : 1991)",0.06,18728197,-1,-1
parietal lobule_00424,https://pubmed.ncbi.nlm.nih.gov/19199416/,Beyond hemispheric dominance: brain regions underlying the joint lateralization of language and arithmetic to the left hemisphere.,"Pinel P, Dehaene S",Journal of cognitive neuroscience,0.06,19199416,-1,-1
parietal lobule_00425,https://pubmed.ncbi.nlm.nih.gov/21757188/,Contralateral delay activity tracks object identity information in visual short term memory.,"Gao Z, Xu X, Chen Z, Yin J, Shen M, Shui R",Brain research,0.06,21757188,-1,-1
parietal lobule_00426,https://pubmed.ncbi.nlm.nih.gov/21787795/,The attention network of the human brain: relating structural damage associated with spatial neglect to functional imaging correlates of spatial attention.,"Ptak R, Schnider A",Neuropsychologia,0.06,21787795,-1,-1
parietal lobule_00427,https://pubmed.ncbi.nlm.nih.gov/22682904/,Weak task-related modulation and stimulus representations during arithmetic problem solving in children with developmental dyscalculia.,"Ashkenazi S, Rosenberg-Lee M, Tenison C, Menon V",Developmental cognitive neuroscience,0.06,22682904,-1,-1
parietal lobule_00428,https://pubmed.ncbi.nlm.nih.gov/22768085/,Neural network development in late adolescents during observation of risk-taking  action.,"Tamura M, Moriguchi Y, Higuchi S, Hida A, Enomoto M, Umezawa J, Mishima K",PloS one,0.06,22768085,-1,-1
parietal lobule_00429,https://pubmed.ncbi.nlm.nih.gov/24718105/,Brain activity changes in cognitive networks in relapsing-remitting multiple sclerosis - insights from a longitudinal FMRI study.,"Loitfelder M, Fazekas F, Koschutnig K, Fuchs S, Petrovic K, Ropele S, Pichler A, Jehna M, Langkammer C, Schmidt R, Neuper C, Enzinger C",PloS one,0.06,24718105,-1,-1
parietal lobule_00430,https://pubmed.ncbi.nlm.nih.gov/25502215/,Altered resting-state connectivity in college students with nonclinical depressive symptoms.,"Wei X, Shen H, Ren J, Li X, Xu X, Yang R, Lai L, Chen L, Hu J, Liu W, Jiang X",PloS one,0.06,25502215,-1,-1
parietal lobule_00431,https://pubmed.ncbi.nlm.nih.gov/26716447/,Task-switching Cost and Intrinsic Functional Connectivity in the Human Brain: Toward Understanding Individual Differences in Cognitive Flexibility.,"Yin S, Wang T, Pan W, Liu Y, Chen A",PloS one,0.06,26716447,10.1371/journal.pone.0145826,-1
parietal lobule_00432,https://pubmed.ncbi.nlm.nih.gov/27833013/,How emotion context modulates unconscious goal activation during motor force exertion.,"Blakemore RL, Neveu R, Vuilleumier P",NeuroImage,0.06,27833013,10.1016/j.neuroimage.2016.11.002,-1
parietal lobule_00433,https://pubmed.ncbi.nlm.nih.gov/27853425/,Interaction Effects of BDNF and COMT Genes on Resting-State Brain Activity and Working Memory.,"Chen W, Chen C, Xia M, Wu K, Chen C, He Q, Xue G, Wang W, He Y, Dong Q",Frontiers in human neuroscience,0.06,27853425,10.3389/fnhum.2016.00540,-1
parietal lobule_00434,https://pubmed.ncbi.nlm.nih.gov/28587813/,Abnormal regional homogeneity as a potential imaging biomarker for adolescent-onset schizophrenia: A resting-state fMRI study and support vector machine analysis.,"Wang S, Zhang Y, Lv L, Wu R, Fan X, Zhao J, Guo W",Schizophrenia research,0.06,28587813,-1,-1
parietal lobule_00435,https://pubmed.ncbi.nlm.nih.gov/12477703/,A neural basis for the perception of voices in external auditory space.,"Hunter MD, Griffiths TD, Farrow TF, Zheng Y, Wilkinson ID, Hegde N, Woods W, Spence SA, Woodruff PW",Brain : a journal of neurology,0.059,12477703,-1,-1
parietal lobule_00436,https://pubmed.ncbi.nlm.nih.gov/15673663/,Catechol-O-methyltransferase val158met genotype affects processing of emotional stimuli in the amygdala and prefrontal cortex.,"Smolka MN, Schumann G, Wrase J, Grusser SM, Flor H, Mann K, Braus DF, Goldman D, Buchel C, Heinz A",The Journal of neuroscience : the official journal of the Society for Neuroscience,0.059,15673663,-1,-1
parietal lobule_00437,https://pubmed.ncbi.nlm.nih.gov/16806986/,Exploring the visual world: the neural substrate of spatial orienting.,"Himmelbach M, Erb M, Karnath HO",NeuroImage,0.059,16806986,-1,-1
parietal lobule_00438,https://pubmed.ncbi.nlm.nih.gov/16938439/,Neural correlates of the object-recall process in semantic memory.,"Assaf M, Calhoun VD, Kuzu CH, Kraut MA, Rivkin PR, Hart J Jr, Pearlson GD",Psychiatry research,0.059,16938439,-1,-1
parietal lobule_00439,https://pubmed.ncbi.nlm.nih.gov/17208260/,Children's and adults' neural bases of verbal and nonverbal 'theory of mind'.,"Kobayashi C, Glover GH, Temple E",Neuropsychologia,0.059,17208260,-1,-1
parietal lobule_00440,https://pubmed.ncbi.nlm.nih.gov/18093845/,Neural correlates of the processing of co-speech gestures.,"Holle H, Gunter TC, Ruschemeyer SA, Hennenlotter A, Iacoboni M",NeuroImage,0.059,18093845,-1,-1
parietal lobule_00441,https://pubmed.ncbi.nlm.nih.gov/18450480/,Neural mechanisms involved in mental imagery and observation of gait.,"Iseki K, Hanakawa T, Shinozaki J, Nankaku M, Fukuyama H",NeuroImage,0.059,18450480,-1,-1
parietal lobule_00442,https://pubmed.ncbi.nlm.nih.gov/19086020/,Dissociable neural effects of stimulus valence and preceding context during the inhibition of responses to emotional faces.,"Schulz KP, Clerkin SM, Halperin JM, Newcorn JH, Tang CY, Fan J",Human brain mapping,0.059,19086020,-1,-1
parietal lobule_00443,https://pubmed.ncbi.nlm.nih.gov/19109459/,Discrete parieto-frontal functional connectivity related to grasping.,"Hattori N, Shibasaki H, Wheaton L, Wu T, Matsuhashi M, Hallett M",Journal of neurophysiology,0.059,19109459,-1,-1
parietal lobule_00444,https://pubmed.ncbi.nlm.nih.gov/19168666/,Double dissociation between motor and visual imagery in the posterior parietal cortex.,"Pelgrims B, Andres M, Olivier E","Cerebral cortex (New York, N.Y. : 1991)",0.059,19168666,-1,-1
parietal lobule_00445,https://pubmed.ncbi.nlm.nih.gov/21397699/,Action expertise reduces brain activity for audiovisual matching actions: an fMRI study with expert drummers.,"Petrini K, Pollick FE, Dahl S, McAleer P, McKay LS, Rocchesso D, Waadeland CH, Love S, Avanzini F, Puce A",NeuroImage,0.059,21397699,-1,-1
parietal lobule_00446,https://pubmed.ncbi.nlm.nih.gov/22539862/,BOLD responses in somatosensory cortices better reflect heat sensation than pain.,"Moulton EA, Pendse G, Becerra LR, Borsook D",The Journal of neuroscience : the official journal of the Society for Neuroscience,0.059,22539862,-1,-1
parietal lobule_00447,https://pubmed.ncbi.nlm.nih.gov/22634854/,Common substrate for mental arithmetic and finger representation in the parietal  cortex.,"Andres M, Michaux N, Pesenti M",NeuroImage,0.059,22634854,-1,-1
parietal lobule_00448,https://pubmed.ncbi.nlm.nih.gov/22689218/,Exogenous attention to facial vs non-facial emotional visual stimuli.,"Carretie L, Kessel D, Carboni A, Lopez-Martin S, Albert J, Tapia M, Mercado F, Capilla A, Hinojosa JA",Social cognitive and affective neuroscience,0.059,22689218,-1,-1
parietal lobule_00449,https://pubmed.ncbi.nlm.nih.gov/24090510/,Regional homogeneity and resting state functional connectivity: associations with exposure to early life stress.,"Philip NS, Kuras YI, Valentine TR, Sweet LH, Tyrka AR, Price LH, Carpenter LL",Psychiatry research,0.059,24090510,-1,-1
parietal lobule_00450,https://pubmed.ncbi.nlm.nih.gov/24324588/,Identify changes of brain regional homogeneity in bipolar disorder and unipolar depression using resting-state FMRI.,"Liang MJ, Zhou Q, Yang KR, Yang XL, Fang J, Chen WL, Huang Z",PloS one,0.059,24324588,-1,-1
parietal lobule_00451,https://pubmed.ncbi.nlm.nih.gov/24838987/,Attribution of emotions to body postures: An independent component analysis study of functional connectivity in autism.,"Libero LE, Stevens CE Jr, Kana RK",Human brain mapping,0.059,24838987,10.1002/hbm.22544,-1
parietal lobule_00452,https://pubmed.ncbi.nlm.nih.gov/25463450/,Microstructure of frontoparietal connections predicts individual resistance to sleep deprivation.,"Cui J, Tkachenko O, Gogel H, Kipman M, Preer LA, Weber M, Divatia SC, Demers LA, Olson EA, Buchholz JL, Bark JS, Rosso IM, Rauch SL, Killgore WD",NeuroImage,0.059,25463450,10.1016/j.neuroimage.2014.11.035,-1
parietal lobule_00453,https://pubmed.ncbi.nlm.nih.gov/25717297/,Enhanced Neuroactivation during Working Memory Task in Postmenopausal Women Receiving Hormone Therapy: A Coordinate-Based Meta-Analysis.,"Li K, Huang X, Han Y, Zhang J, Lai Y, Yuan L, Lu J, Zeng D",Frontiers in human neuroscience,0.059,25717297,-1,-1
parietal lobule_00454,https://pubmed.ncbi.nlm.nih.gov/25804310/,Exposure to childhood trauma is associated with altered n-back activation and performance in healthy adults: implications for a commonly used working memory task.,"Philip NS, Sweet LH, Tyrka AR, Carpenter SL, Albright SE, Price LH, Carpenter LL",Brain imaging and behavior,0.059,25804310,-1,-1
parietal lobule_00455,https://pubmed.ncbi.nlm.nih.gov/28254653/,Functional connectivity between prefrontal and parietal cortex drives visuo-spatial attention shifts.,"Heinen K, Feredoes E, Ruff CC, Driver J",Neuropsychologia,0.059,28254653,-1,-1
parietal lobule_00456,https://pubmed.ncbi.nlm.nih.gov/28413776/,Dissociable neural processes during risky decision-making in individuals with Internet-gaming disorder.,"Liu L, Xue G, Potenza MN, Zhang JT, Yao YW, Xia CC, Lan J, Ma SS, Fang XY",NeuroImage. Clinical,0.059,28413776,-1,-1
parietal lobule_00457,https://pubmed.ncbi.nlm.nih.gov/28463748/,Using short-range and long-range functional connectivity to identify schizophrenia with a family-based case-control design.,"Guo W, Liu F, Chen J, Wu R, Li L, Zhang Z, Chen H, Zhao J",Psychiatry research. Neuroimaging,0.059,28463748,-1,-1
parietal lobule_00458,https://pubmed.ncbi.nlm.nih.gov/28478357/,Anhedonia correlates with abnormal functional connectivity of the superior temporal gyrus and the caudate nucleus in patients with first-episode drug-naive  major depressive disorder.,"Yang XH, Tian K, Wang DF, Wang Y, Cheung EFC, Xie GR, Chan RCK",Journal of affective disorders,0.059,28478357,-1,-1
parietal lobule_00459,https://pubmed.ncbi.nlm.nih.gov/28526931/,Reduced amygdala reactivity and impaired working memory during dissociation in borderline personality disorder.,"Krause-Utz A, Winter D, Schriner F, Chiu CD, Lis S, Spinhoven P, Bohus M, Schmahl C, Elzinga BM",European archives of psychiatry and clinical neuroscience,0.059,28526931,-1,-1
parietal lobule_00460,https://pubmed.ncbi.nlm.nih.gov/28649490/,Frequency-dependent changes in local intrinsic oscillations in chronic primary insomnia: A study of the amplitude of low-frequency fluctuations in the resting state.,"Zhou F, Huang S, Zhuang Y, Gao L, Gong H",NeuroImage. Clinical,0.059,28649490,-1,-1
parietal lobule_00461,https://pubmed.ncbi.nlm.nih.gov/28951165/,Neural activity associated with repetitive simulation of episodic counterfactual  thoughts.,"De Brigard F, Parikh N, Stewart GW, Szpunar KK, Schacter DL",Neuropsychologia,0.059,28951165,-1,-1
parietal lobule_00462,https://pubmed.ncbi.nlm.nih.gov/29023463/,Learning to tie the knot: The acquisition of functional object representations by physical and observational experience.,"Cross ES, Hamilton AFC, Cohen NR, Grafton ST",PloS one,0.059,29023463,-1,-1
parietal lobule_00463,https://pubmed.ncbi.nlm.nih.gov/29731712/,Baseline Brain Activity Changes in Patients With Single and Relapsing Optic Neuritis.,"Ren Z, Liu Y, Li K, Duan Y, Jing H, Liang P, Sun Z, Zhang X, Mao B",Frontiers in human neuroscience,0.059,29731712,-1,-1
parietal lobule_00464,https://pubmed.ncbi.nlm.nih.gov/10666559/,Functional asymmetry of human prefrontal cortex in verbal and non-verbal episodic memory as revealed by fMRI.,"Iidaka T, Sadato N, Yamada H, Yonekura Y",Brain research. Cognitive brain research,0.058,10666559,-1,-1
parietal lobule_00465,https://pubmed.ncbi.nlm.nih.gov/10751455/,Neural activity relating to generation and representation of galvanic skin conductance responses: a functional magnetic resonance imaging study.,"Critchley HD, Elliott R, Mathias CJ, Dolan RJ",The Journal of neuroscience : the official journal of the Society for Neuroscience,0.058,10751455,-1,-1
parietal lobule_00466,https://pubmed.ncbi.nlm.nih.gov/15488911/,An fMRI study of imitation: action representation and body schema.,"Chaminade T, Meltzoff AN, Decety J",Neuropsychologia,0.058,15488911,-1,-1
parietal lobule_00467,https://pubmed.ncbi.nlm.nih.gov/16597731/,Somatic sensation of hand-object interactive movement is associated with activity in the left inferior parietal cortex.,"Naito E, Ehrsson HH",The Journal of neuroscience : the official journal of the Society for Neuroscience,0.058,16597731,-1,-1
