paper_name,paper_url,Title,Author,Journal,Loading,PMID,Doi,download_status
parietal lobule_00001,https://pubmed.ncbi.nlm.nih.gov/27501391/,Assessment of Cortical Dysfunction in Patients with Intermittent Exotropia: An fMRI Study.,"Li Q, Bai J, Zhang J, Gong Q, Liu L",PloS one,0.464,27501391,10.1371/journal.pone.0160806,-1
parietal lobule_00002,https://pubmed.ncbi.nlm.nih.gov/18226833/,Effective brain connectivity in children with reading difficulties during phonological processing.,"Cao F, Bitan T, Booth JR",Brain and language,0.269,18226833,10.1016/j.bandl.2007.12.009,-1
parietal lobule_00003,https://pubmed.ncbi.nlm.nih.gov/25567086/,The neural basis of implicit learning of task-irrelevant Chinese tonal sequence.,"Ling X, Guo X, Zheng L, Li L, Chen M, Wang Q, Huang Q, Dienes Z",Experimental brain research,0.234,25567086,-1,-1
parietal lobule_00004,https://pubmed.ncbi.nlm.nih.gov/24647353/,Classification of cirrhotic patients with or without minimal hepatic encephalopathy and healthy subjects using resting-state attention-related network analysis.,"Chen HJ, Wang Y, Zhu XQ, Li PC, Teng GJ",PloS one,0.225,24647353,-1,-1
parietal lobule_00005,https://pubmed.ncbi.nlm.nih.gov/25164675/,Prismatic adaptation changes visuospatial representation in the inferior parietal lobule.,"Crottaz-Herbette S, Fornari E, Clarke S",The Journal of neuroscience : the official journal of the Society for Neuroscience,0.221,25164675,-1,-1
parietal lobule_00006,https://pubmed.ncbi.nlm.nih.gov/14615300/,"Interindividual differences in functional interactions among prefrontal, parietal and parahippocampal regions during working memory.","Glabus MF, Horwitz B, Holt JL, Kohn PD, Gerton BK, Callicott JH, Meyer-Lindenberg A, Berman KF","Cerebral cortex (New York, N.Y. : 1991)",0.22,14615300,-1,-1
parietal lobule_00007,https://pubmed.ncbi.nlm.nih.gov/25443178/,Intergenerational transmission of fronto-parietal dysfunction during forethought  in attention deficit/hyperactivity disorder: a pilot study.,"Poissant H, Rapin L, Mendrek A",Psychiatry research,0.216,25443178,-1,-1
parietal lobule_00008,https://pubmed.ncbi.nlm.nih.gov/27313520/,Holding Biological Motion in Working Memory: An fMRI Study.,"Lu X, Huang J, Yi Y, Shen M, Weng X, Gao Z",Frontiers in human neuroscience,0.216,27313520,-1,-1
parietal lobule_00009,https://pubmed.ncbi.nlm.nih.gov/20123026/,Delineating self-referential processing from episodic memory retrieval: common and dissociable networks.,"Sajonz B, Kahnt T, Margulies DS, Park SQ, Wittmann A, Stoy M, Strohle A, Heinz A, Northoff G, Bermpohl F",NeuroImage,0.204,20123026,-1,-1
parietal lobule_00010,https://pubmed.ncbi.nlm.nih.gov/23117157/,Probabilistic orthographic cues to grammatical category in the brain.,"Arciuli J, McMahon K, Zubicaray Gd",Brain and language,0.195,23117157,-1,-1
parietal lobule_00011,https://pubmed.ncbi.nlm.nih.gov/17010394/,Children with reading disorder show modality independent brain abnormalities during semantic tasks.,"Booth JR, Bebko G, Burman DD, Bitan T",Neuropsychologia,0.191,17010394,-1,-1
parietal lobule_00012,https://pubmed.ncbi.nlm.nih.gov/23028644/,Resting-state functional connectivity patterns predict Chinese word reading competency.,"Wang X, Han Z, He Y, Liu L, Bi Y",PloS one,0.189,23028644,-1,-1
parietal lobule_00013,https://pubmed.ncbi.nlm.nih.gov/18489958/,Longitudinal fMRI study of reading in a patient with letter-by-letter reading.,"Ino T, Tokumoto K, Usami K, Kimura T, Hashimoto Y, Fukuyama H",Cortex; a journal devoted to the study of the nervous system and behavior,0.178,18489958,-1,-1
parietal lobule_00014,https://pubmed.ncbi.nlm.nih.gov/28782545/,Reshaping the brain after stroke: The effect of prismatic adaptation in patients  with right brain damage.,"Crottaz-Herbette S, Fornari E, Notter MP, Bindschaedler C, Manzoni L, Clarke S",Neuropsychologia,0.177,28782545,-1,-1
parietal lobule_00015,https://pubmed.ncbi.nlm.nih.gov/23453584/,The auditory dorsal stream plays a crucial role in projecting hallucinated voices into external space.,"Looijestijn J, Diederen KM, Goekoop R, Sommer IE, Daalman K, Kahn RS, Hoek HW, Blom JD",Schizophrenia research,0.174,23453584,-1,-1
parietal lobule_00016,https://pubmed.ncbi.nlm.nih.gov/24183467/,Pathways to lexical ambiguity: fMRI evidence for bilateral fronto-parietal involvement in language processing.,"Klepousniotou E, Gracco VL, Pike GB",Brain and language,0.172,24183467,-1,-1
parietal lobule_00017,https://pubmed.ncbi.nlm.nih.gov/21576110/,Lesion evidence for the critical role of the intraparietal sulcus in spatial attention.,"Gillebert CR, Mantini D, Thijs V, Sunaert S, Dupont P, Vandenberghe R",Brain : a journal of neurology,0.169,21576110,-1,-1
parietal lobule_00018,https://pubmed.ncbi.nlm.nih.gov/27569182/,An energy-efficient intrinsic functional organization of human working memory: A  resting-state functional connectivity study.,"Liu H, Yu H, Li Y, Qin W, Xu L, Yu C, Liang M",Behavioural brain research,0.169,27569182,-1,-1
parietal lobule_00019,https://pubmed.ncbi.nlm.nih.gov/24100194/,Possible role of an error detection mechanism in brain processing of deception: PET-fMRI study.,"Kireev M, Korotkov A, Medvedeva N, Medvedev S",International journal of psychophysiology : official journal of the International Organization of Psychophysiology,0.167,24100194,-1,-1
parietal lobule_00020,https://pubmed.ncbi.nlm.nih.gov/25139308/,"When you smile, you become happy: Evidence from resting state task-based fMRI.","Chang J, Zhang M, Hitchman G, Qiu J, Liu Y",Biological psychology,0.166,25139308,-1,-1
parietal lobule_00021,https://pubmed.ncbi.nlm.nih.gov/23263196/,The desire for healthy limb amputation: structural brain correlates and clinical  features of xenomelia.,"Hilti LM, Hanggi J, Vitacco DA, Kraemer B, Palla A, Luechinger R, Jancke L, Brugger P",Brain : a journal of neurology,0.165,23263196,10.1093/brain/aws316,-1
parietal lobule_00022,https://pubmed.ncbi.nlm.nih.gov/23415909/,Neural representation of decision confidence.,"Chen J, Feng T, Shi J, Liu L, Li H",Behavioural brain research,0.162,23415909,10.1016/j.bbr.2013.02.004,-1
parietal lobule_00023,https://pubmed.ncbi.nlm.nih.gov/27195523/,Activation in the Right Inferior Parietal Lobule Reflects the Representation of Musical Structure beyond Simple Pitch Discrimination.,"Royal I, Vuvan DT, Zendel BR, Robitaille N, Schonwiesner M, Peretz I",PloS one,0.162,27195523,10.1371/journal.pone.0155291,-1
parietal lobule_00024,https://pubmed.ncbi.nlm.nih.gov/19104833/,The extreme capsule in humans and rethinking of the language circuitry.,"Makris N, Pandya DN",Brain structure & function,0.161,19104833,-1,-1
parietal lobule_00025,https://pubmed.ncbi.nlm.nih.gov/25793291/,Altered neural basis of the reality processing and its relation to cognitive insight in schizophrenia.,"Lee JS, Chun JW, Lee SH, Kim E, Lee SK, Kim JJ",PloS one,0.161,25793291,-1,-1
parietal lobule_00026,https://pubmed.ncbi.nlm.nih.gov/15050556/,The human parietal cortex is involved in spatial processing of tongue movement-an fMRI study.,"Watanabe J, Sugiura M, Miura N, Watanabe Y, Maeda Y, Matsue Y, Kawashima R",NeuroImage,0.159,15050556,-1,-1
parietal lobule_00027,https://pubmed.ncbi.nlm.nih.gov/27143223/,Hemispheric involvement in the processing of Chinese idioms: An fMRI study.,"Yang J, Li P, Fang X, Shu H, Liu Y, Chen L",Neuropsychologia,0.158,27143223,-1,-1
parietal lobule_00028,https://pubmed.ncbi.nlm.nih.gov/22571931/,The neural substrates associated with attentional resources and difficulty of concurrent processing of the two verbal tasks.,"Mizuno K, Tanaka M, Tanabe HC, Sadato N, Watanabe Y",Neuropsychologia,0.156,22571931,-1,-1
parietal lobule_00029,https://pubmed.ncbi.nlm.nih.gov/15029467/,Neural mechanisms of spatial stimulus-response compatibility: the effect of crossed-hand position.,"Matsumoto E, Misaki M, Miyauchi S",Experimental brain research,0.154,15029467,-1,-1
parietal lobule_00030,https://pubmed.ncbi.nlm.nih.gov/19523524/,Tool responsive regions in the posterior parietal cortex: effect of differences in motor goal and target object during imagined transitive movements.,"Vingerhoets G, Acke F, Vandemaele P, Achten E",NeuroImage,0.153,19523524,-1,-1
parietal lobule_00031,https://pubmed.ncbi.nlm.nih.gov/15091346/,Neural circuits underlying imitation learning of hand actions: an event-related fMRI study.,"Buccino G, Vogt S, Ritzl A, Fink GR, Zilles K, Freund HJ, Rizzolatti G",Neuron,0.152,15091346,-1,-1
parietal lobule_00032,https://pubmed.ncbi.nlm.nih.gov/22047726/,Neural response to eye contact and paroxetine treatment in generalized social anxiety disorder.,"Schneier FR, Pomplun M, Sy M, Hirsch J",Psychiatry research,0.15,22047726,-1,-1
parietal lobule_00033,https://pubmed.ncbi.nlm.nih.gov/20828626/,Evaluation of effective connectivity of motor areas during motor imagery and execution using conditional Granger causality.,"Gao Q, Duan X, Chen H",NeuroImage,0.149,20828626,-1,-1
parietal lobule_00034,https://pubmed.ncbi.nlm.nih.gov/23185300/,Somatosensory-motor adaptation of orofacial actions in posterior parietal and ventral premotor cortices.,"Grabski K, Lamalle L, Sato M",PloS one,0.149,23185300,-1,-1
parietal lobule_00035,https://pubmed.ncbi.nlm.nih.gov/17030047/,Is Broca's area involved in the processing of passive sentences? An event-related fMRI study.,"Yokoyama S, Watanabe J, Iwata K, Ikuta N, Haji T, Usui N, Taira M, Miyamoto T, Nakamura W, Sato S, Horie K, Kawashima R",Neuropsychologia,0.148,17030047,-1,-1
parietal lobule_00036,https://pubmed.ncbi.nlm.nih.gov/20682349/,The changes in brain metabolism in people with activated brown adipose tissue: a  PET study.,"Huang YC, Hsu CC, Huang P, Yin TK, Chiu NT, Wang PW, Huang SH, Huang YE",NeuroImage,0.148,20682349,-1,-1
parietal lobule_00037,https://pubmed.ncbi.nlm.nih.gov/18023825/,Proprio-tactile integration for kinesthetic perception: an fMRI study.,"Kavounoudias A, Roll JP, Anton JL, Nazarian B, Roth M, Roll R",Neuropsychologia,0.147,18023825,-1,-1
parietal lobule_00038,https://pubmed.ncbi.nlm.nih.gov/21078349/,Modulation of default-mode network activity by acute tryptophan depletion is associated with mood change: a resting state functional magnetic resonance imaging study.,"Kunisato Y, Okamoto Y, Okada G, Aoyama S, Demoto Y, Munakata A, Nomura M, Onoda K, Yamawaki S",Neuroscience research,0.143,21078349,-1,-1
parietal lobule_00039,https://pubmed.ncbi.nlm.nih.gov/16497485/,Neural activation during successful and unsuccessful verbal learning in schizophrenia.,"Heinze S, Sartory G, Muller BW, de Greiff A, Forsting M, Juptner M",Schizophrenia research,0.14,16497485,-1,-1
parietal lobule_00040,https://pubmed.ncbi.nlm.nih.gov/25438976/,Can we simulate an action that we temporarily cannot perform?,"Calmels C, Pichon S, Grezes J",Neurophysiologie clinique = Clinical neurophysiology,0.14,25438976,-1,-1
parietal lobule_00041,https://pubmed.ncbi.nlm.nih.gov/20006713/,Impairment and compensation coexist in amnestic MCI default mode network.,"Qi Z, Wu X, Wang Z, Zhang N, Dong H, Yao L, Li K",NeuroImage,0.139,20006713,10.1016/j.neuroimage.2009.12.025,-1
parietal lobule_00042,https://pubmed.ncbi.nlm.nih.gov/23562793/,Brain activity during motor imagery of an action with an object: a functional magnetic resonance imaging study.,"Mizuguchi N, Nakata H, Hayashi T, Sakamoto M, Muraoka T, Uchida Y, Kanosue K",Neuroscience research,0.137,23562793,10.1016/j.neures.2013.03.012,-1
parietal lobule_00043,https://pubmed.ncbi.nlm.nih.gov/27766586/,Brain structure and function in patients with ovarian cancer treated with first-line chemotherapy: a pilot study.,"Correa DD, Root JC, Kryza-Lacombe M, Mehta M, Karimi S, Hensley ML, Relkin N",Brain imaging and behavior,0.137,27766586,10.1007/s11682-016-9608-4,-1
parietal lobule_00044,https://pubmed.ncbi.nlm.nih.gov/21618664/,fMRI investigation of speed-accuracy strategy switching.,"Vallesi A, McIntosh AR, Crescentini C, Stuss DT",Human brain mapping,0.135,21618664,-1,-1
parietal lobule_00045,https://pubmed.ncbi.nlm.nih.gov/24348991/,Individual differences in brain structure and resting brain function underlie cognitive styles: evidence from the Embedded Figures Test.,"Hao X, Wang K, Li W, Yang W, Wei D, Qiu J, Zhang Q",PloS one,0.135,24348991,-1,-1
parietal lobule_00046,https://pubmed.ncbi.nlm.nih.gov/20472072/,Aging and decision making under uncertainty: behavioral and neural evidence for the preservation of decision making in the absence of learning in old age.,"Hosseini SM, Rostami M, Yomogida Y, Takahashi M, Tsukiura T, Kawashima R",NeuroImage,0.132,20472072,-1,-1
parietal lobule_00047,https://pubmed.ncbi.nlm.nih.gov/19618170/,The role of inferior frontal gyrus and inferior parietal lobule in semantic processing of Chinese characters.,"Chou TL, Chen CW, Wu MY, Booth JR",Experimental brain research,0.131,19618170,-1,-1
parietal lobule_00048,https://pubmed.ncbi.nlm.nih.gov/17064940/,Age-related connectivity changes in fMRI data from children listening to stories.,"Karunanayaka PR, Holland SK, Schmithorst VJ, Solodkin A, Chen EE, Szaflarski JP, Plante E",NeuroImage,0.13,17064940,-1,-1
parietal lobule_00049,https://pubmed.ncbi.nlm.nih.gov/20226773/,Mental representations of action: the neural correlates of the verbal and motor components.,"Peran P, Demonet JF, Cherubini A, Carbebat D, Caltagirone C, Sabatini U",Brain research,0.13,20226773,-1,-1
parietal lobule_00050,https://pubmed.ncbi.nlm.nih.gov/21138758/,Overlapping clusters of gray matter deficits in paranoid schizophrenia and psychotic bipolar mania with family history.,"Cui L, Li M, Deng W, Guo W, Ma X, Huang C, Jiang L, Wang Y, Collier DA, Gong Q, Li T",Neuroscience letters,0.129,21138758,-1,-1
parietal lobule_00051,https://pubmed.ncbi.nlm.nih.gov/16872743/,Neural correlates of a mystical experience in Carmelite nuns.,"Beauregard M, Paquette V",Neuroscience letters,0.128,16872743,10.1016/j.neulet.2006.06.060,-1
parietal lobule_00052,https://pubmed.ncbi.nlm.nih.gov/27601666/,Episodic specificity induction impacts activity in a core brain network during construction of imagined future experiences.,"Madore KP, Szpunar KK, Addis DR, Schacter DL",Proceedings of the National Academy of Sciences of the United States of America,0.128,27601666,10.1073/pnas.1612278113,-1
parietal lobule_00053,https://pubmed.ncbi.nlm.nih.gov/19773547/,Cultural constraints on brain development: evidence from a developmental study of visual word processing in mandarin chinese.,"Cao F, Lee R, Shu H, Yang Y, Xu G, Li K, Booth JR","Cerebral cortex (New York, N.Y. : 1991)",0.127,19773547,10.1093/cercor/bhp186,-1
parietal lobule_00054,https://pubmed.ncbi.nlm.nih.gov/16109491/,Cognitive modules utilized for narrative comprehension in children: a functional  magnetic resonance imaging study.,"Schmithorst VJ, Holland SK, Plante E",NeuroImage,0.126,16109491,-1,-1
parietal lobule_00055,https://pubmed.ncbi.nlm.nih.gov/26218431/,The Neural Basis of Typewriting: A Functional MRI Study.,"Higashiyama Y, Takeda K, Someya Y, Kuroiwa Y, Tanaka F",PloS one,0.125,26218431,-1,-1
parietal lobule_00056,https://pubmed.ncbi.nlm.nih.gov/28824403/,Individual Differences in the Accuracy of Judgments of Learning Are Related to the Gray Matter Volume and Functional Connectivity of the Left Mid-Insula.,"Hu X, Liu Z, Chen W, Zheng J, Su N, Wang W, Lin C, Luo L",Frontiers in human neuroscience,0.125,28824403,-1,-1
parietal lobule_00057,https://pubmed.ncbi.nlm.nih.gov/18032069/,Neural substrates of visuomotor learning based on improved feedback control and prediction.,"Grafton ST, Schmitt P, Van Horn J, Diedrichsen J",NeuroImage,0.124,18032069,-1,-1
parietal lobule_00058,https://pubmed.ncbi.nlm.nih.gov/21147233/,Right parietal dominance in spatial egocentric discrimination.,"Loayza FR, Fernandez-Seara MA, Aznarez-Sanado M, Pastor MA",NeuroImage,0.123,21147233,-1,-1
parietal lobule_00059,https://pubmed.ncbi.nlm.nih.gov/22766165/,The what and how components of cognitive control.,"De Baene W, Albers AM, Brass M",NeuroImage,0.123,22766165,-1,-1
parietal lobule_00060,https://pubmed.ncbi.nlm.nih.gov/23246992/,Functional integration processes underlying the instruction-based learning of novel goal-directed behaviors.,"Ruge H, Wolfensteller U",NeuroImage,0.123,23246992,-1,-1
parietal lobule_00061,https://pubmed.ncbi.nlm.nih.gov/23285171/,Patterns in cortical connectivity for determining outcomes in hand function after subcortical stroke.,"Yin D, Song F, Xu D, Peterson BS, Sun L, Men W, Yan X, Fan M",PloS one,0.123,23285171,-1,-1
parietal lobule_00062,https://pubmed.ncbi.nlm.nih.gov/26613720/,ACC and IPL networks in the perception of the faces of parents during selective tasks.,"Zhai H, Yu Y, Zhang W, Chen G, Jia F",Brain imaging and behavior,0.123,26613720,-1,-1
parietal lobule_00063,https://pubmed.ncbi.nlm.nih.gov/18644454/,Neural correlates of hemispheric dominance and ipsilaterality within the vestibular system.,"Janzen J, Schlindwein P, Bense S, Bauermann T, Vucurevic G, Stoeter P, Dieterich M",NeuroImage,0.121,18644454,-1,-1
parietal lobule_00064,https://pubmed.ncbi.nlm.nih.gov/25788100/,Effective connectivity of brain regions related to visual word recognition: An fMRI study of Chinese reading.,"Xu M, Wang T, Chen S, Fox PT, Tan LH",Human brain mapping,0.121,25788100,-1,-1
parietal lobule_00065,https://pubmed.ncbi.nlm.nih.gov/16530429/,Building a motor simulation de novo: observation of dance by dancers.,"Cross ES, Hamilton AF, Grafton ST",NeuroImage,0.12,16530429,-1,-1
parietal lobule_00066,https://pubmed.ncbi.nlm.nih.gov/21315158/,Investigation of melodic contour processing in the brain using multivariate pattern-based fMRI.,"Lee YS, Janata P, Frost C, Hanke M, Granger R",NeuroImage,0.12,21315158,-1,-1
parietal lobule_00067,https://pubmed.ncbi.nlm.nih.gov/27723821/,Abnormal Intrinsic Functional Hubs in Severe Male Obstructive Sleep Apnea: Evidence from a Voxel-Wise Degree Centrality Analysis.,"Li H, Li L, Shao Y, Gong H, Zhang W, Zeng X, Ye C, Nie S, Chen L, Peng D",PloS one,0.119,27723821,-1,-1
parietal lobule_00068,https://pubmed.ncbi.nlm.nih.gov/11240107/,Neuroanatomical discrimination between manipulating and maintaining processes involved in verbal working memory; a functional MRI study.,"Tsukiura T, Fujii T, Takahashi T, Xiao R, Inase M, Iijima T, Yamadori A, Okuda J",Brain research. Cognitive brain research,0.118,11240107,-1,-1
parietal lobule_00069,https://pubmed.ncbi.nlm.nih.gov/20946958/,Is 2+2=4? Meta-analyses of brain areas needed for numbers and calculations.,"Arsalidou M, Taylor MJ",NeuroImage,0.118,20946958,-1,-1
parietal lobule_00070,https://pubmed.ncbi.nlm.nih.gov/22916169/,Neural correlates of individual performance differences in resolving perceptual conflict.,"Labrenz F, Themann M, Wascher E, Beste C, Pfleiderer B",PloS one,0.118,22916169,-1,-1
parietal lobule_00071,https://pubmed.ncbi.nlm.nih.gov/22940117/,The different faces of one's self: an fMRI study into the recognition of current  and past self-facial appearances.,"Apps MA, Tajadura-Jimenez A, Turley G, Tsakiris M",NeuroImage,0.118,22940117,10.1016/j.neuroimage.2012.08.053,-1
parietal lobule_00072,https://pubmed.ncbi.nlm.nih.gov/20739053/,Superior parietal lobule dysfunction in a homogeneous group of dyslexic children  with a visual attention span disorder.,"Peyrin C, Demonet JF, N'Guyen-Morel MA, Le Bas JF, Valdois S",Brain and language,0.117,20739053,10.1016/j.bandl.2010.06.005,-1
parietal lobule_00073,https://pubmed.ncbi.nlm.nih.gov/23174403/,Developmental changes in within- and between-network connectivity between late childhood and adulthood.,"Barber AD, Caffo BS, Pekar JJ, Mostofsky SH",Neuropsychologia,0.117,23174403,10.1016/j.neuropsychologia.2012.11.011,-1
parietal lobule_00074,https://pubmed.ncbi.nlm.nih.gov/25954169/,Emotional face expression modulates occipital-frontal effective connectivity during memory formation in a bottom-up fashion.,"Xiu D, Geiger MJ, Klaver P",Frontiers in behavioral neuroscience,0.117,25954169,-1,-1
parietal lobule_00075,https://pubmed.ncbi.nlm.nih.gov/27590722/,Working memory load influences perceptual ambiguity by competing for fronto-parietal attentional resources.,"Intaite M, Duarte JV, Castelo-Branco M",Brain research,0.115,27590722,-1,-1
parietal lobule_00076,https://pubmed.ncbi.nlm.nih.gov/23555827/,Altered default network resting-state functional connectivity in adolescents with Internet gaming addiction.,"Ding WN, Sun JH, Sun YW, Zhou Y, Li L, Xu JR, Du YS",PloS one,0.113,23555827,-1,-1
parietal lobule_00077,https://pubmed.ncbi.nlm.nih.gov/16343769/,Effect of neurofeedback training on the neural substrates of selective attention  in children with attention-deficit/hyperactivity disorder: a functional magnetic  resonance imaging study.,"Levesque J, Beauregard M, Mensour B",Neuroscience letters,0.112,16343769,-1,-1
parietal lobule_00078,https://pubmed.ncbi.nlm.nih.gov/26076024/,Temporal and Motor Representation of Rhythm in Fronto-Parietal Cortical Areas: An fMRI Study.,"Konoike N, Kotozaki Y, Jeong H, Miyazaki A, Sakaki K, Shinada T, Sugiura M, Kawashima R, Nakamura K",PloS one,0.112,26076024,-1,-1
parietal lobule_00079,https://pubmed.ncbi.nlm.nih.gov/16427033/,Specialization of phonological and semantic processing in Chinese word reading.,"Booth JR, Lu D, Burman DD, Chou TL, Jin Z, Peng DL, Zhang L, Ding GS, Deng Y, Liu L",Brain research,0.111,16427033,-1,-1
parietal lobule_00080,https://pubmed.ncbi.nlm.nih.gov/17046287/,An fMRI approach to particularize the frontoparietal network for visuomotor action monitoring: Detection of incongruence between test subjects' actions and resulting perceptions.,"Schnell K, Heekeren K, Schnitker R, Daumann J, Weber J, Hesselmann V, Moller-Hartmann W, Thron A, Gouzoulis-Mayfrank E",NeuroImage,0.111,17046287,-1,-1
parietal lobule_00081,https://pubmed.ncbi.nlm.nih.gov/19853585/,Neural substrates of irony comprehension: A functional MRI study.,"Shibata M, Toyomura A, Itoh H, Abe J",Brain research,0.111,19853585,-1,-1
parietal lobule_00082,https://pubmed.ncbi.nlm.nih.gov/18272874/,Neuroanatomical correlates of motor acquisition and motor transfer.,"Seidler RD, Noll DC",Journal of neurophysiology,0.11,18272874,-1,-1
parietal lobule_00083,https://pubmed.ncbi.nlm.nih.gov/28890691/,Predicting Intentions of a Familiar Significant Other Beyond the Mirror Neuron System.,"Cacioppo S, Juan E, Monteleone G",Frontiers in behavioral neuroscience,0.11,28890691,-1,-1
parietal lobule_00084,https://pubmed.ncbi.nlm.nih.gov/22146750/,Rearranging the world: neural network supporting the processing of temporal connectives.,"Ye Z, Kutas M, St George M, Sereno MI, Ling F, Munte TF",NeuroImage,0.109,22146750,-1,-1
parietal lobule_00085,https://pubmed.ncbi.nlm.nih.gov/24586822/,Altered spontaneous brain activity in primary open angle glaucoma: a resting-state functional magnetic resonance imaging study.,"Song Y, Mu K, Wang J, Lin F, Chen Z, Yan X, Hao Y, Zhu W, Zhang H",PloS one,0.109,24586822,-1,-1
parietal lobule_00086,https://pubmed.ncbi.nlm.nih.gov/29660636/,"Regional homogeneity and functional connectivity patterns in major depressive disorder, cognitive vulnerability to depression and healthy subjects.","Sun H, Luo L, Yuan X, Zhang L, He Y, Yao S, Wang J, Xiao J",Journal of affective disorders,0.109,29660636,-1,-1
parietal lobule_00087,https://pubmed.ncbi.nlm.nih.gov/14700729/,The effect of musical training on the neural correlates of math processing: a functional magnetic resonance imaging study in humans.,"Schmithorst VJ, Holland SK",Neuroscience letters,0.108,14700729,-1,-1
parietal lobule_00088,https://pubmed.ncbi.nlm.nih.gov/18061483/,The subcortical role of language processing. High level linguistic features such  as ambiguity-resolution and the human brain; an fMRI study.,"Ketteler D, Kastrau F, Vohn R, Huber W",NeuroImage,0.108,18061483,-1,-1
parietal lobule_00089,https://pubmed.ncbi.nlm.nih.gov/25218099/,The neural representation of plural discourse entities.,"Boiteau TW, Bowers E, Nair VA, Almor A",Brain and language,0.107,25218099,-1,-1
parietal lobule_00090,https://pubmed.ncbi.nlm.nih.gov/19943100/,Somatosensory system deficits in schizophrenia revealed by MEG during a median-nerve oddball task.,"Huang MX, Lee RR, Gaa KM, Song T, Harrington DL, Loh C, Theilmann RJ, Edgar JC, Miller GA, Canive JM, Granholm E",Brain topography,0.106,19943100,-1,-1
parietal lobule_00091,https://pubmed.ncbi.nlm.nih.gov/25170021/,An exploratory fMRI study into inferences of self-agency.,"Renes RA, van Haren NE, Aarts H, Vink M",Social cognitive and affective neuroscience,0.106,25170021,10.1093/scan/nsu106,-1
parietal lobule_00092,https://pubmed.ncbi.nlm.nih.gov/18003884/,Human superior parietal lobule is involved in somatic perception of bimanual interaction with an external object.,"Naito E, Scheperjans F, Eickhoff SB, Amunts K, Roland PE, Zilles K, Ehrsson HH",Journal of neurophysiology,0.105,18003884,10.1152/jn.00529.2007,-1
parietal lobule_00093,https://pubmed.ncbi.nlm.nih.gov/26159323/,Neural sources of performance decline during continuous multitasking.,"Al-Hashimi O, Zanto TP, Gazzaley A",Cortex; a journal devoted to the study of the nervous system and behavior,0.105,26159323,10.1016/j.cortex.2015.06.001,-1
parietal lobule_00094,https://pubmed.ncbi.nlm.nih.gov/15766766/,Generating animal and tool names: an fMRI study of effective connectivity.,"Vitali P, Abutalebi J, Tettamanti M, Rowe J, Scifo P, Fazio F, Cappa SF, Perani D",Brain and language,0.103,15766766,10.1016/j.bandl.2004.08.005,-1
parietal lobule_00095,https://pubmed.ncbi.nlm.nih.gov/22285603/,Real-time fMRI-based neurofeedback reinforces causality of attention networks.,"Lee JH, Kim J, Yoo SS",Neuroscience research,0.103,22285603,-1,-1
