paper_name,paper_url,Title,Author,Journal,Loading,PMID,Doi,download_status
parietal lobule_00191,https://pubmed.ncbi.nlm.nih.gov/21220170/,Seeing Chinese characters in action: an fMRI study of the perception of writing sequences.,"Yu H, Gong L, Qiu Y, Zhou X",Brain and language,0.079,21220170,10.1016/j.bandl.2010.11.007,-1
parietal lobule_00192,https://pubmed.ncbi.nlm.nih.gov/22188383/,The anterior superior parietal lobule and its interactions with language and motor areas during writing.,"Segal E, Petrides M",The European journal of neuroscience,0.079,22188383,10.1111/j.1460-9568.2011.07937.x,-1
parietal lobule_00193,https://pubmed.ncbi.nlm.nih.gov/22429244/,Distinct cortical networks support the planning and online control of reaching-to-grasp in humans.,"Glover S, Wall MB, Smith AT",The European journal of neuroscience,0.079,22429244,10.1111/j.1460-9568.2012.08018.x,-1
parietal lobule_00194,https://pubmed.ncbi.nlm.nih.gov/22975196/,Counterfactuals in action: an fMRI study of counterfactual sentences describing physical effort.,"Urrutia M, Gennari SP, de Vega M",Neuropsychologia,0.079,22975196,-1,-1
parietal lobule_00195,https://pubmed.ncbi.nlm.nih.gov/23103517/,Towards a neural circuit model of verbal humor processing: An fMRI study of the neural substrates of incongruity detection and resolution.,"Chan YC, Chou TL, Chen HC, Yeh YC, Lavallee JP, Liang KC, Chang KE",NeuroImage,0.079,23103517,-1,-1
parietal lobule_00196,https://pubmed.ncbi.nlm.nih.gov/25512040/,Brain activity dynamics in human parietal regions during spontaneous switches in  bistable perception.,"Megumi F, Bahrami B, Kanai R, Rees G",NeuroImage,0.079,25512040,-1,-1
parietal lobule_00197,https://pubmed.ncbi.nlm.nih.gov/25797099/,Phonology and arithmetic in the language-calculation network.,"Andin J, Fransson P, Ronnberg J, Rudner M",Brain and language,0.079,25797099,-1,-1
parietal lobule_00198,https://pubmed.ncbi.nlm.nih.gov/27683905/,Multivariate Pattern Analysis Reveals Category-Related Organization of Semantic Representations in Anterior Temporal Cortex.,"Malone PS, Glezer LS, Kim J, Jiang X, Riesenhuber M",The Journal of neuroscience : the official journal of the Society for Neuroscience,0.079,27683905,-1,-1
parietal lobule_00199,https://pubmed.ncbi.nlm.nih.gov/11099827/,Naming of animals and tools: a functional magnetic resonance imaging study of categorical differences in the human brain areas commonly used for naming visually presented objects.,"Okada T, Tanaka S, Nakai T, Nishizawa S, Inui T, Sadato N, Yonekura Y, Konishi J",Neuroscience letters,0.078,11099827,-1,-1
parietal lobule_00200,https://pubmed.ncbi.nlm.nih.gov/11832233/,"Topographical layout of hand, eye, calculation, and language-related areas in the human parietal lobe.","Simon O, Mangin JF, Cohen L, Le Bihan D, Dehaene S",Neuron,0.078,11832233,-1,-1
parietal lobule_00201,https://pubmed.ncbi.nlm.nih.gov/15115734/,Individual differences in error processing: a review and reanalysis of three event-related fMRI studies using the GO/NOGO task.,"Hester R, Fassbender C, Garavan H","Cerebral cortex (New York, N.Y. : 1991)",0.078,15115734,-1,-1
parietal lobule_00202,https://pubmed.ncbi.nlm.nih.gov/17720687/,A frontoparietal network for spatial attention reorienting in the auditory domain: a human fMRI/MEG study of functional and temporal dynamics.,"Brunetti M, Della Penna S, Ferretti A, Del Gratta C, Cianflone F, Belardinelli P, Caulo M, Pizzella V, Olivetti Belardinelli M, Romani GL","Cerebral cortex (New York, N.Y. : 1991)",0.078,17720687,-1,-1
parietal lobule_00203,https://pubmed.ncbi.nlm.nih.gov/19539711/,Gaze-related mimic word activates the frontal eye field and related network in the human brain: an fMRI study.,"Osaka N, Osaka M",Neuroscience letters,0.078,19539711,-1,-1
parietal lobule_00204,https://pubmed.ncbi.nlm.nih.gov/24183468/,Fronto-parietal dorsal and ventral pathways in the context of different linguistic manipulations.,"Kellmeyer P, Ziegler W, Peschke C, Juliane E, Schnell S, Baumgaertner A, Weiller C, Saur D",Brain and language,0.078,24183468,-1,-1
parietal lobule_00205,https://pubmed.ncbi.nlm.nih.gov/24532700/,Short-term meditation modulates brain activity of insight evoked with solution cue.,"Ding X, Tang YY, Cao C, Deng Y, Wang Y, Xin X, Posner MI",Social cognitive and affective neuroscience,0.078,24532700,-1,-1
parietal lobule_00206,https://pubmed.ncbi.nlm.nih.gov/25203270/,The association between gray matter volume and reading proficiency: a longitudinal study of beginning readers.,"Linkersdorfer J, Jurcoane A, Lindberg S, Kaiser J, Hasselhorn M, Fiebach CJ, Lonnemann J",Journal of cognitive neuroscience,0.078,25203270,-1,-1
parietal lobule_00207,https://pubmed.ncbi.nlm.nih.gov/26226086/,Neural correlates of merging number words.,"Hung YH, Pallier C, Dehaene S, Lin YC, Chang A, Tzeng OJ, Wu DH",NeuroImage,0.078,26226086,-1,-1
parietal lobule_00208,https://pubmed.ncbi.nlm.nih.gov/26831102/,Selective memory retrieval of auditory what and auditory where involves the ventrolateral prefrontal cortex.,"Kostopoulos P, Petrides M",Proceedings of the National Academy of Sciences of the United States of America,0.078,26831102,-1,-1
parietal lobule_00209,https://pubmed.ncbi.nlm.nih.gov/28736516/,Weaker Functional Connectivity Strength in Patients with Type 2 Diabetes Mellitus.,"Liu L, Li W, Zhang Y, Qin W, Lu S, Zhang Q",Frontiers in neuroscience,0.078,28736516,-1,-1
parietal lobule_00210,https://pubmed.ncbi.nlm.nih.gov/11867253/,The experimental combination of rTMS and fMRI reveals the functional relevance of parietal cortex for visuospatial functions.,"Sack AT, Hubl D, Prvulovic D, Formisano E, Jandl M, Zanella FE, Maurer K, Goebel R, Dierks T, Linden DE",Brain research. Cognitive brain research,0.077,11867253,-1,-1
parietal lobule_00211,https://pubmed.ncbi.nlm.nih.gov/17350054/,Functional brain correlates of response time variability in children.,"Simmonds DJ, Fotedar SG, Suskauer SJ, Pekar JJ, Denckla MB, Mostofsky SH",Neuropsychologia,0.077,17350054,10.1016/j.neuropsychologia.2007.01.013,-1
parietal lobule_00212,https://pubmed.ncbi.nlm.nih.gov/21376542/,"The effects of DISC1 risk variants on brain activation in controls, patients with bipolar disorder and patients with schizophrenia.","Chakirova G, Whalley HC, Thomson PA, Hennah W, Moorhead TW, Welch KA, Giles S, Hall J, Johnstone EC, Lawrie SM, Porteous DJ, Brown VJ, McIntosh AM",Psychiatry research,0.077,21376542,10.1016/j.pscychresns.2011.01.015,-1
parietal lobule_00213,https://pubmed.ncbi.nlm.nih.gov/23400699/,Experimental induction of reading difficulties in normal readers provides novel insights into the neurofunctional mechanisms of visual word recognition.,"Heim S, Weidner R, von Overheidt AC, Tholen N, Grande M, Amunts K",Brain structure & function,0.077,23400699,10.1007/s00429-013-0509-7,-1
parietal lobule_00214,https://pubmed.ncbi.nlm.nih.gov/25241084/,Lateralization of resting state networks and relationship to age and gender.,"Agcaoglu O, Miller R, Mayer AR, Hugdahl K, Calhoun VD",NeuroImage,0.077,25241084,10.1016/j.neuroimage.2014.09.001,-1
parietal lobule_00215,https://pubmed.ncbi.nlm.nih.gov/25892332/,Differentiating neural systems mediating the acquisition vs. expression of goal-directed and habitual behavioral control.,"Liljeholm M, Dunne S, O'Doherty JP",The European journal of neuroscience,0.077,25892332,-1,-1
parietal lobule_00216,https://pubmed.ncbi.nlm.nih.gov/27747153/,"Structural brain abnormalities in a single gene disorder associated with epilepsy, language impairment and intellectual disability.","Bathelt J, Astle D, Barnes J, Raymond FL, Baker K",NeuroImage. Clinical,0.077,27747153,-1,-1
parietal lobule_00217,https://pubmed.ncbi.nlm.nih.gov/12098493/,Common neural processing regions for dynamic and static stereopsis in human parieto-occipital cortices.,"Iwami T, Nishida Y, Hayashi O, Kimura M, Sakai M, Kani K, Ito R, Shiino A, Suzuki M",Neuroscience letters,0.076,12098493,-1,-1
parietal lobule_00218,https://pubmed.ncbi.nlm.nih.gov/17604649/,I'm not as slim as that girl: neural bases of body shape self-comparison to media images.,"Friederich HC, Uher R, Brooks S, Giampietro V, Brammer M, Williams SC, Herzog W, Treasure J, Campbell IC",NeuroImage,0.076,17604649,-1,-1
parietal lobule_00219,https://pubmed.ncbi.nlm.nih.gov/19540923/,Conflict control during sentence comprehension: fMRI evidence.,"Ye Z, Zhou X",NeuroImage,0.076,19540923,-1,-1
parietal lobule_00220,https://pubmed.ncbi.nlm.nih.gov/19883666/,Neural correlates of top-down letter processing.,"Liu J, Li J, Zhang H, Rieth CA, Huber DE, Li W, Lee K, Tian J",Neuropsychologia,0.076,19883666,-1,-1
parietal lobule_00221,https://pubmed.ncbi.nlm.nih.gov/21295015/,Motor control of jaw movements: An fMRI study of parafunctional clench and grind  behavior.,"Wong D, Dzemidzic M, Talavage TM, Romito LM, Byrd KE",Brain research,0.076,21295015,-1,-1
parietal lobule_00222,https://pubmed.ncbi.nlm.nih.gov/21618663/,Coupling electrophysiological and hemodynamic responses to errors.,"Donamayor N, Heilbronner U, Munte TF",Human brain mapping,0.076,21618663,-1,-1
parietal lobule_00223,https://pubmed.ncbi.nlm.nih.gov/21798310/,Altered regional homogeneity in motor cortices in patients with multiple system atrophy.,"You H, Wang J, Wang H, Zang YF, Zheng FL, Meng CL, Feng F",Neuroscience letters,0.076,21798310,-1,-1
parietal lobule_00224,https://pubmed.ncbi.nlm.nih.gov/23884955/,Neural correlates of the divergence of instrumental probability distributions.,"Liljeholm M, Wang S, Zhang J, O'Doherty JP",The Journal of neuroscience : the official journal of the Society for Neuroscience,0.076,23884955,-1,-1
parietal lobule_00225,https://pubmed.ncbi.nlm.nih.gov/23966916/,Explorations of object and location memory using fMRI.,"Passaro AD, Elmore LC, Ellmore TM, Leising KJ, Papanicolaou AC, Wright AA",Frontiers in behavioral neuroscience,0.076,23966916,-1,-1
parietal lobule_00226,https://pubmed.ncbi.nlm.nih.gov/25379447/,Functional neuroimaging of conversion disorder: The role of ancillary activation.,"Burke MJ, Ghaffar O, Staines WR, Downar J, Feinstein A",NeuroImage. Clinical,0.076,25379447,-1,-1
parietal lobule_00227,https://pubmed.ncbi.nlm.nih.gov/25463140/,Responsiveness and functional connectivity of the scene-sensitive retrosplenial complex in 7-11-year-old children.,"Jiang P, Tokariev M, Aronen ET, Salonen O, Ma Y, Vuontela V, Carlson S",Brain and cognition,0.076,25463140,-1,-1
parietal lobule_00228,https://pubmed.ncbi.nlm.nih.gov/17979124/,Brain network dynamics during error commission.,"Stevens MC, Kiehl KA, Pearlson GD, Calhoun VD",Human brain mapping,0.075,17979124,-1,-1
parietal lobule_00229,https://pubmed.ncbi.nlm.nih.gov/19052227/,A functional magnetic resonance imaging study on the neural mechanisms of hyperalgesic nocebo effect.,"Kong J, Gollub RL, Polich G, Kirsch I, Laviolette P, Vangel M, Rosen B, Kaptchuk TJ",The Journal of neuroscience : the official journal of the Society for Neuroscience,0.075,19052227,-1,-1
parietal lobule_00230,https://pubmed.ncbi.nlm.nih.gov/19726653/,"Multisensory integration of sounds and vibrotactile stimuli in processing streams for ""what"" and ""where"".","Renier LA, Anurova I, De Volder AG, Carlson S, VanMeter J, Rauschecker JP",The Journal of neuroscience : the official journal of the Society for Neuroscience,0.075,19726653,-1,-1
parietal lobule_00231,https://pubmed.ncbi.nlm.nih.gov/20723605/,Similarities and differences in perceiving threat from dynamic faces and bodies.  An fMRI study.,"Kret ME, Pichon S, Grezes J, de Gelder B",NeuroImage,0.075,20723605,10.1016/j.neuroimage.2010.08.012,-1
parietal lobule_00232,https://pubmed.ncbi.nlm.nih.gov/22699900/,Priming of control: implicit contextual cuing of top-down attentional set.,"King JA, Korb FM, Egner T",The Journal of neuroscience : the official journal of the Society for Neuroscience,0.075,22699900,10.1523/JNEUROSCI.0934-12.2012,-1
parietal lobule_00233,https://pubmed.ncbi.nlm.nih.gov/22815229/,Reading acquisition reorganizes the phonological awareness network only in alphabetic writing systems.,"Brennan C, Cao F, Pedroarena-Leal N, McNorgan C, Booth JR",Human brain mapping,0.075,22815229,10.1002/hbm.22147,-1
parietal lobule_00234,https://pubmed.ncbi.nlm.nih.gov/25447374/,Integration of cognitive and affective networks in humor comprehension.,"Shibata M, Terasawa Y, Umeda S",Neuropsychologia,0.075,25447374,-1,-1
parietal lobule_00235,https://pubmed.ncbi.nlm.nih.gov/18330872/,Developmental differences of neurocognitive networks for phonological and semantic processing in Chinese word reading.,"Cao F, Peng D, Liu L, Jin Z, Fan N, Deng Y, Booth JR",Human brain mapping,0.074,18330872,-1,-1
parietal lobule_00236,https://pubmed.ncbi.nlm.nih.gov/19324533/,The neural basis of visuospatial perception in Alzheimer's disease and healthy elderly comparison subjects: an fMRI study.,"Thiyagesh SN, Farrow TF, Parks RW, Accosta-Mesa H, Young C, Wilkinson ID, Hunter MD, Woodruff PW",Psychiatry research,0.074,19324533,-1,-1
parietal lobule_00237,https://pubmed.ncbi.nlm.nih.gov/19376244/,Neural substrates of visual paired associates in young adults with a history of very preterm birth: alterations in fronto-parieto-occipital networks and caudate  nucleus.,"Narberhaus A, Lawrence E, Allin MP, Walshe M, McGuire P, Rifkin L, Murray R, Nosarti C",NeuroImage,0.074,19376244,-1,-1
parietal lobule_00238,https://pubmed.ncbi.nlm.nih.gov/20494338/,Regional brain activity during early visual perception in unaffected siblings of  schizophrenia patients.,"Lee J, Cohen MS, Engel SA, Glahn D, Nuechterlein KH, Wynn JK, Green MF",Biological psychiatry,0.074,20494338,-1,-1
parietal lobule_00239,https://pubmed.ncbi.nlm.nih.gov/22708629/,The morphology and variability of the caudal rami of the superior temporal sulcus.,"Segal E, Petrides M",The European journal of neuroscience,0.074,22708629,-1,-1
parietal lobule_00240,https://pubmed.ncbi.nlm.nih.gov/25241085/,Responses to irrational actions in action observation and mentalising networks of the human brain.,"Marsh LE, Mullett TL, Ropar D, Hamilton AFC",NeuroImage,0.074,25241085,-1,-1
parietal lobule_00241,https://pubmed.ncbi.nlm.nih.gov/25868150/,Language control in bilinguals: Intention to speak vs. execution of speech.,"Reverberi C, Kuhlen A, Abutalebi J, Greulich RS, Costa A, Seyed-Allaei S, Haynes JD",Brain and language,0.074,25868150,-1,-1
parietal lobule_00242,https://pubmed.ncbi.nlm.nih.gov/25903464/,Prediction During Natural Language Comprehension.,"Willems RM, Frank SL, Nijhof AD, Hagoort P, van den Bosch A","Cerebral cortex (New York, N.Y. : 1991)",0.074,25903464,-1,-1
parietal lobule_00243,https://pubmed.ncbi.nlm.nih.gov/26123381/,Degree centrality and fractional amplitude of low-frequency oscillations associated with Stroop interference.,"Takeuchi H, Taki Y, Nouchi R, Sekiguchi A, Hashizume H, Sassa Y, Kotozaki Y, Miyauchi CM, Yokoyama R, Iizuka K, Nakagawa S, Nagase T, Kunitoki K, Kawashima R",NeuroImage,0.074,26123381,-1,-1
parietal lobule_00244,https://pubmed.ncbi.nlm.nih.gov/27810354/,Human sensory cortex structure and top-down controlling brain network determine individual differences in perceptual alternations.,"Sang N, Zhang L, Hao L, Wang Y, Wang X, Zhang F, Huang H, Hou X, Mao Y, Bi T, Qiu J",Neuroscience letters,0.074,27810354,-1,-1
parietal lobule_00245,https://pubmed.ncbi.nlm.nih.gov/15130588/,The cerebellum and decision making under uncertainty.,"Blackwood N, Ffytche D, Simmons A, Bentall R, Murray R, Howard R",Brain research. Cognitive brain research,0.073,15130588,-1,-1
parietal lobule_00246,https://pubmed.ncbi.nlm.nih.gov/16306323/,Neural correlates of the spontaneous phase transition during bimanual coordination.,"Aramaki Y, Honda M, Okada T, Sadato N","Cerebral cortex (New York, N.Y. : 1991)",0.073,16306323,-1,-1
parietal lobule_00247,https://pubmed.ncbi.nlm.nih.gov/19943038/,Contorted and ordinary body postures in the human brain.,"Cross ES, Mackie EC, Wolford G, Hamilton AF",Experimental brain research,0.073,19943038,-1,-1
parietal lobule_00248,https://pubmed.ncbi.nlm.nih.gov/21461742/,Linking coordinative and executive dysfunctions to atrophy in spinocerebellar ataxia 2 patients.,"D'Agata F, Caroppo P, Boghi A, Coriasco M, Caglio M, Baudino B, Sacco K, Cauda F, Geda E, Bergui M, Geminiani G, Bradac GB, Orsi L, Mortara P",Brain structure & function,0.073,21461742,-1,-1
parietal lobule_00249,https://pubmed.ncbi.nlm.nih.gov/21554968/,Handedness-dependent and -independent cerebral asymmetries in the anterior intraparietal sulcus and ventral premotor cortex during grasp planning.,"Martin K, Jacobs S, Frey SH",NeuroImage,0.073,21554968,-1,-1
parietal lobule_00250,https://pubmed.ncbi.nlm.nih.gov/23404335/,Parietal substrates for dimensional effects in visual search: evidence from lesion-symptom mapping.,"Utz S, Humphreys GW, Chechlacz M",Brain : a journal of neurology,0.073,23404335,-1,-1
parietal lobule_00251,https://pubmed.ncbi.nlm.nih.gov/23711484/,Frontoparietal mechanisms supporting attention to location and intensity of painful stimuli.,"Lobanov OV, Quevedo AS, Hadsel MS, Kraft RA, Coghill RC",Pain,0.073,23711484,10.1016/j.pain.2013.05.030,-1
parietal lobule_00252,https://pubmed.ncbi.nlm.nih.gov/23756137/,A large scale (N=102) functional neuroimaging study of response inhibition in a Go/NoGo task.,"Steele VR, Aharoni E, Munro GE, Calhoun VD, Nyalakanti P, Stevens MC, Pearlson G, Kiehl KA",Behavioural brain research,0.073,23756137,10.1016/j.bbr.2013.06.001,-1
parietal lobule_00253,https://pubmed.ncbi.nlm.nih.gov/24493844/,Future planning: default network activity couples with frontoparietal control network and reward-processing regions during process and outcome simulations.,"Gerlach KD, Spreng RN, Madore KP, Schacter DL",Social cognitive and affective neuroscience,0.073,24493844,10.1093/scan/nsu001,-1
parietal lobule_00254,https://pubmed.ncbi.nlm.nih.gov/26219536/,Neural activity patterns evoked by a spouse's incongruent emotional reactions when recalling marriage-relevant experiences.,"Petrican R, Rosenbaum RS, Grady C",Human brain mapping,0.073,26219536,10.1002/hbm.22909,-1
parietal lobule_00255,https://pubmed.ncbi.nlm.nih.gov/26252893/,Voxel Based Morphometry Alterations in Mal de Debarquement Syndrome.,"Cha YH, Chakrapani S",PloS one,0.073,26252893,-1,-1
parietal lobule_00256,https://pubmed.ncbi.nlm.nih.gov/15183391/,The where and how of attention-based rehearsal in spatial working memory.,"Postle BR, Awh E, Jonides J, Smith EE, D'Esposito M",Brain research. Cognitive brain research,0.072,15183391,-1,-1
parietal lobule_00257,https://pubmed.ncbi.nlm.nih.gov/18455308/,Default-mode network activity distinguishes amnestic type mild cognitive impairment from healthy aging: a combined structural and resting-state functional MRI study.,"Bai F, Zhang Z, Yu H, Shi Y, Yuan Y, Zhu W, Zhang X, Qian Y",Neuroscience letters,0.072,18455308,-1,-1
parietal lobule_00258,https://pubmed.ncbi.nlm.nih.gov/19574393/,Auditory attentional control and selection during cocktail party listening.,"Hill KT, Miller LM","Cerebral cortex (New York, N.Y. : 1991)",0.072,19574393,-1,-1
parietal lobule_00259,https://pubmed.ncbi.nlm.nih.gov/21937029/,Right hemispheric participation in semantic decision improves performance.,"Donnelly KM, Allendorfer JB, Szaflarski JP",Brain research,0.072,21937029,-1,-1
parietal lobule_00260,https://pubmed.ncbi.nlm.nih.gov/21962775/,Differential neural activity and connectivity for processing one's own face: a preliminary report.,"Ramasubbu R, Masalovich S, Gaxiola I, Peltier S, Holtzheimer PE, Heim C, Goodyear B, Macqueen G, Mayberg HS",Psychiatry research,0.072,21962775,-1,-1
parietal lobule_00261,https://pubmed.ncbi.nlm.nih.gov/26304153/,From perceptual to lexico-semantic analysis--cortical plasticity enabling new levels of processing.,"Schlaffke L, Ruther NN, Heba S, Haag LM, Schultz T, Rosengarth K, Tegenthoff M, Bellebaum C, Schmidt-Wilcke T",Human brain mapping,0.072,26304153,-1,-1
parietal lobule_00262,https://pubmed.ncbi.nlm.nih.gov/26590845/,EEG marker of inhibitory brain activity correlates with resting-state cerebral blood flow in the reward system in major depression.,"Cantisani A, Koenig T, Stegmayer K, Federspiel A, Horn H, Muller TJ, Wiest R, Strik W, Walther S",European archives of psychiatry and clinical neuroscience,0.072,26590845,-1,-1
parietal lobule_00263,https://pubmed.ncbi.nlm.nih.gov/11313298/,Somatotopic organization of human secondary somatosensory cortex.,"Ruben J, Schwiemann J, Deuchert M, Meyer R, Krause T, Curio G, Villringer K, Kurth R, Villringer A","Cerebral cortex (New York, N.Y. : 1991)",0.071,11313298,-1,-1
parietal lobule_00264,https://pubmed.ncbi.nlm.nih.gov/15627576/,Cerebrocerebellar networks during articulatory rehearsal and verbal working memory tasks.,"Chen SH, Desmond JE",NeuroImage,0.071,15627576,-1,-1
parietal lobule_00265,https://pubmed.ncbi.nlm.nih.gov/15949507/,Temporal dynamics of cerebro-cerebellar network recruitment during a cognitive task.,"Chen SH, Desmond JE",Neuropsychologia,0.071,15949507,-1,-1
parietal lobule_00266,https://pubmed.ncbi.nlm.nih.gov/17394210/,Relation between muscle and brain activity during isometric contractions of the first dorsal interosseus muscle.,"van Duinen H, Renken R, Maurits NM, Zijdewind I",Human brain mapping,0.071,17394210,-1,-1
parietal lobule_00267,https://pubmed.ncbi.nlm.nih.gov/17499159/,The neural basis for understanding non-intended actions.,"Buccino G, Baumgaertner A, Colle L, Buechel C, Rizzolatti G, Binkofski F",NeuroImage,0.071,17499159,-1,-1
parietal lobule_00268,https://pubmed.ncbi.nlm.nih.gov/19683419/,Patterns of brain activity during a semantic task differentiate normal aging from early Alzheimer's disease.,"McGeown WJ, Shanks MF, Forbes-McKay KE, Venneri A",Psychiatry research,0.071,19683419,-1,-1
parietal lobule_00269,https://pubmed.ncbi.nlm.nih.gov/20619279/,Parietal cortex coding of limb posture: in search of the body-schema.,"Parkinson A, Condon L, Jackson SR",Neuropsychologia,0.071,20619279,-1,-1
parietal lobule_00270,https://pubmed.ncbi.nlm.nih.gov/21741302/,Effects of mobile phone signals over BOLD response while performing a cognitive task.,"Curcio G, Nardo D, Perrucci MG, Pasqualetti P, Chen TL, Del Gratta C, Romani GL, Rossini PM",Clinical neurophysiology : official journal of the International Federation of Clinical Neurophysiology,0.071,21741302,-1,-1
parietal lobule_00271,https://pubmed.ncbi.nlm.nih.gov/22206809/,Brain activation during spatial updating and attentive tracking of moving targets.,"Jahn G, Wendt J, Lotze M, Papenmeier F, Huff M",Brain and cognition,0.071,22206809,10.1016/j.bandc.2011.12.001,-1
parietal lobule_00272,https://pubmed.ncbi.nlm.nih.gov/23140909/,Quantitative cerebral blood flow mapping and functional connectivity of postherpetic neuralgia pain: a perfusion fMRI study.,"Liu J, Hao Y, Du M, Wang X, Zhang J, Manor B, Jiang X, Fang W, Wang D",Pain,0.071,23140909,10.1016/j.pain.2012.09.016,-1
parietal lobule_00273,https://pubmed.ncbi.nlm.nih.gov/23748500/,Neural substrates of classically conditioned fear-generalization in humans: a parametric fMRI study.,"Lissek S, Bradford DE, Alvarez RP, Burton P, Espensen-Sturges T, Reynolds RC, Grillon C",Social cognitive and affective neuroscience,0.071,23748500,-1,-1
parietal lobule_00274,https://pubmed.ncbi.nlm.nih.gov/24553134/,Reduced frontal activity during response inhibition in individuals with psychopathic traits: an sLORETA study.,"Kim YY, Jung YS",Biological psychology,0.071,24553134,-1,-1
parietal lobule_00275,https://pubmed.ncbi.nlm.nih.gov/24795593/,Brain activation during phonological and semantic processing of Chinese characters in deaf signers.,"Li Y, Peng D, Liu L, Booth JR, Ding G",Frontiers in human neuroscience,0.071,24795593,-1,-1
parietal lobule_00276,https://pubmed.ncbi.nlm.nih.gov/26004037/,Alteration of spontaneous neuronal activity in young adults with non-clinical depressive symptoms.,"Wei X, Shen H, Ren J, Liu W, Yang R, Liu J, Wu H, Xu X, Lai L, Hu J, Pan X, Jiang X",Psychiatry research,0.071,26004037,-1,-1
parietal lobule_00277,https://pubmed.ncbi.nlm.nih.gov/26291449/,Neural Basis of Psychological Growth following Adverse Experiences: A Resting-State Functional MRI Study.,"Fujisawa TX, Jung M, Kojima M, Saito DN, Kosaka H, Tomoda A",PloS one,0.071,26291449,-1,-1
parietal lobule_00278,https://pubmed.ncbi.nlm.nih.gov/28974380/,Neural evidence for defective top-down control of visual processing in Parkinson's and Alzheimer's disease.,"Nemcova Elfmarkova N, Gajdos M, Rektorova I, Marecek R, Rapcsak SZ",Neuropsychologia,0.071,28974380,-1,-1
parietal lobule_00279,https://pubmed.ncbi.nlm.nih.gov/29477840/,One-way traffic: The inferior frontal gyrus controls brain activation in the middle temporal gyrus and inferior parietal lobule during divergent thinking.,"Vartanian O, Beatty EL, Smith I, Blackler K, Lam Q, Forbes S",Neuropsychologia,0.071,29477840,-1,-1
parietal lobule_00280,https://pubmed.ncbi.nlm.nih.gov/16300965/,Cortical activation in the processing of passive sentences in L1 and L2: an fMRI  study.,"Yokoyama S, Okamoto H, Miyamoto T, Yoshimoto K, Kim J, Iwata K, Jeong H, Uchida S, Ikuta N, Sassa Y, Nakamura W, Horie K, Sato S, Kawashima R",NeuroImage,0.07,16300965,-1,-1
parietal lobule_00281,https://pubmed.ncbi.nlm.nih.gov/18234508/,Neural codes for somatosensory two-point discrimination in inferior parietal lobule: an fMRI study.,"Akatsuka K, Noguchi Y, Harada T, Sadato N, Kakigi R",NeuroImage,0.07,18234508,-1,-1
parietal lobule_00282,https://pubmed.ncbi.nlm.nih.gov/19288466/,Functional interactions guiding adaptive processing of behavioral significance.,"Diekhof EK, Falkai P, Gruber O",Human brain mapping,0.07,19288466,-1,-1
