paper_name,paper_url,Title,Author,Journal,Loading,PMID,Doi,download_status
parietal lobule_00468,https://pubmed.ncbi.nlm.nih.gov/16757180/,Neuroanatomical dissociation between bottom-up and top-down processes of visuospatial selective attention.,"Hahn B, Ross TJ, Stein EA",NeuroImage,0.058,16757180,-1,-1
parietal lobule_00469,https://pubmed.ncbi.nlm.nih.gov/17621607/,The different neural correlates of action and functional knowledge in semantic memory: an FMRI study.,"Canessa N, Borgo F, Cappa SF, Perani D, Falini A, Buccino G, Tettamanti M, Shallice T","Cerebral cortex (New York, N.Y. : 1991)",0.058,17621607,-1,-1
parietal lobule_00470,https://pubmed.ncbi.nlm.nih.gov/20181590/,The inferior parietal lobule and recognition memory: expectancy violation or successful retrieval?,"O'Connor AR, Han S, Dobbins IG",The Journal of neuroscience : the official journal of the Society for Neuroscience,0.058,20181590,-1,-1
parietal lobule_00471,https://pubmed.ncbi.nlm.nih.gov/20633662/,Sex-linked white matter microstructure of the social and analytic brain.,"Chou KH, Cheng Y, Chen IY, Lin CP, Chu WC",NeuroImage,0.058,20633662,-1,-1
parietal lobule_00472,https://pubmed.ncbi.nlm.nih.gov/22088776/,"A key role for experimental task performance: effects of math talent, gender and  performance on the neural correlates of mental rotation.","Hoppe C, Fliessbach K, Stausberg S, Stojanovic J, Trautner P, Elger CE, Weber B",Brain and cognition,0.058,22088776,10.1016/j.bandc.2011.10.008,-1
parietal lobule_00473,https://pubmed.ncbi.nlm.nih.gov/22452559/,Nicotine effects on brain function during a visual oddball task: a comparison between conventional and EEG-informed fMRI analysis.,"Warbrick T, Mobascher A, Brinkmeyer J, Musso F, Stoecker T, Shah NJ, Fink GR, Winterer G",Journal of cognitive neuroscience,0.058,22452559,10.1162/jocn_a_00236,-1
parietal lobule_00474,https://pubmed.ncbi.nlm.nih.gov/23774397/,Neural substrates of cognitive switching and inhibition in a face processing task.,"Piguet C, Sterpenich V, Desseilles M, Cojan Y, Bertschy G, Vuilleumier P",NeuroImage,0.058,23774397,10.1016/j.neuroimage.2013.06.015,-1
parietal lobule_00475,https://pubmed.ncbi.nlm.nih.gov/24297657/,Long-term intensive training induced brain structural changes in world class gymnasts.,"Huang R, Lu M, Song Z, Wang J",Brain structure & function,0.058,24297657,-1,-1
parietal lobule_00476,https://pubmed.ncbi.nlm.nih.gov/25847180/,In Search of Multimodal Neuroimaging Biomarkers of Cognitive Deficits in Schizophrenia.,"Sui J, Pearlson GD, Du Y, Yu Q, Jones TR, Chen J, Jiang T, Bustillo J, Calhoun VD",Biological psychiatry,0.058,25847180,-1,-1
parietal lobule_00477,https://pubmed.ncbi.nlm.nih.gov/25970523/,Aberrant function of learning and cognitive control networks underlie inefficient cognitive flexibility in anorexia nervosa: a cross-sectional FMRI study.,"Lao-Kaim NP, Fonville L, Giampietro VP, Williams SC, Simmons A, Tchanturia K",PloS one,0.058,25970523,-1,-1
parietal lobule_00478,https://pubmed.ncbi.nlm.nih.gov/26190403/,Response control networks are selectively modulated by attention to rare events and memory load regardless of the need for inhibition.,"Wijeakumar S, Magnotta VA, Buss AT, Ambrose JP, Wifall TA, Hazeltine E, Spencer JP",NeuroImage,0.058,26190403,-1,-1
parietal lobule_00479,https://pubmed.ncbi.nlm.nih.gov/28431987/,Patterns of brain and cardiovascular activation while solving rule-discovery and  rule-application numeric tasks.,"Sosnowski T, Rynkiewicz A, Wordecha M, Kepkowicz A, Majewska A, Pstragowska A, Oleksy T, Wypych M, Marchewka A",International journal of psychophysiology : official journal of the International Organization of Psychophysiology,0.058,28431987,-1,-1
parietal lobule_00480,https://pubmed.ncbi.nlm.nih.gov/28578155/,Prefrontal-parietal effective connectivity during working memory in older adults.,"Heinzel S, Lorenz RC, Duong QL, Rapp MA, Deserno L",Neurobiology of aging,0.058,28578155,-1,-1
parietal lobule_00481,https://pubmed.ncbi.nlm.nih.gov/29536173/,Task- and domain-specific modulation of functional connectivity in the ventral and dorsal object-processing pathways.,"Garcea FE, Chen Q, Vargas R, Narayan DA, Mahon BZ",Brain structure & function,0.058,29536173,-1,-1
parietal lobule_00482,https://pubmed.ncbi.nlm.nih.gov/14980575/,Spatial and temporal factors during processing of audiovisual speech: a PET study.,"Macaluso E, George N, Dolan R, Spence C, Driver J",NeuroImage,0.057,14980575,-1,-1
parietal lobule_00483,https://pubmed.ncbi.nlm.nih.gov/16427324/,Continuous ASL perfusion fMRI investigation of higher cognition: quantification of tonic CBF changes during sustained attention and working memory tasks.,"Kim J, Whyte J, Wang J, Rao H, Tang KZ, Detre JA",NeuroImage,0.057,16427324,-1,-1
parietal lobule_00484,https://pubmed.ncbi.nlm.nih.gov/16473025/,Interactions between ego- and allocentric neuronal representations of space.,"Neggers SF, Van der Lubbe RH, Ramsey NF, Postma A",NeuroImage,0.057,16473025,-1,-1
parietal lobule_00485,https://pubmed.ncbi.nlm.nih.gov/16716387/,Neuroanatomically separable effects of imageability and grammatical class during  single-word comprehension.,"Bedny M, Thompson-Schill SL",Brain and language,0.057,16716387,-1,-1
parietal lobule_00486,https://pubmed.ncbi.nlm.nih.gov/17977592/,Neuroanatomical distribution of five semantic components of verbs: evidence from  fMRI.,"Kemmerer D, Castillo JG, Talavage T, Patterson S, Wiley C",Brain and language,0.057,17977592,-1,-1
parietal lobule_00487,https://pubmed.ncbi.nlm.nih.gov/18495180/,Modifying the brain activation of poor readers during sentence comprehension with extended remedial instruction: a longitudinal study of neuroplasticity.,"Meyler A, Keller TA, Cherkassky VL, Gabrieli JD, Just MA",Neuropsychologia,0.057,18495180,-1,-1
parietal lobule_00488,https://pubmed.ncbi.nlm.nih.gov/19107748/,Regional brain activation changes and abnormal functional connectivity of the ventrolateral prefrontal cortex during working memory processing in adults with attention-deficit/hyperactivity disorder.,"Wolf RC, Plichta MM, Sambataro F, Fallgatter AJ, Jacob C, Lesch KP, Herrmann MJ, Schonfeldt-Lecuona C, Connemann BJ, Gron G, Vasic N",Human brain mapping,0.057,19107748,-1,-1
parietal lobule_00489,https://pubmed.ncbi.nlm.nih.gov/20520767/,"The brain functional networks associated to human and animal suffering differ among omnivores, vegetarians and vegans.","Filippi M, Riccitelli G, Falini A, Di Salle F, Vuilleumier P, Comi G, Rocca MA",PloS one,0.057,20520767,-1,-1
parietal lobule_00490,https://pubmed.ncbi.nlm.nih.gov/20629027/,Neural correlates of pantomiming familiar and unfamiliar tools: action semantics  versus mechanical problem solving?,"Vingerhoets G, Vandekerckhove E, Honore P, Vandemaele P, Achten E",Human brain mapping,0.057,20629027,-1,-1
parietal lobule_00491,https://pubmed.ncbi.nlm.nih.gov/21671736/,Eye can see what you want: posterior intraparietal sulcus encodes the object of an actor's gaze.,"Ramsey R, Cross ES, Hamilton AF",Journal of cognitive neuroscience,0.057,21671736,10.1162/jocn_a_00074,-1
parietal lobule_00492,https://pubmed.ncbi.nlm.nih.gov/22669970/,Mental paper folding performance following penetrating traumatic brain injury in  combat veterans: a lesion mapping study.,"Glass L, Krueger F, Solomon J, Raymont V, Grafman J","Cerebral cortex (New York, N.Y. : 1991)",0.057,22669970,10.1093/cercor/bhs153,-1
parietal lobule_00493,https://pubmed.ncbi.nlm.nih.gov/23297206/,Complementary hemispheric specialization for language production and visuospatial attention.,"Cai Q, Van der Haegen L, Brysbaert M",Proceedings of the National Academy of Sciences of the United States of America,0.057,23297206,-1,-1
parietal lobule_00494,https://pubmed.ncbi.nlm.nih.gov/24384151/,False belief and counterfactual reasoning in a social environment.,"Van Hoeck N, Begtas E, Steen J, Kestemont J, Vandekerckhove M, Van Overwalle F",NeuroImage,0.057,24384151,-1,-1
parietal lobule_00495,https://pubmed.ncbi.nlm.nih.gov/24903120/,Brain areas associated with force steadiness and intensity during isometric ankle dorsiflexion in men and women.,"Yoon T, Vanden Noven ML, Nielson KA, Hunter SK",Experimental brain research,0.057,24903120,-1,-1
parietal lobule_00496,https://pubmed.ncbi.nlm.nih.gov/25557401/,Top-down controlled and bottom-up triggered orienting of auditory attention to pitch activate overlapping brain networks.,"Alho K, Salmi J, Koistinen S, Salonen O, Rinne T",Brain research,0.057,25557401,-1,-1
parietal lobule_00497,https://pubmed.ncbi.nlm.nih.gov/25632133/,Dynamic modulation of the action observation network by movement familiarity.,"Gardner T, Goulden N, Cross ES",The Journal of neuroscience : the official journal of the Society for Neuroscience,0.057,25632133,-1,-1
parietal lobule_00498,https://pubmed.ncbi.nlm.nih.gov/26215473/,Earlier adolescent substance use onset predicts stronger connectivity between reward and cognitive control brain networks.,"Weissman DG, Schriber RA, Fassbender C, Atherton O, Krafft C, Robins RW, Hastings PD, Guyer AE",Developmental cognitive neuroscience,0.057,26215473,-1,-1
parietal lobule_00499,https://pubmed.ncbi.nlm.nih.gov/27626634/,From Cortical and Subcortical Grey Matter Abnormalities to Neurobehavioral Phenotype of Angelman Syndrome: A Voxel-Based Morphometry Study.,"Aghakhanyan G, Bonanni P, Randazzo G, Nappi S, Tessarotto F, De Martin L, Frijia F, De Marchi D, De Masi F, Kuppers B, Lombardo F, Caramella D, Montanaro D",PloS one,0.057,27626634,-1,-1
parietal lobule_00500,https://pubmed.ncbi.nlm.nih.gov/29128871/,Neural substrate of unrelenting negative symptoms in schizophrenia: a longitudinal resting-state fMRI study.,"Li M, Deng W, Das T, Li Y, Zhao L, Ma X, Wang Y, Yu H, Li X, Meng YJ, Wang Q, Palaniyappan L, Li T",European archives of psychiatry and clinical neuroscience,0.057,29128871,-1,-1
parietal lobule_00501,https://pubmed.ncbi.nlm.nih.gov/15607988/,A voxel based morphometry study on mild cognitive impairment.,"Pennanen C, Testa C, Laakso MP, Hallikainen M, Helkala EL, Hanninen T, Kivipelto M, Kononen M, Nissinen A, Tervo S, Vanhanen M, Vanninen R, Frisoni GB, Soininen H","Journal of neurology, neurosurgery, and psychiatry",0.056,15607988,-1,-1
parietal lobule_00502,https://pubmed.ncbi.nlm.nih.gov/15808992/,"Self-face recognition activates a frontoparietal ""mirror"" network in the right hemisphere: an event-related fMRI study.","Uddin LQ, Kaplan JT, Molnar-Szakacs I, Zaidel E, Iacoboni M",NeuroImage,0.056,15808992,-1,-1
parietal lobule_00503,https://pubmed.ncbi.nlm.nih.gov/15922309/,Changes in gray matter volume in patients with bipolar disorder.,"Adler CM, Levine AD, DelBello MP, Strakowski SM",Biological psychiatry,0.056,15922309,-1,-1
parietal lobule_00504,https://pubmed.ncbi.nlm.nih.gov/16236528/,Parallel networks operating across attentional deployment and motion processing:  a multi-seed partial least squares fMRI study.,"Caplan JB, Luks TL, Simpson GV, Glaholt M, McIntosh AR",NeuroImage,0.056,16236528,-1,-1
parietal lobule_00505,https://pubmed.ncbi.nlm.nih.gov/17317678/,Brain activation during sentence comprehension among good and poor readers.,"Meyler A, Keller TA, Cherkassky VL, Lee D, Hoeft F, Whitfield-Gabrieli S, Gabrieli JD, Just MA","Cerebral cortex (New York, N.Y. : 1991)",0.056,17317678,-1,-1
parietal lobule_00506,https://pubmed.ncbi.nlm.nih.gov/19179050/,"Abnormal prefrontal cortical activity and connectivity during response selection  in first episode psychosis, chronic schizophrenia, and unaffected siblings of individuals with schizophrenia.","Woodward ND, Waldie B, Rogers B, Tibbo P, Seres P, Purdon SE",Schizophrenia research,0.056,19179050,-1,-1
parietal lobule_00507,https://pubmed.ncbi.nlm.nih.gov/20727412/,Symbolic representations in motor sequence learning.,"Bo J, Peltier SJ, Noll DC, Seidler RD",NeuroImage,0.056,20727412,-1,-1
parietal lobule_00508,https://pubmed.ncbi.nlm.nih.gov/21236649/,Voxel-based morphometric analysis on the volume of gray matter in bipolar I disorder.,"Li M, Cui L, Deng W, Ma X, Huang C, Jiang L, Wang Y, Collier DA, Gong Q, Li T",Psychiatry research,0.056,21236649,-1,-1
parietal lobule_00509,https://pubmed.ncbi.nlm.nih.gov/22245646/,Neural basis of phonological processing in second language reading: an fMRI study of Chinese regularity effect.,"Zhao J, Li QL, Wang JJ, Yang Y, Deng Y, Bi HY",NeuroImage,0.056,22245646,-1,-1
parietal lobule_00510,https://pubmed.ncbi.nlm.nih.gov/22576840/,The neural substrate for working memory of tactile surface texture.,"Kaas AL, van Mier H, Visser M, Goebel R",Human brain mapping,0.056,22576840,-1,-1
parietal lobule_00511,https://pubmed.ncbi.nlm.nih.gov/22658706/,The neural network sustaining crossmodal integration is impaired in alcohol-dependence: an fMRI study.,"Maurage P, Joassin F, Pesenti M, Grandin C, Heeren A, Philippot P, de Timary P",Cortex; a journal devoted to the study of the nervous system and behavior,0.056,22658706,-1,-1
parietal lobule_00512,https://pubmed.ncbi.nlm.nih.gov/22659111/,Pre-orthographic character string processing and parietal cortex: a role for visual attention in reading?,"Lobier M, Peyrin C, Le Bas JF, Valdois S",Neuropsychologia,0.056,22659111,-1,-1
parietal lobule_00513,https://pubmed.ncbi.nlm.nih.gov/22890475/,Sensory modality of smoking cues modulates neural cue reactivity.,"Yalachkov Y, Kaiser J, Gorres A, Seehaus A, Naumer MJ",Psychopharmacology,0.056,22890475,-1,-1
parietal lobule_00514,https://pubmed.ncbi.nlm.nih.gov/23175825/,Perceptual criteria in the human brain.,"White CN, Mumford JA, Poldrack RA",The Journal of neuroscience : the official journal of the Society for Neuroscience,0.056,23175825,10.1523/JNEUROSCI.1744-12.2012,-1
parietal lobule_00515,https://pubmed.ncbi.nlm.nih.gov/23528204/,The role of circulating sex hormones in menstrual cycle-dependent modulation of pain-related brain activation.,"Veldhuijzen DS, Keaser ML, Traub DS, Zhuo J, Gullapalli RP, Greenspan JD",Pain,0.056,23528204,10.1016/j.pain.2012.12.019,-1
parietal lobule_00516,https://pubmed.ncbi.nlm.nih.gov/24015241/,Enhanced activation of motor execution networks using action observation combined with imagination of lower limb movements.,"Villiger M, Estevez N, Hepp-Reymond MC, Kiper D, Kollias SS, Eng K, Hotz-Boendermaker S",PloS one,0.056,24015241,10.1371/journal.pone.0072403,-1
parietal lobule_00517,https://pubmed.ncbi.nlm.nih.gov/24666131/,Reach out and touch someone: anticipatory sensorimotor processes of active interpersonal touch.,"Ebisch SJ, Ferri F, Romani GL, Gallese V",Journal of cognitive neuroscience,0.056,24666131,-1,-1
parietal lobule_00518,https://pubmed.ncbi.nlm.nih.gov/25019676/,Brain representations for acquiring and recalling visual-motor adaptations.,"Bedard P, Sanes JN",NeuroImage,0.056,25019676,-1,-1
parietal lobule_00519,https://pubmed.ncbi.nlm.nih.gov/25790026/,Neural control of enhanced filtering demands in a combined Flanker and Garner conflict task.,"Berron D, Fruhholz S, Herrmann M",PloS one,0.056,25790026,-1,-1
parietal lobule_00520,https://pubmed.ncbi.nlm.nih.gov/26343316/,Neural mechanisms underlying conscious and unconscious attentional shifts triggered by eye gaze.,"Sato W, Kochiyama T, Uono S, Toichi M",NeuroImage,0.056,26343316,-1,-1
parietal lobule_00521,https://pubmed.ncbi.nlm.nih.gov/26589804/,Don't watch where you're going: The neural correlates of decoupling eye and arm movements.,"Gorbet DJ, Sergio LE",Behavioural brain research,0.056,26589804,-1,-1
parietal lobule_00522,https://pubmed.ncbi.nlm.nih.gov/27672555/,Disorder-specific characteristics of borderline personality disorder with co-occurring depression and its comparison with major depression: An fMRI study with emotional interference task.,"Chechko N, Kellermann T, Augustin M, Zvyagintsev M, Schneider F, Habel U",NeuroImage. Clinical,0.056,27672555,-1,-1
parietal lobule_00523,https://pubmed.ncbi.nlm.nih.gov/28476336/,Abnormal neural activity as a potential biomarker for drug-naive first-episode adolescent-onset schizophrenia with coherence regional homogeneity and support vector machine analyses.,"Liu Y, Zhang Y, Lv L, Wu R, Zhao J, Guo W",Schizophrenia research,0.056,28476336,-1,-1
parietal lobule_00524,https://pubmed.ncbi.nlm.nih.gov/29587165/,Disrupted functional connectivity patterns of the insula subregions in drug-free  major depressive disorder.,"Wang C, Wu H, Chen F, Xu J, Li H, Li H, Wang J",Journal of affective disorders,0.056,29587165,-1,-1
parietal lobule_00525,https://pubmed.ncbi.nlm.nih.gov/14568457/,Brain processing of visual sexual stimuli in healthy men: a functional magnetic resonance imaging study.,"Mouras H, Stoleru S, Bittoun J, Glutron D, Pelegrini-Issac M, Paradis AL, Burnod Y",NeuroImage,0.055,14568457,-1,-1
parietal lobule_00526,https://pubmed.ncbi.nlm.nih.gov/15921932/,Long-range EEG phase synchronization during an arithmetic task indexes a coherent cortical network simultaneously measured by fMRI.,"Mizuhara H, Wang LQ, Kobayashi K, Yamaguchi Y",NeuroImage,0.055,15921932,-1,-1
parietal lobule_00527,https://pubmed.ncbi.nlm.nih.gov/16407533/,Brain activity associated with expectancy-enhanced placebo analgesia as measured  by functional magnetic resonance imaging.,"Kong J, Gollub RL, Rosman IS, Webb JM, Vangel MG, Kirsch I, Kaptchuk TJ",The Journal of neuroscience : the official journal of the Society for Neuroscience,0.055,16407533,-1,-1
parietal lobule_00528,https://pubmed.ncbi.nlm.nih.gov/16785427/,Involvement of human left dorsolateral prefrontal cortex in perceptual decision making is independent of response modality.,"Heekeren HR, Marrett S, Ruff DA, Bandettini PA, Ungerleider LG",Proceedings of the National Academy of Sciences of the United States of America,0.055,16785427,-1,-1
parietal lobule_00529,https://pubmed.ncbi.nlm.nih.gov/17173876/,The neural correlates of attention orienting in visuospatial working memory for detecting feature and conjunction changes.,"Yeh YY, Kuo BC, Liu HL",Brain research,0.055,17173876,-1,-1
parietal lobule_00530,https://pubmed.ncbi.nlm.nih.gov/17192434/,An oculomotor decision process revealed by functional magnetic resonance imaging.,"Heinen SJ, Rowland J, Lee BT, Wade AR",The Journal of neuroscience : the official journal of the Society for Neuroscience,0.055,17192434,-1,-1
parietal lobule_00531,https://pubmed.ncbi.nlm.nih.gov/17434917/,Cortical mechanisms for shifting and holding visuospatial attention.,"Kelley TA, Serences JT, Giesbrecht B, Yantis S","Cerebral cortex (New York, N.Y. : 1991)",0.055,17434917,10.1093/cercor/bhm036,-1
parietal lobule_00532,https://pubmed.ncbi.nlm.nih.gov/17855375/,Dorsolateral prefrontal cortex dysfunction in presymptomatic Huntington's disease: evidence from event-related fMRI.,"Wolf RC, Vasic N, Schonfeldt-Lecuona C, Landwehrmeyer GB, Ecker D",Brain : a journal of neurology,0.055,17855375,10.1093/brain/awm210,-1
parietal lobule_00533,https://pubmed.ncbi.nlm.nih.gov/18773963/,How do we infer others' goals from non-stereotypic actions? The outcome of context-sensitive inferential processing in right inferior parietal and posterior temporal cortex.,"Liepelt R, Von Cramon DY, Brass M",NeuroImage,0.055,18773963,10.1016/j.neuroimage.2008.08.007,-1
parietal lobule_00534,https://pubmed.ncbi.nlm.nih.gov/21148010/,Effects of parametrical and trial-to-trial variation in prior probability processing revealed by simultaneous electroencephalogram/functional magnetic resonance imaging.,"Scheibe C, Ullsperger M, Sommer W, Heekeren HR",The Journal of neuroscience : the official journal of the Society for Neuroscience,0.055,21148010,-1,-1
parietal lobule_00535,https://pubmed.ncbi.nlm.nih.gov/21620984/,What difference does a year of schooling make? Maturation of brain response and connectivity between 2nd and 3rd grades during arithmetic problem solving.,"Rosenberg-Lee M, Barth M, Menon V",NeuroImage,0.055,21620984,-1,-1
parietal lobule_00536,https://pubmed.ncbi.nlm.nih.gov/22126670/,Premotor cortex is sensitive to auditory-visual congruence for biological motion.,"Wuerger SM, Parkes L, Lewis PA, Crocker-Buque A, Rutschmann R, Meyer GF",Journal of cognitive neuroscience,0.055,22126670,-1,-1
parietal lobule_00537,https://pubmed.ncbi.nlm.nih.gov/22711287/,Aberrant functional network recruitment of posterior parietal cortex in Turner syndrome.,"Bray S, Hoeft F, Hong DS, Reiss AL",Human brain mapping,0.055,22711287,-1,-1
parietal lobule_00538,https://pubmed.ncbi.nlm.nih.gov/23357079/,Differential activation of brain regions involved with error-feedback and imitation based motor simulation when observing self and an expert's actions in pilots and non-pilots on a complex glider land,"Callan DE, Terzibas C, Cassel DB, Callan A, Kawato M, Sato MA",NeuroImage,0.055,23357079,-1,-1
parietal lobule_00539,https://pubmed.ncbi.nlm.nih.gov/23654223/,High proficiency in a second language is characterized by greater involvement of  the first language network: evidence from Chinese learners of English.,"Cao F, Tao R, Liu L, Perfetti CA, Booth JR",Journal of cognitive neuroscience,0.055,23654223,-1,-1
parietal lobule_00540,https://pubmed.ncbi.nlm.nih.gov/24643507/,Green tea extract enhances parieto-frontal connectivity during working memory processing.,"Schmidt A, Hammann F, Wolnerhanssen B, Meyer-Gerspach AC, Drewe J, Beglinger C, Borgwardt S",Psychopharmacology,0.055,24643507,-1,-1
parietal lobule_00541,https://pubmed.ncbi.nlm.nih.gov/25328839/,Insight into the neurophysiological processes of melodically intoned language with functional MRI.,"Mendez Orellana CP, van de Sandt-Koenderman ME, Saliasi E, van der Meulen I, Klip S, van der Lugt A, Smits M",Brain and behavior,0.055,25328839,-1,-1
parietal lobule_00542,https://pubmed.ncbi.nlm.nih.gov/25571770/,Visual imagery influences brain responses to visual stimulation in bilateral cortical blindness.,"de Gelder B, Tamietto M, Pegna AJ, Van den Stock J",Cortex; a journal devoted to the study of the nervous system and behavior,0.055,25571770,-1,-1
parietal lobule_00543,https://pubmed.ncbi.nlm.nih.gov/26250852/,Examining the neural correlates of emergent equivalence relations in fragile X syndrome.,"Klabunde M, Saggar M, Hustyi KM, Kelley RG, Reiss AL, Hall SS",Psychiatry research,0.055,26250852,-1,-1
parietal lobule_00544,https://pubmed.ncbi.nlm.nih.gov/29545745/,Monetary Reward and Punishment to Response Inhibition Modulate Activation and Synchronization Within the Inhibitory Brain Network.,"Chikara RK, Chang EC, Lu YC, Lin DS, Lin CT, Ko LW",Frontiers in human neuroscience,0.055,29545745,-1,-1
parietal lobule_00545,https://pubmed.ncbi.nlm.nih.gov/16108019/,Motion standstill leads to activation of inferior parietal lobe.,"Federspiel A, Volpe U, Horn H, Dierks T, Franck A, Vannini P, Wahlund LO, Galderisi S, Maj M",Human brain mapping,0.054,16108019,-1,-1
parietal lobule_00546,https://pubmed.ncbi.nlm.nih.gov/16962075/,Neural substrates of knowledge of hand postures for object grasping and functional object use: evidence from fMRI.,"Buxbaum LJ, Kyle KM, Tang K, Detre JA",Brain research,0.054,16962075,-1,-1
parietal lobule_00547,https://pubmed.ncbi.nlm.nih.gov/17056279/,Functional activation in parieto-premotor and visual areas dependent on congruency between hand movement and visual stimuli during motor-visual priming.,"Stanley J, Miall RC",NeuroImage,0.054,17056279,-1,-1
parietal lobule_00548,https://pubmed.ncbi.nlm.nih.gov/17329424/,Response anticipation and response conflict: an event-related potential and functional magnetic resonance imaging study.,"Fan J, Kolster R, Ghajar J, Suh M, Knight RT, Sarkar R, McCandliss BD",The Journal of neuroscience : the official journal of the Society for Neuroscience,0.054,17329424,-1,-1
parietal lobule_00549,https://pubmed.ncbi.nlm.nih.gov/17803973/,An fMRI investigation into the neural mechanisms of spatial attentional selection in a location-based negative priming task.,"Krueger F, Fischer R, Heinecke A, Hagendorf H",Brain research,0.054,17803973,-1,-1
parietal lobule_00550,https://pubmed.ncbi.nlm.nih.gov/20413149/,Localization of sublexical speech perception components.,"Turkeltaub PE, Coslett HB",Brain and language,0.054,20413149,-1,-1
parietal lobule_00551,https://pubmed.ncbi.nlm.nih.gov/20678494/,Differences in cerebral activation during perception of optokinetic computer stimuli and video clips of living animals: an fMRI study.,"Bottger S, Haberl R, Prosiegel M, Audebert H, Rumberg B, Forsting M, Gizewski ER",Brain research,0.054,20678494,10.1016/j.brainres.2010.07.056,-1
parietal lobule_00552,https://pubmed.ncbi.nlm.nih.gov/22227141/,Neural mechanisms underlying the conditioned diminution of the unconditioned fear response.,"Wood KH, Ver Hoef LW, Knight DC",NeuroImage,0.054,22227141,10.1016/j.neuroimage.2011.12.048,-1
parietal lobule_00553,https://pubmed.ncbi.nlm.nih.gov/22579495/,Practice on conflict tasks promotes executive function of working memory in the elderly.,"Osaka M, Yaoi K, Otsuka Y, Katsuhara M, Osaka N",Behavioural brain research,0.054,22579495,10.1016/j.bbr.2012.04.044,-1
parietal lobule_00554,https://pubmed.ncbi.nlm.nih.gov/22608404/,Neural representations of unfamiliar objects are modulated by sensorimotor experience.,"Bellebaum C, Tettamanti M, Marchetta E, Della Rosa P, Rizzo G, Daum I, Cappa SF",Cortex; a journal devoted to the study of the nervous system and behavior,0.054,22608404,10.1016/j.cortex.2012.03.023,-1
parietal lobule_00555,https://pubmed.ncbi.nlm.nih.gov/22918981/,Common and segregated processing of observed actions in human SPL.,"Abdollahi RO, Jastorff J, Orban GA","Cerebral cortex (New York, N.Y. : 1991)",0.054,22918981,-1,-1
parietal lobule_00556,https://pubmed.ncbi.nlm.nih.gov/23131612/,Differential brain response to alcohol cue distractors across stages of alcohol dependence.,"Fryer SL, Jorgensen KW, Yetter EJ, Daurignac EC, Watson TD, Shanbhag H, Krystal JH, Mathalon DH",Biological psychology,0.054,23131612,-1,-1
