paper_name,paper_url,Title,Author,Journal,Loading,PMID,Doi,download_status
personality traits_00001,https://pubmed.ncbi.nlm.nih.gov/25413497/,Different neural pathways linking personality traits and eudaimonic well-being: a resting-state functional magnetic resonance imaging study.,"Kong F, Liu L, Wang X, Hu S, Song Y, Liu J","Cognitive, affective & behavioral neuroscience",0.413,25413497,-1,-1
personality traits_00002,https://pubmed.ncbi.nlm.nih.gov/15275916/,Distributed self in episodic memory: neural correlates of successful retrieval of self-encoded positive and negative personality traits.,"Fossati P, Hevenor SJ, Lepage M, Graham SJ, Grady C, Keightley ML, Craik F, Mayberg H",NeuroImage,0.383,15275916,-1,-1
personality traits_00003,https://pubmed.ncbi.nlm.nih.gov/28680397/,A Comprehensive Analysis of the Correlations between Resting-State Oscillations in Multiple-Frequency Bands and Big Five Traits.,"Ikeda S, Takeuchi H, Taki Y, Nouchi R, Yokoyama R, Kotozaki Y, Nakagawa S, Sekiguchi A, Iizuka K, Yamamoto Y, Hanawa S, Araki T, Miyauchi CM, Sakaki K, Nozawa T, Yokota S, Magistro D, Kawashima R",Frontiers in human neuroscience,0.379,28680397,-1,-1
personality traits_00004,https://pubmed.ncbi.nlm.nih.gov/12880840/,Brain function and personality in normal males: a SPECT study using statistical parametric mapping.,"Turner RM, Hudson IL, Butler PH, Joyce PR",NeuroImage,0.375,12880840,-1,-1
personality traits_00005,https://pubmed.ncbi.nlm.nih.gov/21840401/,White matter integrity and five-factor personality measures in healthy adults.,"Xu J, Potenza MN",NeuroImage,0.324,21840401,-1,-1
personality traits_00006,https://pubmed.ncbi.nlm.nih.gov/19940176/,Functional variation of the dopamine D2 receptor gene is associated with emotional control as well as brain activity and connectivity during emotion processing in humans.,"Blasi G, Lo Bianco L, Taurisano P, Gelao B, Romano R, Fazio L, Papazacharias A, Di Giorgio A, Caforio G, Rampino A, Masellis R, Papp A, Ursini G, Sinibaldi L, Popolizio T, Sadee W, Bertolino A",The Journal of neuroscience : the official journal of the Society for Neuroscience,0.292,19940176,-1,-1
personality traits_00007,https://pubmed.ncbi.nlm.nih.gov/19682867/,Gender difference in relationship between anxiety-related personality traits and  cerebral brain glucose metabolism.,"Hakamata Y, Iwase M, Iwata H, Kobayashi T, Tamaki T, Nishio M, Matsuda H, Ozaki N, Inada T",Psychiatry research,0.284,19682867,-1,-1
personality traits_00008,https://pubmed.ncbi.nlm.nih.gov/25989852/,Individual variation in the neural processes of motor decisions in the stop signal task: the influence of novelty seeking and harm avoidance personality traits.,"Hu J, Lee D, Hu S, Zhang S, Chao H, Li CS",Brain structure & function,0.266,25989852,-1,-1
personality traits_00009,https://pubmed.ncbi.nlm.nih.gov/24040207/,Isn't it ironic? Neural correlates of irony comprehension in schizophrenia.,"Rapp AM, Langohr K, Mutschler DE, Klingberg S, Wild B, Erb M",PloS one,0.253,24040207,-1,-1
personality traits_00010,https://pubmed.ncbi.nlm.nih.gov/24656768/,"Impulsivity, aggression and brain structure in high and low lethality suicide attempters with borderline personality disorder.","Soloff P, White R, Diwadkar VA",Psychiatry research,0.235,24656768,-1,-1
personality traits_00011,https://pubmed.ncbi.nlm.nih.gov/20970509/,Voxel-based morphometry studies of personality: issue of statistical model specification--effect of nuisance covariates.,"Hu X, Erb M, Ackermann H, Martin JA, Grodd W, Reiterer SM",NeuroImage,0.231,20970509,-1,-1
personality traits_00012,https://pubmed.ncbi.nlm.nih.gov/24475262/,Relationship between personality traits and brain reward responses when playing on a team.,"Morawetz C, Kirilina E, Baudewig J, Heekeren HR",PloS one,0.194,24475262,-1,-1
personality traits_00013,https://pubmed.ncbi.nlm.nih.gov/25712871/,The neuroanatomical delineation of agentic and affiliative extraversion.,"Grodin EN, White TL","Cognitive, affective & behavioral neuroscience",0.194,25712871,-1,-1
personality traits_00014,https://pubmed.ncbi.nlm.nih.gov/22842813/,The neural correlates of positive self-evaluation and self-related memory.,"Pauly K, Finkelmeyer A, Schneider F, Habel U",Social cognitive and affective neuroscience,0.186,22842813,-1,-1
personality traits_00015,https://pubmed.ncbi.nlm.nih.gov/19925182/,Dissociable neural substrates for agentic versus conceptual representations of self.,"Powell LJ, Macrae CN, Cloutier J, Metcalfe J, Mitchell JP",Journal of cognitive neuroscience,0.184,19925182,-1,-1
personality traits_00016,https://pubmed.ncbi.nlm.nih.gov/22937001/,The modulating effect of personality traits on neural error monitoring: evidence  from event-related FMRI.,"Sosic-Vasic Z, Ulrich M, Ruchsow M, Vasic N, Gron G",PloS one,0.178,22937001,-1,-1
personality traits_00017,https://pubmed.ncbi.nlm.nih.gov/15820652/,Contagious yawning and the brain.,"Platek SM, Mohamed FB, Gallup GG Jr",Brain research. Cognitive brain research,0.169,15820652,10.1016/j.cogbrainres.2004.11.011,-1
personality traits_00018,https://pubmed.ncbi.nlm.nih.gov/28039797/,Impulsivity and aggression mediate regional brain responses in Borderline Personality Disorder: An fMRI study.,"Soloff PH, Abraham K, Burgess A, Ramaseshan K, Chowdury A, Diwadkar VA",Psychiatry research. Neuroimaging,0.167,28039797,10.1016/j.pscychresns.2016.12.009,-1
personality traits_00019,https://pubmed.ncbi.nlm.nih.gov/18299790/,Cerebral connectivity and psychotic personality traits. A diffusion tensor imaging study.,"Volpe U, Federspiel A, Mucci A, Dierks T, Frank A, Wahlund LO, Galderisi S, Maj M",European archives of psychiatry and clinical neuroscience,0.166,18299790,10.1007/s00406-007-0796-1,-1
personality traits_00020,https://pubmed.ncbi.nlm.nih.gov/22378896/,Variation in the corticotropin-releasing hormone receptor 1 (CRHR1) gene influences fMRI signal responses during emotional stimulus processing.,"Hsu DT, Mickey BJ, Langenecker SA, Heitzeg MM, Love TM, Wang H, Kennedy SE, Pecina M, Shafir T, Hodgkinson CA, Enoch MA, Goldman D, Zubieta JK",The Journal of neuroscience : the official journal of the Society for Neuroscience,0.164,22378896,10.1523/JNEUROSCI.5533-11.2012,-1
personality traits_00021,https://pubmed.ncbi.nlm.nih.gov/27717769/,"Peering into the brain to predict behavior: Peer-reported, but not self-reported, conscientiousness links threat-related amygdala activity to future problem drinking.","Swartz JR, Knodt AR, Radtke SR, Hariri AR",NeuroImage,0.159,27717769,-1,-1
personality traits_00022,https://pubmed.ncbi.nlm.nih.gov/22306799/,Embodied empathy for tactile events: Interindividual differences and vicarious somatosensory responses during touch observation.,"Schaefer M, Heinze HJ, Rotte M",NeuroImage,0.148,22306799,-1,-1
personality traits_00023,https://pubmed.ncbi.nlm.nih.gov/24027520/,Cortical Midline Structures and Autobiographical-Self Processes: An Activation-Likelihood Estimation Meta-Analysis.,"Araujo HF, Kaplan J, Damasio A",Frontiers in human neuroscience,0.147,24027520,-1,-1
personality traits_00024,https://pubmed.ncbi.nlm.nih.gov/20452398/,Passively viewing negatively valenced baby faces attenuates left amygdala activity in healthy females scoring high on 'Harm Avoidance'.,"Baeken C, Van Schuerbeek P, De Raedt R, Bossuyt A, Vanderhasselt MA, De Mey J, Luypaert R",Neuroscience letters,0.144,20452398,-1,-1
personality traits_00025,https://pubmed.ncbi.nlm.nih.gov/27498369/,Neural correlates of envy: Regional homogeneity of resting-state brain activity predicts dispositional envy.,"Xiang Y, Kong F, Wen X, Wu Q, Mo L",NeuroImage,0.136,27498369,-1,-1
personality traits_00026,https://pubmed.ncbi.nlm.nih.gov/28551067/,The neural correlates of reciprocity are sensitive to prior experience of reciprocity.,"Caceda R, Prendes-Alvarez S, Hsu JJ, Tripathi SP, Kilts CD, James GA",Behavioural brain research,0.136,28551067,-1,-1
personality traits_00027,https://pubmed.ncbi.nlm.nih.gov/25979607/,Neural correlates of creative thinking and schizotypy.,"Park HR, Kirk IJ, Waldie KE",Neuropsychologia,0.134,25979607,-1,-1
personality traits_00028,https://pubmed.ncbi.nlm.nih.gov/27672175/,Grit and the brain: spontaneous activity of the dorsomedial prefrontal cortex mediates the relationship between the trait grit and academic performance.,"Wang S, Zhou M, Chen T, Yang X, Chen G, Wang M, Gong Q",Social cognitive and affective neuroscience,0.132,27672175,-1,-1
personality traits_00029,https://pubmed.ncbi.nlm.nih.gov/23732338/,Personality traits modulate neural responses to emotions expressed in music.,"Park M, Hennig-Fast K, Bao Y, Carl P, Poppel E, Welker L, Reiser M, Meindl T, Gutyrchik E",Brain research,0.128,23732338,-1,-1
personality traits_00030,https://pubmed.ncbi.nlm.nih.gov/22956672/,Linkage of functional and structural anomalies in the left amygdala of reactive-aggressive men.,"Bobes MA, Ostrosky F, Diaz K, Romero C, Borja K, Santos Y, Valdes-Sosa M",Social cognitive and affective neuroscience,0.119,22956672,-1,-1
personality traits_00031,https://pubmed.ncbi.nlm.nih.gov/20147458/,Behavioral activation system modulation on brain activation during appetitive and aversive stimulus processing.,"Barros-Loscertales A, Ventura-Campos N, Sanjuan-Tomas A, Belloch V, Parcet MA, Avila C",Social cognitive and affective neuroscience,0.116,20147458,-1,-1
personality traits_00032,https://pubmed.ncbi.nlm.nih.gov/21315749/,The role of negative affectivity and social inhibition in perceiving social threat: an fMRI study.,"Kret ME, Denollet J, Grezes J, de Gelder B",Neuropsychologia,0.115,21315749,-1,-1
personality traits_00033,https://pubmed.ncbi.nlm.nih.gov/23552077/,Involvement of the mentalizing network in social and non-social high construal.,"Baetens K, Ma N, Steen J, Van Overwalle F",Social cognitive and affective neuroscience,0.115,23552077,-1,-1
personality traits_00034,https://pubmed.ncbi.nlm.nih.gov/23446840/,Neural mechanisms underlying the integration of situational information into attribution outcomes.,"Brosch T, Schiller D, Mojdehbakhsh R, Uleman JS, Phelps EA",Social cognitive and affective neuroscience,0.114,23446840,-1,-1
personality traits_00035,https://pubmed.ncbi.nlm.nih.gov/20083206/,Retest reliability of reward-related BOLD signals.,"Fliessbach K, Rohe T, Linder NS, Trautner P, Elger CE, Weber B",NeuroImage,0.111,20083206,-1,-1
personality traits_00036,https://pubmed.ncbi.nlm.nih.gov/25852527/,Synchrony between sensory and cognitive networks is associated with subclinical variation in autistic traits.,"Young JS, Smith DV, Coutlee CG, Huettel SA",Frontiers in human neuroscience,0.111,25852527,10.3389/fnhum.2015.00146,-1
personality traits_00037,https://pubmed.ncbi.nlm.nih.gov/16710715/,The effect of acute tryptophan depletion on the BOLD response during performance  monitoring and response inhibition in healthy male volunteers.,"Evers EA, van der Veen FM, van Deursen JA, Schmitt JA, Deutz NE, Jolles J",Psychopharmacology,0.11,16710715,10.1007/s00213-006-0411-6,-1
personality traits_00038,https://pubmed.ncbi.nlm.nih.gov/22977199/,Anterior insular cortex mediates bodily sensibility and social anxiety.,"Terasawa Y, Shibata M, Moriguchi Y, Umeda S",Social cognitive and affective neuroscience,0.108,22977199,-1,-1
personality traits_00039,https://pubmed.ncbi.nlm.nih.gov/19429013/,"Temporal pole activity during perception of sad faces, but not happy faces, correlates with neuroticism trait.","Jimura K, Konishi S, Miyashita Y",Neuroscience letters,0.107,19429013,-1,-1
personality traits_00040,https://pubmed.ncbi.nlm.nih.gov/20570602/,Neural correlates of intolerance of uncertainty.,"Schienle A, Kochel A, Ebner F, Reishofer G, Schafer A",Neuroscience letters,0.107,20570602,-1,-1
personality traits_00041,https://pubmed.ncbi.nlm.nih.gov/23887820/,Neural representation and clinically relevant moderators of individualised self-criticism in healthy subjects.,"Doerig N, Schlumpf Y, Spinelli S, Spati J, Brakowski J, Quednow BB, Seifritz E, Grosse Holtforth M",Social cognitive and affective neuroscience,0.106,23887820,-1,-1
personality traits_00042,https://pubmed.ncbi.nlm.nih.gov/17229578/,Neuroanatomical correlates of personality in the elderly.,"Wright CI, Feczko E, Dickerson B, Williams D",NeuroImage,0.105,17229578,-1,-1
personality traits_00043,https://pubmed.ncbi.nlm.nih.gov/23596404/,Dopaminergic basis of the psychosis-prone personality investigated with functional magnetic resonance imaging of procedural learning.,"Ettinger U, Corr PJ, Mofidi A, Williams SC, Kumari V",Frontiers in human neuroscience,0.105,23596404,-1,-1
personality traits_00044,https://pubmed.ncbi.nlm.nih.gov/21937025/,The synchronization of spontaneous BOLD activity predicts extraversion and neuroticism.,"Wei L, Duan X, Yang Y, Liao W, Gao Q, Ding JR, Zhang Z, Zeng W, Li Y, Lu G, Chen H",Brain research,0.104,21937025,-1,-1
personality traits_00045,https://pubmed.ncbi.nlm.nih.gov/16202396/,Monoamine oxidase-a genetic variations influence brain activity associated with inhibitory control: new insight into the neural correlates of impulsivity.,"Passamonti L, Fera F, Magariello A, Cerasa A, Gioia MC, Muglia M, Nicoletti G, Gallo O, Provinciali L, Quattrone A",Biological psychiatry,0.101,16202396,-1,-1
personality traits_00046,https://pubmed.ncbi.nlm.nih.gov/19948949/,Prestimulus functional connectivity determines pain perception in humans.,"Ploner M, Lee MC, Wiech K, Bingel U, Tracey I",Proceedings of the National Academy of Sciences of the United States of America,0.1,19948949,-1,-1
personality traits_00047,https://pubmed.ncbi.nlm.nih.gov/23664683/,Hypnotic susceptibility modulates brain activity related to experimental placebo  analgesia.,"Huber A, Lui F, Porro CA",Pain,0.1,23664683,-1,-1
personality traits_00048,https://pubmed.ncbi.nlm.nih.gov/24899706/,Lasting impact of regret and gratification on resting brain activity and its relation to depressive traits.,"Eryilmaz H, Van De Ville D, Schwartz S, Vuilleumier P",The Journal of neuroscience : the official journal of the Society for Neuroscience,0.1,24899706,-1,-1
personality traits_00049,https://pubmed.ncbi.nlm.nih.gov/15850737/,Frontal and limbic metabolic differences in subjects selected according to genetic variation of the SLC6A4 gene polymorphism.,"Graff-Guerrero A, De la Fuente-Sandoval C, Camarena B, Gomez-Martin D, Apiquian R, Fresan A, Aguilar A, Mendez-Nunez JC, Escalona-Huerta C, Drucker-Colin R, Nicolini H",NeuroImage,0.099,15850737,-1,-1
personality traits_00050,https://pubmed.ncbi.nlm.nih.gov/21527789/,Individual differences in the spontaneous recruitment of brain regions supporting mental state understanding when viewing natural social scenes.,"Wagner DD, Kelley WM, Heatherton TF","Cerebral cortex (New York, N.Y. : 1991)",0.098,21527789,10.1093/cercor/bhr074,-1
personality traits_00051,https://pubmed.ncbi.nlm.nih.gov/24369435/,"Me, myself and I: temporal dysfunctions during self-evaluation in patients with schizophrenia.","Pauly KD, Kircher TT, Schneider F, Habel U",Social cognitive and affective neuroscience,0.098,24369435,-1,-1
personality traits_00052,https://pubmed.ncbi.nlm.nih.gov/18682729/,Individual attachment style modulates human amygdala and striatum activation during social appraisal.,"Vrticka P, Andersson F, Grandjean D, Sander D, Vuilleumier P",PloS one,0.097,18682729,-1,-1
personality traits_00053,https://pubmed.ncbi.nlm.nih.gov/27566262/,Tell me twice: A multi-study analysis of the functional connectivity between the  cerebrum and cerebellum after repeated trait information.,"Van Overwalle F, Heleven E, Ma N, Marien P",NeuroImage,0.097,27566262,-1,-1
personality traits_00054,https://pubmed.ncbi.nlm.nih.gov/22987723/,Specific frequency bands of amplitude low-frequency oscillation encodes personality.,"Wei L, Duan X, Zheng C, Wang S, Gao Q, Zhang Z, Lu G, Chen H",Human brain mapping,0.096,22987723,-1,-1
personality traits_00055,https://pubmed.ncbi.nlm.nih.gov/19497374/,Genetic variation in schizophrenia-risk-gene dysbindin 1 modulates brain activation in anterior cingulate cortex and right temporal gyrus during language  production in healthy individuals.,"Markov V, Krug A, Krach S, Whitney C, Eggermann T, Zerres K, Stocker T, Shah NJ, Nothen MM, Treutlein J, Rietschel M, Kircher T",NeuroImage,0.095,19497374,-1,-1
personality traits_00056,https://pubmed.ncbi.nlm.nih.gov/20071019/,Neural correlates of irony comprehension: the role of schizotypal personality traits.,"Rapp AM, Mutschler DE, Wild B, Erb M, Lengsfeld I, Saur R, Grodd W",Brain and language,0.095,20071019,-1,-1
personality traits_00057,https://pubmed.ncbi.nlm.nih.gov/15935262/,Influences of disgust sensitivity on hemodynamic responses towards a disgust-inducing film clip.,"Stark R, Schienle A, Sarlo M, Palomba D, Walter B, Vaitl D",International journal of psychophysiology : official journal of the International Organization of Psychophysiology,0.094,15935262,-1,-1
personality traits_00058,https://pubmed.ncbi.nlm.nih.gov/27172859/,Athlete or athletic? Limited differential brain activation in person descriptions using nouns or adjectives.,"Van der Cruyssen L, Ozdem C, Haesevoets T, Vandekerckhove M, Van Overwalle F",Brain and language,0.094,27172859,-1,-1
personality traits_00059,https://pubmed.ncbi.nlm.nih.gov/25009315/,Frontal glutamate and reward processing in adolescence and adulthood.,"Gleich T, Lorenz RC, Pohland L, Raufelder D, Deserno L, Beck A, Heinz A, Kuhn S, Gallinat J",Brain structure & function,0.093,25009315,-1,-1
personality traits_00060,https://pubmed.ncbi.nlm.nih.gov/15050563/,Target dependency of brain mechanism involved in dispositional inference: a PET study.,"Sugiura M, Gotoh R, Okada K, Yamaguchi K, Itoh M, Fukuda H, Kawashima R",NeuroImage,0.092,15050563,-1,-1
personality traits_00061,https://pubmed.ncbi.nlm.nih.gov/27560361/,The Role of the Subgenual Anterior Cingulate Cortex and Amygdala in Environmental Sensitivity to Infant Crying.,"Mutschler I, Ball T, Kirmse U, Wieckhorst B, Pluess M, Klarhofer M, Meyer AH, Wilhelm FH, Seifritz E",PloS one,0.092,27560361,-1,-1
personality traits_00062,https://pubmed.ncbi.nlm.nih.gov/28346539/,"Is there a relation between novelty seeking, striatal dopamine release and frontal cortical thickness?","Jaworska N, Cox SM, Casey KF, Boileau I, Cherkasova M, Larcher K, Dagher A, Benkelfat C, Leyton M",PloS one,0.092,28346539,-1,-1
personality traits_00063,https://pubmed.ncbi.nlm.nih.gov/18985100/,Medial prefrontal dissociations during processing of trait diagnostic and nondiagnostic person information.,"Mitchell JP, Cloutier J, Banaji MR, Macrae CN",Social cognitive and affective neuroscience,0.091,18985100,-1,-1
personality traits_00064,https://pubmed.ncbi.nlm.nih.gov/22287265/,Why are you looking like that? How the context influences evaluation and processing of human faces.,"Schwarz KA, Wieser MJ, Gerdes AB, Muhlberger A, Pauli P",Social cognitive and affective neuroscience,0.091,22287265,-1,-1
personality traits_00065,https://pubmed.ncbi.nlm.nih.gov/26364127/,Neurobiological underpinnings of sensation seeking trait in heroin abusers.,"Cheng GL, Liu YP, Chan CC, So KF, Zeng H, Lee TM",European neuropsychopharmacology : the journal of the European College of Neuropsychopharmacology,0.091,26364127,-1,-1
personality traits_00066,https://pubmed.ncbi.nlm.nih.gov/19945172/,Self-referential processing and the prefrontal cortex over the course of depression: a pilot study.,"Lemogne C, Mayberg H, Bergouignan L, Volle E, Delaveau P, Lehericy S, Allilaire JF, Fossati P",Journal of affective disorders,0.09,19945172,-1,-1
personality traits_00067,https://pubmed.ncbi.nlm.nih.gov/26197051/,Abnormal Social Reward Responses in Anorexia Nervosa: An fMRI Study.,"Via E, Soriano-Mas C, Sanchez I, Forcano L, Harrison BJ, Davey CG, Pujol J, Martinez-Zalacain I, Menchon JM, Fernandez-Aranda F, Cardoner N",PloS one,0.09,26197051,-1,-1
personality traits_00068,https://pubmed.ncbi.nlm.nih.gov/26441569/,Physical attractiveness and sex as modulatory factors of empathic brain responses to pain.,"Jankowiak-Siuda K, Rymarczyk K, Zurawski L, Jednorog K, Marchewka A",Frontiers in behavioral neuroscience,0.089,26441569,-1,-1
personality traits_00069,https://pubmed.ncbi.nlm.nih.gov/19015108/,Functional abnormalities of the default network during self- and other-reflection in autism.,"Kennedy DP, Courchesne E",Social cognitive and affective neuroscience,0.088,19015108,-1,-1
personality traits_00070,https://pubmed.ncbi.nlm.nih.gov/28342970/,Not in one metric: Neuroticism modulates different resting state metrics within distinctive brain regions.,"Gentili C, Cristea IA, Ricciardi E, Vanello N, Popita C, David D, Pietrini P",Behavioural brain research,0.088,28342970,-1,-1
personality traits_00071,https://pubmed.ncbi.nlm.nih.gov/16487726/,Prediction error as a linear function of reward probability is coded in human nucleus accumbens.,"Abler B, Walter H, Erk S, Kammerer H, Spitzer M",NeuroImage,0.087,16487726,-1,-1
personality traits_00072,https://pubmed.ncbi.nlm.nih.gov/19307251/,In search of the depressive self: extended medial prefrontal network during self-referential processing in major depression.,"Lemogne C, le Bastard G, Mayberg H, Volle E, Bergouignan L, Lehericy S, Allilaire JF, Fossati P",Social cognitive and affective neuroscience,0.087,19307251,-1,-1
personality traits_00073,https://pubmed.ncbi.nlm.nih.gov/25241083/,Distinct neural correlates of social categories and personality traits.,"Van der Cruyssen L, Heleven E, Ma N, Vandekerckhove M, Van Overwalle F",NeuroImage,0.086,25241083,-1,-1
personality traits_00074,https://pubmed.ncbi.nlm.nih.gov/28633048/,Affective traits and history of depression are related to ventral striatum connectivity.,"DelDonno SR, Jenkins LM, Crane NA, Nusslock R, Ryan KA, Shankman SA, Phan KL, Langenecker SA",Journal of affective disorders,0.086,28633048,-1,-1
personality traits_00075,https://pubmed.ncbi.nlm.nih.gov/19642887/,The neural basis of personal goal processing when envisioning future events.,"D'Argembeau A, Stawarczyk D, Majerus S, Collette F, Van der Linden M, Feyers D, Maquet P, Salmon E",Journal of cognitive neuroscience,0.085,19642887,-1,-1
personality traits_00076,https://pubmed.ncbi.nlm.nih.gov/21130172/,Resting state functional connectivity within the cingulate cortex jointly predicts agreeableness and stressor-evoked cardiovascular reactivity.,"Ryan JP, Sheu LK, Gianaros PJ",NeuroImage,0.085,21130172,-1,-1
personality traits_00077,https://pubmed.ncbi.nlm.nih.gov/26375210/,Neural correlates of reflection on actual versus ideal self-discrepancy.,"Shi Z, Ma Y, Wu B, Wu X, Wang Y, Han S",NeuroImage,0.084,26375210,-1,-1
personality traits_00078,https://pubmed.ncbi.nlm.nih.gov/26696853/,Role of the Insula and Vestibular System in Patients with Chronic Subjective Dizziness: An fMRI Study Using Sound-Evoked Vestibular Stimulation.,"Indovina I, Riccelli R, Chiarella G, Petrolo C, Augimeri A, Giofre L, Lacquaniti F, Staab JP, Passamonti L",Frontiers in behavioral neuroscience,0.084,26696853,-1,-1
personality traits_00079,https://pubmed.ncbi.nlm.nih.gov/20045478/,When I think about me and simulate you: medial rostral prefrontal cortex and self-referential processes.,"Benoit RG, Gilbert SJ, Volle E, Burgess PW",NeuroImage,0.083,20045478,-1,-1
personality traits_00080,https://pubmed.ncbi.nlm.nih.gov/24352685/,Neuroticism and extraversion are associated with amygdala resting-state functional connectivity.,"Aghajani M, Veer IM, van Tol MJ, Aleman A, van Buchem MA, Veltman DJ, Rombouts SA, van der Wee NJ","Cognitive, affective & behavioral neuroscience",0.083,24352685,-1,-1
personality traits_00081,https://pubmed.ncbi.nlm.nih.gov/27672555/,Disorder-specific characteristics of borderline personality disorder with co-occurring depression and its comparison with major depression: An fMRI study with emotional interference task.,"Chechko N, Kellermann T, Augustin M, Zvyagintsev M, Schneider F, Habel U",NeuroImage. Clinical,0.083,27672555,-1,-1
personality traits_00082,https://pubmed.ncbi.nlm.nih.gov/23450237/,The influence of valence and decision difficulty on self-referential processing.,"Meffert H, Blanken L, Blair KS, White SF, Blair JR",Frontiers in human neuroscience,0.082,23450237,-1,-1
personality traits_00083,https://pubmed.ncbi.nlm.nih.gov/26262561/,The attracting power of the gaze of politicians is modulated by the personality and ideological attitude of their voters: a functional magnetic resonance imaging study.,"Cazzato V, Liuzza MT, Caprara GV, Macaluso E, Aglioti SM",The European journal of neuroscience,0.081,26262561,-1,-1
personality traits_00084,https://pubmed.ncbi.nlm.nih.gov/22610513/,The five factors of personality and regional cortical variability in the Baltimore longitudinal study of aging.,"Kapogiannis D, Sutin A, Davatzikos C, Costa P Jr, Resnick S",Human brain mapping,0.08,22610513,-1,-1
personality traits_00085,https://pubmed.ncbi.nlm.nih.gov/28870852/,Independent circuits in basal ganglia and cortex for the processing of reward and precision feedback.,"Pascucci D, Hickey C, Jovicich J, Turatto M",NeuroImage,0.079,28870852,-1,-1
personality traits_00086,https://pubmed.ncbi.nlm.nih.gov/19770058/,Motivational orientation modulates the neural response to reward.,"Linke J, Kirsch P, King AV, Gass A, Hennerici MG, Bongers A, Wessa M",NeuroImage,0.078,19770058,-1,-1
personality traits_00087,https://pubmed.ncbi.nlm.nih.gov/27857686/,"Novelty Seeking, Harm Avoidance, and Cerebral Responses to Conflict Anticipation: An Exploratory Study.","Hu J, Hu S, Maisano JR, Chao HH, Zhang S, Li CR",Frontiers in human neuroscience,0.078,27857686,-1,-1
