paper_name,paper_url,Title,Author,Journal,Loading,PMID,Doi,download_status
personality traits_00088,https://pubmed.ncbi.nlm.nih.gov/18258337/,Perspective taking to assess self-personality: what's modified in Alzheimer's disease?,"Ruby P, Collette F, D'Argembeau A, Peters F, Degueldre C, Balteau E, Luxen A, Maquet P, Salmon E",Neurobiology of aging,0.077,18258337,-1,-1
personality traits_00089,https://pubmed.ncbi.nlm.nih.gov/19328237/,Neural response to reward anticipation is modulated by Gray's impulsivity.,"Hahn T, Dresler T, Ehlis AC, Plichta MM, Heinzel S, Polak T, Lesch KP, Breuer F, Jakob PM, Fallgatter AJ",NeuroImage,0.077,19328237,-1,-1
personality traits_00090,https://pubmed.ncbi.nlm.nih.gov/23771644/,Physiological and psychological individual differences influence resting brain function measured by ASL perfusion.,"Kano M, Coen SJ, Farmer AD, Aziz Q, Williams SC, Alsop DC, Fukudo S, O'Gorman RL",Brain structure & function,0.077,23771644,-1,-1
personality traits_00091,https://pubmed.ncbi.nlm.nih.gov/16529951/,Personality factors correlate with regional cerebral perfusion.,"O'Gorman RL, Kumari V, Williams SC, Zelaya FO, Connor SE, Alsop DC, Gray JA",NeuroImage,0.075,16529951,10.1016/j.neuroimage.2005.12.048,-1
personality traits_00092,https://pubmed.ncbi.nlm.nih.gov/22484520/,Age differences in default and reward networks during processing of personally relevant information.,"Grady CL, Grigg O, Ng C",Neuropsychologia,0.074,22484520,10.1016/j.neuropsychologia.2012.03.024,-1
personality traits_00093,https://pubmed.ncbi.nlm.nih.gov/23185306/,Brain structural correlates of reward sensitivity and impulsivity in adolescents  with normal and excess weight.,"Moreno-Lopez L, Soriano-Mas C, Delgado-Rico E, Rio-Valle JS, Verdejo-Garcia A",PloS one,0.073,23185306,-1,-1
personality traits_00094,https://pubmed.ncbi.nlm.nih.gov/29020651/,Is negative self-referent bias an endophenotype for depression? An fMRI study of  emotional self-referent words in twins at high vs. low risk of depression.,"Miskowiak KW, Larsen JE, Harmer CJ, Siebner HR, Kessing LV, Macoveanu J, Vinberg M",Journal of affective disorders,0.073,29020651,-1,-1
personality traits_00095,https://pubmed.ncbi.nlm.nih.gov/29747140/,Short-term escitalopram treatment normalizes aberrant self-referential processing in major depressive disorder.,"Komulainen E, Heikkila R, Nummenmaa L, Raij TT, Harmer CJ, Isometsa E, Ekelund J",Journal of affective disorders,0.07,29747140,-1,-1
personality traits_00096,https://pubmed.ncbi.nlm.nih.gov/20041155/,Is our self nothing but reward? Neuronal overlap and distinction between reward and personal relevance and its relation to human personality.,"Enzi B, de Greck M, Prosch U, Tempelmann C, Northoff G",PloS one,0.069,20041155,-1,-1
personality traits_00097,https://pubmed.ncbi.nlm.nih.gov/20594938/,Neural networks involved in self-judgement in young and elderly adults.,"Feyers D, Collette F, D'Argembeau A, Majerus S, Salmon E",NeuroImage,0.069,20594938,-1,-1
personality traits_00098,https://pubmed.ncbi.nlm.nih.gov/26807336/,Neural correlates of different self domains.,"Araujo HF, Kaplan J, Damasio H, Damasio A",Brain and behavior,0.068,26807336,-1,-1
personality traits_00099,https://pubmed.ncbi.nlm.nih.gov/20108218/,Reduced functional coupling in the default-mode network during self-referential processing.,"van Buuren M, Gladwin TE, Zandbelt BB, Kahn RS, Vink M",Human brain mapping,0.067,20108218,-1,-1
personality traits_00100,https://pubmed.ncbi.nlm.nih.gov/26690806/,Modulation of meso-limbic reward processing by motivational tendencies in young adolescents and adults.,"Joseph JE, Zhu X, Lynam D, Kelly TH",NeuroImage,0.066,26690806,-1,-1
personality traits_00101,https://pubmed.ncbi.nlm.nih.gov/26333130/,Coping with Self-Threat and the Evaluation of Self-Related Traits: An fMRI Study.,"Hoefler A, Athenstaedt U, Corcoran K, Ebner F, Ischebeck A",PloS one,0.054,26333130,-1,-1
