paper_name,paper_url,Title,Author,Journal,Loading,PMID,Doi,download_status
salience network_00087,https://pubmed.ncbi.nlm.nih.gov/22427852/,Large-scale brain networks in board game experts: insights from a domain-related  task and task-free resting state.,"Duan X, Liao W, Liang D, Qiu L, Gao Q, Liu C, Gong Q, Chen H",PloS one,0.078,22427852,-1,-1
salience network_00088,https://pubmed.ncbi.nlm.nih.gov/24642509/,Altered intrinsic functional connectivity of the salience network in childhood absence epilepsy.,"Luo C, Yang T, Tu S, Deng J, Liu D, Li Q, Dong L, Goldberg I, Gong Q, Zhang D, An D, Zhou D, Yao D",Journal of the neurological sciences,0.078,24642509,-1,-1
salience network_00089,https://pubmed.ncbi.nlm.nih.gov/27079535/,The salience network dynamics in perceptual decision-making.,"Chand GB, Dhamala M",NeuroImage,0.078,27079535,-1,-1
salience network_00090,https://pubmed.ncbi.nlm.nih.gov/23727217/,"Links among resting-state default-mode network, salience network, and symptomatology in schizophrenia.","Orliac F, Naveau M, Joliot M, Delcroix N, Razafimandimby A, Brazo P, Dollfus S, Delamillieure P",Schizophrenia research,0.076,23727217,-1,-1
salience network_00091,https://pubmed.ncbi.nlm.nih.gov/26241476/,Disruptions in Resting State Functional Connectivity and Cerebral Blood Flow in Mild Traumatic Brain Injury Patients.,"Sours C, Zhuo J, Roys S, Shanmuganathan K, Gullapalli RP",PloS one,0.076,26241476,10.1371/journal.pone.0134019,-1
salience network_00092,https://pubmed.ncbi.nlm.nih.gov/26388754/,Impact of real-time fMRI working memory feedback training on the interactions between three core brain networks.,"Zhang Q, Zhang G, Yao L, Zhao X",Frontiers in behavioral neuroscience,0.076,26388754,10.3389/fnbeh.2015.00244,-1
salience network_00093,https://pubmed.ncbi.nlm.nih.gov/25274576/,Imbalance of default mode and regulatory networks during externally focused processing in depression.,"Belleau EL, Taubitz LE, Larson CL",Social cognitive and affective neuroscience,0.075,25274576,10.1093/scan/nsu117,-1
salience network_00094,https://pubmed.ncbi.nlm.nih.gov/23720623/,BOLD Frequency Power Indexes Working Memory Performance.,"Balsters JH, Robertson IH, Calhoun VD",Frontiers in human neuroscience,0.074,23720623,-1,-1
salience network_00095,https://pubmed.ncbi.nlm.nih.gov/28594841/,Probabilistic Entity-Relationship Diagram: A correlation between functional connectivity and spontaneous brain activity during resting state in major depressive disorder.,"Zhang L, Shi L, Zhang B, Zhao L, Dong Y, Liu J, Lian Z, Liang L, Chen W, Luo X, Pei S, Mo X, Huang W, Ouyang F, Guo B, Liang C, Zhang S",PloS one,0.074,28594841,-1,-1
salience network_00096,https://pubmed.ncbi.nlm.nih.gov/23595766/,Cognitive control and the salience network: an investigation of error processing  and effective connectivity.,"Ham T, Leff A, de Boissezon X, Joffe A, Sharp DJ",The Journal of neuroscience : the official journal of the Society for Neuroscience,0.072,23595766,-1,-1
salience network_00097,https://pubmed.ncbi.nlm.nih.gov/24823717/,Alterations in Low-Level Perceptual Networks Related to Clinical Severity in PTSD after an Earthquake: A Resting-State fMRI Study.,"Shang J, Lui S, Meng Y, Zhu H, Qiu C, Gong Q, Liao W, Zhang W",PloS one,0.072,24823717,-1,-1
salience network_00098,https://pubmed.ncbi.nlm.nih.gov/23471456/,Dysregulated but not decreased salience network activity in schizophrenia.,"White TP, Gilleen J, Shergill SS",Frontiers in human neuroscience,0.07,23471456,-1,-1
salience network_00099,https://pubmed.ncbi.nlm.nih.gov/26331685/,Intranetwork and internetwork functional connectivity alterations in post-traumatic stress disorder.,"Zhang Y, Liu F, Chen H, Li M, Duan X, Xie B, Chen H",Journal of affective disorders,0.07,26331685,-1,-1
salience network_00100,https://pubmed.ncbi.nlm.nih.gov/28743059/,"Altered connectivity within and between the default mode, central executive, and  salience networks in obsessive-compulsive disorder.","Fan J, Zhong M, Gan J, Liu W, Niu C, Liao H, Zhang H, Yi J, Chan RCK, Tan C, Zhu X",Journal of affective disorders,0.07,28743059,-1,-1
salience network_00101,https://pubmed.ncbi.nlm.nih.gov/21782031/,Mind wandering and attention during focused meditation: a fine-grained temporal analysis of fluctuating cognitive states.,"Hasenkamp W, Wilson-Mendenhall CD, Duncan E, Barsalou LW",NeuroImage,0.069,21782031,-1,-1
salience network_00102,https://pubmed.ncbi.nlm.nih.gov/23527165/,Changes of functional and effective connectivity in smoking replenishment on deprived heavy smokers: a resting-state FMRI study.,"Ding X, Lee SW",PloS one,0.069,23527165,-1,-1
salience network_00103,https://pubmed.ncbi.nlm.nih.gov/25553621/,Alteration of spontaneous neuronal activity within the salience network in partially remitted depression.,"Liu CH, Ma X, Song LP, Tang LR, Jing B, Zhang Y, Li F, Zhou Z, Fan J, Wang CY",Brain research,0.069,25553621,-1,-1
salience network_00104,https://pubmed.ncbi.nlm.nih.gov/26057359/,Neural correlates of valence generalization in an affective conditioning paradigm.,"Schick A, Adam R, Vollmayr B, Kuehner C, Kanske P, Wessa M",Behavioural brain research,0.068,26057359,-1,-1
salience network_00105,https://pubmed.ncbi.nlm.nih.gov/28649489/,Brain functional connectivity is associated with visceral sensitivity in women with Irritable Bowel Syndrome.,"Icenhour A, Witt ST, Elsenbruch S, Lowen M, Engstrom M, Tillisch K, Mayer EA, Walter S",NeuroImage. Clinical,0.068,28649489,-1,-1
salience network_00106,https://pubmed.ncbi.nlm.nih.gov/26941629/,Resting-State Coupling between Core Regions within the Central-Executive and Salience Networks Contributes to Working Memory Performance.,"Fang X, Zhang Y, Zhou Y, Cheng L, Li J, Wang Y, Friston KJ, Jiang T",Frontiers in behavioral neuroscience,0.067,26941629,-1,-1
salience network_00107,https://pubmed.ncbi.nlm.nih.gov/21458238/,Functional resting-state networks are differentially affected in schizophrenia.,"Woodward ND, Rogers B, Heckers S",Schizophrenia research,0.066,21458238,-1,-1
salience network_00108,https://pubmed.ncbi.nlm.nih.gov/23716653/,Heightened emotional contagion in mild cognitive impairment and Alzheimer's disease is associated with temporal lobe degeneration.,"Sturm VE, Yokoyama JS, Seeley WW, Kramer JH, Miller BL, Rankin KP",Proceedings of the National Academy of Sciences of the United States of America,0.066,23716653,-1,-1
salience network_00109,https://pubmed.ncbi.nlm.nih.gov/26834594/,Decreased Intra- and Inter-Salience Network Functional Connectivity is Related to Trait Anxiety in Adolescents.,"Geng H, Li X, Chen J, Li X, Gu R",Frontiers in behavioral neuroscience,0.066,26834594,-1,-1
salience network_00110,https://pubmed.ncbi.nlm.nih.gov/27007121/,Contributions of self-report and performance-based individual differences measures of social cognitive ability to large-scale neural network functioning.,"Smith R, Alkozei A, Killgore WDS",Brain imaging and behavior,0.066,27007121,-1,-1
salience network_00111,https://pubmed.ncbi.nlm.nih.gov/28300639/,Sliding-window analysis tracks fluctuations in amygdala functional connectivity associated with physiological arousal and vigilance during fear conditioning.,"Baczkowski BM, Johnstone T, Walter H, Erk S, Veer IM",NeuroImage,0.066,28300639,10.1016/j.neuroimage.2017.03.022,-1
salience network_00112,https://pubmed.ncbi.nlm.nih.gov/24830839/,Anticipatory processes in brain state switching - Evidence from a novel cued-switching task implicating default mode and salience networks.,"Sidlauskaite J, Wiersema JR, Roeyers H, Krebs RM, Vassena E, Fias W, Brass M, Achten E, Sonuga-Barke E",NeuroImage,0.065,24830839,10.1016/j.neuroimage.2014.05.010,-1
salience network_00113,https://pubmed.ncbi.nlm.nih.gov/24790196/,Local Activity Determines Functional Connectivity in the Resting Human Brain: A Simultaneous FDG-PET/fMRI Study.,"Riedl V, Bienkowska K, Strobel C, Tahmasian M, Grimmer T, Forster S, Friston KJ, Sorg C, Drzezga A",The Journal of neuroscience : the official journal of the Society for Neuroscience,0.063,24790196,10.1523/JNEUROSCI.0492-14.2014,-1
salience network_00114,https://pubmed.ncbi.nlm.nih.gov/29164505/,Network-level dysconnectivity in patients with nasopharyngeal carcinoma (NPC) early post-radiotherapy: longitudinal resting state fMRI study.,"Qiu Y, Guo Z, Han L, Yang Y, Li J, Liu S, Lv X",Brain imaging and behavior,0.063,29164505,-1,-1
salience network_00115,https://pubmed.ncbi.nlm.nih.gov/26197092/,"Neural networks supporting switching, hypothesis testing, and rule application.","Liu Z, Braunlich K, Wehe HS, Seger CA",Neuropsychologia,0.062,26197092,-1,-1
salience network_00116,https://pubmed.ncbi.nlm.nih.gov/27627760/,Default Mode and Executive Networks Areas: Association with the Serial Order in Divergent Thinking.,"Heinonen J, Numminen J, Hlushchuk Y, Antell H, Taatila V, Suomala J",PloS one,0.061,27627760,-1,-1
salience network_00117,https://pubmed.ncbi.nlm.nih.gov/24222384/,Abnormal salience network in normal aging and in amnestic mild cognitive impairment and Alzheimer's disease.,"He X, Qin W, Liu Y, Zhang X, Duan Y, Song J, Li K, Jiang T, Yu C",Human brain mapping,0.06,24222384,-1,-1
salience network_00118,https://pubmed.ncbi.nlm.nih.gov/25307723/,Functional connectivity and neuronal variability of resting state activity in bipolar disorder-reduction and decoupling in anterior cortical midline structures.,"Magioncalda P, Martino M, Conio B, Escelsior A, Piaggio N, Presta A, Marozzi V, Rocchi G, Anastasio L, Vassallo L, Ferri F, Huang Z, Roccatagliata L, Pardini M, Northoff G, Amore M",Human brain mapping,0.06,25307723,-1,-1
salience network_00119,https://pubmed.ncbi.nlm.nih.gov/25721566/,Functional connectivity patterns reflect individual differences in conflict adaptation.,"Wang X, Wang T, Chen Z, Hitchman G, Liu Y, Chen A",Neuropsychologia,0.06,25721566,-1,-1
salience network_00120,https://pubmed.ncbi.nlm.nih.gov/27512990/,Altered Vision-Related Resting-State Activity in Pituitary Adenoma Patients with  Visual Damage.,"Qian H, Wang X, Wang Z, Wang Z, Liu P",PloS one,0.058,27512990,-1,-1
salience network_00121,https://pubmed.ncbi.nlm.nih.gov/24292325/,Differentially disrupted functional connectivity of the subregions of the inferior parietal lobule in Alzheimer's disease.,"Wang Z, Xia M, Dai Z, Liang X, Song H, He Y, Li K",Brain structure & function,0.055,24292325,-1,-1
salience network_00122,https://pubmed.ncbi.nlm.nih.gov/26252893/,Voxel Based Morphometry Alterations in Mal de Debarquement Syndrome.,"Cha YH, Chakrapani S",PloS one,0.053,26252893,-1,-1
salience network_00123,https://pubmed.ncbi.nlm.nih.gov/25139625/,Endogenous-cue prospective memory involving incremental updating of working memory: an fMRI study.,"Halahalli HN, John JP, Lukose A, Jain S, Kutty BM",Brain structure & function,0.052,25139625,-1,-1
salience network_00124,https://pubmed.ncbi.nlm.nih.gov/24478665/,Insular dysfunction within the salience network is associated with severity of symptoms and aberrant inter-network connectivity in major depressive disorder.,"Manoliu A, Meng C, Brandl F, Doll A, Tahmasian M, Scherr M, Schwerthoffer D, Zimmer C, Forstl H, Bauml J, Riedl V, Wohlschlager AM, Sorg C",Frontiers in human neuroscience,0.051,24478665,-1,-1
salience network_00125,https://pubmed.ncbi.nlm.nih.gov/26379530/,Alteration of Basal Ganglia and Right Frontoparietal Network in Early Drug-Naive  Parkinson's Disease during Heat Pain Stimuli and Resting State.,"Tan Y, Tan J, Deng J, Cui W, He H, Yang F, Deng H, Xiao R, Huang Z, Zhang X, Tan R, Shen X, Liu T, Wang X, Yao D, Luo C",Frontiers in human neuroscience,0.048,26379530,-1,-1
salience network_00126,https://pubmed.ncbi.nlm.nih.gov/28458998/,Resting-state functional connectivity between right anterior insula and right orbital frontal cortex correlate with insight level in obsessive-compulsive disorder.,"Fan J, Zhong M, Zhu X, Gan J, Liu W, Niu C, Liao H, Zhang H, Yi J, Tan C",NeuroImage. Clinical,0.046,28458998,-1,-1
