paper_name,paper_url,Title,Author,Journal,Loading,PMID,Doi,download_status
salience network_00001,https://pubmed.ncbi.nlm.nih.gov/23146249/,Salience network-midbrain dysconnectivity and blunted reward signals in schizophrenia.,"Gradin VB, Waiter G, O'Connor A, Romaniuk L, Stickle C, Matthews K, Hall J, Douglas Steele J",Psychiatry research,0.337,23146249,-1,-1
salience network_00002,https://pubmed.ncbi.nlm.nih.gov/23616756/,Brain and effort: brain activation and effort-related working memory in healthy participants and patients with working memory deficits.,"Engstrom M, Landtblom AM, Karlsson T",Frontiers in human neuroscience,0.312,23616756,-1,-1
salience network_00003,https://pubmed.ncbi.nlm.nih.gov/20724114/,Aberrant salience network (bilateral insula and anterior cingulate cortex) connectivity during information processing in schizophrenia.,"White TP, Joseph V, Francis ST, Liddle PF",Schizophrenia research,0.286,20724114,-1,-1
salience network_00004,https://pubmed.ncbi.nlm.nih.gov/22522963/,Alterations of the salience network in obesity: a resting-state fMRI study.,"Garcia-Garcia I, Jurado MA, Garolera M, Segura B, Sala-Llonch R, Marques-Iturria I, Pueyo R, Sender-Palacios MJ, Vernet-Vernet M, Narberhaus A, Ariza M, Junque C",Human brain mapping,0.282,22522963,-1,-1
salience network_00005,https://pubmed.ncbi.nlm.nih.gov/22784277/,Decreased functional connectivity by aging is associated with cognitive decline.,"Onoda K, Ishihara M, Yamaguchi S",Journal of cognitive neuroscience,0.26,22784277,-1,-1
salience network_00006,https://pubmed.ncbi.nlm.nih.gov/29395610/,Disrupted salience processing involved in motivational deficits for real-life activities in patients with schizophrenia.,"Kim BH, Shin YB, Kyeong S, Lee SK, Kim JJ",Schizophrenia research,0.257,29395610,-1,-1
salience network_00007,https://pubmed.ncbi.nlm.nih.gov/28453543/,Altered resting-state intra- and inter- network functional connectivity in patients with persistent somatoform pain disorder.,"Zhao Z, Huang T, Tang C, Ni K, Pan X, Yan C, Fan X, Xu D, Luo Y",PloS one,0.216,28453543,-1,-1
salience network_00008,https://pubmed.ncbi.nlm.nih.gov/24768931/,Neural dynamics necessary and sufficient for transition into pre-sleep induced by EEG NeuroFeedback.,"Kinreich S, Podlipsky I, Jamshy S, Intrator N, Hendler T",NeuroImage,0.203,24768931,-1,-1
salience network_00009,https://pubmed.ncbi.nlm.nih.gov/27729852/,Reward vs. Retaliation-the Role of the Mesocorticolimbic Salience Network in Human Reactive Aggression.,"Gan G, Preston-Campbell RN, Moeller SJ, Steinberg JL, Lane SD, Maloney T, Parvaz MA, Goldstein RZ, Alia-Klein N",Frontiers in behavioral neuroscience,0.198,27729852,-1,-1
salience network_00010,https://pubmed.ncbi.nlm.nih.gov/22301351/,The salience network contributes to an individual's fluid reasoning capacity.,"Yuan Z, Qin W, Wang D, Jiang T, Zhang Y, Yu C",Behavioural brain research,0.197,22301351,-1,-1
salience network_00011,https://pubmed.ncbi.nlm.nih.gov/26184459/,"Aberrant functioning of the putamen links delusions, antipsychotic drug dose, and compromised connectivity in first episode psychosis--Preliminary fMRI findings.","Raij TT, Mantyla T, Kieseppa T, Suvisaari J",Psychiatry research,0.193,26184459,-1,-1
salience network_00012,https://pubmed.ncbi.nlm.nih.gov/22586138/,Functional network connectivity underlying food processing: disturbed salience and visual processing in overweight and obese adults.,"Kullmann S, Pape AA, Heni M, Ketterer C, Schick F, Haring HU, Fritsche A, Preissl H, Veit R","Cerebral cortex (New York, N.Y. : 1991)",0.192,22586138,-1,-1
salience network_00013,https://pubmed.ncbi.nlm.nih.gov/29571753/,"Disrupted network cross talk, hippocampal dysfunction and hallucinations in schizophrenia.","Hare SM, Law AS, Ford JM, Mathalon DH, Ahmadi A, Damaraju E, Bustillo J, Belger A, Lee HJ, Mueller BA, Lim KO, Brown GG, Preda A, van Erp TGM, Potkin SG, Calhoun VD, Turner JA",Schizophrenia research,0.192,29571753,-1,-1
salience network_00014,https://pubmed.ncbi.nlm.nih.gov/25743635/,Auditory mismatch impairments are characterized by core neural dysfunctions in schizophrenia.,"Gaebler AJ, Mathiak K, Koten JW Jr, Konig AA, Koush Y, Weyer D, Depner C, Matentzoglu S, Edgar JC, Willmes K, Zvyagintsev M",Brain : a journal of neurology,0.191,25743635,-1,-1
salience network_00015,https://pubmed.ncbi.nlm.nih.gov/28844071/,Corticolimbic structural alterations linked to health status and trait anxiety in functional neurological disorder.,"Perez DL, Williams B, Matin N, LaFrance WC Jr, Costumero-Ramos V, Fricchione GL, Sepulcre J, Keshavan MS, Dickerson BC","Journal of neurology, neurosurgery, and psychiatry",0.191,28844071,-1,-1
salience network_00016,https://pubmed.ncbi.nlm.nih.gov/27142636/,Functional connectivity dynamics during film viewing reveal common networks for different emotional experiences.,"Raz G, Touroutoglou A, Wilson-Mendenhall C, Gilam G, Lin T, Gonen T, Jacob Y, Atzil S, Admon R, Bleich-Cohen M, Maron-Katz A, Hendler T, Barrett LF","Cognitive, affective & behavioral neuroscience",0.185,27142636,-1,-1
salience network_00017,https://pubmed.ncbi.nlm.nih.gov/25143607/,Network organization unfolds over time during periods of anxious anticipation.,"McMenamin BW, Langeslag SJ, Sirbu M, Padmala S, Pessoa L",The Journal of neuroscience : the official journal of the Society for Neuroscience,0.184,25143607,10.1523/JNEUROSCI.1579-14.2014,-1
salience network_00018,https://pubmed.ncbi.nlm.nih.gov/27414048/,Aberrant Resting-State Functional Connectivity in the Salience Network of Adolescent Chronic Fatigue Syndrome.,"Wortinger LA, Endestad T, Melinder AM, Oie MG, Sevenius A, Bruun Wyller V",PloS one,0.184,27414048,10.1371/journal.pone.0159351,-1
salience network_00019,https://pubmed.ncbi.nlm.nih.gov/24862074/,The salience network is responsible for switching between the default mode network and the central executive network: replication from DCM.,"Goulden N, Khusnulina A, Davis NJ, Bracewell RM, Bokde AL, McNulty JP, Mullins PG",NeuroImage,0.18,24862074,-1,-1
salience network_00020,https://pubmed.ncbi.nlm.nih.gov/28806707/,Deviant functional activation and connectivity of the right insula are associated with lack of awareness of episodic memory impairment in nonamnesic alcoholism.,"Le Berre AP, Muller-Oehring EM, Schulte T, Serventi MR, Pfefferbaum A, Sullivan EV",Cortex; a journal devoted to the study of the nervous system and behavior,0.18,28806707,-1,-1
salience network_00021,https://pubmed.ncbi.nlm.nih.gov/25044711/,Emotion perception and executive control interact in the salience network during  emotionally charged working memory processing.,"Luo Y, Qin S, Fernandez G, Zhang Y, Klumpers F, Li H",Human brain mapping,0.165,25044711,-1,-1
salience network_00022,https://pubmed.ncbi.nlm.nih.gov/26793436/,Abnormalities in large scale functional networks in unmedicated patients with schizophrenia and effects of risperidone.,"Kraguljac NV, White DM, Hadley JA, Visscher K, Knight D, ver Hoef L, Falola B, Lahti AC",NeuroImage. Clinical,0.154,26793436,-1,-1
salience network_00023,https://pubmed.ncbi.nlm.nih.gov/23185305/,scMRI reveals large-scale brain network abnormalities in autism.,"Zielinski BA, Anderson JS, Froehlich AL, Prigge MB, Nielsen JA, Cooperrider JR, Cariello AN, Fletcher PT, Alexander AL, Lange N, Bigler ED, Lainhart JE",PloS one,0.149,23185305,-1,-1
salience network_00024,https://pubmed.ncbi.nlm.nih.gov/27444730/,Intrinsic network connectivity and own body perception in gender dysphoria.,"Feusner JD, Lidstrom A, Moody TD, Dhejne C, Bookheimer SY, Savic I",Brain imaging and behavior,0.146,27444730,-1,-1
salience network_00025,https://pubmed.ncbi.nlm.nih.gov/29364911/,Scholastic performance and functional connectivity of brain networks in children.,"Chaddock-Heyman L, Weng TB, Kienzler C, Erickson KI, Voss MW, Drollette ES, Raine LB, Kao SC, Hillman CH, Kramer AF",PloS one,0.14,29364911,-1,-1
salience network_00026,https://pubmed.ncbi.nlm.nih.gov/26307468/,Source analysis of stimulus-preceding negativity constrained by functional magnetic resonance imaging.,"Kotani Y, Ohgami Y, Ishiwata T, Arai J, Kiryu S, Inoue Y",Biological psychology,0.137,26307468,-1,-1
salience network_00027,https://pubmed.ncbi.nlm.nih.gov/28101012/,Morphological and Functional Differences between Athletes and Novices in Cortical Neuronal Networks.,"Tan XY, Pi YL, Wang J, Li XP, Zhang LL, Dai W, Zhu H, Ni Z, Zhang J, Wu Y",Frontiers in human neuroscience,0.136,28101012,-1,-1
salience network_00028,https://pubmed.ncbi.nlm.nih.gov/27966102/,Behavioral and neural correlates of disrupted orienting attention in posttraumatic stress disorder.,"Russman Block S, King AP, Sripada RK, Weissman DH, Welsh R, Liberzon I","Cognitive, affective & behavioral neuroscience",0.134,27966102,-1,-1
salience network_00029,https://pubmed.ncbi.nlm.nih.gov/28539879/,Multiple Neural Networks Malfunction in Primary Blepharospasm: An Independent Components Analysis.,"Huang XF, Zhu MR, Shan P, Pei CH, Liang ZH, Zhou HL, Ni MF, Miao YW, Xu GQ, Zhang BW, Luo YY",Frontiers in human neuroscience,0.127,28539879,-1,-1
salience network_00030,https://pubmed.ncbi.nlm.nih.gov/29527476/,Connectome-wide investigation of altered resting-state functional connectivity in war veterans with and without posttraumatic stress disorder.,"Misaki M, Phillips R, Zotev V, Wong CK, Wurfel BE, Krueger F, Feldner M, Bodurka J",NeuroImage. Clinical,0.121,29527476,-1,-1
salience network_00031,https://pubmed.ncbi.nlm.nih.gov/25237810/,Modafinil alters intrinsic functional connectivity of the right posterior insula: a pharmacological resting state fMRI study.,"Cera N, Tartaro A, Sensi SL",PloS one,0.12,25237810,-1,-1
salience network_00032,https://pubmed.ncbi.nlm.nih.gov/26303978/,Epigenetic variation in the serotonin transporter gene predicts resting state functional connectivity strength within the salience-network.,"Muehlhan M, Kirschbaum C, Wittchen HU, Alexander N",Human brain mapping,0.116,26303978,-1,-1
salience network_00033,https://pubmed.ncbi.nlm.nih.gov/26248899/,Dissociated neural effects of cortisol depending on threat escapability.,"Montoya ER, van Honk J, Bos PA, Terburg D",Human brain mapping,0.113,26248899,-1,-1
salience network_00034,https://pubmed.ncbi.nlm.nih.gov/21497489/,Regional contraction of brain surface area involves three large-scale networks in schizophrenia.,"Palaniyappan L, Mallikarjun P, Joseph V, White TP, Liddle PF",Schizophrenia research,0.112,21497489,-1,-1
salience network_00035,https://pubmed.ncbi.nlm.nih.gov/25994971/,Sex differences in intrinsic brain functional connectivity underlying human shyness.,"Yang X, Wang S, Kendrick KM, Wu X, Yao L, Lei D, Kuang W, Bi F, Huang X, He Y, Gong Q",Social cognitive and affective neuroscience,0.112,25994971,-1,-1
salience network_00036,https://pubmed.ncbi.nlm.nih.gov/25266592/,Regional amyloid burden and intrinsic connectivity networks in cognitively normal elderly subjects.,"Lim HK, Nebes R, Snitz B, Cohen A, Mathis C, Price J, Weissfeld L, Klunk W, Aizenstein HJ",Brain : a journal of neurology,0.111,25266592,-1,-1
salience network_00037,https://pubmed.ncbi.nlm.nih.gov/25445783/,Brain network activity in monolingual and bilingual older adults.,"Grady CL, Luk G, Craik FI, Bialystok E",Neuropsychologia,0.111,25445783,-1,-1
salience network_00038,https://pubmed.ncbi.nlm.nih.gov/26219630/,Common neural correlates of emotion perception in humans.,"Jastorff J, Huang YA, Giese MA, Vandenbulcke M",Human brain mapping,0.111,26219630,-1,-1
salience network_00039,https://pubmed.ncbi.nlm.nih.gov/27298763/,Increased frontal functional networks in adult survivors of childhood brain tumors.,"Chen H, Wang L, King TZ, Mao H",NeuroImage. Clinical,0.109,27298763,-1,-1
salience network_00040,https://pubmed.ncbi.nlm.nih.gov/25468173/,Resting-state functional connectivity alterations in the default network of schizophrenia patients with persistent auditory verbal hallucinations.,"Alonso-Solis A, Vives-Gilabert Y, Grasa E, Portella MJ, Rabella M, Sauras RB, Roldan A, Nunez-Marin F, Gomez-Anson B, Perez V, Alvarez E, Corripio I",Schizophrenia research,0.108,25468173,-1,-1
salience network_00041,https://pubmed.ncbi.nlm.nih.gov/26231515/,Individual differences in resting-state functional connectivity with the executive network: support for a cerebellar role in anxiety vulnerability.,"Caulfield MD, Zhu DC, McAuley JD, Servatius RJ",Brain structure & function,0.107,26231515,-1,-1
salience network_00042,https://pubmed.ncbi.nlm.nih.gov/26448909/,Impaired target detection in schizophrenia and the ventral attentional network: Findings from a joint event-related potential-functional MRI analysis.,"Wynn JK, Jimenez AM, Roach BJ, Korb A, Lee J, Horan WP, Ford JM, Green MF",NeuroImage. Clinical,0.107,26448909,-1,-1
salience network_00043,https://pubmed.ncbi.nlm.nih.gov/26440126/,Sex commonalities and differences in the relationship between resilient personality and the intrinsic connectivity of the salience and default mode networks.,"Kilpatrick LA, Istrin JJ, Gupta A, Naliboff BD, Tillisch K, Labus JS, Mayer EA",Biological psychology,0.106,26440126,-1,-1
salience network_00044,https://pubmed.ncbi.nlm.nih.gov/27499736/,Amplitude of Sensorimotor Mu Rhythm Is Correlated with BOLD from Multiple Brain Regions: A Simultaneous EEG-fMRI Study.,"Yin S, Liu Y, Ding M",Frontiers in human neuroscience,0.104,27499736,-1,-1
salience network_00045,https://pubmed.ncbi.nlm.nih.gov/22465168/,The facilitating effect of clinical hypnosis on motor imagery: an fMRI study.,"Muller K, Bacht K, Schramm S, Seitz RJ",Behavioural brain research,0.101,22465168,-1,-1
salience network_00046,https://pubmed.ncbi.nlm.nih.gov/24302681/,The neurosteroids allopregnanolone and dehydroepiandrosterone modulate resting-state amygdala connectivity.,"Sripada RK, Welsh RC, Marx CE, Liberzon I",Human brain mapping,0.101,24302681,-1,-1
salience network_00047,https://pubmed.ncbi.nlm.nih.gov/25659130/,Evaluation of resting state networks in patients with gliomas: connectivity changes in the unaffected side and its relation to cognitive function.,"Maesawa S, Bagarinao E, Fujii M, Futamura M, Motomura K, Watanabe H, Mori D, Sobue G, Wakabayashi T",PloS one,0.101,25659130,-1,-1
salience network_00048,https://pubmed.ncbi.nlm.nih.gov/25482265/,Frontoparietal networks involved in categorization and item working memory.,"Braunlich K, Gomez-Lavin J, Seger CA",NeuroImage,0.1,25482265,-1,-1
salience network_00049,https://pubmed.ncbi.nlm.nih.gov/23376790/,EEG correlates of time-varying BOLD functional connectivity.,"Chang C, Liu Z, Chen MC, Liu X, Duyn JH",NeuroImage,0.099,23376790,-1,-1
salience network_00050,https://pubmed.ncbi.nlm.nih.gov/27656137/,Altered Effective Connectivity among Core Neurocognitive Networks in Idiopathic Generalized Epilepsy: An fMRI Evidence.,"Wei H, An J, Shen H, Zeng LL, Qiu S, Hu D",Frontiers in human neuroscience,0.099,27656137,-1,-1
salience network_00051,https://pubmed.ncbi.nlm.nih.gov/29733816/,Creative conceptual expansion: A combined fMRI replication and extension study to examine individual differences in creativity.,"Abraham A, Rutter B, Bantin T, Hermann C",Neuropsychologia,0.099,29733816,10.1016/j.neuropsychologia.2018.05.004,-1
salience network_00052,https://pubmed.ncbi.nlm.nih.gov/22403536/,Effects of meditation experience on functional connectivity of distributed brain  networks.,"Hasenkamp W, Barsalou LW",Frontiers in human neuroscience,0.097,22403536,-1,-1
salience network_00053,https://pubmed.ncbi.nlm.nih.gov/28880891/,Altered right anterior insular connectivity and loss of associated functions in adolescent chronic fatigue syndrome.,"Wortinger LA, Glenne Oie M, Endestad T, Bruun Wyller V",PloS one,0.096,28880891,-1,-1
salience network_00054,https://pubmed.ncbi.nlm.nih.gov/23000783/,Altered anterior insula activation during anticipation and experience of painful  stimuli in expert meditators.,"Lutz A, McFarlin DR, Perlman DM, Salomons TV, Davidson RJ",NeuroImage,0.095,23000783,-1,-1
salience network_00055,https://pubmed.ncbi.nlm.nih.gov/24315034/,Divergent task-dependent functional connectivity of executive control and salience networks.,"Elton A, Gao W",Cortex; a journal devoted to the study of the nervous system and behavior,0.094,24315034,-1,-1
salience network_00056,https://pubmed.ncbi.nlm.nih.gov/26279212/,Neural correlates of psychological resilience and their relation to life satisfaction in a sample of healthy young adults.,"Kong F, Wang X, Hu S, Liu J",NeuroImage,0.094,26279212,-1,-1
salience network_00057,https://pubmed.ncbi.nlm.nih.gov/22563003/,Reduced functional connectivity within and between 'social' resting state networks in autism spectrum conditions.,"von dem Hagen EA, Stoyanova RS, Baron-Cohen S, Calder AJ",Social cognitive and affective neuroscience,0.093,22563003,-1,-1
salience network_00058,https://pubmed.ncbi.nlm.nih.gov/29264112/,Altered intrinsic and extrinsic connectivity in schizophrenia.,"Zhou Y, Zeidman P, Wu S, Razi A, Chen C, Yang L, Zou J, Wang G, Wang H, Friston KJ",NeuroImage. Clinical,0.093,29264112,-1,-1
salience network_00059,https://pubmed.ncbi.nlm.nih.gov/24469099/,Altered brain activation during response inhibition and error processing in subjects with Internet gaming disorder: a functional magnetic imaging study.,"Ko CH, Hsieh TJ, Chen CY, Yen CF, Chen CS, Yen JY, Wang PW, Liu GC",European archives of psychiatry and clinical neuroscience,0.09,24469099,-1,-1
salience network_00060,https://pubmed.ncbi.nlm.nih.gov/25797238/,Asymmetric development of dorsal and ventral attention networks in the human brain.,"Farrant K, Uddin LQ",Developmental cognitive neuroscience,0.09,25797238,-1,-1
salience network_00061,https://pubmed.ncbi.nlm.nih.gov/27818626/,Arousal Rather than Basic Emotions Influence Long-Term Recognition Memory in Humans.,"Marchewka A, Wypych M, Moslehi A, Riegel M, Michalowski JM, Jednorog K",Frontiers in behavioral neuroscience,0.089,27818626,-1,-1
salience network_00062,https://pubmed.ncbi.nlm.nih.gov/28119587/,The Effect of Gray Matter ICA and Coefficient of Variation Mapping of BOLD Data on the Detection of Functional Connectivity Changes in Alzheimer's Disease and bvFTD.,"Tuovinen T, Rytty R, Moilanen V, Abou Elseoud A, Veijola J, Remes AM, Kiviniemi VJ",Frontiers in human neuroscience,0.089,28119587,-1,-1
salience network_00063,https://pubmed.ncbi.nlm.nih.gov/28466439/,High-sensitivity neuroimaging biomarkers for the identification of amnestic mild  cognitive impairment based on resting-state fMRI and a triple network model.,"Yu E, Liao Z, Tan Y, Qiu Y, Zhu J, Han Z, Wang J, Wang X, Wang H, Chen Y, Zhang Q, Li Y, Mao D, Ding Z",Brain imaging and behavior,0.089,28466439,-1,-1
salience network_00064,https://pubmed.ncbi.nlm.nih.gov/21111053/,Functional connectivity of the insula in the resting brain.,"Cauda F, D'Agata F, Sacco K, Duca S, Geminiani G, Vercelli A",NeuroImage,0.088,21111053,-1,-1
salience network_00065,https://pubmed.ncbi.nlm.nih.gov/22745490/,Loss of intranetwork and internetwork resting state functional connections with Alzheimer's disease progression.,"Brier MR, Thomas JB, Snyder AZ, Benzinger TL, Zhang D, Raichle ME, Holtzman DM, Morris JC, Ances BM",The Journal of neuroscience : the official journal of the Society for Neuroscience,0.087,22745490,-1,-1
salience network_00066,https://pubmed.ncbi.nlm.nih.gov/27192082/,Task and Resting-State fMRI Reveal Altered Salience Responses to Positive Stimuli in Patients with Major Depressive Disorder.,"Yang Y, Zhong N, Imamura K, Lu S, Li M, Zhou H, Li H, Yang X, Wan Z, Wang G, Hu B, Li K",PloS one,0.087,27192082,-1,-1
salience network_00067,https://pubmed.ncbi.nlm.nih.gov/22426336/,Distinct frontal networks are involved in adapting to internally and externally signaled errors.,"Ham TE, de Boissezon X, Leff A, Beckmann C, Hughes E, Kinnunen KM, Leech R, Sharp DJ","Cerebral cortex (New York, N.Y. : 1991)",0.086,22426336,-1,-1
salience network_00068,https://pubmed.ncbi.nlm.nih.gov/23558094/,The scent of salience--is there olfactory-trigeminal conditioning in humans?,"Moessnang C, Pauly K, Kellermann T, Kramer J, Finkelmeyer A, Hummel T, Siegel SJ, Schneider F, Habel U",NeuroImage,0.086,23558094,-1,-1
salience network_00069,https://pubmed.ncbi.nlm.nih.gov/24619004/,Abnormal neural processing during emotional salience attribution of affective asymmetry in patients with schizophrenia.,"Lee SK, Chun JW, Lee JS, Park HJ, Jung YC, Seok JH, Kim JJ",PloS one,0.086,24619004,-1,-1
salience network_00070,https://pubmed.ncbi.nlm.nih.gov/26657414/,Intrinsic connectivity networks from childhood to late adolescence: Effects of age and sex.,"Sole-Padulles C, Castro-Fornieles J, de la Serna E, Calvo R, Baeza I, Moya J, Lazaro L, Rosa M, Bargallo N, Sugranyes G",Developmental cognitive neuroscience,0.086,26657414,-1,-1
salience network_00071,https://pubmed.ncbi.nlm.nih.gov/27788143/,Brain Connectivity Changes in Autosomal Recessive Parkinson Disease: A Model for  the Sporadic Form.,"Makovac E, Cercignani M, Serra L, Torso M, Spano B, Petrucci S, Ricciardi L, Ginevrino M, Caltagirone C, Bentivoglio AR, Valente EM, Bozzali M",PloS one,0.086,27788143,10.1371/journal.pone.0163980,-1
salience network_00072,https://pubmed.ncbi.nlm.nih.gov/28125578/,Functional Connectivity Anomalies in Adolescents with Psychotic Symptoms.,"Amico F, O'Hanlon E, Kraft D, Oertel-Knochel V, Clarke M, Kelleher I, Higgins N, Coughlan H, Creegan D, Heneghan M, Power E, Power L, Ryan J, Frodl T, Cannon M",PloS one,0.086,28125578,10.1371/journal.pone.0169364,-1
salience network_00073,https://pubmed.ncbi.nlm.nih.gov/25271846/,Selective vulnerability related to aging in large-scale resting brain networks.,"Zhang HY, Chen WX, Jiao Y, Xu Y, Zhang XR, Wu JT",PloS one,0.084,25271846,-1,-1
salience network_00074,https://pubmed.ncbi.nlm.nih.gov/26674413/,Abnormal striatal resting-state functional connectivity in adolescents with obsessive-compulsive disorder.,"Bernstein GA, Mueller BA, Schreiner MW, Campbell SM, Regan EK, Nelson PM, Houri AK, Lee SS, Zagoloff AD, Lim KO, Yacoub ES, Cullen KR",Psychiatry research. Neuroimaging,0.083,26674413,-1,-1
salience network_00075,https://pubmed.ncbi.nlm.nih.gov/28092055/,Differentiating emotional processing and attention in psychopathy with functional neuroimaging.,"Anderson NE, Steele VR, Maurer JM, Rao V, Koenigs MR, Decety J, Kosson DS, Calhoun VD, Kiehl KA","Cognitive, affective & behavioral neuroscience",0.083,28092055,-1,-1
salience network_00076,https://pubmed.ncbi.nlm.nih.gov/24563528/,Variety in emotional life: within-category typicality of emotional experiences is associated with neural activity in large-scale brain networks.,"Wilson-Mendenhall CD, Feldman Barrett L, Barsalou LW",Social cognitive and affective neuroscience,0.082,24563528,-1,-1
salience network_00077,https://pubmed.ncbi.nlm.nih.gov/25126947/,Brain networks during free viewing of complex erotic movie: new insights on psychogenic erectile dysfunction.,"Cera N, Di Pierro ED, Ferretti A, Tartaro A, Romani GL, Perrucci MG",PloS one,0.082,25126947,-1,-1
salience network_00078,https://pubmed.ncbi.nlm.nih.gov/25680990/,Intrinsic connectivity in the human brain does not reveal networks for 'basic' emotions.,"Touroutoglou A, Lindquist KA, Dickerson BC, Barrett LF",Social cognitive and affective neuroscience,0.082,25680990,-1,-1
salience network_00079,https://pubmed.ncbi.nlm.nih.gov/24198777/,Shifted intrinsic connectivity of central executive and salience network in borderline personality disorder.,"Doll A, Sorg C, Manoliu A, Woller A, Meng C, Forstl H, Zimmer C, Wohlschlager AM, Riedl V",Frontiers in human neuroscience,0.081,24198777,-1,-1
salience network_00080,https://pubmed.ncbi.nlm.nih.gov/25731997/,Functional brain networks underlying detection and integration of disconfirmatory evidence.,"Lavigne KM, Metzak PD, Woodward TS",NeuroImage,0.081,25731997,-1,-1
salience network_00081,https://pubmed.ncbi.nlm.nih.gov/29169125/,"Functional connectivity between salience, default mode and frontoparietal networks in post-stroke depression.","Balaev V, Orlov I, Petrushevsky A, Martynova O",Journal of affective disorders,0.081,29169125,-1,-1
salience network_00082,https://pubmed.ncbi.nlm.nih.gov/23973408/,"The feedback-related negativity (FRN) revisited: new insights into the localization, meaning and network organization.","Hauser TU, Iannaccone R, Stampfli P, Drechsler R, Brandeis D, Walitza S, Brem S",NeuroImage,0.08,23973408,-1,-1
salience network_00083,https://pubmed.ncbi.nlm.nih.gov/26063914/,Generalization in Category Learning: The Roles of Representational and Decisional Uncertainty.,"Seger CA, Braunlich K, Wehe HS, Liu Z",The Journal of neuroscience : the official journal of the Society for Neuroscience,0.08,26063914,-1,-1
salience network_00084,https://pubmed.ncbi.nlm.nih.gov/26208746/,Altered threat and safety neural processing linked to persecutory delusions in schizophrenia: a two-task fMRI study.,"Perez DL, Pan H, Weisholtz DS, Root JC, Tuescher O, Fischer DB, Butler T, Vago DR, Isenberg N, Epstein J, Landa Y, Smith TE, Savitz AJ, Silbersweig DA, Stern E",Psychiatry research,0.08,26208746,-1,-1
salience network_00085,https://pubmed.ncbi.nlm.nih.gov/26673113/,Thinking about thinking: Neural mechanisms and effects on memory.,"Bonhage C, Weber F, Exner C, Kanske P",NeuroImage,0.08,26673113,-1,-1
salience network_00086,https://pubmed.ncbi.nlm.nih.gov/25745394/,Directionality of large-scale resting-state brain networks during eyes open and eyes closed conditions.,"Zhang D, Liang B, Wu X, Wang Z, Xu P, Chang S, Liu B, Liu M, Huang R",Frontiers in human neuroscience,0.079,25745394,-1,-1
