paper_name,paper_url,Title,Author,Journal,Loading,PMID,Doi,download_status
sleep_00088,https://pubmed.ncbi.nlm.nih.gov/22565029/,Frontal and parietal activity after sleep deprivation is dependent on task difficulty and can be predicted by the fMRI response after normal sleep.,"Lythe KE, Williams SC, Anderson C, Libri V, Mehta MA",Behavioural brain research,0.285,22565029,-1,-1
sleep_00089,https://pubmed.ncbi.nlm.nih.gov/24205327/,Decreased thalamocortical functional connectivity after 36 hours of total sleep deprivation: evidence from resting state FMRI.,"Shao Y, Wang L, Ye E, Jin X, Ni W, Yang Y, Wen B, Hu D, Yang Z",PloS one,0.285,24205327,-1,-1
sleep_00090,https://pubmed.ncbi.nlm.nih.gov/20140099/,Sleep deprivation impairs object-selective attention: a view from the ventral visual cortex.,"Lim J, Tan JC, Parimal S, Dinges DF, Chee MW",PloS one,0.281,20140099,-1,-1
sleep_00091,https://pubmed.ncbi.nlm.nih.gov/14654457/,MEG tomography of human cortex and brainstem activity in waking and REM sleep saccades.,"Ioannides AA, Corsi-Cabrera M, Fenwick PB, del Rio Portilla Y, Laskaris NA, Khurshudyan A, Theofilou D, Shibata T, Uchida S, Nakabayashi T, Kostopoulos GK","Cerebral cortex (New York, N.Y. : 1991)",0.266,14654457,10.1093/cercor/bhg091,-1
sleep_00092,https://pubmed.ncbi.nlm.nih.gov/27444729/,Short-term memory deficits correlate with hippocampal-thalamic functional connectivity alterations following acute sleep restriction.,"Chengyang L, Daqing H, Jianlin Q, Haisheng C, Qingqing M, Jin W, Jiajia L, Enmao Y, Yongcong S, Xi Z",Brain imaging and behavior,0.263,27444729,10.1007/s11682-016-9570-1,-1
sleep_00093,https://pubmed.ncbi.nlm.nih.gov/24768931/,Neural dynamics necessary and sufficient for transition into pre-sleep induced by EEG NeuroFeedback.,"Kinreich S, Podlipsky I, Jamshy S, Intrator N, Hendler T",NeuroImage,0.261,24768931,-1,-1
sleep_00094,https://pubmed.ncbi.nlm.nih.gov/20666600/,Neural precursors of delayed insight.,"Darsaud A, Wagner U, Balteau E, Desseilles M, Sterpenich V, Vandewalle G, Albouy G, Dang-Vu T, Collette F, Boly M, Schabus M, Degueldre C, Luxen A, Maquet P",Journal of cognitive neuroscience,0.256,20666600,-1,-1
sleep_00095,https://pubmed.ncbi.nlm.nih.gov/25687596/,fMRI identifies chronotype-specific brain activation associated with attention to motion--why we need to know when subjects go to bed.,"Reske M, Rosenberg J, Plapp S, Kellermann T, Shah NJ",NeuroImage,0.253,25687596,-1,-1
sleep_00096,https://pubmed.ncbi.nlm.nih.gov/26358975/,Comparison of obese adults with poor versus good sleep quality during a functional neuroimaging delay discounting task: A pilot study.,"Martin LE, Pollack L, McCune A, Schulte E, Savage CR, Lundgren JD",Psychiatry research,0.253,26358975,-1,-1
sleep_00097,https://pubmed.ncbi.nlm.nih.gov/16626972/,Increased brain activation during verbal learning in obstructive sleep apnea.,"Ayalon L, Ancoli-Israel S, Klemfuss Z, Shalauta MD, Drummond SP",NeuroImage,0.244,16626972,-1,-1
sleep_00098,https://pubmed.ncbi.nlm.nih.gov/27975159/,Neural correlates of increased risk-taking propensity in sleep-deprived people along with a changing risk level.,"Lei Y, Wang L, Chen P, Li Y, Han W, Ge M, Yang L, Chen S, Hu W, Wu X, Yang Z",Brain imaging and behavior,0.237,27975159,-1,-1
sleep_00099,https://pubmed.ncbi.nlm.nih.gov/18620906/,Neural generators of brain potentials before rapid eye movements during human REM sleep: a study using sLORETA.,"Abe T, Ogawa K, Nittono H, Hori T",Clinical neurophysiology : official journal of the International Federation of Clinical Neurophysiology,0.236,18620906,-1,-1
sleep_00100,https://pubmed.ncbi.nlm.nih.gov/17904385/,fMRI during natural sleep as a method to study brain function during early childhood.,"Redcay E, Kennedy DP, Courchesne E",NeuroImage,0.232,17904385,-1,-1
sleep_00101,https://pubmed.ncbi.nlm.nih.gov/29467636/,Increased Posterior Insula-Sensorimotor Connectivity Is Associated with Cognitive Function in Healthy Participants with Sleep Complaints.,"Liu CH, Liu CZ, Zhu XQ, Fang JL, Lu SL, Tang LR, Wang CY, Liu QQ",Frontiers in human neuroscience,0.228,29467636,-1,-1
sleep_00102,https://pubmed.ncbi.nlm.nih.gov/24144507/,An altered neural response to reward may contribute to alcohol problems among late adolescents with an evening chronotype.,"Hasler BP, Sitnick SL, Shaw DS, Forbes EE",Psychiatry research,0.225,24144507,-1,-1
sleep_00103,https://pubmed.ncbi.nlm.nih.gov/26106555/,Altered resting brain connectivity in persistent cancer related fatigue.,"Hampson JP, Zick SM, Khabir T, Wright BD, Harris RE",NeuroImage. Clinical,0.219,26106555,-1,-1
sleep_00104,https://pubmed.ncbi.nlm.nih.gov/20171288/,Lapsing when sleep deprived: neural activation characteristics of resistant and vulnerable individuals.,"Chee MW, Tan JC",NeuroImage,0.214,20171288,-1,-1
sleep_00105,https://pubmed.ncbi.nlm.nih.gov/27425430/,Reduced spontaneous neuronal activity in the insular cortex and thalamus in healthy adults with insomnia symptoms.,"Liu CH, Liu CZ, Zhang J, Yuan Z, Tang LR, Tie CL, Fan J, Liu QQ",Brain research,0.193,27425430,-1,-1
sleep_00106,https://pubmed.ncbi.nlm.nih.gov/25608023/,"Neurophysiological effects of sleep deprivation in healthy adults, a pilot study.","Klumpers UM, Veltman DJ, van Tol MJ, Kloet RW, Boellaard R, Lammertsma AA, Hoogendijk WJ",PloS one,0.191,25608023,-1,-1
sleep_00107,https://pubmed.ncbi.nlm.nih.gov/22593062/,Sleep deprivation is associated with attenuated parametric valuation and control  signals in the midbrain during value-based decision making.,"Menz MM, Buchel C, Peters J",The Journal of neuroscience : the official journal of the Society for Neuroscience,0.187,22593062,-1,-1
sleep_00108,https://pubmed.ncbi.nlm.nih.gov/18761038/,An open-source hardware and software system for acquisition and real-time processing of electrophysiology during high field MRI.,"Purdon PL, Millan H, Fuller PL, Bonmassar G",Journal of neuroscience methods,0.185,18761038,-1,-1
sleep_00109,https://pubmed.ncbi.nlm.nih.gov/26082888/,Reversal of functional changes in the brain associated with obstructive sleep apnoea following 6 months of CPAP.,"Fatouleh RH, Lundblad LC, Macey PM, McKenzie DK, Henderson LA, Macefield VG",NeuroImage. Clinical,0.181,26082888,-1,-1
sleep_00110,https://pubmed.ncbi.nlm.nih.gov/25463450/,Microstructure of frontoparietal connections predicts individual resistance to sleep deprivation.,"Cui J, Tkachenko O, Gogel H, Kipman M, Preer LA, Weber M, Divatia SC, Demers LA, Olson EA, Buchholz JL, Bark JS, Rosso IM, Rauch SL, Killgore WD",NeuroImage,0.165,25463450,-1,-1
sleep_00111,https://pubmed.ncbi.nlm.nih.gov/23028775/,Argument structure and morphological factors in noun and verb processing: an fMRI study.,"Garbin G, Collina S, Tabossi P",PloS one,0.146,23028775,10.1371/journal.pone.0045091,-1
sleep_00112,https://pubmed.ncbi.nlm.nih.gov/29378319/,Alter spontaneous activity in amygdala and vmPFC during fear consolidation following 24h sleep deprivation.,"Feng P, Becker B, Feng T, Zheng Y",NeuroImage,0.144,29378319,10.1016/j.neuroimage.2018.01.057,-1
sleep_00113,https://pubmed.ncbi.nlm.nih.gov/19549821/,Decoupling of the brain's default mode network during deep sleep.,"Horovitz SG, Braun AR, Carr WS, Picchioni D, Balkin TJ, Fukunaga M, Duyn JH",Proceedings of the National Academy of Sciences of the United States of America,0.141,19549821,10.1073/pnas.0901435106,-1
sleep_00114,https://pubmed.ncbi.nlm.nih.gov/19110062/,EEG-vigilance and BOLD effect during simultaneous EEG/fMRI measurement.,"Olbrich S, Mulert C, Karch S, Trenner M, Leicht G, Pogarell O, Hegerl U",NeuroImage,0.137,19110062,10.1016/j.neuroimage.2008.11.014,-1
sleep_00115,https://pubmed.ncbi.nlm.nih.gov/29509806/,Obstructive sleep apnea and cortical thickness in females and males.,"Macey PM, Haris N, Kumar R, Thomas MA, Woo MA, Harper RM",PloS one,0.137,29509806,-1,-1
sleep_00116,https://pubmed.ncbi.nlm.nih.gov/29748772/,Decreased cortical and subcortical response to inhibition control after sleep deprivation.,"Zhao R, Zhang X, Fei N, Zhu Y, Sun J, Liu P, Yang X, Qin W",Brain imaging and behavior,0.135,29748772,-1,-1
sleep_00117,https://pubmed.ncbi.nlm.nih.gov/28066207/,Diurnal Variations in Neural Activity of Healthy Human Brain Decoded with Resting-State Blood Oxygen Level Dependent fMRI.,"Jiang C, Yi L, Su S, Shi C, Long X, Xie G, Zhang L",Frontiers in human neuroscience,0.127,28066207,-1,-1
sleep_00118,https://pubmed.ncbi.nlm.nih.gov/26244275/,Striatal-cerebellar networks mediate consolidation in a motor sequence learning task: An fMRI study using dynamic causal modelling.,"Tzvi E, Stoldt A, Witt K, Kramer UM",NeuroImage,0.125,26244275,-1,-1
sleep_00119,https://pubmed.ncbi.nlm.nih.gov/18493621/,Anomalous hypothalamic responses to humor in cataplexy.,"Reiss AL, Hoeft F, Tenforde AS, Chen W, Mobbs D, Mignot EJ",PloS one,0.123,18493621,-1,-1
sleep_00120,https://pubmed.ncbi.nlm.nih.gov/24381554/,"Trauma, dream, and psychic change in psychoanalyses: a dialog between psychoanalysis and the neurosciences.","Fischmann T, Russ MO, Leuzinger-Bohleber M",Frontiers in human neuroscience,0.114,24381554,-1,-1
sleep_00121,https://pubmed.ncbi.nlm.nih.gov/18972392/,fMRI evidence for multisensory recruitment associated with rapid eye movements during sleep.,"Hong CC, Harris JC, Pearlson GD, Kim JS, Calhoun VD, Fallon JH, Golay X, Gillen JS, Simmonds DJ, van Zijl PC, Zee DS, Pekar JJ",Human brain mapping,0.113,18972392,-1,-1
sleep_00122,https://pubmed.ncbi.nlm.nih.gov/27013952/,Effects of 12 Months Continuous Positive Airway Pressure on Sympathetic Activity  Related Brainstem Function and Structure in Obstructive Sleep Apnea.,"Henderson LA, Fatouleh RH, Lundblad LC, McKenzie DK, Macefield VG",Frontiers in neuroscience,0.113,27013952,-1,-1
sleep_00123,https://pubmed.ncbi.nlm.nih.gov/15006669/,Anatomical and functional brain imaging evidence of lenticulo-insular anomalies in Smith Magenis syndrome.,"Boddaert N, De Leersnyder H, Bourgeois M, Munnich A, Brunelle F, Zilbovicius M",NeuroImage,0.112,15006669,-1,-1
sleep_00124,https://pubmed.ncbi.nlm.nih.gov/21151992/,Changes in resting neural connectivity during propofol sedation.,"Stamatakis EA, Adapa RM, Absalom AR, Menon DK",PloS one,0.112,21151992,-1,-1
sleep_00125,https://pubmed.ncbi.nlm.nih.gov/25366378/,Close-range blast exposure is associated with altered functional connectivity in  Veterans independent of concussion symptoms at time of exposure.,"Robinson ME, Lindemer ER, Fonda JR, Milberg WP, McGlinchey RE, Salat DH",Human brain mapping,0.111,25366378,-1,-1
sleep_00126,https://pubmed.ncbi.nlm.nih.gov/22028686/,Sleep deprivation alters valuation signals in the ventromedial prefrontal cortex.,"Libedinsky C, Smith DV, Teng CS, Namburi P, Chen VW, Huettel SA, Chee MW",Frontiers in behavioral neuroscience,0.105,22028686,-1,-1
sleep_00127,https://pubmed.ncbi.nlm.nih.gov/27536225/,Altered Brain Microstate Dynamics in Adolescents with Narcolepsy.,"Drissi NM, Szakacs A, Witt ST, Wretman A, Ulander M, Stahlbrandt H, Darin N, Hallbook T, Landtblom AM, Engstrom M",Frontiers in human neuroscience,0.105,27536225,-1,-1
sleep_00128,https://pubmed.ncbi.nlm.nih.gov/15525806/,Hypercapnic exposure in congenital central hypoventilation syndrome reveals CNS respiratory control mechanisms.,"Harper RM, Macey PM, Woo MA, Macey KE, Keens TG, Gozal D, Alger JR",Journal of neurophysiology,0.102,15525806,-1,-1
sleep_00129,https://pubmed.ncbi.nlm.nih.gov/9787003/,A specific role for the thalamus in mediating the interaction of attention and arousal in humans.,"Portas CM, Rees G, Howseman AM, Josephs O, Turner R, Frith CD",The Journal of neuroscience : the official journal of the Society for Neuroscience,0.101,9787003,-1,-1
sleep_00130,https://pubmed.ncbi.nlm.nih.gov/28856094/,Alterations in striato-thalamo-pallidal intrinsic functional connectivity as a prodrome of Parkinson's disease.,"Dayan E, Browner N",NeuroImage. Clinical,0.101,28856094,-1,-1
sleep_00131,https://pubmed.ncbi.nlm.nih.gov/15784437/,Dissociation of cortical regions modulated by both working memory load and sleep  deprivation and by sleep deprivation alone.,"Choo WC, Lee WW, Venkatraman V, Sheu FS, Chee MW",NeuroImage,0.095,15784437,-1,-1
sleep_00132,https://pubmed.ncbi.nlm.nih.gov/18201907/,Metabolic evidence for remote inhibition in epilepsies with continuous spike-waves during sleep.,"De Tiege X, Ligot N, Goldman S, Poznanski N, de Saint Martin A, Van Bogaert P",NeuroImage,0.095,18201907,-1,-1
sleep_00133,https://pubmed.ncbi.nlm.nih.gov/25372882/,Altered resting-state amygdala functional connectivity after 36 hours of total sleep deprivation.,"Shao Y, Lei Y, Wang L, Zhai T, Jin X, Ni W, Yang Y, Tan S, Wen B, Ye E, Yang Z",PloS one,0.095,25372882,-1,-1
sleep_00134,https://pubmed.ncbi.nlm.nih.gov/24358198/,Apnea-induced cortical BOLD-fMRI and peripheral sympathoneural firing response patterns of awake healthy humans.,"Kimmerly DS, Morris BL, Floras JS",PloS one,0.093,24358198,-1,-1
sleep_00135,https://pubmed.ncbi.nlm.nih.gov/20502992/,Default network response to a working memory challenge after withdrawal of continuous positive airway pressure treatment for obstructive sleep apnea.,"Sweet LH, Jerskey BA, Aloia MS",Brain imaging and behavior,0.089,20502992,-1,-1
sleep_00136,https://pubmed.ncbi.nlm.nih.gov/15140927/,Functional imaging of working memory after 24 hr of total sleep deprivation.,"Chee MW, Choo WC",The Journal of neuroscience : the official journal of the Society for Neuroscience,0.084,15140927,-1,-1
sleep_00137,https://pubmed.ncbi.nlm.nih.gov/25268234/,The cerebral cost of breathing: an FMRI case-study in congenital central hypoventilation syndrome.,"Sharman M, Gallea C, Lehongre K, Galanaud D, Nicolas N, Similowski T, Cohen L, Straus C, Naccache L",PloS one,0.084,25268234,-1,-1
sleep_00138,https://pubmed.ncbi.nlm.nih.gov/27723821/,Abnormal Intrinsic Functional Hubs in Severe Male Obstructive Sleep Apnea: Evidence from a Voxel-Wise Degree Centrality Analysis.,"Li H, Li L, Shao Y, Gong H, Zhang W, Zeng X, Ye C, Nie S, Chen L, Peng D",PloS one,0.083,27723821,-1,-1
sleep_00139,https://pubmed.ncbi.nlm.nih.gov/17239623/,"The NIH MRI study of normal brain development (Objective-2): newborns, infants, toddlers, and preschoolers.","Almli CR, Rivkin MJ, McKinstry RC",NeuroImage,0.082,17239623,-1,-1
sleep_00140,https://pubmed.ncbi.nlm.nih.gov/18672231/,Deviant functional magnetic resonance imaging patterns of brain activity to speech in 2-3-year-old children with autism spectrum disorder.,"Redcay E, Courchesne E",Biological psychiatry,0.082,18672231,-1,-1
sleep_00141,https://pubmed.ncbi.nlm.nih.gov/25379440/,Functional and structural changes in the brain associated with the increase in muscle sympathetic nerve activity in obstructive sleep apnoea.,"Fatouleh RH, Hammam E, Lundblad LC, Macey PM, McKenzie DK, Henderson LA, Macefield VG",NeuroImage. Clinical,0.082,25379440,-1,-1
sleep_00142,https://pubmed.ncbi.nlm.nih.gov/28649490/,Frequency-dependent changes in local intrinsic oscillations in chronic primary insomnia: A study of the amplitude of low-frequency fluctuations in the resting state.,"Zhou F, Huang S, Zhuang Y, Gao L, Gong H",NeuroImage. Clinical,0.082,28649490,-1,-1
sleep_00143,https://pubmed.ncbi.nlm.nih.gov/22101493/,Influence of periodontal afferent inputs for human cerebral blood oxygenation during jaw movements.,"Iida T, Sakayanagi M, Svensson P, Komiyama O, Hirayama T, Kaneda T, Sakatani K, Kawara M",Experimental brain research,0.081,22101493,-1,-1
sleep_00144,https://pubmed.ncbi.nlm.nih.gov/26232266/,"Evidence for normal letter-sound integration, but altered language pathways in a  case of recovered Landau-Kleffner Syndrome.","Pullens P, Pullens W, Blau V, Sorger B, Jansma BM, Goebel R",Brain and cognition,0.079,26232266,-1,-1
sleep_00145,https://pubmed.ncbi.nlm.nih.gov/18483003/,Impairment of attentional networks after 1 night of sleep deprivation.,"Tomasi D, Wang RL, Telang F, Boronikolas V, Jayne MC, Wang GJ, Fowler JS, Volkow ND","Cerebral cortex (New York, N.Y. : 1991)",0.076,18483003,-1,-1
sleep_00146,https://pubmed.ncbi.nlm.nih.gov/22305924/,Dual-tasking alleviated sleep deprivation disruption in visuomotor tracking: an fMRI study.,"Gazes Y, Rakitin BC, Steffener J, Habeck C, Butterfield B, Basner RC, Ghez C, Stern Y",Brain and cognition,0.073,22305924,-1,-1
sleep_00147,https://pubmed.ncbi.nlm.nih.gov/23227139/,The effects of CPAP treatment on task positive and default mode networks in obstructive sleep apnea patients: an fMRI study.,"Prilipko O, Huynh N, Schwartz S, Tantrakul V, Kushida C, Paiva T, Guilleminault C",PloS one,0.073,23227139,-1,-1
sleep_00148,https://pubmed.ncbi.nlm.nih.gov/26615599/,The impact of fibromyalgia symptoms on brain morphometry.,"Diaz-Piedra C, Guzman MA, Buela-Casal G, Catena A",Brain imaging and behavior,0.073,26615599,-1,-1
sleep_00149,https://pubmed.ncbi.nlm.nih.gov/18819988/,Working memory performance is correlated with local brain morphology in the medial frontal and anterior cingulate cortex in fibromyalgia patients: structural correlates of pain-cognition interaction.,"Luerding R, Weigand T, Bogdahn U, Schmidt-Wilcke T",Brain : a journal of neurology,0.07,18819988,-1,-1
sleep_00150,https://pubmed.ncbi.nlm.nih.gov/25798918/,Frequency-dependent changes of local resting oscillations in sleep-deprived brain.,"Gao L, Bai L, Zhang Y, Dai XJ, Netra R, Min Y, Zhou F, Niu C, Dun W, Gong H, Zhang M",PloS one,0.069,25798918,-1,-1
sleep_00151,https://pubmed.ncbi.nlm.nih.gov/25553621/,Alteration of spontaneous neuronal activity within the salience network in partially remitted depression.,"Liu CH, Ma X, Song LP, Tang LR, Jing B, Zhang Y, Li F, Zhou Z, Fan J, Wang CY",Brain research,0.067,25553621,10.1016/j.brainres.2014.12.040,-1
sleep_00152,https://pubmed.ncbi.nlm.nih.gov/27721206/,The cortical thickness correlates of clinical manifestations in the mid-stage sporadic Parkinson's disease.,"Deng X, Tang CY, Zhang J, Zhu L, Xie ZC, Gong HH, Xiao XZ, Xu RS",Neuroscience letters,0.067,27721206,-1,-1
sleep_00153,https://pubmed.ncbi.nlm.nih.gov/26697846/,Thalamic abnormalities in children with continuous spike-wave during slow-wave sleep: An F-18-fluorodeoxyglucose positron emission tomography perspective.,"Agarwal R, Kumar A, Tiwari VN, Chugani H",Epilepsia,0.062,26697846,-1,-1
sleep_00154,https://pubmed.ncbi.nlm.nih.gov/22875902/,Dissociated mean and functional connectivity BOLD signals in visual cortex during eyes closed and fixation.,"McAvoy M, Larson-Prior L, Ludwikow M, Zhang D, Snyder AZ, Gusnard DL, Raichle ME, d'Avossa G",Journal of neurophysiology,0.056,22875902,-1,-1
