paper_name,paper_url,Title,Author,Journal,Loading,PMID,Doi,download_status
sleep_00001,https://pubmed.ncbi.nlm.nih.gov/16339798/,Brain activation and hypothalamic functional connectivity during human non-rapid  eye movement sleep: an EEG/fMRI study.,"Kaufmann C, Wehrle R, Wetter TC, Holsboer F, Auer DP, Pollmacher T, Czisch M",Brain : a journal of neurology,0.82,16339798,10.1093/brain/awh686,-1
sleep_00002,https://pubmed.ncbi.nlm.nih.gov/21753010/,Sleep spindles and hippocampal functional connectivity in human NREM sleep.,"Andrade KC, Spoormaker VI, Dresler M, Wehrle R, Holsboer F, Samann PG, Czisch M",The Journal of neuroscience : the official journal of the Society for Neuroscience,0.818,21753010,-1,-1
sleep_00003,https://pubmed.ncbi.nlm.nih.gov/25067818/,Local awakening: regional reorganizations of brain oscillations after sleep.,"Tsai PJ, Chen SC, Hsu CY, Wu CW, Wu YC, Hung CS, Yang AC, Liu PY, Biswal B, Lin CP",NeuroImage,0.81,25067818,-1,-1
sleep_00004,https://pubmed.ncbi.nlm.nih.gov/19553435/,"Functional magnetic resonance imaging-assessed brain responses during an executive task depend on interaction of sleep homeostasis, circadian phase, and PER3 genotype.","Vandewalle G, Archer SN, Wuillaume C, Balteau E, Degueldre C, Luxen A, Maquet P, Dijk DJ",The Journal of neuroscience : the official journal of the Society for Neuroscience,0.806,19553435,-1,-1
sleep_00005,https://pubmed.ncbi.nlm.nih.gov/29680789/,Neurophysiological differences in the adolescent brain following a single night of restricted sleep - A 7T fMRI study.,"Robinson JL, Erath SA, Kana RK, El-Sheikh M",Developmental cognitive neuroscience,0.774,29680789,-1,-1
sleep_00006,https://pubmed.ncbi.nlm.nih.gov/28526620/,Evidence for cortical structural plasticity in humans after a day of waking and sleep deprivation.,"Elvsashagen T, Zak N, Norbom LB, Pedersen PO, Quraishi SH, Bjornerud A, Alnaes D, Doan NT, Malt UF, Groote IR, Westlye LT",NeuroImage,0.771,28526620,-1,-1
sleep_00007,https://pubmed.ncbi.nlm.nih.gov/16339020/,Motor memory consolidation in sleep shapes more effective neuronal representations.,"Fischer S, Nitschke MF, Melchert UH, Erdmann C, Born J",The Journal of neuroscience : the official journal of the Society for Neuroscience,0.742,16339020,-1,-1
sleep_00008,https://pubmed.ncbi.nlm.nih.gov/15703253/,The functional anatomy of sleep-dependent visual skill learning.,"Walker MP, Stickgold R, Jolesz FA, Yoo SS","Cerebral cortex (New York, N.Y. : 1991)",0.741,15703253,-1,-1
sleep_00009,https://pubmed.ncbi.nlm.nih.gov/23501052/,The role of sleep and sleep deprivation in consolidating fear memories.,"Menz MM, Rihm JS, Salari N, Born J, Kalisch R, Pape HC, Marshall L, Buchel C",NeuroImage,0.741,23501052,-1,-1
sleep_00010,https://pubmed.ncbi.nlm.nih.gov/28777996/,Neural connectivity moderates the association between sleep and impulsivity in adolescents.,"Tashjian SM, Goldenberg D, Galvan A",Developmental cognitive neuroscience,0.726,28777996,-1,-1
sleep_00011,https://pubmed.ncbi.nlm.nih.gov/17328781/,Functional microstates within human REM sleep: first evidence from fMRI of a thalamocortical network specific for phasic REM periods.,"Wehrle R, Kaufmann C, Wetter TC, Holsboer F, Auer DP, Pollmacher T, Czisch M",The European journal of neuroscience,0.712,17328781,-1,-1
sleep_00012,https://pubmed.ncbi.nlm.nih.gov/20146605/,Does sleep promote false memories?,"Darsaud A, Dehon H, Lahl O, Sterpenich V, Boly M, Dang-Vu T, Desseilles M, Gais S, Matarazzo L, Peters F, Schabus M, Schmidt C, Tinguely G, Vandewalle G, Luxen A, Maquet P, Collette F",Journal of cognitive neuroscience,0.711,20146605,-1,-1
sleep_00013,https://pubmed.ncbi.nlm.nih.gov/21621549/,The impact of overnight consolidation upon memory for emotional and neutral encoding contexts.,"Lewis PA, Cairney S, Manning L, Critchley HD",Neuropsychologia,0.705,21621549,-1,-1
sleep_00014,https://pubmed.ncbi.nlm.nih.gov/26019123/,Co-activated yet disconnected-Neural correlates of eye closures when trying to stay awake.,"Ong JL, Kong D, Chia TT, Tandi J, Thomas Yeo BT, Chee MW",NeuroImage,0.704,26019123,-1,-1
sleep_00015,https://pubmed.ncbi.nlm.nih.gov/29061703/,Baseline Levels of Rapid Eye Movement Sleep May Protect Against Excessive Activity in Fear-Related Neural Circuitry.,"Lerner I, Lupkin SM, Sinha N, Tsai A, Gluck MA",The Journal of neuroscience : the official journal of the Society for Neuroscience,0.698,29061703,-1,-1
sleep_00016,https://pubmed.ncbi.nlm.nih.gov/11960899/,Human regional cerebral glucose metabolism during non-rapid eye movement sleep in relation to waking.,"Nofzinger EA, Buysse DJ, Miewald JM, Meltzer CC, Price JC, Sembrat RC, Ombao H, Reynolds CF, Monk TH, Hall M, Kupfer DJ, Moore RY",Brain : a journal of neurology,0.69,11960899,-1,-1
sleep_00017,https://pubmed.ncbi.nlm.nih.gov/21945697/,To wake or not to wake? The two-sided nature of the human K-complex.,"Jahnke K, von Wegner F, Morzelewski A, Borisov S, Maischein M, Steinmetz H, Laufs H",NeuroImage,0.686,21945697,-1,-1
sleep_00018,https://pubmed.ncbi.nlm.nih.gov/19702469/,The unrested resting brain: sleep deprivation alters activity within the default-mode network.,"Gujar N, Yoo SS, Hu P, Walker MP",Journal of cognitive neuroscience,0.685,19702469,-1,-1
sleep_00019,https://pubmed.ncbi.nlm.nih.gov/23770411/,Structural brain correlates of human sleep oscillations.,"Saletin JM, van der Helm E, Walker MP",NeuroImage,0.672,23770411,-1,-1
sleep_00020,https://pubmed.ncbi.nlm.nih.gov/27957670/,Residual effects of emotion are reflected in enhanced visual activity after sleep.,"Bennion KA, Payne JD, Kensinger EA","Cognitive, affective & behavioral neuroscience",0.672,27957670,-1,-1
sleep_00021,https://pubmed.ncbi.nlm.nih.gov/26724779/,Progression to deep sleep is characterized by changes to BOLD dynamics in sensory cortices.,"Davis B, Tagliazucchi E, Jovicich J, Laufs H, Hasson U",NeuroImage,0.671,26724779,10.1016/j.neuroimage.2015.12.034,-1
sleep_00022,https://pubmed.ncbi.nlm.nih.gov/23761912/,Concurrent synaptic and systems memory consolidation during sleep.,"Mascetti L, Foret A, Schrouff J, Muto V, Dideberg V, Balteau E, Degueldre C, Phillips C, Luxen A, Collette F, Bours V, Maquet P",The Journal of neuroscience : the official journal of the Society for Neuroscience,0.664,23761912,-1,-1
sleep_00023,https://pubmed.ncbi.nlm.nih.gov/27310812/,Diminished Auditory Responses during NREM Sleep Correlate with the Hierarchy of Language Processing.,"Wilf M, Ramot M, Furman-Haran E, Arzi A, Levkovitz Y, Malach R",PloS one,0.655,27310812,-1,-1
sleep_00024,https://pubmed.ncbi.nlm.nih.gov/22719723/,Enhanced emotional reactivity after selective REM sleep deprivation in humans: an fMRI study.,"Rosales-Lagarde A, Armony JL, Del Rio-Portilla Y, Trejo-Martinez D, Conde R, Corsi-Cabrera M",Frontiers in behavioral neuroscience,0.65,22719723,-1,-1
sleep_00025,https://pubmed.ncbi.nlm.nih.gov/19386910/,Sleep promotes the neural reorganization of remote emotional memory.,"Sterpenich V, Albouy G, Darsaud A, Schmidt C, Vandewalle G, Dang Vu TT, Desseilles M, Phillips C, Degueldre C, Balteau E, Collette F, Luxen A, Maquet P",The Journal of neuroscience : the official journal of the Society for Neuroscience,0.644,19386910,-1,-1
sleep_00026,https://pubmed.ncbi.nlm.nih.gov/29486001/,Comparison of NREM sleep and intravenous sedation through local information processing and whole brain network to explore the mechanism of general anesthesia.,"Li Y, Wang S, Pan C, Xue F, Xian J, Huang Y, Wang X, Li T, He H",PloS one,0.619,29486001,-1,-1
sleep_00027,https://pubmed.ncbi.nlm.nih.gov/21271311/,The effect of sleep deprivation on BOLD activity elicited by a divided attention  task.,"Jackson ML, Hughes ME, Croft RJ, Howard ME, Crewther D, Kennedy GA, Owens K, Pierce RJ, O'Donoghue FJ, Johnston P",Brain imaging and behavior,0.613,21271311,-1,-1
sleep_00028,https://pubmed.ncbi.nlm.nih.gov/24795594/,The effects of a single night of sleep deprivation on fluency and prefrontal cortex function during divergent thinking.,"Vartanian O, Bouak F, Caldwell JL, Cheung B, Cupchik G, Jobidon ME, Lam Q, Nakashima A, Paul M, Peng H, Silvia PJ, Smith I",Frontiers in human neuroscience,0.611,24795594,-1,-1
sleep_00029,https://pubmed.ncbi.nlm.nih.gov/24302373/,fMRI and sleep correlates of the age-related impairment in motor memory consolidation.,"Fogel SM, Albouy G, Vien C, Popovicci R, King BR, Hoge R, Jbabdi S, Benali H, Karni A, Maquet P, Carrier J, Doyon J",Human brain mapping,0.599,24302373,-1,-1
sleep_00030,https://pubmed.ncbi.nlm.nih.gov/18495886/,Lapsing during sleep deprivation is associated with distributed changes in brain  activation.,"Chee MW, Tan JC, Zheng H, Parimal S, Weissman DH, Zagorodnov V, Dinges DF",The Journal of neuroscience : the official journal of the Society for Neuroscience,0.592,18495886,-1,-1
sleep_00031,https://pubmed.ncbi.nlm.nih.gov/16822972/,The neural basis of interindividual variability in inhibitory efficiency after sleep deprivation.,"Chuah YM, Venkatraman V, Dinges DF, Chee MW",The Journal of neuroscience : the official journal of the Society for Neuroscience,0.58,16822972,10.1523/JNEUROSCI.0906-06.2006,-1
sleep_00032,https://pubmed.ncbi.nlm.nih.gov/21310653/,Functional imaging of sleep vertex sharp transients.,"Stern JM, Caporro M, Haneef Z, Yeh HJ, Buttinelli C, Lenartowicz A, Mumford JA, Parvizi J, Poldrack RA",Clinical neurophysiology : official journal of the International Federation of Clinical Neurophysiology,0.58,21310653,10.1016/j.clinph.2010.12.049,-1
sleep_00033,https://pubmed.ncbi.nlm.nih.gov/26918589/,A Genetic Polymorphism of the Human Dopamine Transporter Determines the Impact of Sleep Deprivation on Brain Responses to Rewards and Punishments.,"Greer SM, Goldstein AN, Knutson B, Walker MP",Journal of cognitive neuroscience,0.58,26918589,-1,-1
sleep_00034,https://pubmed.ncbi.nlm.nih.gov/20521852/,Sleep leads to changes in the emotional memory trace: evidence from FMRI.,"Payne JD, Kensinger EA",Journal of cognitive neuroscience,0.568,20521852,-1,-1
sleep_00035,https://pubmed.ncbi.nlm.nih.gov/22879350/,Overnight consolidation aids the transfer of statistical knowledge from the medial temporal lobe to the striatum.,"Durrant SJ, Cairney SA, Lewis PA","Cerebral cortex (New York, N.Y. : 1991)",0.568,22879350,-1,-1
sleep_00036,https://pubmed.ncbi.nlm.nih.gov/18698363/,Sleep modulates the neural substrates of both spatial and contextual memory consolidation.,"Rauchs G, Orban P, Schmidt C, Albouy G, Balteau E, Degueldre C, Schnackers C, Sterpenich V, Tinguely G, Luxen A, Maquet P, Peigneux P",PloS one,0.561,18698363,-1,-1
sleep_00037,https://pubmed.ncbi.nlm.nih.gov/25173415/,Resting state connectivity immediately following learning correlates with subsequent sleep-dependent enhancement of motor task performance.,"Gregory MD, Agam Y, Selvadurai C, Nagy A, Vangel M, Tucker M, Robertson EM, Stickgold R, Manoach DS",NeuroImage,0.554,25173415,-1,-1
sleep_00038,https://pubmed.ncbi.nlm.nih.gov/22037418/,Sleep spindle-related reactivation of category-specific cortical regions after learning face-scene associations.,"Bergmann TO, Molle M, Diedrichs J, Born J, Siebner HR",NeuroImage,0.545,22037418,-1,-1
sleep_00039,https://pubmed.ncbi.nlm.nih.gov/16427321/,Functional imaging of working memory following normal sleep and after 24 and 35 h of sleep deprivation: Correlations of fronto-parietal activation with performance.,"Chee MW, Chuah LY, Venkatraman V, Chan WY, Philip P, Dinges DF",NeuroImage,0.542,16427321,-1,-1
sleep_00040,https://pubmed.ncbi.nlm.nih.gov/28712063/,Resisting Sleep Pressure: Impact on Resting State Functional Network Connectivity.,"Tushaus L, Balsters JH, Schlapfer A, Brandeis D, O'Gorman Tuura R, Achermann P",Brain topography,0.539,28712063,-1,-1
sleep_00041,https://pubmed.ncbi.nlm.nih.gov/23806174/,Sleep-dependent neurophysiological processes in implicit sequence learning.,"Urbain C, Schmitz R, Schmidt C, Cleeremans A, Van Bogaert P, Maquet P, Peigneux P",Journal of cognitive neuroscience,0.537,23806174,-1,-1
sleep_00042,https://pubmed.ncbi.nlm.nih.gov/20164352/,EEG measures index neural and cognitive recovery from sleep deprivation.,"Mander BA, Reid KJ, Baron KG, Tjoa T, Parrish TB, Paller KA, Gitelman DR, Zee PC",The Journal of neuroscience : the official journal of the Society for Neuroscience,0.529,20164352,-1,-1
sleep_00043,https://pubmed.ncbi.nlm.nih.gov/23804084/,Tired and apprehensive: anxiety amplifies the impact of sleep loss on aversive brain anticipation.,"Goldstein AN, Greer SM, Saletin JM, Harvey AG, Nitschke JB, Walker MP",The Journal of neuroscience : the official journal of the Society for Neuroscience,0.528,23804084,-1,-1
sleep_00044,https://pubmed.ncbi.nlm.nih.gov/23558102/,Distinct neural correlates of time-on-task and transient errors during a visuomotor tracking task after sleep restriction.,"Poudel GR, Innes CR, Jones RD",NeuroImage,0.523,23558102,-1,-1
sleep_00045,https://pubmed.ncbi.nlm.nih.gov/19707599/,Acoustic oddball during NREM sleep: a combined EEG/fMRI study.,"Czisch M, Wehrle R, Stiegler A, Peters H, Andrade K, Holsboer F, Samann PG",PloS one,0.517,19707599,-1,-1
sleep_00046,https://pubmed.ncbi.nlm.nih.gov/11163282/,Auditory processing across the sleep-wake cycle: simultaneous EEG and fMRI monitoring in humans.,"Portas CM, Krakow K, Allen P, Josephs O, Armony JL, Frith CD",Neuron,0.515,11163282,-1,-1
sleep_00047,https://pubmed.ncbi.nlm.nih.gov/26205911/,Hippocampal activity mediates the relationship between circadian activity rhythms and memory in older adults.,"Sherman SM, Mumford JA, Schnyer DM",Neuropsychologia,0.509,26205911,-1,-1
sleep_00048,https://pubmed.ncbi.nlm.nih.gov/28939415/,Qualitative differences in offline improvement of procedural memory by daytime napping and overnight sleep: An fMRI study.,"Sugawara SK, Koike T, Kawamichi H, Makita K, Hamano YH, Takahashi HK, Nakagawa E, Sadato N",Neuroscience research,0.506,28939415,-1,-1
sleep_00049,https://pubmed.ncbi.nlm.nih.gov/18514543/,Intrinsic correlations of electroencephalography rhythms with cerebral hemodynamics during sleep transitions.,"Uchida-Ota M, Tanaka N, Sato H, Maki A",NeuroImage,0.5,18514543,-1,-1
sleep_00050,https://pubmed.ncbi.nlm.nih.gov/17598166/,Low frequency BOLD fluctuations during resting wakefulness and light sleep: a simultaneous EEG-fMRI study.,"Horovitz SG, Fukunaga M, de Zwart JA, van Gelderen P, Fulton SC, Balkin TJ, Duyn JH",Human brain mapping,0.499,17598166,-1,-1
sleep_00051,https://pubmed.ncbi.nlm.nih.gov/21430147/,"Sleep deprivation amplifies reactivity of brain reward networks, biasing the appraisal of positive emotional experiences.","Gujar N, Yoo SS, Hu P, Walker MP",The Journal of neuroscience : the official journal of the Society for Neuroscience,0.499,21430147,10.1523/JNEUROSCI.3220-10.2011,-1
sleep_00052,https://pubmed.ncbi.nlm.nih.gov/26821063/,Decreased sleep duration is associated with increased fMRI responses to emotional faces in children.,"Reidy BL, Hamann S, Inman C, Johnson KC, Brennan PA",Neuropsychologia,0.496,26821063,10.1016/j.neuropsychologia.2016.01.028,-1
sleep_00053,https://pubmed.ncbi.nlm.nih.gov/21775199/,Functional MRI of sleep spindles and K-complexes.,"Caporro M, Haneef Z, Yeh HJ, Lenartowicz A, Buttinelli C, Parvizi J, Stern JM",Clinical neurophysiology : official journal of the International Federation of Clinical Neurophysiology,0.492,21775199,-1,-1
sleep_00054,https://pubmed.ncbi.nlm.nih.gov/24072888/,Sleep and Cortisol Interact to Support Memory Consolidation.,"Bennion KA, Mickley Steinmetz KR, Kensinger EA, Payne JD","Cerebral cortex (New York, N.Y. : 1991)",0.488,24072888,-1,-1
sleep_00055,https://pubmed.ncbi.nlm.nih.gov/21826762/,Effects of rapid eye movement sleep deprivation on fear extinction recall and prediction error signaling.,"Spoormaker VI, Schroter MS, Andrade KC, Dresler M, Kiem SA, Goya-Maldonado R, Wetter TC, Holsboer F, Samann PG, Czisch M",Human brain mapping,0.487,21826762,-1,-1
sleep_00056,https://pubmed.ncbi.nlm.nih.gov/27815989/,Sleep spindles: a physiological marker of age-related changes in gray matter in brain regions supporting motor skill memory consolidation.,"Fogel S, Vien C, Karni A, Benali H, Carrier J, Doyon J",Neurobiology of aging,0.481,27815989,-1,-1
sleep_00057,https://pubmed.ncbi.nlm.nih.gov/28422976/,Reactivation or transformation? Motor memory consolidation associated with cerebral activation time-locked to sleep spindles.,"Fogel S, Albouy G, King BR, Lungu O, Vien C, Bore A, Pinsard B, Benali H, Carrier J, Doyon J",PloS one,0.478,28422976,-1,-1
sleep_00058,https://pubmed.ncbi.nlm.nih.gov/23747456/,Time-on-task and sleep deprivation effects are evidenced in overlapping brain areas.,"Asplund CL, Chee MW",NeuroImage,0.475,23747456,-1,-1
sleep_00059,https://pubmed.ncbi.nlm.nih.gov/19255447/,Cortical network functional connectivity in the descent to sleep.,"Larson-Prior LJ, Zempel JM, Nolan TS, Prior FW, Snyder AZ, Raichle ME",Proceedings of the National Academy of Sciences of the United States of America,0.474,19255447,-1,-1
sleep_00060,https://pubmed.ncbi.nlm.nih.gov/20876115/,Brain plasticity related to the consolidation of motor sequence learning and motor adaptation.,"Debas K, Carrier J, Orban P, Barakat M, Lungu O, Vandewalle G, Hadj Tahar A, Bellec P, Karni A, Ungerleider LG, Benali H, Doyon J",Proceedings of the National Academy of Sciences of the United States of America,0.474,20876115,-1,-1
sleep_00061,https://pubmed.ncbi.nlm.nih.gov/15054065/,Identification and differential vulnerability of a neural network in sleep deprivation.,"Bell-McGinty S, Habeck C, Hilton HJ, Rakitin B, Scarmeas N, Zarahn E, Flynn J, DeLaPaz R, Basner R, Stern Y","Cerebral cortex (New York, N.Y. : 1991)",0.473,15054065,-1,-1
sleep_00062,https://pubmed.ncbi.nlm.nih.gov/24844748/,Off-line consolidation of motor sequence learning results in greater integration  within a cortico-striatal functional network.,"Debas K, Carrier J, Barakat M, Marrelec G, Bellec P, Abdallah HT, Karni A, Ungerleider LG, Benali H, Doyon J",NeuroImage,0.471,24844748,-1,-1
sleep_00063,https://pubmed.ncbi.nlm.nih.gov/22674673/,Sleep spindles predict neural and behavioral changes in motor sequence consolidation.,"Barakat M, Carrier J, Debas K, Lungu O, Fogel S, Vandewalle G, Hoge RD, Bellec P, Karni A, Ungerleider LG, Benali H, Doyon J",Human brain mapping,0.46,22674673,-1,-1
sleep_00064,https://pubmed.ncbi.nlm.nih.gov/24452776/,Ventromedial prefrontal cortex activity and rapid eye movement sleep are associated with subsequent fear expression in human subjects.,"Spoormaker VI, Gvozdanovic GA, Samann PG, Czisch M",Experimental brain research,0.455,24452776,-1,-1
sleep_00065,https://pubmed.ncbi.nlm.nih.gov/23376698/,The effects of poor quality sleep on brain function and risk taking in adolescence.,"Telzer EH, Fuligni AJ, Lieberman MD, Galvan A",NeuroImage,0.449,23376698,-1,-1
sleep_00066,https://pubmed.ncbi.nlm.nih.gov/29555427/,Temporal evolution of neural activity and connectivity during microsleeps when rested and following sleep restriction.,"Poudel GR, Innes CRH, Jones RD",NeuroImage,0.446,29555427,-1,-1
sleep_00067,https://pubmed.ncbi.nlm.nih.gov/22743197/,Automatic sleep staging using fMRI functional connectivity data.,"Tagliazucchi E, von Wegner F, Morzelewski A, Borisov S, Jahnke K, Laufs H",NeuroImage,0.435,22743197,-1,-1
sleep_00068,https://pubmed.ncbi.nlm.nih.gov/22960270/,Weekend-weekday advances in sleep timing are associated with altered reward-related brain function in healthy adolescents.,"Hasler BP, Dahl RE, Holm SM, Jakubcak JL, Ryan ND, Silk JS, Phillips ML, Forbes EE",Biological psychology,0.435,22960270,-1,-1
sleep_00069,https://pubmed.ncbi.nlm.nih.gov/21330468/,Development of the brain's default mode network from wakefulness to slow wave sleep.,"Samann PG, Wehrle R, Hoehn D, Spoormaker VI, Peters H, Tully C, Holsboer F, Czisch M","Cerebral cortex (New York, N.Y. : 1991)",0.43,21330468,-1,-1
sleep_00070,https://pubmed.ncbi.nlm.nih.gov/27442458/,"Preliminary investigation of the relationships between sleep duration, reward circuitry function, and mood dysregulation in youth offspring of parents with bipolar disorder.","Soehner AM, Bertocci MA, Manelis A, Bebko G, Ladouceur CD, Graur S, Monk K, Bonar LK, Hickey MB, Axelson D, Goldstein BI, Goldstein TR, Birmaher B, Phillips ML",Journal of affective disorders,0.429,27442458,-1,-1
sleep_00071,https://pubmed.ncbi.nlm.nih.gov/19349237/,Hyperstimulation of striatal D2 receptors with sleep deprivation: Implications for cognitive impairment.,"Volkow ND, Tomasi D, Wang GJ, Telang F, Fowler JS, Wang RL, Logan J, Wong C, Jayne M, Swanson JM",NeuroImage,0.416,19349237,10.1016/j.neuroimage.2009.01.003,-1
sleep_00072,https://pubmed.ncbi.nlm.nih.gov/20974158/,Keeping time in your sleep: overnight consolidation of temporal rhythm.,"Lewis PA, Couch TJ, Walker MP",Neuropsychologia,0.399,20974158,10.1016/j.neuropsychologia.2010.10.025,-1
sleep_00073,https://pubmed.ncbi.nlm.nih.gov/21168395/,Infraslow EEG oscillations organize large-scale cortical-subcortical interactions during sleep: a combined EEG/fMRI study.,"Picchioni D, Horovitz SG, Fukunaga M, Carr WS, Meltzer JA, Balkin TJ, Duyn JH, Braun AR",Brain research,0.396,21168395,-1,-1
sleep_00074,https://pubmed.ncbi.nlm.nih.gov/24408956/,Complementary Roles of Slow-Wave Sleep and Rapid Eye Movement Sleep in Emotional  Memory Consolidation.,"Cairney SA, Durrant SJ, Power R, Lewis PA","Cerebral cortex (New York, N.Y. : 1991)",0.387,24408956,-1,-1
sleep_00075,https://pubmed.ncbi.nlm.nih.gov/22238632/,Circadian preference modulates the neural substrate of conflict processing across the day.,"Schmidt C, Peigneux P, Leclercq Y, Sterpenich V, Vandewalle G, Phillips C, Berthomier P, Berthomier C, Tinguely G, Gais S, Schabus M, Desseilles M, Dang-Vu T, Salmon E, Degueldre C, Balteau E, Luxen A, Cajochen C, Maquet P, Collette F",PloS one,0.373,22238632,-1,-1
sleep_00076,https://pubmed.ncbi.nlm.nih.gov/14741317/,An event-related fMRI study of the neurobehavioral impact of sleep deprivation on performance of a delayed-match-to-sample task.,"Habeck C, Rakitin BC, Moeller J, Scarmeas N, Zarahn E, Brown T, Stern Y",Brain research. Cognitive brain research,0.365,14741317,-1,-1
sleep_00077,https://pubmed.ncbi.nlm.nih.gov/18094020/,Abnormal activity in hypothalamus and amygdala during humour processing in human  narcolepsy with cataplexy.,"Schwartz S, Ponz A, Poryazova R, Werth E, Boesiger P, Khatami R, Bassetti CL",Brain : a journal of neurology,0.36,18094020,-1,-1
sleep_00078,https://pubmed.ncbi.nlm.nih.gov/17670944/,Hemodynamic cerebral correlates of sleep spindles during human non-rapid eye movement sleep.,"Schabus M, Dang-Vu TT, Albouy G, Balteau E, Boly M, Carrier J, Darsaud A, Degueldre C, Desseilles M, Gais S, Phillips C, Rauchs G, Schnakers C, Sterpenich V, Vandewalle G, Luxen A, Maquet P",Proceedings of the National Academy of Sciences of the United States of America,0.348,17670944,-1,-1
sleep_00079,https://pubmed.ncbi.nlm.nih.gov/18584959/,fMRI differences between early and late stage-1 sleep.,"Picchioni D, Fukunaga M, Carr WS, Braun AR, Balkin TJ, Duyn JH, Horovitz SG",Neuroscience letters,0.329,18584959,-1,-1
sleep_00080,https://pubmed.ncbi.nlm.nih.gov/23908622/,Dreaming as mind wandering: evidence from functional neuroimaging and first-person content reports.,"Fox KC, Nijeboer S, Solomonova E, Domhoff GW, Christoff K",Frontiers in human neuroscience,0.329,23908622,-1,-1
sleep_00081,https://pubmed.ncbi.nlm.nih.gov/22137505/,PER2 rs2304672 polymorphism moderates circadian-relevant reward circuitry activity in adolescents.,"Forbes EE, Dahl RE, Almeida JR, Ferrell RE, Nimgaonkar VL, Mansour H, Sciarrillo SR, Holm SM, Rodriguez EE, Phillips ML",Biological psychiatry,0.328,22137505,-1,-1
sleep_00082,https://pubmed.ncbi.nlm.nih.gov/18511023/,Sleep deprivation alters functioning within the neural network underlying the covert orienting of attention.,"Mander BA, Reid KJ, Davuluri VK, Small DM, Parrish TB, Mesulam MM, Zee PC, Gitelman DR",Brain research,0.326,18511023,-1,-1
sleep_00083,https://pubmed.ncbi.nlm.nih.gov/25255048/,Brainstem changes associated with increased muscle sympathetic drive in obstructive sleep apnoea.,"Lundblad LC, Fatouleh RH, Hammam E, McKenzie DK, Macefield VG, Henderson LA",NeuroImage,0.321,25255048,-1,-1
sleep_00084,https://pubmed.ncbi.nlm.nih.gov/16263248/,Compensatory recruitment after sleep deprivation and the relationship with performance.,"Drummond SP, Meloy MJ, Yanagi MA, Orff HJ, Brown GG",Psychiatry research,0.306,16263248,-1,-1
sleep_00085,https://pubmed.ncbi.nlm.nih.gov/18815373/,Spontaneous neural activity during human slow wave sleep.,"Dang-Vu TT, Schabus M, Desseilles M, Albouy G, Boly M, Darsaud A, Gais S, Rauchs G, Sterpenich V, Vandewalle G, Carrier J, Moonen G, Balteau E, Degueldre C, Luxen A, Phillips C, Maquet P",Proceedings of the National Academy of Sciences of the United States of America,0.302,18815373,-1,-1
sleep_00086,https://pubmed.ncbi.nlm.nih.gov/25788668/,"Neural and behavioral correlates of extended training during sleep deprivation in humans: evidence for local, task-specific effects.","Bernardi G, Siclari F, Yu X, Zennig C, Bellesi M, Ricciardi E, Cirelli C, Ghilardi MF, Pietrini P, Tononi G",The Journal of neuroscience : the official journal of the Society for Neuroscience,0.301,25788668,-1,-1
sleep_00087,https://pubmed.ncbi.nlm.nih.gov/25765256/,Influence of epoch length on measurement of dynamic functional connectivity in wakefulness and behavioural validation in sleep.,"Wilson RS, Mayhew SD, Rollings DT, Goldstone A, Przezdzik I, Arvanitis TN, Bagshaw AP",NeuroImage,0.296,25765256,-1,-1
