paper_name,paper_url,Title,Author,Journal,Loading,PMID,Doi,download_status
social cognitive_00093,https://pubmed.ncbi.nlm.nih.gov/22505330/,Atypical brain activation patterns during a face-to-face joint attention game in  adults with autism spectrum disorder.,"Redcay E, Dodell-Feder D, Mavros PL, Kleiner M, Pearrow MJ, Triantafyllou C, Gabrieli JD, Saxe R",Human brain mapping,0.069,22505330,-1,-1
social cognitive_00094,https://pubmed.ncbi.nlm.nih.gov/26484047/,Default mode network segregation and social deficits in autism spectrum disorder: Evidence from non-medicated children.,"Yerys BE, Gordon EM, Abrams DN, Satterthwaite TD, Weinblatt R, Jankowski KF, Strang J, Kenworthy L, Gaillard WD, Vaidya CJ",NeuroImage. Clinical,0.068,26484047,-1,-1
social cognitive_00095,https://pubmed.ncbi.nlm.nih.gov/24523434/,Right anterior temporal lobe dysfunction underlies theory of mind impairments in  semantic dementia.,"Irish M, Hodges JR, Piguet O",Brain : a journal of neurology,0.064,24523434,-1,-1
social cognitive_00096,https://pubmed.ncbi.nlm.nih.gov/27091676/,Plastic modulation of episodic memory networks in the aging brain with cognitive  decline.,"Bai F, Yuan Y, Yu H, Zhang Z",Behavioural brain research,0.06,27091676,-1,-1
social cognitive_00097,https://pubmed.ncbi.nlm.nih.gov/20008375/,Atypical neural self-representation in autism.,"Lombardo MV, Chakrabarti B, Bullmore ET, Sadek SA, Pasco G, Wheelwright SJ, Suckling J, Baron-Cohen S",Brain : a journal of neurology,0.058,20008375,-1,-1
social cognitive_00098,https://pubmed.ncbi.nlm.nih.gov/19328236/,Duration matters: dissociating neural correlates of detection and evaluation of social gaze.,"Kuzmanovic B, Georgescu AL, Eickhoff SB, Shah NJ, Bente G, Fink GR, Vogeley K",NeuroImage,0.045,19328236,-1,-1
