paper_name,paper_url,Title,Author,Journal,Loading,PMID,Doi,download_status
somatosensory_00185,https://pubmed.ncbi.nlm.nih.gov/19172650/,Effects of different viewing perspectives on somatosensory activations during observation of touch.,"Schaefer M, Xu B, Flor H, Cohen LG",Human brain mapping,0.128,19172650,-1,-1
somatosensory_00186,https://pubmed.ncbi.nlm.nih.gov/19684249/,Distinct and overlapping functional zones in the cerebellum defined by resting state functional connectivity.,"O'Reilly JX, Beckmann CF, Tomassini V, Ramnani N, Johansen-Berg H","Cerebral cortex (New York, N.Y. : 1991)",0.128,19684249,-1,-1
somatosensory_00187,https://pubmed.ncbi.nlm.nih.gov/22608155/,Excessive contralateral motor overflow in schizophrenia measured by fMRI.,"Minzenberg MJ, Yoon JH, Soosman SK, Carter CS",Psychiatry research,0.127,22608155,-1,-1
somatosensory_00188,https://pubmed.ncbi.nlm.nih.gov/26053316/,Characterizing Thalamocortical Disturbances in Cervical Spondylotic Myelopathy: Revealed by Functional Connectivity under Two Slow Frequency Bands.,"Zhou F, Wu L, Liu X, Gong H, Luk KD, Hu Y",PloS one,0.127,26053316,-1,-1
somatosensory_00189,https://pubmed.ncbi.nlm.nih.gov/16765998/,Neural correlates of crossmodal visual-tactile extinction and of tactile awareness revealed by fMRI in a right-hemisphere stroke patient.,"Sarri M, Blankenburg F, Driver J",Neuropsychologia,0.126,16765998,-1,-1
somatosensory_00190,https://pubmed.ncbi.nlm.nih.gov/22114261/,Functionally specific changes in resting-state sensorimotor networks after motor  learning.,"Vahdat S, Darainy M, Milner TE, Ostry DJ",The Journal of neuroscience : the official journal of the Society for Neuroscience,0.126,22114261,-1,-1
somatosensory_00191,https://pubmed.ncbi.nlm.nih.gov/23507388/,Crossmodal interactions of haptic and visual texture information in early sensory cortex.,"Eck J, Kaas AL, Goebel R",NeuroImage,0.126,23507388,-1,-1
somatosensory_00192,https://pubmed.ncbi.nlm.nih.gov/25461704/,Resting BOLD fluctuations in the primary somatosensory cortex correlate with tactile acuity.,"Haag LM, Heba S, Lenz M, Glaubitz B, Hoffken O, Kalisch T, Puts NA, Edden RA, Tegenthoff M, Dinse H, Schmidt-Wilcke T",Cortex; a journal devoted to the study of the nervous system and behavior,0.126,25461704,-1,-1
somatosensory_00193,https://pubmed.ncbi.nlm.nih.gov/12880836/,A fronto-parietal circuit for tactile object discrimination: an event-related fMRI study.,"Stoeckel MC, Weder B, Binkofski F, Buccino G, Shah NJ, Seitz RJ",NeuroImage,0.124,12880836,-1,-1
somatosensory_00194,https://pubmed.ncbi.nlm.nih.gov/15784433/,Validation of SOBI components from high-density EEG.,"Tang AC, Sutherland MT, McKinney CJ",NeuroImage,0.124,15784433,-1,-1
somatosensory_00195,https://pubmed.ncbi.nlm.nih.gov/20817354/,Brain correlates of stress-induced analgesia.,"Yilmaz P, Diers M, Diener S, Rance M, Wessa M, Flor H",Pain,0.124,20817354,-1,-1
somatosensory_00196,https://pubmed.ncbi.nlm.nih.gov/23461704/,Modulation of proprioceptive feedback during functional electrical stimulation: an fMRI study.,"Christensen MS, Grey MJ",The European journal of neuroscience,0.124,23461704,-1,-1
somatosensory_00197,https://pubmed.ncbi.nlm.nih.gov/25767441/,Propensity to obesity impacts the neuronal response to energy imbalance.,"Cornier MA, McFadden KL, Thomas EA, Bechtell JL, Bessesen DH, Tregellas JR",Frontiers in behavioral neuroscience,0.124,25767441,-1,-1
somatosensory_00198,https://pubmed.ncbi.nlm.nih.gov/28529174/,Inhibitory rTMS of secondary somatosensory cortex reduces intensity but not pleasantness of gentle touch.,"Case LK, Laubacher CM, Richards EA, Spagnolo PA, Olausson H, Bushnell MC",Neuroscience letters,0.124,28529174,-1,-1
somatosensory_00199,https://pubmed.ncbi.nlm.nih.gov/16040108/,Neural modeling and imaging of the cortical interactions underlying syllable production.,"Guenther FH, Ghosh SS, Tourville JA",Brain and language,0.121,16040108,-1,-1
somatosensory_00200,https://pubmed.ncbi.nlm.nih.gov/22539862/,BOLD responses in somatosensory cortices better reflect heat sensation than pain.,"Moulton EA, Pendse G, Becerra LR, Borsook D",The Journal of neuroscience : the official journal of the Society for Neuroscience,0.121,22539862,-1,-1
somatosensory_00201,https://pubmed.ncbi.nlm.nih.gov/24375687/,Concurrent functional magnetic resonance imaging and electroencephalography assessment of sensory gating in schizophrenia.,"Bak N, Rostrup E, Larsson HB, Glenthoj BY, Oranje B",Human brain mapping,0.121,24375687,-1,-1
somatosensory_00202,https://pubmed.ncbi.nlm.nih.gov/26713867/,Functional Connectivity Estimated from Resting-State fMRI Reveals Selective Alterations in Male Adolescents with Pure Conduct Disorder.,"Lu FM, Zhou JS, Zhang J, Xiang YT, Zhang J, Liu Q, Wang XP, Yuan Z",PloS one,0.121,26713867,-1,-1
somatosensory_00203,https://pubmed.ncbi.nlm.nih.gov/17156923/,Brain activity related to temporal summation of C-fiber evoked pain.,"Staud R, Craggs JG, Robinson ME, Perlstein WM, Price DD",Pain,0.12,17156923,-1,-1
somatosensory_00204,https://pubmed.ncbi.nlm.nih.gov/18938199/,Enter feelings: somatosensory responses following early stages of visual induction of emotion.,"Rudrauf D, Lachaux JP, Damasio A, Baillet S, Hugueville L, Martinerie J, Damasio H, Renault B",International journal of psychophysiology : official journal of the International Organization of Psychophysiology,0.12,18938199,-1,-1
somatosensory_00205,https://pubmed.ncbi.nlm.nih.gov/20946964/,Meta-analytic evidence for common and distinct neural networks associated with directly experienced pain and empathy for pain.,"Lamm C, Decety J, Singer T",NeuroImage,0.12,20946964,-1,-1
somatosensory_00206,https://pubmed.ncbi.nlm.nih.gov/22427134/,Treatment-related changes in brain activation in patients with fibromyalgia syndrome.,"Diers M, Yilmaz P, Rance M, Thieme K, Gracely RH, Rolko C, Schley MT, Kiessling U, Wang H, Flor H",Experimental brain research,0.12,22427134,-1,-1
somatosensory_00207,https://pubmed.ncbi.nlm.nih.gov/15808994/,Spatiotemporal brain dynamics in response to muscle stimulation.,"Niddam DM, Chen LF, Wu YT, Hsieh JC",NeuroImage,0.119,15808994,-1,-1
somatosensory_00208,https://pubmed.ncbi.nlm.nih.gov/20350177/,Viewing one's own face being touched modulates tactile perception: an fMRI study.,"Cardini F, Costantini M, Galati G, Romani GL, Ladavas E, Serino A",Journal of cognitive neuroscience,0.119,20350177,-1,-1
somatosensory_00209,https://pubmed.ncbi.nlm.nih.gov/20162595/,Working memory for vibrotactile frequencies: comparison of cortical activity in blind and sighted individuals.,"Burton H, Sinclair RJ, Dixit S",Human brain mapping,0.118,20162595,-1,-1
somatosensory_00210,https://pubmed.ncbi.nlm.nih.gov/15734339/,EEG source analysis and fMRI reveal two electrical sources in the fronto-parietal operculum during subepidermal finger stimulation.,"Stancak A, Polacek H, Vrana J, Rachmanova R, Hoechstetter K, Tintra J, Scherg M",NeuroImage,0.117,15734339,-1,-1
somatosensory_00211,https://pubmed.ncbi.nlm.nih.gov/24269492/,Differential brain activity in subjects with painful trigeminal neuropathy and painful temporomandibular disorder.,"Youssef AM, Gustin SM, Nash PG, Reeves JM, Petersen ET, Peck CC, Murray GM, Henderson LA",Pain,0.117,24269492,-1,-1
somatosensory_00212,https://pubmed.ncbi.nlm.nih.gov/15036060/,Effects of distraction on magnetoencephalographic responses ascending through C-fibers in humans.,"Qiu Y, Inui K, Wang X, Nguyen BT, Tran TD, Kakigi R",Clinical neurophysiology : official journal of the International Federation of Clinical Neurophysiology,0.116,15036060,-1,-1
somatosensory_00213,https://pubmed.ncbi.nlm.nih.gov/20162596/,Dynamic EEG-informed fMRI modeling of the pain matrix using 20-ms root mean square segments.,"Brinkmeyer J, Mobascher A, Warbrick T, Musso F, Wittsack HJ, Saleh A, Schnitzler A, Winterer G",Human brain mapping,0.116,20162596,-1,-1
somatosensory_00214,https://pubmed.ncbi.nlm.nih.gov/22305143/,Within-limb somatotopic organization in human SI and parietal operculum for the leg: an fMRI study.,"Bao R, Wei P, Li K, Lu J, Zhao C, Wang Y, Zhang T",Brain research,0.116,22305143,-1,-1
somatosensory_00215,https://pubmed.ncbi.nlm.nih.gov/23485849/,Gray matter volume reduction reflects chronic pain in trigeminal neuralgia.,"Obermann M, Rodriguez-Raecke R, Naegel S, Holle D, Mueller D, Yoon MS, Theysohn N, Blex S, Diener HC, Katsarava Z",NeuroImage,0.116,23485849,-1,-1
somatosensory_00216,https://pubmed.ncbi.nlm.nih.gov/24376780/,Racial bias in neural empathic responses to pain.,"Contreras-Huerta LS, Baker KS, Reynolds KJ, Batalha L, Cunnington R",PloS one,0.116,24376780,-1,-1
somatosensory_00217,https://pubmed.ncbi.nlm.nih.gov/26287488/,Brain Regions Associated to a Kinesthetic Illusion Evoked by Watching a Video of  One's Own Moving Hand.,"Kaneko F, Blanchard C, Lebar N, Nazarian B, Kavounoudias A, Romaiguere P",PloS one,0.116,26287488,-1,-1
somatosensory_00218,https://pubmed.ncbi.nlm.nih.gov/19576957/,Negative BOLD effect on somato-motor inhibitory processing: an fMRI study.,"Nakata H, Sakamoto K, Ferretti A, Gianni Perrucci M, Del Gratta C, Kakigi R, Luca Romani G",Neuroscience letters,0.115,19576957,-1,-1
somatosensory_00219,https://pubmed.ncbi.nlm.nih.gov/20630656/,NMDA-receptor antagonist and morphine decrease CRPS-pain and cerebral pain representation.,"Gustin SM, Schwarz A, Birbaumer N, Sines N, Schmidt AC, Veit R, Larbig W, Flor H, Lotze M",Pain,0.115,20630656,-1,-1
somatosensory_00220,https://pubmed.ncbi.nlm.nih.gov/15907299/,Multisensory stimulation with or without saccades: fMRI evidence for crossmodal effects on sensory-specific cortices that reflect multisensory location-congruence rather than task-relevance.,"Macaluso E, Frith CD, Driver J",NeuroImage,0.114,15907299,-1,-1
somatosensory_00221,https://pubmed.ncbi.nlm.nih.gov/25019676/,Brain representations for acquiring and recalling visual-motor adaptations.,"Bedard P, Sanes JN",NeuroImage,0.114,25019676,10.1016/j.neuroimage.2014.07.009,-1
somatosensory_00222,https://pubmed.ncbi.nlm.nih.gov/12824463/,Neural correlates of interindividual differences in the subjective experience of  pain.,"Coghill RC, McHaffie JG, Yen YF",Proceedings of the National Academy of Sciences of the United States of America,0.113,12824463,10.1073/pnas.1430684100,-1
somatosensory_00223,https://pubmed.ncbi.nlm.nih.gov/14511835/,Neural networks active during tactile form perception: common and differential activity during macrospatial and microspatial tasks.,"Stoesz MR, Zhang M, Weisser VD, Prather SC, Mao H, Sathian K",International journal of psychophysiology : official journal of the International Organization of Psychophysiology,0.113,14511835,-1,-1
somatosensory_00224,https://pubmed.ncbi.nlm.nih.gov/15449356/,Cortical activity to vibrotactile stimulation: an fMRI study in blind and sighted individuals.,"Burton H, Sinclair RJ, McLaren DG",Human brain mapping,0.113,15449356,-1,-1
somatosensory_00225,https://pubmed.ncbi.nlm.nih.gov/17670972/,Human MST but not MT responds to tactile stimulation.,"Beauchamp MS, Yasar NE, Kishan N, Ro T",The Journal of neuroscience : the official journal of the Society for Neuroscience,0.113,17670972,-1,-1
somatosensory_00226,https://pubmed.ncbi.nlm.nih.gov/22357844/,Linking pain and the body: neural correlates of visually induced analgesia.,"Longo MR, Iannetti GD, Mancini F, Driver J, Haggard P",The Journal of neuroscience : the official journal of the Society for Neuroscience,0.113,22357844,-1,-1
somatosensory_00227,https://pubmed.ncbi.nlm.nih.gov/29416506/,Asymmetric Functional Connectivity of the Contra- and Ipsilateral Secondary Somatosensory Cortex during Tactile Object Recognition.,"Yu Y, Yang J, Ejima Y, Fukuyama H, Wu J",Frontiers in human neuroscience,0.113,29416506,-1,-1
somatosensory_00228,https://pubmed.ncbi.nlm.nih.gov/10196461/,Mapping of secondary somatosensory cortex activation induced by vibrational stimulation: an fMRI study.,"Maldjian JA, Gottschalk A, Patel RS, Pincus D, Detre JA, Alsop DC",Brain research,0.112,10196461,-1,-1
somatosensory_00229,https://pubmed.ncbi.nlm.nih.gov/21569800/,Non-effective increase of fMRI-activation for motor performance in elder individuals.,"Loibl M, Beutling W, Kaza E, Lotze M",Behavioural brain research,0.112,21569800,-1,-1
somatosensory_00230,https://pubmed.ncbi.nlm.nih.gov/29258852/,Loss of inhibition in ipsilateral somatosensory areas following altered afferent  nerve signaling from the hand.,"Bjorkman A, Weibull A",Neuroscience research,0.112,29258852,-1,-1
somatosensory_00231,https://pubmed.ncbi.nlm.nih.gov/11606687/,Modality specific neural correlates of auditory and somatic hallucinations.,"Shergill SS, Cameron LA, Brammer MJ, Williams SC, Murray RM, McGuire PK","Journal of neurology, neurosurgery, and psychiatry",0.111,11606687,-1,-1
somatosensory_00232,https://pubmed.ncbi.nlm.nih.gov/16459107/,Acute opioid effects on human brain as revealed by functional magnetic resonance  imaging.,"Leppa M, Korvenoja A, Carlson S, Timonen P, Martinkauppi S, Ahonen J, Rosenberg PH, Aronen HJ, Kalso E",NeuroImage,0.11,16459107,-1,-1
somatosensory_00233,https://pubmed.ncbi.nlm.nih.gov/25937342/,Symptom severity and disgust-related traits in borderline personality disorder: The role of amygdala subdivisions.,"Schienle A, Leutgeb V, Wabnegger A",Psychiatry research,0.11,25937342,-1,-1
somatosensory_00234,https://pubmed.ncbi.nlm.nih.gov/26279210/,Brain imaging signatures of the relationship between epidermal nerve fibers and heat pain perception.,"Tseng MT, Kong Y, Chiang MC, Chao CC, Tseng WY, Hsieh ST",NeuroImage,0.11,26279210,-1,-1
somatosensory_00235,https://pubmed.ncbi.nlm.nih.gov/28353135/,Abnormal brain structure implicated in patients with functional dyspepsia.,"Liu P, Wang G, Zeng F, Liu Y, Fan Y, Wei Y, Qin W, Calhoun VD",Brain imaging and behavior,0.11,28353135,-1,-1
somatosensory_00236,https://pubmed.ncbi.nlm.nih.gov/22325095/,Altered cortical morphology in sensorimotor processing regions in adolescents and adults with attention-deficit/hyperactivity disorder.,"Duerden EG, Tannock R, Dockstader C",Brain research,0.108,22325095,-1,-1
somatosensory_00237,https://pubmed.ncbi.nlm.nih.gov/25995478/,Connections between Intraparietal Sulcus and a Sensorimotor Network Underpin Sustained Tactile Attention.,"Goltz D, Gundlach C, Nierhaus T, Villringer A, Muller M, Pleger B",The Journal of neuroscience : the official journal of the Society for Neuroscience,0.108,25995478,-1,-1
somatosensory_00238,https://pubmed.ncbi.nlm.nih.gov/24012546/,The shared neural basis of empathy and facial imitation accuracy.,"Braadbaart L, de Grauw H, Perrett DI, Waiter GD, Williams JH",NeuroImage,0.107,24012546,-1,-1
somatosensory_00239,https://pubmed.ncbi.nlm.nih.gov/12062028/,Driving plasticity in human adult motor cortex is associated with improved motor  function after brain injury.,"Fraser C, Power M, Hamdy S, Rothwell J, Hobday D, Hollander I, Tyrell P, Hobson A, Williams S, Thompson D",Neuron,0.106,12062028,-1,-1
somatosensory_00240,https://pubmed.ncbi.nlm.nih.gov/26977802/,Altered Spontaneous Activity in Patients with Persistent Somatoform Pain Disorder Revealed by Regional Homogeneity.,"Huang T, Zhao Z, Yan C, Lu J, Li X, Tang C, Fan M, Luo Y",PloS one,0.106,26977802,-1,-1
somatosensory_00241,https://pubmed.ncbi.nlm.nih.gov/11884359/,Mechanical noxious stimuli cause bilateral activation of parietal operculum in callosotomized subjects.,"Fabri M, Polonara G, Quattrini A, Salvolini U","Cerebral cortex (New York, N.Y. : 1991)",0.105,11884359,10.1093/cercor/12.4.446,-1
somatosensory_00242,https://pubmed.ncbi.nlm.nih.gov/22001262/,The neural mechanisms of reliability weighted integration of shape information from vision and touch.,"Helbig HB, Ernst MO, Ricciardi E, Pietrini P, Thielscher A, Mayer KM, Schultz J, Noppeney U",NeuroImage,0.105,22001262,10.1016/j.neuroimage.2011.09.072,-1
somatosensory_00243,https://pubmed.ncbi.nlm.nih.gov/22594914/,Touching and feeling: differences in pleasant touch processing between glabrous and hairy skin in humans.,"McGlone F, Olausson H, Boyle JA, Jones-Gotman M, Dancer C, Guest S, Essick G",The European journal of neuroscience,0.105,22594914,-1,-1
somatosensory_00244,https://pubmed.ncbi.nlm.nih.gov/29654733/,Cortical remodeling after electroacupuncture therapy in peripheral nerve repairing model.,"Wu JJ, Lu YC, Hua XY, Ma SJ, Shan CL, Xu JG",Brain research,0.105,29654733,-1,-1
somatosensory_00245,https://pubmed.ncbi.nlm.nih.gov/11160520/,Multisensory cortical signal increases and decreases during vestibular galvanic stimulation (fMRI).,"Bense S, Stephan T, Yousry TA, Brandt T, Dieterich M",Journal of neurophysiology,0.104,11160520,-1,-1
somatosensory_00246,https://pubmed.ncbi.nlm.nih.gov/20236763/,Chronic myofascial temporomandibular pain is associated with neural abnormalities in the trigeminal and limbic systems.,"Younger JW, Shen YF, Goddard G, Mackey SC",Pain,0.104,20236763,-1,-1
somatosensory_00247,https://pubmed.ncbi.nlm.nih.gov/11297824/,Remodelling of sensorimotor maps in paraplegia: a functional magnetic resonance imaging study after a surgical nerve transfer.,"Perani D, Brunelli GA, Tettamanti M, Scifo P, Tecchio F, Rossini PM, Fazio F",Neuroscience letters,0.103,11297824,-1,-1
somatosensory_00248,https://pubmed.ncbi.nlm.nih.gov/16631383/,Eye closure in darkness animates olfactory and gustatory cortical areas.,"Wiesmann M, Kopietz R, Albrecht J, Linn J, Reime U, Kara E, Pollatos O, Sakar V, Anzinger A, Fesl G, Bruckmann H, Kobal G, Stephan T",NeuroImage,0.103,16631383,-1,-1
somatosensory_00249,https://pubmed.ncbi.nlm.nih.gov/17274965/,Intranasal trigeminal function in subjects with and without an intact sense of smell.,"Iannilli E, Gerber J, Frasnelli J, Hummel T",Brain research,0.103,17274965,-1,-1
somatosensory_00250,https://pubmed.ncbi.nlm.nih.gov/17553011/,Disgust sensitivity predicts the insula and pallidal response to pictures of disgusting foods.,"Calder AJ, Beaver JD, Davis MH, van Ditzhuijzen J, Keane J, Lawrence AD",The European journal of neuroscience,0.103,17553011,-1,-1
somatosensory_00251,https://pubmed.ncbi.nlm.nih.gov/20851770/,Functional connectivity of the human insular cortex during noxious and innocuous  thermal stimulation.,"Peltz E, Seifert F, DeCol R, Dorfler A, Schwab S, Maihofner C",NeuroImage,0.102,20851770,-1,-1
somatosensory_00252,https://pubmed.ncbi.nlm.nih.gov/23300575/,Differential grey matter changes in sensorimotor cortex related to exceptional fine motor skills.,"Stoeckel MC, Morgenroth F, Buetefisch CM, Seitz RJ",PloS one,0.099,23300575,-1,-1
somatosensory_00253,https://pubmed.ncbi.nlm.nih.gov/18718326/,Supraspinal locomotor control in quadrupeds and humans.,"Jahn K, Deutschlander A, Stephan T, Kalla R, Hufner K, Wagner J, Strupp M, Brandt T",Progress in brain research,0.098,18718326,-1,-1
somatosensory_00254,https://pubmed.ncbi.nlm.nih.gov/19781597/,Negative BOLD during tongue movement: a functional magnetic resonance imaging study.,"Sakamoto K, Nakata H, Perrucci MG, Del Gratta C, Kakigi R, Romani GL",Neuroscience letters,0.098,19781597,-1,-1
somatosensory_00255,https://pubmed.ncbi.nlm.nih.gov/15862218/,Brain activation of lower extremity movement in chronically impaired stroke survivors.,"Luft AR, Forrester L, Macko RF, McCombe-Waller S, Whitall J, Villagra F, Hanley DF",NeuroImage,0.097,15862218,-1,-1
somatosensory_00256,https://pubmed.ncbi.nlm.nih.gov/22496865/,The human operculo-insular cortex is pain-preferentially but not pain-exclusively activated by trigeminal and olfactory stimuli.,"Lotsch J, Walter C, Felden L, Noth U, Deichmann R, Oertel BG",PloS one,0.097,22496865,-1,-1
somatosensory_00257,https://pubmed.ncbi.nlm.nih.gov/24575000/,Voluntary Out-of-Body Experience: An fMRI Study.,"Smith AM, Messier C",Frontiers in human neuroscience,0.097,24575000,-1,-1
somatosensory_00258,https://pubmed.ncbi.nlm.nih.gov/27894900/,Neuroimaging somatosensory perception and masking.,"Meador KJ, Revill KP, Epstein CM, Sathian K, Loring DW, Rorden C",Neuropsychologia,0.097,27894900,-1,-1
somatosensory_00259,https://pubmed.ncbi.nlm.nih.gov/24080372/,Activation of the human mirror neuron system during the observation of the manipulation of virtual tools in the absence of a visible effector limb.,"Modrono C, Navarrete G, Rodriguez-Hernandez AF, Gonzalez-Mora JL",Neuroscience letters,0.096,24080372,-1,-1
somatosensory_00260,https://pubmed.ncbi.nlm.nih.gov/16963184/,Placebo analgesia is accompanied by large reductions in pain-related brain activity in irritable bowel syndrome patients.,"Price DD, Craggs J, Verne GN, Perlstein WM, Robinson ME",Pain,0.095,16963184,-1,-1
somatosensory_00261,https://pubmed.ncbi.nlm.nih.gov/19184995/,Strength of prefrontal activation predicts intensity of suggestion-induced pain.,"Raij TT, Numminen J, Narvanen S, Hiltunen J, Hari R",Human brain mapping,0.095,19184995,10.1002/hbm.20716,-1
somatosensory_00262,https://pubmed.ncbi.nlm.nih.gov/16150613/,Functional imaging of stress urinary incontinence.,"Di Gangi Herms AM, Veit R, Reisenauer C, Herms A, Grodd W, Enck P, Stenzl A, Birbaumer N",NeuroImage,0.094,16150613,10.1016/j.neuroimage.2005.07.018,-1
somatosensory_00263,https://pubmed.ncbi.nlm.nih.gov/16280463/,Brain processing of the signals ascending through unmyelinated C fibers in humans: an event-related functional magnetic resonance imaging study.,"Qiu Y, Noguchi Y, Honda M, Nakata H, Tamura Y, Tanaka S, Sadato N, Wang X, Inui K, Kakigi R","Cerebral cortex (New York, N.Y. : 1991)",0.094,16280463,-1,-1
somatosensory_00264,https://pubmed.ncbi.nlm.nih.gov/15808973/,What vs. where in touch: an fMRI study.,"Reed CL, Klatzky RL, Halgren E",NeuroImage,0.093,15808973,-1,-1
somatosensory_00265,https://pubmed.ncbi.nlm.nih.gov/26384774/,Cortical thickness in adults with agenesis of the corpus callosum.,"Beaule V, Tremblay S, Lafleur LP, Tremblay S, Lassonde M, Lepage JF, Theoret H",Neuropsychologia,0.093,26384774,-1,-1
somatosensory_00266,https://pubmed.ncbi.nlm.nih.gov/15006685/,Kinematic specificity of cortical reorganization associated with motor training.,"Morgen K, Kadom N, Sawaki L, Tessitore A, Ohayon J, Frank J, McFarland H, Martin R, Cohen LG",NeuroImage,0.091,15006685,-1,-1
somatosensory_00267,https://pubmed.ncbi.nlm.nih.gov/16221923/,The neural basis of human dance.,"Brown S, Martinez MJ, Parsons LM","Cerebral cortex (New York, N.Y. : 1991)",0.091,16221923,-1,-1
somatosensory_00268,https://pubmed.ncbi.nlm.nih.gov/19822572/,Cytoarchitecture and probabilistic maps of the human posterior insular cortex.,"Kurth F, Eickhoff SB, Schleicher A, Hoemke L, Zilles K, Amunts K","Cerebral cortex (New York, N.Y. : 1991)",0.09,19822572,-1,-1
somatosensory_00269,https://pubmed.ncbi.nlm.nih.gov/22912698/,Close to you: embodied simulation for peripersonal space in primary somatosensory cortex.,"Schaefer M, Heinze HJ, Rotte M",PloS one,0.09,22912698,-1,-1
somatosensory_00270,https://pubmed.ncbi.nlm.nih.gov/24155004/,The cerebral representation of scratching-induced pleasantness.,"Mochizuki H, Tanaka S, Morita T, Wasaka T, Sadato N, Kakigi R",Journal of neurophysiology,0.09,24155004,-1,-1
somatosensory_00271,https://pubmed.ncbi.nlm.nih.gov/15130584/,Blindness and brain plasticity: contribution of mental imagery? An fMRI study.,"Lambert S, Sampaio E, Mauss Y, Scheiber C",Brain research. Cognitive brain research,0.089,15130584,-1,-1
somatosensory_00272,https://pubmed.ncbi.nlm.nih.gov/21167825/,Altered resting state networks in epileptic patients with generalized tonic-clonic seizures.,"Wang Z, Lu G, Zhang Z, Zhong Y, Jiao Q, Zhang Z, Tan Q, Tian L, Chen G, Liao W, Li K, Liu Y",Brain research,0.089,21167825,-1,-1
somatosensory_00273,https://pubmed.ncbi.nlm.nih.gov/22422484/,Judging roughness by sight--a 7-Tesla fMRI study on responsivity of the primary somatosensory cortex during observed touch of self and others.,"Kuehn E, Trampel R, Mueller K, Turner R, Schutz-Bosbach S",Human brain mapping,0.089,22422484,-1,-1
somatosensory_00274,https://pubmed.ncbi.nlm.nih.gov/25161897/,Intersession reliability of fMRI activation for heat pain and motor tasks.,"Quiton RL, Keaser ML, Zhuo J, Gullapalli RP, Greenspan JD",NeuroImage. Clinical,0.089,25161897,-1,-1
somatosensory_00275,https://pubmed.ncbi.nlm.nih.gov/22711692/,"The centre of the brain: topographical model of motor, cognitive, affective, and  somatosensory functions of the basal ganglia.","Arsalidou M, Duerden EG, Taylor MJ",Human brain mapping,0.088,22711692,-1,-1
somatosensory_00276,https://pubmed.ncbi.nlm.nih.gov/23277112/,Modulation of somatosensory processing by action.,"Shergill SS, White TP, Joyce DW, Bays PM, Wolpert DM, Frith CD",NeuroImage,0.088,23277112,-1,-1
somatosensory_00277,https://pubmed.ncbi.nlm.nih.gov/24431433/,Mental action simulation synchronizes action-observation circuits across individuals.,"Nummenmaa L, Smirnov D, Lahnakoski JM, Glerean E, Jaaskelainen IP, Sams M, Hari R",The Journal of neuroscience : the official journal of the Society for Neuroscience,0.088,24431433,-1,-1
somatosensory_00278,https://pubmed.ncbi.nlm.nih.gov/27738997/,Default mode network activity and neuropsychological profile in male children and adolescents with attention deficit hyperactivity disorder and conduct disorder.,"Uytun MC, Karakaya E, Oztop DB, Gengec S, Gumus K, Ozmen S, Doganay S, Icer S, Demirci E, Ozsoy SD",Brain imaging and behavior,0.088,27738997,-1,-1
somatosensory_00279,https://pubmed.ncbi.nlm.nih.gov/16361059/,Unpleasant odors increase pain processing in a patient with neuropathic pain: psychophysical and fMRI investigation.,"Villemure C, Wassimi S, Bennett GJ, Shir Y, Bushnell MC",Pain,0.087,16361059,-1,-1
