paper_name,paper_url,Title,Author,Journal,Loading,PMID,Doi,download_status
somatosensory_00469,https://pubmed.ncbi.nlm.nih.gov/18848631/,Fluctuations in electrodermal activity reveal variations in single trial brain responses to painful laser stimuli--a fMRI/EEG study.,"Mobascher A, Brinkmeyer J, Warbrick T, Musso F, Wittsack HJ, Stoermer R, Saleh A, Schnitzler A, Winterer G",NeuroImage,0.063,18848631,-1,-1
somatosensory_00470,https://pubmed.ncbi.nlm.nih.gov/21559066/,Interoception drives increased rational decision-making in meditators playing the ultimatum game.,"Kirk U, Downar J, Montague PR",Frontiers in neuroscience,0.063,21559066,-1,-1
somatosensory_00471,https://pubmed.ncbi.nlm.nih.gov/21933287/,Involvement of area MT in bimanual finger movements in left-handers: an fMRI study.,"Muller K, Kleiser R, Mechsner F, Seitz RJ",The European journal of neuroscience,0.063,21933287,-1,-1
somatosensory_00472,https://pubmed.ncbi.nlm.nih.gov/22922525/,The influence of risky and conservative mental sets on cerebral activations of cognitive control.,"Winkler AD, Hu S, Li CS",International journal of psychophysiology : official journal of the International Organization of Psychophysiology,0.063,22922525,10.1016/j.ijpsycho.2012.08.010,-1
somatosensory_00473,https://pubmed.ncbi.nlm.nih.gov/24508649/,Re-wiring the brain: Increased functional connectivity within primary somatosensory cortex following synchronous co-activation.,"Vidyasagar R, Folger SE, Parkes LM",NeuroImage,0.063,24508649,10.1016/j.neuroimage.2014.01.052,-1
somatosensory_00474,https://pubmed.ncbi.nlm.nih.gov/24661456/,Decoding the individual finger movements from single-trial functional magnetic resonance imaging recordings of human brain activity.,"Shen G, Zhang J, Wang M, Lei D, Yang G, Zhang S, Du X",The European journal of neuroscience,0.063,24661456,-1,-1
somatosensory_00475,https://pubmed.ncbi.nlm.nih.gov/25339893/,Activity of right premotor-parietal regions dependent upon imagined force level:  an fMRI study.,"Mizuguchi N, Nakata H, Kanosue K",Frontiers in human neuroscience,0.063,25339893,-1,-1
somatosensory_00476,https://pubmed.ncbi.nlm.nih.gov/11884351/,Directing attention to locations and to sensory modalities: multiple levels of selective processing revealed with PET.,"Macaluso E, Frith CD, Driver J","Cerebral cortex (New York, N.Y. : 1991)",0.062,11884351,-1,-1
somatosensory_00477,https://pubmed.ncbi.nlm.nih.gov/18083602/,Somato-motor inhibitory processing in humans: an event-related functional MRI study.,"Nakata H, Sakamoto K, Ferretti A, Gianni Perrucci M, Del Gratta C, Kakigi R, Luca Romani G",NeuroImage,0.062,18083602,-1,-1
somatosensory_00478,https://pubmed.ncbi.nlm.nih.gov/19906971/,Cerebral and cerebrospinal processes underlying counterirritation analgesia.,"Piche M, Arsenault M, Rainville P",The Journal of neuroscience : the official journal of the Society for Neuroscience,0.062,19906971,-1,-1
somatosensory_00479,https://pubmed.ncbi.nlm.nih.gov/21911384/,"Cortico-subcortical visual, somatosensory, and motor activations for perceiving dynamic whole-body emotional expressions with and without striate cortex (V1).","Van den Stock J, Tamietto M, Sorger B, Pichon S, Grezes J, de Gelder B",Proceedings of the National Academy of Sciences of the United States of America,0.062,21911384,-1,-1
somatosensory_00480,https://pubmed.ncbi.nlm.nih.gov/22971086/,On-line changing of thinking about words: the effect of cognitive context on neural responses to verb reading.,"Papeo L, Rumiati RI, Cecchetto C, Tomasino B",Journal of cognitive neuroscience,0.062,22971086,-1,-1
somatosensory_00481,https://pubmed.ncbi.nlm.nih.gov/23684870/,The roles of superficial amygdala and auditory cortex in music-evoked fear and joy.,"Koelsch S, Skouras S, Fritz T, Herrera P, Bonhage C, Kussner MB, Jacobs AM",NeuroImage,0.062,23684870,-1,-1
somatosensory_00482,https://pubmed.ncbi.nlm.nih.gov/24935777/,The Resting Brain of Alcoholics.,"Muller-Oehring EM, Jung YC, Pfefferbaum A, Sullivan EV, Schulte T","Cerebral cortex (New York, N.Y. : 1991)",0.062,24935777,-1,-1
somatosensory_00483,https://pubmed.ncbi.nlm.nih.gov/28321186/,Brain Activity during Mental Imagery of Gait Versus Gait-Like Plantar Stimulation: A Novel Combined Functional MRI Paradigm to Better Understand Cerebral Gait Control.,"Labriffe M, Annweiler C, Amirova LE, Gauquelin-Koch G, Ter Minassian A, Leiber LM, Beauchet O, Custaud MA, Dinomais M",Frontiers in human neuroscience,0.062,28321186,-1,-1
somatosensory_00484,https://pubmed.ncbi.nlm.nih.gov/15652307/,Cerebral activation using a MR-compatible piezoelectric actuator with adjustable  vibration frequencies and in vivo wave propagation control.,"Gizewski ER, Koeze O, Uffmann K, de Greiff A, Ladd ME, Forsting M",NeuroImage,0.061,15652307,-1,-1
somatosensory_00485,https://pubmed.ncbi.nlm.nih.gov/16820004/,Contribution of the corpus callosum to bilateral representation of the trunk midline in the human brain: an fMRI study of callosotomized patients.,"Fabri M, Polonara G, Mascioli G, Paggi A, Salvolini U, Manzoni T",The European journal of neuroscience,0.061,16820004,-1,-1
somatosensory_00486,https://pubmed.ncbi.nlm.nih.gov/17924535/,Selective visuo-haptic processing of shape and texture.,"Stilla R, Sathian K",Human brain mapping,0.061,17924535,-1,-1
somatosensory_00487,https://pubmed.ncbi.nlm.nih.gov/18588532/,"Hypothalamus, sexual arousal and psychosexual identity in human males: a functional magnetic resonance imaging study.","Brunetti M, Babiloni C, Ferretti A, Del Gratta C, Merla A, Olivetti Belardinelli M, Romani GL",The European journal of neuroscience,0.061,18588532,-1,-1
somatosensory_00488,https://pubmed.ncbi.nlm.nih.gov/18980863/,Dissociating nociceptive modulation by the duration of pain anticipation from unpredictability in the timing of pain.,"Clark JA, Brown CA, Jones AK, El-Deredy W",Clinical neurophysiology : official journal of the International Federation of Clinical Neurophysiology,0.061,18980863,-1,-1
somatosensory_00489,https://pubmed.ncbi.nlm.nih.gov/19914778/,Using perfusion MRI to measure the dynamic changes in neural activation associated with tonic muscular pain.,"Owen DG, Clarke CF, Ganapathy S, Prato FS, St Lawrence KS",Pain,0.061,19914778,-1,-1
somatosensory_00490,https://pubmed.ncbi.nlm.nih.gov/20668275/,Brain activations in response to vibrotactile tooth stimulation: a psychophysical and fMRI study.,"Trulsson M, Francis ST, Bowtell R, McGlone F",Journal of neurophysiology,0.061,20668275,-1,-1
somatosensory_00491,https://pubmed.ncbi.nlm.nih.gov/21514332/,Painful muscle stimulation preferentially activates emotion-related brain regions compared to painful skin stimulation.,"Takahashi K, Taguchi T, Tanaka S, Sadato N, Qiu Y, Kakigi R, Mizumura K",Neuroscience research,0.061,21514332,-1,-1
somatosensory_00492,https://pubmed.ncbi.nlm.nih.gov/22155031/,Somatosensory activation of two fingers can be discriminated with ultrahigh-density diffuse optical tomography.,"Habermehl C, Holtze S, Steinbrink J, Koch SP, Obrig H, Mehnert J, Schmitz CH",NeuroImage,0.061,22155031,-1,-1
somatosensory_00493,https://pubmed.ncbi.nlm.nih.gov/23558094/,The scent of salience--is there olfactory-trigeminal conditioning in humans?,"Moessnang C, Pauly K, Kellermann T, Kramer J, Finkelmeyer A, Hummel T, Siegel SJ, Schneider F, Habel U",NeuroImage,0.061,23558094,-1,-1
somatosensory_00494,https://pubmed.ncbi.nlm.nih.gov/25762671/,Spinal cord-midbrain functional connectivity is related to perceived pain intensity: a combined spino-cortical FMRI study.,"Sprenger C, Finsterbusch J, Buchel C",The Journal of neuroscience : the official journal of the Society for Neuroscience,0.061,25762671,-1,-1
somatosensory_00495,https://pubmed.ncbi.nlm.nih.gov/26095674/,Functional connectivity associated with hand shape generation: Imitating novel hand postures and pantomiming tool grips challenge different nodes of a shared neural network.,"Vingerhoets G, Clauwaert A",Human brain mapping,0.061,26095674,-1,-1
somatosensory_00496,https://pubmed.ncbi.nlm.nih.gov/28323166/,Neural foundations of overt and covert actions.,"Simos PG, Kavroulakis E, Maris T, Papadaki E, Boursianis T, Kalaitzakis G, Savaki HE",NeuroImage,0.061,28323166,10.1016/j.neuroimage.2017.03.036,-1
somatosensory_00497,https://pubmed.ncbi.nlm.nih.gov/15707905/,The brain basis of piano performance.,"Parsons LM, Sergent J, Hodges DA, Fox PT",Neuropsychologia,0.06,15707905,10.1016/j.neuropsychologia.2004.11.007,-1
somatosensory_00498,https://pubmed.ncbi.nlm.nih.gov/18586370/,Pointing with the eyes: the role of gaze in communicating danger.,"Hadjikhani N, Hoge R, Snyder J, de Gelder B",Brain and cognition,0.06,18586370,10.1016/j.bandc.2008.01.008,-1
somatosensory_00499,https://pubmed.ncbi.nlm.nih.gov/18818908/,Decreasing task-related brain activity over repeated functional MRI scans and sessions with no change in performance: implications for serial investigations.,"Goodyear BG, Douglas EA",Experimental brain research,0.06,18818908,-1,-1
somatosensory_00500,https://pubmed.ncbi.nlm.nih.gov/19833154/,Brain activation patterns underlying fast habituation to painful laser stimuli.,"Mobascher A, Brinkmeyer J, Warbrick T, Musso F, Schlemper V, Wittsack HJ, Saleh A, Schnitzler A, Winterer G",International journal of psychophysiology : official journal of the International Organization of Psychophysiology,0.06,19833154,-1,-1
somatosensory_00501,https://pubmed.ncbi.nlm.nih.gov/21976509/,"mu-suppression during action observation and execution correlates with BOLD in dorsal premotor, inferior parietal, and SI cortices.","Arnstein D, Cui F, Keysers C, Maurits NM, Gazzola V",The Journal of neuroscience : the official journal of the Society for Neuroscience,0.06,21976509,-1,-1
somatosensory_00502,https://pubmed.ncbi.nlm.nih.gov/22586478/,Musical training induces functional plasticity in perceptual and motor networks:  insights from resting-state FMRI.,"Luo C, Guo ZW, Lai YX, Liao W, Liu Q, Kendrick KM, Yao DZ, Li H",PloS one,0.06,22586478,-1,-1
somatosensory_00503,https://pubmed.ncbi.nlm.nih.gov/22634854/,Common substrate for mental arithmetic and finger representation in the parietal  cortex.,"Andres M, Michaux N, Pesenti M",NeuroImage,0.06,22634854,-1,-1
somatosensory_00504,https://pubmed.ncbi.nlm.nih.gov/23327932/,Reminders of mortality decrease midcingulate activity in response to others' suffering.,"Luo S, Shi Z, Yang X, Wang X, Han S",Social cognitive and affective neuroscience,0.06,23327932,-1,-1
somatosensory_00505,https://pubmed.ncbi.nlm.nih.gov/24788815/,Mapping Small-World Properties through Development in the Human Brain: Disruption in Schizophrenia.,"Tomasi D, Volkow ND",PloS one,0.06,24788815,-1,-1
somatosensory_00506,https://pubmed.ncbi.nlm.nih.gov/27244227/,"Abdominal Pain, the Adolescent and Altered Brain Structure and Function.","Hubbard CS, Becerra L, Heinz N, Ludwick A, Rasooly T, Wu R, Johnson A, Schechter NL, Borsook D, Nurko S",PloS one,0.06,27244227,-1,-1
somatosensory_00507,https://pubmed.ncbi.nlm.nih.gov/27375466/,"Distinct and Overlapping Brain Areas Engaged during Value-Based, Mathematical, and Emotional Decision Processing.","Hsu CW, Goh JO",Frontiers in human neuroscience,0.06,27375466,-1,-1
somatosensory_00508,https://pubmed.ncbi.nlm.nih.gov/27394669/,Cerebral functional deficits in patients with ankylosing spondylitis- an fMRI study.,"Li C, Wei X, Zou Q, Zhang Y, Yin X, Zhao J, Wang J",Brain imaging and behavior,0.06,27394669,-1,-1
somatosensory_00509,https://pubmed.ncbi.nlm.nih.gov/28649490/,Frequency-dependent changes in local intrinsic oscillations in chronic primary insomnia: A study of the amplitude of low-frequency fluctuations in the resting state.,"Zhou F, Huang S, Zhuang Y, Gao L, Gong H",NeuroImage. Clinical,0.06,28649490,-1,-1
somatosensory_00510,https://pubmed.ncbi.nlm.nih.gov/15808988/,Spatial resolution of fMRI in the human parasylvian cortex: comparison of somatosensory and auditory activation.,"Ozcan M, Baumgartner U, Vucurevic G, Stoeter P, Treede RD",NeuroImage,0.059,15808988,-1,-1
somatosensory_00511,https://pubmed.ncbi.nlm.nih.gov/15888606/,The human parietal operculum. II. Stereotaxic maps and correlation with functional imaging results.,"Eickhoff SB, Amunts K, Mohlberg H, Zilles K","Cerebral cortex (New York, N.Y. : 1991)",0.059,15888606,-1,-1
somatosensory_00512,https://pubmed.ncbi.nlm.nih.gov/16908493/,Interactions of pain intensity and cognitive load: the brain stays on task.,"Seminowicz DA, Davis KD","Cerebral cortex (New York, N.Y. : 1991)",0.059,16908493,-1,-1
somatosensory_00513,https://pubmed.ncbi.nlm.nih.gov/17524669/,Neural correlates of perceptual difference between itching and pain: a human fMRI study.,"Mochizuki H, Sadato N, Saito DN, Toyoda H, Tashiro M, Okamura N, Yanai K",NeuroImage,0.059,17524669,-1,-1
somatosensory_00514,https://pubmed.ncbi.nlm.nih.gov/18091986/,What are you feeling? Using functional magnetic resonance imaging to assess the modulation of sensory and affective responses during empathy for pain.,"Lamm C, Nusbaum HC, Meltzoff AN, Decety J",PloS one,0.059,18091986,-1,-1
somatosensory_00515,https://pubmed.ncbi.nlm.nih.gov/18985135/,Age-related differences in brain activity underlying identification of emotional  expressions in faces.,"Keightley ML, Chiew KS, Winocur G, Grady CL",Social cognitive and affective neuroscience,0.059,18985135,-1,-1
somatosensory_00516,https://pubmed.ncbi.nlm.nih.gov/19925191/,Cognitive and motor loops of the human cerebro-cerebellar system.,"Salmi J, Pallesen KJ, Neuvonen T, Brattico E, Korvenoja A, Salonen O, Carlson S",Journal of cognitive neuroscience,0.059,19925191,-1,-1
somatosensory_00517,https://pubmed.ncbi.nlm.nih.gov/23056337/,Levodopa effects on hand and speech movements in patients with Parkinson's disease: a FMRI study.,"Maillet A, Krainik A, Debu B, Tropres I, Lagrange C, Thobois S, Pollak P, Pinto S",PloS one,0.059,23056337,-1,-1
somatosensory_00518,https://pubmed.ncbi.nlm.nih.gov/23121899/,Increased brain responses during subjectively-matched mechanical pain stimulation in fibromyalgia patients as evidenced by MEG.,"Maestu C, Cortes A, Vazquez JM, del Rio D, Gomez-Arguelles JM, del Pozo F, Nevado A",Clinical neurophysiology : official journal of the International Federation of Clinical Neurophysiology,0.059,23121899,10.1016/j.clinph.2012.09.015,-1
somatosensory_00519,https://pubmed.ncbi.nlm.nih.gov/23810975/,From Vivaldi to Beatles and back: predicting lateralized brain responses to music.,"Alluri V, Toiviainen P, Lund TE, Wallentin M, Vuust P, Nandi AK, Ristaniemi T, Brattico E",NeuroImage,0.059,23810975,10.1016/j.neuroimage.2013.06.064,-1
somatosensory_00520,https://pubmed.ncbi.nlm.nih.gov/28496399/,The Effect of Wealth Shocks on Loss Aversion: Behavior and Neural Correlates.,"Pammi VSC, Ruiz S, Lee S, Noussair CN, Sitaram R",Frontiers in neuroscience,0.059,28496399,10.3389/fnins.2017.00237,-1
somatosensory_00521,https://pubmed.ncbi.nlm.nih.gov/28729830/,Resting-State Fluctuations of EEG Sensorimotor Rhythm Reflect BOLD Activities in  the Pericentral Areas: A Simultaneous EEG-fMRI Study.,"Tsuchimoto S, Shibusawa S, Mizuguchi N, Kato K, Ebata H, Liu M, Hanakawa T, Ushiba J",Frontiers in human neuroscience,0.059,28729830,-1,-1
somatosensory_00522,https://pubmed.ncbi.nlm.nih.gov/29375341/,Functional Connectivity Alterations between Networks and Associations with Infant Immune Health within Networks in HIV Infected Children on Early Treatment: A Study at 7 Years.,"Toich JTF, Taylor PA, Holmes MJ, Gohel S, Cotton MF, Dobbels E, Laughton B, Little F, van der Kouwe AJW, Biswal B, Meintjes EM",Frontiers in human neuroscience,0.059,29375341,-1,-1
somatosensory_00523,https://pubmed.ncbi.nlm.nih.gov/12880826/,The single-epoch fMRI design: validation of a simplified paradigm for the collection of subjective ratings.,"Koyama T, McHaffie JG, Laurienti PJ, Coghill RC",NeuroImage,0.058,12880826,-1,-1
somatosensory_00524,https://pubmed.ncbi.nlm.nih.gov/16951408/,Pain sensitivity and fMRI pain-related brain activity in Alzheimer's disease.,"Cole LJ, Farrell MJ, Duff EP, Barber JB, Egan GF, Gibson SJ",Brain : a journal of neurology,0.058,16951408,-1,-1
somatosensory_00525,https://pubmed.ncbi.nlm.nih.gov/18476766/,Cortical activation patterns during long-term memory retrieval of visually or haptically encoded objects and locations.,"Stock O, Roder B, Burke M, Bien S, Rosler F",Journal of cognitive neuroscience,0.058,18476766,-1,-1
somatosensory_00526,https://pubmed.ncbi.nlm.nih.gov/19150520/,Decomposing interference during Stroop performance into different conflict factors: an event-related fMRI study.,"Melcher T, Gruber O",Cortex; a journal devoted to the study of the nervous system and behavior,0.058,19150520,-1,-1
somatosensory_00527,https://pubmed.ncbi.nlm.nih.gov/21741301/,Effect of median-nerve electrical stimulation on BOLD activity in acute ischemic  stroke patients.,"Manganotti P, Storti SF, Formaggio E, Acler M, Zoccatelli G, Pizzini FB, Alessandrini F, Bertoldo A, Toffolo GM, Bovi P, Beltramello A, Moretto G, Fiaschi A",Clinical neurophysiology : official journal of the International Federation of Clinical Neurophysiology,0.058,21741301,-1,-1
somatosensory_00528,https://pubmed.ncbi.nlm.nih.gov/21963911/,Neuronal network coherent with hand kinematics during fast repetitive hand movements.,"Bourguignon M, Jousmaki V, Op de Beeck M, Van Bogaert P, Goldman S, De Tiege X",NeuroImage,0.058,21963911,-1,-1
somatosensory_00529,https://pubmed.ncbi.nlm.nih.gov/22815523/,Multilocus genetic composite reflecting dopamine signaling capacity predicts reward circuitry responsivity.,"Stice E, Yokum S, Burger K, Epstein L, Smolen A",The Journal of neuroscience : the official journal of the Society for Neuroscience,0.058,22815523,-1,-1
somatosensory_00530,https://pubmed.ncbi.nlm.nih.gov/23528204/,The role of circulating sex hormones in menstrual cycle-dependent modulation of pain-related brain activation.,"Veldhuijzen DS, Keaser ML, Traub DS, Zhuo J, Gullapalli RP, Greenspan JD",Pain,0.058,23528204,-1,-1
somatosensory_00531,https://pubmed.ncbi.nlm.nih.gov/23752177/,Deficient modulation of pain by a positive emotional context in fibromyalgia patients.,"Kamping S, Bomba IC, Kanske P, Diesch E, Flor H",Pain,0.058,23752177,-1,-1
somatosensory_00532,https://pubmed.ncbi.nlm.nih.gov/26173182/,Neural correlates of self-injurious behavior in Prader-Willi syndrome.,"Klabunde M, Saggar M, Hustyi KM, Hammond JL, Reiss AL, Hall SS",Human brain mapping,0.058,26173182,-1,-1
somatosensory_00533,https://pubmed.ncbi.nlm.nih.gov/27175777/,Brain Structural Correlates of Emotion Recognition in Psychopaths.,"Pera-Guardiola V, Contreras-Rodriguez O, Batalla I, Kosson D, Menchon JM, Pifarre J, Bosque J, Cardoner N, Soriano-Mas C",PloS one,0.058,27175777,-1,-1
somatosensory_00534,https://pubmed.ncbi.nlm.nih.gov/14642491/,The musician's brain: functional imaging of amateurs and professionals during performance and imagery.,"Lotze M, Scheler G, Tan H-RM, Braun C, Birbaumer N",NeuroImage,0.057,14642491,-1,-1
somatosensory_00535,https://pubmed.ncbi.nlm.nih.gov/15953559/,"Functional magnetic resonance imaging and transcranial magnetic stimulation: effects of motor imagery, movement and coil orientation.","Niyazov DM, Butler AJ, Kadah YM, Epstein CM, Hu XP",Clinical neurophysiology : official journal of the International Federation of Clinical Neurophysiology,0.057,15953559,-1,-1
somatosensory_00536,https://pubmed.ncbi.nlm.nih.gov/17032710/,The somatotopic organization of cytoarchitectonic areas on the human parietal operculum.,"Eickhoff SB, Grefkes C, Zilles K, Fink GR","Cerebral cortex (New York, N.Y. : 1991)",0.057,17032710,-1,-1
somatosensory_00537,https://pubmed.ncbi.nlm.nih.gov/17275792/,The effect of task-relevance on primary somatosensory cortex during continuous sensory-guided movement in the presence of bimodal competition.,"Meehan SK, Staines WR",Brain research,0.057,17275792,-1,-1
somatosensory_00538,https://pubmed.ncbi.nlm.nih.gov/19027077/,Brain activity associated with the electrodermal reactivity to acute heat pain.,"Dube AA, Duquette M, Roy M, Lepore F, Duncan G, Rainville P",NeuroImage,0.057,19027077,-1,-1
somatosensory_00539,https://pubmed.ncbi.nlm.nih.gov/22576840/,The neural substrate for working memory of tactile surface texture.,"Kaas AL, van Mier H, Visser M, Goebel R",Human brain mapping,0.057,22576840,-1,-1
somatosensory_00540,https://pubmed.ncbi.nlm.nih.gov/22890475/,Sensory modality of smoking cues modulates neural cue reactivity.,"Yalachkov Y, Kaiser J, Gorres A, Seehaus A, Naumer MJ",Psychopharmacology,0.057,22890475,-1,-1
somatosensory_00541,https://pubmed.ncbi.nlm.nih.gov/25465122/,"Once you feel it, you see it: Insula and sensory-motor contribution to visual awareness for fearful bodies in parietal neglect.","Tamietto M, Cauda F, Celeghin A, Diano M, Costa T, Cossa FM, Sacco K, Duca S, Geminiani GC, de Gelder B",Cortex; a journal devoted to the study of the nervous system and behavior,0.057,25465122,-1,-1
somatosensory_00542,https://pubmed.ncbi.nlm.nih.gov/26019123/,Co-activated yet disconnected-Neural correlates of eye closures when trying to stay awake.,"Ong JL, Kong D, Chia TT, Tandi J, Thomas Yeo BT, Chee MW",NeuroImage,0.057,26019123,-1,-1
somatosensory_00543,https://pubmed.ncbi.nlm.nih.gov/26673114/,The origins of metamodality in visual object area LO: Bodily topographical biases and increased functional connectivity to S1.,"Tal Z, Geva R, Amedi A",NeuroImage,0.057,26673114,-1,-1
somatosensory_00544,https://pubmed.ncbi.nlm.nih.gov/28139959/,Inside Speech: Multisensory and Modality-specific Processing of Tongue and Lip Speech Actions.,"Treille A, Vilain C, Hueber T, Lamalle L, Sato M",Journal of cognitive neuroscience,0.057,28139959,-1,-1
somatosensory_00545,https://pubmed.ncbi.nlm.nih.gov/29334647/,Time-resolved decoding of planned delayed and immediate prehension movements.,"Ariani G, Oosterhof NN, Lingnau A",Cortex; a journal devoted to the study of the nervous system and behavior,0.057,29334647,-1,-1
somatosensory_00546,https://pubmed.ncbi.nlm.nih.gov/16038681/,Neural networks of information processing in posttraumatic stress disorder: a functional magnetic resonance imaging study.,"Bryant RA, Felmingham KL, Kemp AH, Barton M, Peduto AS, Rennie C, Gordon E, Williams LM",Biological psychiatry,0.056,16038681,-1,-1
somatosensory_00547,https://pubmed.ncbi.nlm.nih.gov/17533167/,Whole brain functional connectivity in the early blind.,"Liu Y, Yu C, Liang M, Li J, Tian L, Zhou Y, Qin W, Li K, Jiang T",Brain : a journal of neurology,0.056,17533167,-1,-1
somatosensory_00548,https://pubmed.ncbi.nlm.nih.gov/18573266/,Who caused the pain? An fMRI investigation of empathy and intentionality in children.,"Decety J, Michalska KJ, Akitsuki Y",Neuropsychologia,0.056,18573266,-1,-1
somatosensory_00549,https://pubmed.ncbi.nlm.nih.gov/21126990/,Gait-related cerebral alterations in patients with Parkinson's disease with freezing of gait.,"Snijders AH, Leunissen I, Bakker M, Overeem S, Helmich RC, Bloem BR, Toni I",Brain : a journal of neurology,0.056,21126990,-1,-1
somatosensory_00550,https://pubmed.ncbi.nlm.nih.gov/21375601/,A multicentre study of motor functional connectivity changes in patients with multiple sclerosis.,"Valsasina P, Rocca MA, Absinta M, Sormani MP, Mancini L, De Stefano N, Rovira A, Gass A, Enzinger C, Barkhof F, Wegner C, Matthews PM, Filippi M",The European journal of neuroscience,0.056,21375601,-1,-1
somatosensory_00551,https://pubmed.ncbi.nlm.nih.gov/22522975/,fMRI evidence of degeneration-induced neuropathic pain in diabetes: enhanced limbic and striatal activations.,"Tseng MT, Chiang MC, Chao CC, Tseng WY, Hsieh ST",Human brain mapping,0.056,22522975,-1,-1
somatosensory_00552,https://pubmed.ncbi.nlm.nih.gov/23576811/,Relation of obesity to neural activation in response to food commercials.,"Gearhardt AN, Yokum S, Stice E, Harris JL, Brownell KD",Social cognitive and affective neuroscience,0.056,23576811,-1,-1
somatosensory_00553,https://pubmed.ncbi.nlm.nih.gov/29453959/,Indices of repetitive behaviour are correlated with patterns of intrinsic functional connectivity in youth with autism spectrum disorder.,"Traynor JM, Doyle-Thomas KAR, Hanford LC, Foster NE, Tryfon A, Hyde KL, Anagnostou E, Evans AC, Zwaigenbaum L, Hall GBC",Brain research,0.056,29453959,-1,-1
somatosensory_00554,https://pubmed.ncbi.nlm.nih.gov/12763188/,Tactile-visual cross-modal shape matching: a functional MRI study.,"Saito DN, Okada T, Morita Y, Yonekura Y, Sadato N",Brain research. Cognitive brain research,0.055,12763188,-1,-1
somatosensory_00555,https://pubmed.ncbi.nlm.nih.gov/15955481/,Functional MRI of galvanic vestibular stimulation with alternating currents at different frequencies.,"Stephan T, Deutschlander A, Nolte A, Schneider E, Wiesmann M, Brandt T, Dieterich M",NeuroImage,0.055,15955481,-1,-1
somatosensory_00556,https://pubmed.ncbi.nlm.nih.gov/17095251/,"Cerebral correlates of the ""Kohnstamm phenomenon"": an fMRI study.","Duclos C, Roll R, Kavounoudias A, Roll JP",NeuroImage,0.055,17095251,-1,-1
somatosensory_00557,https://pubmed.ncbi.nlm.nih.gov/18515150/,Sensory stimulation activates both motor and sensory components of the swallowing system.,"Lowell SY, Poletto CJ, Knorr-Chung BR, Reynolds RC, Simonyan K, Ludlow CL",NeuroImage,0.055,18515150,-1,-1
somatosensory_00558,https://pubmed.ncbi.nlm.nih.gov/22516588/,Cortical thickness correlates of pain and temperature sensitivity.,"Erpelding N, Moayedi M, Davis KD",Pain,0.055,22516588,-1,-1
somatosensory_00559,https://pubmed.ncbi.nlm.nih.gov/22518017/,Multisensory interactions between auditory and haptic object recognition.,"Kassuba T, Menz MM, Roder B, Siebner HR","Cerebral cortex (New York, N.Y. : 1991)",0.055,22518017,-1,-1
