paper_name,paper_url,Title,Author,Journal,Loading,PMID,Doi,download_status
somatosensory_00374,https://pubmed.ncbi.nlm.nih.gov/21126587/,Activation of central sympathetic networks during innocuous and noxious somatosensory stimulation.,"Maihofner C, Seifert F, Decol R",NeuroImage,0.072,21126587,-1,-1
somatosensory_00375,https://pubmed.ncbi.nlm.nih.gov/21681856/,Separating brain processing of pain from that of stimulus intensity.,"Oertel BG, Preibisch C, Martin T, Walter C, Gamer M, Deichmann R, Lotsch J",Human brain mapping,0.072,21681856,-1,-1
somatosensory_00376,https://pubmed.ncbi.nlm.nih.gov/23691237/,Altered hub configurations within default mode network following acupuncture at ST36: a multimodal investigation combining fMRI and MEG.,"You Y, Bai L, Dai R, Cheng H, Liu Z, Wei W, Tian J",PloS one,0.072,23691237,-1,-1
somatosensory_00377,https://pubmed.ncbi.nlm.nih.gov/25044473/,Sequential evolution of cortical activity and effective connectivity of swallowing using fMRI.,"Mihai PG, Otto M, Platz T, Eickhoff SB, Lotze AM",Human brain mapping,0.072,25044473,-1,-1
somatosensory_00378,https://pubmed.ncbi.nlm.nih.gov/29385142/,The auditory cortex hosts network nodes influential for emotion processing: An fMRI study on music-evoked fear and joy.,"Koelsch S, Skouras S, Lohmann G",PloS one,0.072,29385142,-1,-1
somatosensory_00379,https://pubmed.ncbi.nlm.nih.gov/16140345/,Empathy examined through the neural mechanisms involved in imagining how I feel versus how you feel pain.,"Jackson PL, Brunet E, Meltzoff AN, Decety J",Neuropsychologia,0.071,16140345,-1,-1
somatosensory_00380,https://pubmed.ncbi.nlm.nih.gov/16672666/,Perceptual knowledge retrieval activates sensory brain regions.,"Goldberg RF, Perfetti CA, Schneider W",The Journal of neuroscience : the official journal of the Society for Neuroscience,0.071,16672666,-1,-1
somatosensory_00381,https://pubmed.ncbi.nlm.nih.gov/17928451/,Posteromedial parietal cortical activity and inputs predict tactile spatial acuity.,"Stilla R, Deshpande G, LaConte S, Hu X, Sathian K",The Journal of neuroscience : the official journal of the Society for Neuroscience,0.071,17928451,-1,-1
somatosensory_00382,https://pubmed.ncbi.nlm.nih.gov/18234508/,Neural codes for somatosensory two-point discrimination in inferior parietal lobule: an fMRI study.,"Akatsuka K, Noguchi Y, Harada T, Sadato N, Kakigi R",NeuroImage,0.071,18234508,-1,-1
somatosensory_00383,https://pubmed.ncbi.nlm.nih.gov/18448452/,The human dorsal action control system develops in the absence of vision.,"Fiehler K, Burke M, Bien S, Roder B, Rosler F","Cerebral cortex (New York, N.Y. : 1991)",0.071,18448452,-1,-1
somatosensory_00384,https://pubmed.ncbi.nlm.nih.gov/18571795/,The salient characteristics of the central effects of acupuncture needling: limbic-paralimbic-neocortical network modulation.,"Fang J, Jin Z, Wang Y, Li K, Kong J, Nixon EE, Zeng Y, Ren Y, Tong H, Wang Y, Wang P, Hui KK",Human brain mapping,0.071,18571795,-1,-1
somatosensory_00385,https://pubmed.ncbi.nlm.nih.gov/19837177/,The integration of large-scale neural network modeling and functional brain imaging in speech motor control.,"Golfinopoulos E, Tourville JA, Guenther FH",NeuroImage,0.071,19837177,-1,-1
somatosensory_00386,https://pubmed.ncbi.nlm.nih.gov/20079443/,Visual guidance modulates hemispheric asymmetries during an interlimb coordination task.,"Woolley DG, Wenderoth N, Heuninckx S, Zhang X, Callaert D, Swinnen SP",NeuroImage,0.071,20079443,-1,-1
somatosensory_00387,https://pubmed.ncbi.nlm.nih.gov/20206641/,Altered connectivity between prefrontal and sensorimotor cortex in conversion paralysis.,"de Lange FP, Toni I, Roelofs K",Neuropsychologia,0.071,20206641,-1,-1
somatosensory_00388,https://pubmed.ncbi.nlm.nih.gov/21903460/,Cortical pattern of complex but not simple movements is affected in writer's cramp: a parametric event-related fMRI study.,"Havrankova P, Walker ND, Operto G, Sieger T, Vymazal J, Jech R",Clinical neurophysiology : official journal of the International Federation of Clinical Neurophysiology,0.071,21903460,-1,-1
somatosensory_00389,https://pubmed.ncbi.nlm.nih.gov/22154332/,Sex similarities and differences in pain-related periaqueductal gray connectivity.,"Linnman C, Beucke JC, Jensen KB, Gollub RL, Kong J",Pain,0.071,22154332,-1,-1
somatosensory_00390,https://pubmed.ncbi.nlm.nih.gov/10899227/,Segregation of somatosensory activation in the human rolandic cortex using fMRI.,"Moore CI, Stern CE, Corkin S, Fischl B, Gray AC, Rosen BR, Dale AM",Journal of neurophysiology,0.07,10899227,-1,-1
somatosensory_00391,https://pubmed.ncbi.nlm.nih.gov/12390981/,Changes of non-affected upper limb cortical representation in paraplegic patients as assessed by fMRI.,"Curt A, Alkadhi H, Crelier GR, Boendermaker SH, Hepp-Reymond MC, Kollias SS",Brain : a journal of neurology,0.07,12390981,10.1093/brain/awf250,-1
somatosensory_00392,https://pubmed.ncbi.nlm.nih.gov/15050561/,Awareness of muscular force during movement production: an fMRI study.,"de Graaf JB, Gallea C, Pailhous J, Anton JL, Roth M, Bonnard M",NeuroImage,0.07,15050561,10.1016/j.neuroimage.2003.11.009,-1
somatosensory_00393,https://pubmed.ncbi.nlm.nih.gov/15381748/,Changing brain networks for visuomotor control with increased movement automaticity.,"Floyer-Lea A, Matthews PM",Journal of neurophysiology,0.07,15381748,-1,-1
somatosensory_00394,https://pubmed.ncbi.nlm.nih.gov/17525980/,Altered functional connectivity of primary visual cortex in early blindness.,"Yu C, Liu Y, Li J, Zhou Y, Wang K, Tian L, Qin W, Jiang T, Li K",Human brain mapping,0.07,17525980,-1,-1
somatosensory_00395,https://pubmed.ncbi.nlm.nih.gov/20188768/,Performance degradation and altered cerebral activation during dual performance:  evidence for a bottom-up attentional system.,"Gazes Y, Rakitin BC, Steffener J, Habeck C, Butterfield B, Ghez C, Stern Y",Behavioural brain research,0.07,20188768,-1,-1
somatosensory_00396,https://pubmed.ncbi.nlm.nih.gov/22113948/,Writer's cramp: increased dorsal premotor activity during intended writing.,"Delnooz CC, Helmich RC, Medendorp WP, Van de Warrenburg BP, Toni I",Human brain mapping,0.07,22113948,-1,-1
somatosensory_00397,https://pubmed.ncbi.nlm.nih.gov/25044884/,Evoked effective connectivity of the human neocortex.,"Entz L, Toth E, Keller CJ, Bickel S, Groppe DM, Fabo D, Kozak LR, Eross L, Ulbert I, Mehta AD",Human brain mapping,0.07,25044884,-1,-1
somatosensory_00398,https://pubmed.ncbi.nlm.nih.gov/25553620/,A selective involvement of putamen functional connectivity in youth with internet gaming disorder.,"Hong SB, Harrison BJ, Dandash O, Choi EJ, Kim SC, Kim HH, Shim DH, Kim CD, Kim JW, Yi SH",Brain research,0.07,25553620,-1,-1
somatosensory_00399,https://pubmed.ncbi.nlm.nih.gov/26781484/,Preliminary findings of cerebral responses on transcutaneous vagal nerve stimulation on experimental heat pain.,"Usichenko T, Laqua R, Leutzow B, Lotze M",Brain imaging and behavior,0.07,26781484,-1,-1
somatosensory_00400,https://pubmed.ncbi.nlm.nih.gov/11110829/,Learning- and expectation-related changes in the human brain during motor learning.,"Ramnani N, Toni I, Josephs O, Ashburner J, Passingham RE",Journal of neurophysiology,0.069,11110829,-1,-1
somatosensory_00401,https://pubmed.ncbi.nlm.nih.gov/17138596/,Neural signatures of body ownership: a sensory network for bodily self-consciousness.,"Tsakiris M, Hesse MD, Boy C, Haggard P, Fink GR","Cerebral cortex (New York, N.Y. : 1991)",0.069,17138596,-1,-1
somatosensory_00402,https://pubmed.ncbi.nlm.nih.gov/17451973/,Central control of grasp: manipulation of objects with complex and simple dynamics.,"Milner TE, Franklin DW, Imamizu H, Kawato M",NeuroImage,0.069,17451973,-1,-1
somatosensory_00403,https://pubmed.ncbi.nlm.nih.gov/17767511/,Brain imaging of analgesic and antihyperalgesic effects of cyclooxygenase inhibition in an experimental human pain model: a functional MRI study.,"Maihofner C, Ringler R, Herrndobler F, Koppert W",The European journal of neuroscience,0.069,17767511,-1,-1
somatosensory_00404,https://pubmed.ncbi.nlm.nih.gov/21591025/,Interaction of electrical stimulation and voluntary hand movement in SII and the  cerebellum during simulated therapeutic functional electrical stimulation in healthy adults.,"Iftime-Nielsen SD, Christensen MS, Vingborg RJ, Sinkjaer T, Roepstorff A, Grey MJ",Human brain mapping,0.069,21591025,-1,-1
somatosensory_00405,https://pubmed.ncbi.nlm.nih.gov/21955457/,Diffusion tensor imaging in Alzheimer's disease and dementia with Lewy bodies.,"Firbank MJ, Blamire AM, Teodorczuk A, Teper E, Mitra D, O'Brien JT",Psychiatry research,0.069,21955457,-1,-1
somatosensory_00406,https://pubmed.ncbi.nlm.nih.gov/23677490/,Impaired inhibitory control in anorexia nervosa elicited by physical activity stimuli.,"Kullmann S, Giel KE, Hu X, Bischoff SC, Teufel M, Thiel A, Zipfel S, Preissl H",Social cognitive and affective neuroscience,0.069,23677490,-1,-1
somatosensory_00407,https://pubmed.ncbi.nlm.nih.gov/24185016/,The extrastriate body area is involved in illusory limb ownership.,"Limanowski J, Lutti A, Blankenburg F",NeuroImage,0.069,24185016,-1,-1
somatosensory_00408,https://pubmed.ncbi.nlm.nih.gov/12429600/,Correlation between motor improvements and altered fMRI activity after rehabilitative therapy.,"Johansen-Berg H, Dawes H, Guy C, Smith SM, Wade DT, Matthews PM",Brain : a journal of neurology,0.068,12429600,-1,-1
somatosensory_00409,https://pubmed.ncbi.nlm.nih.gov/15588604/,Common cortical network for first and second pain.,"Forss N, Raij TT, Seppa M, Hari R",NeuroImage,0.068,15588604,-1,-1
somatosensory_00410,https://pubmed.ncbi.nlm.nih.gov/18950717/,"fMRI analysis of active, passive and electrically stimulated ankle dorsiflexion.","Francis S, Lin X, Aboushoushah S, White TP, Phillips M, Bowtell R, Constantinescu CS",NeuroImage,0.068,18950717,-1,-1
somatosensory_00411,https://pubmed.ncbi.nlm.nih.gov/19439183/,Social context and perceived agency affects empathy for pain: an event-related fMRI investigation.,"Akitsuki Y, Decety J",NeuroImage,0.068,19439183,10.1016/j.neuroimage.2009.04.091,-1
somatosensory_00412,https://pubmed.ncbi.nlm.nih.gov/19572308/,Crossmodal influences in somatosensory cortex: Interaction of vision and touch.,"Dionne JK, Meehan SK, Legon W, Staines WR",Human brain mapping,0.068,19572308,10.1002/hbm.20841,-1
somatosensory_00413,https://pubmed.ncbi.nlm.nih.gov/20975836/,Granger causality mapping during joint actions reveals evidence for forward models that could overcome sensory-motor delays.,"Kokal I, Keysers C",PloS one,0.068,20975836,10.1371/journal.pone.0013507,-1
somatosensory_00414,https://pubmed.ncbi.nlm.nih.gov/21438078/,"Staying responsive to the world: modality-specific and -nonspecific contributions to speeded auditory, tactile, and visual stimulus detection.","Langner R, Kellermann T, Eickhoff SB, Boers F, Chatterjee A, Willmes K, Sturm W",Human brain mapping,0.068,21438078,-1,-1
somatosensory_00415,https://pubmed.ncbi.nlm.nih.gov/22819967/,Anatomical and functional enhancements of the insula after loss of large primary  somatosensory fibers.,"Ceko M, Seminowicz DA, Bushnell MC, Olausson HW","Cerebral cortex (New York, N.Y. : 1991)",0.068,22819967,-1,-1
somatosensory_00416,https://pubmed.ncbi.nlm.nih.gov/24904391/,Imaging the where and when of tic generation and resting state networks in adult  Tourette patients.,"Neuner I, Werner CJ, Arrubla J, Stocker T, Ehlen C, Wegener HP, Schneider F, Shah NJ",Frontiers in human neuroscience,0.068,24904391,-1,-1
somatosensory_00417,https://pubmed.ncbi.nlm.nih.gov/25191704/,Quantifying the reconfiguration of intrinsic networks during working memory.,"Cohen JR, Gallen CL, Jacobs EG, Lee TG, D'Esposito M",PloS one,0.068,25191704,-1,-1
somatosensory_00418,https://pubmed.ncbi.nlm.nih.gov/26351989/,Shared and Distinct Neuroanatomic Regions Critical for Tool-related Action Production and Recognition: Evidence from 131 Left-hemisphere Stroke Patients.,"Tarhan LY, Watson CE, Buxbaum LJ",Journal of cognitive neuroscience,0.068,26351989,-1,-1
somatosensory_00419,https://pubmed.ncbi.nlm.nih.gov/26493637/,Disrupted sensorimotor and social-cognitive networks underlie symptoms in childhood-onset schizophrenia.,"Berman RA, Gotts SJ, McAdams HM, Greenstein D, Lalonde F, Clasen L, Watsky RE, Shora L, Ordonez AE, Raznahan A, Martin A, Gogtay N, Rapoport J",Brain : a journal of neurology,0.068,26493637,-1,-1
somatosensory_00420,https://pubmed.ncbi.nlm.nih.gov/27134038/,Neural activity related to discrimination and vocal production of consonant and dissonant musical intervals.,"Gonzalez-Garcia N, Gonzalez MA, Rendon PL",Brain research,0.068,27134038,-1,-1
somatosensory_00421,https://pubmed.ncbi.nlm.nih.gov/15182316/,Neural correlates of error detection and error correction: is there a common neuroanatomical substrate?,"Fiehler K, Ullsperger M, von Cramon DY",The European journal of neuroscience,0.067,15182316,-1,-1
somatosensory_00422,https://pubmed.ncbi.nlm.nih.gov/16368192/,A PET activation study of brush-evoked allodynia in patients with nerve injury pain.,"Witting N, Kupers RC, Svensson P, Jensen TS",Pain,0.067,16368192,-1,-1
somatosensory_00423,https://pubmed.ncbi.nlm.nih.gov/16943559/,Lighter or heavier than predicted: neural correlates of corrective mechanisms during erroneously programmed lifts.,"Jenmalm P, Schmitz C, Forssberg H, Ehrsson HH",The Journal of neuroscience : the official journal of the Society for Neuroscience,0.067,16943559,-1,-1
somatosensory_00424,https://pubmed.ncbi.nlm.nih.gov/18337009/,Acupuncture modulates resting state connectivity in default and sensorimotor brain networks.,"Dhond RP, Yeh C, Park K, Kettner N, Napadow V",Pain,0.067,18337009,-1,-1
somatosensory_00425,https://pubmed.ncbi.nlm.nih.gov/20082331/,"The neural control of bimanual movements in the elderly: Brain regions exhibiting age-related increases in activity, frequency-induced neural modulation, and task-specific compensatory recruitment.","Goble DJ, Coxon JP, Van Impe A, De Vos J, Wenderoth N, Swinnen SP",Human brain mapping,0.067,20082331,-1,-1
somatosensory_00426,https://pubmed.ncbi.nlm.nih.gov/20674749/,A Monte Carlo method for locally multivariate brain mapping.,"Bjornsdotter M, Rylander K, Wessberg J",NeuroImage,0.067,20674749,-1,-1
somatosensory_00427,https://pubmed.ncbi.nlm.nih.gov/22611041/,Mechanical flutter stimulation induces a lasting response in the sensorimotor cortex as revealed with BOLD fMRI.,"Christova M, Golaszewski S, Ischebeck A, Kunz A, Rafolt D, Nardone R, Gallasch E",Human brain mapping,0.067,22611041,-1,-1
somatosensory_00428,https://pubmed.ncbi.nlm.nih.gov/22918979/,Changes in sensory hand representation and pain thresholds induced by motor cortex stimulation in humans.,"Houze B, Bradley C, Magnin M, Garcia-Larrea L","Cerebral cortex (New York, N.Y. : 1991)",0.067,22918979,-1,-1
somatosensory_00429,https://pubmed.ncbi.nlm.nih.gov/23450833/,Differences in cortical coding of heat evoked pain beyond the perceived intensity: an fMRI and EEG study.,"Haefeli J, Freund P, Kramer JL, Blum J, Luechinger R, Curt A",Human brain mapping,0.067,23450833,-1,-1
somatosensory_00430,https://pubmed.ncbi.nlm.nih.gov/24478649/,The neural correlates of risk propensity in males and females using resting-state fMRI.,"Zhou Y, Li S, Dunn J, Li H, Qin W, Zhu M, Rao LL, Song M, Yu C, Jiang T",Frontiers in behavioral neuroscience,0.067,24478649,-1,-1
somatosensory_00431,https://pubmed.ncbi.nlm.nih.gov/27242409/,Altered Brain Network in Amyotrophic Lateral Sclerosis: A Resting Graph Theory-Based Network Study at Voxel-Wise Level.,"Zhou C, Hu X, Hu J, Liang M, Yin X, Chen L, Zhang J, Wang J",Frontiers in neuroscience,0.067,27242409,10.3389/fnins.2016.00204,-1
somatosensory_00432,https://pubmed.ncbi.nlm.nih.gov/28692702/,Impaired insula functional connectivity associated with persistent pain perception in patients with complex regional pain syndrome.,"Kim JH, Choi SH, Jang JH, Lee DH, Lee KJ, Lee WJ, Moon JY, Kim YC, Kang DH",PloS one,0.067,28692702,10.1371/journal.pone.0180479,-1
somatosensory_00433,https://pubmed.ncbi.nlm.nih.gov/16033888/,Neural basis of aging: the penetration of cognition into action control.,"Heuninckx S, Wenderoth N, Debaere F, Peeters R, Swinnen SP",The Journal of neuroscience : the official journal of the Society for Neuroscience,0.066,16033888,-1,-1
somatosensory_00434,https://pubmed.ncbi.nlm.nih.gov/17990299/,Functional neuroanatomical investigation of vision-related acupuncture point specificity--a multisession fMRI study.,"Kong J, Kaptchuk TJ, Webb JM, Kong JT, Sasaki Y, Polich GR, Vangel MG, Kwong K, Rosen B, Gollub RL",Human brain mapping,0.066,17990299,-1,-1
somatosensory_00435,https://pubmed.ncbi.nlm.nih.gov/18567624/,"Phantom limb pain, cortical reorganization and the therapeutic effect of mental imagery.","MacIver K, Lloyd DM, Kelly S, Roberts N, Nurmikko T",Brain : a journal of neurology,0.066,18567624,-1,-1
somatosensory_00436,https://pubmed.ncbi.nlm.nih.gov/20471751/,Cerebral processing of pain in school-aged children with neonatal nociceptive input: an exploratory fMRI study.,"Hohmeister J, Kroll A, Wollgarten-Hadamek I, Zohsel K, Demirakca S, Flor H, Hermann C",Pain,0.066,20471751,-1,-1
somatosensory_00437,https://pubmed.ncbi.nlm.nih.gov/22876229/,Task-dependent neural bases of perceiving emotionally expressive targets.,"Zaki J, Weber J, Ochsner K",Frontiers in human neuroscience,0.066,22876229,-1,-1
somatosensory_00438,https://pubmed.ncbi.nlm.nih.gov/23516304/,Neural changes with tactile learning reflect decision-level reweighting of perceptual readout.,"Sathian K, Deshpande G, Stilla R",The Journal of neuroscience : the official journal of the Society for Neuroscience,0.066,23516304,-1,-1
somatosensory_00439,https://pubmed.ncbi.nlm.nih.gov/23800791/,"Interoceptive and multimodal functions of the operculo-insular cortex: tactile, nociceptive and vestibular representations.","zu Eulenburg P, Baumgartner U, Treede RD, Dieterich M",NeuroImage,0.066,23800791,-1,-1
somatosensory_00440,https://pubmed.ncbi.nlm.nih.gov/24650596/,Overlapping representations for grip type and reach direction.,"Fabbri S, Strnad L, Caramazza A, Lingnau A",NeuroImage,0.066,24650596,-1,-1
somatosensory_00441,https://pubmed.ncbi.nlm.nih.gov/24718725/,A reliability study on brain activation during active and passive arm movements supported by an MRI-compatible robot.,"Estevez N, Yu N, Brugger M, Villiger M, Hepp-Reymond MC, Riener R, Kollias S",Brain topography,0.066,24718725,-1,-1
somatosensory_00442,https://pubmed.ncbi.nlm.nih.gov/26693398/,Neural correlates of abnormal sensory discrimination in laryngeal dystonia.,"Termsarasab P, Ramdhani RA, Battistella G, Rubien-Thomas E, Choy M, Farwell IM, Velickovic M, Blitzer A, Frucht SJ, Reilly RB, Hutchinson M, Ozelius LJ, Simonyan K",NeuroImage. Clinical,0.066,26693398,-1,-1
somatosensory_00443,https://pubmed.ncbi.nlm.nih.gov/26904405/,Transdiagnostic commonalities and differences in resting state functional connectivity of the default mode network in schizophrenia and major depression.,"Schilbach L, Hoffstaedter F, Muller V, Cieslik EC, Goya-Maldonado R, Trost S, Sorg C, Riedl V, Jardri R, Sommer I, Kogler L, Derntl B, Gruber O, Eickhoff SB",NeuroImage. Clinical,0.066,26904405,-1,-1
somatosensory_00444,https://pubmed.ncbi.nlm.nih.gov/14642473/,Functional topography of the secondary somatosensory cortex for nonpainful and painful stimuli: an fMRI study.,"Ferretti A, Babiloni C, Gratta CD, Caulo M, Tartaro A, Bonomo L, Rossini PM, Romani GL",NeuroImage,0.065,14642473,-1,-1
somatosensory_00445,https://pubmed.ncbi.nlm.nih.gov/16679031/,An fMRI study of cerebral processing of brush-evoked allodynia in neuropathic pain patients.,"Schweinhardt P, Glynn C, Brooks J, McQuay H, Jack T, Chessell I, Bountra C, Tracey I",NeuroImage,0.065,16679031,-1,-1
somatosensory_00446,https://pubmed.ncbi.nlm.nih.gov/21377494/,Unconditioned responses and functional fear networks in human classical conditioning.,"Linnman C, Rougemont-Bucking A, Beucke JC, Zeffiro TA, Milad MR",Behavioural brain research,0.065,21377494,-1,-1
somatosensory_00447,https://pubmed.ncbi.nlm.nih.gov/22609273/,fMRI-activation during drawing a naturalistic or sketchy portrait.,"Schaer K, Jahn G, Lotze M",Behavioural brain research,0.065,22609273,-1,-1
somatosensory_00448,https://pubmed.ncbi.nlm.nih.gov/22438199/,Brain activity during sympathetic response in anticipation and experience of pain.,"Seifert F, Schuberth N, De Col R, Peltz E, Nickel FT, Maihofner C",Human brain mapping,0.065,22438199,-1,-1
somatosensory_00449,https://pubmed.ncbi.nlm.nih.gov/12667851/,Single trial fMRI reveals significant contralateral bias in responses to laser pain within thalamus and somatosensory cortices.,"Bingel U, Quante M, Knab R, Bromm B, Weiller C, Buchel C",NeuroImage,0.064,12667851,-1,-1
somatosensory_00450,https://pubmed.ncbi.nlm.nih.gov/15993767/,"Distinct fMRI responses to laughter, speech, and sounds along the human peri-sylvian cortex.","Meyer M, Zysset S, von Cramon DY, Alter K",Brain research. Cognitive brain research,0.064,15993767,-1,-1
somatosensory_00451,https://pubmed.ncbi.nlm.nih.gov/16855007/,Inner experience of pain: imagination of pain while viewing images showing painful events forms subjective pain representation in human brain.,"Ogino Y, Nemoto H, Inui K, Saito S, Kakigi R, Goto F","Cerebral cortex (New York, N.Y. : 1991)",0.064,16855007,10.1093/cercor/bhl023,-1
somatosensory_00452,https://pubmed.ncbi.nlm.nih.gov/17512615/,Neural substrates underlying evaluation of pain in actions depicted in words.,"Gu X, Han S",Behavioural brain research,0.064,17512615,10.1016/j.bbr.2007.04.008,-1
somatosensory_00453,https://pubmed.ncbi.nlm.nih.gov/19172643/,The free choice whether or not to respond after stimulus presentation.,"Karch S, Mulert C, Thalmeier T, Lutz J, Leicht G, Meindl T, Moller HJ, Jager L, Pogarell O",Human brain mapping,0.064,19172643,10.1002/hbm.20722,-1
somatosensory_00454,https://pubmed.ncbi.nlm.nih.gov/21051105/,Aging of human supraspinal locomotor and postural control in fMRI.,"Zwergal A, Linn J, Xiong G, Brandt T, Strupp M, Jahn K",Neurobiology of aging,0.064,21051105,-1,-1
somatosensory_00455,https://pubmed.ncbi.nlm.nih.gov/22479499/,Thinking about eating food activates visual cortex with reduced bilateral cerebellar activation in females with anorexia nervosa: an fMRI study.,"Brooks SJ, O'Daly O, Uher R, Friederich HC, Giampietro V, Brammer M, Williams SC, Schioth HB, Treasure J, Campbell IC",PloS one,0.064,22479499,-1,-1
somatosensory_00456,https://pubmed.ncbi.nlm.nih.gov/25300959/,Interaction of brain areas of visual and vestibular simultaneous activity with fMRI.,"Della-Justina HM, Gamba HR, Lukasova K, Nucci-da-Silva MP, Winkler AM, Amaro E Jr",Experimental brain research,0.064,25300959,-1,-1
somatosensory_00457,https://pubmed.ncbi.nlm.nih.gov/27107808/,Cortical thickness in symptomatic and asymptomatic bipolar offspring.,"Hanford LC, Sassi RB, Minuzzi L, Hall GB",Psychiatry research. Neuroimaging,0.064,27107808,-1,-1
somatosensory_00458,https://pubmed.ncbi.nlm.nih.gov/29452265/,Characterizing the modulation of resting-state fMRI metrics by baseline physiology.,"Chu PPW, Golestani AM, Kwinta JB, Khatamian YB, Chen JJ",NeuroImage,0.064,29452265,-1,-1
somatosensory_00459,https://pubmed.ncbi.nlm.nih.gov/11230093/,Interval and ordinal properties of sequences are associated with distinct premotor areas.,"Schubotz RI, von Cramon DY","Cerebral cortex (New York, N.Y. : 1991)",0.063,11230093,-1,-1
somatosensory_00460,https://pubmed.ncbi.nlm.nih.gov/15734345/,Listening to talking faces: motor cortical activation during speech perception.,"Skipper JI, Nusbaum HC, Small SL",NeuroImage,0.063,15734345,-1,-1
somatosensory_00461,https://pubmed.ncbi.nlm.nih.gov/15896481/,Time-efficient localization of the human secondary somatosensory cortex by functional magnetic resonance imaging.,"Stippich C, Romanowski A, Nennig E, Kress B, Sartor K",Neuroscience letters,0.063,15896481,-1,-1
somatosensory_00462,https://pubmed.ncbi.nlm.nih.gov/16337816/,The role of 'shared representations' in social perception and empathy: an fMRI study.,"Lawrence EJ, Shaw P, Giampietro VP, Surguladze S, Brammer MJ, David AS",NeuroImage,0.063,16337816,-1,-1
somatosensory_00463,https://pubmed.ncbi.nlm.nih.gov/16761270/,Somatosensory cortical plasticity in carpal tunnel syndrome treated by acupuncture.,"Napadow V, Liu J, Li M, Kettner N, Ryan A, Kwong KK, Hui KK, Audette JF",Human brain mapping,0.063,16761270,-1,-1
somatosensory_00464,https://pubmed.ncbi.nlm.nih.gov/17208459/,Towards natural stimulation in fMRI--issues of data analysis.,"Malinen S, Hlushchuk Y, Hari R",NeuroImage,0.063,17208459,-1,-1
somatosensory_00465,https://pubmed.ncbi.nlm.nih.gov/17407825/,Capsaicin-induced thermal hyperalgesia and sensitization in the human trigeminal  nociceptive pathway: an fMRI study.,"Moulton EA, Pendse G, Morris S, Strassman A, Aiello-Lammens M, Becerra L, Borsook D",NeuroImage,0.063,17407825,-1,-1
somatosensory_00466,https://pubmed.ncbi.nlm.nih.gov/17478107/,Overt and imagined singing of an Italian aria.,"Kleber B, Birbaumer N, Veit R, Trevorrow T, Lotze M",NeuroImage,0.063,17478107,-1,-1
somatosensory_00467,https://pubmed.ncbi.nlm.nih.gov/17548801/,Kinesthetic working memory and action control within the dorsal stream.,"Fiehler K, Burke M, Engel A, Bien S, Rosler F","Cerebral cortex (New York, N.Y. : 1991)",0.063,17548801,-1,-1
somatosensory_00468,https://pubmed.ncbi.nlm.nih.gov/18424181/,Variability of BOLD response evoked by foot vibrotactile stimulation: influence of vibration amplitude and stimulus waveform.,"Siedentopf CM, Heubach K, Ischebeck A, Gallasch E, Fend M, Mottaghy FM, Koppelstaetter F, Haala IA, Krause BJ, Felber S, Gerstenbrand F, Golaszewski SM",NeuroImage,0.063,18424181,-1,-1
