paper_name,paper_url,Title,Author,Journal,Loading,PMID,Doi,download_status
somatosensory_00001,https://pubmed.ncbi.nlm.nih.gov/22306799/,Embodied empathy for tactile events: Interindividual differences and vicarious somatosensory responses during touch observation.,"Schaefer M, Heinze HJ, Rotte M",NeuroImage,0.555,22306799,-1,-1
somatosensory_00002,https://pubmed.ncbi.nlm.nih.gov/26546882/,Age-dependent modulation of the somatosensory network upon eye closure.,"Brodoehl S, Klingner C, Witte OW",Behavioural brain research,0.549,26546882,-1,-1
somatosensory_00003,https://pubmed.ncbi.nlm.nih.gov/22451353/,Perceptual plasticity is mediated by connectivity changes of the medial thalamic  nucleus.,"Klingner CM, Hasler C, Brodoehl S, Axer H, Witte OW",Human brain mapping,0.536,22451353,-1,-1
somatosensory_00004,https://pubmed.ncbi.nlm.nih.gov/23226567/,Pulsed ultrasound differentially stimulates somatosensory circuits in humans as indicated by EEG and FMRI.,"Legon W, Rowlands A, Opitz A, Sato TF, Tyler WJ",PloS one,0.514,23226567,-1,-1
somatosensory_00005,https://pubmed.ncbi.nlm.nih.gov/22514285/,Forebrain organization representing baroreceptor gating of somatosensory afferents within the cortical autonomic network.,"Goswami R, Frances MF, Steinback CD, Shoemaker JK",Journal of neurophysiology,0.438,22514285,-1,-1
somatosensory_00006,https://pubmed.ncbi.nlm.nih.gov/24416222/,"Functional magnetic resonance imaging connectivity analyses reveal efference-copy to primary somatosensory area, BA2.","Cui F, Arnstein D, Thomas RM, Maurits NM, Keysers C, Gazzola V",PloS one,0.432,24416222,-1,-1
somatosensory_00007,https://pubmed.ncbi.nlm.nih.gov/25166875/,Subjective somatosensory experiences disclosed by focused attention: cortical-hippocampal-insular and amygdala contributions.,"Bauer CC, Barrios FA, Diaz JL",PloS one,0.417,25166875,-1,-1
somatosensory_00008,https://pubmed.ncbi.nlm.nih.gov/21840344/,Habituation within the somatosensory processing hierarchy.,"Klingner CM, Nenadic I, Hasler C, Brodoehl S, Witte OW",Behavioural brain research,0.414,21840344,-1,-1
somatosensory_00009,https://pubmed.ncbi.nlm.nih.gov/22849401/,The contribution of primary and secondary somatosensory cortices to the representation of body parts and body sides: an fMRI adaptation study.,"Tame L, Braun C, Lingnau A, Schwarzbach J, Demarchi G, Li Hegner Y, Farne A, Pavani F",Journal of cognitive neuroscience,0.393,22849401,-1,-1
somatosensory_00010,https://pubmed.ncbi.nlm.nih.gov/22579866/,Evidence for neural encoding of Bayesian surprise in human somatosensation.,"Ostwald D, Spitzer B, Guggenmos M, Schmidt TT, Kiebel SJ, Blankenburg F",NeuroImage,0.366,22579866,-1,-1
somatosensory_00011,https://pubmed.ncbi.nlm.nih.gov/23123141/,Age-related changes in the somatosensory processing of tactile stimulation--an fMRI study.,"Brodoehl S, Klingner C, Stieglitz K, Witte OW",Behavioural brain research,0.363,23123141,-1,-1
somatosensory_00012,https://pubmed.ncbi.nlm.nih.gov/23150550/,Neural basis of contagious itch and why some people are more prone to it.,"Holle H, Warne K, Seth AK, Critchley HD, Ward J",Proceedings of the National Academy of Sciences of the United States of America,0.363,23150550,-1,-1
somatosensory_00013,https://pubmed.ncbi.nlm.nih.gov/17452003/,Effects of spinal cord stimulation on the cortical somatosensory evoked potentials in failed back surgery syndrome patients.,"Polacek H, Kozak J, Vrba I, Vrana J, Stancak A",Clinical neurophysiology : official journal of the International Federation of Clinical Neurophysiology,0.359,17452003,-1,-1
somatosensory_00014,https://pubmed.ncbi.nlm.nih.gov/16280353/,Silent event-related fMRI reveals deficient motor and enhanced somatosensory activation in orofacial dystonia.,"Dresel C, Haslinger B, Castrop F, Wohlschlaeger AM, Ceballos-Baumann AO",Brain : a journal of neurology,0.336,16280353,-1,-1
somatosensory_00015,https://pubmed.ncbi.nlm.nih.gov/12667848/,Dipole source localization and fMRI of simultaneously recorded data applied to somatosensory categorization.,"Thees S, Blankenburg F, Taskin B, Curio G, Villringer A",NeuroImage,0.334,12667848,-1,-1
somatosensory_00016,https://pubmed.ncbi.nlm.nih.gov/21677181/,Parallel processing of nociceptive and non-nociceptive somatosensory information  in the human primary and secondary somatosensory cortices: evidence from dynamic  causal modeling of functional magnet,"Liang M, Mouraux A, Iannetti GD",The Journal of neuroscience : the official journal of the Society for Neuroscience,0.326,21677181,-1,-1
somatosensory_00017,https://pubmed.ncbi.nlm.nih.gov/19943100/,Somatosensory system deficits in schizophrenia revealed by MEG during a median-nerve oddball task.,"Huang MX, Lee RR, Gaa KM, Song T, Harrington DL, Loh C, Theilmann RJ, Edgar JC, Miller GA, Canive JM, Granholm E",Brain topography,0.325,19943100,-1,-1
somatosensory_00018,https://pubmed.ncbi.nlm.nih.gov/22580382/,A time-varying source connectivity approach to reveal human somatosensory information processing.,"Hu L, Zhang ZG, Hu Y",NeuroImage,0.325,22580382,-1,-1
somatosensory_00019,https://pubmed.ncbi.nlm.nih.gov/15038005/,Neural substrates of tactile object recognition: an fMRI study.,"Reed CL, Shoham S, Halgren E",Human brain mapping,0.323,15038005,-1,-1
somatosensory_00020,https://pubmed.ncbi.nlm.nih.gov/17997331/,A new device for tactile stimulation during fMRI.,"Dresel C, Parzinger A, Rimpau C, Zimmer C, Ceballos-Baumann AO, Haslinger B",NeuroImage,0.319,17997331,-1,-1
somatosensory_00021,https://pubmed.ncbi.nlm.nih.gov/24727703/,Sustained attention to spontaneous thumb sensations activates brain somatosensory and other proprioceptive areas.,"Bauer CC, Diaz JL, Concha L, Barrios FA",Brain and cognition,0.319,24727703,10.1016/j.bandc.2014.03.009,-1
somatosensory_00022,https://pubmed.ncbi.nlm.nih.gov/23370054/,Neural correlates of somatosensory paired-pulse suppression: a MEG study using distributed source modeling and dynamic spectral power analysis.,"Hsiao FJ, Cheng CH, Chen WT, Lin YY",NeuroImage,0.316,23370054,-1,-1
somatosensory_00023,https://pubmed.ncbi.nlm.nih.gov/27790087/,Functional and Structural Neuroplasticity Induced by Short-Term Tactile Training  Based on Braille Reading.,"Debowska W, Wolak T, Nowicka A, Kozak A, Szwed M, Kossut M",Frontiers in neuroscience,0.315,27790087,-1,-1
somatosensory_00024,https://pubmed.ncbi.nlm.nih.gov/18938220/,Somatotopical relationships between cortical activity and reflex areas in reflexology: a functional magnetic resonance imaging study.,"Nakamaru T, Miura N, Fukushima A, Kawashima R",Neuroscience letters,0.303,18938220,-1,-1
somatosensory_00025,https://pubmed.ncbi.nlm.nih.gov/25541190/,The perception of touch and the ventral somatosensory pathway.,"Preusser S, Thiel SD, Rook C, Roggenhofer E, Kosatschek A, Draganski B, Blankenburg F, Driver J, Villringer A, Pleger B",Brain : a journal of neurology,0.297,25541190,-1,-1
somatosensory_00026,https://pubmed.ncbi.nlm.nih.gov/17597225/,Studying the human somatosensory hand area: A new way to compare fMRI and MEG.,"Stoeckel MC, Pollok B, Schnitzler A, Seitz RJ",Journal of neuroscience methods,0.296,17597225,-1,-1
somatosensory_00027,https://pubmed.ncbi.nlm.nih.gov/21389303/,The cortical response to the oral perception of fat emulsions and the effect of taster status.,"Eldeghaidy S, Marciani L, McGlone F, Hollowood T, Hort J, Head K, Taylor AJ, Busch J, Spiller RC, Gowland PA, Francis ST",Journal of neurophysiology,0.294,21389303,-1,-1
somatosensory_00028,https://pubmed.ncbi.nlm.nih.gov/12401562/,Simultaneous electroencephalography and functional magnetic resonance imaging of  primary and secondary somatosensory cortex in humans after electrical stimulation.,"Christmann C, Ruf M, Braus DF, Flor H",Neuroscience letters,0.293,12401562,-1,-1
somatosensory_00029,https://pubmed.ncbi.nlm.nih.gov/22537316/,Phantom digit somatotopy: a functional magnetic resonance imaging study in forearm amputees.,"Bjorkman A, Weibull A, Olsrud J, Ehrsson HH, Rosen B, Bjorkman-Burtscher IM",The European journal of neuroscience,0.286,22537316,-1,-1
somatosensory_00030,https://pubmed.ncbi.nlm.nih.gov/23044088/,Working memory of somatosensory stimuli: an fMRI study.,"Savini N, Brunetti M, Babiloni C, Ferretti A",International journal of psychophysiology : official journal of the International Organization of Psychophysiology,0.286,23044088,-1,-1
somatosensory_00031,https://pubmed.ncbi.nlm.nih.gov/12749964/,Central representation of visceral and cutaneous hypersensitivity in the irritable bowel syndrome.,"Verne GN, Himes NC, Robinson ME, Gopinath KS, Briggs RW, Crosson B, Price DD",Pain,0.284,12749964,-1,-1
somatosensory_00032,https://pubmed.ncbi.nlm.nih.gov/21741443/,Cortical processing of tactile direction discrimination based on spatiotemporal cues in man.,"Lundblad LC, Olausson HW, Hermansson AK, Wasling HB",Neuroscience letters,0.279,21741443,-1,-1
somatosensory_00033,https://pubmed.ncbi.nlm.nih.gov/28841675/,Neural encoding of saltatory pneumotactile velocity in human glabrous hand.,"Oh H, Custead R, Wang Y, Barlow S",PloS one,0.273,28841675,-1,-1
somatosensory_00034,https://pubmed.ncbi.nlm.nih.gov/25741269/,Differential cerebral response to somatosensory stimulation of an acupuncture point vs. two non-acupuncture points measured with EEG and fMRI.,"Nierhaus T, Pach D, Huang W, Long X, Napadow V, Roll S, Liang F, Pleger B, Villringer A, Witt CM",Frontiers in human neuroscience,0.271,25741269,-1,-1
somatosensory_00035,https://pubmed.ncbi.nlm.nih.gov/15907302/,Passive somatosensory discrimination tasks in healthy volunteers: differential networks involved in familiar versus unfamiliar shape and length discrimination.,"Van de Winckel A, Sunaert S, Wenderoth N, Peeters R, Van Hecke P, Feys H, Horemans E, Marchal G, Swinnen SP, Perfetti C, De Weerdt W",NeuroImage,0.267,15907302,-1,-1
somatosensory_00036,https://pubmed.ncbi.nlm.nih.gov/22787048/,Altered cross-modal processing in the primary auditory cortex of congenitally deaf adults: a visual-somatosensory fMRI study with a double-flash illusion.,"Karns CM, Dow MW, Neville HJ",The Journal of neuroscience : the official journal of the Society for Neuroscience,0.259,22787048,-1,-1
somatosensory_00037,https://pubmed.ncbi.nlm.nih.gov/20666597/,Differential involvement of somatosensory and interoceptive cortices during the observation of affective touch.,"Ebisch SJ, Ferri F, Salone A, Perrucci MG, D'Amico L, Ferro FM, Romani GL, Gallese V",Journal of cognitive neuroscience,0.258,20666597,-1,-1
somatosensory_00038,https://pubmed.ncbi.nlm.nih.gov/12880819/,Representation of different trigeminal divisions within the primary and secondary human somatosensory cortex.,"Iannetti GD, Porro CA, Pantano P, Romanelli PL, Galeotti F, Cruccu G",NeuroImage,0.25,12880819,-1,-1
somatosensory_00039,https://pubmed.ncbi.nlm.nih.gov/16466679/,Information processing in human parieto-frontal circuits during goal-directed bimanual movements.,"Wenderoth N, Toni I, Bedeleem S, Debaere F, Swinnen SP",NeuroImage,0.25,16466679,-1,-1
somatosensory_00040,https://pubmed.ncbi.nlm.nih.gov/18329293/,Human secondary somatosensory cortex is involved in the processing of somatosensory rare stimuli: an fMRI study.,"Chen TL, Babiloni C, Ferretti A, Perrucci MG, Romani GL, Rossini PM, Tartaro A, Del Gratta C",NeuroImage,0.25,18329293,-1,-1
somatosensory_00041,https://pubmed.ncbi.nlm.nih.gov/23185306/,Brain structural correlates of reward sensitivity and impulsivity in adolescents  with normal and excess weight.,"Moreno-Lopez L, Soriano-Mas C, Delgado-Rico E, Rio-Valle JS, Verdejo-Garcia A",PloS one,0.249,23185306,10.1371/journal.pone.0049185,-1
somatosensory_00042,https://pubmed.ncbi.nlm.nih.gov/12091578/,Auditory-somatosensory multisensory processing in auditory association cortex: an fMRI study.,"Foxe JJ, Wylie GR, Martinez A, Schroeder CE, Javitt DC, Guilfoyle D, Ritter W, Murray MM",Journal of neurophysiology,0.246,12091578,10.1152/jn.2002.88.1.540,-1
somatosensory_00043,https://pubmed.ncbi.nlm.nih.gov/18495495/,Behavioral correlates of negative BOLD signal changes in the primary somatosensory cortex.,"Kastrup A, Baudewig J, Schnaudigel S, Huonker R, Becker L, Sohns JM, Dechent P, Klingner C, Witte OW",NeuroImage,0.24,18495495,-1,-1
somatosensory_00044,https://pubmed.ncbi.nlm.nih.gov/19347874/,Attachment avoidance modulates neural response to masked facial emotion.,"Suslow T, Kugel H, Rauch AV, Dannlowski U, Bauer J, Konrad C, Arolt V, Heindel W, Ohrmann P",Human brain mapping,0.235,19347874,-1,-1
somatosensory_00045,https://pubmed.ncbi.nlm.nih.gov/26205825/,The impact of eye closure on somatosensory perception in the elderly.,"Brodoehl S, Klingner C, Stieglitz K, Witte OW",Behavioural brain research,0.235,26205825,-1,-1
somatosensory_00046,https://pubmed.ncbi.nlm.nih.gov/21734252/,Understanding otherness: the neural bases of action comprehension and pain empathy in a congenital amputee.,"Aziz-Zadeh L, Sheng T, Liew SL, Damasio H","Cerebral cortex (New York, N.Y. : 1991)",0.234,21734252,-1,-1
somatosensory_00047,https://pubmed.ncbi.nlm.nih.gov/24659451/,Depicting the inner and outer nose: The representation of the nose and the nasal  mucosa on the human primary somatosensory cortex (SI).,"Gastl M, Brunner YF, Wiesmann M, Freiherr J",Human brain mapping,0.234,24659451,-1,-1
somatosensory_00048,https://pubmed.ncbi.nlm.nih.gov/17094120/,Cortical brain responses during passive nonpainful median nerve stimulation at low frequencies (0.5-4 Hz): an fMRI study.,"Ferretti A, Babiloni C, Arienzo D, Del Gratta C, Rossini PM, Tartaro A, Romani GL",Human brain mapping,0.233,17094120,-1,-1
somatosensory_00049,https://pubmed.ncbi.nlm.nih.gov/24416229/,Effects of combining 2 weeks of passive sensory stimulation with active hand motor training in healthy adults.,"Ladda AM, Pfannmoeller JP, Kalisch T, Roschka S, Platz T, Dinse HR, Lotze M",PloS one,0.233,24416229,-1,-1
somatosensory_00050,https://pubmed.ncbi.nlm.nih.gov/25653609/,Distributed functions of detection and discrimination of vibrotactile stimuli in  the hierarchical human somatosensory system.,"Kim J, Muller KR, Chung YG, Chung SC, Park JY, Bulthoff HH, Kim SP",Frontiers in human neuroscience,0.233,25653609,-1,-1
somatosensory_00051,https://pubmed.ncbi.nlm.nih.gov/9114263/,Multiple nonprimary motor areas in the human cortex.,"Fink GR, Frackowiak RS, Pietrzyk U, Passingham RE",Journal of neurophysiology,0.232,9114263,-1,-1
somatosensory_00052,https://pubmed.ncbi.nlm.nih.gov/12356445/,Functional neuroimaging studies of human somatosensory cortex.,"McGlone F, Kelly EF, Trulsson M, Francis ST, Westling G, Bowtell R",Behavioural brain research,0.232,12356445,-1,-1
somatosensory_00053,https://pubmed.ncbi.nlm.nih.gov/23991064/,Neural basis of limb ownership in individuals with body integrity identity disorder.,"van Dijk MT, van Wingen GA, van Lammeren A, Blom RM, de Kwaasteniet BP, Scholte HS, Denys D",PloS one,0.232,23991064,-1,-1
somatosensory_00054,https://pubmed.ncbi.nlm.nih.gov/20669167/,Active and passive touch differentially activate somatosensory cortex in texture  perception.,"Simoes-Franklin C, Whitaker TA, Newell FN",Human brain mapping,0.23,20669167,-1,-1
somatosensory_00055,https://pubmed.ncbi.nlm.nih.gov/22020967/,Prominent activation of the intraparietal and somatosensory areas during angle discrimination by intra-active touch.,"Yang J, Han H, Chui D, Shen Y, Wu J",Human brain mapping,0.227,22020967,-1,-1
somatosensory_00056,https://pubmed.ncbi.nlm.nih.gov/23263196/,The desire for healthy limb amputation: structural brain correlates and clinical  features of xenomelia.,"Hilti LM, Hanggi J, Vitacco DA, Kraemer B, Palla A, Luechinger R, Jancke L, Brugger P",Brain : a journal of neurology,0.225,23263196,-1,-1
somatosensory_00057,https://pubmed.ncbi.nlm.nih.gov/20732744/,Bilateral activation of the trigeminothalamic tract by acute orofacial cutaneous  and muscle pain in humans.,"Nash PG, Macefield VG, Klineberg IJ, Gustin SM, Murray GM, Henderson LA",Pain,0.222,20732744,-1,-1
somatosensory_00058,https://pubmed.ncbi.nlm.nih.gov/11313298/,Somatotopic organization of human secondary somatosensory cortex.,"Ruben J, Schwiemann J, Deuchert M, Meyer R, Krause T, Curio G, Villringer K, Kurth R, Villringer A","Cerebral cortex (New York, N.Y. : 1991)",0.218,11313298,-1,-1
somatosensory_00059,https://pubmed.ncbi.nlm.nih.gov/19100840/,Imagined locomotion in the blind: an fMRI study.,"Deutschlander A, Stephan T, Hufner K, Wagner J, Wiesmann M, Strupp M, Brandt T, Jahn K",NeuroImage,0.217,19100840,-1,-1
somatosensory_00060,https://pubmed.ncbi.nlm.nih.gov/27916664/,Experience-dependent modulation of right anterior insula and sensorimotor regions as a function of noise-masked auditory feedback in singers and nonsingers.,"Kleber B, Friberg A, Zeitouni A, Zatorre R",NeuroImage,0.217,27916664,-1,-1
somatosensory_00061,https://pubmed.ncbi.nlm.nih.gov/21195191/,fMRI investigation of unexpected somatosensory feedback perturbation during speech.,"Golfinopoulos E, Tourville JA, Bohland JW, Ghosh SS, Nieto-Castanon A, Guenther FH",NeuroImage,0.216,21195191,10.1016/j.neuroimage.2010.12.065,-1
somatosensory_00062,https://pubmed.ncbi.nlm.nih.gov/15091347/,A touching sight: SII/PV activation during the observation and experience of touch.,"Keysers C, Wicker B, Gazzola V, Anton JL, Fogassi L, Gallese V",Neuron,0.215,15091347,10.1016/s0896-6273(04)00156-4,-1
somatosensory_00063,https://pubmed.ncbi.nlm.nih.gov/15733635/,Brain processing during mechanical hyperalgesia in complex regional pain syndrome: a functional MRI study.,"Maihofner C, Forster C, Birklein F, Neundorfer B, Handwerker HO",Pain,0.214,15733635,10.1016/j.pain.2004.12.001,-1
somatosensory_00064,https://pubmed.ncbi.nlm.nih.gov/21575727/,Dual pathways for haptic and visual perception of spatial and texture information.,"Sathian K, Lacey S, Stilla R, Gibson GO, Deshpande G, Hu X, Laconte S, Glielmi C",NeuroImage,0.213,21575727,-1,-1
somatosensory_00065,https://pubmed.ncbi.nlm.nih.gov/26584870/,Anterior insula coordinates hierarchical processing of tactile mismatch responses.,"Allen M, Fardo F, Dietz MJ, Hillebrandt H, Friston KJ, Rees G, Roepstorff A",NeuroImage,0.211,26584870,-1,-1
somatosensory_00066,https://pubmed.ncbi.nlm.nih.gov/20863844/,Self-organisation in the human visual system--visuo-motor processing with congenitally abnormal V1 input.,"Wolynski B, Kanowski M, Meltendorf S, Behrens-Baumann W, Hoffmann MB",Neuropsychologia,0.21,20863844,-1,-1
somatosensory_00067,https://pubmed.ncbi.nlm.nih.gov/15325369/,Somatotopic organization of human somatosensory cortices for pain: a single trial fMRI study.,"Bingel U, Lorenz J, Glauche V, Knab R, Glascher J, Weiller C, Buchel C",NeuroImage,0.208,15325369,-1,-1
somatosensory_00068,https://pubmed.ncbi.nlm.nih.gov/12842716/,What aspect of the fMRI BOLD signal best reflects the underlying electrophysiology in human somatosensory cortex?,"Arthurs OJ, Boniface SJ",Clinical neurophysiology : official journal of the International Federation of Clinical Neurophysiology,0.204,12842716,-1,-1
somatosensory_00069,https://pubmed.ncbi.nlm.nih.gov/19234068/,Stimulus-response profile during single-pulse transcranial magnetic stimulation to the primary motor cortex.,"Hanakawa T, Mima T, Matsumoto R, Abe M, Inouchi M, Urayama S, Anami K, Honda M, Fukuyama H","Cerebral cortex (New York, N.Y. : 1991)",0.201,19234068,-1,-1
somatosensory_00070,https://pubmed.ncbi.nlm.nih.gov/24523536/,Structure of plasticity in human sensory and motor networks due to perceptual learning.,"Vahdat S, Darainy M, Ostry DJ",The Journal of neuroscience : the official journal of the Society for Neuroscience,0.201,24523536,-1,-1
somatosensory_00071,https://pubmed.ncbi.nlm.nih.gov/18395979/,Unmyelinated tactile afferents have opposite effects on insular and somatosensory cortical processing.,"Olausson HW, Cole J, Vallbo A, McGlone F, Elam M, Kramer HH, Rylander K, Wessberg J, Bushnell MC",Neuroscience letters,0.199,18395979,-1,-1
somatosensory_00072,https://pubmed.ncbi.nlm.nih.gov/29487791/,Altered functional connectivity differs in stroke survivors with impaired touch sensation following left and right hemisphere lesions.,"Goodin P, Lamp G, Vidyasagar R, McArdle D, Seitz RJ, Carey LM",NeuroImage. Clinical,0.198,29487791,-1,-1
somatosensory_00073,https://pubmed.ncbi.nlm.nih.gov/21949769/,Tactile motion and pattern processing assessed with high-field FMRI.,"Wacker E, Spitzer B, Lutzkendorf R, Bernarding J, Blankenburg F",PloS one,0.194,21949769,-1,-1
somatosensory_00074,https://pubmed.ncbi.nlm.nih.gov/11784773/,Adaptive changes in early and late blind: a fMRI study of Braille reading.,"Burton H, Snyder AZ, Conturo TE, Akbudak E, Ollinger JM, Raichle ME",Journal of neurophysiology,0.192,11784773,-1,-1
somatosensory_00075,https://pubmed.ncbi.nlm.nih.gov/16648455/,Intracortically distributed neurovascular coupling relationships within and between human somatosensory cortices.,"Arthurs OJ, Donovan T, Spiegelhalter DJ, Pickard JD, Boniface SJ","Cerebral cortex (New York, N.Y. : 1991)",0.192,16648455,-1,-1
somatosensory_00076,https://pubmed.ncbi.nlm.nih.gov/21444827/,Social rejection shares somatosensory representations with physical pain.,"Kross E, Berman MG, Mischel W, Smith EE, Wager TD",Proceedings of the National Academy of Sciences of the United States of America,0.192,21444827,-1,-1
somatosensory_00077,https://pubmed.ncbi.nlm.nih.gov/19631756/,The somatosensory representation of the human clitoris: an fMRI study.,"Michels L, Mehnert U, Boy S, Schurch B, Kollias S",NeuroImage,0.188,19631756,-1,-1
somatosensory_00078,https://pubmed.ncbi.nlm.nih.gov/16084116/,The functional neuroanatomy of coordinated orofacial movements: sparse sampling fMRI of whistling.,"Dresel C, Castrop F, Haslinger B, Wohlschlaeger AM, Hennenlotter A, Ceballos-Baumann AO",NeuroImage,0.186,16084116,-1,-1
somatosensory_00079,https://pubmed.ncbi.nlm.nih.gov/20691793/,BA3b and BA1 activate in a serial fashion after median nerve stimulation: direct  evidence from combining source analysis of evoked fields and cytoarchitectonic probabilistic maps.,"Papadelis C, Eickhoff SB, Zilles K, Ioannides AA",NeuroImage,0.186,20691793,-1,-1
somatosensory_00080,https://pubmed.ncbi.nlm.nih.gov/18582581/,Functional imaging of sensory decline and gain induced by differential noxious stimulation.,"Stammler T, De Col R, Seifert F, Maihofner C",NeuroImage,0.185,18582581,-1,-1
somatosensory_00081,https://pubmed.ncbi.nlm.nih.gov/19136548/,Structural changes in the somatosensory system correlate with tic severity in Gilles de la Tourette syndrome.,"Thomalla G, Siebner HR, Jonas M, Baumer T, Biermann-Ruben K, Hummel F, Gerloff C, Muller-Vahl K, Schnitzler A, Orth M, Munchau A",Brain : a journal of neurology,0.185,19136548,10.1093/brain/awn339,-1
somatosensory_00082,https://pubmed.ncbi.nlm.nih.gov/25203272/,Adaptive Coding of Orofacial and Speech Actions in Motor and Somatosensory Spaces with and without Overt Motor Behavior.,"Sato M, Vilain C, Lamalle L, Grabski K",Journal of cognitive neuroscience,0.185,25203272,-1,-1
somatosensory_00083,https://pubmed.ncbi.nlm.nih.gov/27034024/,Voxel-based morphometry in opera singers: Increased gray-matter volume in right somatosensory and auditory cortices.,"Kleber B, Veit R, Moll CV, Gaser C, Birbaumer N, Lotze M",NeuroImage,0.185,27034024,-1,-1
somatosensory_00084,https://pubmed.ncbi.nlm.nih.gov/19211888/,Following one's heart: cardiac rhythms gate central initiation of sympathetic reflexes.,"Gray MA, Rylander K, Harrison NA, Wallin BG, Critchley HD",The Journal of neuroscience : the official journal of the Society for Neuroscience,0.183,19211888,-1,-1
somatosensory_00085,https://pubmed.ncbi.nlm.nih.gov/21391252/,Eye muscle proprioception is represented bilaterally in the sensorimotor cortex.,"Balslev D, Albert NB, Miall C",Human brain mapping,0.183,21391252,-1,-1
somatosensory_00086,https://pubmed.ncbi.nlm.nih.gov/23523812/,No somatotopy of sensorimotor alpha-oscillation responses to differential finger  stimulation.,"Nierula B, Hohlefeld FU, Curio G, Nikulin VV",NeuroImage,0.183,23523812,-1,-1
somatosensory_00087,https://pubmed.ncbi.nlm.nih.gov/18574581/,Cortical processing of lateral skin stretch stimulation in humans.,"Backlund Wasling H, Lundblad L, Loken L, Wessberg J, Wiklund K, Norrsell U, Olausson H",Experimental brain research,0.18,18574581,-1,-1
somatosensory_00088,https://pubmed.ncbi.nlm.nih.gov/19780042/,Sensory-motor brain network connectivity for speech comprehension.,"Londei A, D'Ausilio A, Basso D, Sestieri C, Gratta CD, Romani GL, Belardinelli MO",Human brain mapping,0.177,19780042,-1,-1
somatosensory_00089,https://pubmed.ncbi.nlm.nih.gov/27852776/,Somatic and Reinforcement-Based Plasticity in the Initial Stages of Human Motor Learning.,"Sidarta A, Vahdat S, Bernardi NF, Ostry DJ",The Journal of neuroscience : the official journal of the Society for Neuroscience,0.177,27852776,-1,-1
somatosensory_00090,https://pubmed.ncbi.nlm.nih.gov/16112876/,Differential coding of hyperalgesia in the human brain: a functional MRI study.,"Maihofner C, Handwerker HO",NeuroImage,0.176,16112876,-1,-1
somatosensory_00091,https://pubmed.ncbi.nlm.nih.gov/26285212/,Facial Emotion Recognition in Parkinson's Disease: An fMRI Investigation.,"Wabnegger A, Ille R, Schwingenschuh P, Katschnig-Winter P, Kogl-Wallner M, Wenzel K, Schienle A",PloS one,0.176,26285212,-1,-1
somatosensory_00092,https://pubmed.ncbi.nlm.nih.gov/18537117/,My third arm: shifts in topography of the somatosensory homunculus predict feeling of an artificial supernumerary arm.,"Schaefer M, Heinze HJ, Rotte M",Human brain mapping,0.175,18537117,-1,-1
