paper_name,paper_url,Title,Author,Journal,Loading,PMID,Doi,download_status
stop signal_00090,https://pubmed.ncbi.nlm.nih.gov/23553547/,Changes in cerebral morphometry and amplitude of low-frequency fluctuations of BOLD signals during healthy aging: correlation with inhibitory control.,"Hu S, Chao HH, Zhang S, Ide JS, Li CS",Brain structure & function,0.077,23553547,-1,-1
stop signal_00091,https://pubmed.ncbi.nlm.nih.gov/23874445/,Psychosis-proneness and neural correlates of self-inhibition in theory of mind.,"van der Meer L, Groenewold NA, Pijnenborg M, Aleman A",PloS one,0.074,23874445,10.1371/journal.pone.0067774,-1
stop signal_00092,https://pubmed.ncbi.nlm.nih.gov/25810512/,Effects of rTMS of pre-supplementary motor area on fronto basal ganglia network activity during stop-signal task.,"Watanabe T, Hanajima R, Shirota Y, Tsutsumi R, Shimizu T, Hayashi T, Terao Y, Ugawa Y, Katsura M, Kunimatsu A, Ohtomo K, Hirose S, Miyashita Y, Konishi S",The Journal of neuroscience : the official journal of the Society for Neuroscience,0.074,25810512,10.1523/JNEUROSCI.3761-14.2015,-1
stop signal_00093,https://pubmed.ncbi.nlm.nih.gov/26110429/,Dissociating Two Stages of Preparation in the Stop Signal Task Using fMRI.,"Chevrier A, Cheyne D, Graham S, Schachar R",PloS one,0.072,26110429,-1,-1
stop signal_00094,https://pubmed.ncbi.nlm.nih.gov/23660028/,Inhibitory control and trait aggression: neural and behavioral insights using the emotional stop signal task.,"Pawliczek CM, Derntl B, Kellermann T, Kohn N, Gur RC, Habel U",NeuroImage,0.066,23660028,-1,-1
stop signal_00095,https://pubmed.ncbi.nlm.nih.gov/25698959/,"Effect of foreknowledge on neural activity of primary ""go"" responses relates to response stopping and switching.","Xu B, Levy S, Butman J, Pham D, Cohen LG, Sandrini M",Frontiers in human neuroscience,0.065,25698959,-1,-1
stop signal_00096,https://pubmed.ncbi.nlm.nih.gov/20600968/,Error detection in the stop signal task.,"Chevrier A, Schachar RJ",NeuroImage,0.062,20600968,-1,-1
stop signal_00097,https://pubmed.ncbi.nlm.nih.gov/29274748/,Neural circuitry underlying sustained attention in healthy adolescents and in ADHD symptomatology.,"O'Halloran L, Cao Z, Ruddy K, Jollans L, Albaugh MD, Aleni A, Potter AS, Vahey N, Banaschewski T, Hohmann S, Bokde ALW, Bromberg U, Buchel C, Quinlan EB, Desrivieres S, Flor H, Frouin V, Gowland P, Heinz A, Ittermann B, Nees F, Orfanos DP, Paus T, Smolka MN, Walter H, Schumann G, Garavan H, Kelly C, Whelan R",NeuroImage,0.061,29274748,-1,-1
stop signal_00098,https://pubmed.ncbi.nlm.nih.gov/25610797/,Altered neural connectivity during response inhibition in adolescents with attention-deficit/hyperactivity disorder and their unaffected siblings.,"van Rooij D, Hartman CA, Mennes M, Oosterlaan J, Franke B, Rommelse N, Heslenfeld D, Faraone SV, Buitelaar JK, Hoekstra PJ",NeuroImage. Clinical,0.058,25610797,-1,-1
stop signal_00099,https://pubmed.ncbi.nlm.nih.gov/26183689/,Altered inhibition-related frontolimbic connectivity in obsessive-compulsive disorder.,"van Velzen LS, de Wit SJ, Curcic-Blake B, Cath DC, de Vries FE, Veltman DJ, van der Werf YD, van den Heuvel OA",Human brain mapping,0.058,26183689,-1,-1
