paper_name,paper_url,Title,Author,Journal,Loading,PMID,Doi,download_status
stress_00178,https://pubmed.ncbi.nlm.nih.gov/23485025/,How brooding minds inhibit negative material: an event-related fMRI study.,"Vanderhasselt MA, Baeken C, Van Schuerbeek P, Luypaert R, De Mey J, De Raedt R",Brain and cognition,0.088,23485025,-1,-1
stress_00179,https://pubmed.ncbi.nlm.nih.gov/24078020/,"Psychological, endocrine and neural responses to social evaluation in subclinical depression.","Dedovic K, Duchesne A, Engert V, Lue SD, Andrews J, Efanov SI, Beaudry T, Pruessner JC",Social cognitive and affective neuroscience,0.088,24078020,-1,-1
stress_00180,https://pubmed.ncbi.nlm.nih.gov/25862672/,Altered functional connectivity in the brain default-mode network of earthquake survivors persists after 2 years despite recovery from anxiety symptoms.,"Du MY, Liao W, Lui S, Huang XQ, Li F, Kuang WH, Li J, Chen HF, Kendrick KM, Gong QY",Social cognitive and affective neuroscience,0.088,25862672,-1,-1
stress_00181,https://pubmed.ncbi.nlm.nih.gov/21071182/,Mindfulness practice leads to increases in regional brain gray matter density.,"Holzel BK, Carmody J, Vangel M, Congleton C, Yerramsetti SM, Gard T, Lazar SW",Psychiatry research,0.087,21071182,10.1016/j.pscychresns.2010.08.006,-1
stress_00182,https://pubmed.ncbi.nlm.nih.gov/17291781/,Ventral medial prefrontal cortex and cardiovagal control in conscious humans.,"Wong SW, Masse N, Kimmerly DS, Menon RS, Shoemaker JK",NeuroImage,0.086,17291781,10.1016/j.neuroimage.2006.12.027,-1
stress_00183,https://pubmed.ncbi.nlm.nih.gov/12821513/,Human cingulate cortex and autonomic control: converging neuroimaging and clinical evidence.,"Critchley HD, Mathias CJ, Josephs O, O'Doherty J, Zanini S, Dewar BK, Cipolotti L, Shallice T, Dolan RJ",Brain : a journal of neurology,0.085,12821513,-1,-1
stress_00184,https://pubmed.ncbi.nlm.nih.gov/17525984/,Enhanced amygdala and medial prefrontal activation during nonconscious processing of fear in posttraumatic stress disorder: an fMRI study.,"Bryant RA, Kemp AH, Felmingham KL, Liddell B, Olivieri G, Peduto A, Gordon E, Williams LM",Human brain mapping,0.085,17525984,-1,-1
stress_00185,https://pubmed.ncbi.nlm.nih.gov/24302681/,The neurosteroids allopregnanolone and dehydroepiandrosterone modulate resting-state amygdala connectivity.,"Sripada RK, Welsh RC, Marx CE, Liberzon I",Human brain mapping,0.085,24302681,-1,-1
stress_00186,https://pubmed.ncbi.nlm.nih.gov/26749205/,The innate alarm circuit in post-traumatic stress disorder: Conscious and subconscious processing of fear- and trauma-related cues.,"Rabellino D, Densmore M, Frewen PA, Theberge J, Lanius RA",Psychiatry research. Neuroimaging,0.085,26749205,-1,-1
stress_00187,https://pubmed.ncbi.nlm.nih.gov/17999939/,Central representation of hyperalgesia from myofascial trigger point.,"Niddam DM, Chan RC, Lee SH, Yeh TC, Hsieh JC",NeuroImage,0.084,17999939,-1,-1
stress_00188,https://pubmed.ncbi.nlm.nih.gov/20434779/,An fMRI study on mental pain and suicidal behavior.,"Reisch T, Seifritz E, Esposito F, Wiest R, Valach L, Michel K",Journal of affective disorders,0.084,20434779,-1,-1
stress_00189,https://pubmed.ncbi.nlm.nih.gov/24757127/,Cortisol administration increases hippocampal activation to infant crying in males depending on childhood neglect.,"Bos PA, Montoya ER, Terburg D, van Honk J",Human brain mapping,0.084,24757127,-1,-1
stress_00190,https://pubmed.ncbi.nlm.nih.gov/26124712/,Childhood Poverty Predicts Adult Amygdala and Frontal Activity and Connectivity in Response to Emotional Faces.,"Javanbakht A, King AP, Evans GW, Swain JE, Angstadt M, Phan KL, Liberzon I",Frontiers in behavioral neuroscience,0.084,26124712,-1,-1
stress_00191,https://pubmed.ncbi.nlm.nih.gov/18221758/,fMRI reveals altered auditory processing in manifest and premanifest Huntington's disease.,"Saft C, Schuttke A, Beste C, Andrich J, Heindel W, Pfleiderer B",Neuropsychologia,0.083,18221758,-1,-1
stress_00192,https://pubmed.ncbi.nlm.nih.gov/19546156/,Altered water diffusivity in cortical association tracts in children with early deprivation identified with Tract-Based Spatial Statistics (TBSS).,"Govindan RM, Behen ME, Helder E, Makki MI, Chugani HT","Cerebral cortex (New York, N.Y. : 1991)",0.083,19546156,-1,-1
stress_00193,https://pubmed.ncbi.nlm.nih.gov/21878364/,Amygdala hyperactivation and prefrontal hypoactivation in subjects with cognitive vulnerability to depression.,"Zhong M, Wang X, Xiao J, Yi J, Zhu X, Liao J, Wang W, Yao S",Biological psychology,0.083,21878364,-1,-1
stress_00194,https://pubmed.ncbi.nlm.nih.gov/25338633/,Neural and genetic markers of vulnerability to post-traumatic stress symptoms among survivors of the World Trade Center attacks.,"Olsson A, Kross E, Nordberg SS, Weinberg A, Weber J, Schmer-Galunder S, Fossella J, Wager TD, Bonanno GA, Ochsner KN",Social cognitive and affective neuroscience,0.083,25338633,-1,-1
stress_00195,https://pubmed.ncbi.nlm.nih.gov/25608023/,"Neurophysiological effects of sleep deprivation in healthy adults, a pilot study.","Klumpers UM, Veltman DJ, van Tol MJ, Kloet RW, Boellaard R, Lammertsma AA, Hoogendijk WJ",PloS one,0.083,25608023,-1,-1
stress_00196,https://pubmed.ncbi.nlm.nih.gov/19464376/,Vulnerability to simple faints is predicted by regional differences in brain anatomy.,"Beacher FD, Gray MA, Mathias CJ, Critchley HD",NeuroImage,0.082,19464376,-1,-1
stress_00197,https://pubmed.ncbi.nlm.nih.gov/21497403/,"Different white matter abnormalities between the first-episode, treatment-naive patients with posttraumatic stress disorder and generalized anxiety disorder without comorbid conditions.","Zhang L, Zhang Y, Li L, Li Z, Li W, Ma N, Hou C, Zhang Z, Zhang Z, Wang L, Duan L, Lu G",Journal of affective disorders,0.082,21497403,-1,-1
stress_00198,https://pubmed.ncbi.nlm.nih.gov/21618664/,fMRI investigation of speed-accuracy strategy switching.,"Vallesi A, McIntosh AR, Crescentini C, Stuss DT",Human brain mapping,0.082,21618664,-1,-1
stress_00199,https://pubmed.ncbi.nlm.nih.gov/23209643/,Increased neural habituation in the amygdala and orbitofrontal cortex in social anxiety disorder revealed by FMRI.,"Sladky R, Hoflich A, Atanelov J, Kraus C, Baldinger P, Moser E, Lanzenberger R, Windischberger C",PloS one,0.082,23209643,-1,-1
stress_00200,https://pubmed.ncbi.nlm.nih.gov/24332890/,"Functional effects of chronic paroxetine versus placebo on the fear, stress and anxiety brain circuit in Social Anxiety Disorder: initial validation of an imaging protocol for drug discovery.","Gimenez M, Ortiz H, Soriano-Mas C, Lopez-Sola M, Farre M, Deus J, Martin-Santos R, Fernandes S, Fina P, Bani M, Zancan S, Pujol J, Merlo-Pich E",European neuropsychopharmacology : the journal of the European College of Neuropsychopharmacology,0.082,24332890,-1,-1
stress_00201,https://pubmed.ncbi.nlm.nih.gov/26003127/,Exercise intensity modulates the change in cerebral blood flow following aerobic  exercise in chronic stroke.,"Robertson AD, Crane DE, Rajab AS, Swardfager W, Marzolini S, Shirzadi Z, Middleton LE, MacIntosh BJ",Experimental brain research,0.081,26003127,-1,-1
stress_00202,https://pubmed.ncbi.nlm.nih.gov/26879624/,Interaction between COMT Val(158)Met polymorphism and childhood adversity affects reward processing in adulthood.,"Boecker-Schlier R, Holz NE, Buchmann AF, Blomeyer D, Plichta MM, Jennen-Steinmetz C, Wolf I, Baumeister S, Treutlein J, Rietschel M, Meyer-Lindenberg A, Banaschewski T, Brandeis D, Laucht M",NeuroImage,0.081,26879624,-1,-1
stress_00203,https://pubmed.ncbi.nlm.nih.gov/28843886/,Childhood maltreatment is associated with gray matter volume abnormalities in patients with first-episode depression.,"Yang S, Cheng Y, Mo Y, Bai Y, Shen Z, Liu F, Li N, Jiang L, Chen W, Lu Y, Sun X, Xu X",Psychiatry research. Neuroimaging,0.081,28843886,10.1016/j.pscychresns.2017.07.005,-1
stress_00204,https://pubmed.ncbi.nlm.nih.gov/29061703/,Baseline Levels of Rapid Eye Movement Sleep May Protect Against Excessive Activity in Fear-Related Neural Circuitry.,"Lerner I, Lupkin SM, Sinha N, Tsai A, Gluck MA",The Journal of neuroscience : the official journal of the Society for Neuroscience,0.081,29061703,10.1523/JNEUROSCI.0578-17.2017,-1
stress_00205,https://pubmed.ncbi.nlm.nih.gov/17566766/,Neural responses to auditory stimulus deviance under threat of electric shock revealed by spatially-filtered magnetoencephalography.,"Cornwell BR, Baas JM, Johnson L, Holroyd T, Carver FW, Lissek S, Grillon C",NeuroImage,0.08,17566766,-1,-1
stress_00206,https://pubmed.ncbi.nlm.nih.gov/18614265/,Incidental retrieval of emotional contexts in post-traumatic stress disorder and  depression: an fMRI study.,"Whalley MG, Rugg MD, Smith AP, Dolan RJ, Brewin CR",Brain and cognition,0.08,18614265,-1,-1
stress_00207,https://pubmed.ncbi.nlm.nih.gov/21215389/,The CREB1-BDNF-NTRK2 pathway in depression: multiple gene-cognition-environment interactions.,"Juhasz G, Dunham JS, McKie S, Thomas E, Downey D, Chase D, Lloyd-Williams K, Toth ZG, Platt H, Mekli K, Payton A, Elliott R, Williams SR, Anderson IM, Deakin JF",Biological psychiatry,0.08,21215389,-1,-1
stress_00208,https://pubmed.ncbi.nlm.nih.gov/25939653/,Childhood poverty and recruitment of adult emotion regulatory neurocircuitry.,"Liberzon I, Ma ST, Okada G, Ho SS, Swain JE, Evans GW",Social cognitive and affective neuroscience,0.079,25939653,-1,-1
stress_00209,https://pubmed.ncbi.nlm.nih.gov/19398308/,Functional connectivity reveals inefficient working memory systems in post-traumatic stress disorder.,"Shaw ME, Moores KA, Clark RC, McFarlane AC, Strother SC, Bryant RA, Brown GC, Taylor JD",Psychiatry research,0.078,19398308,-1,-1
stress_00210,https://pubmed.ncbi.nlm.nih.gov/24009576/,The social regulation of threat-related attentional disengagement in highly anxious individuals.,"Maresh EL, Beckes L, Coan JA",Frontiers in human neuroscience,0.078,24009576,-1,-1
stress_00211,https://pubmed.ncbi.nlm.nih.gov/24349161/,Negative emotion regulation in patients with posttraumatic stress disorder.,"Xiong K, Zhang Y, Qiu M, Zhang J, Sang L, Wang L, Xie B, Wang J, Li M",PloS one,0.078,24349161,-1,-1
stress_00212,https://pubmed.ncbi.nlm.nih.gov/21212840/,Staying cool when things get hot: emotion regulation modulates neural mechanisms  of memory encoding.,"Hayes JP, Morey RA, Petty CM, Seth S, Smoski MJ, McCarthy G, Labar KS",Frontiers in human neuroscience,0.077,21212840,-1,-1
stress_00213,https://pubmed.ncbi.nlm.nih.gov/22028765/,Interaction between dysfunctional connectivity at rest and heroin cues-induced brain responses in male abstinent heroin-dependent individuals.,"Liu J, Qin W, Yuan K, Li J, Wang W, Li Q, Wang Y, Sun J, von Deneen KM, Liu Y, Tian J",PloS one,0.077,22028765,-1,-1
stress_00214,https://pubmed.ncbi.nlm.nih.gov/23291188/,Predictions in speech comprehension: fMRI evidence on the meter-semantic interface.,"Rothermich K, Kotz SA",NeuroImage,0.077,23291188,-1,-1
stress_00215,https://pubmed.ncbi.nlm.nih.gov/27720744/,"The association of serotonin receptor 3A methylation with maternal violence exposure, neural activity, and child aggression.","Schechter DS, Moser DA, Pointet VC, Aue T, Stenz L, Paoloni-Giacobino A, Adouan W, Manini A, Suardi F, Vital M, Sancho Rossignol A, Cordero MI, Rothenberg M, Ansermet F, Rusconi Serpa S, Dayer AG",Behavioural brain research,0.077,27720744,-1,-1
stress_00216,https://pubmed.ncbi.nlm.nih.gov/14625149/,Amygdala and insular responses to emotionally valenced human faces in small animal specific phobia.,"Wright CI, Martis B, McMullin K, Shin LM, Rauch SL",Biological psychiatry,0.076,14625149,-1,-1
stress_00217,https://pubmed.ncbi.nlm.nih.gov/15955491/,Parahippocampal activation evoked by masked traumatic images in posttraumatic stress disorder: a functional MRI study.,"Sakamoto H, Fukuda R, Okuaki T, Rogers M, Kasai K, Machida T, Shirouzu I, Yamasue H, Akiyama T, Kato N",NeuroImage,0.076,15955491,-1,-1
stress_00218,https://pubmed.ncbi.nlm.nih.gov/18093809/,Neural systems for executive and emotional processing are modulated by symptoms of posttraumatic stress disorder in Iraq War veterans.,"Morey RA, Petty CM, Cooper DA, Labar KS, McCarthy G",Psychiatry research,0.076,18093809,-1,-1
stress_00219,https://pubmed.ncbi.nlm.nih.gov/18321537/,An fMRI investigation of memory encoding in PTSD: influence of symptom severity.,"Dickie EW, Brunet A, Akerib V, Armony JL",Neuropsychologia,0.076,18321537,-1,-1
stress_00220,https://pubmed.ncbi.nlm.nih.gov/19465137/,Brain mediators of cardiovascular responses to social threat: part I: Reciprocal  dorsal and ventral sub-regions of the medial prefrontal cortex and heart-rate reactivity.,"Wager TD, Waugh CE, Lindquist M, Noll DC, Fredrickson BL, Taylor SF",NeuroImage,0.076,19465137,-1,-1
stress_00221,https://pubmed.ncbi.nlm.nih.gov/24815949/,The anatomical foundations of acquired reading disorders: a neuropsychological verification of the dual-route model of reading.,"Ripamonti E, Aggujaro S, Molteni F, Zonca G, Frustaci M, Luzzatti C",Brain and language,0.076,24815949,10.1016/j.bandl.2014.04.001,-1
stress_00222,https://pubmed.ncbi.nlm.nih.gov/27939189/,Linking language to the visual world: Neural correlates of comprehending verbal reference to objects through pointing and visual cues.,"Peeters D, Snijders TM, Hagoort P, Ozyurek A",Neuropsychologia,0.076,27939189,10.1016/j.neuropsychologia.2016.12.004,-1
stress_00223,https://pubmed.ncbi.nlm.nih.gov/20045475/,Self-related awareness and emotion regulation.,"Herwig U, Kaffenberger T, Jancke L, Bruhl AB",NeuroImage,0.075,20045475,10.1016/j.neuroimage.2009.12.089,-1
stress_00224,https://pubmed.ncbi.nlm.nih.gov/23776553/,Voxel-based morphometry in women with borderline personality disorder with and without comorbid posttraumatic stress disorder.,"Niedtfeld I, Schulze L, Krause-Utz A, Demirakca T, Bohus M, Schmahl C",PloS one,0.075,23776553,-1,-1
stress_00225,https://pubmed.ncbi.nlm.nih.gov/28254509/,Human ventromedial prefrontal cortex and the positive affective processing of safety signals.,"Harrison BJ, Fullana MA, Via E, Soriano-Mas C, Vervliet B, Martinez-Zalacain I, Pujol J, Davey CG, Kircher T, Straube B, Cardoner N",NeuroImage,0.075,28254509,-1,-1
stress_00226,https://pubmed.ncbi.nlm.nih.gov/17574445/,Resolving sentence ambiguity with planning and working memory resources: Evidence from fMRI.,"Novais-Santos S, Gee J, Shah M, Troiani V, Work M, Grossman M",NeuroImage,0.074,17574445,-1,-1
stress_00227,https://pubmed.ncbi.nlm.nih.gov/22689216/,Mindfulness meditation training alters cortical representations of interoceptive  attention.,"Farb NA, Segal ZV, Anderson AK",Social cognitive and affective neuroscience,0.074,22689216,-1,-1
stress_00228,https://pubmed.ncbi.nlm.nih.gov/23684978/,Magnetic resonance imaging in patients with borderline personality disorder: a study of volumetric abnormalities.,"O'Neill A, D'Souza A, Carballedo A, Joseph S, Kerskens C, Frodl T",Psychiatry research,0.074,23684978,-1,-1
stress_00229,https://pubmed.ncbi.nlm.nih.gov/25862529/,Effect of direct eye contact in women with PTSD related to interpersonal trauma:  Psychophysiological interaction analysis of connectivity of an innate alarm system.,"Steuwe C, Daniels JK, Frewen PA, Densmore M, Theberge J, Lanius RA",Psychiatry research,0.074,25862529,-1,-1
stress_00230,https://pubmed.ncbi.nlm.nih.gov/27213610/,Perfusion Deficits and Functional Connectivity Alterations in Memory-Related Regions of Patients with Post-Traumatic Stress Disorder.,"Liu Y, Li B, Feng N, Pu H, Zhang X, Lu H, Yin H",PloS one,0.074,27213610,-1,-1
stress_00231,https://pubmed.ncbi.nlm.nih.gov/28712089/,Increased recruitment of cognitive control in the presence of traumatic stimuli in complex PTSD.,"Herzog JI, Niedtfeld I, Rausch S, Thome J, Mueller-Engelmann M, Steil R, Priebe K, Bohus M, Schmahl C",European archives of psychiatry and clinical neuroscience,0.074,28712089,-1,-1
stress_00232,https://pubmed.ncbi.nlm.nih.gov/29438845/,Brain over body-A study on the willful regulation of autonomic function during  cold exposure.,"Muzik O, Reilly KT, Diwadkar VA",NeuroImage,0.074,29438845,-1,-1
stress_00233,https://pubmed.ncbi.nlm.nih.gov/23385487/,Regional cerebral changes and functional connectivity during the observation of negative emotional stimuli in subjects with post-traumatic stress disorder.,"Mazza M, Tempesta D, Pino MC, Catalucci A, Gallucci M, Ferrara M",European archives of psychiatry and clinical neuroscience,0.073,23385487,-1,-1
stress_00234,https://pubmed.ncbi.nlm.nih.gov/25985955/,"Stress, trauma and PTSD: translational insights into the core synaptic circuitry  and its modulation.","Bennett MR, Hatton SN, Lagopoulos J",Brain structure & function,0.073,25985955,-1,-1
stress_00235,https://pubmed.ncbi.nlm.nih.gov/25804310/,Exposure to childhood trauma is associated with altered n-back activation and performance in healthy adults: implications for a commonly used working memory task.,"Philip NS, Sweet LH, Tyrka AR, Carpenter SL, Albright SE, Price LH, Carpenter LL",Brain imaging and behavior,0.072,25804310,-1,-1
stress_00236,https://pubmed.ncbi.nlm.nih.gov/28526931/,Reduced amygdala reactivity and impaired working memory during dissociation in borderline personality disorder.,"Krause-Utz A, Winter D, Schriner F, Chiu CD, Lis S, Spinhoven P, Bohus M, Schmahl C, Elzinga BM",European archives of psychiatry and clinical neuroscience,0.072,28526931,-1,-1
stress_00237,https://pubmed.ncbi.nlm.nih.gov/28753471/,Neural differences underlying face processing in veterans with TBI and co-occurring TBI and PTSD.,"Bomyea J, Matthews SC, Buchsbaum MS, Spadoni AD, Strigo IA, Simmons AN",Journal of affective disorders,0.072,28753471,-1,-1
stress_00238,https://pubmed.ncbi.nlm.nih.gov/16213690/,Quantifiable change in functional brain response to empathic and forgivability judgments with resolution of posttraumatic stress disorder.,"Farrow TF, Hunter MD, Wilkinson ID, Gouneea C, Fawbert D, Smith R, Lee KH, Mason S, Spence SA, Woodruff PW",Psychiatry research,0.071,16213690,-1,-1
stress_00239,https://pubmed.ncbi.nlm.nih.gov/22156722/,Increased anterior cingulate cortex and hippocampus activation in Complex PTSD during encoding of negative words.,"Thomaes K, Dorrepaal E, Draijer N, de Ruiter MB, Elzinga BM, Sjoerds Z, van Balkom AJ, Smit JH, Veltman DJ",Social cognitive and affective neuroscience,0.071,22156722,-1,-1
stress_00240,https://pubmed.ncbi.nlm.nih.gov/22977200/,Effect of direct eye contact in PTSD related to interpersonal trauma: an fMRI study of activation of an innate alarm system.,"Steuwe C, Daniels JK, Frewen PA, Densmore M, Pannasch S, Beblo T, Reiss J, Lanius RA",Social cognitive and affective neuroscience,0.071,22977200,-1,-1
stress_00241,https://pubmed.ncbi.nlm.nih.gov/23501052/,The role of sleep and sleep deprivation in consolidating fear memories.,"Menz MM, Rihm JS, Salari N, Born J, Kalisch R, Pape HC, Marshall L, Buchel C",NeuroImage,0.071,23501052,-1,-1
stress_00242,https://pubmed.ncbi.nlm.nih.gov/18091986/,What are you feeling? Using functional magnetic resonance imaging to assess the modulation of sensory and affective responses during empathy for pain.,"Lamm C, Nusbaum HC, Meltzoff AN, Decety J",PloS one,0.07,18091986,10.1371/journal.pone.0001292,-1
stress_00243,https://pubmed.ncbi.nlm.nih.gov/22112927/,Limbic scars: long-term consequences of childhood maltreatment revealed by functional and structural magnetic resonance imaging.,"Dannlowski U, Stuhrmann A, Beutelmann V, Zwanzger P, Lenzen T, Grotegerd D, Domschke K, Hohoff C, Ohrmann P, Bauer J, Lindner C, Postert C, Konrad C, Arolt V, Heindel W, Suslow T, Kugel H",Biological psychiatry,0.07,22112927,10.1016/j.biopsych.2011.10.021,-1
stress_00244,https://pubmed.ncbi.nlm.nih.gov/23911835/,Negative emotional distraction on neural circuits for working memory in patients  with posttraumatic stress disorder.,"Zhang JN, Xiong KL, Qiu MG, Zhang Y, Xie B, Wang J, Li M, Chen H, Zhang Y, Zhang JJ",Brain research,0.07,23911835,10.1016/j.brainres.2013.07.042,-1
stress_00245,https://pubmed.ncbi.nlm.nih.gov/23916537/,Neural responses during emotional processing before and after cognitive trauma therapy for battered women.,"Aupperle RL, Allard CB, Simmons AN, Flagan T, Thorp SR, Norman SB, Paulus MP, Stein MB",Psychiatry research,0.07,23916537,10.1016/j.pscychresns.2013.05.001,-1
stress_00246,https://pubmed.ncbi.nlm.nih.gov/24936431/,Prefrontal responses to digit span memory phases in patients with post-traumatic  stress disorder (PTSD): a functional near infrared spectroscopy study.,"Tian F, Yennu A, Smith-Osborne A, Gonzalez-Lima F, North CS, Liu H",NeuroImage. Clinical,0.07,24936431,-1,-1
stress_00247,https://pubmed.ncbi.nlm.nih.gov/21130172/,Resting state functional connectivity within the cingulate cortex jointly predicts agreeableness and stressor-evoked cardiovascular reactivity.,"Ryan JP, Sheu LK, Gianaros PJ",NeuroImage,0.069,21130172,-1,-1
stress_00248,https://pubmed.ncbi.nlm.nih.gov/27114901/,Autonomic correlations with MRI are abnormal in the brainstem vasomotor centre in Chronic Fatigue Syndrome.,"Barnden LR, Kwiatek R, Crouch B, Burnet R, Del Fante P",NeuroImage. Clinical,0.069,27114901,-1,-1
stress_00249,https://pubmed.ncbi.nlm.nih.gov/22576840/,The neural substrate for working memory of tactile surface texture.,"Kaas AL, van Mier H, Visser M, Goebel R",Human brain mapping,0.068,22576840,-1,-1
stress_00250,https://pubmed.ncbi.nlm.nih.gov/23483523/,Neural networks supporting autobiographical memory retrieval in posttraumatic stress disorder.,"St Jacques PL, Kragel PA, Rubin DC","Cognitive, affective & behavioral neuroscience",0.068,23483523,-1,-1
stress_00251,https://pubmed.ncbi.nlm.nih.gov/24146643/,Avoidant symptoms in PTSD predict fear circuit activation during multimodal fear  extinction.,"Sripada RK, Garfinkel SN, Liberzon I",Frontiers in human neuroscience,0.068,24146643,-1,-1
stress_00252,https://pubmed.ncbi.nlm.nih.gov/24400079/,White matter microstructural changes as vulnerability factors and acquired signs  of post-earthquake distress.,"Sekiguchi A, Sugiura M, Taki Y, Kotozaki Y, Nouchi R, Takeuchi H, Araki T, Hanawa S, Nakagawa S, Miyauchi CM, Sakuma A, Kawashima R",PloS one,0.068,24400079,-1,-1
stress_00253,https://pubmed.ncbi.nlm.nih.gov/25552572/,Neural and cortisol responses during play with human and computer partners in children with autism.,"Edmiston EK, Merkle K, Corbett BA",Social cognitive and affective neuroscience,0.068,25552572,-1,-1
stress_00254,https://pubmed.ncbi.nlm.nih.gov/26011637/,Community structure analysis of transcriptional networks reveals distinct molecular pathways for early- and late-onset temporal lobe epilepsy with childhood febrile seizures.,"Moreira-Filho CA, Bando SY, Bertonha FB, Iamashita P, Silva FN, Costa Lda F, Silva AV, Castro LH, Wen HT",PloS one,0.068,26011637,-1,-1
stress_00255,https://pubmed.ncbi.nlm.nih.gov/25137414/,Resting state functional connectivity of the anterior cingulate cortex in veterans with and without post-traumatic stress disorder.,"Kennis M, Rademaker AR, van Rooij SJ, Kahn RS, Geuze E",Human brain mapping,0.067,25137414,-1,-1
stress_00256,https://pubmed.ncbi.nlm.nih.gov/27672554/,Alpha oscillation neurofeedback modulates amygdala complex connectivity and arousal in posttraumatic stress disorder.,"Nicholson AA, Ros T, Frewen PA, Densmore M, Theberge J, Kluetsch RC, Jetly R, Lanius RA",NeuroImage. Clinical,0.067,27672554,-1,-1
stress_00257,https://pubmed.ncbi.nlm.nih.gov/27853428/,Goal Directed Worry Rules Are Associated with Distinct Patterns of Amygdala Functional Connectivity and Vagal Modulation during Perseverative Cognition.,"Meeten F, Davey GC, Makovac E, Watson DR, Garfinkel SN, Critchley HD, Ottaviani C",Frontiers in human neuroscience,0.067,27853428,-1,-1
stress_00258,https://pubmed.ncbi.nlm.nih.gov/16038681/,Neural networks of information processing in posttraumatic stress disorder: a functional magnetic resonance imaging study.,"Bryant RA, Felmingham KL, Kemp AH, Barton M, Peduto AS, Rennie C, Gordon E, Williams LM",Biological psychiatry,0.066,16038681,-1,-1
stress_00259,https://pubmed.ncbi.nlm.nih.gov/18639236/,Functional activation and neural networks in women with posttraumatic stress disorder related to intimate partner violence.,"Simmons AN, Paulus MP, Thorp SR, Matthews SC, Norman SB, Stein MB",Biological psychiatry,0.066,18639236,-1,-1
stress_00260,https://pubmed.ncbi.nlm.nih.gov/19858108/,Serotonin transporter genotype modulates amygdala activity during mood regulation.,"Gillihan SJ, Rao H, Wang J, Detre JA, Breland J, Sankoorikal GM, Brodkin ES, Farah MJ",Social cognitive and affective neuroscience,0.066,19858108,-1,-1
stress_00261,https://pubmed.ncbi.nlm.nih.gov/24145409/,Effects of childhood poverty and chronic stress on emotion regulatory brain function in adulthood.,"Kim P, Evans GW, Angstadt M, Ho SS, Sripada CS, Swain JE, Liberzon I, Phan KL",Proceedings of the National Academy of Sciences of the United States of America,0.066,24145409,10.1073/pnas.1308240110,-1
stress_00262,https://pubmed.ncbi.nlm.nih.gov/24795442/,Life stress in adolescence predicts early adult reward-related brain function and alcohol dependence.,"Casement MD, Shaw DS, Sitnick SL, Musselman SC, Forbes EE",Social cognitive and affective neuroscience,0.066,24795442,10.1093/scan/nsu061,-1
stress_00263,https://pubmed.ncbi.nlm.nih.gov/19081708/,Increased activation of the left hippocampus region in Complex PTSD during encoding and recognition of emotional words: a pilot study.,"Thomaes K, Dorrepaal E, Draijer NP, de Ruiter MB, Elzinga BM, van Balkom AJ, Smoor PL, Smit J, Veltman DJ",Psychiatry research,0.065,19081708,-1,-1
stress_00264,https://pubmed.ncbi.nlm.nih.gov/21047627/,Receptive prosody in nonfluent primary progressive aphasias.,"Rohrer JD, Sauter D, Scott S, Rossor MN, Warren JD",Cortex; a journal devoted to the study of the nervous system and behavior,0.065,21047627,-1,-1
