paper_name,paper_url,Title,Author,Journal,Loading,PMID,Doi,download_status
stress_00091,https://pubmed.ncbi.nlm.nih.gov/21880911/,Corticotropin-releasing factor receptor 1 antagonist alters regional activation and effective connectivity in an emotional-arousal circuit during expectation of  abdominal pain.,"Hubbard CS, Labus JS, Bueller J, Stains J, Suyenobu B, Dukes GE, Kelleher DL, Tillisch K, Naliboff BD, Mayer EA",The Journal of neuroscience : the official journal of the Society for Neuroscience,0.215,21880911,-1,-1
stress_00092,https://pubmed.ncbi.nlm.nih.gov/22395084/,"Brain hypoactivation, autonomic nervous system dysregulation, and gonadal hormones in depression: a preliminary study.","Holsen LM, Lee JH, Spaeth SB, Ogden LA, Klibanski A, Whitfield-Gabrieli S, Sloan RP, Goldstein JM",Neuroscience letters,0.21,22395084,-1,-1
stress_00093,https://pubmed.ncbi.nlm.nih.gov/24862560/,Serotonin transporter gene methylation is associated with hippocampal gray matter volume.,"Dannlowski U, Kugel H, Redlich R, Halik A, Schneider I, Opel N, Grotegerd D, Schwarte K, Schettler C, Ambree O, Rust S, Domschke K, Arolt V, Heindel W, Baune BT, Suslow T, Zhang W, Hohoff C",Human brain mapping,0.207,24862560,-1,-1
stress_00094,https://pubmed.ncbi.nlm.nih.gov/22586252/,MBSR vs aerobic exercise in social anxiety: fMRI of emotion regulation of negative self-beliefs.,"Goldin P, Ziv M, Jazaieri H, Hahn K, Gross JJ",Social cognitive and affective neuroscience,0.196,22586252,-1,-1
stress_00095,https://pubmed.ncbi.nlm.nih.gov/29572771/,Brain functional connectivity correlates of coping styles.,"Santarnecchi E, Sprugnoli G, Tatti E, Mencarelli L, Neri F, Momi D, Di Lorenzo G, Pascual-Leone A, Rossi S, Rossi A","Cognitive, affective & behavioral neuroscience",0.196,29572771,-1,-1
stress_00096,https://pubmed.ncbi.nlm.nih.gov/24086358/,Altered olfactory processing of stress-related body odors and artificial odors in patients with panic disorder.,"Wintermann GB, Donix M, Joraschky P, Gerber J, Petrowski K",PloS one,0.191,24086358,-1,-1
stress_00097,https://pubmed.ncbi.nlm.nih.gov/23967320/,Enhanced sympathetic arousal in response to FMRI scanning correlates with task induced activations and deactivations.,"Muehlhan M, Lueken U, Siegert J, Wittchen HU, Smolka MN, Kirschbaum C",PloS one,0.188,23967320,-1,-1
stress_00098,https://pubmed.ncbi.nlm.nih.gov/19427910/,Regulation of natural killer cell redistribution by prefrontal cortex during stochastic learning.,"Ohira H, Fukuyama S, Kimura K, Nomura M, Isowa T, Ichikawa N, Matsunaga M, Shinoda J, Yamada J",NeuroImage,0.184,19427910,-1,-1
stress_00099,https://pubmed.ncbi.nlm.nih.gov/29102026/,Amygdala Reward Reactivity Mediates the Association Between Preschool Stress Response and Depression Severity.,"Gaffrey MS, Barch DM, Bogdan R, Farris K, Petersen SE, Luby JL",Biological psychiatry,0.182,29102026,-1,-1
stress_00100,https://pubmed.ncbi.nlm.nih.gov/21938758/,Dynamically changing effects of corticosteroids on human hippocampal and prefrontal processing.,"Henckens MJ, Pu Z, Hermans EJ, van Wingen GA, Joels M, Fernandez G",Human brain mapping,0.173,21938758,-1,-1
stress_00101,https://pubmed.ncbi.nlm.nih.gov/20493234/,Neural and behavioral responses to threatening emotion faces in children as a function of the short allele of the serotonin transporter gene.,"Thomason ME, Henry ML, Paul Hamilton J, Joormann J, Pine DS, Ernst M, Goldman D, Mogg K, Bradley BP, Britton JC, Lindstrom KM, Monk CS, Sankin LS, Louro HM, Gotlib IH",Biological psychology,0.171,20493234,10.1016/j.biopsycho.2010.04.009,-1
stress_00102,https://pubmed.ncbi.nlm.nih.gov/20600990/,Evolution and resolution of human brain perfusion responses to the stress of induced hypoglycemia.,"Teh MM, Dunn JT, Choudhary P, Samarasinghe Y, Macdonald I, O'Doherty M, Marsden P, Reed LJ, Amiel SA",NeuroImage,0.169,20600990,10.1016/j.neuroimage.2010.06.033,-1
stress_00103,https://pubmed.ncbi.nlm.nih.gov/15013829/,Posttraumatic stress disorder and fMRI activation patterns of traumatic memory in patients with borderline personality disorder.,"Driessen M, Beblo T, Mertens M, Piefke M, Rullkoetter N, Silva-Saavedra A, Reddemann L, Rau H, Markowitsch HJ, Wulff H, Lange W, Woermann FG",Biological psychiatry,0.168,15013829,10.1016/j.biopsych.2003.08.018,-1
stress_00104,https://pubmed.ncbi.nlm.nih.gov/27881783/,Multivariate Brain Prediction of Heart Rate and Skin Conductance Responses to Social Threat.,"Eisenbarth H, Chang LJ, Wager TD",The Journal of neuroscience : the official journal of the Society for Neuroscience,0.168,27881783,-1,-1
stress_00105,https://pubmed.ncbi.nlm.nih.gov/16839780/,Influence of the stress hormone cortisol on fear conditioning in humans: evidence for sex differences in the response of the prefrontal cortex.,"Stark R, Wolf OT, Tabbert K, Kagerer S, Zimmermann M, Kirsch P, Schienle A, Vaitl D",NeuroImage,0.166,16839780,-1,-1
stress_00106,https://pubmed.ncbi.nlm.nih.gov/26149610/,Controllability modulates the neural response to predictable but not unpredictable threat in humans.,"Wood KH, Wheelock MD, Shumen JR, Bowen KH, Ver Hoef LW, Knight DC",NeuroImage,0.162,26149610,-1,-1
stress_00107,https://pubmed.ncbi.nlm.nih.gov/17913515/,Imaging brain and immune association accompanying cognitive appraisal of an acute stressor.,"Ohira H, Isowa T, Nomura M, Ichikawa N, Kimura K, Miyakoshi M, Iidaka T, Fukuyama S, Nakajima T, Yamada J",NeuroImage,0.16,17913515,-1,-1
stress_00108,https://pubmed.ncbi.nlm.nih.gov/21436038/,Time-dependent corticosteroid modulation of prefrontal working memory processing.,"Henckens MJ, van Wingen GA, Joels M, Fernandez G",Proceedings of the National Academy of Sciences of the United States of America,0.16,21436038,-1,-1
stress_00109,https://pubmed.ncbi.nlm.nih.gov/25844311/,Multimodal MRI and cognitive function in patients with breast cancer prior to adjuvant treatment--the role of fatigue.,"Menning S, de Ruiter MB, Veltman DJ, Koppelmans V, Kirschbaum C, Boogerd W, Reneman L, Schagen SB",NeuroImage. Clinical,0.16,25844311,-1,-1
stress_00110,https://pubmed.ncbi.nlm.nih.gov/25208742/,Neural emotion regulation circuitry underlying anxiolytic effects of perceived control over pain.,"Salomons TV, Nusslock R, Detloff A, Johnstone T, Davidson RJ",Journal of cognitive neuroscience,0.158,25208742,-1,-1
stress_00111,https://pubmed.ncbi.nlm.nih.gov/21184220/,Appetite at high altitude: an fMRI study on the impact of prolonged high-altitude residence on gustatory neural processing.,"Yan X, Zhang J, Gong Q, Weng X",Experimental brain research,0.155,21184220,-1,-1
stress_00112,https://pubmed.ncbi.nlm.nih.gov/28032303/,"Neural circuitry of emotion regulation: Effects of appraisal, attention, and cortisol administration.","Ma ST, Abelson JL, Okada G, Taylor SF, Liberzon I","Cognitive, affective & behavioral neuroscience",0.155,28032303,-1,-1
stress_00113,https://pubmed.ncbi.nlm.nih.gov/15269107/,The functional neuroanatomy of metrical stress evaluation of perceived and imagined spoken words.,"Aleman A, Formisano E, Koppenhagen H, Hagoort P, de Haan EH, Kahn RS","Cerebral cortex (New York, N.Y. : 1991)",0.153,15269107,-1,-1
stress_00114,https://pubmed.ncbi.nlm.nih.gov/22717383/,Psychological and neural mechanisms of trait mindfulness in reducing depression vulnerability.,"Paul NA, Stanton SJ, Greeson JM, Smoski MJ, Wang L",Social cognitive and affective neuroscience,0.152,22717383,-1,-1
stress_00115,https://pubmed.ncbi.nlm.nih.gov/21334442/,Impact of Mindfulness-Based Stress Reduction training on intrinsic brain connectivity.,"Kilpatrick LA, Suyenobu BY, Smith SR, Bueller JA, Goodman T, Creswell JD, Tillisch K, Mayer EA, Naliboff BD",NeuroImage,0.151,21334442,-1,-1
stress_00116,https://pubmed.ncbi.nlm.nih.gov/28045980/,Long-Term Effects of Acute Stress on the Prefrontal-Limbic System in the Healthy  Adult.,"Li Y, Hou X, Wei D, Du X, Zhang Q, Liu G, Qiu J",PloS one,0.15,28045980,-1,-1
stress_00117,https://pubmed.ncbi.nlm.nih.gov/27455992/,Posterior and prefrontal contributions to the development posttraumatic stress disorder symptom severity: an fMRI study of symptom provocation in acute stress disorder.,"Cwik JC, Sartory G, Nuyken M, Schurholt B, Seitz RJ",European archives of psychiatry and clinical neuroscience,0.148,27455992,-1,-1
stress_00118,https://pubmed.ncbi.nlm.nih.gov/23436504/,The stress model of chronic pain: evidence from basal cortisol and hippocampal structure and function in humans.,"Vachon-Presseau E, Roy M, Martel MO, Caron E, Marin MF, Chen J, Albouy G, Plante I, Sullivan MJ, Lupien SJ, Rainville P",Brain : a journal of neurology,0.143,23436504,-1,-1
stress_00119,https://pubmed.ncbi.nlm.nih.gov/24090510/,Regional homogeneity and resting state functional connectivity: associations with exposure to early life stress.,"Philip NS, Kuras YI, Valentine TR, Sweet LH, Tyrka AR, Price LH, Carpenter LL",Psychiatry research,0.143,24090510,-1,-1
stress_00120,https://pubmed.ncbi.nlm.nih.gov/20561537/,Early-life stress is associated with impairment in cognitive control in adolescence: an fMRI study.,"Mueller SC, Maheu FS, Dozier M, Peloso E, Mandell D, Leibenluft E, Pine DS, Ernst M",Neuropsychologia,0.142,20561537,-1,-1
stress_00121,https://pubmed.ncbi.nlm.nih.gov/20727906/,The production and detection of deception in an interactive game.,"Sip KE, Lynge M, Wallentin M, McGregor WB, Frith CD, Roepstorff A",Neuropsychologia,0.142,20727906,10.1016/j.neuropsychologia.2010.08.013,-1
stress_00122,https://pubmed.ncbi.nlm.nih.gov/28667881/,Grey matter density changes of structures involved in Posttraumatic Stress Disorder (PTSD) after recovery following Eye Movement Desensitization and Reprocessing (EMDR) therapy.,"Boukezzi S, El Khoury-Malhame M, Auzias G, Reynaud E, Rousseau PF, Richard E, Zendjidjian X, Roques J, Castelli N, Correard N, Guyon V, Gellato C, Samuelian JC, Cancel A, Comte M, Latinus M, Guedj E, Khalfa S",Psychiatry research. Neuroimaging,0.138,28667881,10.1016/j.pscychresns.2017.06.009,-1
stress_00123,https://pubmed.ncbi.nlm.nih.gov/24642273/,Neural effects of mental fatigue caused by continuous attention load: a magnetoencephalography study.,"Tanaka M, Ishii A, Watanabe Y",Brain research,0.133,24642273,10.1016/j.brainres.2014.03.009,-1
stress_00124,https://pubmed.ncbi.nlm.nih.gov/21907809/,Cognitive reappraisal in trauma-exposed women with borderline personality disorder.,"Lang S, Kotchoubey B, Frick C, Spitzer C, Grabe HJ, Barnow S",NeuroImage,0.129,21907809,-1,-1
stress_00125,https://pubmed.ncbi.nlm.nih.gov/25184336/,Reduced amygdala and ventral striatal activity to happy faces in PTSD is associated with emotional numbing.,"Felmingham KL, Falconer EM, Williams L, Kemp AH, Allen A, Peduto A, Bryant RA",PloS one,0.127,25184336,-1,-1
stress_00126,https://pubmed.ncbi.nlm.nih.gov/21145215/,Cerebral blood flow changes associated with different meditation practices and perceived depth of meditation.,"Wang DJ, Rao H, Korczykowski M, Wintering N, Pluta J, Khalsa DS, Newberg AB",Psychiatry research,0.126,21145215,-1,-1
stress_00127,https://pubmed.ncbi.nlm.nih.gov/18455372/,Abnormal recruitment of working memory updating networks during maintenance of trauma-neutral information in post-traumatic stress disorder.,"Moores KA, Clark CR, McFarlane AC, Brown GC, Puce A, Taylor DJ",Psychiatry research,0.122,18455372,-1,-1
stress_00128,https://pubmed.ncbi.nlm.nih.gov/21787870/,Phonological manipulation between speech perception and production activates a parieto-frontal circuit.,"Peschke C, Ziegler W, Eisenberger J, Baumgaertner A",NeuroImage,0.122,21787870,-1,-1
stress_00129,https://pubmed.ncbi.nlm.nih.gov/27039701/,Sex differences in the functional connectivity of the amygdalae in association with cortisol.,"Kogler L, Muller VI, Seidel EM, Boubela R, Kalcher K, Moser E, Habel U, Gur RC, Eickhoff SB, Derntl B",NeuroImage,0.122,27039701,-1,-1
stress_00130,https://pubmed.ncbi.nlm.nih.gov/16514105/,Brain activation during sight gags and language-dependent humor.,"Watson KK, Matthews BJ, Allman JM","Cerebral cortex (New York, N.Y. : 1991)",0.121,16514105,-1,-1
stress_00131,https://pubmed.ncbi.nlm.nih.gov/22652538/,The neural correlates of maternal sensitivity: an fMRI study.,"Musser ED, Kaiser-Laurent H, Ablow JC",Developmental cognitive neuroscience,0.121,22652538,-1,-1
stress_00132,https://pubmed.ncbi.nlm.nih.gov/22910447/,The effects of temporal unpredictability in anticipation of negative events in combat veterans with PTSD.,"Simmons AN, Flagan TM, Wittmann M, Strigo IA, Matthews SC, Donovan H, Lohr JB, Paulus MP",Journal of affective disorders,0.121,22910447,-1,-1
stress_00133,https://pubmed.ncbi.nlm.nih.gov/23021615/,"Post-traumatic stress symptoms correlate with smaller subgenual cingulate, caudate, and insula volumes in unmedicated combat veterans.","Herringa R, Phillips M, Almeida J, Insana S, Germain A",Psychiatry research,0.121,23021615,-1,-1
stress_00134,https://pubmed.ncbi.nlm.nih.gov/19446647/,"'Negativity bias' in risk for depression and anxiety: brain-body fear circuitry correlates, 5-HTT-LPR and early life stress.","Williams LM, Gatt JM, Schofield PR, Olivieri G, Peduto A, Gordon E",NeuroImage,0.118,19446647,-1,-1
stress_00135,https://pubmed.ncbi.nlm.nih.gov/27722829/,Post-traumatic stress influences local and remote functional connectivity: a resting-state functional magnetic resonance imaging study.,"Ke J, Chen F, Qi R, Xu Q, Zhong Y, Chen L, Li J, Zhang L, Lu G",Brain imaging and behavior,0.117,27722829,-1,-1
stress_00136,https://pubmed.ncbi.nlm.nih.gov/27448273/,Differential Activation in Amygdala and Plasma Noradrenaline during Colorectal Distention by Administration of Corticotropin-Releasing Hormone between Healthy Individuals and Patients with Irritable B,"Tanaka Y, Kanazawa M, Kano M, Morishita J, Hamaguchi T, Van Oudenhove L, Ly HG, Dupont P, Tack J, Yamaguchi T, Yanai K, Tashiro M, Fukudo S",PloS one,0.116,27448273,-1,-1
stress_00137,https://pubmed.ncbi.nlm.nih.gov/23269472/,Early life stress is associated with greater default network deactivation during  working memory in healthy controls: a preliminary report.,"Philip NS, Sweet LH, Tyrka AR, Price LH, Carpenter LL, Kuras YI, Clark US, Niaura RS",Brain imaging and behavior,0.113,23269472,-1,-1
stress_00138,https://pubmed.ncbi.nlm.nih.gov/16150613/,Functional imaging of stress urinary incontinence.,"Di Gangi Herms AM, Veit R, Reisenauer C, Herms A, Grodd W, Enck P, Stenzl A, Birbaumer N",NeuroImage,0.111,16150613,-1,-1
stress_00139,https://pubmed.ncbi.nlm.nih.gov/23522878/,Egocentric virtual maze learning in adult survivors of childhood abuse with dissociative disorders: evidence from functional magnetic resonance imaging.,"Weniger G, Siemerkus J, Barke A, Lange C, Ruhleder M, Sachsse U, Schmidt-Samoa C, Dechent P, Irle E",Psychiatry research,0.111,23522878,-1,-1
stress_00140,https://pubmed.ncbi.nlm.nih.gov/23918376/,Brief meditation training induces smoking reduction.,"Tang YY, Tang R, Posner MI",Proceedings of the National Academy of Sciences of the United States of America,0.111,23918376,-1,-1
stress_00141,https://pubmed.ncbi.nlm.nih.gov/16861005/,Predictability modulates the affective and sensory-discriminative neural processing of pain.,"Carlsson K, Andersson J, Petrovic P, Petersson KM, Ohman A, Ingvar M",NeuroImage,0.11,16861005,-1,-1
stress_00142,https://pubmed.ncbi.nlm.nih.gov/22952599/,Decreased premotor cortex volume in victims of urban violence with posttraumatic  stress disorder.,"Rocha-Rego V, Pereira MG, Oliveira L, Mendlowicz MV, Fiszman A, Marques-Portella C, Berger W, Chu C, Joffily M, Moll J, Mari JJ, Figueira I, Volchan E",PloS one,0.11,22952599,-1,-1
stress_00143,https://pubmed.ncbi.nlm.nih.gov/24616684/,Nondirective meditation activates default mode network and areas associated with  memory retrieval and emotional processing.,"Xu J, Vik A, Groote IR, Lagopoulos J, Holen A, Ellingsen O, Haberg AK, Davanger S",Frontiers in human neuroscience,0.109,24616684,10.3389/fnhum.2014.00086,-1
stress_00144,https://pubmed.ncbi.nlm.nih.gov/25459874/,The potential of infant fMRI research and the study of early life stress as a promising exemplar.,"Graham AM, Pfeifer JH, Fisher PA, Lin W, Gao W, Fair DA",Developmental cognitive neuroscience,0.108,25459874,10.1016/j.dcn.2014.09.005,-1
stress_00145,https://pubmed.ncbi.nlm.nih.gov/19551135/,Induction of empathy by the smell of anxiety.,"Prehn-Kristensen A, Wiesner C, Bergmann TO, Wolff S, Jansen O, Mehdorn HM, Ferstl R, Pause BM",PloS one,0.105,19551135,10.1371/journal.pone.0005987,-1
stress_00146,https://pubmed.ncbi.nlm.nih.gov/25360090/,Working memory training improves emotional states of healthy individuals.,"Takeuchi H, Taki Y, Nouchi R, Hashizume H, Sekiguchi A, Kotozaki Y, Nakagawa S, Miyauchi CM, Sassa Y, Kawashima R",Frontiers in systems neuroscience,0.105,25360090,-1,-1
stress_00147,https://pubmed.ncbi.nlm.nih.gov/23155380/,Different regional gray matter loss in recent onset PTSD and non PTSD after a single prolonged trauma exposure.,"Chen Y, Fu K, Feng C, Tang L, Zhang J, Huan Y, Cui J, Mu Y, Qi S, Xiong L, Ma C, Wang H, Tan Q, Yin H",PloS one,0.103,23155380,-1,-1
stress_00148,https://pubmed.ncbi.nlm.nih.gov/23685776/,How emotional abilities modulate the influence of early life stress on hippocampal functioning.,"Aust S, Alkan Hartwig E, Koelsch S, Heekeren HR, Heuser I, Bajbouj M",Social cognitive and affective neuroscience,0.103,23685776,-1,-1
stress_00149,https://pubmed.ncbi.nlm.nih.gov/24349515/,Alterations in white matter microstructure as vulnerability factors and acquired  signs of traffic accident-induced PTSD.,"Sun Y, Wang Z, Ding W, Wan J, Zhuang Z, Zhang Y, Liu Y, Zhou Y, Xu J",PloS one,0.103,24349515,-1,-1
stress_00150,https://pubmed.ncbi.nlm.nih.gov/17617382/,Oxytocin attenuates amygdala responses to emotional faces regardless of valence.,"Domes G, Heinrichs M, Glascher J, Buchel C, Braus DF, Herpertz SC",Biological psychiatry,0.102,17617382,-1,-1
stress_00151,https://pubmed.ncbi.nlm.nih.gov/23920149/,Exposure to traumatic experiences is associated with abnormal neural mechanism during charitable donation.,"Wei D, Wang K, Shen Y, Du X, Li W, Dupuis-Roy N, Qiu J, Zhang Q",Psychiatry research,0.102,23920149,-1,-1
stress_00152,https://pubmed.ncbi.nlm.nih.gov/22406758/,Stress hormones are associated with the neuronal correlates of instructed fear conditioning.,"Merz CJ, Stark R, Vaitl D, Tabbert K, Wolf OT",Biological psychology,0.1,22406758,-1,-1
stress_00153,https://pubmed.ncbi.nlm.nih.gov/23681887/,Blunted feelings: Alexithymia is associated with a diminished neural response to  speech prosody.,"Goerlich-Dobre KS, Witteman J, Schiller NO, van Heuven VJ, Aleman A, Martens S",Social cognitive and affective neuroscience,0.099,23681887,-1,-1
stress_00154,https://pubmed.ncbi.nlm.nih.gov/22586106/,PKCalpha is genetically linked to memory capacity in healthy subjects and to risk for posttraumatic stress disorder in genocide survivors.,"de Quervain DJ, Kolassa IT, Ackermann S, Aerni A, Boesiger P, Demougin P, Elbert T, Ertl V, Gschwind L, Hadziselimovic N, Hanser E, Heck A, Hieber P, Huynh KD, Klarhofer M, Luechinger R, Rasch B, Scheffler K, Spalek K, Stippich C, Vogler C, Vukojevic V, Stetak A, Papassotiropoulos A",Proceedings of the National Academy of Sciences of the United States of America,0.097,22586106,-1,-1
stress_00155,https://pubmed.ncbi.nlm.nih.gov/22019203/,Regional heterogeneity in the processing and the production of speech in the human planum temporale.,"Tremblay P, Deschamps I, Gracco VL",Cortex; a journal devoted to the study of the nervous system and behavior,0.096,22019203,-1,-1
stress_00156,https://pubmed.ncbi.nlm.nih.gov/25366378/,Close-range blast exposure is associated with altered functional connectivity in  Veterans independent of concussion symptoms at time of exposure.,"Robinson ME, Lindemer ER, Fonda JR, Milberg WP, McGlinchey RE, Salat DH",Human brain mapping,0.096,25366378,-1,-1
stress_00157,https://pubmed.ncbi.nlm.nih.gov/15852381/,Preservation of limbic and paralimbic structures in aging.,"Grieve SM, Clark CR, Williams LM, Peduto AJ, Gordon E",Human brain mapping,0.095,15852381,-1,-1
stress_00158,https://pubmed.ncbi.nlm.nih.gov/27531977/,Neural Response during the Activation of the Attachment System in Patients with Borderline Personality Disorder: An fMRI Study.,"Buchheim A, Erk S, George C, Kachele H, Martius P, Pokorny D, Spitzer M, Walter H",Frontiers in human neuroscience,0.095,27531977,-1,-1
stress_00159,https://pubmed.ncbi.nlm.nih.gov/12559652/,Recall of emotional states in posttraumatic stress disorder: an fMRI investigation.,"Lanius RA, Williamson PC, Hopper J, Densmore M, Boksman K, Gupta MA, Neufeld RW, Gati JS, Menon RS",Biological psychiatry,0.094,12559652,-1,-1
stress_00160,https://pubmed.ncbi.nlm.nih.gov/14683707/,Personality influences limbic-cortical interactions during sad mood induction.,"Keightley ML, Seminowicz DA, Bagby RM, Costa PT, Fossati P, Mayberg HS",NeuroImage,0.094,14683707,-1,-1
stress_00161,https://pubmed.ncbi.nlm.nih.gov/26248899/,Dissociated neural effects of cortisol depending on threat escapability.,"Montoya ER, van Honk J, Bos PA, Terburg D",Human brain mapping,0.094,26248899,-1,-1
stress_00162,https://pubmed.ncbi.nlm.nih.gov/16517071/,Hypocapnia related changes in pain-induced brain activation as measured by functional MRI.,"Terekhin P, Forster C",Neuroscience letters,0.093,16517071,-1,-1
stress_00163,https://pubmed.ncbi.nlm.nih.gov/18781590/,The human mirror neuron system in a population with deficient self-awareness: an  fMRI study in alexithymia.,"Moriguchi Y, Ohnishi T, Decety J, Hirakata M, Maeda M, Matsuda H, Komaki G",Human brain mapping,0.092,18781590,10.1002/hbm.20653,-1
stress_00164,https://pubmed.ncbi.nlm.nih.gov/21440563/,Amygdala activity correlates with attentional bias in PTSD.,"El Khoury-Malhame M, Reynaud E, Soriano A, Michael K, Salgado-Pineda P, Zendjidjian X, Gellato C, Eric F, Lefebvre MN, Rouby F, Samuelian JC, Anton JL, Blin O, Khalfa S",Neuropsychologia,0.092,21440563,10.1016/j.neuropsychologia.2011.03.025,-1
stress_00165,https://pubmed.ncbi.nlm.nih.gov/22021653/,An fMRI study of the brain responses of traumatized mothers to viewing their toddlers during separation and play.,"Schechter DS, Moser DA, Wang Z, Marsh R, Hao X, Duan Y, Yu S, Gunter B, Murphy D, McCaw J, Kangarlu A, Willheim E, Myers MM, Hofer MA, Peterson BS",Social cognitive and affective neuroscience,0.092,22021653,10.1093/scan/nsr069,-1
stress_00166,https://pubmed.ncbi.nlm.nih.gov/23207576/,An fMRI investigation of posttraumatic flashbacks.,"Whalley MG, Kroes MC, Huntley Z, Rugg MD, Davis SW, Brewin CR",Brain and cognition,0.092,23207576,-1,-1
stress_00167,https://pubmed.ncbi.nlm.nih.gov/24760033/,Left and right amygdala - mediofrontal cortical functional connectivity is differentially modulated by harm avoidance.,"Baeken C, Marinazzo D, Van Schuerbeek P, Wu GR, De Mey J, Luypaert R, De Raedt R",PloS one,0.092,24760033,-1,-1
stress_00168,https://pubmed.ncbi.nlm.nih.gov/22464826/,Resting cerebral glucose metabolism and perfusion patterns in women with posttraumatic stress disorder related to sexual assault.,"Kim SY, Chung YK, Kim BS, Lee SJ, Yoon JK, An YS",Psychiatry research,0.091,22464826,-1,-1
stress_00169,https://pubmed.ncbi.nlm.nih.gov/22563395/,The impact of social disparity on prefrontal function in childhood.,"Sheridan MA, Sarsour K, Jutte D, D'Esposito M, Boyce WT",PloS one,0.091,22563395,-1,-1
stress_00170,https://pubmed.ncbi.nlm.nih.gov/16207891/,Hormonal cycle modulates arousal circuitry in women using functional magnetic resonance imaging.,"Goldstein JM, Jerram M, Poldrack R, Ahern T, Kennedy DN, Seidman LJ, Makris N",The Journal of neuroscience : the official journal of the Society for Neuroscience,0.089,16207891,-1,-1
stress_00171,https://pubmed.ncbi.nlm.nih.gov/18597797/,Altered reward processing in the nucleus accumbens and mesial prefrontal cortex of patients with posttraumatic stress disorder.,"Sailer U, Robinson S, Fischmeister FP, Konig D, Oppenauer C, Lueger-Schuster B, Moser E, Kryspin-Exner I, Bauer H",Neuropsychologia,0.089,18597797,-1,-1
stress_00172,https://pubmed.ncbi.nlm.nih.gov/19505585/,High-frequency heart rate variability and cortico-striatal activity in men and women with social phobia.,"Ahs F, Sollers JJ 3rd, Furmark T, Fredrikson M, Thayer JF",NeuroImage,0.089,19505585,-1,-1
stress_00173,https://pubmed.ncbi.nlm.nih.gov/26440126/,Sex commonalities and differences in the relationship between resilient personality and the intrinsic connectivity of the salience and default mode networks.,"Kilpatrick LA, Istrin JJ, Gupta A, Naliboff BD, Tillisch K, Labus JS, Mayer EA",Biological psychology,0.089,26440126,-1,-1
stress_00174,https://pubmed.ncbi.nlm.nih.gov/16009569/,Left inferior prefrontal cortex activation during a semantic decision-making task predicts the degree of semantic organization.,"Simmons A, Miller D, Feinstein JS, Goldberg TE, Paulus MP",NeuroImage,0.088,16009569,-1,-1
stress_00175,https://pubmed.ncbi.nlm.nih.gov/16306323/,Neural correlates of the spontaneous phase transition during bimanual coordination.,"Aramaki Y, Honda M, Okada T, Sadato N","Cerebral cortex (New York, N.Y. : 1991)",0.088,16306323,-1,-1
stress_00176,https://pubmed.ncbi.nlm.nih.gov/21942763/,Absence of face-specific cortical activity in the complete absence of awareness:  converging evidence from functional magnetic resonance imaging and event-related  potentials.,"Rodriguez V, Thompson R, Stokes M, Brett M, Alvarez I, Valdes-Sosa M, Duncan J",Journal of cognitive neuroscience,0.088,21942763,-1,-1
stress_00177,https://pubmed.ncbi.nlm.nih.gov/22414937/,Neural correlates of attention bias to threat in post-traumatic stress disorder.,"Fani N, Jovanovic T, Ely TD, Bradley B, Gutman D, Tone EB, Ressler KJ",Biological psychology,0.088,22414937,-1,-1
