paper_name,paper_url,Title,Author,Journal,Loading,PMID,Doi,download_status
stress_00265,https://pubmed.ncbi.nlm.nih.gov/22720021/,Cortical thinning in patients with recent onset post-traumatic stress disorder after a single prolonged trauma exposure.,"Liu Y, Li YJ, Luo EP, Lu HB, Yin H",PloS one,0.065,22720021,-1,-1
stress_00266,https://pubmed.ncbi.nlm.nih.gov/25561375/,Precuneal and amygdala spontaneous activity and functional connectivity in war-zone-related PTSD.,"Yan X, Lazar M, Shalev AY, Neylan TC, Wolkowitz OM, Brown AD, Henn-Haase C, Yehuda R, Flory JD, Abu-Amara D, Sodickson DK, Marmar CR",Psychiatry research,0.065,25561375,-1,-1
stress_00267,https://pubmed.ncbi.nlm.nih.gov/26627911/,"Prenatal cocaine exposure, illicit-substance use and stress and craving processes during adolescence.","Yip SW, Lacadie CM, Sinha R, Mayes LC, Potenza MN",Drug and alcohol dependence,0.065,26627911,-1,-1
stress_00268,https://pubmed.ncbi.nlm.nih.gov/25486615/,Adolescent earthquake survivors' show increased prefrontal cortex activation to masked earthquake images as adults.,"Du X, Wei D, Ganzel BL, Kim P, Zhang Q, Qiu J",International journal of psychophysiology : official journal of the International Organization of Psychophysiology,0.064,25486615,-1,-1
stress_00269,https://pubmed.ncbi.nlm.nih.gov/26040978/,Effects of oxytocin and vasopressin on the neural response to unreciprocated cooperation within brain regions involved in stress and anxiety in men and women.,"Chen X, Hackett PD, DeMarco AC, Feng C, Stair S, Haroon E, Ditzen B, Pagnoni G, Rilling JK",Brain imaging and behavior,0.064,26040978,-1,-1
stress_00270,https://pubmed.ncbi.nlm.nih.gov/26407482/,Double-letter processing in surface dyslexia and dysgraphia following a left temporal lesion: A multimodal neuroimaging study.,"Tomasino B, Marin D, Maieron M, D'Agostini S, Fabbro F, Skrap M, Luzzatti C",Cortex; a journal devoted to the study of the nervous system and behavior,0.064,26407482,-1,-1
stress_00271,https://pubmed.ncbi.nlm.nih.gov/11750889/,An fMRI study of anterior cingulate function in posttraumatic stress disorder.,"Shin LM, Whalen PJ, Pitman RK, Bush G, Macklin ML, Lasko NB, Orr SP, McInerney SC, Rauch SL",Biological psychiatry,0.063,11750889,-1,-1
stress_00272,https://pubmed.ncbi.nlm.nih.gov/23122880/,Alterations in the cortical thickness and the amplitude of low-frequency fluctuation in patients with post-traumatic stress disorder.,"Bing X, Ming-Guo Q, Ye Z, Jing-Na Z, Min L, Han C, Yu Z, Jia-Jia Z, Jian W, Wei C, Han-Jian D, Shao-Xiang Z",Brain research,0.063,23122880,-1,-1
stress_00273,https://pubmed.ncbi.nlm.nih.gov/15737660/,Differential time courses and specificity of amygdala activity in posttraumatic stress disorder subjects and normal control subjects.,"Protopopescu X, Pan H, Tuescher O, Cloitre M, Goldstein M, Engelien W, Epstein J, Yang Y, Gorman J, LeDoux J, Silbersweig D, Stern E",Biological psychiatry,0.062,15737660,-1,-1
stress_00274,https://pubmed.ncbi.nlm.nih.gov/21111828/,Phasic and sustained fear in humans elicits distinct patterns of brain activity.,"Alvarez RP, Chen G, Bodurka J, Kaplan R, Grillon C",NeuroImage,0.062,21111828,-1,-1
stress_00275,https://pubmed.ncbi.nlm.nih.gov/21813114/,Altered resting-state functional connectivity of thalamus in earthquake-induced posttraumatic stress disorder: a functional magnetic resonance imaging study.,"Yin Y, Jin C, Hu X, Duan L, Li Z, Song M, Chen H, Feng B, Jiang T, Jin H, Wong C, Gong Q, Li L",Brain research,0.062,21813114,-1,-1
stress_00276,https://pubmed.ncbi.nlm.nih.gov/23154098/,Neural functional and structural correlates of childhood maltreatment in women with intimate-partner violence-related posttraumatic stress disorder.,"Fonzo GA, Flagan TM, Sullivan S, Allard CB, Grimes EM, Simmons AN, Paulus MP, Stein MB",Psychiatry research,0.062,23154098,-1,-1
stress_00277,https://pubmed.ncbi.nlm.nih.gov/23790741/,The effects of mindfulness-based cognitive therapy in patients with bipolar disorder: a controlled functional MRI investigation.,"Ives-Deliperi VL, Howells F, Stein DJ, Meintjes EM, Horn N",Journal of affective disorders,0.062,23790741,-1,-1
stress_00278,https://pubmed.ncbi.nlm.nih.gov/24795443/,The quality of adolescents' peer relationships modulates neural sensitivity to risk taking.,"Telzer EH, Fuligni AJ, Lieberman MD, Miernicki ME, Galvan A",Social cognitive and affective neuroscience,0.062,24795443,-1,-1
stress_00279,https://pubmed.ncbi.nlm.nih.gov/29175202/,Brain correlates of constituent structure in sign language comprehension.,"Moreno A, Limousin F, Dehaene S, Pallier C",NeuroImage,0.062,29175202,-1,-1
stress_00280,https://pubmed.ncbi.nlm.nih.gov/25555525/,Neural activity related to cognitive and emotional empathy in post-traumatic stress disorder.,"Mazza M, Tempesta D, Pino MC, Nigri A, Catalucci A, Guadagni V, Gallucci M, Iaria G, Ferrara M",Behavioural brain research,0.061,25555525,-1,-1
stress_00281,https://pubmed.ncbi.nlm.nih.gov/17395493/,Neural pathways link social support to attenuated neuroendocrine stress responses.,"Eisenberger NI, Taylor SE, Gable SL, Hilmert CJ, Lieberman MD",NeuroImage,0.06,17395493,10.1016/j.neuroimage.2007.01.038,-1
stress_00282,https://pubmed.ncbi.nlm.nih.gov/20483375/,Patterns of altered cortical perfusion and diminished subcortical integrity in posttraumatic stress disorder: an MRI study.,"Schuff N, Zhang Y, Zhan W, Lenoci M, Ching C, Boreta L, Mueller SG, Wang Z, Marmar CR, Weiner MW, Neylan TC",NeuroImage,0.06,20483375,10.1016/j.neuroimage.2010.05.024,-1
stress_00283,https://pubmed.ncbi.nlm.nih.gov/22465843/,The influence of emotional priming on the neural substrates of memory: a prospective fMRI study using portrait art stimuli.,"Baeken C, De Raedt R, Van Schuerbeek P, De Mey J, Bossuyt A, Luypaert R",NeuroImage,0.06,22465843,10.1016/j.neuroimage.2012.03.043,-1
stress_00284,https://pubmed.ncbi.nlm.nih.gov/24823717/,Alterations in Low-Level Perceptual Networks Related to Clinical Severity in PTSD after an Earthquake: A Resting-State fMRI Study.,"Shang J, Lui S, Meng Y, Zhu H, Qiu C, Gong Q, Liao W, Zhang W",PloS one,0.06,24823717,-1,-1
stress_00285,https://pubmed.ncbi.nlm.nih.gov/25118701/,Impact of early life adversity on reward processing in young adults: EEG-fMRI results from a prospective study over 25 years.,"Boecker R, Holz NE, Buchmann AF, Blomeyer D, Plichta MM, Wolf I, Baumeister S, Meyer-Lindenberg A, Banaschewski T, Brandeis D, Laucht M",PloS one,0.06,25118701,-1,-1
stress_00286,https://pubmed.ncbi.nlm.nih.gov/28893930/,How Human Amygdala and Bed Nucleus of the Stria Terminalis May Drive Distinct Defensive Responses.,"Klumpers F, Kroes MCW, Baas JMP, Fernandez G",The Journal of neuroscience : the official journal of the Society for Neuroscience,0.06,28893930,-1,-1
stress_00287,https://pubmed.ncbi.nlm.nih.gov/16216534/,Trauma modulates amygdala and medial prefrontal responses to consciously attended fear.,"Williams LM, Kemp AH, Felmingham K, Barton M, Olivieri G, Peduto A, Gordon E, Bryant RA",NeuroImage,0.059,16216534,-1,-1
stress_00288,https://pubmed.ncbi.nlm.nih.gov/19344776/,Genotype-phenotype interactions in primary dystonias revealed by differential changes in brain structure.,"Draganski B, Schneider SA, Fiorio M, Kloppel S, Gambarin M, Tinazzi M, Ashburner J, Bhatia KP, Frackowiak RS",NeuroImage,0.059,19344776,-1,-1
stress_00289,https://pubmed.ncbi.nlm.nih.gov/20573339/,Exaggerated and disconnected insular-amygdalar blood oxygenation level-dependent  response to threat-related emotional faces in women with intimate-partner violence posttraumatic stress disorder.,"Fonzo GA, Simmons AN, Thorp SR, Norman SB, Paulus MP, Stein MB",Biological psychiatry,0.059,20573339,-1,-1
stress_00290,https://pubmed.ncbi.nlm.nih.gov/23056477/,Early altered resting-state functional connectivity predicts the severity of post-traumatic stress disorder symptoms in acutely traumatized subjects.,"Zhou Y, Wang Z, Qin LD, Wan JQ, Sun YW, Su SS, Ding WN, Xu JR",PloS one,0.059,23056477,-1,-1
stress_00291,https://pubmed.ncbi.nlm.nih.gov/25959594/,Neurobiological indicators of disinhibition in posttraumatic stress disorder.,"Sadeh N, Spielberg JM, Miller MW, Milberg WP, Salat DH, Amick MM, Fortier CB, McGlinchey RE",Human brain mapping,0.059,25959594,-1,-1
stress_00292,https://pubmed.ncbi.nlm.nih.gov/26331685/,Intranetwork and internetwork functional connectivity alterations in post-traumatic stress disorder.,"Zhang Y, Liu F, Chen H, Li M, Duan X, Xie B, Chen H",Journal of affective disorders,0.059,26331685,-1,-1
stress_00293,https://pubmed.ncbi.nlm.nih.gov/12208637/,Brain activation during script-driven imagery induced dissociative responses in PTSD: a functional magnetic resonance imaging investigation.,"Lanius RA, Williamson PC, Boksman K, Densmore M, Gupta M, Neufeld RW, Gati JS, Menon RS",Biological psychiatry,0.058,12208637,-1,-1
stress_00294,https://pubmed.ncbi.nlm.nih.gov/17217927/,Recall of fear extinction in humans activates the ventromedial prefrontal cortex  and hippocampus in concert.,"Milad MR, Wright CI, Orr SP, Pitman RK, Quirk GJ, Rauch SL",Biological psychiatry,0.058,17217927,-1,-1
stress_00295,https://pubmed.ncbi.nlm.nih.gov/19349151/,Converging evidence for abnormalities of the prefrontal cortex and evaluation of  midsagittal structures in pediatric posttraumatic stress disorder: an MRI study.,"Carrion VG, Weems CF, Watson C, Eliez S, Menon V, Reiss AL",Psychiatry research,0.058,19349151,-1,-1
stress_00296,https://pubmed.ncbi.nlm.nih.gov/23020899/,Reduced neural activation during an inhibition task is associated with impaired fear inhibition in a traumatized civilian sample.,"Jovanovic T, Ely T, Fani N, Glover EM, Gutman D, Tone EB, Norrholm SD, Bradley B, Ressler KJ",Cortex; a journal devoted to the study of the nervous system and behavior,0.058,23020899,-1,-1
stress_00297,https://pubmed.ncbi.nlm.nih.gov/17331476/,Brain responses to symptom provocation and trauma-related short-term memory recall in coal mining accident survivors with acute severe PTSD.,"Hou C, Liu J, Wang K, Li L, Liang M, He Z, Liu Y, Zhang Y, Li W, Jiang T",Brain research,0.057,17331476,-1,-1
stress_00298,https://pubmed.ncbi.nlm.nih.gov/18930351/,Increased gray matter density in young women with chronic vulvar pain.,"Schweinhardt P, Kuchinad A, Pukall CF, Bushnell MC",Pain,0.057,18930351,-1,-1
stress_00299,https://pubmed.ncbi.nlm.nih.gov/28916500/,Early-Life stress modulates neural networks associated with habitual use of reappraisal.,"El Khawli E, Fan Y, Aust S, Wirth K, Bonke L, Stevense A, Herrera A, Metz S, Loayza A, Bajbouj M, Grimm S",Behavioural brain research,0.057,28916500,-1,-1
stress_00300,https://pubmed.ncbi.nlm.nih.gov/18413350/,Hemispheric asymmetry of frequency-dependent suppression in the ipsilateral primary motor cortex during finger movement: a functional magnetic resonance imaging study.,"Hayashi MJ, Saito DN, Aramaki Y, Asai T, Fujibayashi Y, Sadato N","Cerebral cortex (New York, N.Y. : 1991)",0.056,18413350,-1,-1
stress_00301,https://pubmed.ncbi.nlm.nih.gov/20553750/,Neural correlates of altered pain response in women with posttraumatic stress disorder from intimate partner violence.,"Strigo IA, Simmons AN, Matthews SC, Grimes EM, Allard CB, Reinhardt LE, Paulus MP, Stein MB",Biological psychiatry,0.056,20553750,10.1016/j.biopsych.2010.03.034,-1
stress_00302,https://pubmed.ncbi.nlm.nih.gov/27792961/,Effectiveness of cognitive-coping therapy and alteration of resting-state brain function in obsessive-compulsive disorder.,"Zhao HZ, Wang CH, Gao ZZ, Ma JD, Huang P, Li HF, Sang DE, Shan XW, Kou SJ, Li ZR, Ma L, Zhang ZH, Zhang JH, Ouyang H, Lian HK, Zang YF, Hu XZ",Journal of affective disorders,0.056,27792961,10.1016/j.jad.2016.10.015,-1
stress_00303,https://pubmed.ncbi.nlm.nih.gov/27966102/,Behavioral and neural correlates of disrupted orienting attention in posttraumatic stress disorder.,"Russman Block S, King AP, Sripada RK, Weissman DH, Welsh R, Liberzon I","Cognitive, affective & behavioral neuroscience",0.056,27966102,-1,-1
stress_00304,https://pubmed.ncbi.nlm.nih.gov/29100627/,Locus Coeruleus Activity Mediates Hyperresponsiveness in Posttraumatic Stress Disorder.,"Naegeli C, Zeffiro T, Piccirelli M, Jaillard A, Weilenmann A, Hassanpour K, Schick M, Rufer M, Orr SP, Mueller-Pfeiffer C",Biological psychiatry,0.056,29100627,-1,-1
stress_00305,https://pubmed.ncbi.nlm.nih.gov/23945999/,Cortisol modifies extinction learning of recently acquired fear in men.,"Merz CJ, Hermann A, Stark R, Wolf OT",Social cognitive and affective neuroscience,0.055,23945999,-1,-1
stress_00306,https://pubmed.ncbi.nlm.nih.gov/18987188/,From fear to safety and back: reversal of fear in the human brain.,"Schiller D, Levy I, Niv Y, LeDoux JE, Phelps EA",The Journal of neuroscience : the official journal of the Society for Neuroscience,0.054,18987188,-1,-1
stress_00307,https://pubmed.ncbi.nlm.nih.gov/21498053/,Decreased gray matter volume in the left hippocampus and bilateral calcarine cortex in coal mine flood disaster survivors with recent onset PTSD.,"Zhang J, Tan Q, Yin H, Zhang X, Huan Y, Tang L, Wang H, Xu J, Li L",Psychiatry research,0.054,21498053,-1,-1
stress_00308,https://pubmed.ncbi.nlm.nih.gov/23010311/,A preliminary study of alterations in default network connectivity in post-traumatic stress disorder patients following recent trauma.,"Qin LD, Wang Z, Sun YW, Wan JQ, Su SS, Zhou Y, Xu JR",Brain research,0.053,23010311,-1,-1
stress_00309,https://pubmed.ncbi.nlm.nih.gov/25527996/,Altered spontaneous neuronal activity in chronic posttraumatic stress disorder patients before and after a 12-week paroxetine treatment.,"Zhu H, Qiu C, Meng Y, Cui H, Zhang Y, Huang X, Zhang J, Li T, Gong Q, Zhang W, Lui S",Journal of affective disorders,0.053,25527996,-1,-1
stress_00310,https://pubmed.ncbi.nlm.nih.gov/27011015/,High early life stress and aberrant amygdala activity: risk factors for elevated  neuropsychiatric symptoms in HIV+ adults.,"Clark US, Sweet LH, Morgello S, Philip NS, Cohen RA",Brain imaging and behavior,0.053,27011015,-1,-1
stress_00311,https://pubmed.ncbi.nlm.nih.gov/29527476/,Connectome-wide investigation of altered resting-state functional connectivity in war veterans with and without posttraumatic stress disorder.,"Misaki M, Phillips R, Zotev V, Wong CK, Wurfel BE, Krueger F, Feldner M, Bodurka J",NeuroImage. Clinical,0.051,29527476,-1,-1
stress_00312,https://pubmed.ncbi.nlm.nih.gov/28767657/,Maternal PTSD and corresponding neural activity mediate effects of child exposure to violence on child PTSD symptoms.,"Schechter DS, Moser DA, Aue T, Gex-Fabry M, Pointet VC, Cordero MI, Suardi F, Manini A, Vital M, Sancho Rossignol A, Rothenberg M, Dayer AG, Ansermet F, Rusconi Serpa S",PloS one,0.05,28767657,-1,-1
stress_00313,https://pubmed.ncbi.nlm.nih.gov/29634738/,Interaction of childhood urbanicity and variation in dopamine genes alters adult  prefrontal function as measured by functional magnetic resonance imaging (fMRI).,"Reed JL, D'Ambrosio E, Marenco S, Ursini G, Zheutlin AB, Blasi G, Spencer BE, Romano R, Hochheiser J, Reifman A, Sturm J, Berman KF, Bertolino A, Weinberger DR, Callicott JH",PloS one,0.05,29634738,-1,-1
stress_00314,https://pubmed.ncbi.nlm.nih.gov/15820708/,Functional connectivity of dissociative responses in posttraumatic stress disorder: a functional magnetic resonance imaging investigation.,"Lanius RA, Williamson PC, Bluhm RL, Densmore M, Boksman K, Neufeld RW, Gati JS, Menon RS",Biological psychiatry,0.049,15820708,-1,-1
stress_00315,https://pubmed.ncbi.nlm.nih.gov/25887261/,Developmental sex differences in resting state functional connectivity of amygdala sub-regions.,"Alarcon G, Cservenka A, Rudolph MD, Fair DA, Nagel BJ",NeuroImage,0.047,25887261,-1,-1
stress_00316,https://pubmed.ncbi.nlm.nih.gov/25274821/,Impaired contextual modulation of memories in PTSD: an fMRI and psychophysiological study of extinction retention and fear renewal.,"Garfinkel SN, Abelson JL, King AP, Sripada RK, Wang X, Gaines LM, Liberzon I",The Journal of neuroscience : the official journal of the Society for Neuroscience,0.046,25274821,-1,-1
stress_00317,https://pubmed.ncbi.nlm.nih.gov/28911803/,Sensory overload and imbalance: Resting-state vestibular connectivity in PTSD and its dissociative subtype.,"Harricharan S, Nicholson AA, Densmore M, Theberge J, McKinnon MC, Neufeld RWJ, Lanius RA",Neuropsychologia,0.046,28911803,-1,-1
stress_00318,https://pubmed.ncbi.nlm.nih.gov/27042977/,Unique insula subregion resting-state functional connectivity with amygdala complexes in posttraumatic stress disorder and its dissociative subtype.,"Nicholson AA, Sapru I, Densmore M, Frewen PA, Neufeld RW, Theberge J, McKinnon MC, Lanius RA",Psychiatry research. Neuroimaging,0.045,27042977,-1,-1
stress_00319,https://pubmed.ncbi.nlm.nih.gov/28279623/,Cortical thickness reduction in combat exposed U.S. veterans with and without PTSD.,"Wrocklage KM, Averill LA, Cobb Scott J, Averill CL, Schweinsburg B, Trejo M, Roy A, Weisser V, Kelly C, Martini B, Harpaz-Rotem I, Southwick SM, Krystal JH, Abdallah CG",European neuropsychopharmacology : the journal of the European College of Neuropsychopharmacology,0.043,28279623,-1,-1
stress_00320,https://pubmed.ncbi.nlm.nih.gov/19748076/,Neurobiological basis of failure to recall extinction memory in posttraumatic stress disorder.,"Milad MR, Pitman RK, Ellis CB, Gold AL, Shin LM, Lasko NB, Zeidan MA, Handwerger K, Orr SP, Rauch SL",Biological psychiatry,0.039,19748076,-1,-1
stress_00321,https://pubmed.ncbi.nlm.nih.gov/25610763/,PTSD symptom severity is associated with increased recruitment of top-down attentional control in a trauma-exposed sample.,"White SF, Costanzo ME, Blair JR, Roy MJ",NeuroImage. Clinical,0.03,25610763,10.1016/j.nicl.2014.11.012,-1
