paper_name,paper_url,Title,Author,Journal,Loading,PMID,Doi,download_status
sulcus sts_00001,https://pubmed.ncbi.nlm.nih.gov/19046993/,Walk-related mimic word activates the extrastriate visual cortex in the human brain: an fMRI study.,Osaka N,Behavioural brain research,0.196,19046993,-1,-1
sulcus sts_00002,https://pubmed.ncbi.nlm.nih.gov/24518753/,Mentalizing and the Role of the Posterior Superior Temporal Sulcus in Sharing Others' Embarrassment.,"Paulus FM, Muller-Pinzler L, Jansen A, Gazzola V, Krach S","Cerebral cortex (New York, N.Y. : 1991)",0.159,24518753,-1,-1
sulcus sts_00003,https://pubmed.ncbi.nlm.nih.gov/22156723/,Can we share the joy of others? Empathic neural responses to distress vs joy.,"Perry D, Hendler T, Shamay-Tsoory SG",Social cognitive and affective neuroscience,0.151,22156723,-1,-1
sulcus sts_00004,https://pubmed.ncbi.nlm.nih.gov/19167506/,"Commonalities in the neural mechanisms underlying automatic attentional shifts by gaze, gestures, and symbols.","Sato W, Kochiyama T, Uono S, Yoshikawa S",NeuroImage,0.14,19167506,-1,-1
sulcus sts_00005,https://pubmed.ncbi.nlm.nih.gov/23084460/,The associative-semantic network for words and pictures: effective connectivity and graph analysis.,"Vandenberghe R, Wang Y, Nelissen N, Vandenbulcke M, Dhollander T, Sunaert S, Dupont P",Brain and language,0.14,23084460,-1,-1
sulcus sts_00006,https://pubmed.ncbi.nlm.nih.gov/15670705/,Yearning to yawn: the neural basis of contagious yawning.,"Schurmann M, Hesse MD, Stephan KE, Saarela M, Zilles K, Hari R, Fink GR",NeuroImage,0.134,15670705,-1,-1
sulcus sts_00007,https://pubmed.ncbi.nlm.nih.gov/19015114/,Time course of superior temporal sulcus activity in response to eye gaze: a combined fMRI and MEG study.,"Sato W, Kochiyama T, Uono S, Yoshikawa S",Social cognitive and affective neuroscience,0.129,19015114,-1,-1
sulcus sts_00008,https://pubmed.ncbi.nlm.nih.gov/18823249/,A multisensory cortical network for understanding speech in noise.,"Bishop CW, Miller LM",Journal of cognitive neuroscience,0.125,18823249,-1,-1
sulcus sts_00009,https://pubmed.ncbi.nlm.nih.gov/26994741/,Cross-modal comparisons of stimulus specificity and commonality in phonological processing.,"Oron A, Wolak T, Zeffiro T, Szelag E",Brain and language,0.124,26994741,-1,-1
sulcus sts_00010,https://pubmed.ncbi.nlm.nih.gov/27669107/,Mental representations of vowel features asymmetrically modulate activity in superior temporal sulcus.,"Scharinger M, Domahs U, Klein E, Domahs F",Brain and language,0.119,27669107,-1,-1
sulcus sts_00011,https://pubmed.ncbi.nlm.nih.gov/22019860/,Biological motion processing: the left cerebellum communicates with the right superior temporal sulcus.,"Sokolov AA, Erb M, Gharabaghi A, Grodd W, Tatagiba MS, Pavlova MA",NeuroImage,0.118,22019860,-1,-1
sulcus sts_00012,https://pubmed.ncbi.nlm.nih.gov/16565953/,Applying FSL to the FIAC data: model-based and model-free analysis of voice and sentence repetition priming.,"Beckmann CF, Jenkinson M, Woolrich MW, Behrens TE, Flitney DE, Devlin JT, Smith SM",Human brain mapping,0.116,16565953,-1,-1
sulcus sts_00013,https://pubmed.ncbi.nlm.nih.gov/21236276/,A role for the right superior temporal sulcus in categorical perception of musical chords.,"Klein ME, Zatorre RJ",Neuropsychologia,0.116,21236276,-1,-1
sulcus sts_00014,https://pubmed.ncbi.nlm.nih.gov/15703256/,Neural substrates of phonemic perception.,"Liebenthal E, Binder JR, Spitzer SM, Possing ET, Medler DA","Cerebral cortex (New York, N.Y. : 1991)",0.112,15703256,-1,-1
sulcus sts_00015,https://pubmed.ncbi.nlm.nih.gov/16682235/,The neural basis of social tactics: An fMRI study.,"Fukui H, Murai T, Shinozaki J, Aso T, Fukuyama H, Hayashi T, Hanakawa T",NeuroImage,0.112,16682235,-1,-1
sulcus sts_00016,https://pubmed.ncbi.nlm.nih.gov/19231480/,Vowel-specific mismatch responses in the anterior superior temporal gyrus: an fMRI study.,"Leff AP, Iverson P, Schofield TM, Kilner JM, Crinion JT, Friston KJ, Price CJ",Cortex; a journal devoted to the study of the nervous system and behavior,0.112,19231480,-1,-1
sulcus sts_00017,https://pubmed.ncbi.nlm.nih.gov/23507387/,Functional responses and structural connections of cortical areas for processing  faces and voices in the superior temporal sulcus.,"Ethofer T, Bretscher J, Wiethoff S, Bisch J, Schlipf S, Wildgruber D, Kreifelts B",NeuroImage,0.112,23507387,-1,-1
sulcus sts_00018,https://pubmed.ncbi.nlm.nih.gov/15907315/,A common neural basis for receptive and expressive communication of pleasant facial affect.,"Hennenlotter A, Schroeder U, Erhard P, Castrop F, Haslinger B, Stoecker D, Lange KW, Ceballos-Baumann AO",NeuroImage,0.11,15907315,-1,-1
sulcus sts_00019,https://pubmed.ncbi.nlm.nih.gov/18973818/,Audiovisual integration in human superior temporal sulcus: Inverse effectiveness  and the neural processing of speech and object recognition.,"Stevenson RA, James TW",NeuroImage,0.11,18973818,-1,-1
sulcus sts_00020,https://pubmed.ncbi.nlm.nih.gov/20723605/,Similarities and differences in perceiving threat from dynamic faces and bodies.  An fMRI study.,"Kret ME, Pichon S, Grezes J, de Gelder B",NeuroImage,0.108,20723605,-1,-1
sulcus sts_00021,https://pubmed.ncbi.nlm.nih.gov/21641022/,Multi- and unisensory decoding of words and nonwords result in differential brain responses in dyslexic and nondyslexic adults.,"Kast M, Bezzola L, Jancke L, Meyer M",Brain and language,0.108,21641022,-1,-1
sulcus sts_00022,https://pubmed.ncbi.nlm.nih.gov/26046623/,Investigating the brain basis of facial expression perception using multi-voxel pattern analysis.,"Wegrzyn M, Riehle M, Labudda K, Woermann F, Baumgartner F, Pollmann S, Bien CG, Kissler J",Cortex; a journal devoted to the study of the nervous system and behavior,0.108,26046623,-1,-1
sulcus sts_00023,https://pubmed.ncbi.nlm.nih.gov/28290075/,Audio-visual speech perception in adult readers with dyslexia: an fMRI study.,"Russeler J, Ye Z, Gerth I, Szycik GR, Munte TF",Brain imaging and behavior,0.108,28290075,-1,-1
sulcus sts_00024,https://pubmed.ncbi.nlm.nih.gov/24557638/,Neural Correlates of Subliminal Language Processing.,"Axelrod V, Bar M, Rees G, Yovel G","Cerebral cortex (New York, N.Y. : 1991)",0.107,24557638,-1,-1
sulcus sts_00025,https://pubmed.ncbi.nlm.nih.gov/24840874/,How sound symbolism is processed in the brain: a study on Japanese mimetic words.,"Kanero J, Imai M, Okuda J, Okada H, Matsuda T",PloS one,0.107,24840874,-1,-1
sulcus sts_00026,https://pubmed.ncbi.nlm.nih.gov/22708629/,The morphology and variability of the caudal rami of the superior temporal sulcus.,"Segal E, Petrides M",The European journal of neuroscience,0.106,22708629,-1,-1
sulcus sts_00027,https://pubmed.ncbi.nlm.nih.gov/15325349/,Cooperation of different neuronal systems during hand sign recognition.,"Nakamura A, Maess B, Knosche TR, Gunter TC, Bach P, Friederici AD",NeuroImage,0.105,15325349,-1,-1
sulcus sts_00028,https://pubmed.ncbi.nlm.nih.gov/19943038/,Contorted and ordinary body postures in the human brain.,"Cross ES, Mackie EC, Wolford G, Hamilton AF",Experimental brain research,0.105,19943038,-1,-1
sulcus sts_00029,https://pubmed.ncbi.nlm.nih.gov/19617291/,Modulation of perception and brain activity by predictable trajectories of facial expressions.,"Furl N, van Rijsbergen NJ, Kiebel SJ, Friston KJ, Treves A, Dolan RJ","Cerebral cortex (New York, N.Y. : 1991)",0.104,19617291,-1,-1
sulcus sts_00030,https://pubmed.ncbi.nlm.nih.gov/19750227/,Spatio-temporal dynamics of human intention understanding in temporo-parietal cortex: a combined EEG/fMRI repetition suppression paradigm.,"Ortigue S, Thompson JC, Parasuraman R, Grafton ST",PloS one,0.104,19750227,-1,-1
sulcus sts_00031,https://pubmed.ncbi.nlm.nih.gov/16280465/,Hemispheric specialization for processing auditory nonspeech stimuli.,"Jamison HL, Watkins KE, Bishop DV, Matthews PM","Cerebral cortex (New York, N.Y. : 1991)",0.103,16280465,-1,-1
sulcus sts_00032,https://pubmed.ncbi.nlm.nih.gov/21953980/,Audiovisual synchrony enhances BOLD responses in a brain network including multisensory STS while also enhancing target-detection performance for both modalities.,"Marchant JL, Ruff CC, Driver J",Human brain mapping,0.103,21953980,-1,-1
sulcus sts_00033,https://pubmed.ncbi.nlm.nih.gov/15183397/,Phonemic manipulation in Japanese: an fMRI study.,"Seki A, Okada T, Koeda T, Sadato N",Brain research. Cognitive brain research,0.102,15183397,-1,-1
sulcus sts_00034,https://pubmed.ncbi.nlm.nih.gov/22535907/,What the human brain likes about facial motion.,"Schultz J, Brockhaus M, Bulthoff HH, Pilz KS","Cerebral cortex (New York, N.Y. : 1991)",0.102,22535907,-1,-1
sulcus sts_00035,https://pubmed.ncbi.nlm.nih.gov/20122966/,The brain's relevance detection network operates independently of stimulus modality.,"Scharpf KR, Wendt J, Lotze M, Hamm AO",Behavioural brain research,0.101,20122966,-1,-1
sulcus sts_00036,https://pubmed.ncbi.nlm.nih.gov/17617658/,The effect of prior visual information on recognition of speech and sounds.,"Noppeney U, Josephs O, Hocking J, Price CJ, Friston KJ","Cerebral cortex (New York, N.Y. : 1991)",0.1,17617658,-1,-1
sulcus sts_00037,https://pubmed.ncbi.nlm.nih.gov/23155450/,Effect of intentional bias on agency attribution of animated motion: an event-related fMRI study.,"Osaka N, Ikeda T, Osaka M",PloS one,0.1,23155450,-1,-1
sulcus sts_00038,https://pubmed.ncbi.nlm.nih.gov/16192397/,Configural processing of biological motion in human superior temporal sulcus.,"Thompson JC, Clarke M, Stewart T, Puce A",The Journal of neuroscience : the official journal of the Society for Neuroscience,0.099,16192397,-1,-1
sulcus sts_00039,https://pubmed.ncbi.nlm.nih.gov/21094525/,Neural responses to meaningless pseudosigns: evidence for sign-based phonetic processing in superior temporal cortex.,"Emmorey K, Xu J, Braun A",Brain and language,0.099,21094525,-1,-1
sulcus sts_00040,https://pubmed.ncbi.nlm.nih.gov/16540574/,Lateralization of the human mirror neuron system.,"Aziz-Zadeh L, Koski L, Zaidel E, Mazziotta J, Iacoboni M",The Journal of neuroscience : the official journal of the Society for Neuroscience,0.098,16540574,-1,-1
sulcus sts_00041,https://pubmed.ncbi.nlm.nih.gov/17483530/,Controlling emotional expression: behavioral and neural correlates of nonimitative emotional responses.,"Lee TW, Dolan RJ, Critchley HD","Cerebral cortex (New York, N.Y. : 1991)",0.098,17483530,-1,-1
sulcus sts_00042,https://pubmed.ncbi.nlm.nih.gov/19185468/,Reduced language lateralization in first-episode schizophrenia: an fMRI index of  functional asymmetry.,"Bleich-Cohen M, Hendler T, Kotler M, Strous RD",Psychiatry research,0.098,19185468,-1,-1
sulcus sts_00043,https://pubmed.ncbi.nlm.nih.gov/17188904/,Developmental differences in the neural bases of the face inversion effect show progressive tuning of face-selective regions to the upright orientation.,"Passarotti AM, Smith J, DeLano M, Huang J",NeuroImage,0.097,17188904,-1,-1
sulcus sts_00044,https://pubmed.ncbi.nlm.nih.gov/22024246/,Biological motion task performance predicts superior temporal sulcus activity.,"Herrington JD, Nymberg C, Schultz RT",Brain and cognition,0.097,22024246,-1,-1
sulcus sts_00045,https://pubmed.ncbi.nlm.nih.gov/23630602/,Explicating the face perception network with white matter connectivity.,"Pyles JA, Verstynen TD, Schneider W, Tarr MJ",PloS one,0.096,23630602,-1,-1
sulcus sts_00046,https://pubmed.ncbi.nlm.nih.gov/23988132/,"People-selectivity, audiovisual integration and heteromodality in the superior temporal sulcus.","Watson R, Latinus M, Charest I, Crabbe F, Belin P",Cortex; a journal devoted to the study of the nervous system and behavior,0.096,23988132,-1,-1
sulcus sts_00047,https://pubmed.ncbi.nlm.nih.gov/21391281/,Dissociable neural imprints of perception and grammar in auditory functional imaging.,"Herrmann B, Obleser J, Kalberlah C, Haynes JD, Friederici AD",Human brain mapping,0.095,21391281,-1,-1
sulcus sts_00048,https://pubmed.ncbi.nlm.nih.gov/23585519/,The Pathways for Intelligible Speech: Multivariate and Univariate Perspectives.,"Evans S, Kyong JS, Rosen S, Golestani N, Warren JE, McGettigan C, Mourao-Miranda J, Wise RJ, Scott SK","Cerebral cortex (New York, N.Y. : 1991)",0.095,23585519,-1,-1
sulcus sts_00049,https://pubmed.ncbi.nlm.nih.gov/20435051/,"Mental state attribution and the temporoparietal junction: an fMRI study comparing belief, emotion, and perception.","Zaitchik D, Walker C, Miller S, LaViolette P, Feczko E, Dickerson BC",Neuropsychologia,0.094,20435051,-1,-1
sulcus sts_00050,https://pubmed.ncbi.nlm.nih.gov/22529797/,Examining the McGurk illusion using high-field 7 Tesla functional MRI.,"Szycik GR, Stadler J, Tempelmann C, Munte TF",Frontiers in human neuroscience,0.093,22529797,-1,-1
sulcus sts_00051,https://pubmed.ncbi.nlm.nih.gov/26048954/,Functional Organization of Social Perception and Cognition in the Superior Temporal Sulcus.,"Deen B, Koldewyn K, Kanwisher N, Saxe R","Cerebral cortex (New York, N.Y. : 1991)",0.093,26048954,10.1093/cercor/bhv111,-1
sulcus sts_00052,https://pubmed.ncbi.nlm.nih.gov/19710382/,Functional asymmetries revealed in visually guided saccades: an FMRI study.,"Petit L, Zago L, Vigneau M, Andersson F, Crivello F, Mazoyer B, Mellet E, Tzourio-Mazoyer N",Journal of neurophysiology,0.092,19710382,10.1152/jn.00280.2009,-1
sulcus sts_00053,https://pubmed.ncbi.nlm.nih.gov/19718654/,Disentangling syntax and intelligibility in auditory language comprehension.,"Friederici AD, Kotz SA, Scott SK, Obleser J",Human brain mapping,0.092,19718654,-1,-1
sulcus sts_00054,https://pubmed.ncbi.nlm.nih.gov/20087840/,The role of the superior temporal sulcus and the mirror neuron system in imitation.,"Molenberghs P, Brander C, Mattingley JB, Cunnington R",Human brain mapping,0.092,20087840,-1,-1
sulcus sts_00055,https://pubmed.ncbi.nlm.nih.gov/21957257/,Neural correlates of interindividual differences in children's audiovisual speech perception.,"Nath AR, Fava EE, Beauchamp MS",The Journal of neuroscience : the official journal of the Society for Neuroscience,0.092,21957257,-1,-1
sulcus sts_00056,https://pubmed.ncbi.nlm.nih.gov/22192727/,The central role of the temporo-parietal junction and the superior longitudinal fasciculus in supporting multi-item competition: evidence from lesion-symptom mapping of extinction.,"Chechlacz M, Rotshtein P, Hansen PC, Deb S, Riddoch MJ, Humphreys GW",Cortex; a journal devoted to the study of the nervous system and behavior,0.092,22192727,-1,-1
sulcus sts_00057,https://pubmed.ncbi.nlm.nih.gov/22767633/,Altered intra- and inter-regional synchronization of superior temporal cortex in  deaf people.,"Li Y, Booth JR, Peng D, Zang Y, Li J, Yan C, Ding G","Cerebral cortex (New York, N.Y. : 1991)",0.092,22767633,-1,-1
sulcus sts_00058,https://pubmed.ncbi.nlm.nih.gov/15269107/,The functional neuroanatomy of metrical stress evaluation of perceived and imagined spoken words.,"Aleman A, Formisano E, Koppenhagen H, Hagoort P, de Haan EH, Kahn RS","Cerebral cortex (New York, N.Y. : 1991)",0.091,15269107,-1,-1
sulcus sts_00059,https://pubmed.ncbi.nlm.nih.gov/18985132/,Differential effects of tryptophan depletion on emotion processing according to face direction.,"Williams JH, Perrett DI, Waiter GD, Pechey S",Social cognitive and affective neuroscience,0.091,18985132,-1,-1
sulcus sts_00060,https://pubmed.ncbi.nlm.nih.gov/15746001/,"Functional anatomy of biological motion perception in posterior temporal cortex:  an FMRI study of eye, mouth and hand movements.","Pelphrey KA, Morris JP, Michelich CR, Allison T, McCarthy G","Cerebral cortex (New York, N.Y. : 1991)",0.09,15746001,-1,-1
sulcus sts_00061,https://pubmed.ncbi.nlm.nih.gov/19365800/,Neural correlates of word production stages delineated by parametric modulation of psycholinguistic variables.,"Wilson SM, Isenberg AL, Hickok G",Human brain mapping,0.09,19365800,-1,-1
sulcus sts_00062,https://pubmed.ncbi.nlm.nih.gov/19674084/,The fusiform face area and occipital face area show sensitivity to spatial relations in faces.,"Rhodes G, Michie PT, Hughes ME, Byatt G",The European journal of neuroscience,0.09,19674084,-1,-1
sulcus sts_00063,https://pubmed.ncbi.nlm.nih.gov/19944083/,Emotional and cognitive aspects of empathy and their relation to social cognition--an fMRI-study.,"Kramer UM, Mohammadi B, Donamayor N, Samii A, Munte TF",Brain research,0.09,19944083,-1,-1
sulcus sts_00064,https://pubmed.ncbi.nlm.nih.gov/27960147/,Neural basis for inferring false beliefs and social emotions in others among individuals with schizophrenia and those at ultra-high risk for psychosis.,"Takano Y, Aoki Y, Yahata N, Kawakubo Y, Inoue H, Iwashiro N, Natsubori T, Koike S, Gonoi W, Sasaki H, Takao H, Kasai K, Yamasue H",Psychiatry research. Neuroimaging,0.09,27960147,-1,-1
sulcus sts_00065,https://pubmed.ncbi.nlm.nih.gov/18174910/,Perception of dynamic changes in facial affect and identity in autism.,"Pelphrey KA, Morris JP, McCarthy G, Labar KS",Social cognitive and affective neuroscience,0.089,18174910,-1,-1
sulcus sts_00066,https://pubmed.ncbi.nlm.nih.gov/19833143/,Neural responses to rigidly moving faces displaying shifts in social attention investigated with fMRI and MEG.,"Lee LC, Andrews TJ, Johnson SJ, Woods W, Gouws A, Green GG, Young AW",Neuropsychologia,0.089,19833143,-1,-1
sulcus sts_00067,https://pubmed.ncbi.nlm.nih.gov/23573184/,Gum chewing inhibits the sensory processing and the propagation of stress-related information in a brain network.,"Yu H, Chen X, Liu J, Zhou X",PloS one,0.089,23573184,-1,-1
sulcus sts_00068,https://pubmed.ncbi.nlm.nih.gov/16343948/,"Controlling for individual differences in fMRI brain activation to tones, syllables, and words.","Rimol LM, Specht K, Hugdahl K",NeuroImage,0.087,16343948,-1,-1
sulcus sts_00069,https://pubmed.ncbi.nlm.nih.gov/18685036/,Bilateral speech comprehension reflects differential sensitivity to spectral and  temporal features.,"Obleser J, Eisner F, Kotz SA",The Journal of neuroscience : the official journal of the Society for Neuroscience,0.087,18685036,-1,-1
sulcus sts_00070,https://pubmed.ncbi.nlm.nih.gov/15275908/,Preparatory deployment of attention to motion activates higher-order motion-processing brain regions.,"Luks TL, Simpson GV",NeuroImage,0.086,15275908,-1,-1
sulcus sts_00071,https://pubmed.ncbi.nlm.nih.gov/21849560/,The control of mimicry by eye contact is mediated by medial prefrontal cortex.,"Wang Y, Ramsey R, Hamilton AF",The Journal of neuroscience : the official journal of the Society for Neuroscience,0.086,21849560,10.1523/JNEUROSCI.0845-11.2011,-1
sulcus sts_00072,https://pubmed.ncbi.nlm.nih.gov/18093845/,Neural correlates of the processing of co-speech gestures.,"Holle H, Gunter TC, Ruschemeyer SA, Hennenlotter A, Iacoboni M",NeuroImage,0.085,18093845,10.1016/j.neuroimage.2007.10.055,-1
sulcus sts_00073,https://pubmed.ncbi.nlm.nih.gov/25426057/,Hemodynamic Response Pattern of Spatial Cueing is Different for Social and Symbolic Cues.,"Lockhofen DE, Gruppe H, Ruprecht C, Gallhofer B, Sammer G",Frontiers in human neuroscience,0.085,25426057,-1,-1
sulcus sts_00074,https://pubmed.ncbi.nlm.nih.gov/21531779/,Learning-induced changes in the cerebral processing of voice identity.,"Latinus M, Crabbe F, Belin P","Cerebral cortex (New York, N.Y. : 1991)",0.084,21531779,-1,-1
sulcus sts_00075,https://pubmed.ncbi.nlm.nih.gov/23035108/,Effortful listening: the processing of degraded speech depends critically on attention.,"Wild CJ, Yusuf A, Wilson DE, Peelle JE, Davis MH, Johnsrude IS",The Journal of neuroscience : the official journal of the Society for Neuroscience,0.084,23035108,-1,-1
sulcus sts_00076,https://pubmed.ncbi.nlm.nih.gov/11587893/,Cortical substrates for the perception of face actions: an fMRI study of the specificity of activation for seen speech and for meaningless lower-face acts (gurning).,"Campbell R, MacSweeney M, Surguladze S, Calvert G, McGuire P, Suckling J, Brammer MJ, David AS",Brain research. Cognitive brain research,0.083,11587893,-1,-1
sulcus sts_00077,https://pubmed.ncbi.nlm.nih.gov/16565949/,Functional segregation of cortical language areas by sentence repetition.,"Dehaene-Lambertz G, Dehaene S, Anton JL, Campagne A, Ciuciu P, Dehaene GP, Denghien I, Jobert A, Lebihan D, Sigman M, Pallier C, Poline JB",Human brain mapping,0.083,16565949,-1,-1
sulcus sts_00078,https://pubmed.ncbi.nlm.nih.gov/16324128/,Neuromagnetic correlates of visual motion coherence.,"Aspell JE, Tanskanen T, Hurlbert AC",The European journal of neuroscience,0.082,16324128,-1,-1
sulcus sts_00079,https://pubmed.ncbi.nlm.nih.gov/21182967/,fMRI item analysis in a theory of mind task.,"Dodell-Feder D, Koster-Hale J, Bedny M, Saxe R",NeuroImage,0.082,21182967,-1,-1
sulcus sts_00080,https://pubmed.ncbi.nlm.nih.gov/14980575/,Spatial and temporal factors during processing of audiovisual speech: a PET study.,"Macaluso E, George N, Dolan R, Spence C, Driver J",NeuroImage,0.081,14980575,-1,-1
sulcus sts_00081,https://pubmed.ncbi.nlm.nih.gov/15895428/,Response of anterior temporal cortex to syntactic and prosodic manipulations during sentence processing.,"Humphries C, Love T, Swinney D, Hickok G",Human brain mapping,0.081,15895428,-1,-1
sulcus sts_00082,https://pubmed.ncbi.nlm.nih.gov/16000632/,Functionally segregated neural substrates for arbitrary audiovisual paired-association learning.,"Tanabe HC, Honda M, Sadato N",The Journal of neuroscience : the official journal of the Society for Neuroscience,0.081,16000632,-1,-1
sulcus sts_00083,https://pubmed.ncbi.nlm.nih.gov/21421059/,Dynamic assignment of neural resources in auditory comprehension of complex sentences.,"Obleser J, Meyer L, Friederici AD",NeuroImage,0.081,21421059,-1,-1
sulcus sts_00084,https://pubmed.ncbi.nlm.nih.gov/22634292/,Multisensory speech perception without the left superior temporal sulcus.,"Baum SH, Martin RC, Hamilton AC, Beauchamp MS",NeuroImage,0.08,22634292,-1,-1
sulcus sts_00085,https://pubmed.ncbi.nlm.nih.gov/22972952/,Intra- and interhemispheric connectivity between face-selective regions in the human brain.,"Davies-Thompson J, Andrews TJ",Journal of neurophysiology,0.08,22972952,10.1152/jn.01171.2011,-1
sulcus sts_00086,https://pubmed.ncbi.nlm.nih.gov/16525130/,FMRI study of emotional speech comprehension.,"Beaucousin V, Lacheret A, Turbelin MR, Morel M, Mazoyer B, Tzourio-Mazoyer N","Cerebral cortex (New York, N.Y. : 1991)",0.078,16525130,10.1093/cercor/bhj151,-1
sulcus sts_00087,https://pubmed.ncbi.nlm.nih.gov/19651222/,Phonological repetition-suppression in bilateral superior temporal sulci.,"Vaden KI Jr, Muftuler LT, Hickok G",NeuroImage,0.078,19651222,10.1016/j.neuroimage.2009.07.063,-1
sulcus sts_00088,https://pubmed.ncbi.nlm.nih.gov/20051318/,Differential processing of metacognitive evaluation and the neural circuitry of the self and others in schizophrenia: a pilot study.,"Murphy ER, Brent BK, Benton M, Pruitt P, Diwadkar V, Rajarethinam RP, Keshavan MS",Schizophrenia research,0.078,20051318,-1,-1
sulcus sts_00089,https://pubmed.ncbi.nlm.nih.gov/24834043/,Dissecting the functional anatomy of auditory word repetition.,"Hope TM, Prejawa S, Parker Jones ', Oberhuber M, Seghier ML, Green DW, Price CJ",Frontiers in human neuroscience,0.078,24834043,-1,-1
sulcus sts_00090,https://pubmed.ncbi.nlm.nih.gov/20668196/,Supramodal representations of perceived emotions in the human brain.,"Peelen MV, Atkinson AP, Vuilleumier P",The Journal of neuroscience : the official journal of the Society for Neuroscience,0.077,20668196,-1,-1
sulcus sts_00091,https://pubmed.ncbi.nlm.nih.gov/21600290/,Feature selection and classification of imbalanced datasets: application to PET images of children with autistic spectrum disorders.,"Duchesnay E, Cachia A, Boddaert N, Chabane N, Mangin JF, Martinot JL, Brunelle F, Zilbovicius M",NeuroImage,0.077,21600290,-1,-1
sulcus sts_00092,https://pubmed.ncbi.nlm.nih.gov/22941501/,Social inclusion enhances biological motion processing: a functional near-infrared spectroscopy study.,"Bolling DZ, Pelphrey KA, Kaiser MD",Brain topography,0.077,22941501,-1,-1
sulcus sts_00093,https://pubmed.ncbi.nlm.nih.gov/15703258/,Role of the superior temporal region in human visual motion perception.,"Noguchi Y, Kaneoke Y, Kakigi R, Tanabe HC, Sadato N","Cerebral cortex (New York, N.Y. : 1991)",0.076,15703258,-1,-1
sulcus sts_00094,https://pubmed.ncbi.nlm.nih.gov/21289179/,Dynamic changes in superior temporal sulcus connectivity during perception of noisy audiovisual speech.,"Nath AR, Beauchamp MS",The Journal of neuroscience : the official journal of the Society for Neuroscience,0.076,21289179,-1,-1
sulcus sts_00095,https://pubmed.ncbi.nlm.nih.gov/24464944/,Convergent BOLD and Beta-Band Activity in Superior Temporal Sulcus and Frontolimbic Circuitry Underpins Human Emotion Cognition.,"Jabbi M, Kohn PD, Nash T, Ianni A, Coutlee C, Holroyd T, Carver FW, Chen Q, Cropp B, Kippenhan JS, Robinson SE, Coppola R, Berman KF","Cerebral cortex (New York, N.Y. : 1991)",0.076,24464944,-1,-1
sulcus sts_00096,https://pubmed.ncbi.nlm.nih.gov/25297095/,The fusion of mental imagery and sensation in the temporal association cortex.,"Berger CC, Ehrsson HH",The Journal of neuroscience : the official journal of the Society for Neuroscience,0.076,25297095,-1,-1
sulcus sts_00097,https://pubmed.ncbi.nlm.nih.gov/16730755/,Differential cerebral activation during observation of expressive gestures and motor acts.,"Lotze M, Heymans U, Birbaumer N, Veit R, Erb M, Flor H, Halsband U",Neuropsychologia,0.075,16730755,-1,-1
sulcus sts_00098,https://pubmed.ncbi.nlm.nih.gov/17616403/,Common and distinct brain activation to viewing dynamic sequences of face and hand movements.,"Thompson JC, Hardee JE, Panayiotou A, Crewther D, Puce A",NeuroImage,0.075,17616403,-1,-1
