paper_name,paper_url,Title,Author,Journal,Loading,PMID,Doi,download_status
sulcus sts_00099,https://pubmed.ncbi.nlm.nih.gov/22796987/,The responsiveness of biological motion processing areas to selective attention towards goals.,"Herrington J, Nymberg C, Faja S, Price E, Schultz R",NeuroImage,0.075,22796987,-1,-1
sulcus sts_00100,https://pubmed.ncbi.nlm.nih.gov/24466026/,Functional connectivity between face-movement and speech-intelligibility areas during auditory-only speech perception.,"Schall S, von Kriegstein K",PloS one,0.075,24466026,-1,-1
sulcus sts_00101,https://pubmed.ncbi.nlm.nih.gov/15758039/,Neural basis of eye gaze processing deficits in autism.,"Pelphrey KA, Morris JP, McCarthy G",Brain : a journal of neurology,0.074,15758039,-1,-1
sulcus sts_00102,https://pubmed.ncbi.nlm.nih.gov/23684882/,Differential role of the Mentalizing and the Mirror Neuron system in the imitation of communicative gestures.,"Mainieri AG, Heim S, Straube B, Binkofski F, Kircher T",NeuroImage,0.074,23684882,-1,-1
sulcus sts_00103,https://pubmed.ncbi.nlm.nih.gov/24185024/,The superior temporal sulcus and the N170 during face processing: single trial analysis of concurrent EEG-fMRI.,"Nguyen VT, Cunnington R",NeuroImage,0.074,24185024,10.1016/j.neuroimage.2013.10.047,-1
sulcus sts_00104,https://pubmed.ncbi.nlm.nih.gov/26826513/,Face-selective regions differ in their ability to classify facial expressions.,"Zhang H, Japee S, Nolan R, Chu C, Liu N, Ungerleider LG",NeuroImage,0.074,26826513,10.1016/j.neuroimage.2016.01.045,-1
sulcus sts_00105,https://pubmed.ncbi.nlm.nih.gov/28057489/,Representations of modality-general valence for videos and music derived from fMRI data.,"Kim J, Shinkareva SV, Wedell DH",NeuroImage,0.074,28057489,10.1016/j.neuroimage.2017.01.002,-1
sulcus sts_00106,https://pubmed.ncbi.nlm.nih.gov/16023041/,"Taking an ""intentional stance"" on eye-gaze shifts: a functional neuroimaging study of social perception in children.","Mosconi MW, Mack PB, McCarthy G, Pelphrey KA",NeuroImage,0.073,16023041,-1,-1
sulcus sts_00107,https://pubmed.ncbi.nlm.nih.gov/20362418/,Factors in sensory processing of prosody in schizotypal personality disorder: an  fMRI experiment.,"Dickey CC, Morocz IA, Minney D, Niznikiewicz MA, Voglmaier MM, Panych LP, Khan U, Zacks R, Terry DP, Shenton ME, McCarley RW",Schizophrenia research,0.073,20362418,-1,-1
sulcus sts_00108,https://pubmed.ncbi.nlm.nih.gov/23664949/,Mean-based neural coding of voices.,"Andics A, McQueen JM, Petersson KM",NeuroImage,0.073,23664949,-1,-1
sulcus sts_00109,https://pubmed.ncbi.nlm.nih.gov/14527592/,Effect of head orientation on gaze processing in fusiform gyrus and superior temporal sulcus.,"Pageler NM, Menon V, Merin NM, Eliez S, Brown WE, Reiss AL",NeuroImage,0.072,14527592,-1,-1
sulcus sts_00110,https://pubmed.ncbi.nlm.nih.gov/16616863/,The neural mechanism associated with the processing of onomatopoeic sounds.,"Hashimoto T, Usui N, Taira M, Nose I, Haji T, Kojima S",NeuroImage,0.072,16616863,-1,-1
sulcus sts_00111,https://pubmed.ncbi.nlm.nih.gov/18378168/,Effects of feature-selective attention on auditory pattern and location processing.,"Altmann CF, Henning M, Doring MK, Kaiser J",NeuroImage,0.072,18378168,-1,-1
sulcus sts_00112,https://pubmed.ncbi.nlm.nih.gov/20610740/,Object-based attentional modulation of biological motion processing: spatiotemporal dynamics using functional magnetic resonance imaging and electroencephalography.,"Safford AS, Hussey EA, Parasuraman R, Thompson JC",The Journal of neuroscience : the official journal of the Society for Neuroscience,0.072,20610740,-1,-1
sulcus sts_00113,https://pubmed.ncbi.nlm.nih.gov/21695133/,Cortical dynamics of acoustic and phonological processing in speech perception.,"Zhang L, Xi J, Xu G, Shu H, Wang X, Li P",PloS one,0.072,21695133,-1,-1
sulcus sts_00114,https://pubmed.ncbi.nlm.nih.gov/25003207/,Medial temporal lobe resection attenuates superior temporal sulcus response to faces.,"Ahs F, Engman J, Persson J, Larsson EM, Wikstrom J, Kumlien E, Fredrikson M",Neuropsychologia,0.072,25003207,-1,-1
sulcus sts_00115,https://pubmed.ncbi.nlm.nih.gov/18053686/,Neural bases for impaired social cognition in schizophrenia and autism spectrum disorders.,"Pinkham AE, Hopfinger JB, Pelphrey KA, Piven J, Penn DL",Schizophrenia research,0.071,18053686,-1,-1
sulcus sts_00116,https://pubmed.ncbi.nlm.nih.gov/20943902/,Sound-induced enhancement of low-intensity vision: multisensory influences on human sensory-specific cortices and thalamic bodies relate to perceptual enhancement of visual detection sensitivity.,"Noesselt T, Tyll S, Boehler CN, Budinger E, Heinze HJ, Driver J",The Journal of neuroscience : the official journal of the Society for Neuroscience,0.071,20943902,-1,-1
sulcus sts_00117,https://pubmed.ncbi.nlm.nih.gov/15193626/,Distinct functional substrates along the right superior temporal sulcus for the processing of voices.,"Kriegstein KV, Giraud AL",NeuroImage,0.07,15193626,-1,-1
sulcus sts_00118,https://pubmed.ncbi.nlm.nih.gov/26908317/,Dissociable roles of internal feelings and face recognition ability in facial expression decoding.,"Zhang L, Song Y, Liu L, Liu J",NeuroImage,0.07,26908317,-1,-1
sulcus sts_00119,https://pubmed.ncbi.nlm.nih.gov/28439236/,"Auditory, Visual and Audiovisual Speech Processing Streams in Superior Temporal Sulcus.","Venezia JH, Vaden KI Jr, Rong F, Maddox D, Saberi K, Hickok G",Frontiers in human neuroscience,0.069,28439236,-1,-1
sulcus sts_00120,https://pubmed.ncbi.nlm.nih.gov/19576235/,Voice perception in blind persons: a functional magnetic resonance imaging study.,"Gougoux F, Belin P, Voss P, Lepore F, Lassonde M, Zatorre RJ",Neuropsychologia,0.066,19576235,-1,-1
sulcus sts_00121,https://pubmed.ncbi.nlm.nih.gov/17088019/,Brain responses to dynamic facial expressions of pain.,"Simon D, Craig KD, Miltner WH, Rainville P",Pain,0.065,17088019,-1,-1
sulcus sts_00122,https://pubmed.ncbi.nlm.nih.gov/22905026/,Naturalistic FMRI mapping reveals superior temporal sulcus as the hub for the distributed brain network for social perception.,"Lahnakoski JM, Glerean E, Salmi J, Jaaskelainen IP, Sams M, Hari R, Nummenmaa L",Frontiers in human neuroscience,0.065,22905026,-1,-1
sulcus sts_00123,https://pubmed.ncbi.nlm.nih.gov/17707444/,Facial expression and gaze-direction in human superior temporal sulcus.,"Engell AD, Haxby JV",Neuropsychologia,0.063,17707444,10.1016/j.neuropsychologia.2007.06.022,-1
sulcus sts_00124,https://pubmed.ncbi.nlm.nih.gov/23023154/,Mechanisms of enhancing visual-speech recognition by prior auditory information.,"Blank H, von Kriegstein K",NeuroImage,0.063,23023154,10.1016/j.neuroimage.2012.09.047,-1
sulcus sts_00125,https://pubmed.ncbi.nlm.nih.gov/20164350/,Distinct functional contributions of primary sensory and association areas to audiovisual integration in object categorization.,"Werner S, Noppeney U",The Journal of neuroscience : the official journal of the Society for Neuroscience,0.061,20164350,10.1523/JNEUROSCI.5091-09.2010,-1
sulcus sts_00126,https://pubmed.ncbi.nlm.nih.gov/11553776/,Functional neuroanatomy of biological motion perception in humans.,"Vaina LM, Solomon J, Chowdhury S, Sinha P, Belliveau JW",Proceedings of the National Academy of Sciences of the United States of America,0.059,11553776,-1,-1
sulcus sts_00127,https://pubmed.ncbi.nlm.nih.gov/23063451/,Inter-individual differences in successful perspective taking during pain perception mediates emotional responsiveness in self and others: an fMRI study.,"van der Heiden L, Scherpiet S, Konicar L, Birbaumer N, Veit R",NeuroImage,0.057,23063451,-1,-1
sulcus sts_00128,https://pubmed.ncbi.nlm.nih.gov/26167916/,Functional MRI of Challenging Food Choices: Forced Choice between Equally Liked High- and Low-Calorie Foods in the Absence of Hunger.,"Charbonnier L, van der Laan LN, Viergever MA, Smeets PA",PloS one,0.057,26167916,-1,-1
sulcus sts_00129,https://pubmed.ncbi.nlm.nih.gov/23060772/,"Hard to ""tune in"": neural mechanisms of live face-to-face interaction with high-functioning autistic spectrum disorder.","Tanabe HC, Kosaka H, Saito DN, Koike T, Hayashi MJ, Izuma K, Komeda H, Ishitobi M, Omori M, Munesue T, Okazawa H, Wada Y, Sadato N",Frontiers in human neuroscience,0.055,23060772,-1,-1
sulcus sts_00130,https://pubmed.ncbi.nlm.nih.gov/17174987/,The neural processing of moral sensitivity to issues of justice and care.,"Robertson D, Snarey J, Ousley O, Harenski K, DuBois Bowman F, Gilkey R, Kilts C",Neuropsychologia,0.052,17174987,-1,-1
sulcus sts_00131,https://pubmed.ncbi.nlm.nih.gov/20832481/,Cortical processing of head- and eye-gaze cues guiding joint social attention.,"Laube I, Kamphuis S, Dicke PW, Thier P",NeuroImage,0.052,20832481,-1,-1
