paper_name,paper_url,Title,Author,Journal,Loading,PMID,Doi,download_status
ventrolateral prefrontal_00001,https://pubmed.ncbi.nlm.nih.gov/18992349/,A parametric relief signal in human ventrolateral prefrontal cortex.,"Fujiwara J, Tobler PN, Taira M, Iijima T, Tsutsui K",NeuroImage,0.339,18992349,-1,-1
ventrolateral prefrontal_00002,https://pubmed.ncbi.nlm.nih.gov/18279361/,Left mid-ventrolateral prefrontal cortex: underlying principles of function.,"Kostopoulos P, Petrides M",The European journal of neuroscience,0.325,18279361,-1,-1
ventrolateral prefrontal_00003,https://pubmed.ncbi.nlm.nih.gov/23048018/,Shared and drug-specific effects of atomoxetine and methylphenidate on inhibitory brain dysfunction in medication-naive ADHD boys.,"Cubillo A, Smith AB, Barrett N, Giampietro V, Brammer MJ, Simmons A, Rubia K","Cerebral cortex (New York, N.Y. : 1991)",0.304,23048018,-1,-1
ventrolateral prefrontal_00004,https://pubmed.ncbi.nlm.nih.gov/18308586/,Speaking of secrets and lies: the contribution of ventrolateral prefrontal cortex to vocal deception.,"Spence SA, Kaylor-Hughes C, Farrow TF, Wilkinson ID",NeuroImage,0.269,18308586,-1,-1
ventrolateral prefrontal_00005,https://pubmed.ncbi.nlm.nih.gov/23675408/,Neural basis of impaired cognitive flexibility in patients with anorexia nervosa.,"Sato Y, Saito N, Utsumi A, Aizawa E, Shoji T, Izumiyama M, Mushiake H, Hongo M, Fukudo S",PloS one,0.245,23675408,-1,-1
ventrolateral prefrontal_00006,https://pubmed.ncbi.nlm.nih.gov/25449847/,Tasting calories differentially affects brain activation during hunger and satiety.,"van Rijn I, de Graaf C, Smeets PA",Behavioural brain research,0.243,25449847,-1,-1
ventrolateral prefrontal_00007,https://pubmed.ncbi.nlm.nih.gov/16421302/,Mental chronometry of working memory retrieval: a combined functional magnetic resonance imaging and event-related potentials approach.,"Bledowski C, Cohen Kadosh K, Wibral M, Rahm B, Bittner RA, Hoechstetter K, Scherg M, Maurer K, Goebel R, Linden DE",The Journal of neuroscience : the official journal of the Society for Neuroscience,0.241,16421302,-1,-1
ventrolateral prefrontal_00008,https://pubmed.ncbi.nlm.nih.gov/12713652/,The mid-ventrolateral prefrontal cortex: insights into its role in memory retrieval.,"Kostopoulos P, Petrides M",The European journal of neuroscience,0.218,12713652,-1,-1
ventrolateral prefrontal_00009,https://pubmed.ncbi.nlm.nih.gov/17010573/,Neural correlates of working memory dysfunction in first-episode schizophrenia patients: an fMRI multi-center study.,"Schneider F, Habel U, Reske M, Kellermann T, Stocker T, Shah NJ, Zilles K, Braus DF, Schmitt A, Schlosser R, Wagner M, Frommann I, Kircher T, Rapp A, Meisenzahl E, Ufer S, Ruhrmann S, Thienel R, Sauer H, Henn FA, Gaebel W",Schizophrenia research,0.217,17010573,-1,-1
ventrolateral prefrontal_00010,https://pubmed.ncbi.nlm.nih.gov/21906689/,Neural correlates of blink suppression and the buildup of a natural bodily urge.,"Berman BD, Horovitz SG, Morel B, Hallett M",NeuroImage,0.208,21906689,-1,-1
ventrolateral prefrontal_00011,https://pubmed.ncbi.nlm.nih.gov/18752414/,Reduced ventrolateral fMRI response during observation of emotional gestures related to the degree of dopaminergic impairment in Parkinson disease.,"Lotze M, Reimold M, Heymans U, Laihinen A, Patt M, Halsband U",Journal of cognitive neuroscience,0.184,18752414,-1,-1
ventrolateral prefrontal_00012,https://pubmed.ncbi.nlm.nih.gov/17950474/,The contribution of ventrolateral and dorsolateral prefrontal cortex to response  reversal.,"Mitchell DG, Rhodes RA, Pine DS, Blair RJ",Behavioural brain research,0.18,17950474,-1,-1
ventrolateral prefrontal_00013,https://pubmed.ncbi.nlm.nih.gov/19428222/,Changes in prefrontal and amygdala activity during olanzapine treatment in schizophrenia.,"Blasi G, Popolizio T, Taurisano P, Caforio G, Romano R, Di Giorgio A, Sambataro F, Rubino V, Latorre V, Lo Bianco L, Fazio L, Nardini M, Weinberger DR, Bertolino A",Psychiatry research,0.179,19428222,-1,-1
ventrolateral prefrontal_00014,https://pubmed.ncbi.nlm.nih.gov/28253076/,Major Thought Restructuring: The Roles of Different Prefrontal Cortical Regions.,"Seyed-Allaei S, Avanaki ZN, Bahrami B, Shallice T",Journal of cognitive neuroscience,0.176,28253076,-1,-1
ventrolateral prefrontal_00015,https://pubmed.ncbi.nlm.nih.gov/21359508/,Differential modulation of emotion processing brain regions by noradrenergic and  serotonergic antidepressants.,"Bruhl AB, Jancke L, Herwig U",Psychopharmacology,0.173,21359508,-1,-1
ventrolateral prefrontal_00016,https://pubmed.ncbi.nlm.nih.gov/27755551/,Striatum-Centered Fiber Connectivity Is Associated with the Personality Trait of  Cooperativeness.,"Lei X, Chen C, Chen C, He Q, Moyzis RK, Xue G, Dong Q",PloS one,0.173,27755551,-1,-1
ventrolateral prefrontal_00017,https://pubmed.ncbi.nlm.nih.gov/22154406/,Repetition learning of vibrotactile temporal sequences: an fMRI study in blind and sighted individuals.,"Burton H, Agato A, Sinclair RJ",Brain research,0.168,22154406,-1,-1
ventrolateral prefrontal_00018,https://pubmed.ncbi.nlm.nih.gov/25129889/,"The Cortical Signature of Central Poststroke Pain: Gray Matter Decreases in Somatosensory, Insular, and Prefrontal Cortices.","Krause T, Asseyer S, Taskin B, Floel A, Witte AV, Mueller K, Fiebach JB, Villringer K, Villringer A, Jungehulsing GJ","Cerebral cortex (New York, N.Y. : 1991)",0.166,25129889,-1,-1
ventrolateral prefrontal_00019,https://pubmed.ncbi.nlm.nih.gov/11683908/,Selective activation of the ventrolateral prefrontal cortex in the human brain during active retrieval processing.,"Cadoret G, Pike GB, Petrides M",The European journal of neuroscience,0.164,11683908,-1,-1
ventrolateral prefrontal_00020,https://pubmed.ncbi.nlm.nih.gov/20089812/,The time course of ventrolateral prefrontal cortex involvement in memory formation.,"Machizawa MG, Kalla R, Walsh V, Otten LJ",Journal of neurophysiology,0.16,20089812,-1,-1
ventrolateral prefrontal_00021,https://pubmed.ncbi.nlm.nih.gov/21051038/,Functional magnetic resonance imaging brain activation in bipolar mania: evidence for disruption of the ventrolateral prefrontal-amygdala emotional pathway.,"Strakowski SM, Eliassen JC, Lamy M, Cerullo MA, Allendorfer JB, Madore M, Lee JH, Welge JA, DelBello MP, Fleck DE, Adler CM",Biological psychiatry,0.15,21051038,-1,-1
ventrolateral prefrontal_00022,https://pubmed.ncbi.nlm.nih.gov/21925720/,A new lexical card-sorting task for studying fronto-striatal contribution to processing language rules.,"Simard F, Monetta L, Nagano-Saito A, Monchi O",Brain and language,0.144,21925720,-1,-1
ventrolateral prefrontal_00023,https://pubmed.ncbi.nlm.nih.gov/19683225/,Functional neuroanatomy of the encoding and retrieval processes of verbal episodic memory in MCI.,"Clement F, Belleville S, Mellah S",Cortex; a journal devoted to the study of the nervous system and behavior,0.141,19683225,-1,-1
ventrolateral prefrontal_00024,https://pubmed.ncbi.nlm.nih.gov/20926653/,Distinct frontoparietal networks set the stage for later perceptual identification priming and episodic recognition memory.,"Wimber M, Heinze HJ, Richardson-Klavehn A",The Journal of neuroscience : the official journal of the Society for Neuroscience,0.138,20926653,-1,-1
ventrolateral prefrontal_00025,https://pubmed.ncbi.nlm.nih.gov/21983794/,Using real-time fMRI to learn voluntary regulation of the anterior insula in the  presence of threat-related stimuli.,"Veit R, Singh V, Sitaram R, Caria A, Rauss K, Birbaumer N",Social cognitive and affective neuroscience,0.137,21983794,-1,-1
ventrolateral prefrontal_00026,https://pubmed.ncbi.nlm.nih.gov/17097071/,Affective neural circuitry during facial emotion processing in pediatric bipolar  disorder.,"Pavuluri MN, O'Connor MM, Harral E, Sweeney JA",Biological psychiatry,0.135,17097071,-1,-1
ventrolateral prefrontal_00027,https://pubmed.ncbi.nlm.nih.gov/12040063/,Defining the neural mechanisms of probabilistic reversal learning using event-related functional magnetic resonance imaging.,"Cools R, Clark L, Owen AM, Robbins TW",The Journal of neuroscience : the official journal of the Society for Neuroscience,0.131,12040063,-1,-1
ventrolateral prefrontal_00028,https://pubmed.ncbi.nlm.nih.gov/24454951/,Extrapunitive and intropunitive individuals activate different parts of the prefrontal cortex under an ego-blocking frustration.,"Minamoto T, Osaka M, Yaoi K, Osaka N",PloS one,0.13,24454951,-1,-1
ventrolateral prefrontal_00029,https://pubmed.ncbi.nlm.nih.gov/17182905/,"Heschl's gyrus, posterior superior temporal gyrus, and mid-ventrolateral prefrontal cortex have different roles in the detection of acoustic changes.","Schonwiesner M, Novitski N, Pakarinen S, Carlson S, Tervaniemi M, Naatanen R",Journal of neurophysiology,0.128,17182905,-1,-1
ventrolateral prefrontal_00030,https://pubmed.ncbi.nlm.nih.gov/25576907/,Compensatory fronto-parietal hyperactivation during set-shifting in unmedicated patients with Parkinson's disease.,"Gerrits NJ, van der Werf YD, Verhoef KM, Veltman DJ, Groenewegen HJ, Berendse HW, van den Heuvel OA",Neuropsychologia,0.126,25576907,-1,-1
ventrolateral prefrontal_00031,https://pubmed.ncbi.nlm.nih.gov/26004692/,Cognitive insight in first-episode schizophrenia: Further evidence for a role of  the ventrolateral prefrontal cortex.,"Buchy L, Hawco C, Joober R, Malla A, Lepage M",Schizophrenia research,0.126,26004692,10.1016/j.schres.2015.05.009,-1
ventrolateral prefrontal_00032,https://pubmed.ncbi.nlm.nih.gov/18938008/,Are errors differentiable from deceptive responses when feigning memory impairment? An fMRI study.,"Lee TM, Au RK, Liu HL, Ting KH, Huang CM, Chan CC",Brain and cognition,0.125,18938008,10.1016/j.bandc.2008.09.002,-1
ventrolateral prefrontal_00033,https://pubmed.ncbi.nlm.nih.gov/23644912/,Greater risk sensitivity of dorsolateral prefrontal cortex in young smokers than  in nonsmokers.,"Galvan A, Schonberg T, Mumford J, Kohno M, Poldrack RA, London ED",Psychopharmacology,0.125,23644912,10.1007/s00213-013-3113-x,-1
ventrolateral prefrontal_00034,https://pubmed.ncbi.nlm.nih.gov/11169874/,Event-related fMRI study of response inhibition.,"Liddle PF, Kiehl KA, Smith AM",Human brain mapping,0.122,11169874,-1,-1
ventrolateral prefrontal_00035,https://pubmed.ncbi.nlm.nih.gov/11950516/,"Topographic segregation and convergence of verbal, object, shape and spatial working memory in humans.","Hautzel H, Mottaghy FM, Schmidt D, Zemb M, Shah NJ, Muller-Gartner HW, Krause BJ",Neuroscience letters,0.121,11950516,-1,-1
ventrolateral prefrontal_00036,https://pubmed.ncbi.nlm.nih.gov/19641108/,Get aroused and be stronger: emotional facilitation of physical effort in the human brain.,"Schmidt L, Clery-Melin ML, Lafargue G, Valabregue R, Fossati P, Dubois B, Pessiglione M",The Journal of neuroscience : the official journal of the Society for Neuroscience,0.12,19641108,-1,-1
ventrolateral prefrontal_00037,https://pubmed.ncbi.nlm.nih.gov/17097073/,Neural responses to facial expressions of disgust but not fear are modulated by washing symptoms in OCD.,"Lawrence NS, An SK, Mataix-Cols D, Ruths F, Speckens A, Phillips ML",Biological psychiatry,0.117,17097073,-1,-1
ventrolateral prefrontal_00038,https://pubmed.ncbi.nlm.nih.gov/24209777/,The Development of the Neural Substrates of Cognitive Control in Adolescents with Autism Spectrum Disorders.,"Solomon M, Yoon JH, Ragland JD, Niendam TA, Lesh TA, Fairbrother W, Carter CS",Biological psychiatry,0.116,24209777,-1,-1
ventrolateral prefrontal_00039,https://pubmed.ncbi.nlm.nih.gov/16436686/,Fractionating attentional control using event-related fMRI.,"Hampshire A, Owen AM","Cerebral cortex (New York, N.Y. : 1991)",0.115,16436686,-1,-1
ventrolateral prefrontal_00040,https://pubmed.ncbi.nlm.nih.gov/28667891/,Anomalous prefrontal-limbic activation and connectivity in youth at high-risk for bipolar disorder.,"Chang K, Garrett A, Kelley R, Howe M, Sanders EM, Acquaye T, Bararpour L, Li S, Singh M, Jo B, Hallmayer J, Reiss A",Journal of affective disorders,0.114,28667891,-1,-1
ventrolateral prefrontal_00041,https://pubmed.ncbi.nlm.nih.gov/22079661/,Prefrontal hyperactivation during a working memory task in early-onset schizophrenia spectrum disorders: an fMRI study.,"Thormodsen R, Jensen J, Holmen A, Juuhl-Langseth M, Emblem KE, Andreassen OA, Rund BR",Psychiatry research,0.11,22079661,-1,-1
ventrolateral prefrontal_00042,https://pubmed.ncbi.nlm.nih.gov/16275930/,Personality predicts activity in reward and emotional regions associated with humor.,"Mobbs D, Hagan CC, Azim E, Menon V, Reiss AL",Proceedings of the National Academy of Sciences of the United States of America,0.109,16275930,-1,-1
ventrolateral prefrontal_00043,https://pubmed.ncbi.nlm.nih.gov/17123836/,Diffusion tensor studies dissociated two fronto-temporal pathways in the human memory system.,"Takahashi E, Ohki K, Kim DS",NeuroImage,0.109,17123836,-1,-1
ventrolateral prefrontal_00044,https://pubmed.ncbi.nlm.nih.gov/17904389/,Neural mechanisms of proactive interference-resolution.,"Nee DE, Jonides J, Berman MG",NeuroImage,0.109,17904389,-1,-1
ventrolateral prefrontal_00045,https://pubmed.ncbi.nlm.nih.gov/15219600/,From facial cue to dinner for two: the neural substrates of personal choice.,"Turk DJ, Banfield JF, Walling BR, Heatherton TF, Grafton ST, Handy TC, Gazzaniga MS, Macrae CN",NeuroImage,0.107,15219600,-1,-1
ventrolateral prefrontal_00046,https://pubmed.ncbi.nlm.nih.gov/16481440/,Brain systems mediating cognitive interference by emotional distraction.,"Dolcos F, McCarthy G",The Journal of neuroscience : the official journal of the Society for Neuroscience,0.107,16481440,-1,-1
ventrolateral prefrontal_00047,https://pubmed.ncbi.nlm.nih.gov/21782395/,Aberrant visual circuitry associated with normal spatial match-to-sample accuracy in schizophrenia.,"Avsar KB, Stoeckel LE, Bolding MS, White DM, Tagamets MA, Holcomb HH, Lahti AC",Psychiatry research,0.106,21782395,-1,-1
ventrolateral prefrontal_00048,https://pubmed.ncbi.nlm.nih.gov/23460073/,Responses of medial and ventrolateral prefrontal cortex to interpersonal conflict for resources.,"Koban L, Pichon S, Vuilleumier P",Social cognitive and affective neuroscience,0.104,23460073,-1,-1
ventrolateral prefrontal_00049,https://pubmed.ncbi.nlm.nih.gov/20573575/,The hybrid GLM-ICA investigation on the neural mechanism of acupoint ST36: an fMRI study.,"Liu P, Zhou G, Zhang Y, Dong M, Qin W, Yuan K, Sun J, Liu J, Liang J, von Deneen KM, Liu Y, Tian J",Neuroscience letters,0.103,20573575,-1,-1
ventrolateral prefrontal_00050,https://pubmed.ncbi.nlm.nih.gov/11804576/,Immature frontal lobe contributions to cognitive control in children: evidence from fMRI.,"Bunge SA, Dudukovic NM, Thomason ME, Vaidya CJ, Gabrieli JD",Neuron,0.101,11804576,-1,-1
ventrolateral prefrontal_00051,https://pubmed.ncbi.nlm.nih.gov/21190759/,Age-related effects on the neural correlates of autobiographical memory retrieval.,"St Jacques PL, Rubin DC, Cabeza R",Neurobiology of aging,0.101,21190759,10.1016/j.neurobiolaging.2010.11.007,-1
ventrolateral prefrontal_00052,https://pubmed.ncbi.nlm.nih.gov/22912831/,Functional alterations in neural substrates of geometric reasoning in adults with high-functioning autism.,"Yamada T, Ohta H, Watanabe H, Kanai C, Tani M, Ohno T, Takayama Y, Iwanami A, Kato N, Hashimoto R",PloS one,0.101,22912831,10.1371/journal.pone.0043220,-1
ventrolateral prefrontal_00053,https://pubmed.ncbi.nlm.nih.gov/24222712/,Existential neuroscience: self-esteem moderates neuronal responses to mortality-related stimuli.,"Klackl J, Jonas E, Kronbichler M",Social cognitive and affective neuroscience,0.101,24222712,10.1093/scan/nst167,-1
ventrolateral prefrontal_00054,https://pubmed.ncbi.nlm.nih.gov/24336707/,Diagnostic value underlies asymmetric updating of impressions in the morality and ability domains.,"Mende-Siedlecki P, Baron SG, Todorov A",The Journal of neuroscience : the official journal of the Society for Neuroscience,0.1,24336707,-1,-1
ventrolateral prefrontal_00055,https://pubmed.ncbi.nlm.nih.gov/21074583/,The role of the dorsolateral prefrontal cortex in deception when remembering neutral and emotional events.,"Ito A, Abe N, Fujii T, Ueno A, Koseki Y, Hashimoto R, Mugikura S, Takahashi S, Mori E",Neuroscience research,0.098,21074583,-1,-1
ventrolateral prefrontal_00056,https://pubmed.ncbi.nlm.nih.gov/23426687/,Reputational priors magnify striatal responses to violations of trust.,"Fouragnan E, Chierchia G, Greiner S, Neveu R, Avesani P, Coricelli G",The Journal of neuroscience : the official journal of the Society for Neuroscience,0.098,23426687,-1,-1
ventrolateral prefrontal_00057,https://pubmed.ncbi.nlm.nih.gov/26190983/,A functional polymorphism in the prodynorphin gene affects cognitive flexibility  and brain activation during reversal learning.,"Votinov M, Pripfl J, Windischberger C, Moser E, Sailer U, Lamm C",Frontiers in behavioral neuroscience,0.098,26190983,-1,-1
ventrolateral prefrontal_00058,https://pubmed.ncbi.nlm.nih.gov/14741672/,Modality effects in verbal working memory: differential prefrontal and parietal responses to auditory and visual stimuli.,"Crottaz-Herbette S, Anagnoson RT, Menon V",NeuroImage,0.097,14741672,-1,-1
ventrolateral prefrontal_00059,https://pubmed.ncbi.nlm.nih.gov/28757070/,Individual differences in the processing of smoking-cessation video messages: An  imaging genetics study.,"Shi Z, Wang AL, Aronowitz CA, Romer D, Langleben DD",Biological psychology,0.097,28757070,-1,-1
ventrolateral prefrontal_00060,https://pubmed.ncbi.nlm.nih.gov/16009242/,Brain activations associated with probability matching.,"Miller MB, Valsangkar-Smyth M, Newman S, Dumont H, Wolford G",Neuropsychologia,0.096,16009242,-1,-1
ventrolateral prefrontal_00061,https://pubmed.ncbi.nlm.nih.gov/19523967/,A role for right ventrolateral prefrontal cortex in reasoning about indeterminate relations.,"Goel V, Stollstorff M, Nakic M, Knutson K, Grafman J",Neuropsychologia,0.096,19523967,-1,-1
ventrolateral prefrontal_00062,https://pubmed.ncbi.nlm.nih.gov/18022606/,All for one but not one for all: how multiple number representations are recruited in one numerical task.,"Wood G, Nuerk HC, Moeller K, Geppert B, Schnitker R, Weber J, Willmes K",Brain research,0.095,18022606,-1,-1
ventrolateral prefrontal_00063,https://pubmed.ncbi.nlm.nih.gov/16418844/,Brain activity during visuomotor behavior triggered by arbitrary and spatially constrained cues: an fMRI study in humans.,"Hanakawa T, Honda M, Zito G, Dimyan MA, Hallett M",Experimental brain research,0.094,16418844,-1,-1
ventrolateral prefrontal_00064,https://pubmed.ncbi.nlm.nih.gov/18588543/,Individual differences in disgust sensitivity modulate neural responses to aversive/disgusting stimuli.,"Mataix-Cols D, An SK, Lawrence NS, Caseras X, Speckens A, Giampietro V, Brammer MJ, Phillips ML",The European journal of neuroscience,0.094,18588543,-1,-1
ventrolateral prefrontal_00065,https://pubmed.ncbi.nlm.nih.gov/12457762/,Prefrontal activity associated with working memory and episodic long-term memory.,"Ranganath C, Johnson MK, D'Esposito M",Neuropsychologia,0.093,12457762,-1,-1
ventrolateral prefrontal_00066,https://pubmed.ncbi.nlm.nih.gov/22200490/,Role of the striatum in language: Syntactic and conceptual sequencing.,"Chan SH, Ryan L, Bever TG",Brain and language,0.092,22200490,-1,-1
ventrolateral prefrontal_00067,https://pubmed.ncbi.nlm.nih.gov/16120772/,Conditional associative memory for musical stimuli in nonmusicians: implications  for absolute pitch.,"Bermudez P, Zatorre RJ",The Journal of neuroscience : the official journal of the Society for Neuroscience,0.091,16120772,-1,-1
ventrolateral prefrontal_00068,https://pubmed.ncbi.nlm.nih.gov/16230029/,Segregated neural representation of distinct emotion dimensions in the prefrontal cortex-an fMRI study.,"Grimm S, Schmidt CF, Bermpohl F, Heinzel A, Dahlem Y, Wyss M, Hell D, Boesiger P, Boeker H, Northoff G",NeuroImage,0.091,16230029,-1,-1
ventrolateral prefrontal_00069,https://pubmed.ncbi.nlm.nih.gov/19038275/,Ventrolateral prefrontal cortex and self-initiated semantic elaboration during memory retrieval.,"Raposo A, Han S, Dobbins IG",Neuropsychologia,0.091,19038275,-1,-1
ventrolateral prefrontal_00070,https://pubmed.ncbi.nlm.nih.gov/29590181/,Modulation of inhibitory control by prefrontal anodal tDCS: A crossover double-blind sham-controlled fMRI study.,"Sallard E, Mouthon M, De Pretto M, Spierer L",PloS one,0.091,29590181,-1,-1
ventrolateral prefrontal_00071,https://pubmed.ncbi.nlm.nih.gov/14993603/,Frontostriatal deficits in fragile X syndrome: relation to FMR1 gene expression.,"Menon V, Leroux J, White CD, Reiss AL",Proceedings of the National Academy of Sciences of the United States of America,0.09,14993603,10.1073/pnas.0304544101,-1
ventrolateral prefrontal_00072,https://pubmed.ncbi.nlm.nih.gov/17370344/,The engagement of mid-ventrolateral prefrontal cortex and posterior brain regions in intentional cognitive activity.,"Dove A, Manly T, Epstein R, Owen AM",Human brain mapping,0.09,17370344,10.1002/hbm.20378,-1
ventrolateral prefrontal_00073,https://pubmed.ncbi.nlm.nih.gov/22228752/,Facing puberty: associations between pubertal development and neural responses to affective facial displays.,"Moore WE 3rd, Pfeifer JH, Masten CL, Mazziotta JC, Iacoboni M, Dapretto M",Social cognitive and affective neuroscience,0.09,22228752,-1,-1
ventrolateral prefrontal_00074,https://pubmed.ncbi.nlm.nih.gov/19004769/,Ventral and dorsal pathways for language.,"Saur D, Kreher BW, Schnell S, Kummerer D, Kellmeyer P, Vry MS, Umarova R, Musso M, Glauche V, Abel S, Huber W, Rijntjes M, Hennig J, Weiller C",Proceedings of the National Academy of Sciences of the United States of America,0.089,19004769,-1,-1
ventrolateral prefrontal_00075,https://pubmed.ncbi.nlm.nih.gov/23228724/,Altered cerebellar-cerebral resting-state functional connectivity reliably identifies major depressive disorder.,"Ma Q, Zeng LL, Shen H, Liu L, Hu D",Brain research,0.089,23228724,-1,-1
ventrolateral prefrontal_00076,https://pubmed.ncbi.nlm.nih.gov/15217392/,Prefrontal cortical involvement in verbal encoding strategies.,"Bor D, Cumming N, Scott CE, Owen AM",The European journal of neuroscience,0.088,15217392,-1,-1
ventrolateral prefrontal_00077,https://pubmed.ncbi.nlm.nih.gov/18033767/,Understanding the neural computations of arbitrary visuomotor learning through fMRI and associative learning theory.,"Brovelli A, Laksiri N, Nazarian B, Meunier M, Boussaoud D","Cerebral cortex (New York, N.Y. : 1991)",0.088,18033767,-1,-1
ventrolateral prefrontal_00078,https://pubmed.ncbi.nlm.nih.gov/18511301/,"Time-course of ""off-line"" prefrontal rTMS effects--a PET study.","Eisenegger C, Treyer V, Fehr E, Knoch D",NeuroImage,0.088,18511301,-1,-1
ventrolateral prefrontal_00079,https://pubmed.ncbi.nlm.nih.gov/18817740/,Prefrontal-subcortical pathways mediating successful emotion regulation.,"Wager TD, Davidson ML, Hughes BL, Lindquist MA, Ochsner KN",Neuron,0.088,18817740,-1,-1
ventrolateral prefrontal_00080,https://pubmed.ncbi.nlm.nih.gov/18835075/,Developmental shifts in fMRI activations during visuospatial relational reasoning.,"Eslinger PJ, Blair C, Wang J, Lipovsky B, Realmuto J, Baker D, Thorne S, Gamson D, Zimmerman E, Rohrer L, Yang QX",Brain and cognition,0.088,18835075,-1,-1
ventrolateral prefrontal_00081,https://pubmed.ncbi.nlm.nih.gov/19394205/,Neural correlates of emotion processing in borderline personality disorder.,"Koenigsberg HW, Siever LJ, Lee H, Pizzarello S, New AS, Goodman M, Cheng H, Flory J, Prohovnik I",Psychiatry research,0.088,19394205,-1,-1
ventrolateral prefrontal_00082,https://pubmed.ncbi.nlm.nih.gov/19560907/,Sexually dimorphic gray matter volume reduction in patients with panic disorder.,"Asami T, Yamasue H, Hayano F, Nakamura M, Uehara K, Otsuka T, Roppongi T, Nihashi N, Inoue T, Hirayasu Y",Psychiatry research,0.088,19560907,-1,-1
ventrolateral prefrontal_00083,https://pubmed.ncbi.nlm.nih.gov/20194687/,The emergence of explicit memory during learning.,"Rose M, Haider H, Buchel C","Cerebral cortex (New York, N.Y. : 1991)",0.088,20194687,-1,-1
ventrolateral prefrontal_00084,https://pubmed.ncbi.nlm.nih.gov/22414937/,Neural correlates of attention bias to threat in post-traumatic stress disorder.,"Fani N, Jovanovic T, Ely TD, Bradley B, Gutman D, Tone EB, Ressler KJ",Biological psychology,0.088,22414937,-1,-1
ventrolateral prefrontal_00085,https://pubmed.ncbi.nlm.nih.gov/12244209/,Neural basis of protracted developmental changes in visuo-spatial working memory.,"Kwon H, Reiss AL, Menon V",Proceedings of the National Academy of Sciences of the United States of America,0.087,12244209,-1,-1
ventrolateral prefrontal_00086,https://pubmed.ncbi.nlm.nih.gov/20350180/,Multimodal imaging of incidental retrieval: the low route to memory.,"Kompus K, Eichele T, Hugdahl K, Nyberg L",Journal of cognitive neuroscience,0.087,20350180,-1,-1
ventrolateral prefrontal_00087,https://pubmed.ncbi.nlm.nih.gov/18308708/,Semantic adaptation and competition during word comprehension.,"Bedny M, McGill M, Thompson-Schill SL","Cerebral cortex (New York, N.Y. : 1991)",0.086,18308708,-1,-1
ventrolateral prefrontal_00088,https://pubmed.ncbi.nlm.nih.gov/21126587/,Activation of central sympathetic networks during innocuous and noxious somatosensory stimulation.,"Maihofner C, Seifert F, Decol R",NeuroImage,0.086,21126587,-1,-1
ventrolateral prefrontal_00089,https://pubmed.ncbi.nlm.nih.gov/25234799/,The neural basis of attaining conscious awareness of sad mood.,"Smith R, Braden BB, Chen K, Ponce FA, Lane RD, Baxter LC",Brain imaging and behavior,0.086,25234799,-1,-1
ventrolateral prefrontal_00090,https://pubmed.ncbi.nlm.nih.gov/15716474/,Developmental changes in mental arithmetic: evidence for increased functional specialization in the left inferior parietal cortex.,"Rivera SM, Reiss AL, Eckert MA, Menon V","Cerebral cortex (New York, N.Y. : 1991)",0.085,15716474,-1,-1
