paper_name,paper_url,Title,Author,Journal,Loading,PMID,Doi,download_status
ventrolateral prefrontal_00091,https://pubmed.ncbi.nlm.nih.gov/16054840/,"Prefrontal cortex activity in self-initiated movements is condition-specific, but not movement-related.","Wiese H, Stude P, Nebel K, Forsting M, de Greiff A",NeuroImage,0.085,16054840,10.1016/j.neuroimage.2005.06.044,-1
ventrolateral prefrontal_00092,https://pubmed.ncbi.nlm.nih.gov/20864602/,Fronto-striatal contribution to lexical set-shifting.,"Simard F, Joanette Y, Petrides M, Jubault T, Madjar C, Monchi O","Cerebral cortex (New York, N.Y. : 1991)",0.085,20864602,10.1093/cercor/bhq182,-1
ventrolateral prefrontal_00093,https://pubmed.ncbi.nlm.nih.gov/22661404/,Perseveration and choice in Parkinson's disease: the impact of progressive frontostriatal dysfunction on action decisions.,"Hughes LE, Altena E, Barker RA, Rowe JB","Cerebral cortex (New York, N.Y. : 1991)",0.085,22661404,10.1093/cercor/bhs144,-1
ventrolateral prefrontal_00094,https://pubmed.ncbi.nlm.nih.gov/23115550/,Male carriers of the FMR1 premutation show altered hippocampal-prefrontal function during memory encoding.,"Wang JM, Koldewyn K, Hashimoto R, Schneider A, Le L, Tassone F, Cheung K, Hagerman P, Hessl D, Rivera SM",Frontiers in human neuroscience,0.085,23115550,-1,-1
ventrolateral prefrontal_00095,https://pubmed.ncbi.nlm.nih.gov/24486655/,Development of temperamental effortful control mediates the relationship between  maturation of the prefrontal cortex and psychopathology during adolescence: a 4-year longitudinal study.,"Vijayakumar N, Whittle S, Dennison M, Yucel M, Simmons J, Allen NB",Developmental cognitive neuroscience,0.085,24486655,-1,-1
ventrolateral prefrontal_00096,https://pubmed.ncbi.nlm.nih.gov/28957750/,Comparing abnormalities of amplitude of low-frequency fluctuations in multiple system atrophy and idiopathic Parkinson's disease measured with resting-state fMRI.,"Wang N, Edmiston EK, Luo X, Yang H, Chang M, Wang F, Fan G",Psychiatry research. Neuroimaging,0.085,28957750,-1,-1
ventrolateral prefrontal_00097,https://pubmed.ncbi.nlm.nih.gov/16256375/,Tracking the subprocesses of decision-based action in the human frontal lobes.,"Rahm B, Opwis K, Kaller CP, Spreer J, Schwarzwald R, Seifritz E, Halsband U, Unterrainer JM",NeuroImage,0.084,16256375,-1,-1
ventrolateral prefrontal_00098,https://pubmed.ncbi.nlm.nih.gov/19554558/,Auditory orienting and inhibition of return in mild traumatic brain injury: a FMRI study.,"Mayer AR, Mannell MV, Ling J, Elgie R, Gasparovic C, Phillips JP, Doezema D, Yeo RA",Human brain mapping,0.084,19554558,-1,-1
ventrolateral prefrontal_00099,https://pubmed.ncbi.nlm.nih.gov/19932154/,Maintenance of real objects and their verbal designations in working memory.,"Kaiser S, Kopka ML, Rentrop M, Walther S, Kronmuller K, Olbrich R, Weisbrod M, Stippich C",Neuroscience letters,0.084,19932154,-1,-1
ventrolateral prefrontal_00100,https://pubmed.ncbi.nlm.nih.gov/20035016/,Neural correlates of incidental and directed facial emotion processing in adolescents and adults.,"Passarotti AM, Sweeney JA, Pavuluri MN",Social cognitive and affective neuroscience,0.084,20035016,-1,-1
ventrolateral prefrontal_00101,https://pubmed.ncbi.nlm.nih.gov/15862220/,Same or different? Neural correlates of happy and sad mood in healthy males.,"Habel U, Klein M, Kellermann T, Shah NJ, Schneider F",NeuroImage,0.083,15862220,-1,-1
ventrolateral prefrontal_00102,https://pubmed.ncbi.nlm.nih.gov/18774224/,An fMRI study measuring analgesia enhanced by religion as a belief system.,"Wiech K, Farias M, Kahane G, Shackel N, Tiede W, Tracey I",Pain,0.083,18774224,-1,-1
ventrolateral prefrontal_00103,https://pubmed.ncbi.nlm.nih.gov/20510377/,Body mass correlates inversely with inhibitory control in response to food among  adolescent girls: an fMRI study.,"Batterink L, Yokum S, Stice E",NeuroImage,0.083,20510377,-1,-1
ventrolateral prefrontal_00104,https://pubmed.ncbi.nlm.nih.gov/21803165/,Different types of target probability have different prefrontal consequences.,"Hon N, Ong J, Tan R, Yang TH",NeuroImage,0.083,21803165,-1,-1
ventrolateral prefrontal_00105,https://pubmed.ncbi.nlm.nih.gov/21945849/,Abeta Deposition in aging is associated with increases in brain activation during successful memory encoding.,"Mormino EC, Brandel MG, Madison CM, Marks S, Baker SL, Jagust WJ","Cerebral cortex (New York, N.Y. : 1991)",0.083,21945849,-1,-1
ventrolateral prefrontal_00106,https://pubmed.ncbi.nlm.nih.gov/22565029/,Frontal and parietal activity after sleep deprivation is dependent on task difficulty and can be predicted by the fMRI response after normal sleep.,"Lythe KE, Williams SC, Anderson C, Libri V, Mehta MA",Behavioural brain research,0.083,22565029,-1,-1
ventrolateral prefrontal_00107,https://pubmed.ncbi.nlm.nih.gov/25759470/,Mothers know best: redirecting adolescent reward sensitivity toward safe behavior during risk taking.,"Telzer EH, Ichien NT, Qu Y",Social cognitive and affective neuroscience,0.083,25759470,-1,-1
ventrolateral prefrontal_00108,https://pubmed.ncbi.nlm.nih.gov/26483212/,Processing of decision-making and social threat in patients with history of suicidal attempt: A neuroimaging replication study.,"Olie E, Ding Y, Le Bars E, de Champfleur NM, Mura T, Bonafe A, Courtet P, Jollant F",Psychiatry research,0.083,26483212,-1,-1
ventrolateral prefrontal_00109,https://pubmed.ncbi.nlm.nih.gov/12595179/,Maintenance versus manipulation in verbal working memory revisited: an fMRI study.,"Veltman DJ, Rombouts SA, Dolan RJ",NeuroImage,0.082,12595179,-1,-1
ventrolateral prefrontal_00110,https://pubmed.ncbi.nlm.nih.gov/16202396/,Monoamine oxidase-a genetic variations influence brain activity associated with inhibitory control: new insight into the neural correlates of impulsivity.,"Passamonti L, Fera F, Magariello A, Cerasa A, Gioia MC, Muglia M, Nicoletti G, Gallo O, Provinciali L, Quattrone A",Biological psychiatry,0.082,16202396,-1,-1
ventrolateral prefrontal_00111,https://pubmed.ncbi.nlm.nih.gov/17118409/,Neural substrates of choice selection in adults and adolescents: development of the ventrolateral prefrontal and anterior cingulate cortices.,"Eshel N, Nelson EE, Blair RJ, Pine DS, Ernst M",Neuropsychologia,0.082,17118409,10.1016/j.neuropsychologia.2006.10.004,-1
ventrolateral prefrontal_00112,https://pubmed.ncbi.nlm.nih.gov/19686782/,Prefrontal function associated with impaired emotion recognition in patients with multiple sclerosis.,"Krause M, Wendt J, Dressel A, Berneiser J, Kessler C, Hamm AO, Lotze M",Behavioural brain research,0.082,19686782,10.1016/j.bbr.2009.08.009,-1
ventrolateral prefrontal_00113,https://pubmed.ncbi.nlm.nih.gov/22936905/,Emotional and cognitive processing of narratives and individual appraisal styles: recruitment of cognitive control networks vs. modulation of deactivations.,"Benelli E, Mergenthaler E, Walter S, Messina I, Sambin M, Buchheim A, Sim EJ, Viviani R",Frontiers in human neuroscience,0.082,22936905,-1,-1
ventrolateral prefrontal_00114,https://pubmed.ncbi.nlm.nih.gov/23968837/,Resting-State Striato-Frontal Functional Connectivity is Sensitive to DAT1 Genotype and Predicts Executive Function.,"Gordon EM, Devaney JM, Bean S, Vaidya CJ","Cerebral cortex (New York, N.Y. : 1991)",0.082,23968837,-1,-1
ventrolateral prefrontal_00115,https://pubmed.ncbi.nlm.nih.gov/27510495/,Intrinsic functional connectivity underlying successful emotion regulation of angry faces.,"Morawetz C, Kellermann T, Kogler L, Radke S, Blechert J, Derntl B",Social cognitive and affective neuroscience,0.082,27510495,-1,-1
ventrolateral prefrontal_00116,https://pubmed.ncbi.nlm.nih.gov/29656269/,Task-positive and task-negative networks in major depressive disorder: A combined fMRI and EEG study.,"Knyazev GG, Savostyanov AN, Bocharov AV, Brak IV, Osipov EA, Filimonova EA, Saprigyn AE, Aftanas LI",Journal of affective disorders,0.082,29656269,-1,-1
ventrolateral prefrontal_00117,https://pubmed.ncbi.nlm.nih.gov/15858053/,Changes in brain activation during the acquisition of a multifrequency bimanual coordination task: from the cognitive stage to advanced levels of automaticity.,"Puttemans V, Wenderoth N, Swinnen SP",The Journal of neuroscience : the official journal of the Society for Neuroscience,0.081,15858053,-1,-1
ventrolateral prefrontal_00118,https://pubmed.ncbi.nlm.nih.gov/17855057/,Blunted activation in right ventrolateral prefrontal cortex during motor response inhibition in schizophrenia.,"Kaladjian A, Jeanningros R, Azorin JM, Grimault S, Anton JL, Mazzola-Pomietto P",Schizophrenia research,0.081,17855057,-1,-1
ventrolateral prefrontal_00119,https://pubmed.ncbi.nlm.nih.gov/17964741/,Differences in cortical activity between methamphetamine-dependent and healthy individuals performing a facial affect matching task.,"Payer DE, Lieberman MD, Monterosso JR, Xu J, Fong TW, London ED",Drug and alcohol dependence,0.081,17964741,-1,-1
ventrolateral prefrontal_00120,https://pubmed.ncbi.nlm.nih.gov/20162604/,Parkinson's disease and healthy aging: independent and interacting effects on action selection.,"Hughes LE, Barker RA, Owen AM, Rowe JB",Human brain mapping,0.081,20162604,-1,-1
ventrolateral prefrontal_00121,https://pubmed.ncbi.nlm.nih.gov/22884992/,Developmental differences in the neural correlates of relational encoding and recall in children: an event-related fMRI study.,"Guler OE, Thomas KM",Developmental cognitive neuroscience,0.081,22884992,-1,-1
ventrolateral prefrontal_00122,https://pubmed.ncbi.nlm.nih.gov/24236043/,Neural correlates of four broad temperament dimensions: testing predictions for a novel construct of personality.,"Brown LL, Acevedo B, Fisher HE",PloS one,0.081,24236043,-1,-1
ventrolateral prefrontal_00123,https://pubmed.ncbi.nlm.nih.gov/25527112/,Neural correlates of self-deception and impression-management.,"Farrow TF, Burgess J, Wilkinson ID, Hunter MD",Neuropsychologia,0.081,25527112,-1,-1
ventrolateral prefrontal_00124,https://pubmed.ncbi.nlm.nih.gov/28031150/,Functional Dysconnection of the Inferior Frontal Gyrus in Young People With Bipolar Disorder or at Genetic High Risk.,"Roberts G, Lord A, Frankland A, Wright A, Lau P, Levy F, Lenroot RK, Mitchell PB, Breakspear M",Biological psychiatry,0.081,28031150,-1,-1
ventrolateral prefrontal_00125,https://pubmed.ncbi.nlm.nih.gov/23913849/,Maintenance and manipulation of somatosensory information in ventrolateral prefrontal cortex.,"Spitzer B, Goltz D, Wacker E, Auksztulewicz R, Blankenburg F",Human brain mapping,0.08,23913849,-1,-1
ventrolateral prefrontal_00126,https://pubmed.ncbi.nlm.nih.gov/26454185/,Behavioral activation can normalize neural hypoactivation in subthreshold depression during a monetary incentive delay task.,"Mori A, Okamoto Y, Okada G, Takagaki K, Jinnin R, Takamura M, Kobayakawa M, Yamawaki S",Journal of affective disorders,0.08,26454185,-1,-1
ventrolateral prefrontal_00127,https://pubmed.ncbi.nlm.nih.gov/27182810/,Resting state functional connectivity of the hippocampus along the anterior-posterior axis and its association with glutamatergic metabolism.,"Wagner G, Gussew A, Kohler S, de la Cruz F, Smesny S, Reichenbach JR, Bar KJ",Cortex; a journal devoted to the study of the nervous system and behavior,0.08,27182810,-1,-1
ventrolateral prefrontal_00128,https://pubmed.ncbi.nlm.nih.gov/16460697/,Neural responses to emotional stimuli are associated with childhood family stress.,"Taylor SE, Eisenberger NI, Saxbe D, Lehman BJ, Lieberman MD",Biological psychiatry,0.079,16460697,-1,-1
ventrolateral prefrontal_00129,https://pubmed.ncbi.nlm.nih.gov/17258912/,Preparatory allocation of attention and adjustments in conflict processing.,"Luks TL, Simpson GV, Dale CL, Hough MG",NeuroImage,0.079,17258912,-1,-1
ventrolateral prefrontal_00130,https://pubmed.ncbi.nlm.nih.gov/17437282/,Fronto-striatal dysfunction and potential compensatory mechanisms in male adolescents with fragile X syndrome.,"Hoeft F, Hernandez A, Parthasarathy S, Watson CL, Hall SS, Reiss AL",Human brain mapping,0.079,17437282,-1,-1
ventrolateral prefrontal_00131,https://pubmed.ncbi.nlm.nih.gov/19074015/,Neural markers of inhibition in human memory retrieval.,"Wimber M, Bauml KH, Bergstrom Z, Markopoulos G, Heinze HJ, Richardson-Klavehn A",The Journal of neuroscience : the official journal of the Society for Neuroscience,0.079,19074015,10.1523/JNEUROSCI.1916-08.2008,-1
ventrolateral prefrontal_00132,https://pubmed.ncbi.nlm.nih.gov/21828112/,Neural circuitry underlying affective response to peer feedback in adolescence.,"Guyer AE, Choate VR, Pine DS, Nelson EE",Social cognitive and affective neuroscience,0.079,21828112,10.1093/scan/nsr043,-1
ventrolateral prefrontal_00133,https://pubmed.ncbi.nlm.nih.gov/21878395/,Squeezing lemons in the bathroom: contextual information modulates action recognition.,"Wurm MF, Schubotz RI",NeuroImage,0.079,21878395,-1,-1
ventrolateral prefrontal_00134,https://pubmed.ncbi.nlm.nih.gov/25754503/,Fronto-insula network activity explains emotional dysfunctions in juvenile myoclonic epilepsy: combined evidence from pupillometry and fMRI.,"Paulus FM, Krach S, Blanke M, Roth C, Belke M, Sommer J, Muller-Pinzler L, Menzler K, Jansen A, Rosenow F, Bremmer F, Einhauser W, Knake S",Cortex; a journal devoted to the study of the nervous system and behavior,0.079,25754503,-1,-1
ventrolateral prefrontal_00135,https://pubmed.ncbi.nlm.nih.gov/26551408/,Resting-state functional network connectivity in prefrontal regions differs between unmedicated patients with bipolar and major depressive disorders.,"He H, Yu Q, Du Y, Vergara V, Victor TA, Drevets WC, Savitz JB, Jiang T, Sui J, Calhoun VD",Journal of affective disorders,0.079,26551408,-1,-1
ventrolateral prefrontal_00136,https://pubmed.ncbi.nlm.nih.gov/27926435/,Brain correlates of the intrinsic subjective cost of effort in sedentary volunteers.,"Bernacer J, Martinez-Valbuena I, Martinez M, Pujol N, Luis E, Ramirez-Castillo D, Pastor MA",Progress in brain research,0.079,27926435,-1,-1
ventrolateral prefrontal_00137,https://pubmed.ncbi.nlm.nih.gov/11567063/,Wisconsin Card Sorting revisited: distinct neural circuits participating in different stages of the task identified by event-related functional magnetic resonance imaging.,"Monchi O, Petrides M, Petre V, Worsley K, Dagher A",The Journal of neuroscience : the official journal of the Society for Neuroscience,0.078,11567063,-1,-1
ventrolateral prefrontal_00138,https://pubmed.ncbi.nlm.nih.gov/20154013/,Dissociable connectivity within human angular gyrus and intraparietal sulcus: evidence from functional and structural connectivity.,"Uddin LQ, Supekar K, Amin H, Rykhlevskaia E, Nguyen DA, Greicius MD, Menon V","Cerebral cortex (New York, N.Y. : 1991)",0.078,20154013,-1,-1
ventrolateral prefrontal_00139,https://pubmed.ncbi.nlm.nih.gov/21769993/,How cognitive performance-induced stress can influence right VLPFC activation: an fMRI study in healthy subjects and in patients with social phobia.,"Koric L, Volle E, Seassau M, Bernard FA, Mancini J, Dubois B, Pelissolo A, Levy R",Human brain mapping,0.078,21769993,-1,-1
ventrolateral prefrontal_00140,https://pubmed.ncbi.nlm.nih.gov/22644759/,Trait anxiety and the neural efficiency of manipulation in working memory.,"Basten U, Stelzel C, Fiebach CJ","Cognitive, affective & behavioral neuroscience",0.078,22644759,-1,-1
ventrolateral prefrontal_00141,https://pubmed.ncbi.nlm.nih.gov/25527113/,"The special case of self-perspective inhibition in mental, but not non-mental, representation.","Hartwright CE, Apperly IA, Hansen PC",Neuropsychologia,0.078,25527113,-1,-1
ventrolateral prefrontal_00142,https://pubmed.ncbi.nlm.nih.gov/16968868/,Two distinct functional networks for successful resolution of proactive interference.,"Caplan JB, McIntosh AR, De Rosa E","Cerebral cortex (New York, N.Y. : 1991)",0.077,16968868,-1,-1
ventrolateral prefrontal_00143,https://pubmed.ncbi.nlm.nih.gov/17855604/,Common and differential ventrolateral prefrontal activity during inhibition of hand and eye movements.,"Leung HC, Cai W",The Journal of neuroscience : the official journal of the Society for Neuroscience,0.077,17855604,-1,-1
ventrolateral prefrontal_00144,https://pubmed.ncbi.nlm.nih.gov/18033768/,Where vision meets memory: prefrontal-posterior networks for visual object constancy during categorization and recognition.,"Schendan HE, Stern CE","Cerebral cortex (New York, N.Y. : 1991)",0.077,18033768,-1,-1
ventrolateral prefrontal_00145,https://pubmed.ncbi.nlm.nih.gov/18674871/,Low prefrontal perfusion linked to depression symptoms in methadone-maintained opiate-dependent patients.,"Suh JJ, Langleben DD, Ehrman RN, Hakun JG, Wang Z, Li Y, Busch SI, O'Brien CP, Childress AR",Drug and alcohol dependence,0.077,18674871,-1,-1
ventrolateral prefrontal_00146,https://pubmed.ncbi.nlm.nih.gov/21613466/,Distinct patterns of functional and effective connectivity between perirhinal cortex and other cortical regions in recognition memory and perceptual discrimination.,"O'Neil EB, Protzner AB, McCormick C, McLean DA, Poppenk J, Cate AD, Kohler S","Cerebral cortex (New York, N.Y. : 1991)",0.077,21613466,-1,-1
ventrolateral prefrontal_00147,https://pubmed.ncbi.nlm.nih.gov/28210783/,A neuroimaging study of emotion-cognition interaction in schizophrenia: the effect of ziprasidone treatment.,"Stip E, Cherbal A, Luck D, Zhornitsky S, Bentaleb LA, Lungu O",Psychopharmacology,0.077,28210783,-1,-1
ventrolateral prefrontal_00148,https://pubmed.ncbi.nlm.nih.gov/19944083/,Emotional and cognitive aspects of empathy and their relation to social cognition--an fMRI-study.,"Kramer UM, Mohammadi B, Donamayor N, Samii A, Munte TF",Brain research,0.076,19944083,-1,-1
ventrolateral prefrontal_00149,https://pubmed.ncbi.nlm.nih.gov/21334351/,Neural correlates of choice behavior related to impulsivity and venturesomeness.,"Hinvest NS, Elliott R, McKie S, Anderson IM",Neuropsychologia,0.076,21334351,-1,-1
ventrolateral prefrontal_00150,https://pubmed.ncbi.nlm.nih.gov/21570470/,"Dissociable functional connectivity changes during the Stroop task relating to risk, resilience and disease expression in bipolar disorder.","Pompei F, Dima D, Rubia K, Kumari V, Frangou S",NeuroImage,0.076,21570470,-1,-1
ventrolateral prefrontal_00151,https://pubmed.ncbi.nlm.nih.gov/21917846/,Adolescents' depressive symptoms moderate neural responses to their mothers' positive behavior.,"Whittle S, Yucel M, Forbes EE, Davey CG, Harding IH, Sheeber L, Yap MB, Allen NB",Social cognitive and affective neuroscience,0.076,21917846,10.1093/scan/nsr049,-1
ventrolateral prefrontal_00152,https://pubmed.ncbi.nlm.nih.gov/22450299/,Effects of semantic relatedness on age-related associative memory deficits: the role of theta oscillations.,"Crespo-Garcia M, Cantero JL, Atienza M",NeuroImage,0.076,22450299,10.1016/j.neuroimage.2012.03.034,-1
ventrolateral prefrontal_00153,https://pubmed.ncbi.nlm.nih.gov/23475755/,The role of top-down control in different phases of a sensorimotor timing task: a DCM study of adults and adolescents.,"Witt ST, Stevens MC",Brain imaging and behavior,0.076,23475755,10.1007/s11682-013-9224-5,-1
ventrolateral prefrontal_00154,https://pubmed.ncbi.nlm.nih.gov/25198094/,Neural systems for cognitive reappraisal in children and adolescents with autism  spectrum disorder.,"Pitskel NB, Bolling DZ, Kaiser MD, Pelphrey KA, Crowley MJ",Developmental cognitive neuroscience,0.076,25198094,-1,-1
ventrolateral prefrontal_00155,https://pubmed.ncbi.nlm.nih.gov/26270056/,Cerebral Inefficient Activation in Schizophrenia Patients and Their Unaffected Parents during the N-Back Working Memory Task: A Family fMRI Study.,"Jiang S, Yan H, Chen Q, Tian L, Lu T, Tan HY, Yan J, Zhang D",PloS one,0.076,26270056,-1,-1
ventrolateral prefrontal_00156,https://pubmed.ncbi.nlm.nih.gov/26284994/,Competition between Mutually Exclusive Object States in Event Comprehension.,"Solomon SH, Hindy NC, Altmann GT, Thompson-Schill SL",Journal of cognitive neuroscience,0.076,26284994,-1,-1
ventrolateral prefrontal_00157,https://pubmed.ncbi.nlm.nih.gov/27773357/,Relating pessimistic memory predictions to Alzheimer's disease brain structure.,"Genon S, Simon J, Bahri MA, Collette F, Souchay C, Jaspar M, Bastin C, Salmon E",Cortex; a journal devoted to the study of the nervous system and behavior,0.076,27773357,-1,-1
ventrolateral prefrontal_00158,https://pubmed.ncbi.nlm.nih.gov/28946039/,Disrupted amygdala-prefrontal connectivity during emotion regulation links stress-reactive rumination and adolescent depressive symptoms.,"Fowler CH, Miernicki ME, Rudolph KD, Telzer EH",Developmental cognitive neuroscience,0.076,28946039,-1,-1
ventrolateral prefrontal_00159,https://pubmed.ncbi.nlm.nih.gov/16624583/,Dissociable contributions of the mid-ventrolateral frontal cortex and the medial  temporal lobe system to human memory.,"Dove A, Brett M, Cusack R, Owen AM",NeuroImage,0.075,16624583,-1,-1
ventrolateral prefrontal_00160,https://pubmed.ncbi.nlm.nih.gov/17027928/,Voxel-based study of structural changes in first-episode patients with bipolar disorder.,"Adler CM, DelBello MP, Jarvis K, Levine A, Adams J, Strakowski SM",Biological psychiatry,0.075,17027928,-1,-1
ventrolateral prefrontal_00161,https://pubmed.ncbi.nlm.nih.gov/19883772/,Emotional priming effects during Stroop task performance.,"Hart SJ, Green SR, Casp M, Belger A",NeuroImage,0.075,19883772,-1,-1
ventrolateral prefrontal_00162,https://pubmed.ncbi.nlm.nih.gov/20045475/,Self-related awareness and emotion regulation.,"Herwig U, Kaffenberger T, Jancke L, Bruhl AB",NeuroImage,0.075,20045475,-1,-1
ventrolateral prefrontal_00163,https://pubmed.ncbi.nlm.nih.gov/20974272/,Dissociable brain mechanisms for processing social exclusion and rule violation.,"Bolling DZ, Pitskel NB, Deen B, Crowley MJ, McPartland JC, Mayes LC, Pelphrey KA",NeuroImage,0.075,20974272,-1,-1
ventrolateral prefrontal_00164,https://pubmed.ncbi.nlm.nih.gov/24675869/,The When and Where of Working Memory Dysfunction in Early-Onset Schizophrenia--A  Functional Magnetic Resonance Imaging Study.,"Bittner RA, Linden DE, Roebroeck A, Hartling F, Rotarska-Jagiela A, Maurer K, Goebel R, Singer W, Haenschel C","Cerebral cortex (New York, N.Y. : 1991)",0.075,24675869,-1,-1
ventrolateral prefrontal_00165,https://pubmed.ncbi.nlm.nih.gov/25339893/,Activity of right premotor-parietal regions dependent upon imagined force level:  an fMRI study.,"Mizuguchi N, Nakata H, Kanosue K",Frontiers in human neuroscience,0.075,25339893,-1,-1
ventrolateral prefrontal_00166,https://pubmed.ncbi.nlm.nih.gov/25557777/,Amygdala subnuclei connectivity in response to violence reveals unique influences of individual differences in psychopathic traits in a nonforensic sample.,"Yoder KJ, Porges EC, Decety J",Human brain mapping,0.075,25557777,-1,-1
ventrolateral prefrontal_00167,https://pubmed.ncbi.nlm.nih.gov/27898341/,Tracking competition and cognitive control during language comprehension with multi-voxel pattern analysis.,"Musz E, Thompson-Schill SL",Brain and language,0.075,27898341,-1,-1
ventrolateral prefrontal_00168,https://pubmed.ncbi.nlm.nih.gov/12948709/,Basal ganglia and supplementary motor area subtend duration perception: an fMRI study.,"Ferrandez AM, Hugueville L, Lehericy S, Poline JB, Marsault C, Pouthas V",NeuroImage,0.074,12948709,-1,-1
ventrolateral prefrontal_00169,https://pubmed.ncbi.nlm.nih.gov/16414280/,Using fMRI to decompose the neural processes underlying the Wisconsin Card Sorting Test.,"Lie CH, Specht K, Marshall JC, Fink GR",NeuroImage,0.074,16414280,-1,-1
ventrolateral prefrontal_00170,https://pubmed.ncbi.nlm.nih.gov/16418007/,The neural basis of implicit moral attitude--an IAT study using event-related fMRI.,"Luo Q, Nakic M, Wheatley T, Richell R, Martin A, Blair RJ",NeuroImage,0.074,16418007,-1,-1
ventrolateral prefrontal_00171,https://pubmed.ncbi.nlm.nih.gov/18063349/,Evidence for deficient modulation of amygdala response by prefrontal cortex in bipolar mania.,"Foland LC, Altshuler LL, Bookheimer SY, Eisenberger N, Townsend J, Thompson PM",Psychiatry research,0.074,18063349,10.1016/j.pscychresns.2007.04.007,-1
ventrolateral prefrontal_00172,https://pubmed.ncbi.nlm.nih.gov/22440654/,Multiple roles for executive control in belief-desire reasoning: distinct neural  networks are recruited for self perspective inhibition and complexity of reasoning.,"Hartwright CE, Apperly IA, Hansen PC",NeuroImage,0.074,22440654,10.1016/j.neuroimage.2012.03.012,-1
ventrolateral prefrontal_00173,https://pubmed.ncbi.nlm.nih.gov/23077042/,Neural substrate of the late positive potential in emotional processing.,"Liu Y, Huang H, McGinnis-Deweese M, Keil A, Ding M",The Journal of neuroscience : the official journal of the Society for Neuroscience,0.074,23077042,10.1523/JNEUROSCI.3109-12.2012,-1
ventrolateral prefrontal_00174,https://pubmed.ncbi.nlm.nih.gov/23355265/,Neural correlates of treatment response in depressed bipolar adolescents during emotion processing.,"Diler RS, Ladouceur CD, Segreti A, Almeida JR, Birmaher B, Axelson DA, Phillips ML, Pan LA",Brain imaging and behavior,0.074,23355265,-1,-1
ventrolateral prefrontal_00175,https://pubmed.ncbi.nlm.nih.gov/23423461/,Aberrant connectivity of areas for decoding degraded speech in patients with auditory verbal hallucinations.,"Clos M, Diederen KM, Meijering AL, Sommer IE, Eickhoff SB",Brain structure & function,0.074,23423461,-1,-1
ventrolateral prefrontal_00176,https://pubmed.ncbi.nlm.nih.gov/23440005/,Resting-state functional connectivity of ventral parietal regions associated with attention reorienting and episodic recollection.,"Daselaar SM, Huijbers W, Eklund K, Moscovitch M, Cabeza R",Frontiers in human neuroscience,0.074,23440005,-1,-1
