paper_name,paper_url,Title,Author,Journal,Loading,PMID,Doi,download_status
ventrolateral prefrontal_00262,https://pubmed.ncbi.nlm.nih.gov/27756046/,Amygdala-prefrontal cortical functional connectivity during implicit emotion processing differentiates youth with bipolar spectrum from youth with externalizing disorders.,"Hafeman D, Bebko G, Bertocci MA, Fournier JC, Chase HW, Bonar L, Perlman SB, Travis M, Gill MK, Diwadkar VA, Sunshine JL, Holland SK, Kowatch RA, Birmaher B, Axelson D, Horwitz SM, Arnold LE, Fristad MA, Frazier TW, Youngstrom EA, Findling RL, Phillips ML",Journal of affective disorders,0.06,27756046,-1,-1
ventrolateral prefrontal_00263,https://pubmed.ncbi.nlm.nih.gov/28634448/,From Behavioral Facilitation to Inhibition: The Neuronal Correlates of the Orienting and Reorienting of Auditory Attention.,"Hanlon FM, Dodd AB, Ling JM, Bustillo JR, Abbott CC, Mayer AR",Frontiers in human neuroscience,0.06,28634448,-1,-1
ventrolateral prefrontal_00264,https://pubmed.ncbi.nlm.nih.gov/17716696/,Effects of aging on true and false memory formation: an fMRI study.,"Dennis NA, Kim H, Cabeza R",Neuropsychologia,0.059,17716696,-1,-1
ventrolateral prefrontal_00265,https://pubmed.ncbi.nlm.nih.gov/21620979/,The effects of aging on material-independent and material-dependent neural correlates of contextual binding.,"Dulas MR, Duarte A",NeuroImage,0.059,21620979,-1,-1
ventrolateral prefrontal_00266,https://pubmed.ncbi.nlm.nih.gov/22136749/,Neural mechanisms mediating the effects of expectation in visceral placebo analgesia: an fMRI study in healthy placebo responders and nonresponders.,"Elsenbruch S, Kotsis V, Benson S, Rosenberger C, Reidick D, Schedlowski M, Bingel U, Theysohn N, Forsting M, Gizewski ER",Pain,0.059,22136749,-1,-1
ventrolateral prefrontal_00267,https://pubmed.ncbi.nlm.nih.gov/24239131/,Neural Correlates of Impaired Cognitive Control over Working Memory in Schizophrenia.,"Eich TS, Nee DE, Insel C, Malapani C, Smith EE",Biological psychiatry,0.059,24239131,-1,-1
ventrolateral prefrontal_00268,https://pubmed.ncbi.nlm.nih.gov/26082893/,Inhibitory behavioral control: A stochastic dynamic causal modeling study comparing cocaine dependent subjects and controls.,"Ma L, Steinberg JL, Cunningham KA, Lane SD, Bjork JM, Neelakantan H, Price AE, Narayana PA, Kosten TR, Bechara A, Moeller FG",NeuroImage. Clinical,0.059,26082893,-1,-1
ventrolateral prefrontal_00269,https://pubmed.ncbi.nlm.nih.gov/15817513/,Functional MRI study of diencephalic amnesia in Wernicke-Korsakoff syndrome.,"Caulo M, Van Hecke J, Toma L, Ferretti A, Tartaro A, Colosimo C, Romani GL, Uncini A",Brain : a journal of neurology,0.058,15817513,-1,-1
ventrolateral prefrontal_00270,https://pubmed.ncbi.nlm.nih.gov/16076549/,Intact hemispheric specialization for spatial and shape working memory in schizophrenia.,"Manoach DS, White N, Lindgren KA, Heckers S, Coleman MJ, Dubal S, Goff DC, Holzman PS",Schizophrenia research,0.058,16076549,-1,-1
ventrolateral prefrontal_00271,https://pubmed.ncbi.nlm.nih.gov/17151834/,Effects of treatment with the atypical neuroleptic quetiapine on working memory function: a functional MRI follow-up investigation.,"Meisenzahl EM, Scheuerecker J, Zipse M, Ufer S, Wiesmann M, Frodl T, Koutsouleris N, Zetzsche T, Schmitt G, Riedel M, Spellmann I, Dehning S, Linn J, Bruckmann H, Moller HJ",European archives of psychiatry and clinical neuroscience,0.058,17151834,10.1007/s00406-006-0687-x,-1
ventrolateral prefrontal_00272,https://pubmed.ncbi.nlm.nih.gov/19720072/,Autobiographical memory in semantic dementia: a longitudinal fMRI study.,"Maguire EA, Kumaran D, Hassabis D, Kopelman MD",Neuropsychologia,0.058,19720072,10.1016/j.neuropsychologia.2009.08.020,-1
ventrolateral prefrontal_00273,https://pubmed.ncbi.nlm.nih.gov/20399560/,A prefrontal non-opioid mechanism in placebo analgesia.,"Petrovic P, Kalso E, Petersson KM, Andersson J, Fransson P, Ingvar M",Pain,0.058,20399560,-1,-1
ventrolateral prefrontal_00274,https://pubmed.ncbi.nlm.nih.gov/23994453/,Age-related changes in prefrontal and hippocampal contributions to relational encoding.,"Addis DR, Giovanello KS, Vu MA, Schacter DL",NeuroImage,0.058,23994453,-1,-1
ventrolateral prefrontal_00275,https://pubmed.ncbi.nlm.nih.gov/26938433/,Increased Grey Matter Associated with Long-Term Sahaja Yoga Meditation: A Voxel-Based Morphometry Study.,"Hernandez SE, Suero J, Barros A, Gonzalez-Mora JL, Rubia K",PloS one,0.058,26938433,-1,-1
ventrolateral prefrontal_00276,https://pubmed.ncbi.nlm.nih.gov/12644355/,Neural circuitry underlying voluntary suppression of sadness.,"Levesque J, Eugene F, Joanette Y, Paquette V, Mensour B, Beaudoin G, Leroux JM, Bourgouin P, Beauregard M",Biological psychiatry,0.057,12644355,-1,-1
ventrolateral prefrontal_00277,https://pubmed.ncbi.nlm.nih.gov/21071387/,Multispectral brain morphometry in Tourette syndrome persisting into adulthood.,"Draganski B, Martino D, Cavanna AE, Hutton C, Orth M, Robertson MM, Critchley HD, Frackowiak RS",Brain : a journal of neurology,0.057,21071387,-1,-1
ventrolateral prefrontal_00278,https://pubmed.ncbi.nlm.nih.gov/21945346/,"Age-related changes in the three-way correlation between anterior hippocampus volume, whole-brain patterns of encoding activity and subsequent context retrieval.","Maillet D, Rajah MN",Brain research,0.057,21945346,-1,-1
ventrolateral prefrontal_00279,https://pubmed.ncbi.nlm.nih.gov/22952762/,Levels of integration in cognitive control and sequence processing in the prefrontal cortex.,"Bahlmann J, Korb FM, Gratton C, Friederici AD",PloS one,0.057,22952762,-1,-1
ventrolateral prefrontal_00280,https://pubmed.ncbi.nlm.nih.gov/28916500/,Early-Life stress modulates neural networks associated with habitual use of reappraisal.,"El Khawli E, Fan Y, Aust S, Wirth K, Bonke L, Stevense A, Herrera A, Metz S, Loayza A, Bajbouj M, Grimm S",Behavioural brain research,0.057,28916500,-1,-1
ventrolateral prefrontal_00281,https://pubmed.ncbi.nlm.nih.gov/17505817/,Impact of smoking abstinence on working memory neurocircuitry in adolescent daily tobacco smokers.,"Jacobsen LK, Mencl WE, Constable RT, Westerveld M, Pugh KR",Psychopharmacology,0.056,17505817,-1,-1
ventrolateral prefrontal_00282,https://pubmed.ncbi.nlm.nih.gov/24016726/,Task-related fronto-striatal functional connectivity during working memory performance in schizophrenia.,"Quide Y, Morris RW, Shepherd AM, Rowland JE, Green MJ",Schizophrenia research,0.056,24016726,-1,-1
ventrolateral prefrontal_00283,https://pubmed.ncbi.nlm.nih.gov/24123508/,Pattern classification of response inhibition in ADHD: Toward the development of  neurobiological markers for ADHD.,"Hart H, Chantiluke K, Cubillo AI, Smith AB, Simmons A, Brammer MJ, Marquand AF, Rubia K",Human brain mapping,0.056,24123508,-1,-1
ventrolateral prefrontal_00284,https://pubmed.ncbi.nlm.nih.gov/26419389/,Meta-analysis of real-time fMRI neurofeedback studies using individual participant data: How is brain regulation mediated?,"Emmert K, Kopel R, Sulzer J, Bruhl AB, Berman BD, Linden DEJ, Horovitz SG, Breimhorst M, Caria A, Frank S, Johnston S, Long Z, Paret C, Robineau F, Veit R, Bartsch A, Beckmann CF, Van De Ville D, Haller S",NeuroImage,0.056,26419389,-1,-1
ventrolateral prefrontal_00285,https://pubmed.ncbi.nlm.nih.gov/28611613/,Simultaneous Processing of Noun Cue and to-be-Produced Verb in Verb Generation Task: Electromagnetic Evidence.,"Butorina AV, Pavlova AA, Nikolaeva AY, Prokofyev AO, Bondarev DP, Stroganova TA",Frontiers in human neuroscience,0.056,28611613,-1,-1
ventrolateral prefrontal_00286,https://pubmed.ncbi.nlm.nih.gov/16553630/,Brain regions underlying response inhibition and interference monitoring and suppression.,"Blasi G, Goldberg TE, Weickert T, Das S, Kohn P, Zoltick B, Bertolino A, Callicott JH, Weinberger DR, Mattay VS",The European journal of neuroscience,0.055,16553630,-1,-1
ventrolateral prefrontal_00287,https://pubmed.ncbi.nlm.nih.gov/16644239/,The neural correlates of cross-modal interaction in speech perception during a semantic decision task on sentences: a PET study.,"Kang E, Lee DS, Kang H, Hwang CH, Oh SH, Kim CS, Chung JK, Lee MC",NeuroImage,0.055,16644239,-1,-1
ventrolateral prefrontal_00288,https://pubmed.ncbi.nlm.nih.gov/23009959/,Test-retest reliability of the BOLD pharmacological MRI response to ketamine in healthy volunteers.,"De Simoni S, Schwarz AJ, O'Daly OG, Marquand AF, Brittain C, Gonzales C, Stephenson S, Williams SC, Mehta MA",NeuroImage,0.055,23009959,-1,-1
ventrolateral prefrontal_00289,https://pubmed.ncbi.nlm.nih.gov/23040316/,Distinct structural alterations independently contributing to working memory deficits and symptomatology in paranoid schizophrenia.,"Zierhut KC, Schulte-Kemna A, Kaufmann J, Steiner J, Bogerts B, Schiltz K",Cortex; a journal devoted to the study of the nervous system and behavior,0.055,23040316,-1,-1
ventrolateral prefrontal_00290,https://pubmed.ncbi.nlm.nih.gov/15102894/,Experience-dependent neural integration of taste and smell in the human brain.,"Small DM, Voss J, Mak YE, Simmons KB, Parrish T, Gitelman D",Journal of neurophysiology,0.054,15102894,-1,-1
ventrolateral prefrontal_00291,https://pubmed.ncbi.nlm.nih.gov/18586109/,Neural basis of abnormal response to negative feedback in unmedicated mood disorders.,"Taylor Tavares JV, Clark L, Furey ML, Williams GB, Sahakian BJ, Drevets WC",NeuroImage,0.053,18586109,10.1016/j.neuroimage.2008.05.049,-1
ventrolateral prefrontal_00292,https://pubmed.ncbi.nlm.nih.gov/27442458/,"Preliminary investigation of the relationships between sleep duration, reward circuitry function, and mood dysregulation in youth offspring of parents with bipolar disorder.","Soehner AM, Bertocci MA, Manelis A, Bebko G, Ladouceur CD, Graur S, Monk K, Bonar LK, Hickey MB, Axelson D, Goldstein BI, Goldstein TR, Birmaher B, Phillips ML",Journal of affective disorders,0.053,27442458,10.1016/j.jad.2016.03.074,-1
ventrolateral prefrontal_00293,https://pubmed.ncbi.nlm.nih.gov/27852776/,Somatic and Reinforcement-Based Plasticity in the Initial Stages of Human Motor Learning.,"Sidarta A, Vahdat S, Bernardi NF, Ostry DJ",The Journal of neuroscience : the official journal of the Society for Neuroscience,0.053,27852776,-1,-1
ventrolateral prefrontal_00294,https://pubmed.ncbi.nlm.nih.gov/17175179/,Temporal dynamics of basal ganglia response and connectivity during verbal working memory.,"Chang C, Crottaz-Herbette S, Menon V",NeuroImage,0.052,17175179,-1,-1
ventrolateral prefrontal_00295,https://pubmed.ncbi.nlm.nih.gov/17320049/,An fMRI investigation of the role of the basal ganglia in reasoning.,"Melrose RJ, Poulin RM, Stern CE",Brain research,0.052,17320049,-1,-1
ventrolateral prefrontal_00296,https://pubmed.ncbi.nlm.nih.gov/20164350/,Distinct functional contributions of primary sensory and association areas to audiovisual integration in object categorization.,"Werner S, Noppeney U",The Journal of neuroscience : the official journal of the Society for Neuroscience,0.052,20164350,-1,-1
ventrolateral prefrontal_00297,https://pubmed.ncbi.nlm.nih.gov/15961050/,Retrieving rules for behavior from long-term memory.,"Donohue SE, Wendelken C, Crone EA, Bunge SA",NeuroImage,0.051,15961050,-1,-1
ventrolateral prefrontal_00298,https://pubmed.ncbi.nlm.nih.gov/17412567/,Neural correlates of trauma script-imagery in posttraumatic stress disorder with  and without comorbid major depression: a functional MRI investigation.,"Lanius RA, Frewen PA, Girotti M, Neufeld RW, Stevens TK, Densmore M",Psychiatry research,0.051,17412567,-1,-1
ventrolateral prefrontal_00299,https://pubmed.ncbi.nlm.nih.gov/20720103/,Separable prefrontal cortex contributions to free recall.,"Long NM, Oztekin I, Badre D",The Journal of neuroscience : the official journal of the Society for Neuroscience,0.051,20720103,-1,-1
ventrolateral prefrontal_00300,https://pubmed.ncbi.nlm.nih.gov/21349335/,Neural mechanisms of semantic interference and false recognition in short-term memory.,"Atkins AS, Reuter-Lorenz PA",NeuroImage,0.051,21349335,-1,-1
ventrolateral prefrontal_00301,https://pubmed.ncbi.nlm.nih.gov/25552571/,Emotional task management: neural correlates of switching between affective and non-affective task-sets.,"Reeck C, Egner T",Social cognitive and affective neuroscience,0.051,25552571,-1,-1
ventrolateral prefrontal_00302,https://pubmed.ncbi.nlm.nih.gov/25946334/,Temporal dynamics of stress-induced alternations of intrinsic amygdala connectivity and neuroendocrine levels.,"Quaedflieg CW, van de Ven V, Meyer T, Siep N, Merckelbach H, Smeets T",PloS one,0.051,25946334,-1,-1
ventrolateral prefrontal_00303,https://pubmed.ncbi.nlm.nih.gov/25307723/,Functional connectivity and neuronal variability of resting state activity in bipolar disorder-reduction and decoupling in anterior cortical midline structures.,"Magioncalda P, Martino M, Conio B, Escelsior A, Piaggio N, Presta A, Marozzi V, Rocchi G, Anastasio L, Vassallo L, Ferri F, Huang Z, Roccatagliata L, Pardini M, Northoff G, Amore M",Human brain mapping,0.05,25307723,-1,-1
ventrolateral prefrontal_00304,https://pubmed.ncbi.nlm.nih.gov/20877464/,Neural mechanisms of interference control in working memory: effects of interference expectancy and fluid intelligence.,"Burgess GC, Braver TS",PloS one,0.049,20877464,-1,-1
ventrolateral prefrontal_00305,https://pubmed.ncbi.nlm.nih.gov/22398976/,Neural bases of gaze and emotion processing in children with autism spectrum disorders.,"Davies MS, Dapretto M, Sigman M, Sepeta L, Bookheimer SY",Brain and behavior,0.049,22398976,-1,-1
ventrolateral prefrontal_00306,https://pubmed.ncbi.nlm.nih.gov/25149192/,Age differences in the neural correlates of novelty processing: The effects of item-relatedness.,"Bowman CR, Dennis NA",Brain research,0.049,25149192,-1,-1
ventrolateral prefrontal_00307,https://pubmed.ncbi.nlm.nih.gov/23063451/,Inter-individual differences in successful perspective taking during pain perception mediates emotional responsiveness in self and others: an fMRI study.,"van der Heiden L, Scherpiet S, Konicar L, Birbaumer N, Veit R",NeuroImage,0.048,23063451,-1,-1
ventrolateral prefrontal_00308,https://pubmed.ncbi.nlm.nih.gov/17346989/,Mental rotation and object categorization share a common network of prefrontal and dorsal and ventral regions of posterior cortex.,"Schendan HE, Stern CE",NeuroImage,0.047,17346989,10.1016/j.neuroimage.2007.01.012,-1
ventrolateral prefrontal_00309,https://pubmed.ncbi.nlm.nih.gov/27709512/,Neural correlates of immediate and prolonged effects of cognitive reappraisal and distraction on emotional experience.,"Hermann A, Kress L, Stark R",Brain imaging and behavior,0.047,27709512,10.1007/s11682-016-9603-9,-1
ventrolateral prefrontal_00310,https://pubmed.ncbi.nlm.nih.gov/28755632/,Heightened activity in social reward networks is associated with adolescents' risky sexual behaviors.,"Eckstrand KL, Choukas-Bradley S, Mohanty A, Cross M, Allen NB, Silk JS, Jones NP, Forbes EE",Developmental cognitive neuroscience,0.047,28755632,10.1016/j.dcn.2017.07.004,-1
ventrolateral prefrontal_00311,https://pubmed.ncbi.nlm.nih.gov/20553895/,Neural mechanisms for voice recognition.,"Andics A, McQueen JM, Petersson KM, Gal V, Rudas G, Vidnyanszky Z",NeuroImage,0.043,20553895,-1,-1
ventrolateral prefrontal_00312,https://pubmed.ncbi.nlm.nih.gov/28093475/,Hippocampal Contribution to Context Encoding across Development Is Disrupted following Early-Life Adversity.,"Lambert HK, Sheridan MA, Sambrook KA, Rosen ML, Askren MK, McLaughlin KA",The Journal of neuroscience : the official journal of the Society for Neuroscience,0.043,28093475,-1,-1
ventrolateral prefrontal_00313,https://pubmed.ncbi.nlm.nih.gov/17071240/,Intracerebral ERD/ERS in voluntary movement and in cognitive visuomotor task.,"Rektor I, Sochurkova D, Bockova M",Progress in brain research,0.039,17071240,-1,-1
ventrolateral prefrontal_00314,https://pubmed.ncbi.nlm.nih.gov/21396384/,Imagery and retrieval of auditory and visual information: neural correlates of successful and unsuccessful performance.,"Huijbers W, Pennartz CM, Rubin DC, Daselaar SM",Neuropsychologia,0.039,21396384,-1,-1
