paper_name,paper_url,Title,Author,Journal,Loading,PMID,Doi,download_status
words_00200,https://pubmed.ncbi.nlm.nih.gov/11709486/,Task-dependency of the neural correlates of episodic encoding as measured by fMRI.,"Otten LJ, Rugg MD","Cerebral cortex (New York, N.Y. : 1991)",0.218,11709486,-1,-1
words_00201,https://pubmed.ncbi.nlm.nih.gov/15850740/,Hippocampal activations during encoding and retrieval in a verbal working memory  paradigm.,"Karlsgodt KH, Shirinyan D, van Erp TG, Cohen MS, Cannon TD",NeuroImage,0.218,15850740,-1,-1
words_00202,https://pubmed.ncbi.nlm.nih.gov/20336280/,Linear increases in BOLD response associated with increasing proportion of incongruent trials across time in a colour Stroop task.,Mitchell RL,Experimental brain research,0.218,20336280,-1,-1
words_00203,https://pubmed.ncbi.nlm.nih.gov/22659393/,Amygdala responsiveness to emotional words is modulated by subclinical anxiety and depression.,"Laeger I, Dobel C, Dannlowski U, Kugel H, Grotegerd D, Kissler J, Keuper K, Eden A, Zwitserlood P, Zwanzger P",Behavioural brain research,0.218,22659393,-1,-1
words_00204,https://pubmed.ncbi.nlm.nih.gov/19800410/,Where syntax meets math: right intraparietal sulcus activation in response to grammatical number agreement violations.,"Carreiras M, Carr L, Barber HA, Hernandez A",NeuroImage,0.217,19800410,-1,-1
words_00205,https://pubmed.ncbi.nlm.nih.gov/22210673/,Emotion disrupts neural activity during selective attention in psychopathy.,"Sadeh N, Spielberg JM, Heller W, Herrington JD, Engels AS, Warren SL, Crocker LD, Sutton BP, Miller GA",Social cognitive and affective neuroscience,0.216,22210673,-1,-1
words_00206,https://pubmed.ncbi.nlm.nih.gov/26575986/,Beyond the amygdala: Linguistic threat modulates peri-sylvian semantic access cortices.,"Weisholtz DS, Root JC, Butler T, Tuscher O, Epstein J, Pan H, Protopopescu X, Goldstein M, Isenberg N, Brendel G, LeDoux J, Silbersweig DA, Stern E",Brain and language,0.216,26575986,-1,-1
words_00207,https://pubmed.ncbi.nlm.nih.gov/27919546/,Brain morphometry predicts individual creative potential and the ability to combine remote ideas.,"Bendetowicz D, Urbanski M, Aichelburg C, Levy R, Volle E",Cortex; a journal devoted to the study of the nervous system and behavior,0.216,27919546,-1,-1
words_00208,https://pubmed.ncbi.nlm.nih.gov/19782094/,Body schematics: on the role of the body schema in embodied lexical-semantic representations.,"Rueschemeyer SA, Pfeiffer C, Bekkering H",Neuropsychologia,0.215,19782094,-1,-1
words_00209,https://pubmed.ncbi.nlm.nih.gov/23110678/,Retrieval orientation and the control of recollection: an fMRI study.,"Morcom AM, Rugg MD",Journal of cognitive neuroscience,0.214,23110678,-1,-1
words_00210,https://pubmed.ncbi.nlm.nih.gov/12417678/,Neural correlates of successful encoding identified using functional magnetic resonance imaging.,"Reber PJ, Siwiec RM, Gitelman DR, Parrish TB, Mesulam MM, Paller KA",The Journal of neuroscience : the official journal of the Society for Neuroscience,0.213,12417678,-1,-1
words_00211,https://pubmed.ncbi.nlm.nih.gov/16460968/,Bilingual brain organization: a functional magnetic resonance adaptation study.,"Klein D, Zatorre RJ, Chen JK, Milner B, Crane J, Belin P, Bouffard M",NeuroImage,0.213,16460968,10.1016/j.neuroimage.2005.12.012,-1
words_00212,https://pubmed.ncbi.nlm.nih.gov/22672735/,Attention and semantic processing during speech: an fMRI study.,"Rama P, Relander-Syrjanen K, Carlson S, Salonen O, Kujala T",Brain and language,0.213,22672735,10.1016/j.bandl.2012.04.018,-1
words_00213,https://pubmed.ncbi.nlm.nih.gov/22674273/,Gray matter density of auditory association cortex relates to knowledge of sound  concepts in primary progressive aphasia.,"Bonner MF, Grossman M",The Journal of neuroscience : the official journal of the Society for Neuroscience,0.212,22674273,10.1523/JNEUROSCI.6241-11.2012,-1
words_00214,https://pubmed.ncbi.nlm.nih.gov/29371094/,Orthographic influence on spoken word identification: Behavioral and fMRI evidence.,"Chiarello C, Vaden KI Jr, Eckert MA",Neuropsychologia,0.212,29371094,-1,-1
words_00215,https://pubmed.ncbi.nlm.nih.gov/16628608/,Effect of word and syllable frequency on activation during lexical decision and reading aloud.,"Carreiras M, Mechelli A, Price CJ",Human brain mapping,0.211,16628608,-1,-1
words_00216,https://pubmed.ncbi.nlm.nih.gov/15884023/,Neural correlates of the misattribution of self-generated speech.,"Allen PP, Amaro E, Fu CH, Williams SC, Brammer M, Johns LC, McGuire PK",Human brain mapping,0.21,15884023,-1,-1
words_00217,https://pubmed.ncbi.nlm.nih.gov/20201631/,Dissociating linguistic and task-related activity in the left inferior frontal gyrus.,"Wright P, Randall B, Marslen-Wilson WD, Tyler LK",Journal of cognitive neuroscience,0.21,20201631,-1,-1
words_00218,https://pubmed.ncbi.nlm.nih.gov/24316238/,Cross-linguistic sound symbolism and crossmodal correspondence: Evidence from fMRI and DTI.,"Revill KP, Namy LL, DeFife LC, Nygaard LC",Brain and language,0.21,24316238,-1,-1
words_00219,https://pubmed.ncbi.nlm.nih.gov/14972366/,Temporal lobe abnormalities in semantic processing by criminal psychopaths as revealed by functional magnetic resonance imaging.,"Kiehl KA, Smith AM, Mendrek A, Forster BB, Hare RD, Liddle PF",Psychiatry research,0.209,14972366,-1,-1
words_00220,https://pubmed.ncbi.nlm.nih.gov/21391767/,Differential contributions of bilateral ventral anterior temporal lobe and left anterior superior temporal gyrus to semantic processes.,"Visser M, Lambon Ralph MA",Journal of cognitive neuroscience,0.209,21391767,-1,-1
words_00221,https://pubmed.ncbi.nlm.nih.gov/27721080/,The effect of aging on the brain network for exception word reading.,"Provost JS, Brambati SM, Chapleau M, Wilson MA",Cortex; a journal devoted to the study of the nervous system and behavior,0.208,27721080,-1,-1
words_00222,https://pubmed.ncbi.nlm.nih.gov/16842827/,An event-related fMRI investigation of phonological-lexical competition.,"Prabhakaran R, Blumstein SE, Myers EB, Hutchison E, Britton B",Neuropsychologia,0.207,16842827,-1,-1
words_00223,https://pubmed.ncbi.nlm.nih.gov/24262200/,Hidden word learning capacity through orthography in aphasia.,"Tuomiranta LM, Camara E, Froudist Walsh S, Ripolles P, Saunavaara JP, Parkkola R, Martin N, Rodriguez-Fornells A, Laine M",Cortex; a journal devoted to the study of the nervous system and behavior,0.207,24262200,-1,-1
words_00224,https://pubmed.ncbi.nlm.nih.gov/16263248/,Compensatory recruitment after sleep deprivation and the relationship with performance.,"Drummond SP, Meloy MJ, Yanagi MA, Orff HJ, Brown GG",Psychiatry research,0.206,16263248,-1,-1
words_00225,https://pubmed.ncbi.nlm.nih.gov/17321757/,Context-dependent interpretation of words: evidence for interactive neural processes.,"Gennari SP, MacDonald MC, Postle BR, Seidenberg MS",NeuroImage,0.206,17321757,-1,-1
words_00226,https://pubmed.ncbi.nlm.nih.gov/11073867/,Task-specific repetition priming in left inferior prefrontal cortex.,"Wagner AD, Koutstaal W, Maril A, Schacter DL, Buckner RL","Cerebral cortex (New York, N.Y. : 1991)",0.205,11073867,-1,-1
words_00227,https://pubmed.ncbi.nlm.nih.gov/17652467/,The relationship between study processing and the effects of cue congruency at retrieval: fMRI support for transfer appropriate processing.,"Park H, Rugg MD","Cerebral cortex (New York, N.Y. : 1991)",0.205,17652467,-1,-1
words_00228,https://pubmed.ncbi.nlm.nih.gov/22521476/,Neural processing of overt word generation in healthy individuals: the effect of  age and word knowledge.,"Nagels A, Kircher T, Dietsche B, Backes H, Marquetand J, Krug A",NeuroImage,0.205,22521476,-1,-1
words_00229,https://pubmed.ncbi.nlm.nih.gov/22227457/,Cortical correlates of self-generation in verbal paired associate learning.,"Vannest J, Eaton KP, Henkel D, Siegel M, Tsevat RK, Allendorfer JB, Schefft BK, Banks C, Szaflarski JP",Brain research,0.204,22227457,-1,-1
words_00230,https://pubmed.ncbi.nlm.nih.gov/26419390/,Left ventral occipitotemporal activation during orthographic and semantic processing of auditory words.,"Ludersdorfer P, Wimmer H, Richlan F, Schurz M, Hutzler F, Kronbichler M",NeuroImage,0.203,26419390,-1,-1
words_00231,https://pubmed.ncbi.nlm.nih.gov/16930636/,Neural correlates of differential retrieval orientation: Sustained and item-related components.,"Woodruff CC, Uncapher MR, Rugg MD",Neuropsychologia,0.202,16930636,10.1016/j.neuropsychologia.2006.06.019,-1
words_00232,https://pubmed.ncbi.nlm.nih.gov/18702576/,"Developmental increase in top-down and bottom-up processing in a phonological task: an effective connectivity, fMRI study.","Bitan T, Cheon J, Lu D, Burman DD, Booth JR",Journal of cognitive neuroscience,0.202,18702576,10.1162/jocn.2009.21065,-1
words_00233,https://pubmed.ncbi.nlm.nih.gov/27592331/,"Dough, tough, cough, rough: A ""fast"" fMRI localizer of component processes in reading.","Malins JG, Gumkowski N, Buis B, Molfese P, Rueckl JG, Frost SJ, Pugh KR, Morris R, Mencl WE",Neuropsychologia,0.201,27592331,-1,-1
words_00234,https://pubmed.ncbi.nlm.nih.gov/15275916/,Distributed self in episodic memory: neural correlates of successful retrieval of self-encoded positive and negative personality traits.,"Fossati P, Hevenor SJ, Lepage M, Graham SJ, Grady C, Keightley ML, Craik F, Mayberg H",NeuroImage,0.2,15275916,-1,-1
words_00235,https://pubmed.ncbi.nlm.nih.gov/25109567/,Effect of orthography over neural regions in bilinguals: a view from neuroimaging.,Kumar U,Neuroscience letters,0.198,25109567,-1,-1
words_00236,https://pubmed.ncbi.nlm.nih.gov/27923474/,Recapitulation of emotional source context during memory retrieval.,"Bowen HJ, Kensinger EA",Cortex; a journal devoted to the study of the nervous system and behavior,0.198,27923474,-1,-1
words_00237,https://pubmed.ncbi.nlm.nih.gov/25844310/,Age related-changes in the neural basis of self-generation in verbal paired associate learning.,"Vannest J, Maloney T, Kay B, Siegel M, Allendorfer JB, Banks C, Altaye M, Szaflarski JP",NeuroImage. Clinical,0.196,25844310,-1,-1
words_00238,https://pubmed.ncbi.nlm.nih.gov/11287664/,Can medial temporal lobe regions distinguish true from false? An event-related functional MRI study of veridical and illusory recognition memory.,"Cabeza R, Rao SM, Wagner AD, Mayer AR, Schacter DL",Proceedings of the National Academy of Sciences of the United States of America,0.195,11287664,-1,-1
words_00239,https://pubmed.ncbi.nlm.nih.gov/17617658/,The effect of prior visual information on recognition of speech and sounds.,"Noppeney U, Josephs O, Hocking J, Price CJ, Friston KJ","Cerebral cortex (New York, N.Y. : 1991)",0.195,17617658,-1,-1
words_00240,https://pubmed.ncbi.nlm.nih.gov/17884585/,Developmental changes in activation and effective connectivity in phonological processing.,"Bitan T, Cheon J, Lu D, Burman DD, Gitelman DR, Mesulam MM, Booth JR",NeuroImage,0.195,17884585,-1,-1
words_00241,https://pubmed.ncbi.nlm.nih.gov/25303272/,Differing contributions of inferior prefrontal and anterior temporal cortex to concrete and abstract conceptual knowledge.,"Hoffman P, Binney RJ, Lambon Ralph MA",Cortex; a journal devoted to the study of the nervous system and behavior,0.195,25303272,-1,-1
words_00242,https://pubmed.ncbi.nlm.nih.gov/16242924/,Action selectivity in parietal and temporal cortex.,"Noppeney U, Josephs O, Kiebel S, Friston KJ, Price CJ",Brain research. Cognitive brain research,0.194,16242924,-1,-1
words_00243,https://pubmed.ncbi.nlm.nih.gov/16757006/,Effects of aging on recognition of intentionally and incidentally stored words: an fMRI study.,"van der Veen FM, Nijhuis FA, Tisserand DJ, Backes WH, Jolles J",Neuropsychologia,0.194,16757006,-1,-1
words_00244,https://pubmed.ncbi.nlm.nih.gov/18180168/,Sensitivity to orthographic familiarity in the occipito-temporal region.,"Bruno JL, Zumberge A, Manis FR, Lu ZL, Goldman JG",NeuroImage,0.194,18180168,-1,-1
words_00245,https://pubmed.ncbi.nlm.nih.gov/16154453/,Anterior prefrontal cortex and the recollection of contextual information.,"Simons JS, Owen AM, Fletcher PC, Burgess PW",Neuropsychologia,0.193,16154453,-1,-1
words_00246,https://pubmed.ncbi.nlm.nih.gov/14683699/,Isolating the retrieval of imagined pictures during episodic memory: activation of the left precuneus and left prefrontal cortex.,"Lundstrom BN, Petersson KM, Andersson J, Johansson M, Fransson P, Ingvar M",NeuroImage,0.192,14683699,-1,-1
words_00247,https://pubmed.ncbi.nlm.nih.gov/16219423/,An fMRI study of Chinese character reading and picture naming by native Korean speakers.,"Yoon HW, Chung JY, Kim KH, Song MS, Park HW",Neuroscience letters,0.192,16219423,-1,-1
words_00248,https://pubmed.ncbi.nlm.nih.gov/18510447/,Structural and metabolic correlates of episodic memory in relation to the depth of encoding in normal aging.,"Kalpouzos G, Chetelat G, Landeau B, Clochon P, Viader F, Eustache F, Desgranges B",Journal of cognitive neuroscience,0.192,18510447,-1,-1
words_00249,https://pubmed.ncbi.nlm.nih.gov/21664275/,On the context-dependent nature of the contribution of the ventral premotor cortex to speech perception.,"Tremblay P, Small SL",NeuroImage,0.192,21664275,-1,-1
words_00250,https://pubmed.ncbi.nlm.nih.gov/16275017/,Developmental changes in the neural correlates of semantic processing.,"Chou TL, Booth JR, Burman DD, Bitan T, Bigio JD, Lu D, Cone NE",NeuroImage,0.191,16275017,-1,-1
words_00251,https://pubmed.ncbi.nlm.nih.gov/19560544/,Neural substrates of semantic relationships: common and distinct left-frontal activities for generation of synonyms vs. antonyms.,"Jeon HA, Lee KM, Kim YB, Cho ZH",NeuroImage,0.191,19560544,10.1016/j.neuroimage.2009.06.049,-1
words_00252,https://pubmed.ncbi.nlm.nih.gov/23728081/,Dissociating frontal regions that co-lateralize with different ventral occipitotemporal regions during word processing.,"Seghier ML, Price CJ",Brain and language,0.191,23728081,10.1016/j.bandl.2013.04.003,-1
words_00253,https://pubmed.ncbi.nlm.nih.gov/26621710/,Universal brain signature of proficient reading: Evidence from four contrasting languages.,"Rueckl JG, Paz-Alonso PM, Molfese PJ, Kuo WJ, Bick A, Frost SJ, Hancock R, Wu DH, Mencl WE, Dunabeitia JA, Lee JR, Oliver M, Zevin JD, Hoeft F, Carreiras M, Tzeng OJ, Pugh KR, Frost R",Proceedings of the National Academy of Sciences of the United States of America,0.191,26621710,-1,-1
words_00254,https://pubmed.ncbi.nlm.nih.gov/25262587/,Incidental self-processing modulates the interaction of emotional valence and arousal.,"Wang Q, Zheng L, Li L, Xu X, Cheng X, Ning R, Dienes Z, Guo X",Experimental brain research,0.19,25262587,-1,-1
words_00255,https://pubmed.ncbi.nlm.nih.gov/18702579/,Neural correlates of semantic competition during processing of ambiguous words.,"Bilenko NY, Grindrod CM, Myers EB, Blumstein SE",Journal of cognitive neuroscience,0.189,18702579,-1,-1
words_00256,https://pubmed.ncbi.nlm.nih.gov/23933470/,Distinguishable neurofunctional effects of task practice and item practice in picture naming: a BOLD fMRI study in healthy subjects.,"Basso G, Magon S, Reggiani F, Capasso R, Monittola G, Yang FJ, Miceli G",Brain and language,0.189,23933470,-1,-1
words_00257,https://pubmed.ncbi.nlm.nih.gov/24135134/,Cross-linguistic parallels in processing derivational morphology: evidence from Polish.,"Bozic M, Szlachta Z, Marslen-Wilson WD",Brain and language,0.189,24135134,-1,-1
words_00258,https://pubmed.ncbi.nlm.nih.gov/17368914/,Dissociable correlates of two classes of retrieval processing in prefrontal cortex.,"Ranganath C, Heller AS, Wilding EL",NeuroImage,0.188,17368914,-1,-1
words_00259,https://pubmed.ncbi.nlm.nih.gov/15964209/,Content-specific activation during associative long-term memory retrieval.,"Khader P, Burke M, Bien S, Ranganath C, Rosler F",NeuroImage,0.187,15964209,-1,-1
words_00260,https://pubmed.ncbi.nlm.nih.gov/17089376/,Assessing the influence of scanner background noise on auditory processing. II. An fMRI study comparing auditory processing in the absence and presence of recorded scanner noise using a sparse design.,"Gaab N, Gabrieli JD, Glover GH",Human brain mapping,0.187,17089376,-1,-1
words_00261,https://pubmed.ncbi.nlm.nih.gov/18234690/,Brain activation for consonants and vowels.,"Carreiras M, Price CJ","Cerebral cortex (New York, N.Y. : 1991)",0.186,18234690,-1,-1
words_00262,https://pubmed.ncbi.nlm.nih.gov/19396362/,Activation of the left inferior frontal gyrus in the first 200 ms of reading: evidence from magnetoencephalography (MEG).,"Cornelissen PL, Kringelbach ML, Ellis AW, Whitney C, Holliday IE, Hansen PC",PloS one,0.185,19396362,-1,-1
words_00263,https://pubmed.ncbi.nlm.nih.gov/27575853/,The neural bases of the learning and generalization of morphological inflection.,"Nevat M, Ullman MT, Eviatar Z, Bitan T",Neuropsychologia,0.184,27575853,-1,-1
words_00264,https://pubmed.ncbi.nlm.nih.gov/28341165/,The left intraparietal sulcus adapts to symbolic number in both the visual and auditory modalities: Evidence from fMRI.,"Vogel SE, Goffin C, Bohnenberger J, Koschutnig K, Reishofer G, Grabner RH, Ansari D",NeuroImage,0.184,28341165,-1,-1
words_00265,https://pubmed.ncbi.nlm.nih.gov/19962859/,Neural correlates of inhibitory deficits in depression.,"Eugene F, Joormann J, Cooney RE, Atlas LY, Gotlib IH",Psychiatry research,0.183,19962859,-1,-1
words_00266,https://pubmed.ncbi.nlm.nih.gov/25446003/,How do conceptual representations interact with processing demands: An fMRI study on action- and abstract-related words.,"Tomasino B, Fabbro F, Brambilla P",Brain research,0.183,25446003,-1,-1
words_00267,https://pubmed.ncbi.nlm.nih.gov/23117157/,Probabilistic orthographic cues to grammatical category in the brain.,"Arciuli J, McMahon K, Zubicaray Gd",Brain and language,0.182,23117157,-1,-1
words_00268,https://pubmed.ncbi.nlm.nih.gov/10847601/,Human temporal lobe activation by speech and nonspeech sounds.,"Binder JR, Frost JA, Hammeke TA, Bellgowan PS, Springer JA, Kaufman JN, Possing ET","Cerebral cortex (New York, N.Y. : 1991)",0.181,10847601,-1,-1
words_00269,https://pubmed.ncbi.nlm.nih.gov/16310346/,The role of the left Brodmann's areas 44 and 45 in reading words and pseudowords.,"Heim S, Alter K, Ischebeck AK, Amunts K, Eickhoff SB, Mohlberg H, Zilles K, von Cramon DY, Friederici AD",Brain research. Cognitive brain research,0.181,16310346,-1,-1
words_00270,https://pubmed.ncbi.nlm.nih.gov/19770045/,Why do children make mirror errors in reading? Neural correlates of mirror invariance in the visual word form area.,"Dehaene S, Nakamura K, Jobert A, Kuroki C, Ogawa S, Cohen L",NeuroImage,0.181,19770045,-1,-1
words_00271,https://pubmed.ncbi.nlm.nih.gov/28077514/,"Representational Similarity Mapping of Distributional Semantics in Left Inferior  Frontal, Middle Temporal, and Motor Cortex.","Carota F, Kriegeskorte N, Nili H, Pulvermuller F","Cerebral cortex (New York, N.Y. : 1991)",0.181,28077514,10.1093/cercor/bhw379,-1
words_00272,https://pubmed.ncbi.nlm.nih.gov/20619347/,How specifically are action verbs represented in the neural motor system: an fMRI study.,"van Dam WO, Rueschemeyer SA, Bekkering H",NeuroImage,0.18,20619347,10.1016/j.neuroimage.2010.06.071,-1
words_00273,https://pubmed.ncbi.nlm.nih.gov/19301996/,On the processing of semantic aspects of experience in the anterior medial temporal lobe: an event-related fMRI study.,"Meyer P, Mecklinger A, Friederici AD",Journal of cognitive neuroscience,0.179,19301996,10.1162/jocn.2009.21199,-1
words_00274,https://pubmed.ncbi.nlm.nih.gov/23281129/,How 'love' and 'hate' differ from 'sleep': using combined electro/magnetoencephalographic data to reveal the sources of early cortical responses to emotional words.,"Keuper K, Zwanzger P, Nordt M, Eden A, Laeger I, Zwitserlood P, Kissler J, Junghofer M, Dobel C",Human brain mapping,0.177,23281129,-1,-1
words_00275,https://pubmed.ncbi.nlm.nih.gov/18823229/,Modality- and task-specific brain regions involved in Chinese lexical processing.,"Liu L, Deng X, Peng D, Cao F, Ding G, Jin Z, Zeng Y, Li K, Zhu L, Fan N, Deng Y, Bolger DJ, Booth JR",Journal of cognitive neuroscience,0.176,18823229,-1,-1
words_00276,https://pubmed.ncbi.nlm.nih.gov/20626458/,Neural correlates of the orthographic neighborhood size effect in Chinese.,"Li QL, Bi HY, Zhang JX",The European journal of neuroscience,0.176,20626458,-1,-1
words_00277,https://pubmed.ncbi.nlm.nih.gov/18262207/,Sex differences in neural processing of language among children.,"Burman DD, Bitan T, Booth JR",Neuropsychologia,0.175,18262207,-1,-1
words_00278,https://pubmed.ncbi.nlm.nih.gov/21167644/,Abnormal cortical activity in patients with temporomandibular disorder evoked by  cognitive and emotional tasks.,"Weissman-Fogel I, Moayedi M, Tenenbaum HC, Goldberg MB, Freeman BV, Davis KD",Pain,0.175,21167644,-1,-1
words_00279,https://pubmed.ncbi.nlm.nih.gov/23312790/,The neural correlates of statistical learning in a word segmentation task: An fMRI study.,"Karuza EA, Newport EL, Aslin RN, Starling SJ, Tivarus ME, Bavelier D",Brain and language,0.175,23312790,-1,-1
words_00280,https://pubmed.ncbi.nlm.nih.gov/22347490/,Investigating unique environmental contributions to the neural representation of  written words: a monozygotic twin study.,"Park J, Park DC, Polk TA",PloS one,0.174,22347490,-1,-1
words_00281,https://pubmed.ncbi.nlm.nih.gov/27838547/,Neural substrates of sublexical processing for spelling.,"DeMarco AT, Wilson SM, Rising K, Rapcsak SZ, Beeson PM",Brain and language,0.174,27838547,-1,-1
words_00282,https://pubmed.ncbi.nlm.nih.gov/17059812/,Learning-related changes of brain activation in the visual ventral stream: an fMRI study of mirror reading skill.,"Mochizuki-Kawai H, Tsukiura T, Mochizuki S, Kawamura M",Brain research,0.173,17059812,-1,-1
words_00283,https://pubmed.ncbi.nlm.nih.gov/19478033/,The impact of second language learning on semantic and nonsemantic first language reading.,"Nosarti C, Mechelli A, Green DW, Price CJ","Cerebral cortex (New York, N.Y. : 1991)",0.173,19478033,-1,-1
words_00284,https://pubmed.ncbi.nlm.nih.gov/20004724/,The amodal system for conscious word and picture identification in the absence of a semantic task.,"Van Doren L, Dupont P, De Grauwe S, Peeters R, Vandenberghe R",NeuroImage,0.173,20004724,-1,-1
words_00285,https://pubmed.ncbi.nlm.nih.gov/22717280/,The neuronal infrastructure of speaking.,"Menenti L, Segaert K, Hagoort P",Brain and language,0.173,22717280,-1,-1
words_00286,https://pubmed.ncbi.nlm.nih.gov/24144956/,Reading impairment in schizophrenia: dysconnectivity within the visual system.,"Vinckier F, Cohen L, Oppenheim C, Salvador A, Picard H, Amado I, Krebs MO, Gaillard R",Neuropsychologia,0.173,24144956,-1,-1
words_00287,https://pubmed.ncbi.nlm.nih.gov/25040779/,When first language is not first: an functional magnetic resonance imaging investigation of the neural basis of diglossia in Arabic.,"Nevat M, Khateb A, Prior A",The European journal of neuroscience,0.173,25040779,-1,-1
words_00288,https://pubmed.ncbi.nlm.nih.gov/28712089/,Increased recruitment of cognitive control in the presence of traumatic stimuli in complex PTSD.,"Herzog JI, Niedtfeld I, Rausch S, Thome J, Mueller-Engelmann M, Steil R, Priebe K, Bohus M, Schmahl C",European archives of psychiatry and clinical neuroscience,0.173,28712089,-1,-1
words_00289,https://pubmed.ncbi.nlm.nih.gov/15054068/,Separable effects of semantic priming and imageability on word processing in human cortex.,"Giesbrecht B, Camblin CC, Swaab TY","Cerebral cortex (New York, N.Y. : 1991)",0.172,15054068,-1,-1
words_00290,https://pubmed.ncbi.nlm.nih.gov/24315838/,Dissociable roles of default-mode regions during episodic encoding.,"Maillet D, Rajah MN",NeuroImage,0.172,24315838,-1,-1
words_00291,https://pubmed.ncbi.nlm.nih.gov/24683066/,Value-based modulation of memory encoding involves strategic engagement of fronto-temporal semantic processing regions.,"Cohen MS, Rissman J, Suthana NA, Castel AD, Knowlton BJ","Cognitive, affective & behavioral neuroscience",0.172,24683066,10.3758/s13415-014-0275-x,-1
words_00292,https://pubmed.ncbi.nlm.nih.gov/17979123/,Cortical network dynamics during source memory retrieval: current density imaging with individual MRI.,"Kim YY, Roh AY, Namgoong Y, Jo HJ, Lee JM, Kwon JS",Human brain mapping,0.171,17979123,10.1002/hbm.20487,-1
words_00293,https://pubmed.ncbi.nlm.nih.gov/16343948/,"Controlling for individual differences in fMRI brain activation to tones, syllables, and words.","Rimol LM, Specht K, Hugdahl K",NeuroImage,0.17,16343948,-1,-1
words_00294,https://pubmed.ncbi.nlm.nih.gov/17390317/,Positive and negative modulation of word learning by reward anticipation.,"Callan DE, Schweighofer N",Human brain mapping,0.17,17390317,-1,-1
words_00295,https://pubmed.ncbi.nlm.nih.gov/18790618/,Episodic memory in schizophrenia: the influence of strategy use on behavior and brain activation.,"Bonner-Jackson A, Yodkovik N, Csernansky JG, Barch DM",Psychiatry research,0.17,18790618,-1,-1
words_00296,https://pubmed.ncbi.nlm.nih.gov/22971086/,On-line changing of thinking about words: the effect of cognitive context on neural responses to verb reading.,"Papeo L, Rumiati RI, Cecchetto C, Tomasino B",Journal of cognitive neuroscience,0.17,22971086,-1,-1
words_00297,https://pubmed.ncbi.nlm.nih.gov/26254542/,Dissociation in borderline personality disorder: Disturbed cognitive and emotional inhibition and its neural correlates.,"Winter D, Krause-Utz A, Lis S, Chiu CD, Lanius RA, Schriner F, Bohus M, Schmahl C",Psychiatry research,0.17,26254542,-1,-1
words_00298,https://pubmed.ncbi.nlm.nih.gov/27315268/,Word Imageability Enhances Association-memory by Increasing Hippocampal Engagement.,"Caplan JB, Madan CR",Journal of cognitive neuroscience,0.17,27315268,-1,-1
