paper_name,paper_url,Title,Author,Journal,Loading,PMID,Doi,download_status
words_00690,https://pubmed.ncbi.nlm.nih.gov/23238964/,Frontal and temporal contributions to understanding the iconic co-speech gestures that accompany speech.,"Dick AS, Mok EH, Raja Beharelle A, Goldin-Meadow S, Small SL",Human brain mapping,0.064,23238964,-1,-1
words_00691,https://pubmed.ncbi.nlm.nih.gov/23963602/,Supramodal and modality-sensitive representations of perceived action categories  in the human brain.,"Ramsey R, Cross ES, Hamilton AF",Experimental brain research,0.064,23963602,10.1007/s00221-013-3659-1,-1
words_00692,https://pubmed.ncbi.nlm.nih.gov/25056572/,The Dopaminergic Midbrain Encodes the Expected Certainty about Desired Outcomes.,"Schwartenbeck P, FitzGerald TH, Mathys C, Dolan R, Friston K","Cerebral cortex (New York, N.Y. : 1991)",0.064,25056572,10.1093/cercor/bhu159,-1
words_00693,https://pubmed.ncbi.nlm.nih.gov/26175008/,"The effects of age, sex, and hormones on emotional conflict-related brain response during adolescence.","Cservenka A, Stroup ML, Etkin A, Nagel BJ",Brain and cognition,0.064,26175008,-1,-1
words_00694,https://pubmed.ncbi.nlm.nih.gov/26834609/,Neural Correlates of Morphological Processing: Evidence from Chinese.,"Zou L, Packard JL, Xia Z, Liu Y, Shu H",Frontiers in human neuroscience,0.064,26834609,-1,-1
words_00695,https://pubmed.ncbi.nlm.nih.gov/15635062/,The neural mechanisms of speech comprehension: fMRI studies of semantic ambiguity.,"Rodd JM, Davis MH, Johnsrude IS","Cerebral cortex (New York, N.Y. : 1991)",0.063,15635062,-1,-1
words_00696,https://pubmed.ncbi.nlm.nih.gov/15944370/,Two distinct neural mechanisms for category-selective responses.,"Noppeney U, Price CJ, Penny WD, Friston KJ","Cerebral cortex (New York, N.Y. : 1991)",0.063,15944370,-1,-1
words_00697,https://pubmed.ncbi.nlm.nih.gov/16861335/,Visual cortex activation in bilingual blind individuals during use of native and  second language.,"Ofan RH, Zohary E","Cerebral cortex (New York, N.Y. : 1991)",0.063,16861335,-1,-1
words_00698,https://pubmed.ncbi.nlm.nih.gov/18023505/,Structure-function interactions of correct retrieval in healthy elderly women.,"Brassen S, Buchel C, Weber-Fahr W, Lehmbeck JT, Sommer T, Braus DF",Neurobiology of aging,0.063,18023505,-1,-1
words_00699,https://pubmed.ncbi.nlm.nih.gov/18249420/,Cortical circuits for silent speechreading in deaf and hearing people.,"Capek CM, Macsweeney M, Woll B, Waters D, McGuire PK, David AS, Brammer MJ, Campbell R",Neuropsychologia,0.063,18249420,-1,-1
words_00700,https://pubmed.ncbi.nlm.nih.gov/21958650/,Encoding: the keystone to efficient functioning of verbal short-term memory.,"Barry JG, Sabisch B, Friederici AD, Brauer J",Neuropsychologia,0.063,21958650,-1,-1
words_00701,https://pubmed.ncbi.nlm.nih.gov/24427267/,The route to an integrative associative memory is influenced by emotion.,"Murray BD, Kensinger EA",PloS one,0.063,24427267,-1,-1
words_00702,https://pubmed.ncbi.nlm.nih.gov/25598049/,Long-term experience with Chinese language shapes the fusiform asymmetry of English reading.,"Mei L, Xue G, Lu ZL, Chen C, Wei M, He Q, Dong Q",NeuroImage,0.063,25598049,-1,-1
words_00703,https://pubmed.ncbi.nlm.nih.gov/12599275/,Developmental aspects of language processing: fMRI of verbal fluency in children  and adults.,"Gaillard WD, Sachs BC, Whitnah JR, Ahmad Z, Balsamo LM, Petrella JR, Braniecki SH, McKinney CM, Hunter K, Xu B, Grandin CB",Human brain mapping,0.062,12599275,-1,-1
words_00704,https://pubmed.ncbi.nlm.nih.gov/17572110/,Negative words enhance recognition in nonclinical high dissociators: An fMRI study.,"de Ruiter MB, Veltman DJ, Phaf RH, van Dyck R",NeuroImage,0.062,17572110,-1,-1
words_00705,https://pubmed.ncbi.nlm.nih.gov/19660559/,Effects of implied physical effort in sensory-motor and pre-frontal cortex during language comprehension.,"Moody CL, Gennari SP",NeuroImage,0.062,19660559,-1,-1
words_00706,https://pubmed.ncbi.nlm.nih.gov/20089812/,The time course of ventrolateral prefrontal cortex involvement in memory formation.,"Machizawa MG, Kalla R, Walsh V, Otten LJ",Journal of neurophysiology,0.062,20089812,-1,-1
words_00707,https://pubmed.ncbi.nlm.nih.gov/21761506/,I know you can hear me: neural correlates of feigned hearing loss.,"McPherson B, McMahon K, Wilson W, Copland D",Human brain mapping,0.062,21761506,-1,-1
words_00708,https://pubmed.ncbi.nlm.nih.gov/21968566/,Dissociating frontotemporal contributions to semantic ambiguity resolution in spoken sentences.,"Rodd JM, Johnsrude IS, Davis MH","Cerebral cortex (New York, N.Y. : 1991)",0.062,21968566,-1,-1
words_00709,https://pubmed.ncbi.nlm.nih.gov/22066586/,Incongruent abstract stimulus-response bindings result in response interference:  FMRI and EEG evidence from visual object classification priming.,"Horner AJ, Henson RN",Journal of cognitive neuroscience,0.062,22066586,-1,-1
words_00710,https://pubmed.ncbi.nlm.nih.gov/22386970/,Autobiographical memory in depression: an fMRI study.,"Whalley MG, Rugg MD, Brewin CR",Psychiatry research,0.062,22386970,-1,-1
words_00711,https://pubmed.ncbi.nlm.nih.gov/22390465/,Age-related neural reorganization during spoken word recognition: the interaction of form and meaning.,"Shafto M, Randall B, Stamatakis EA, Wright P, Tyler LK",Journal of cognitive neuroscience,0.062,22390465,10.1162/jocn_a_00218,-1
words_00712,https://pubmed.ncbi.nlm.nih.gov/23734122/,"Recollection, familiarity, and content-sensitivity in lateral parietal cortex: a  high-resolution fMRI study.","Johnson JD, Suzuki M, Rugg MD",Frontiers in human neuroscience,0.062,23734122,-1,-1
words_00713,https://pubmed.ncbi.nlm.nih.gov/15993771/,Activity and functional connectivity of inferior frontal cortex associated with response conflict.,"Kemmotsu N, Villalobos ME, Gaffrey MS, Courchesne E, Muller RA",Brain research. Cognitive brain research,0.061,15993771,-1,-1
words_00714,https://pubmed.ncbi.nlm.nih.gov/17350289/,Cerebellar contributions to episodic memory encoding as revealed by fMRI.,"Fliessbach K, Trautner P, Quesada CM, Elger CE, Weber B",NeuroImage,0.061,17350289,-1,-1
words_00715,https://pubmed.ncbi.nlm.nih.gov/18514168/,Automatic processing of semantic relations in fMRI: neural activation during semantic priming of taxonomic and thematic categories.,"Sachs O, Weis S, Zellagui N, Huber W, Zvyagintsev M, Mathiak K, Kircher T",Brain research,0.061,18514168,-1,-1
words_00716,https://pubmed.ncbi.nlm.nih.gov/18725239/,Differential effects of orthographic and phonological consistency in cortex for children with and without reading impairment.,"Bolger DJ, Minas J, Burman DD, Booth JR",Neuropsychologia,0.061,18725239,-1,-1
words_00717,https://pubmed.ncbi.nlm.nih.gov/20226773/,Mental representations of action: the neural correlates of the verbal and motor components.,"Peran P, Demonet JF, Cherubini A, Carbebat D, Caltagirone C, Sabatini U",Brain research,0.061,20226773,-1,-1
words_00718,https://pubmed.ncbi.nlm.nih.gov/20395549/,Brain sensitivity to print emerges when children learn letter-speech sound correspondences.,"Brem S, Bach S, Kucian K, Guttorm TK, Martin E, Lyytinen H, Brandeis D, Richardson U",Proceedings of the National Academy of Sciences of the United States of America,0.061,20395549,-1,-1
words_00719,https://pubmed.ncbi.nlm.nih.gov/20702070/,The role of hippocampus dysfunction in deficient memory encoding and positive symptoms in schizophrenia.,"Zierhut K, Bogerts B, Schott B, Fenker D, Walter M, Albrecht D, Steiner J, Schutze H, Northoff G, Duzel E, Schiltz K",Psychiatry research,0.061,20702070,-1,-1
words_00720,https://pubmed.ncbi.nlm.nih.gov/22504766/,From a concept to a word in a syntactically complete sentence: an fMRI study on spontaneous language production in an overt picture description task.,"Grande M, Meffert E, Schoenberger E, Jung S, Frauenrath T, Huber W, Hussmann K, Moormann M, Heim S",NeuroImage,0.061,22504766,-1,-1
words_00721,https://pubmed.ncbi.nlm.nih.gov/26406969/,Aberrant brain responses to emotionally valent words is normalised after cognitive behavioural therapy in female depressed adolescents.,"Chuang JY, J Whitaker K, Murray GK, Elliott R, Hagan CC, Graham JM, Ooi C, Tait R, Holt RJ, van Nieuwenhuizen AO, Reynolds S, Wilkinson PO, Bullmore ET, Lennox BR, Sahakian BJ, Goodyer I, Suckling J",Journal of affective disorders,0.061,26406969,-1,-1
words_00722,https://pubmed.ncbi.nlm.nih.gov/26958463/,"Klinefelter syndrome has increased brain responses to auditory stimuli and motor  output, but not to visual stimuli or Stroop adaptation.","Wallentin M, Skakkebaek A, Bojesen A, Fedder J, Laurberg P, Ostergaard JR, Hertz JM, Pedersen AD, Gravholt CH",NeuroImage. Clinical,0.061,26958463,-1,-1
words_00723,https://pubmed.ncbi.nlm.nih.gov/27803656/,"Recruitment of Language-, Emotion- and Speech-Timing Associated Brain Regions for Expressing Emotional Prosody: Investigation of Functional Neuroanatomy with fMRI.","Mitchell RL, Jazdzyk A, Stets M, Kotz SA",Frontiers in human neuroscience,0.061,27803656,-1,-1
words_00724,https://pubmed.ncbi.nlm.nih.gov/29349038/,Abnormal neural hierarchy in processing of verbal information in patients with schizophrenia.,"Lerner Y, Bleich-Cohen M, Solnik-Knirsh S, Yogev-Seligmann G, Eisenstein T, Madah W, Shamir A, Hendler T, Kremer I",NeuroImage. Clinical,0.061,29349038,-1,-1
words_00725,https://pubmed.ncbi.nlm.nih.gov/29499492/,The impact of inverted text on visual word processing: An fMRI study.,"Sussman BL, Reddigari S, Newman SD",Brain and cognition,0.061,29499492,-1,-1
words_00726,https://pubmed.ncbi.nlm.nih.gov/15808982/,Neuroimaging-guided rTMS of the left inferior frontal gyrus interferes with repetition priming.,"Thiel A, Haupt WF, Habedank B, Winhuisen L, Herholz K, Kessler J, Markowitsch HJ, Heiss WD",NeuroImage,0.06,15808982,-1,-1
words_00727,https://pubmed.ncbi.nlm.nih.gov/16051283/,Dissociating prefrontal contributions during a recency memory task.,"Rajah MN, McIntosh AR",Neuropsychologia,0.06,16051283,-1,-1
words_00728,https://pubmed.ncbi.nlm.nih.gov/17010394/,Children with reading disorder show modality independent brain abnormalities during semantic tasks.,"Booth JR, Bebko G, Burman DD, Bitan T",Neuropsychologia,0.06,17010394,-1,-1
words_00729,https://pubmed.ncbi.nlm.nih.gov/17336346/,Atypical [corrected] participation of visual cortex during word processing in autism: an fMRI study of semantic decision.,"Gaffrey MS, Kleinhans NM, Haist F, Akshoomoff N, Campbell A, Courchesne E, Muller RA",Neuropsychologia,0.06,17336346,-1,-1
words_00730,https://pubmed.ncbi.nlm.nih.gov/17634931/,A repetition suppression effect lasting several days within the semantic network.,"Meister IG, Buelte D, Sparing R, Boroojerdi B",Experimental brain research,0.06,17634931,-1,-1
words_00731,https://pubmed.ncbi.nlm.nih.gov/18282770/,Phonological processing in deaf signers and the impact of age of first language acquisition.,"MacSweeney M, Waters D, Brammer MJ, Woll B, Goswami U",NeuroImage,0.06,18282770,10.1016/j.neuroimage.2007.12.047,-1
words_00732,https://pubmed.ncbi.nlm.nih.gov/18582580/,Modulation of brain activity by multiple lexical and word form variables in visual word recognition: A parametric fMRI study.,"Hauk O, Davis MH, Pulvermuller F",NeuroImage,0.06,18582580,-1,-1
words_00733,https://pubmed.ncbi.nlm.nih.gov/18752404/,"Differential influences of emotion, task, and novelty on brain regions underlying the processing of speech melody.","Ethofer T, Kreifelts B, Wiethoff S, Wolf J, Grodd W, Vuilleumier P, Wildgruber D",Journal of cognitive neuroscience,0.06,18752404,-1,-1
words_00734,https://pubmed.ncbi.nlm.nih.gov/21216293/,Left fusiform BOLD responses are inversely related to word-likeness in a one-back task.,"Wang X, Yang J, Shu H, Zevin JD",NeuroImage,0.06,21216293,-1,-1
words_00735,https://pubmed.ncbi.nlm.nih.gov/22196742/,Colateralization of Broca's area and the visual word form area in left-handers: fMRI evidence.,"Van der Haegen L, Cai Q, Brysbaert M",Brain and language,0.06,22196742,-1,-1
words_00736,https://pubmed.ncbi.nlm.nih.gov/22836179/,Neural correlates of combinatorial semantic processing of literal and figurative  noun noun compound words.,"Forgacs B, Bohrn I, Baudewig J, Hofmann MJ, Pleh C, Jacobs AM",NeuroImage,0.06,22836179,-1,-1
words_00737,https://pubmed.ncbi.nlm.nih.gov/23864694/,Vowel category boundaries enhance cortical and behavioral responses to speech feedback alterations.,"Niziolek CA, Guenther FH",The Journal of neuroscience : the official journal of the Society for Neuroscience,0.06,23864694,-1,-1
words_00738,https://pubmed.ncbi.nlm.nih.gov/24992291/,The processing of lexical ambiguity in healthy ageing and Parkinsons disease: role of cortico-subcortical networks.,"Ketteler S, Ketteler D, Vohn R, Kastrau F, Schulz JB, Reetz K, Huber W",Brain research,0.06,24992291,-1,-1
words_00739,https://pubmed.ncbi.nlm.nih.gov/26548403/,Cerebral asymmetry for language: Comparing production with comprehension.,"Haberling IS, Steinemann A, Corballis MC",Neuropsychologia,0.06,26548403,-1,-1
words_00740,https://pubmed.ncbi.nlm.nih.gov/10865105/,"Cerebral regions associated with verbal response initiation, suppression and strategy use.","de Zubicaray GI, Zelaya FO, Andrew C, Williams SC, Bullmore ET",Neuropsychologia,0.059,10865105,-1,-1
words_00741,https://pubmed.ncbi.nlm.nih.gov/18031826/,Toward a functional neuroanatomy of premenstrual dysphoric disorder.,"Protopopescu X, Tuescher O, Pan H, Epstein J, Root J, Chang L, Altemus M, Polanecsky M, McEwen B, Stern E, Silbersweig D",Journal of affective disorders,0.059,18031826,-1,-1
words_00742,https://pubmed.ncbi.nlm.nih.gov/19365800/,Neural correlates of word production stages delineated by parametric modulation of psycholinguistic variables.,"Wilson SM, Isenberg AL, Hickok G",Human brain mapping,0.059,19365800,-1,-1
words_00743,https://pubmed.ncbi.nlm.nih.gov/19830683/,Enhanced effectiveness in visuo-haptic object-selective brain regions with increasing stimulus salience.,"Kim S, James TW",Human brain mapping,0.059,19830683,-1,-1
words_00744,https://pubmed.ncbi.nlm.nih.gov/20004364/,Anhedonia and emotional experience in schizophrenia: neural and behavioral indicators.,"Dowd EC, Barch DM",Biological psychiatry,0.059,20004364,-1,-1
words_00745,https://pubmed.ncbi.nlm.nih.gov/20042233/,Superior temporal activation as a function of linguistic knowledge: insights from deaf native signers who speechread.,"Capek CM, Woll B, MacSweeney M, Waters D, McGuire PK, David AS, Brammer MJ, Campbell R",Brain and language,0.059,20042233,-1,-1
words_00746,https://pubmed.ncbi.nlm.nih.gov/20715084/,Emotion triggers executive attention: anterior cingulate cortex and amygdala responses to emotional words in a conflict task.,"Kanske P, Kotz SA",Human brain mapping,0.059,20715084,-1,-1
words_00747,https://pubmed.ncbi.nlm.nih.gov/20810879/,Bidirectional connectivity between hemispheres occurs at multiple levels in language processing but depends on sex.,"Bitan T, Lifshitz A, Breznitz Z, Booth JR",The Journal of neuroscience : the official journal of the Society for Neuroscience,0.059,20810879,-1,-1
words_00748,https://pubmed.ncbi.nlm.nih.gov/22248577/,Task by stimulus interactions in brain responses during Chinese character processing.,"Yang J, Wang X, Shu H, Zevin JD",NeuroImage,0.059,22248577,-1,-1
words_00749,https://pubmed.ncbi.nlm.nih.gov/24638878/,Heschl's gyrification pattern is related to speech-listening hemispheric lateralization: FMRI investigation in 281 healthy volunteers.,"Tzourio-Mazoyer N, Marie D, Zago L, Jobard G, Perchey G, Leroux G, Mellet E, Joliot M, Crivello F, Petit L, Mazoyer B",Brain structure & function,0.059,24638878,-1,-1
words_00750,https://pubmed.ncbi.nlm.nih.gov/24899709/,"Effects of resveratrol on memory performance, hippocampal functional connectivity, and glucose metabolism in healthy older adults.","Witte AV, Kerti L, Margulies DS, Floel A",The Journal of neuroscience : the official journal of the Society for Neuroscience,0.059,24899709,-1,-1
words_00751,https://pubmed.ncbi.nlm.nih.gov/25568119/,Spatial and temporal characteristics of error-related activity in the human brain.,"Neta M, Miezin FM, Nelson SM, Dubis JW, Dosenbach NU, Schlaggar BL, Petersen SE",The Journal of neuroscience : the official journal of the Society for Neuroscience,0.059,25568119,10.1523/JNEUROSCI.1313-14.2015,-1
words_00752,https://pubmed.ncbi.nlm.nih.gov/26918586/,Fusiform Gyrus Laterality in Writing Systems with Different Mapping Principles: An Artificial Orthography Training Study.,"Hirshorn EA, Wrencher A, Durisko C, Moore MW, Fiez JA",Journal of cognitive neuroscience,0.059,26918586,-1,-1
words_00753,https://pubmed.ncbi.nlm.nih.gov/27647282/,Domain-specific and Domain-general Processing in Left Perisylvian Cortex: Evidence from Russian.,"Klimovich-Gray A, Bozic M, Marslen-Wilson WD",Journal of cognitive neuroscience,0.059,27647282,-1,-1
words_00754,https://pubmed.ncbi.nlm.nih.gov/28803349/,Scary symptoms? Functional magnetic resonance imaging evidence for symptom interpretation bias in pathological health anxiety.,"Yan Z, Witthoft M, Bailer J, Diener C, Mier D",European archives of psychiatry and clinical neuroscience,0.059,28803349,-1,-1
words_00755,https://pubmed.ncbi.nlm.nih.gov/16035045/,Activation of the left planum temporale in pitch processing is shaped by language experience.,"Xu Y, Gandour J, Talavage T, Wong D, Dzemidzic M, Tong Y, Li X, Lowe M",Human brain mapping,0.058,16035045,-1,-1
words_00756,https://pubmed.ncbi.nlm.nih.gov/16199012/,Abnormal object recall and anterior cingulate overactivation correlate with formal thought disorder in schizophrenia.,"Assaf M, Rivkin PR, Kuzu CH, Calhoun VD, Kraut MA, Groth KM, Yassa MA, Hart J Jr, Pearlson GD",Biological psychiatry,0.058,16199012,-1,-1
words_00757,https://pubmed.ncbi.nlm.nih.gov/16337816/,The role of 'shared representations' in social perception and empathy: an fMRI study.,"Lawrence EJ, Shaw P, Giampietro VP, Surguladze S, Brammer MJ, David AS",NeuroImage,0.058,16337816,-1,-1
words_00758,https://pubmed.ncbi.nlm.nih.gov/16421329/,The role of semantics and grammatical class in the neural representation of words.,"Vigliocco G, Warren J, Siri S, Arciuli J, Scott S, Wise R","Cerebral cortex (New York, N.Y. : 1991)",0.058,16421329,-1,-1
words_00759,https://pubmed.ncbi.nlm.nih.gov/16989874/,Support for an auto-associative model of spoken cued recall: evidence from fMRI.,"de Zubicaray G, McMahon K, Eastburn M, Pringle AJ, Lorenz L, Humphreys MS",Neuropsychologia,0.058,16989874,-1,-1
words_00760,https://pubmed.ncbi.nlm.nih.gov/17403529/,Neural representation of binding lexical signs and words in the episodic buffer of working memory.,"Rudner M, Fransson P, Ingvar M, Nyberg L, Ronnberg J",Neuropsychologia,0.058,17403529,-1,-1
words_00761,https://pubmed.ncbi.nlm.nih.gov/18445531/,Feedback signals in the caudate reflect goal achievement on a declarative memory  task.,"Tricomi E, Fiez JA",NeuroImage,0.058,18445531,-1,-1
words_00762,https://pubmed.ncbi.nlm.nih.gov/19100847/,Domain-specific reorganization of semantic processing after extensive damage to the left temporal lobe.,"Leonard B, de Partz MP, Grandin C, Pillon A",NeuroImage,0.058,19100847,-1,-1
words_00763,https://pubmed.ncbi.nlm.nih.gov/19446799/,The inversion effect in visual word form processing.,"Kao CH, Chen DY, Chen CC",Cortex; a journal devoted to the study of the nervous system and behavior,0.058,19446799,-1,-1
words_00764,https://pubmed.ncbi.nlm.nih.gov/20965253/,Semantic memory involvement in the default mode network: a functional neuroimaging study using independent component analysis.,"Wirth M, Jann K, Dierks T, Federspiel A, Wiest R, Horn H",NeuroImage,0.058,20965253,-1,-1
words_00765,https://pubmed.ncbi.nlm.nih.gov/21215442/,Brain activations associated with sign production using word and picture inputs in deaf signers.,"Hu Z, Wang W, Liu H, Peng D, Yang Y, Li K, Zhang JX, Ding G",Brain and language,0.058,21215442,-1,-1
words_00766,https://pubmed.ncbi.nlm.nih.gov/21862447/,Word intelligibility and age predict visual cortex activity during word listening.,"Kuchinsky SE, Vaden KI Jr, Keren NI, Harris KC, Ahlstrom JB, Dubno JR, Eckert MA","Cerebral cortex (New York, N.Y. : 1991)",0.058,21862447,-1,-1
words_00767,https://pubmed.ncbi.nlm.nih.gov/21889520/,Sensory and semantic category subdivisions within the anterior temporal lobes.,"Skipper LM, Ross LA, Olson IR",Neuropsychologia,0.058,21889520,-1,-1
words_00768,https://pubmed.ncbi.nlm.nih.gov/21935483/,The effect of negative and positive emotionality on associative memory: an FMRI study.,"Okada G, Okamoto Y, Kunisato Y, Aoyama S, Nishiyama Y, Yoshimura S, Onoda K, Toki S, Yamashita H, Yamawaki S",PloS one,0.058,21935483,-1,-1
words_00769,https://pubmed.ncbi.nlm.nih.gov/22807028/,Functional neuroimaging of sex differences in autobiographical memory recall.,"Young KD, Bellgowan PS, Bodurka J, Drevets WC",Human brain mapping,0.058,22807028,-1,-1
words_00770,https://pubmed.ncbi.nlm.nih.gov/23888133/,Task modulation of brain responses in visual word recognition as studied using EEG/MEG and fMRI.,"Chen Y, Davis MH, Pulvermuller F, Hauk O",Frontiers in human neuroscience,0.058,23888133,-1,-1
words_00771,https://pubmed.ncbi.nlm.nih.gov/23906596/,Cerebral lateralization of face-sensitive areas in left-handers: only the FFA does not get it right.,"Bukowski H, Dricot L, Hanseeuw B, Rossion B",Cortex; a journal devoted to the study of the nervous system and behavior,0.058,23906596,-1,-1
words_00772,https://pubmed.ncbi.nlm.nih.gov/23908615/,Identifying brain systems for gaze orienting during reading: fMRI investigation of the Landolt paradigm.,"Hillen R, Gunther T, Kohlen C, Eckers C, van Ermingen-Marbach M, Sass K, Scharke W, Vollmar J, Radach R, Heim S",Frontiers in human neuroscience,0.058,23908615,-1,-1
words_00773,https://pubmed.ncbi.nlm.nih.gov/26004057/,Pattern reactivation co-varies with activity in the core recollection network during source memory.,"Leiker EK, Johnson JD",Neuropsychologia,0.058,26004057,10.1016/j.neuropsychologia.2015.05.021,-1
words_00774,https://pubmed.ncbi.nlm.nih.gov/10227106/,Attenuated frontal activation in schizophrenia may be task dependent.,"Curtis VA, Bullmore ET, Morris RG, Brammer MJ, Williams SC, Simmons A, Sharma T, Murray RM, McGuire PK",Schizophrenia research,0.057,10227106,-1,-1
words_00775,https://pubmed.ncbi.nlm.nih.gov/17964813/,Cerebral processing of emotional prosody--influence of acoustic parameters and arousal.,"Wiethoff S, Wildgruber D, Kreifelts B, Becker H, Herbert C, Grodd W, Ethofer T",NeuroImage,0.057,17964813,-1,-1
words_00776,https://pubmed.ncbi.nlm.nih.gov/18063349/,Evidence for deficient modulation of amygdala response by prefrontal cortex in bipolar mania.,"Foland LC, Altshuler LL, Bookheimer SY, Eisenberger N, Townsend J, Thompson PM",Psychiatry research,0.057,18063349,-1,-1
words_00777,https://pubmed.ncbi.nlm.nih.gov/18635241/,fMRI evidence for the effect of verbal complexity on lateralisation of the neural response associated with decoding prosodic emotion.,"Mitchell RL, Ross ED",Neuropsychologia,0.057,18635241,-1,-1
words_00778,https://pubmed.ncbi.nlm.nih.gov/19302160/,Spatial attention can modulate audiovisual integration at multiple cortical and subcortical sites.,"Fairhall SL, Macaluso E",The European journal of neuroscience,0.057,19302160,-1,-1
words_00779,https://pubmed.ncbi.nlm.nih.gov/19395526/,An fMRI study of functional abnormalities in the verbal working memory system and the relationship to clinical symptoms in chronic schizophrenia.,"Hashimoto R, Lee K, Preus A, McCarley RW, Wible CG","Cerebral cortex (New York, N.Y. : 1991)",0.057,19395526,-1,-1
words_00780,https://pubmed.ncbi.nlm.nih.gov/20034582/,fMRI-adaptation evidence of overlapping neural representations for objects related in function or manipulation.,"Yee E, Drucker DM, Thompson-Schill SL",NeuroImage,0.057,20034582,-1,-1
words_00781,https://pubmed.ncbi.nlm.nih.gov/20727411/,Neural correlates of S-ketamine induced psychosis during overt continuous verbal  fluency.,"Nagels A, Kirner-Veselinovic A, Krach S, Kircher T",NeuroImage,0.057,20727411,-1,-1
words_00782,https://pubmed.ncbi.nlm.nih.gov/21640191/,Activation of the dentate nucleus in a verb generation task: A 7T MRI study.,"Thurling M, Kuper M, Stefanescu R, Maderwald S, Gizewski ER, Ladd ME, Timmann D",NeuroImage,0.057,21640191,-1,-1
words_00783,https://pubmed.ncbi.nlm.nih.gov/22584235/,Single-trial EEG-fMRI coupling of the emotional auditory early posterior negativity.,"Jaspers-Fayer F, Ertl M, Leicht G, Leupelt A, Mulert C",NeuroImage,0.057,22584235,-1,-1
words_00784,https://pubmed.ncbi.nlm.nih.gov/26188260/,Reading visually embodied meaning from the brain: Visually grounded computational models decode visual-object mental imagery induced by written text.,"Anderson AJ, Bruni E, Lopopolo A, Poesio M, Baroni M",NeuroImage,0.057,26188260,-1,-1
words_00785,https://pubmed.ncbi.nlm.nih.gov/27845255/,Loss of lateral prefrontal cortex control in food-directed attention and goal-directed food choice in obesity.,"Janssen LK, Duif I, van Loon I, Wegman J, de Vries JHM, Cools R, Aarts E",NeuroImage,0.057,27845255,-1,-1
words_00786,https://pubmed.ncbi.nlm.nih.gov/28346539/,"Is there a relation between novelty seeking, striatal dopamine release and frontal cortical thickness?","Jaworska N, Cox SM, Casey KF, Boileau I, Cherkasova M, Larcher K, Dagher A, Benkelfat C, Leyton M",PloS one,0.057,28346539,-1,-1
words_00787,https://pubmed.ncbi.nlm.nih.gov/29305161/,Decoding intentions of self and others from fMRI activity patterns.,"Gilbert SJ, Fung H",NeuroImage,0.057,29305161,-1,-1
words_00788,https://pubmed.ncbi.nlm.nih.gov/15050577/,Neural representations of nouns and verbs in Chinese: an fMRI study.,"Li P, Jin Z, Tan LH",NeuroImage,0.056,15050577,-1,-1
