paper_name,paper_url,Title,Author,Journal,Loading,PMID,Doi,download_status
words_00397,https://pubmed.ncbi.nlm.nih.gov/15010232/,Neural correlates of lexical and sublexical processes in reading.,"Joubert S, Beauregard M, Walter N, Bourgouin P, Beaudoin G, Leroux JM, Karama S, Lecours AR",Brain and language,0.13,15010232,-1,-1
words_00398,https://pubmed.ncbi.nlm.nih.gov/26431906/,Testing the antidepressant properties of the peptide ARA290 in a human neuropsychological model of drug action.,"Cerit H, Veer IM, Dahan A, Niesters M, Harmer CJ, Miskowiak KW, Rombouts SA, Van der Does W",European neuropsychopharmacology : the journal of the European College of Neuropsychopharmacology,0.13,26431906,-1,-1
words_00399,https://pubmed.ncbi.nlm.nih.gov/28294712/,Frequency and Chunking in Derived Words: A Parametric fMRI Study.,"Blumenthal-Drame A, Glauche V, Bormann T, Weiller C, Musso M, Kortmann B",Journal of cognitive neuroscience,0.13,28294712,-1,-1
words_00400,https://pubmed.ncbi.nlm.nih.gov/27012502/,Chinese Character and English Word processing in children's ventral occipitotemporal cortex: fMRI evidence for script invariance.,"Krafnick AJ, Tan LH, Flowers DL, Luetje MM, Napoliello EM, Siok WT, Perfetti C, Eden GF",NeuroImage,0.129,27012502,-1,-1
words_00401,https://pubmed.ncbi.nlm.nih.gov/18840418/,Evidence for automatic sentence priming in the fusiform semantic area: convergent ERP and fMRI findings.,"Dien J, O'Hare AJ",Brain research,0.128,18840418,-1,-1
words_00402,https://pubmed.ncbi.nlm.nih.gov/19046993/,Walk-related mimic word activates the extrastriate visual cortex in the human brain: an fMRI study.,Osaka N,Behavioural brain research,0.128,19046993,-1,-1
words_00403,https://pubmed.ncbi.nlm.nih.gov/16575838/,Developmental and skill effects on the neural correlates of semantic processing to visually presented words.,"Chou TL, Booth JR, Bitan T, Burman DD, Bigio JD, Cone NE, Lu D, Cao F",Human brain mapping,0.127,16575838,-1,-1
words_00404,https://pubmed.ncbi.nlm.nih.gov/19015036/,The separation of processing stages in a lexical interference fMRI-paradigm.,"Abel S, Dressel K, Bitzer R, Kummerer D, Mader I, Weiller C, Huber W",NeuroImage,0.127,19015036,-1,-1
words_00405,https://pubmed.ncbi.nlm.nih.gov/20371815/,Top-down and bottom-up attention to memory are dissociated in posterior parietal  cortex: neuroimagingand and neuropsychological evidence.,"Ciaramelli E, Grady C, Levine B, Ween J, Moscovitch M",The Journal of neuroscience : the official journal of the Society for Neuroscience,0.127,20371815,-1,-1
words_00406,https://pubmed.ncbi.nlm.nih.gov/21156209/,"COMT Val158Met polymorphism, verbalizing of emotion and activation of affective brain systems.","Swart M, Bruggeman R, Laroi F, Alizadeh BZ, Kema I, Kortekaas R, Wiersma D, Aleman A",NeuroImage,0.127,21156209,-1,-1
words_00407,https://pubmed.ncbi.nlm.nih.gov/22936905/,Emotional and cognitive processing of narratives and individual appraisal styles: recruitment of cognitive control networks vs. modulation of deactivations.,"Benelli E, Mergenthaler E, Walter S, Messina I, Sambin M, Buchheim A, Sim EJ, Viviani R",Frontiers in human neuroscience,0.126,22936905,-1,-1
words_00408,https://pubmed.ncbi.nlm.nih.gov/10808134/,Recognition of emotional prosody and verbal components of spoken language: an fMRI study.,"Buchanan TW, Lutz K, Mirzazade S, Specht K, Shah NJ, Zilles K, Jancke L",Brain research. Cognitive brain research,0.125,10808134,-1,-1
words_00409,https://pubmed.ncbi.nlm.nih.gov/14683700/,Functional segregation of the temporal lobes into highly differentiated subsystems for auditory perception: an auditory rapid event-related fMRI-task.,"Specht K, Reul J",NeuroImage,0.125,14683700,-1,-1
words_00410,https://pubmed.ncbi.nlm.nih.gov/19837174/,Neural differences in the mapping of verb and noun concepts onto novel words.,"Mestres-Misse A, Rodriguez-Fornells A, Munte TF",NeuroImage,0.125,19837174,-1,-1
words_00411,https://pubmed.ncbi.nlm.nih.gov/25681681/,The emotion potential of words and passages in reading Harry Potter--an fMRI study.,"Hsu CT, Jacobs AM, Citron FM, Conrad M",Brain and language,0.125,25681681,10.1016/j.bandl.2015.01.011,-1
words_00412,https://pubmed.ncbi.nlm.nih.gov/26403581/,Brain activation to negative stimuli mediates a relationship between adolescent marijuana use and later emotional functioning.,"Heitzeg MM, Cope LM, Martz ME, Hardee JE, Zucker RA",Developmental cognitive neuroscience,0.125,26403581,10.1016/j.dcn.2015.09.003,-1
words_00413,https://pubmed.ncbi.nlm.nih.gov/11587890/,Encoding and retrieval related cerebral activation in continuous verbal recognition.,"Jessen F, Flacke S, Granath DO, Manka C, Scheef L, Papassotiropoulos A, Schild HH, Heun R",Brain research. Cognitive brain research,0.124,11587890,-1,-1
words_00414,https://pubmed.ncbi.nlm.nih.gov/19571269/,Auditory selective attention to speech modulates activity in the visual word form area.,"Yoncheva YN, Zevin JD, Maurer U, McCandliss BD","Cerebral cortex (New York, N.Y. : 1991)",0.124,19571269,-1,-1
words_00415,https://pubmed.ncbi.nlm.nih.gov/23149036/,Altered brain function underlying verbal memory encoding and retrieval in psychotic major depression.,"Kelley R, Garrett A, Cohen J, Gomez R, Lembke A, Keller J, Reiss AL, Schatzberg A",Psychiatry research,0.124,23149036,-1,-1
words_00416,https://pubmed.ncbi.nlm.nih.gov/28046076/,Visual Imagery and False Memory for Pictures: A Functional Magnetic Resonance Imaging Study in Healthy Participants.,"Stephan-Otto C, Siddi S, Senior C, Munoz-Samons D, Ochoa S, Sanchez-Laforga AM, Brebion G",PloS one,0.124,28046076,-1,-1
words_00417,https://pubmed.ncbi.nlm.nih.gov/28158779/,Maintaining the feelings of others in working memory is associated with activation of the left anterior insula and left frontal-parietal control network.,"Smith R, Lane RD, Alkozei A, Bao J, Smith C, Sanova A, Nettles M, Killgore WDS",Social cognitive and affective neuroscience,0.124,28158779,-1,-1
words_00418,https://pubmed.ncbi.nlm.nih.gov/15528092/,When less means more: deactivations during encoding that predict subsequent memory.,"Daselaar SM, Prince SE, Cabeza R",NeuroImage,0.123,15528092,-1,-1
words_00419,https://pubmed.ncbi.nlm.nih.gov/18245043/,A developmental fMRI study of reading and repetition reveals changes in phonological and visual mechanisms over age.,"Church JA, Coalson RS, Lugar HM, Petersen SE, Schlaggar BL","Cerebral cortex (New York, N.Y. : 1991)",0.123,18245043,-1,-1
words_00420,https://pubmed.ncbi.nlm.nih.gov/19001084/,Retrieval and unification of syntactic structure in sentence comprehension: an FMRI study using word-category ambiguity.,"Snijders TM, Vosse T, Kempen G, Van Berkum JJ, Petersson KM, Hagoort P","Cerebral cortex (New York, N.Y. : 1991)",0.123,19001084,-1,-1
words_00421,https://pubmed.ncbi.nlm.nih.gov/29535619/,The Effect of Speech Repetition Rate on Neural Activation in Healthy Adults: Implications for Treatment of Aphasia and Other Fluency Disorders.,"Marchina S, Norton A, Kumar S, Schlaug G",Frontiers in human neuroscience,0.123,29535619,-1,-1
words_00422,https://pubmed.ncbi.nlm.nih.gov/20084104/,A neurosemantic theory of concrete noun representation based on the underlying brain codes.,"Just MA, Cherkassky VL, Aryal S, Mitchell TM",PloS one,0.122,20084104,-1,-1
words_00423,https://pubmed.ncbi.nlm.nih.gov/16413049/,Connectivity among semantic associates: an fMRI study of semantic priming.,"Wible CG, Han SD, Spencer MH, Kubicki M, Niznikiewicz MH, Jolesz FA, McCarley RW, Nestor P",Brain and language,0.121,16413049,-1,-1
words_00424,https://pubmed.ncbi.nlm.nih.gov/17617657/,Forgetting as an active process: an FMRI investigation of item-method-directed forgetting.,"Wylie GR, Foxe JJ, Taylor TL","Cerebral cortex (New York, N.Y. : 1991)",0.121,17617657,-1,-1
words_00425,https://pubmed.ncbi.nlm.nih.gov/20826428/,"Early and late talkers: school-age language, literacy and neurolinguistic differences.","Preston JL, Frost SJ, Mencl WE, Fulbright RK, Landi N, Grigorenko E, Jacobsen L, Pugh KR",Brain : a journal of neurology,0.121,20826428,-1,-1
words_00426,https://pubmed.ncbi.nlm.nih.gov/27650816/,Charting the effects of TMS with fMRI: Modulation of cortical recruitment within  the distributed network supporting semantic control.,"Hallam GP, Whitney C, Hymers M, Gouws AD, Jefferies E",Neuropsychologia,0.121,27650816,-1,-1
words_00427,https://pubmed.ncbi.nlm.nih.gov/24385957/,Computational principles of syntax in the regions specialized for language: integrating theoretical linguistics and functional neuroimaging.,"Ohta S, Fukui N, Sakai KL",Frontiers in behavioral neuroscience,0.12,24385957,-1,-1
words_00428,https://pubmed.ncbi.nlm.nih.gov/25268230/,Inside the syntactic box: the neural correlates of the functional and positional  level in covert sentence production.,"Collina S, Seurinck R, Hartsuiker RJ",PloS one,0.12,25268230,-1,-1
words_00429,https://pubmed.ncbi.nlm.nih.gov/28129061/,Inferior Frontal Cortex Contributions to the Recognition of Spoken Words and Their Constituent Speech Sounds.,"Rogers JC, Davis MH",Journal of cognitive neuroscience,0.12,28129061,-1,-1
words_00430,https://pubmed.ncbi.nlm.nih.gov/24493840/,Hypoactive medial prefrontal cortex functioning in adults reporting childhood emotional maltreatment.,"van Harmelen AL, van Tol MJ, Dalgleish T, van der Wee NJ, Veltman DJ, Aleman A, Spinhoven P, Penninx BW, Elzinga BM",Social cognitive and affective neuroscience,0.119,24493840,-1,-1
words_00431,https://pubmed.ncbi.nlm.nih.gov/24038636/,Modeling activation and effective connectivity of VWFA in same script bilinguals.,"Boukrina O, Hanson SJ, Hanson C",Human brain mapping,0.118,24038636,10.1002/hbm.22348,-1
words_00432,https://pubmed.ncbi.nlm.nih.gov/24391871/,A large N400 but no BOLD effect--comparing source activations of semantic priming in simultaneous EEG-fMRI.,"Geukes S, Huster RJ, Wollbrink A, Junghofer M, Zwitserlood P, Dobel C",PloS one,0.118,24391871,10.1371/journal.pone.0084029,-1
words_00433,https://pubmed.ncbi.nlm.nih.gov/24815949/,The anatomical foundations of acquired reading disorders: a neuropsychological verification of the dual-route model of reading.,"Ripamonti E, Aggujaro S, Molteni F, Zonca G, Frustaci M, Luzzatti C",Brain and language,0.118,24815949,-1,-1
words_00434,https://pubmed.ncbi.nlm.nih.gov/26218431/,The Neural Basis of Typewriting: A Functional MRI Study.,"Higashiyama Y, Takeda K, Someya Y, Kuroiwa Y, Tanaka F",PloS one,0.117,26218431,-1,-1
words_00435,https://pubmed.ncbi.nlm.nih.gov/19818906/,Executive functions in the absence of behavior: functional imaging of the minimally conscious state.,"Monti MM, Coleman MR, Owen AM",Progress in brain research,0.116,19818906,-1,-1
words_00436,https://pubmed.ncbi.nlm.nih.gov/23019128/,"Dissociated neural correlates of quantity processing of quantifiers, numbers, and numerosities.","Wei W, Chen C, Yang T, Zhang H, Zhou X",Human brain mapping,0.116,23019128,-1,-1
words_00437,https://pubmed.ncbi.nlm.nih.gov/23588185/,Multimodal Lexical Processing in Auditory Cortex Is Literacy Skill Dependent.,"McNorgan C, Awati N, Desroches AS, Booth JR","Cerebral cortex (New York, N.Y. : 1991)",0.116,23588185,-1,-1
words_00438,https://pubmed.ncbi.nlm.nih.gov/19249748/,Neural mechanisms of grief regulation.,"Freed PJ, Yanagihara TK, Hirsch J, Mann JJ",Biological psychiatry,0.115,19249748,-1,-1
words_00439,https://pubmed.ncbi.nlm.nih.gov/20071145/,Increased amygdala and parahippocampal gyrus activation in schizophrenic patients with auditory hallucinations: an fMRI study using independent component analysis.,"Escarti MJ, de la Iglesia-Vaya M, Marti-Bonmati L, Robles M, Carbonell J, Lull JJ, Garcia-Marti G, Manjon JV, Aguilar EJ, Aleman A, Sanjuan J",Schizophrenia research,0.115,20071145,-1,-1
words_00440,https://pubmed.ncbi.nlm.nih.gov/23624171/,Semantic versus perceptual interactions in neural processing of speech-in-noise.,"Golestani N, Hervais-Adelman A, Obleser J, Scott SK",NeuroImage,0.115,23624171,-1,-1
words_00441,https://pubmed.ncbi.nlm.nih.gov/24124929/,"Disruption of Functional Networks in Dyslexia: A Whole-Brain, Data-Driven Analysis of Connectivity.","Finn ES, Shen X, Holahan JM, Scheinost D, Lacadie C, Papademetris X, Shaywitz SE, Shaywitz BA, Constable RT",Biological psychiatry,0.115,24124929,-1,-1
words_00442,https://pubmed.ncbi.nlm.nih.gov/15893574/,Neural mechanisms underlying the processing of Chinese words: an fMRI study.,"Dong Y, Nakamura K, Okada T, Hanakawa T, Fukuyama H, Mazziotta JC, Shibasaki H",Neuroscience research,0.114,15893574,-1,-1
words_00443,https://pubmed.ncbi.nlm.nih.gov/16513369/,Acute tryptophan depletion reduces activation in the right hippocampus during encoding in an episodic memory task.,"van der Veen FM, Evers EA, van Deursen JA, Deutz NE, Backes WH, Schmitt JA",NeuroImage,0.114,16513369,-1,-1
words_00444,https://pubmed.ncbi.nlm.nih.gov/17136453/,Brief report: brain activation to social words in a sedated child with autism.,"Carmody DP, Moreno R, Mars AE, Seshadri K, Lambert GH, Lewis M",Journal of autism and developmental disorders,0.114,17136453,-1,-1
words_00445,https://pubmed.ncbi.nlm.nih.gov/19167505/,Neural correlates of semantic ambiguity processing during context verification.,"Hoenig K, Scheef L",NeuroImage,0.114,19167505,-1,-1
words_00446,https://pubmed.ncbi.nlm.nih.gov/24564467/,Brain mechanisms of successful recognition through retrieval of semantic context.,"Flegal KE, Marin-Gutierrez A, Ragland JD, Ranganath C",Journal of cognitive neuroscience,0.114,24564467,-1,-1
words_00447,https://pubmed.ncbi.nlm.nih.gov/24666161/,Distinct neural specializations for learning to read words and name objects.,"Taylor JS, Rastle K, Davis MH",Journal of cognitive neuroscience,0.114,24666161,-1,-1
words_00448,https://pubmed.ncbi.nlm.nih.gov/20162599/,Differential effects of semantic processing on memory encoding.,"Fliessbach K, Buerger C, Trautner P, Elger CE, Weber B",Human brain mapping,0.113,20162599,-1,-1
words_00449,https://pubmed.ncbi.nlm.nih.gov/20711448/,A common left occipito-temporal dysfunction in developmental dyslexia and acquired letter-by-letter reading?,"Richlan F, Sturm D, Schurz M, Kronbichler M, Ladurner G, Wimmer H",PloS one,0.113,20711448,-1,-1
words_00450,https://pubmed.ncbi.nlm.nih.gov/22711620/,Matching is not naming: a direct comparison of lexical manipulations in explicit  and implicit reading tasks.,"Vogel AC, Petersen SE, Schlaggar BL",Human brain mapping,0.113,22711620,-1,-1
words_00451,https://pubmed.ncbi.nlm.nih.gov/29211656/,The Neural Basis of Successful Word Reading in Aphasia.,"Pillay SB, Gross WL, Graves WW, Humphries C, Book DS, Binder JR",Journal of cognitive neuroscience,0.113,29211656,10.1162/jocn_a_01214,-1
words_00452,https://pubmed.ncbi.nlm.nih.gov/17936858/,The anatomical bases of semantic retrieval deficits in early Alzheimer's disease.,"Venneri A, McGeown WJ, Hietanen HM, Guerrini C, Ellis AW, Shanks MF",Neuropsychologia,0.112,17936858,-1,-1
words_00453,https://pubmed.ncbi.nlm.nih.gov/15721179/,"Co-activation of the amygdala, hippocampus and inferior frontal gyrus during autobiographical memory retrieval.","Greenberg DL, Rice HJ, Cooper JJ, Cabeza R, Rubin DC, Labar KS",Neuropsychologia,0.111,15721179,-1,-1
words_00454,https://pubmed.ncbi.nlm.nih.gov/16938439/,Neural correlates of the object-recall process in semantic memory.,"Assaf M, Calhoun VD, Kuzu CH, Kraut MA, Rivkin PR, Hart J Jr, Pearlson GD",Psychiatry research,0.111,16938439,-1,-1
words_00455,https://pubmed.ncbi.nlm.nih.gov/19539268/,The effects of tryptophan depletion on neural responses to emotional words in remitted depression.,"Roiser JP, Levy J, Fromm SJ, Nugent AC, Talagala SL, Hasler G, Henn FA, Sahakian BJ, Drevets WC",Biological psychiatry,0.111,19539268,-1,-1
words_00456,https://pubmed.ncbi.nlm.nih.gov/28669904/,Functional brain outcomes of L2 speech learning emerge during sensorimotor transformation.,"Carey D, Miquel ME, Evans BG, Adank P, McGettigan C",NeuroImage,0.111,28669904,-1,-1
words_00457,https://pubmed.ncbi.nlm.nih.gov/15050572/,Item- and task-level processes in the left inferior prefrontal cortex: positive and negative correlates of encoding.,"Reynolds JR, Donaldson DI, Wagner AD, Braver TS",NeuroImage,0.11,15050572,-1,-1
words_00458,https://pubmed.ncbi.nlm.nih.gov/15689557/,Neural correlates of relational memory: successful encoding and retrieval of semantic and perceptual associations.,"Prince SE, Daselaar SM, Cabeza R",The Journal of neuroscience : the official journal of the Society for Neuroscience,0.11,15689557,-1,-1
words_00459,https://pubmed.ncbi.nlm.nih.gov/22156722/,Increased anterior cingulate cortex and hippocampus activation in Complex PTSD during encoding of negative words.,"Thomaes K, Dorrepaal E, Draijer N, de Ruiter MB, Elzinga BM, Sjoerds Z, van Balkom AJ, Smit JH, Veltman DJ",Social cognitive and affective neuroscience,0.11,22156722,-1,-1
words_00460,https://pubmed.ncbi.nlm.nih.gov/23010578/,The neural substrates of inferential and referential semantic processing.,"Marconi D, Manenti R, Catricala E, Della Rosa PA, Siri S, Cappa SF",Cortex; a journal devoted to the study of the nervous system and behavior,0.11,23010578,-1,-1
words_00461,https://pubmed.ncbi.nlm.nih.gov/24508158/,Dyslexia in a French-Spanish bilingual girl: behavioural and neural modulations following a visual attention span intervention.,"Valdois S, Peyrin C, Lassus-Sangosse D, Lallier M, Demonet JF, Kandel S",Cortex; a journal devoted to the study of the nervous system and behavior,0.11,24508158,-1,-1
words_00462,https://pubmed.ncbi.nlm.nih.gov/26709465/,A role for left inferior frontal and posterior superior temporal cortex in extracting a syntactic tree from a sentence.,"Pattamadilok C, Dehaene S, Pallier C",Cortex; a journal devoted to the study of the nervous system and behavior,0.11,26709465,-1,-1
words_00463,https://pubmed.ncbi.nlm.nih.gov/28746902/,Remembering verbally-presented items as pictures: Brain activity underlying visual mental images in schizophrenia patients with visual hallucinations.,"Stephan-Otto C, Siddi S, Senior C, Cuevas-Esteban J, Cambra-Marti MR, Ochoa S, Brebion G",Cortex; a journal devoted to the study of the nervous system and behavior,0.11,28746902,-1,-1
words_00464,https://pubmed.ncbi.nlm.nih.gov/29249945/,Perceived Conventionality in Co-speech Gestures Involves the Fronto-Temporal Language Network.,"Wolf D, Rekittke LM, Mittelberg I, Klasen M, Mathiak K",Frontiers in human neuroscience,0.11,29249945,-1,-1
words_00465,https://pubmed.ncbi.nlm.nih.gov/16767767/,Dissociating stimulus-driven semantic and phonological effect during reading and  naming.,"Mechelli A, Josephs O, Lambon Ralph MA, McClelland JL, Price CJ",Human brain mapping,0.109,16767767,-1,-1
words_00466,https://pubmed.ncbi.nlm.nih.gov/17490990/,Priming frequencies of transcranial magnetic stimulation over Wernicke's area modulate word detection.,"Andoh J, Artiges E, Pallier C, Riviere D, Mangin JF, Paillere-Martinot ML, Martinot JL","Cerebral cortex (New York, N.Y. : 1991)",0.109,17490990,-1,-1
words_00467,https://pubmed.ncbi.nlm.nih.gov/21812566/,Reduced specificity of hippocampal and posterior ventrolateral prefrontal activity during relational retrieval in normal aging.,"Giovanello KS, Schacter DL",Journal of cognitive neuroscience,0.109,21812566,-1,-1
words_00468,https://pubmed.ncbi.nlm.nih.gov/24425352/,Frontotemporal neural systems supporting semantic processing in Alzheimer's disease.,"Peelle JE, Powers J, Cook PA, Smith EE, Grossman M","Cognitive, affective & behavioral neuroscience",0.109,24425352,-1,-1
words_00469,https://pubmed.ncbi.nlm.nih.gov/21258644/,Word wins over face: emotional Stroop effect activates the frontal cortical network.,"Ovaysikia S, Tahir KA, Chan JL, DeSouza JF",Frontiers in human neuroscience,0.108,21258644,-1,-1
words_00470,https://pubmed.ncbi.nlm.nih.gov/21775616/,The right posterior paravermis and the control of language interference.,"Filippi R, Richardson FM, Dick F, Leech R, Green DW, Thomas MS, Price CJ",The Journal of neuroscience : the official journal of the Society for Neuroscience,0.108,21775616,-1,-1
words_00471,https://pubmed.ncbi.nlm.nih.gov/16855090/,Cracking the language code: neural mechanisms underlying speech parsing.,"McNealy K, Mazziotta JC, Dapretto M",The Journal of neuroscience : the official journal of the Society for Neuroscience,0.106,16855090,10.1523/JNEUROSCI.5501-05.2006,-1
words_00472,https://pubmed.ncbi.nlm.nih.gov/18476766/,Cortical activation patterns during long-term memory retrieval of visually or haptically encoded objects and locations.,"Stock O, Roder B, Burke M, Bien S, Rosler F",Journal of cognitive neuroscience,0.106,18476766,10.1162/jocn.2009.21006,-1
words_00473,https://pubmed.ncbi.nlm.nih.gov/21371485/,The role of rostral prefrontal cortex in prospective memory: a voxel-based lesion study.,"Volle E, Gonen-Yaacovi G, Costello Ade L, Gilbert SJ, Burgess PW",Neuropsychologia,0.106,21371485,10.1016/j.neuropsychologia.2011.02.045,-1
words_00474,https://pubmed.ncbi.nlm.nih.gov/25532132/,Investigating the Neural Correlates of Voice versus Speech-Sound Directed Information in Pre-School Children.,"Raschle NM, Smith SA, Zuk J, Dauvermann MR, Figuccio MJ, Gaab N",PloS one,0.106,25532132,-1,-1
words_00475,https://pubmed.ncbi.nlm.nih.gov/11983183/,Can't shake that feeling: event-related fMRI assessment of sustained amygdala activity in response to emotional information in depressed individuals.,"Siegle GJ, Steinhauer SR, Thase ME, Stenger VA, Carter CS",Biological psychiatry,0.105,11983183,-1,-1
words_00476,https://pubmed.ncbi.nlm.nih.gov/21683723/,Functional specialisation in the hippocampus and perirhinal cortex during the encoding of verbal associations.,"Greve A, Evans CJ, Graham KS, Wilding EL",Neuropsychologia,0.105,21683723,-1,-1
words_00477,https://pubmed.ncbi.nlm.nih.gov/22387166/,Cortical networks for vision and language in dyslexic and normal children of variable socio-economic status.,"Monzalvo K, Fluss J, Billard C, Dehaene S, Dehaene-Lambertz G",NeuroImage,0.105,22387166,-1,-1
words_00478,https://pubmed.ncbi.nlm.nih.gov/18308586/,Speaking of secrets and lies: the contribution of ventrolateral prefrontal cortex to vocal deception.,"Spence SA, Kaylor-Hughes C, Farrow TF, Wilkinson ID",NeuroImage,0.104,18308586,-1,-1
words_00479,https://pubmed.ncbi.nlm.nih.gov/22042493/,The relationship between level of processing and hippocampal-cortical functional  connectivity during episodic memory formation in humans.,"Schott BH, Wustenberg T, Wimber M, Fenker DB, Zierhut KC, Seidenbecher CI, Heinze HJ, Walter H, Duzel E, Richardson-Klavehn A",Human brain mapping,0.104,22042493,-1,-1
words_00480,https://pubmed.ncbi.nlm.nih.gov/29339313/,The human body odor compound androstadienone increases neural conflict coupled to higher behavioral costs during an emotional Stroop task.,"Hornung J, Kogler L, Erb M, Freiherr J, Derntl B",NeuroImage,0.104,29339313,-1,-1
words_00481,https://pubmed.ncbi.nlm.nih.gov/15869492/,"Recapitulating emotional context: activity of amygdala, hippocampus and fusiform  cortex during recollection and familiarity.","Fenker DB, Schott BH, Richardson-Klavehn A, Heinze HJ, Duzel E",The European journal of neuroscience,0.103,15869492,-1,-1
words_00482,https://pubmed.ncbi.nlm.nih.gov/18675362/,Neural correlates of successful encoding of semantically and phonologically mediated inter-item associations.,"Park H, Rugg MD",NeuroImage,0.103,18675362,-1,-1
words_00483,https://pubmed.ncbi.nlm.nih.gov/22378896/,Variation in the corticotropin-releasing hormone receptor 1 (CRHR1) gene influences fMRI signal responses during emotional stimulus processing.,"Hsu DT, Mickey BJ, Langenecker SA, Heitzeg MM, Love TM, Wang H, Kennedy SE, Pecina M, Shafir T, Hodgkinson CA, Enoch MA, Goldman D, Zubieta JK",The Journal of neuroscience : the official journal of the Society for Neuroscience,0.103,22378896,-1,-1
words_00484,https://pubmed.ncbi.nlm.nih.gov/24486613/,Source recognition by stimulus content in the MTL.,"Park H, Abellanoza C, Schaeffer J, Gandy K",Brain research,0.103,24486613,-1,-1
words_00485,https://pubmed.ncbi.nlm.nih.gov/19651222/,Phonological repetition-suppression in bilateral superior temporal sulci.,"Vaden KI Jr, Muftuler LT, Hickok G",NeuroImage,0.102,19651222,-1,-1
words_00486,https://pubmed.ncbi.nlm.nih.gov/23796527/,Longitudinal changes in brains of patients with fluent primary progressive aphasia.,"Heim S, Pieperhoff P, Grande M, Kuijsten W, Wellner B, Saez LE, Schulte S, Sudmeyer M, Caspers S, Minnerop M, Binkofski F, Huber W, Amunts K",Brain and language,0.102,23796527,-1,-1
words_00487,https://pubmed.ncbi.nlm.nih.gov/24834043/,Dissecting the functional anatomy of auditory word repetition.,"Hope TM, Prejawa S, Parker Jones ', Oberhuber M, Seghier ML, Green DW, Price CJ",Frontiers in human neuroscience,0.102,24834043,-1,-1
words_00488,https://pubmed.ncbi.nlm.nih.gov/12789013/,Dissociating cortical regions activated by semantic and phonological tasks: a FMRI study in blind and sighted people.,"Burton H, Diamond JB, McDermott KB",Journal of neurophysiology,0.101,12789013,-1,-1
words_00489,https://pubmed.ncbi.nlm.nih.gov/20946961/,Functional asymmetries in the representation of noise-vocoded speech.,"Millman RE, Woods WP, Quinlan PT",NeuroImage,0.101,20946961,-1,-1
words_00490,https://pubmed.ncbi.nlm.nih.gov/15358857/,Morphology and the internal structure of words.,"Devlin JT, Jamison HL, Matthews PM, Gonnerman LM",Proceedings of the National Academy of Sciences of the United States of America,0.1,15358857,-1,-1
words_00491,https://pubmed.ncbi.nlm.nih.gov/16730754/,Timing of covert articulation: an fMRI study.,"Shergill SS, Tracy DK, Seal M, Rubia K, McGuire P",Neuropsychologia,0.1,16730754,10.1016/j.neuropsychologia.2006.04.005,-1
